"status_id","created_at","user_id","screen_name","text","source","reply_to_status_id","reply_to_user_id","reply_to_screen_name","is_quote","is_retweet","favorite_count","retweet_count","hashtags","symbols","urls_url","urls_t.co","urls_expanded_url","media_url","media_t.co","media_expanded_url","media_type","ext_media_url","ext_media_t.co","ext_media_expanded_url","ext_media_type","mentions_user_id","mentions_screen_name","lang","quoted_status_id","quoted_text","retweet_status_id","retweet_text","place_url","place_name","place_full_name","place_type","country","country_code","geo_coords","coords_coords","bbox_coords"
"x438377861926240256",2014-02-25 18:20:01,"x249288197","SamsPressShop","ICYMI: U.S. 75 gets a new name through Collin County http://t.co/sNZuiTkPru via @starlocalmedia","Twitter for Websites",,,,FALSE,FALSE,1,1,,,"bit.ly/1ppuBDG","http://t.co/sNZuiTkPru","http://bit.ly/1ppuBDG",,,,,,,,,"x823993891","starlocalmedia","en",,,,,,,,,,,,,
"x433244930505326592",2014-02-11 14:23:35,"x249288197","SamsPressShop","TUNE IN at 10:15 AM for the Ways and Means markup of legislation to #STOPIRS from targeting conservative groups http://t.co/uRGqvR3MdQ","Twitter Web Client",,,,FALSE,FALSE,0,1,"STOPIRS",,"bit.ly/xd9YwE","http://t.co/uRGqvR3MdQ","http://bit.ly/xd9YwE",,,,,,,,,,,"en",,,,,,,,,,,,,
"x431808401933225986",2014-02-07 15:15:20,"x249288197","SamsPressShop","ICYMI: Johnson said, “not only has Obamacare canceled health plans.. but now it can take ppl to court... --&gt; http://t.co/pdwje0SGY1","Twitter Web Client",,,,FALSE,FALSE,3,3,,,"bit.ly/1l5QZ1R","http://t.co/pdwje0SGY1","http://bit.ly/1l5QZ1R",,,,,,,,,,,"en",,,,,,,,,,,,,
"x430763149847834624",2014-02-04 18:01:52,"x249288197","SamsPressShop","New book, Defiant, tells the plight of me and my fellow NAM-POWs in what we dubbed Alcatraz. Thank you @AlvinTownley. http://t.co/6wlkYjIRjl","Twitter Web Client",,,,FALSE,FALSE,4,10,,,"nyti.ms/1k8dV2y","http://t.co/6wlkYjIRjl","http://nyti.ms/1k8dV2y",,,,,,,,,"x23011749","AlvinTownley","en",,,,,,,,,,,,,
"x428629991610679296",2014-01-29 20:45:28,"x249288197","SamsPressShop","RT @JohnnyQuinnUSA: @SamsPressShop Thank you, Mr. Johnson! #GoUSA","Twitter Web Client",,,,FALSE,TRUE,0,1,"GoUSA",,,,,,,,,,,,,"x29088219 249288197","JohnnyQuinnUSA SamsPressShop","en",,,"x428628817960517632","@SamsPressShop Thank you, Mr. Johnson! #GoUSA",,,,,,,,,
"x428624697475878912",2014-01-29 20:24:26,"x249288197","SamsPressShop","Thrilled that @JohnnyQuinnUSA of McKinney will compete in the 2014 Olympic Winter Games. Your fellow Texans are cheering for you! #TeamUSA","Twitter Web Client",,,,FALSE,FALSE,2,2,"TeamUSA",,,,,,,,,,,,,"x29088219","JohnnyQuinnUSA","en",,,,,,,,,,,,,
"x428243083579244545",2014-01-28 19:08:02,"x249288197","SamsPressShop","Thank you @RepJeffDuncan for the shout out. Serving our great country is the worthiest calling of my life --&gt; http://t.co/gaKpl86yZg","Twitter Web Client",,,,FALSE,FALSE,0,1,,,"bit.ly/1k2jEEs","http://t.co/gaKpl86yZg","http://bit.ly/1k2jEEs",,,,,,,,,"x240393970","RepJeffDuncan","en",,,,,,,,,,,,,
"x428193791380426752",2014-01-28 15:52:09,"x249288197","SamsPressShop","Telling Jillian's story now, tune in: http://t.co/cLosWcL9gz","Twitter Web Client",,,,FALSE,FALSE,0,0,,,"waysandmeans.granicus.com/MediaPlayer.ph…","http://t.co/cLosWcL9gz","http://waysandmeans.granicus.com/MediaPlayer.php?view_id=2&event_id=36",,,,,,,,,,,"en",,,,,,,,,,,,,
"x428192240482017280",2014-01-28 15:46:00,"x249288197","SamsPressShop","FACT: Over 60% of those at risk of losing hours as a result of #ObamaCare are female - like Jillian from McKinney, Texas.","Twitter Web Client",,,,FALSE,FALSE,0,0,"ObamaCare",,,,,,,,,,,,,,,"en",,,,,,,,,,,,,
"x428189713040543744",2014-01-28 15:35:57,"x249288197","SamsPressShop","Start #SOTU day by watching the W&amp;M hearing at 10 on how the #ObamaCare29ers rule is hurting hardworking Americans http://t.co/uRGqvR3MdQ","Twitter Web Client",,,,FALSE,FALSE,0,0,"SOTU ObamaCare29ers",,"bit.ly/xd9YwE","http://t.co/uRGqvR3MdQ","http://bit.ly/xd9YwE",,,,,,,,,,,"en",,,,,,,,,,,,,
"x424225314244284416",2014-01-17 17:02:51,"x249288197","SamsPressShop","ICYMI via @TheFiscalTimes: Social Security Cheats Bilk Taxpayers in the Billions http://t.co/uNBpfkZ9Jv #SSDI #NYdisabilityfraud","Twitter Web Client",,,,FALSE,FALSE,0,0,"SSDI NYdisabilityfraud",,"bit.ly/1eQQlDK","http://t.co/uNBpfkZ9Jv","http://bit.ly/1eQQlDK",,,,,,,,,"x95687597","TheFiscalTimes","en",,,,,,,,,,,,,
"x424224215466668032",2014-01-17 16:58:29,"x249288197","SamsPressShop","ICYMI VIDEO: Hearing Held in House in Wake of Alleged Sept. 11 First Responders Social Security Scam http://t.co/XUVAtd7sI1 #SSDI","Twitter Web Client",,,,FALSE,FALSE,1,0,"SSDI",,"bit.ly/19zJmPy","http://t.co/XUVAtd7sI1","http://bit.ly/19zJmPy",,,,,,,,,,,"en",,,,,,,,,,,,,
"x424204789312794625",2014-01-17 15:41:17,"x249288197","SamsPressShop","ICYMI via @ABC: 9/11 Fraud Scandal 'Probably' More Widespread, Top Official Says by @meekwire http://t.co/aKLKdrodUK #SSDI @WaysandMeansGOP","Twitter Web Client",,,,FALSE,FALSE,1,1,"SSDI",,"abcn.ws/Lbbayu","http://t.co/aKLKdrodUK","http://abcn.ws/Lbbayu",,,,,,,,,"x28785486 44478236 12788332","ABC meekwire WaysandMeansGOP","en",,,,,,,,,,,,,
"x424203578241064960",2014-01-17 15:36:29,"x249288197","SamsPressShop","ICYMI via USA Today: Official: Disability scam makes mockery of 9/11 deaths http://t.co/gXCBSSfBn0 #SSDI","Twitter Web Client",,,,FALSE,FALSE,0,1,"SSDI",,"usat.ly/1dsn80u","http://t.co/gXCBSSfBn0","http://usat.ly/1dsn80u",,,,,,,,,,,"en",,,,,,,,,,,,,
"x423847279209230336",2014-01-16 16:00:40,"x249288197","SamsPressShop","RT @damianpaletta: Rep. Johnson predicts Congress will be asked to ""bail out"" the disability trust fund by diverting money from retirement …","Twitter Web Client",,,,FALSE,TRUE,0,1,,,,,,,,,,,,,,"x115718513","damianpaletta","en",,,"x423818461672775680","Rep. Johnson predicts Congress will be asked to ""bail out"" the disability trust fund by diverting money from retirement trust fund.",,,,,,,,,
"x423825534238588928",2014-01-16 14:34:16,"x249288197","SamsPressShop","RT @damianpaletta: Rep. Johnson (R., Texas): ""The public is fast losing faith in Social Security, and I don’t blame them, because we all ar…","Twitter Web Client",,,,FALSE,TRUE,0,1,,,,,,,,,,,,,,"x115718513","damianpaletta","en",,,"x423818331770982400","Rep. Johnson (R., Texas): ""The public is fast losing faith in Social Security, and I don’t blame them, because we all are."" @SamsPressShop",,,,,,,,,
"x423825130133803008",2014-01-16 14:32:39,"x249288197","SamsPressShop","SS Subcommittee Chairman Johnson demands a full investigation of SS, &amp; make fighting fraud and protecting taxpayer dollars #1 priority.","Twitter Web Client",,,,FALSE,FALSE,1,2,,,,,,,,,,,,,,,,"en",,,,,,,,,,,,,
"x423823411354148864",2014-01-16 14:25:50,"x249288197","SamsPressShop","Disability scandals send a clear warning to POTUS that we need a SS Commissioner who will make it his/her 6-year mission to fight fraud.","Twitter Web Client",,,,FALSE,FALSE,1,1,,,,,,,,,,,,,,,,"en",,,,,,,,,,,,,
"x423822026734698496",2014-01-16 14:20:20,"x249288197","SamsPressShop","ICYMI via WSJ: Key Lawmaker Seeks Disability Fraud Review @damianpaletta http://t.co/SIZNAAEZh9","Twitter Web Client",,,,FALSE,FALSE,0,1,,,"on.wsj.com/19wJeAn","http://t.co/SIZNAAEZh9","http://on.wsj.com/19wJeAn",,,,,,,,,"x115718513","damianpaletta","en",,,,,,,,,,,,,
"x423820118150234112",2014-01-16 14:12:45,"x249288197","SamsPressShop","It’s not only the size of the fraud in NY that is shocking but those who committed it:  former policemen, firemen, &amp; a former FBI employee.","Twitter Web Client",,,,FALSE,FALSE,1,1,,,,,,,,,,,,,,,,"en",,,,,,,,,,,,,
"x423819108686106625",2014-01-16 14:08:44,"x249288197","SamsPressShop","Currently in progress is a SS Subcommittee hearing on the recent NY disability scandal, tune in now: http://t.co/NvCkiJDtKF","Twitter Web Client",,,,FALSE,FALSE,0,1,,,"waysandmeans.granicus.com/ViewPublisher.…","http://t.co/NvCkiJDtKF","http://waysandmeans.granicus.com/ViewPublisher.php?view_id=2",,,,,,,,,,,"en",,,,,,,,,,,,,
"x423472016810057728",2014-01-15 15:09:31,"x249288197","SamsPressShop","RT @FixOurTaxCode: VIDEO: Americans deserve a tax code that works for them. #Taxreform will create jobs &amp; increase wages RT If you agree ht…","Twitter Web Client",,,,FALSE,TRUE,0,24,"Taxreform",,,,,,,,,,,,,"x2194467816","FixOurTaxCode","en",,,"x423461737040318464","VIDEO: Americans deserve a tax code that works for them. #Taxreform will create jobs &amp; increase wages RT If you agree http://t.co/Rt9g9cDdmP",,,,,,,,,
"x423459733828161537",2014-01-15 14:20:42,"x249288197","SamsPressShop","#ICYMI responded to @WSJ recent editorial, Grand Theft Disability, highlighting SS management of SSDI program. http://t.co/pPk8OMo3xD","Twitter Web Client",,,,FALSE,FALSE,0,3,"ICYMI",,"on.wsj.com/1dQhOkT","http://t.co/pPk8OMo3xD","http://on.wsj.com/1dQhOkT",,,,,,,,,"x3108351","WSJ","en",,,,,,,,,,,,,
"x423219994944471040",2014-01-14 22:28:04,"x249288197","SamsPressShop","#SS has failed to prevent widespread fraud. On Thurs I'll demand SS to make fighting fraud it's #1 priority in 2014.  http://t.co/2bTeQzwAMT","Twitter Web Client",,,,FALSE,FALSE,1,0,"SS",,"bit.ly/JQWST7","http://t.co/2bTeQzwAMT","http://bit.ly/JQWST7",,,,,,,,,,,"en",,,,,,,,,,,,,
"x422756584112939009",2014-01-13 15:46:38,"x249288197","SamsPressShop","ICYMI: U.S. Rep. Sam Johnson, assailed Reid for flip-flopping on the IRS’ handling of the child tax-credit program. http://t.co/D2xYItMu9c","Twitter Web Client",,,,FALSE,FALSE,0,2,,,"bit.ly/L2cLY2","http://t.co/D2xYItMu9c","http://bit.ly/L2cLY2",,,,,,,,,,,"en",,,,,,,,,,,,,
"x421760784608161793",2014-01-10 21:49:41,"x249288197","SamsPressShop",".@SenatorReid can try to play politics with taxpayer dollars, but he can't hide from his  record http://t.co/39x5Ltmi0b #refchildtaxcredit","Twitter Web Client",,,,FALSE,FALSE,2,1,"refchildtaxcredit",,"1.usa.gov/1eKZmfs","http://t.co/39x5Ltmi0b","http://1.usa.gov/1eKZmfs",,,,,,,,,"x16789970","SenatorReid","en",,,,,,,,,,,,,
"x407586485919952896",2013-12-02 19:06:05,"x249288197","SamsPressShop","A dear friend, fellow POW, and American legend - Air Force Pilot - Robbie Risner --&gt; http://t.co/j6fAKzx9L5 http://t.co/NAvUIay2LF","Twitter Web Client",,,,FALSE,FALSE,0,3,,,"bit.ly/1dLJOvU","http://t.co/j6fAKzx9L5","http://bit.ly/1dLJOvU","http://pbs.twimg.com/media/BagJv9zCMAAK_U9.jpg","http://t.co/NAvUIay2LF","https://twitter.com/SamsPressShop/status/407586485919952896/photo/1","photo","http://pbs.twimg.com/media/BagJv9zCMAAK_U9.jpg","http://t.co/NAvUIay2LF","https://twitter.com/SamsPressShop/status/407586485919952896/photo/1",,,,"en",,,,,,,,,,,,,
"x403207780137332736",2013-11-20 17:06:40,"x249288197","SamsPressShop","Great news for Texas women and the unborn.  Every life is precious and must be protected.  http://t.co/yeP73cNls9","Twitter Web Client",,,,FALSE,FALSE,3,3,,,"wapo.st/1atMryE","http://t.co/yeP73cNls9","http://wapo.st/1atMryE",,,,,,,,,,,"en",,,,,,,,,,,,,
"x400682446863085568",2013-11-13 17:51:54,"x249288197","SamsPressShop","Tom from Allen, TX likes his current health plan and wants to keep it. PERIOD.  #KeepThePromise #KeepYourHealthPlan http://t.co/iPkxkJibML","Twitter Web Client",,,,FALSE,FALSE,0,1,"KeepThePromise KeepYourHealthPlan",,"bit.ly/1aTDn7X","http://t.co/iPkxkJibML","http://bit.ly/1aTDn7X",,,,,,,,,,,"en",,,,,,,,,,,,,
"x398180341925433344",2013-11-06 20:09:26,"x249288197","SamsPressShop","Are your premiums doubling or worse, tripling? Share your #ObamaCare story, I look forward to hearing from you! http://t.co/FplCsHE6UI","Twitter Web Client",,,,FALSE,FALSE,0,2,"ObamaCare",,"1.usa.gov/1cSFbvv","http://t.co/FplCsHE6UI","http://1.usa.gov/1cSFbvv",,,,,,,,,,,"en",,,,,,,,,,,,,
"x398175320752156672",2013-11-06 19:49:28,"x249288197","SamsPressShop","Let your voice be heard, share your #ObamaCare story and expose the truth about how this law effects you! http://t.co/FplCsHE6UI","Twitter Web Client",,,,FALSE,FALSE,0,2,"ObamaCare",,"1.usa.gov/1cSFbvv","http://t.co/FplCsHE6UI","http://1.usa.gov/1cSFbvv",,,,,,,,,,,"en",,,,,,,,,,,,,
"x397487871189192704",2013-11-04 22:17:48,"x249288197","SamsPressShop","ICYMI via @HoustonChron: John Cornyn, Sam Johnson call for federal tax transparency laws http://t.co/cPamkBZ3jW","Twitter Web Client",,,,FALSE,FALSE,0,2,,,"bit.ly/1dINaMQ","http://t.co/cPamkBZ3jW","http://bit.ly/1dINaMQ",,,,,,,,,"x8940342","HoustonChron","en",,,,,,,,,,,,,
"x397484045463855106",2013-11-04 22:02:35,"x249288197","SamsPressShop","Our Founding Fathers declared we are, ‘One nation under God,’ and you better believe I’ll fight to keep it that way. http://t.co/wKJGLuaxct","Twitter Web Client",,,,FALSE,FALSE,2,3,,,"1.usa.gov/HFRhNS","http://t.co/wKJGLuaxct","http://1.usa.gov/HFRhNS",,,,,,,,,,,"en",,,,,,,,,,,,,
"x395255500138229760",2013-10-29 18:27:09,"x249288197","SamsPressShop","Obama admin knew millions wouldn't be able to keep their insurance under #Obamacare, yet told Americans they would. http://t.co/yOdAZNWBJ4","Twitter Web Client",,,,FALSE,FALSE,0,2,"Obamacare",,"nbcnews.to/1dFbgut","http://t.co/yOdAZNWBJ4","http://nbcnews.to/1dFbgut",,,,,,,,,,,"en",,,,,,,,,,,,,
"x394932953362345984",2013-10-28 21:05:28,"x249288197","SamsPressShop","TX Fed. judge's ruling today is very sad news for our country and for folks who are dedicated to the protection of the unborn and value life","Twitter Web Client",,,,FALSE,FALSE,1,2,,,,,,,,,,,,,,,,"en",,,,,,,,,,,,,
"x393459406832009216",2013-10-24 19:30:07,"x249288197","SamsPressShop","Great read, @NRO - Obama still does not appear to have noticed that he’s the executive &amp; accountable. @charlescwcooke http://t.co/5fQduEZ73g","Twitter Web Client",,,,FALSE,FALSE,0,2,,,"nationalreview.com/article/362083…","http://t.co/5fQduEZ73g","http://www.nationalreview.com/article/362083/no-one-sabotaged-obamacare-charles-c-w-cooke/page/0/1",,,,,,,,,"x19417492 233484761","NRO charlescwcooke","en",,,,,,,,,,,,,
"x393429630041853952",2013-10-24 17:31:48,"x249288197","SamsPressShop","Not a smart and sensible use of taxpayer dollars. Give me a break! http://t.co/lxev4w0y9u","Twitter Web Client",,,,FALSE,FALSE,0,0,,,"nypost.com/2013/10/23/oba…","http://t.co/lxev4w0y9u","http://nypost.com/2013/10/23/obama-wants-marines-to-wear-girly-hats/",,,,,,,,,,,"en",,,,,,,,,,,,,
"x393402177839849472",2013-10-24 15:42:42,"x249288197","SamsPressShop","Clearly, President Obama's if-you-like-your-coverage-you-can-keep-it pledge is false --&gt; http://t.co/MqalFpl4Vd","Twitter Web Client",,,,FALSE,FALSE,1,2,,,"forbes.com/sites/theapoth…","http://t.co/MqalFpl4Vd","http://www.forbes.com/sites/theapothecary/2013/10/24/more-americans-have-had-their-insurance-canceled-under-obamacare-than-have-filed-an-exchange-account/",,,,,,,,,,,"en",,,,,,,,,,,,,
"x393136054796300288",2013-10-23 22:05:14,"x249288197","SamsPressShop","RT @gopconference: VIDEO: Check out this live chat on http://t.co/D9jBhfwnjm regarding #Obamacare http://t.co/A3OPJLF842","Twitter Web Client",,,,FALSE,TRUE,0,7,"Obamacare",,"healthcare.gov j.mp/19ZnVAK","http://t.co/D9jBhfwnjm http://t.co/A3OPJLF842","http://healthcare.gov http://j.mp/19ZnVAK",,,,,,,,,"x2285522652","GOPConference","en",,,"x393001716750114816","VIDEO: Check out this live chat on http://t.co/D9jBhfwnjm regarding #Obamacare http://t.co/A3OPJLF842",,,,,,,,,
"x393135987863588864",2013-10-23 22:04:58,"x249288197","SamsPressShop","RT @WaysandMeansGOP: Ways &amp; Means will have a hearing on the #ObamaCare exchanges Tuesday, October 29 @ 10 AM with CMS","Twitter Web Client",,,,FALSE,TRUE,0,13,"ObamaCare",,,,,,,,,,,,,"x12788332","WaysandMeansGOP","en",,,"x392761148040151040","Ways &amp; Means will have a hearing on the #ObamaCare exchanges Tuesday, October 29 @ 10 AM with CMS",,,,,,,,,
"x392729593188077568",2013-10-22 19:10:06,"x249288197","SamsPressShop","@Watchdogorg a commonsense bill, H.R. 556 would prevent this abuse, and save hardworking taxpayers an ~ $24.4 billion over the next 10 years","Twitter Web Client","x392682713964367872","x64723403","Watchdogorg",FALSE,FALSE,0,0,,,,,,,,,,,,,,"x64723403","Watchdogorg","en",,,,,,,,,,,,,
"x392729084418981888",2013-10-22 19:08:04,"x249288197","SamsPressShop","My bill H.R. 556, the Refundable Child Tax Credit Eligibility Verification Reform Act seeks to prevent this #abuse. http://t.co/PrSMLfoder","Twitter Web Client",,,,FALSE,FALSE,0,0,"abuse",,"bit.ly/1gB0KXe","http://t.co/PrSMLfoder","http://bit.ly/1gB0KXe",,,,,,,,,,,"en",,,,,,,,,,,,,
"x391262954890334208",2013-10-18 18:02:12,"x249288197","SamsPressShop","It out! Let me know what you think about this week's e-newsletter --&gt; http://t.co/YGdO8ci0Vl","Twitter Web Client",,,,FALSE,FALSE,0,2,,,"samjohnson.house.gov/news/email/sho…","http://t.co/YGdO8ci0Vl","http://samjohnson.house.gov/news/email/show.aspx?ID=HGFSZ3F3BG7PRJYHJ23IMMR7SI",,,,,,,,,,,"en",,,,,,,,,,,,,
"x388689079975428096",2013-10-11 15:34:32,"x249288197","SamsPressShop","@cqprofiles @PattyMurray @RepChuck Thank you!","Twitter Web Client","x388665382552481792","x85634177","cqprofiles",FALSE,FALSE,0,0,,,,,,,,,,,,,,"x85634177 293131808 235190657","cqprofiles PattyMurray RepChuck","en",,,,,,,,,,,,,
"x388689052041351168",2013-10-11 15:34:26,"x249288197","SamsPressShop","@AAUWPolicy @AAUW Thank you!","Twitter Web Client","x388668071998935040","x20015188","AAUWPolicy",FALSE,FALSE,1,0,,,,,,,,,,,,,,"x20015188 19719380","AAUWPolicy AAUW","en",,,,,,,,,,,,,
"x388046605191880704",2013-10-09 21:01:34,"x249288197","SamsPressShop","We must demonstrate support for our troops, not just in words, but in actions. I urge @SenatorReid to honor our fallen heroes &amp; their family","Twitter Web Client",,,,FALSE,FALSE,2,5,,,,,,,,,,,,,,"x16789970","SenatorReid","en",,,,,,,,,,,,,
"x388045648055894016",2013-10-09 20:57:46,"x249288197","SamsPressShop","I urge the Senate 2 fulfill the pledge of Abraham Lincoln, ""to care for him who shall have borne the battle, &amp; for his widow &amp; his orphans.""","Twitter Web Client",,,,FALSE,FALSE,2,4,,,,,,,,,,,,,,,,"en",,,,,,,,,,,,,
"x388018223230111744",2013-10-09 19:08:48,"x249288197","SamsPressShop","The expenses of a burial service is the last thing a grieving military family should worry about. #HonorOurVets #HJRes91","Twitter Web Client",,,,FALSE,FALSE,1,5,"HonorOurVets HJRes91",,,,,,,,,,,,,,,"en",,,,,,,,,,,,,
"x387586235859869696",2013-10-08 14:32:14,"x249288197","SamsPressShop","RT @gopconference: RT @GOPLeader: If you are having a hard time using Obamacare's broken website, you should not be penalized.","Twitter Web Client",,,,FALSE,TRUE,0,8,,,,,,,,,,,,,,"x2285522652 19739126","GOPConference GOPLeader","en",,,"x387585763170193409","RT @GOPLeader: If you are having a hard time using Obamacare's broken website, you should not be penalized.",,,,,,,,,
"x387298448602435584",2013-10-07 19:28:40,"x249288197","SamsPressShop","We must work to protect the program for those who truly need it. Waste, fraud, and abuse is real &amp; cheats honest, American taxpayers. (2/2)","Twitter Web Client",,,,FALSE,FALSE,0,1,,,,,,,,,,,,,,,,"en",,,,,,,,,,,,,
"x387298015762841600",2013-10-07 19:26:57,"x249288197","SamsPressShop","ICYMI: @60Minutes reports on the deeply troubling state of the SS disability insurance program. (1/2) http://t.co/cdTES2X7k8","Twitter Web Client",,,,FALSE,FALSE,0,2,,,"cbsnews.com/video/watch/?i…","http://t.co/cdTES2X7k8","http://www.cbsnews.com/video/watch/?id=50156574n",,,,,,,,,"x18812572","60Minutes","en",,,,,,,,,,,,,
"x386185021637152768",2013-10-04 17:44:18,"x249288197","SamsPressShop","Looking forward to joining @HonorFlightDCA Vets from North Texas at the WWII Memorial around 3:15 pm alongside most of the #TX delegation.","Twitter Web Client",,,,FALSE,FALSE,2,9,"TX",,,,,,,,,,,,,"x284154572","HonorFlightDCA","en",,,,,,,,,,,,,
"x385851935246397440",2013-10-03 19:40:44,"x249288197","SamsPressShop","RT @usairforce: See what assistance is available to #Airmen &amp; their families during the #governmentshutdown here: http://t.co/BKn7SXwHA5 #A…","Twitter Web Client",,,,FALSE,TRUE,0,32,"Airmen governmentshutdown",,"1.usa.gov/173ywJP","http://t.co/BKn7SXwHA5","http://1.usa.gov/173ywJP",,,,,,,,,"x19611483","usairforce","en",,,"x385851703742173184","See what assistance is available to #Airmen &amp; their families during the #governmentshutdown here: http://t.co/BKn7SXwHA5 #AirForce",,,,,,,,,
"x385848681435385856",2013-10-03 19:27:49,"x249288197","SamsPressShop","My thoughts &amp; prayers are with the injured officer from today's tragedy. Grateful for Capitol Police officers who work hard to keep us safe.","Twitter Web Client",,,,FALSE,FALSE,1,1,,,,,,,,,,,,,,,,"en",,,,,,,,,,,,,
"x385847624122634240",2013-10-03 19:23:36,"x249288197","SamsPressShop","RT @Chris_Moody: While everyone else ran away from the gunshots, police ran toward it. Next time you see an officer, say thanks.","Twitter Web Client",,,,FALSE,TRUE,0,172,,,,,,,,,,,,,,"x2460324608","chris_moody","en",,,"x385846090697687040","While everyone else ran away from the gunshots, police ran toward it. Next time you see an officer, say thanks.",,,,,,,,,
"x385529477855342593",2013-10-02 22:19:24,"x249288197","SamsPressShop","On my way to vote to re-open our national parks and monuments as well as fund the NIH so important research and treatment continues.","Twitter Web Client",,,,FALSE,FALSE,1,1,,,,,,,,,,,,,,,,"en",,,,,,,,,,,,,
"x385492752906993664",2013-10-02 19:53:29,"x249288197","SamsPressShop","Can someone explain to me why @SenatorReid refuses to provide funds for children with Cancer? #HarryReidsShutdown http://t.co/p7hVPEfOgq","Twitter Web Client",,,,FALSE,FALSE,1,5,"HarryReidsShutdown",,"youtube.com/watch?v=QfHLka…","http://t.co/p7hVPEfOgq","http://www.youtube.com/watch?v=QfHLkacQDFw&feature=youtu.be",,,,,,,,,"x16789970","SenatorReid","en",,,,,,,,,,,,,
"x385488395142582272",2013-10-02 19:36:10,"x249288197","SamsPressShop","RT @Reince: Happy to announce @GOP offering to pay to keep WWII memorial that WH barricaded open for 30 days. http://t.co/geo2zSecx1","Twitter Web Client",,,,FALSE,TRUE,0,164,,,,,,"http://pbs.twimg.com/media/BVmG9LqCUAAztEU.jpg","http://t.co/geo2zSecx1","https://twitter.com/Reince/status/385487629002608641/photo/1","photo","http://pbs.twimg.com/media/BVmG9LqCUAAztEU.jpg","http://t.co/geo2zSecx1","https://twitter.com/Reince/status/385487629002608641/photo/1",,"x20733972 11134252","Reince GOP","en",,,"x385487629002608641","Happy to announce @GOP offering to pay to keep WWII memorial that WH barricaded open for 30 days. http://t.co/geo2zSecx1",,,,,,,,,
"x385466141931352064",2013-10-02 18:07:44,"x249288197","SamsPressShop","PROOF http://t.co/VMoKcUKw7M","Twitter Web Client",,,,FALSE,FALSE,0,2,,,,,,"http://pbs.twimg.com/media/BVlzae8CMAAqohB.jpg","http://t.co/VMoKcUKw7M","https://twitter.com/SamsPressShop/status/385466141931352064/photo/1","photo","http://pbs.twimg.com/media/BVlzae8CMAAqohB.jpg","http://t.co/VMoKcUKw7M","https://twitter.com/SamsPressShop/status/385466141931352064/photo/1",,,,"en",,,,,,,,,,,,,
"x385465713453826048",2013-10-02 18:06:02,"x249288197","SamsPressShop","Rain or shine, day or night #WWII memorial is reg. open &amp; unstaffed. Yet, the @WhiteHouse closes it.  Nothing more than a #PublicityStunt","Twitter Web Client",,,,FALSE,FALSE,2,7,"WWII PublicityStunt",,,,,,,,,,,,,"x822215673812119553","WhiteHouse","en",,,,,,,,,,,,,
"x385427923022270464",2013-10-02 15:35:52,"x249288197","SamsPressShop","RT @newtgingrich: #WWII Memorial website says memorial was funded almost entirely by private donations. So why has Obama closed it? http://…","Twitter Web Client",,,,FALSE,TRUE,0,436,"WWII",,,,,,,,,,,,,"x20713061","newtgingrich","en",,,"x385426263235506176","#WWII Memorial website says memorial was funded almost entirely by private donations. So why has Obama closed it? http://t.co/v8p3dqe13R",,,,,,,,,
"x385426860282097666",2013-10-02 15:31:39,"x249288197","SamsPressShop","More guards at WWII memorial than #Benghazi, Park Service closes park it doesn't run --&gt; #HarryReidsShutdown http://t.co/geAQdEJyBL","Twitter Web Client",,,,FALSE,FALSE,1,7,"Benghazi HarryReidsShutdown",,"washingtonexaminer.com/article/2536710","http://t.co/geAQdEJyBL","http://washingtonexaminer.com/article/2536710",,,,,,,,,,,"en",,,,,,,,,,,,,
"x385418406062616579",2013-10-02 14:58:03,"x249288197","SamsPressShop","#Obamacare is a law that is negatively impacting the American people --&gt; 100 consequences due to false promises @NRO http://t.co/2kdvRTfDc2","Twitter Web Client",,,,FALSE,FALSE,0,1,"Obamacare",,"nationalreview.com/article/359861…","http://t.co/2kdvRTfDc2","http://www.nationalreview.com/article/359861/100-unintended-consequences-obamacare-andrew-johnson",,,,,,,,,"x19417492","NRO","en",,,,,,,,,,,,,
"x384900603211554816",2013-10-01 04:40:29,"x249288197","SamsPressShop","Senate's doors are closed, House continues to work to keep government open.  #DejaVu  #HarryReidsShutdown","Twitter Web Client",,,,FALSE,FALSE,1,10,"DejaVu HarryReidsShutdown",,,,,,,,,,,,,,,"en",,,,,,,,,,,,,
"x384852933939974144",2013-10-01 01:31:04,"x249288197","SamsPressShop","It's time to fund the government &amp; give the American ppl the same relief from ObamaCare that @BarackObama unilaterally gave  businesses","Twitter Web Client",,,,FALSE,FALSE,0,7,,,,,,,,,,,,,,"x813286","BarackObama","en",,,,,,,,,,,,,
"x384842084739346432",2013-10-01 00:47:57,"x249288197","SamsPressShop","House passes 3rd #CR. If ObamaCare is the best thing since sliced bread, @SenatorReid should have no problem voting for this bill.","Twitter Web Client",,,,FALSE,FALSE,0,1,"CR",,,,,,,,,,,,,"x16789970","SenatorReid","en",,,,,,,,,,,,,
