"status_id","created_at","user_id","screen_name","text","source","reply_to_status_id","reply_to_user_id","reply_to_screen_name","is_quote","is_retweet","favorite_count","retweet_count","hashtags","symbols","urls_url","urls_t.co","urls_expanded_url","media_url","media_t.co","media_expanded_url","media_type","ext_media_url","ext_media_t.co","ext_media_expanded_url","ext_media_type","mentions_user_id","mentions_screen_name","lang","quoted_status_id","quoted_text","retweet_status_id","retweet_text","place_url","place_name","place_full_name","place_type","country","country_code","geo_coords","coords_coords","bbox_coords"
"x571064509969928194",2015-02-26 21:49:23,"x249288197","SamsPressShop","My measure to protect seniors from identity theft passed committee today! LEARN MORE HERE: http://t.co/BATYPBPsKo","Fireside Publishing",,,,FALSE,FALSE,4,5,,,"goo.gl/mqy9Ms","http://t.co/BATYPBPsKo","http://goo.gl/mqy9Ms",,,,,,,,,,,"en",,,,,,,,,,,,,
"x570972915979694080",2015-02-26 15:45:25,"x249288197","SamsPressShop","@WaysandMeansGOP just passed by measure to protect our seniors f/ identity theft by removing Social Security numbers f/ Medicare cards!","Twitter Web Client",,"x12788332","WaysandMeansGOP",FALSE,FALSE,2,0,,,,,,,,,,,,,,"x12788332","WaysandMeansGOP","en",,,,,,,,,,,,,
"x570969351018438656",2015-02-26 15:31:16,"x249288197","SamsPressShop","Let’s protect our seniors and end the use of social security numbers on Medicare cards once and for all.","Twitter Web Client",,,,FALSE,FALSE,3,1,,,,,,,,,,,,,,,,"en",,,,,,,,,,,,,
"x570969274615001088",2015-02-26 15:30:57,"x249288197","SamsPressShop","Seniors being targeted for identity theft is a problem that has gone on for far too long!","Twitter Web Client",,,,FALSE,FALSE,2,1,,,,,,,,,,,,,,,,"en",,,,,,,,,,,,,
"x570969124014301184",2015-02-26 15:30:21,"x249288197","SamsPressShop","…this makes no sense! It puts Medicare beneficiaries like the over 80,000 in my district at risk if their wallet is lost or stolen!","Twitter Web Client",,,,FALSE,FALSE,3,0,,,,,,,,,,,,,,,,"en",,,,,,,,,,,,,
"x570969028094758912",2015-02-26 15:29:59,"x249288197","SamsPressShop","The problem is that seniors’ Medicare cards include their Social Security Numbers…","Twitter Web Client",,,,FALSE,FALSE,1,0,,,,,,,,,,,,,,,,"en",,,,,,,,,,,,,
"x570968923841175552",2015-02-26 15:29:34,"x249288197","SamsPressShop","Your Social Security number is the key to identity theft, &amp; thieves know that!","Twitter Web Client",,,,FALSE,FALSE,1,0,,,,,,,,,,,,,,,,"en",,,,,,,,,,,,,
"x570968867352281088",2015-02-26 15:29:20,"x249288197","SamsPressShop","If we really want to get serious about protecting seniors f/ identity theft, we need to take Social Security Numbers OFF the Medicare card.","Twitter Web Client",,,,FALSE,FALSE,1,2,,,,,,,,,,,,,,,,"en",,,,,,,,,,,,,
"x570968796258807809",2015-02-26 15:29:03,"x249288197","SamsPressShop","Today @WaysandMeansGOP is voting on a measure of mine to protect seniors from identity theft!","Twitter Web Client",,,,FALSE,FALSE,2,1,,,,,,,,,,,,,,"x12788332","WaysandMeansGOP","en",,,,,,,,,,,,,
"x570677774463205376",2015-02-25 20:12:38,"x249288197","SamsPressShop","...let’s make Social Security better for its current beneficiaries as well as its future ones – our children and grandchildren!","Twitter Web Client",,,,FALSE,FALSE,1,1,,,,,,,,,,,,,,,,"en",,,,,,,,,,,,,
"x570677418513571840",2015-02-25 20:11:13,"x249288197","SamsPressShop","Social Security can &amp; MUST work better for people w/ disabilities as well as for the hardworking American taxpayer.","Twitter Web Client",,,,FALSE,FALSE,2,3,,,,,,,,,,,,,,,,"en",,,,,,,,,,,,,
"x570677023821209600",2015-02-25 20:09:39,"x249288197","SamsPressShop","Let’s discuss ideas on how to make Social Security work better. Ignoring the problem isn’t right, fair, or honest.","Twitter Web Client",,,,FALSE,FALSE,3,0,,,,,,,,,,,,,,,,"en",,,,,,,,,,,,,
"x570676650012241922",2015-02-25 20:08:10,"x249288197","SamsPressShop","Let’s stop kicking the can down the road and start FIXING THE PROBLEM. This is what American taxpayers want, need, &amp; DESERVE.","Twitter Web Client",,,,FALSE,FALSE,2,3,,,,,,,,,,,,,,,,"en",,,,,,,,,,,,,
"x570670614631059458",2015-02-25 19:44:11,"x249288197","SamsPressShop","Bailing out the disability program by robbing the retirement program – which will go insolvent even sooner – is IRRESPONSIBLE.","Twitter Web Client",,,,FALSE,FALSE,0,0,,,,,,,,,,,,,,,,"en",,,,,,,,,,,,,
"x570670141077372928",2015-02-25 19:42:18,"x249288197","SamsPressShop","...and 4th: I’m committed to promoting OPPORTUNITY for those trying to return to work.","Twitter Web Client",,,,FALSE,FALSE,0,0,,,,,,,,,,,,,,,,"en",,,,,,,,,,,,,
"x570669951218003968",2015-02-25 19:41:33,"x249288197","SamsPressShop","...3rd: I’m committed to making the Disability Insurance program work BETTER.","Twitter Web Client",,,,FALSE,FALSE,1,1,,,,,,,,,,,,,,,,"en",,,,,,,,,,,,,
"x570669826915602432",2015-02-25 19:41:03,"x249288197","SamsPressShop","...2nd: I’m committed to preventing a 20% across-the-board benefit cut.","Twitter Web Client",,,,FALSE,FALSE,1,2,,,,,,,,,,,,,,,,"en",,,,,,,,,,,,,
"x570669690722361344",2015-02-25 19:40:31,"x249288197","SamsPressShop","...1st: I’m committed to ensuring benefits continue to be paid to individuals w/ disabilities &amp; their family members that rely on them.","Twitter Web Client",,,,FALSE,FALSE,1,1,,,,,,,,,,,,,,,,"en",,,,,,,,,,,,,
"x570669438648901632",2015-02-25 19:39:31,"x249288197","SamsPressShop","I’m making a 4-pt commitment to the disability community &amp; I’m asking my colleagues on both sides of the aisle to join me!","Twitter Web Client",,,,FALSE,FALSE,1,1,,,,,,,,,,,,,,,,"en",,,,,,,,,,,,,
"x570669186797715456",2015-02-25 19:38:31,"x249288197","SamsPressShop","FACT: In less than 2 yrs, the Disability Insurance program will not have enough $ to pay benefits. Dems want to ignore. I say let's fix it!","Twitter Web Client",,,,FALSE,FALSE,0,0,,,,,,,,,,,,,,,,"en",,,,,,,,,,,,,
"x570669104501280768",2015-02-25 19:38:11,"x249288197","SamsPressShop","Thanks to individuals f/ disability community for coming to the hearing! You know better than most that DI program is not w/o its problems!","Twitter Web Client",,,,FALSE,FALSE,0,0,,,,,,,,,,,,,,,,"en",,,,,,,,,,,,,
"x570668996388909056",2015-02-25 19:37:45,"x249288197","SamsPressShop","TUNE IN NOW: I'm chairing the @WaysandMeansGOP Social Security hearing on protecting the solvency of this important program!","Twitter Web Client",,,,FALSE,FALSE,0,0,,,,,,,,,,,,,,"x12788332","WaysandMeansGOP","en",,,,,,,,,,,,,
"x570223296958078977",2015-02-24 14:06:42,"x249288197","SamsPressShop","IMPORTANT UPDATE: due to poor weather conditions, we will be rescheduling our Mobile Office Hours. Check back for new dates and be safe!","Twitter Web Client",,,,FALSE,FALSE,1,3,,,,,,,,,,,,,,,,"en",,,,,,,,,,,,,
"x569979817124339713",2015-02-23 21:59:12,"x249288197","SamsPressShop","Congressional Art Competition for High School students now underway! Can't wait to see what our local student artists have created! http:...","Fireside Publishing",,,,FALSE,FALSE,1,1,,,,,,,,,,,,,,,,"en",,,,,,,,,,,,,
"x565971846106210305",2015-02-12 20:32:58,"x249288197","SamsPressShop","RT @HouseGOP: 42 yrs ago today, Rep. Sam Johnson was freed after nearly 7 yrs of captivity in North Vietnam. http://t.co/pGIh743gax http://…","Twitter Web Client",,,,FALSE,TRUE,0,84,,,"j.mp/1FDQ6HV","http://t.co/pGIh743gax","http://j.mp/1FDQ6HV",,,,,,,,,"x15207668","HouseGOP","en",,,"x565961760918994944","42 yrs ago today, Rep. Sam Johnson was freed after nearly 7 yrs of captivity in North Vietnam. http://t.co/pGIh743gax http://t.co/LfZPO7BZ6z",,,,,,,,,
"x565949955253469187",2015-02-12 19:05:58,"x249288197","SamsPressShop","... In honor of all POWs &amp; MIAs, I went to the tomb of the Unknown Soldier &amp; Smithsonian Vietnam POW exhibit http://t.co/Mjsrcq2rxg","Twitter Web Client",,,,FALSE,FALSE,3,2,,,,,,"http://pbs.twimg.com/media/B9qofDPCQAATWVI.jpg","http://t.co/Mjsrcq2rxg","https://twitter.com/SamsPressShop/status/565949955253469187/photo/1","photo","http://pbs.twimg.com/media/B9qofDPCQAATWVI.jpg http://pbs.twimg.com/media/B9qofDaCEAAdOpZ.jpg http://pbs.twimg.com/media/B9qoeuxCcAA69mZ.jpg","http://t.co/Mjsrcq2rxg http://t.co/Mjsrcq2rxg http://t.co/Mjsrcq2rxg","https://twitter.com/SamsPressShop/status/565949955253469187/photo/1 https://twitter.com/SamsPressShop/status/565949955253469187/photo/1 https://twitter.com/SamsPressShop/status/565949955253469187/photo/1",,,,"en",,,,,,,,,,,,,
"x565949043390824448",2015-02-12 19:02:21,"x249288197","SamsPressShop","42 yrs ago, after nearly 7 yrs as a POW, I found out I would be going home. Thankful for FREEDOM! Remembering ALL our POWS &amp; MIAs...","Twitter Web Client",,,,FALSE,FALSE,8,3,,,,,,,,,,,,,,,,"en",,,,,,,,,,,,,
"x565557007324045312",2015-02-11 17:04:32,"x249288197","SamsPressShop","Honored and privileged to lead the Pledge on the @HouseFloor today. What a blessing to live in ONE NATION UNDER GOD!","Twitter Web Client",,,,FALSE,FALSE,2,1,,,,,,,,,,,,,,"x7402662","HouseFloor","en",,,,,,,,,,,,,
"x565542416347037696",2015-02-11 16:06:33,"x249288197","SamsPressShop","…And don’t forget - this is the same agency that targeted conservative Americans &amp; goes after small businesses through civil forfeiture.","Twitter Web Client",,,,FALSE,FALSE,0,0,,,,,,,,,,,,,,,,"en",,,,,,,,,,,,,
"x565542117205082112",2015-02-11 16:05:22,"x249288197","SamsPressShop","IRS giving “refund bonuses” to illegal immigrants is unfair to hardworking American taxpayers. I vow to take action on this.","Twitter Web Client",,,,FALSE,FALSE,0,3,,,,,,,,,,,,,,,,"en",,,,,,,,,,,,,
"x565541758025859072",2015-02-11 16:03:57,"x249288197","SamsPressShop","After I questioned IRS Commissioner, he confirmed that illegals can get thousands of dollars.","Twitter Web Client",,,,FALSE,FALSE,0,0,,,,,,,,,,,,,,,,"en",,,,,,,,,,,,,
"x565541558070837248",2015-02-11 16:03:09,"x249288197","SamsPressShop","At @WaysandMeansGOP hearing exposing Obama's empty words that illegals would be paying taxes. IRS will be giving them thousands of dollars!","Twitter Web Client",,,,FALSE,FALSE,1,1,,,,,,,,,,,,,,"x12788332","WaysandMeansGOP","en",,,,,,,,,,,,,
"x565541411702177792",2015-02-11 16:02:34,"x249288197","SamsPressShop","At @WaysandMeansGOP hearing – standing up for hardworking, law-abiding, tax-paying constituents.","Twitter Web Client",,,,FALSE,FALSE,1,0,,,,,,,,,,,,,,"x12788332","WaysandMeansGOP","en",,,,,,,,,,,,,
"x563425803061698560",2015-02-05 19:55:54,"x249288197","SamsPressShop","Glad to supporting small businesses - backbone of US economy - &amp; charitable giving this week! http://t.co/tTxeGCXIWL","Fireside Publishing",,,,FALSE,FALSE,2,4,,,"goo.gl/SeHPRn","http://t.co/tTxeGCXIWL","http://goo.gl/SeHPRn",,,,,,,,,,,"en",,,,,,,,,,,,,
"x563070247838969859",2015-02-04 20:23:03,"x249288197","SamsPressShop","There should be NO “refunds” for illegals on the backs of taxpayers. This is wrong! http://t.co/Qe5JvQHKvA","Fireside Publishing",,,,FALSE,FALSE,4,4,,,"goo.gl/qxGExD","http://t.co/Qe5JvQHKvA","http://goo.gl/qxGExD",,,,,,,,,,,"en",,,,,,,,,,,,,
"x563051747930042369",2015-02-04 19:09:32,"x249288197","SamsPressShop","RT @WaysandMeansGOP: .@BloombergView weighs in on SS Disability shortfall: Republicans “have some good ideas"" on how reform can be done. ht…","Twitter Web Client",,,,FALSE,TRUE,0,12,,,,,,,,,,,,,,"x12788332 2411176891","WaysandMeansGOP BloombergView","en",,,"x563050637601284097",".@BloombergView weighs in on SS Disability shortfall: Republicans “have some good ideas"" on how reform can be done. http://t.co/SjGEkblgdo",,,,,,,,,
"x562747456300285953",2015-02-03 23:00:23,"x249288197","SamsPressShop","To Solve Social Security Challenge, Obama Administration Has to Admit it Exists - http://t.co/76oQzDLDSG","Twitter Web Client",,,,FALSE,FALSE,11,13,,,"1.usa.gov/1EEjhgl","http://t.co/76oQzDLDSG","http://1.usa.gov/1EEjhgl",,,,,,,,,,,"en",,,,,,,,,,,,,
"x562742179744202752",2015-02-03 22:39:25,"x249288197","SamsPressShop","Today I voted to fully repeal Obamacare. Proud to cosponsor HR 596 &amp; encourage the Senate to follow our lead! http://t.co/jON09vtt8Y","Fireside Publishing",,,,FALSE,FALSE,5,2,,,"goo.gl/4gaxsA","http://t.co/jON09vtt8Y","http://goo.gl/4gaxsA",,,,,,,,,,,"en",,,,,,,,,,,,,
"x562647426235117568",2015-02-03 16:22:54,"x249288197","SamsPressShop","Let's work together to strengthen retirement AND disability.","Twitter Web Client",,,,FALSE,FALSE,1,0,,,,,,,,,,,,,,,,"en",,,,,,,,,,,,,
"x562645996581421059",2015-02-03 16:17:13,"x249288197","SamsPressShop","President Obama, what happened to not kicking the can down the road? http://t.co/lAzJBbMiRp","Twitter Web Client",,,,FALSE,FALSE,0,0,,,"washingtonpost.com/wp-dyn/content…","http://t.co/lAzJBbMiRp","http://www.washingtonpost.com/wp-dyn/content/article/2009/01/15/AR2009011504114.html",,,,,,,,,,,"en",,,,,,,,,,,,,
"x562645490979078145",2015-02-03 16:15:13,"x249288197","SamsPressShop","The President's only plan is a budget gimmick. Taking from senior¹s Social Security to pay disability benefits doesn¹t solve anything.","Twitter Web Client",,,,FALSE,FALSE,0,1,,,,,,,,,,,,,,,,"en",,,,,,,,,,,,,
"x562639518399217664",2015-02-03 15:51:29,"x249288197","SamsPressShop","As Social Security Chairman, I'm committed to ensuring this important program is there for Americans who need it.","Twitter Web Client",,,,FALSE,FALSE,1,2,,,,,,,,,,,,,,,,"en",,,,,,,,,,,,,
"x562638237496541185",2015-02-03 15:46:23,"x249288197","SamsPressShop","Obama's budget betrays his 2009 pledge to fix Social Security.  Americans deserve better.","Twitter Web Client",,,,FALSE,FALSE,0,0,,,,,,,,,,,,,,,,"en",,,,,,,,,,,,,
"x562637627212697600",2015-02-03 15:43:58,"x249288197","SamsPressShop","...the longterm shortfall has DOUBLED from $5.3 trillion to $10.6 trillion. That means Social Security can't pay for promises it has made.","Twitter Web Client",,,,FALSE,FALSE,0,1,,,,,,,,,,,,,,,,"en",,,,,,,,,,,,,
"x562637266808737792",2015-02-03 15:42:32,"x249288197","SamsPressShop","Over past 5 yrs Social Security shortfall has doubled. We CANNOT keep kicking the can down the road!","Twitter Web Client",,,,FALSE,FALSE,0,1,,,,,,,,,,,,,,,,"en",,,,,,,,,,,,,
"x562629292115632130",2015-02-03 15:10:51,"x249288197","SamsPressShop","TUNE IN LIVE: @WaysandMeansGOP is holding a hearing on the President's budget proposal w/ Secretary Lew http://t.co/PU9ZKf05IB","Twitter Web Client",,,,FALSE,FALSE,1,0,,,"ustream.tv/channel/hclive…","http://t.co/PU9ZKf05IB","http://www.ustream.tv/channel/hclive09",,,,,,,,,"x12788332","WaysandMeansGOP","en",,,,,,,,,,,,,
"x562313069045760000",2015-02-02 18:14:17,"x249288197","SamsPressShop","President Obama is proposing a budget for bankruptcy. Americans want, need, &amp; deserve better.http://t.co/1NeVFhG5to","Fireside Publishing",,,,FALSE,FALSE,0,6,,,"goo.gl/9ax5wk","http://t.co/1NeVFhG5to","http://goo.gl/9ax5wk",,,,,,,,,,,"en",,,,,,,,,,,,,
"x560884890909282304",2015-01-29 19:39:13,"x249288197","SamsPressShop","Mark your calendars for Feb 24! My first Mobile Office hours of 2015 are set! Check to see if one is coming near you! http://t.co/8X9exKpY54","Twitter Web Client",,,,FALSE,FALSE,1,3,,,"samjohnson.house.gov/news/documents…","http://t.co/8X9exKpY54","http://samjohnson.house.gov/news/documentsingle.aspx?DocumentID=397631",,,,,,,,,,,"en",,,,,,,,,,,,,
"x560476428740075520",2015-01-28 16:36:08,"x249288197","SamsPressShop","I introduced a rule to protect Social Security this month. Here are 7 facts you should know! http://t.co/9kBDboNqyd via @BreitbartNews","Twitter Web Client",,,,FALSE,FALSE,1,4,,,"bit.ly/1v4gUjS","http://t.co/9kBDboNqyd","http://bit.ly/1v4gUjS",,,,,,,,,"x457984599","BreitbartNews","en",,,,,,,,,,,,,
"x560251856459681792",2015-01-28 01:43:46,"x249288197","SamsPressShop","Glad to hear @BarackObama is pulling his proposal to tax 529s - a popular college savings vehicle http://t.co/w5VXcyzCGP","Twitter Web Client",,,,FALSE,FALSE,2,6,,,"wsj.com/articles/obama…","http://t.co/w5VXcyzCGP","http://www.wsj.com/articles/obama-drops-plan-to-raise-taxes-on-529-accounts-1422390991",,,,,,,,,"x813286","BarackObama","en",,,,,,,,,,,,,
"x559755332369788928",2015-01-26 16:50:45,"x249288197","SamsPressShop","Collin County teachers &amp; students - please help make this Valentine's Day special for our hometown veteran heroes! http://t.co/o1QvQ4gzsu","Fireside Publishing",,,,FALSE,FALSE,1,6,,,"goo.gl/dWFauw","http://t.co/o1QvQ4gzsu","http://goo.gl/dWFauw",,,,,,,,,,,"en",,,,,,,,,,,,,
"x558356151159762944",2015-01-22 20:10:54,"x249288197","SamsPressShop","Today, millions of Americans stand up to protect our most fundamental right - Life! http://t.co/RzhGXUw6zh #MarchforLife","Fireside Publishing",,,,FALSE,FALSE,0,5,"MarchforLife",,"goo.gl/ztNwEX","http://t.co/RzhGXUw6zh","http://goo.gl/ztNwEX",,,,,,,,,,,"en",,,,,,,,,,,,,
"x557984243285245952",2015-01-21 19:33:05,"x249288197","SamsPressShop","In DC tomorrow for March for Life? Marchers are invited to my office's open house f/ 2pm-3:30pm for hot coffee &amp; donuts! RSVP @ 202-225-4201","Twitter Web Client",,,,FALSE,FALSE,1,3,,,,,,,,,,,,,,,,"en",,,,,,,,,,,,,
"x557933767625809921",2015-01-21 16:12:30,"x249288197","SamsPressShop","After the midterms, it was disappointing but not surprising to hear the President propose a liberal agenda all about political point scor...","Fireside Publishing",,,,FALSE,FALSE,0,2,,,,,,,,,,,,,,,,"en",,,,,,,,,,,,,
"x555479044268253186",2015-01-14 21:38:19,"x249288197","SamsPressShop","Today I reintroduced my bill to protect seniors from identity theft! Learn more here: http://t.co/XKrYBwHHNc","Fireside Publishing",,,,FALSE,FALSE,3,5,,,"goo.gl/pGlN5r","http://t.co/XKrYBwHHNc","http://goo.gl/pGlN5r",,,,,,,,,,,"en",,,,,,,,,,,,,
"x555459413067456512",2015-01-14 20:20:18,"x249288197","SamsPressShop","Today I voted to STOP Obama’s executive amnesty - I supported both Aderholt &amp; Blackburn amendments to H.R. 240. http://t.co/NtwWlGVhW9","Fireside Publishing",,,,FALSE,FALSE,1,6,,,"goo.gl/vmiPLK","http://t.co/NtwWlGVhW9","http://goo.gl/vmiPLK",,,,,,,,,,,"en",,,,,,,,,,,,,
"x555013209162543104",2015-01-13 14:47:15,"x249288197","SamsPressShop","WATCH LIVE @ 10/9c: @WaysandMeansGOP holds its first hearing of the year, focusing on economic growth. http://t.co/PU9ZKf05IB","Twitter Web Client",,,,FALSE,FALSE,3,5,,,"ustream.tv/channel/hclive…","http://t.co/PU9ZKf05IB","http://www.ustream.tv/channel/hclive09",,,,,,,,,"x12788332","WaysandMeansGOP","en",,,,,,,,,,,,,
"x554772686891917312",2015-01-12 22:51:30,"x249288197","SamsPressShop","Today I joined other Members of the Texas Delegation in reaffirming our fight against Obama's executive amnesty http://t.co/U2l1uSFwaK","Fireside Publishing",,,,FALSE,FALSE,1,5,,,"goo.gl/Ei8PKz","http://t.co/U2l1uSFwaK","http://goo.gl/Ei8PKz",,,,,,,,,,,"en",,,,,,,,,,,,,
"x553642614751494144",2015-01-09 20:01:00,"x249288197","SamsPressShop","Back in Session and hard at work: so glad the House has already passed Keystone, Anti-Obamacare Bills! http://t.co/lcWY6I4v9m","Fireside Publishing",,,,FALSE,FALSE,0,4,,,"goo.gl/hfbBdE","http://t.co/lcWY6I4v9m","http://goo.gl/hfbBdE",,,,,,,,,,,"en",,,,,,,,,,,,,
"x552595962875887616",2015-01-06 22:41:58,"x249288197","SamsPressShop","Thrilled to start 2015 off strong - the House just passed my measure to protect Social Security! http://t.co/7R5JGdKN3f","Fireside Publishing",,,,FALSE,FALSE,0,0,,,"goo.gl/jb0vwP","http://t.co/7R5JGdKN3f","http://goo.gl/jb0vwP",,,,,,,,,,,"en",,,,,,,,,,,,,
"x546019668121911298",2014-12-19 19:10:08,"x249288197","SamsPressShop","A big thank you to Collin County's constituents for such a great year. Please check out my 2014 in Review newsletter! http://t.co/7il6NkPbpD","Twitter Web Client",,,,FALSE,FALSE,2,1,,,"samjohnson.house.gov/news/email/sho…","http://t.co/7il6NkPbpD","http://samjohnson.house.gov/news/email/show.aspx?ID=RFLOTQWUKJT7T2TIJWMZZ7HGBE",,,,,,,,,,,"en",,,,,,,,,,,,,
"x545976437095010304",2014-12-19 16:18:21,"x249288197","SamsPressShop","Thrilled that my No Social Security for Nazis bill was signed into law! http://t.co/r4tkV0cpCI","Fireside Publishing",,,,FALSE,FALSE,3,1,,,"1.usa.gov/1x57MvG","http://t.co/r4tkV0cpCI","http://1.usa.gov/1x57MvG",,,,,,,,,,,"en",,,,,,,,,,,,,
"x543239935545724928",2014-12-12 03:04:28,"x249288197","SamsPressShop","This evening I voted against the ""Cromnibus"" and President Obama's executive amnesty for illegals. Learn more here: http://t.co/2AhkPru1pN","Fireside Publishing",,,,FALSE,FALSE,4,4,,,"1.usa.gov/1wFEmUQ","http://t.co/2AhkPru1pN","http://1.usa.gov/1wFEmUQ",,,,,,,,,,,"en",,,,,,,,,,,,,
"x543162376867311616",2014-12-11 21:56:16,"x249288197","SamsPressShop","Veterans like James Gagliardo deserve better f/ the VA, which mishandled his benefit. The VA must do a better job! http://t.co/GeeCnyr8i4","Twitter Web Client",,,,FALSE,FALSE,2,2,,,"samjohnson.house.gov/uploadedfiles/…","http://t.co/GeeCnyr8i4","http://samjohnson.house.gov/uploadedfiles/csj_letter_to_va_secretary_-_james_gagliardo.pdf",,,,,,,,,,,"en",,,,,,,,,,,,,
"x540616883733811200",2014-12-04 21:21:23,"x249288197","SamsPressShop","Sam Johnson Votes to Stop Obama’s Executive Amnesty","Fireside Publishing",,,,FALSE,FALSE,5,4,,,,,,,,,,,,,,,,"en",,,,,,,,,,,,,
"x540281105820430337",2014-12-03 23:07:08,"x249288197","SamsPressShop","Congressman Sam Johnson votes for ABLE ACT to help individuals with disabilities","Fireside Publishing",,,,FALSE,FALSE,0,0,,,,,,,,,,,,,,,,"en",,,,,,,,,,,,,
"x540278782205378561",2014-12-03 22:57:54,"x249288197","SamsPressShop","RT @GregAbbott_TX: Today I led a 17 state coalition in a lawsuit against Obama's unconstitutional immigration order #tcot @TexasGOP  http:/…","Twitter Web Client",,,,FALSE,TRUE,0,690,"tcot",,,,,,,,,,,,,"x90651198 37760670","GregAbbott_TX TexasGOP","en",,,"x540269261587886080","Today I led a 17 state coalition in a lawsuit against Obama's unconstitutional immigration order #tcot @TexasGOP  http://t.co/QqdAMnFwyC",,,,,,,,,
"x540182431220133888",2014-12-03 16:35:02,"x249288197","SamsPressShop","Working hard to combat the President's illegal executive amnesty on behalf of my constituents! http://t.co/jmAaYv872L","Twitter Web Client",,,,FALSE,FALSE,1,2,,,"theblaze.com/blog/2014/12/0…","http://t.co/jmAaYv872L","http://www.theblaze.com/blog/2014/12/02/watch-dhss-stunningly-simple-answer-to-whether-obamas-immigration-move-will-hurt-u-s-workers/",,,,,,,,,,,"en",,,,,,,,,,,,,
"x539794504971071489",2014-12-02 14:53:33,"x249288197","SamsPressShop","Congressman Sam Johnson fights executive amnesty, introduces ""No Social Security Numbers and Benefits for Illegal Aliens Act""  http://1.u...","Fireside Publishing",,,,FALSE,FALSE,2,6,,,,,,,,,,,,,,,,"en",,,,,,,,,,,,,
"x535480266505334784",2014-11-20 17:10:18,"x249288197","SamsPressShop","Hardworking American taxpayers didn’t sign up to foot the bill for lawbreaking illegal immigrants. http://t.co/QQJy2wrKEU","Twitter Web Client",,,,FALSE,FALSE,1,6,,,"samjohnson.house.gov/news/documents…","http://t.co/QQJy2wrKEU","http://samjohnson.house.gov/news/documentsingle.aspx?DocumentID=397609",,,,,,,,,,,"en",,,,,,,,,,,,,
"x532267067983273985",2014-11-11 20:22:12,"x249288197","SamsPressShop","Congratulations to Collin College! Army Times just named them the #8 best 2-yr school for veterans in the U.S.! http://t.co/E7HSozlXDH","Twitter Web Client",,,,FALSE,FALSE,1,2,,,"armytimes.com/story/veterans…","http://t.co/E7HSozlXDH","http://www.armytimes.com/story/veterans/best-for-vets/education/2014/11/10/best-for-vets-colleges-2015/18798437/?sf33536642=1",,,,,,,,,,,"en",,,,,,,,,,,,,
"x532222723263844353",2014-11-11 17:26:00,"x249288197","SamsPressShop","Is a family member, friend, or neighbor a Veteran? Make sure to wish them a Happy Veterans Day &amp; thank them for their service!","Twitter Web Client",,,,FALSE,FALSE,2,1,,,,,,,,,,,,,,,,"en",,,,,,,,,,,,,
"x532216026646466561",2014-11-11 16:59:23,"x249288197","SamsPressShop","I thank our veterans for their service to defend our Great Nation. The freedom we all enjoy is due to their sacrifice http://t.co/8e3BCrXrT6","Twitter Web Client",,,,FALSE,FALSE,2,2,,,,,,"http://pbs.twimg.com/media/B2LPp9NCUAAkna7.jpg","http://t.co/8e3BCrXrT6","https://twitter.com/SamsPressShop/status/532216026646466561/photo/1","photo","http://pbs.twimg.com/media/B2LPp9NCUAAkna7.jpg","http://t.co/8e3BCrXrT6","https://twitter.com/SamsPressShop/status/532216026646466561/photo/1",,,,"en",,,,,,,,,,,,,
"x530836679448604672",2014-11-07 21:38:21,"x249288197","SamsPressShop","RT @TexanCat: Veterans for today's #HonorFlightDFW &amp; the Hon. @SamsPressShop of Collin County. http://t.co/bo3ZxkyI4J","Twitter for iPhone",,,,FALSE,TRUE,0,1,"HonorFlightDFW",,,,,"http://pbs.twimg.com/media/B12YtiyCcAAzH5J.jpg","http://t.co/bo3ZxkyI4J","https://twitter.com/TexanCat/status/530748239482335232/photo/1","photo","http://pbs.twimg.com/media/B12YtiyCcAAzH5J.jpg","http://t.co/bo3ZxkyI4J","https://twitter.com/TexanCat/status/530748239482335232/photo/1",,"x1902427388 249288197","TexanCat SamsPressShop","en",,,"x530748239482335232","Veterans for today's #HonorFlightDFW &amp; the Hon. @SamsPressShop of Collin County. http://t.co/bo3ZxkyI4J",,,,,,,,,
"x530766155980767232",2014-11-07 16:58:07,"x249288197","SamsPressShop","Happy 96th birthday to Billy Graham! I thank him for his humble leadership and wish him a very happy birthday! http://t.co/7waPUJ9nbw","Twitter Web Client",,,,FALSE,FALSE,1,2,,,"charismanews.com/culture/46029-…","http://t.co/7waPUJ9nbw","http://www.charismanews.com/culture/46029-billy-graham-turns-96-talks-about-heaven",,,,,,,,,,,"en",,,,,,,,,,,,,
"x530753894042046466",2014-11-07 16:09:23,"x249288197","SamsPressShop","Here's a fun history fact: On this day in 1916, Jeannette Rankin of Montana became the first woman - a Republican - elected to Congress.","Twitter Web Client",,,,FALSE,FALSE,1,1,,,,,,,,,,,,,,,,"en",,,,,,,,,,,,,
