"status_id","created_at","user_id","screen_name","text","source","reply_to_status_id","reply_to_user_id","reply_to_screen_name","is_quote","is_retweet","favorite_count","retweet_count","hashtags","symbols","urls_url","urls_t.co","urls_expanded_url","media_url","media_t.co","media_expanded_url","media_type","ext_media_url","ext_media_t.co","ext_media_expanded_url","ext_media_type","mentions_user_id","mentions_screen_name","lang","quoted_status_id","quoted_text","retweet_status_id","retweet_text","place_url","place_name","place_full_name","place_type","country","country_code","geo_coords","coords_coords","bbox_coords"
"x918248849906585600",2017-10-11 22:56:00,"x803694179079458816","SenKamalaHarris","Today is #DayoftheGirl and I want to talk about barriers girls are facing to getting an education in our country right now.","Sprout Social",,,,FALSE,FALSE,1448,442,"DayoftheGirl",,,,,,,,,,,,,,,"en",,,,,,,,,,,,,
"x918232751979028482",2017-10-11 21:52:02,"x803694179079458816","SenKamalaHarris","I see the future, I see the beginning of the next great movement that will always be about fighting for the ideals of our country. https://t.co/3oGFDoVjCB","Sprout Social",,,,FALSE,FALSE,1109,358,,,,,,"http://pbs.twimg.com/media/DL430diUMAEze_3.jpg","https://t.co/3oGFDoVjCB","https://twitter.com/SenKamalaHarris/status/918232751979028482/photo/1","photo","http://pbs.twimg.com/media/DL430diUMAEze_3.jpg","https://t.co/3oGFDoVjCB","https://twitter.com/SenKamalaHarris/status/918232751979028482/photo/1",,,,"en",,,,,,,,,,,,,
"x918216638301966337",2017-10-11 20:48:00,"x803694179079458816","SenKamalaHarris","Your happiness is what matters most. On your terms, in your way, go out &amp; live your truth. #NationalComingOutDay","Sprout Social",,,,FALSE,FALSE,2084,571,"NationalComingOutDay",,,,,,,,,,,,,,,"en",,,,,,,,,,,,,
"x918200531079790592",2017-10-11 19:44:00,"x803694179079458816","SenKamalaHarris","Dry winds are expected to pick up today in Northern California - please continue to heed evacuation warnings &amp; listen to safety officials.","Sprout Social",,,,FALSE,FALSE,748,352,,,,,,,,,,,,,,,,"en",,,,,,,,,,,,,
"x918146677072187393",2017-10-11 16:10:00,"x803694179079458816","SenKamalaHarris","Keep these families in your thoughts today. https://t.co/eOq73UI2Jf","Sprout Social",,,,FALSE,FALSE,1017,415,,,"cnn.com/2017/10/11/us/…","https://t.co/eOq73UI2Jf","http://www.cnn.com/2017/10/11/us/california-fires-updates/index.html",,,,,,,,,,,"en",,,,,,,,,,,,,
"x918130571997532161",2017-10-11 15:06:01,"x803694179079458816","SenKamalaHarris","This morning I’m thinking of our firefighters &amp; first responders. When everyone else is running away from danger, they run to it. Thank you.","Sprout Social",,,,FALSE,FALSE,4899,1063,,,,,,,,,,,,,,,,"en",,,,,,,,,,,,,
"x917851803126988801",2017-10-10 20:38:17,"x803694179079458816","SenKamalaHarris","It’s 2017 - at this point we should all be able to agree that the ability to breathe clean air is a priority.","TweetDeck",,,,FALSE,FALSE,7718,2107,,,,,,,,,,,,,,,,"en",,,,,,,,,,,,,
"x917822919044227074",2017-10-10 18:43:30,"x803694179079458816","SenKamalaHarris","Thankful to our heroes - the firefighters &amp; first responders who have worked through the night to combat these wildfires.","Twitter Web Client",,,,FALSE,FALSE,2549,570,,,,,,,,,,,,,,,,"en",,,,,,,,,,,,,
"x917789834596536321",2017-10-10 16:32:02,"x803694179079458816","SenKamalaHarris","Heavy-hearted this morning, so many have lost everything. https://t.co/1hC8JxJxOf","Twitter Web Client",,,,FALSE,FALSE,1305,494,,,"cnn.com/2017/10/10/us/…","https://t.co/1hC8JxJxOf","http://www.cnn.com/2017/10/10/us/california-fires-napa/index.html?sr=twCNN101017california-fires-napa0722AMVODtop",,,,,,,,,,,"en",,,,,,,,,,,,,
"x917551073585397760",2017-10-10 00:43:17,"x803694179079458816","SenKamalaHarris","My thoughts are with those lost in today's wildfires &amp; their families.","Twitter for iPhone",,,,FALSE,FALSE,1643,315,,,,,,,,,,,,,,,,"en",,,,,,,,,,,,,
"x917503858389192704",2017-10-09 21:35:40,"x803694179079458816","SenKamalaHarris","This decision fails Americans for generations to come. https://t.co/Eltb19WQZg","Twitter for iPhone",,,,FALSE,FALSE,2628,1536,,,"nytimes.com/2017/10/09/cli…","https://t.co/Eltb19WQZg","https://www.nytimes.com/2017/10/09/climate/clean-power-plan.html",,,,,,,,,,,"en",,,,,,,,,,,,,
"x917476556594958338",2017-10-09 19:47:11,"x803694179079458816","SenKamalaHarris","For safety information about the wildfires in Napa and Sonoma please follow @Cal_OES &amp; @CAL_FIRE.","Twitter for iPhone",,,,FALSE,FALSE,308,237,,,,,,,,,,,,,,"x29467516 21249970","Cal_OES CAL_FIRE","en",,,,,,,,,,,,,
"x917440849998417920",2017-10-09 17:25:18,"x803694179079458816","SenKamalaHarris","To everyone in the areas impacted by the wildfires in Napa and Sonoma - please heed evacuation orders &amp; stay safe. https://t.co/TfFCNTTxMw","Twitter for iPhone",,,,FALSE,FALSE,886,399,,,"sfgate.com/bayarea/articl…","https://t.co/TfFCNTTxMw","http://sfgate.com/bayarea/article/North-Bay-fires-List-evacuations-12263283.php",,,,,,,,,,,"en",,,,,,,,,,,,,
"x916404698487410699",2017-10-06 20:48:00,"x803694179079458816","SenKamalaHarris","Wholeheartedly agree with my colleagues on this. https://t.co/BDxb3kVQIr","Sprout Social",,,,FALSE,FALSE,5156,2450,,,"time.com/4968285/john-m…","https://t.co/BDxb3kVQIr","http://time.com/4968285/john-mccain-sheldon-whitehouse-gerrymandering-supreme-court/",,,,,,,,,,,"en",,,,,,,,,,,,,
"x916388592066457601",2017-10-06 19:44:00,"x803694179079458816","SenKamalaHarris","Joining @CHIRLA &amp; @KRCLA at UC Irvine to rally for the DREAM Act on Wed. at 10:30 AM PT. Join us https://t.co/Chl0lOf85o","Sprout Social",,,,FALSE,FALSE,271,128,,,"bit.ly/2yNACU7","https://t.co/Chl0lOf85o","http://bit.ly/2yNACU7",,,,,,,,,"x16568741 21956575","CHIRLA krcla","en",,,,,,,,,,,,,
"x916360180081848320",2017-10-06 17:51:06,"x803694179079458816","SenKamalaHarris","Covering birth control matters. This is an issue of economic security and justice for women.","Twitter for iPhone",,,,FALSE,FALSE,3913,1439,,,,,,,,,,,,,,,,"en",,,,,,,,,,,,,
"x916359989173915648",2017-10-06 17:50:21,"x803694179079458816","SenKamalaHarris","Now your employer or your insurer can deny you coverage of birth control.","Twitter for iPhone",,,,FALSE,FALSE,707,511,,,,,,,,,,,,,,,,"en",,,,,,,,,,,,,
"x916359591784566785",2017-10-06 17:48:46,"x803694179079458816","SenKamalaHarris","More than 55 million women have access to birth control without copayment because of the contraception coverage mandate. Trump reversed it.","Twitter for iPhone",,,,FALSE,FALSE,7492,4997,,,,,,,,,,,,,,,,"en",,,,,,,,,,,,,
"x916355815023443968",2017-10-06 17:33:46,"x803694179079458816","SenKamalaHarris","Reality is much more complicated than the lines politicians draw to score points. https://t.co/X8rdl8zve9","Twitter for iPhone",,,,FALSE,FALSE,573,303,,,"self.com/story/23-week-…","https://t.co/X8rdl8zve9","https://www.self.com/story/23-week-abortion",,,,,,,,,,,"en",,,,,,,,,,,,,
"x916042311037018115",2017-10-05 20:48:00,"x803694179079458816","SenKamalaHarris","The American people want us to work together in a bipartisan way, the Republicans’ proposed budget doesn’t do that.","Sprout Social",,,,FALSE,FALSE,2252,780,,,,,,,,,,,,,,,,"en",,,,,,,,,,,,,
"x916026204225974274",2017-10-05 19:44:00,"x803694179079458816","SenKamalaHarris","Our government should be holding Equifax accountable for financially ruining people, not awarding them contracts! https://t.co/mytSqDR3Wu","Sprout Social",,,,FALSE,FALSE,3963,2054,,,"politi.co/2yK0ZtT","https://t.co/mytSqDR3Wu","http://politi.co/2yK0ZtT",,,,,,,,,,,"en",,,,,,,,,,,,,
"x916007823254933505",2017-10-05 18:30:58,"x803694179079458816","SenKamalaHarris","The Trump Administration has yet to notify DACA recipients directly of today’s renewal deadline. Shame on them.","Sprout Social",,,,FALSE,FALSE,6627,3309,,,,,,,,,,,,,,,,"en",,,,,,,,,,,,,
"x915972349945671680",2017-10-05 16:10:00,"x803694179079458816","SenKamalaHarris","This is not an acceptable answer. https://t.co/2uLaKNdCMx","Sprout Social",,,,FALSE,FALSE,668,304,,,"lat.ms/2xk4iH6","https://t.co/2uLaKNdCMx","http://lat.ms/2xk4iH6",,,,,,,,,,,"en",,,,,,,,,,,,,
"x915712134524391424",2017-10-04 22:56:00,"x803694179079458816","SenKamalaHarris","The United States government made a promise to these young people, and we need to keep our promise. https://t.co/QbTGP3qDVQ","Sprout Social",,,,FALSE,FALSE,2514,808,,,"buzzfeed.com/bensmith/kamal…","https://t.co/QbTGP3qDVQ","https://www.buzzfeed.com/bensmith/kamala-harris-pushes-for-clean-dream-act?utm_term=.mxEl1bkN3M#.amY937E0Bq",,,,,,,,,,,"en",,,,,,,,,,,,,
"x915696029026177025",2017-10-04 21:52:00,"x803694179079458816","SenKamalaHarris","By attempting to sabotage the Affordable Care Act, the Trump Administration is hurting Californians right now. https://t.co/z1TkC09Z2W","Sprout Social",,,,FALSE,FALSE,1503,917,,,"sacbee.com/news/politics-…","https://t.co/z1TkC09Z2W","http://www.sacbee.com/news/politics-government/capitol-alert/article176796761.html",,,,,,,,,,,"en",,,,,,,,,,,,,
"x915679923452379136",2017-10-04 20:48:00,"x803694179079458816","SenKamalaHarris","People need to stop playing politics with health care. https://t.co/2nBYcafpl2","Sprout Social",,,,FALSE,FALSE,1146,473,,,"nbcnews.com/politics/congr…","https://t.co/2nBYcafpl2","https://www.nbcnews.com/politics/congress/house-passes-late-term-abortion-ban-pushed-gop-n807286",,,,,,,,,,,"en",,,,,,,,,,,,,
"x915657872888954880",2017-10-04 19:20:23,"x803694179079458816","SenKamalaHarris","About to head into the Senate Budget Committee to discuss the Republicans’ proposed federal budget. (1/8)","Twitter Web Client",,,,FALSE,FALSE,688,241,,,,,,,,,,,,,,,,"en",,,,,,,,,,,,,
"x915625474994442240",2017-10-04 17:11:39,"x803694179079458816","SenKamalaHarris","Proudly joining @SenFeinstein to introduce legislation that bans the sale, transfer, importation, or possession of bump stocks.","Sprout Social",,,,FALSE,FALSE,11483,3413,,,,,,,,,,,,,,"x476256944","SenFeinstein","en",,,,,,,,,,,,,
"x915365854157561857",2017-10-04 00:00:00,"x803694179079458816","SenKamalaHarris","On Sunday, I joined the First Congregational Church in Atlanta to celebrate 150 yrs. Here's what I shared with them. https://t.co/7wcCsLG21P","Sprout Social",,,,FALSE,FALSE,293,81,,,"medium.com/@SenKamalaHarr…","https://t.co/7wcCsLG21P","https://medium.com/@SenKamalaHarris/let-us-have-the-courage-to-speak-truth-ac4cbee24fda",,,,,,,,,,,"en",,,,,,,,,,,,,
"x915349747468259328",2017-10-03 22:56:00,"x803694179079458816","SenKamalaHarris","Our fellow Americans in Puerto Rico are suffering without electricity &amp; hardly any access to food or water.
https://t.co/xlcpLEgEJ1","Sprout Social",,,,FALSE,FALSE,2659,1357,,,"thehill.com/homenews/35356…","https://t.co/xlcpLEgEJ1","http://thehill.com/homenews/353567-dems-call-on-trump-to-prioritize-relief-efforts-on-two-puerto-rican-islands",,,,,,,,,,,"en",,,,,,,,,,,,,
"x915333641324154881",2017-10-03 21:52:00,"x803694179079458816","SenKamalaHarris","Congratulations to @Caltech’s Kip Thorne and Barry Barish, on winning the 2017 #NobelPrize in Physics! https://t.co/VAcl7YbJFL","Sprout Social",,,,FALSE,FALSE,414,108,"NobelPrize",,"usatoday.com/story/news/nat…","https://t.co/VAcl7YbJFL","https://www.usatoday.com/story/news/nation/2017/10/03/nobel-physics-prize-gravity-waves/726309001/",,,,,,,,,"x16536844","Caltech","en",,,,,,,,,,,,,
"x915317535012261888",2017-10-03 20:48:00,"x803694179079458816","SenKamalaHarris","I believe in a free &amp; open internet, that’s why I support net neutrality rules &amp; why I voted against Ajit Pai.
https://t.co/qUNzyRt476","Sprout Social",,,,FALSE,FALSE,2161,713,,,"techcrunch.com/2017/10/02/sen…","https://t.co/qUNzyRt476","https://techcrunch.com/2017/10/02/senate-confirms-ajit-pai-as-fcc-chairman/",,,,,,,,,,,"en",,,,,,,,,,,,,
"x915301428591243264",2017-10-03 19:44:00,"x803694179079458816","SenKamalaHarris","Moments of silence alone will not suffice. https://t.co/9sndAEkeZK","Sprout Social",,,,FALSE,FALSE,1500,502,,,"popsugar.com/news/Sen-Kamal…","https://t.co/9sndAEkeZK","https://www.popsugar.com/news/Sen-Kamala-Harris-Las-Vegas-Mass-Shooting-October-2017-44097553",,,,,,,,,,,"en",,,,,,,,,,,,,
"x915281383085535234",2017-10-03 18:24:21,"x803694179079458816","SenKamalaHarris","If you need to renew your DACA status, mail your paperwork TODAY, October 3. If you have questions, please call my office (202) 224-3553.","Sprout Social",,,,FALSE,FALSE,3004,2956,,,,,,,,,,,,,,,,"en",,,,,,,,,,,,,
"x915244634875580416",2017-10-03 15:58:20,"x803694179079458816","SenKamalaHarris","We need to pass the DREAM Act - no strings attached. https://t.co/EwAikT5XiH","Twitter for iPhone",,,,FALSE,FALSE,823,272,,,,,,"http://pbs.twimg.com/media/DLOG57EV4AEchKD.jpg","https://t.co/EwAikT5XiH","https://twitter.com/AM2DM/status/915223485982547968/video/1","photo","http://pbs.twimg.com/media/DLOG57EV4AEchKD.jpg","https://t.co/EwAikT5XiH","https://twitter.com/AM2DM/status/915223485982547968/video/1",,,,"en",,,,,,,,,,,,,
"x914898390017822720",2017-10-02 17:02:28,"x803694179079458816","SenKamalaHarris","My thoughts on the horrific shooting in Las Vegas. https://t.co/52UN7mbMsh","Twitter Web Client",,,,FALSE,FALSE,2894,1199,,,,,,"http://pbs.twimg.com/media/DLJfNQZW4AA4gb9.jpg","https://t.co/52UN7mbMsh","https://twitter.com/SenKamalaHarris/status/914898390017822720/photo/1","photo","http://pbs.twimg.com/media/DLJfNQZW4AA4gb9.jpg","https://t.co/52UN7mbMsh","https://twitter.com/SenKamalaHarris/status/914898390017822720/photo/1",,,,"en",,,,,,,,,,,,,
"x914849598304395264",2017-10-02 13:48:35,"x803694179079458816","SenKamalaHarris","If you are trying to locate a loved one in Las Vegas, call 1-866-535-5654.","Twitter Web Client",,,,FALSE,FALSE,12505,13936,,,,,,,,,,,,,,,,"en",,,,,,,,,,,,,
"x914824338104340486",2017-10-02 12:08:13,"x803694179079458816","SenKamalaHarris","Horrified by the Las Vegas shooting. My heart is heavy this morning. Praying for the victims and their families.","Twitter for iPhone",,,,FALSE,FALSE,3273,734,,,,,,,,,,,,,,,,"en",,,,,,,,,,,,,
"x914630388101902336",2017-10-01 23:17:32,"x803694179079458816","SenKamalaHarris","A great weekend read. https://t.co/c5tEkAcfFS","Twitter for iPhone",,,,FALSE,FALSE,471,205,,,"washingtonpost.com/local/from-her…","https://t.co/c5tEkAcfFS","https://www.washingtonpost.com/local/from-her-dads-killing-during-the-crack-epidemic-to-a-supreme-court-clerkship/2017/09/27/e631eb7c-8de0-11e7-8df5-c2e5cf46c1e2_story.html?tid=ss_tw&utm_term=.1631ec7c1988",,,,,,,,,,,"en",,,,,,,,,,,,,
"x914599508830498816",2017-10-01 21:14:49,"x803694179079458816","SenKamalaHarris","DACA recipients: If your permit expires on or before March 5, submit your renewal application by October 3 so it is received by October 5.","Twitter for iPhone",,,,FALSE,FALSE,7438,7315,,,,,,,,,,,,,,,,"en",,,,,,,,,,,,,
"x914501457042448384",2017-10-01 14:45:12,"x803694179079458816","SenKamalaHarris","Today, I’m joining the First Congregational Church in Atlanta to commemorate 150 years. Watch the service live. https://t.co/WZPVnxFwQk","Twitter for iPhone",,,,FALSE,FALSE,550,120,,,"firstchurchatl.org/media/live-str…","https://t.co/WZPVnxFwQk","http://firstchurchatl.org/media/live-stream-2/",,,,,,,,,,,"en",,,,,,,,,,,,,
"x913900196546916353",2017-09-29 22:56:00,"x803694179079458816","SenKamalaHarris","The Trump Administration is out there twisting the truth about this tax plan. https://t.co/vsB7AJqqTq","Sprout Social",,,,FALSE,FALSE,1681,1038,,,"washingtonpost.com/news/fact-chec…","https://t.co/vsB7AJqqTq","https://www.washingtonpost.com/news/fact-checker/wp/2017/09/29/trump-aides-sell-tax-plan-with-pinocchio-laden-claims/?utm_term=.99a791304190",,,,,,,,,,,"en",,,,,,,,,,,,,
"x913884090071437312",2017-09-29 21:52:00,"x803694179079458816","SenKamalaHarris","“Trump Could Save More Than $1 Billion Under His New Tax Plan” https://t.co/YunOkYP2vJ","Sprout Social",,,,FALSE,FALSE,1997,1766,,,"nytimes.com/interactive/20…","https://t.co/YunOkYP2vJ","https://www.nytimes.com/interactive/2017/09/28/us/politics/trump-tax-benefit.html",,,,,,,,,,,"en",,,,,,,,,,,,,
"x913867984854188032",2017-09-29 20:48:01,"x803694179079458816","SenKamalaHarris","Take a moment to read these young women’s stories. Fighting for our DREAMers is so important. https://t.co/qNrepfVUpw","Sprout Social",,,,FALSE,FALSE,735,373,,,"bustle.com/p/7-young-wome…","https://t.co/qNrepfVUpw","https://www.bustle.com/p/7-young-women-reveal-what-losing-daca-would-mean-to-them-those-they-love-2416795",,,,,,,,,,,"en",,,,,,,,,,,,,
"x913553915685126144",2017-09-29 00:00:01,"x803694179079458816","SenKamalaHarris","See how you can help our fellow Americans in Puerto Rico. https://t.co/eyCfA7L6LE","Sprout Social",,,,FALSE,FALSE,451,298,,,"nvoad.org/howtohelp/","https://t.co/eyCfA7L6LE","https://www.nvoad.org/howtohelp/",,,,,,,,,,,"en",,,,,,,,,,,,,
"x913537808656035840",2017-09-28 22:56:00,"x803694179079458816","SenKamalaHarris","Funding for CHIP, which provides health coverage for 9 million kids, expires in  2 days. We can’t let that happen. Make your voice heard.","Sprout Social",,,,FALSE,FALSE,7734,5418,,,,,,,,,,,,,,,,"en",,,,,,,,,,,,,
"x913521702042189824",2017-09-28 21:52:00,"x803694179079458816","SenKamalaHarris","“Many Trump voters will get zero from Republican tax 'framework'” https://t.co/jiUa5syRHF","Sprout Social",,,,FALSE,FALSE,1764,1097,,,"usatoday.com/story/opinion/…","https://t.co/jiUa5syRHF","https://www.usatoday.com/story/opinion/2017/09/27/republican-tax-framework-wont-help-many-trump-voters-editorials-debates/710246001/",,,,,,,,,,,"en",,,,,,,,,,,,,
"x913505596585910272",2017-09-28 20:48:00,"x803694179079458816","SenKamalaHarris","""Your fellow Americans in Puerto Rico need help now"" https://t.co/gz4GecbTR1","Sprout Social",,,,FALSE,FALSE,849,470,,,"washingtonpost.com/opinions/your-…","https://t.co/gz4GecbTR1","https://www.washingtonpost.com/opinions/your-fellow-americans-in-puerto-rico-need-help-now/2017/09/26/41a6f0e6-a2e1-11e7-8cfe-d5b912fabc99_story.html?utm_term=.16e3b43477d2",,,,,,,,,,,"en",,,,,,,,,,,,,
"x913471328530964481",2017-09-28 18:31:50,"x803694179079458816","SenKamalaHarris","Young people in this country are terrified because of this Administration’s actions on DACA. We need answers. https://t.co/4eilmpVOi6","Media Studio",,,,FALSE,FALSE,2037,803,,,,,,"http://pbs.twimg.com/amplify_video_thumb/913148621549432834/img/lCQC8oxZMU6lW5dP.jpg","https://t.co/4eilmpVOi6","https://twitter.com/SenKamalaHarris/status/913471328530964481/video/1","photo","http://pbs.twimg.com/amplify_video_thumb/913148621549432834/img/lCQC8oxZMU6lW5dP.jpg","https://t.co/4eilmpVOi6","https://twitter.com/SenKamalaHarris/status/913471328530964481/video/1",,,,"en",,,,,,,,,,,,,
"x913160411540844544",2017-09-27 21:56:22,"x803694179079458816","SenKamalaHarris","Looking forward to joining the First Congregational Church in commemorating 150 years on Sunday.https://t.co/uW7lFdD2ly","Twitter Web Client",,,,FALSE,FALSE,274,79,,,"rollingout.com/2017/09/25/rev…","https://t.co/uW7lFdD2ly","https://rollingout.com/2017/09/25/rev-dwight-d-andrews-and-first-congregational-church-celebrate-150-years/",,,,,,,,,,,"en",,,,,,,,,,,,,
"x913143207986331653",2017-09-27 20:48:00,"x803694179079458816","SenKamalaHarris","Important deadline: we recommend DREAMers mail their applications by October 3 to make sure they are received by the October 5 deadline.","Sprout Social",,,,FALSE,FALSE,11157,9635,,,,,,,,,,,,,,,,"en",,,,,,,,,,,,,
"x913125428197576704",2017-09-27 19:37:21,"x803694179079458816","SenKamalaHarris","A natural disaster in Puerto Rico should be treated no differently than a natural disaster anywhere else in the United States.","Twitter Web Client",,,,FALSE,FALSE,25378,8327,,,,,,,,,,,,,,,,"en",,,,,,,,,,,,,
"x913086082518011905",2017-09-27 17:01:01,"x803694179079458816","SenKamalaHarris","Our fellow Americans need help. Congress should pass immediate aid for the people of Puerto Rico and USVI.","Sprout Social",,,,FALSE,FALSE,6885,2540,,,,,,,,,,,,,,,,"en",,,,,,,,,,,,,
"x912784450089623552",2017-09-26 21:02:26,"x803694179079458816","SenKamalaHarris","This is not a deal. This is a non-starter. Congress must vote on a clean DREAM Act to protect these young people. https://t.co/JEloBLpJMv","Twitter Web Client",,,,FALSE,FALSE,916,357,,,"mcclatchydc.com/news/politics-…","https://t.co/JEloBLpJMv","http://www.mcclatchydc.com/news/politics-government/congress/article175484806.html#storylink=cpy",,,,,,,,,,,"en",,,,,,,,,,,,,
"x912752428969336837",2017-09-26 18:55:11,"x803694179079458816","SenKamalaHarris","There won't be a vote on the Republican ""health care"" bill. This is because of your work. Keep it up.","Twitter Web Client",,,,FALSE,FALSE,17235,3729,,,,,,,,,,,,,,,,"en",,,,,,,,,,,,,
"x912737004382715904",2017-09-26 17:53:54,"x803694179079458816","SenKamalaHarris","Los Dreamers son estudiantes universitarios, están sirviendo en el ejército, y son propietarios de pequeñas empresas https://t.co/BmtxGa4uTn","Twitter Web Client",,,,FALSE,FALSE,254,104,,,"uni.vi/ER1F100NlTb","https://t.co/BmtxGa4uTn","http://uni.vi/ER1F100NlTb",,,,,,,,,,,"es",,,,,,,,,,,,,
"x912705293699698688",2017-09-26 15:47:53,"x803694179079458816","SenKamalaHarris","Proud to work with @ColorOfChange, @essie4justice, and Southerners on New Ground to #EndMoneyBail. https://t.co/HcqULnUq70","Twitter Web Client",,,,FALSE,FALSE,380,144,"EndMoneyBail",,"essence.com/news/black-wom…","https://t.co/HcqULnUq70","http://www.essence.com/news/black-women-leading-criminal-justice-bail-reform",,,,,,,,,"x27793335 2858293508","ColorOfChange essie4justice","en",,,,,,,,,,,,,
"x912423194237313024",2017-09-25 21:06:56,"x803694179079458816","SenKamalaHarris","This bill would hurt kids, people disabilities, &amp; seniors. We need to do everything in our power to defeat it. #DoNoHarm","Twitter Web Client",,,,FALSE,FALSE,2654,1178,"DoNoHarm",,,,,,,,,,,,,,,"en",,,,,,,,,,,,,
"x912366772560519168",2017-09-25 17:22:44,"x803694179079458816","SenKamalaHarris","Puerto Ricans are our fellow Americans and they are facing a crisis. Please do what you can to help. https://t.co/9Nfs7jWqFS","Twitter Web Client",,,,FALSE,FALSE,6038,3991,,,"huffingtonpost.com/entry/puerto-r…","https://t.co/9Nfs7jWqFS","http://www.huffingtonpost.com/entry/puerto-rica-hurricane-irma-maria_us_59c7f699e4b06ddf45f89c7a",,,,,,,,,,,"en",,,,,,,,,,,,,
"x912088436064088064",2017-09-24 22:56:43,"x803694179079458816","SenKamalaHarris","The Senate could vote on this bill next week. It would be a disaster for California and the country. https://t.co/gSuSKSBvI9","Twitter for iPhone",,,,FALSE,FALSE,1276,772,,,"latimes.com/politics/la-na…","https://t.co/gSuSKSBvI9","http://www.latimes.com/politics/la-na-pol-obamacare-repeal-california-20170924-story.html",,,,,,,,,,,"en",,,,,,,,,,,,,
"x910892989542797314",2017-09-21 15:46:26,"x803694179079458816","SenKamalaHarris","This health care fight is about the well-being of children, seniors &amp; people with disabilities. This is a moral issue.","Twitter Web Client",,,,FALSE,FALSE,9157,4059,,,,,,,,,,,,,,,,"en",,,,,,,,,,,,,
"x910609526218461184",2017-09-20 21:00:04,"x803694179079458816","SenKamalaHarris","It’s true - Graham-Cassidy is worse than the bill we beat back over the summer.
https://t.co/bPteetlCEQ","Twitter Web Client",,,,FALSE,FALSE,2936,1968,,,"vox.com/health-care/20…","https://t.co/bPteetlCEQ","https://www.vox.com/health-care/2017/9/20/16333338/obamacare-repeal-graham-cassidy",,,,,,,,,,,"en",,,,,,,,,,,,,
"x910593686676918272",2017-09-20 19:57:07,"x803694179079458816","SenKamalaHarris","L’Shanah Tovah! Wishing a happy, healthy and sweet new year to all celebrating Rosh Hashanah.","Twitter Web Client",,,,FALSE,FALSE,836,168,,,,,,,,,,,,,,,,"en",,,,,,,,,,,,,
"x910577078302597122",2017-09-20 18:51:07,"x803694179079458816","SenKamalaHarris","Tweet at me if you’re calling Congress to tell them you oppose Graham-Cassidy. I’m gonna share your stories.","Twitter Web Client",,,,FALSE,FALSE,3276,1400,,,,,,,,,,,,,,,,"en",,,,,,,,,,,,,
"x910564407612190721",2017-09-20 18:00:46,"x803694179079458816","SenKamalaHarris","Get this - the American Medical Association opposes the Graham-Cassidy “health care” bill because it violates “first, do no harm.”","Twitter Web Client",,,,FALSE,FALSE,69676,41299,,,,,,,,,,,,,,,,"en",,,,,,,,,,,,,
"x910548624353976321",2017-09-20 16:58:03,"x803694179079458816","SenKamalaHarris","Devastating. Praying for the people of Mexico City. Abrazos para todos.
https://t.co/NIh0qeDED8","Twitter Web Client",,,,FALSE,FALSE,542,203,,,"washingtonpost.com/world/mexico-c…","https://t.co/NIh0qeDED8","https://www.washingtonpost.com/world/mexico-city-residents-search-through-the-night-for-survivors-of-quake-that-killed-more-than-200/2017/09/20/4ef19d8e-9d8a-11e7-b2a7-bc70b6f98089_story.html?utm_term=.db0cbc726f11",,,,,,,,,,,"en",,,,,,,,,,,,,
"x910534063357865984",2017-09-20 16:00:12,"x803694179079458816","SenKamalaHarris","Couldn’t agree more. Graham-Cassidy is a bill that doesn’t pass any test -&gt; https://t.co/R4Qe1gLsVc","Twitter for iPhone",,,,FALSE,FALSE,2179,946,,,,,,"http://pbs.twimg.com/media/DKIiAUhVoAA5RoS.jpg","https://t.co/R4Qe1gLsVc","https://twitter.com/jimmykimmel/status/910327697091391489/video/1","photo","http://pbs.twimg.com/media/DKIiAUhVoAA5RoS.jpg","https://t.co/R4Qe1gLsVc","https://twitter.com/jimmykimmel/status/910327697091391489/video/1",,,,"en",,,,,,,,,,,,,
