"status_id","created_at","user_id","screen_name","text","source","reply_to_status_id","reply_to_user_id","reply_to_screen_name","is_quote","is_retweet","favorite_count","retweet_count","hashtags","symbols","urls_url","urls_t.co","urls_expanded_url","media_url","media_t.co","media_expanded_url","media_type","ext_media_url","ext_media_t.co","ext_media_expanded_url","ext_media_type","mentions_user_id","mentions_screen_name","lang","quoted_status_id","quoted_text","retweet_status_id","retweet_text","place_url","place_name","place_full_name","place_type","country","country_code","geo_coords","coords_coords","bbox_coords"
"x857653079910625282",2017-04-27 17:50:03,"x803694179079458816","SenKamalaHarris","#IfKidsWereInCharge they would combat global climate change. https://t.co/UmpRBiAS7T","Sprout Social",,,,FALSE,FALSE,783,202,"IfKidsWereInCharge",,,,,"http://pbs.twimg.com/media/C-b-7fiU0AEvnup.jpg","https://t.co/UmpRBiAS7T","https://twitter.com/SenKamalaHarris/status/857653079910625282/photo/1","photo","http://pbs.twimg.com/media/C-b-7fiU0AEvnup.jpg","https://t.co/UmpRBiAS7T","https://twitter.com/SenKamalaHarris/status/857653079910625282/photo/1",,,,"en",,,,,,,,,,,,,
"x857644013326872576",2017-04-27 17:14:01,"x803694179079458816","SenKamalaHarris","Nearly 1 in 7 girls report being absent from school because they fear for their safety. Read the @NWLC report: https://t.co/1fEtiqEYO4","TweetDeck",,,,FALSE,FALSE,100,65,,,"nwlc.org/resources/stop…","https://t.co/1fEtiqEYO4","https://nwlc.org/resources/stopping-school-pushout-overview-and-key-findings/",,,,,,,,,"x16967845","nwlc","en",,,,,,,,,,,,,
"x857624886902226944",2017-04-27 15:58:01,"x803694179079458816","SenKamalaHarris","Trump’s “big” tax plan is a big giveaway to big business.","TweetDeck",,,,FALSE,FALSE,360,124,,,,,,,,,,,,,,,,"en",,,,,,,,,,,,,
"x857368702240423936",2017-04-26 23:00:02,"x803694179079458816","SenKamalaHarris","Today and every day it’s important we raise awareness about sexual violence &amp; support survivors. #DenimDay","TweetDeck",,,,FALSE,FALSE,325,79,"DenimDay",,,,,,,,,,,,,,,"en",,,,,,,,,,,,,
"x857338496557633536",2017-04-26 21:00:00,"x803694179079458816","SenKamalaHarris","A great group of kids came by my office to drop off a copy of the Lorax &amp; ask me to fight for the #ParisAgreement. I promise I will! https://t.co/1LZig591RH","TweetDeck",,,,FALSE,FALSE,487,101,"ParisAgreement",,,,,"http://pbs.twimg.com/media/C-WoCnvXgAA9Fbf.jpg","https://t.co/1LZig591RH","https://twitter.com/SenKamalaHarris/status/857338496557633536/photo/1","photo","http://pbs.twimg.com/media/C-WoCnvXgAA9Fbf.jpg","https://t.co/1LZig591RH","https://twitter.com/SenKamalaHarris/status/857338496557633536/photo/1",,,,"en",,,,,,,,,,,,,
"x857323402713026560",2017-04-26 20:00:02,"x803694179079458816","SenKamalaHarris","House Republicans believe they should get to keep their protections under Obamacare, but you shouldn’t. Call them &amp; tell them you disagree. https://t.co/eTtFVQUzdk","TweetDeck",,,,FALSE,FALSE,459,408,,,,,,"http://pbs.twimg.com/media/C-XK2AjXYAAPFZy.jpg","https://t.co/eTtFVQUzdk","https://twitter.com/SenKamalaHarris/status/857323402713026560/photo/1","photo","http://pbs.twimg.com/media/C-XK2AjXYAAPFZy.jpg","https://t.co/eTtFVQUzdk","https://twitter.com/SenKamalaHarris/status/857323402713026560/photo/1",,,,"en",,,,,,,,,,,,,
"x857241560039145472",2017-04-26 14:34:49,"x803694179079458816","SenKamalaHarris","The Republicans hatched a plan to repeal the ACA &amp; rip off Americans and then exempted themselves. Pathetic. https://t.co/ipWCpjy1Ee","Twitter Web Client",,,,FALSE,FALSE,1062,804,,,"vox.com/2017/4/25/1542…","https://t.co/ipWCpjy1Ee","http://www.vox.com/2017/4/25/15429982/gop-exemption-ahca-amendment",,,,,,,,,,,"en",,,,,,,,,,,,,
"x857036512164274178",2017-04-26 01:00:02,"x803694179079458816","SenKamalaHarris","It comes as no surprise that the country’s March for Science with the best backdrop was in California. https://t.co/RtURecAsQF","TweetDeck",,,,FALSE,FALSE,486,130,,,"mercedsunstar.com/news/article14…","https://t.co/RtURecAsQF","http://www.mercedsunstar.com/news/article146251284.html",,,,,,,,,,,"en",,,,,,,,,,,,,
"x857018889787461633",2017-04-25 23:50:00,"x803694179079458816","SenKamalaHarris","""Conversion-therapy” isn't therapy at all. Today, I cosponsored the first federal ban on this terrible practice.","TweetDeck",,,,FALSE,FALSE,5574,1593,,,,,,,,,,,,,,,,"en",,,,,,,,,,,,,
"x857010081501552640",2017-04-25 23:15:00,"x803694179079458816","SenKamalaHarris","Malaria can be prevented and cured. U.S. investments in global health have proven effective &amp; must continue. #WorldMalariaDay","TweetDeck",,,,FALSE,FALSE,254,64,"WorldMalariaDay",,,,,,,,,,,,,,,"en",,,,,,,,,,,,,
"x856998758470475776",2017-04-25 22:30:00,"x803694179079458816","SenKamalaHarris",".@CalState is helping undocumented students find support &amp; guidance. You can find resources here: https://t.co/Ow8pYuWHCN.","TweetDeck",,,,FALSE,FALSE,162,69,,,"www2.calstate.edu/attend/student…","https://t.co/Ow8pYuWHCN","https://www2.calstate.edu/attend/student-services/resources-for-undocumented-students/Pages/default.aspx",,,,,,,,,"x15967775","calstate","en",,,,,,,,,,,,,
"x856969818603479042",2017-04-25 20:35:01,"x803694179079458816","SenKamalaHarris","Congratulations to my friend @SenDuckworth who gave her first major speech on the Senate floor today. Watch it: https://t.co/wLlmllXbUE","TweetDeck",,,,FALSE,FALSE,456,83,,,"facebook.com/SenDuckworth/v…","https://t.co/wLlmllXbUE","https://www.facebook.com/SenDuckworth/videos/846830485490902/",,,,,,,,,"x1058520120","SenDuckworth","en",,,,,,,,,,,,,
"x856949683679145984",2017-04-25 19:15:00,"x803694179079458816","SenKamalaHarris","We have to ask ourselves, if the parents of these American kids get deported, what will happen to them?https://t.co/MHBD6Ris8g","TweetDeck",,,,FALSE,FALSE,297,181,,,"edsource.org/2017/1-in-8-ch…","https://t.co/MHBD6Ris8g","https://edsource.org/2017/1-in-8-children-in-california-schools-have-an-undocumented-parent/580621",,,,,,,,,,,"en",,,,,,,,,,,,,
"x856936724659929088",2017-04-25 18:23:30,"x803694179079458816","SenKamalaHarris","Just met with representatives from @LACCD to talk about how we can better support students. https://t.co/cFRMnDQmGu","Twitter Web Client",,,,FALSE,FALSE,99,17,,,,,,"http://pbs.twimg.com/media/C-Ry-rXXYAUB9Ax.jpg","https://t.co/cFRMnDQmGu","https://twitter.com/SenKamalaHarris/status/856936724659929088/photo/1","photo","http://pbs.twimg.com/media/C-Ry-rXXYAUB9Ax.jpg","https://t.co/cFRMnDQmGu","https://twitter.com/SenKamalaHarris/status/856936724659929088/photo/1",,"x19079988","laccd","en",,,,,,,,,,,,,
"x856666568348114944",2017-04-25 00:30:00,"x803694179079458816","SenKamalaHarris","Today, as we acknowledge humanity’s darkest hours, let us renew our vow to fight for the rights, dignity &amp; security of all. #NeverAgain.","TweetDeck",,,,FALSE,FALSE,586,164,"NeverAgain",,,,,,,,,,,,,,,"en",,,,,,,,,,,,,
"x856651469122138112",2017-04-24 23:30:00,"x803694179079458816","SenKamalaHarris","On this #YomHashoah we remember the 6 million Jewish men, women and children who were murdered for who they were and what they believed.","TweetDeck",,,,FALSE,FALSE,713,279,"YomHashoah",,,,,,,,,,,,,,,"en",,,,,,,,,,,,,
"x856632596939321344",2017-04-24 22:15:01,"x803694179079458816","SenKamalaHarris","Today, I stand with the Armenian community as we remember the horrors of the Armenian genocide that began 102 years ago.","TweetDeck",,,,FALSE,FALSE,623,142,,,,,,,,,,,,,,,,"en",,,,,,,,,,,,,
"x856607786804883456",2017-04-24 20:36:26,"x803694179079458816","SenKamalaHarris","The GOP's new health care bill would cause the premiums of Americans with pre-existing conditions to skyrocket.","Twitter Web Client",,,,FALSE,FALSE,352,285,,,,,,,,,,,,,,,,"en",,,,,,,,,,,,,
"x856538900973727745",2017-04-24 16:02:42,"x803694179079458816","SenKamalaHarris","Back in D.C. after a week in CA &amp; ready to fight for our values. On Trump’s agenda: another attempt to rip away insurance from millions.","Twitter Web Client",,,,FALSE,FALSE,788,188,,,,,,,,,,,,,,,,"en",,,,,,,,,,,,,
"x856306690785988608",2017-04-24 00:39:59,"x803694179079458816","SenKamalaHarris","ICYMI: I wrote an essay celebrating my friend @SenWarren for the #TIME100 https://t.co/DroCX21JuN","Twitter for iPhone",,,,FALSE,FALSE,271,53,"TIME100",,"time.com/collection/201…","https://t.co/DroCX21JuN","http://time.com/collection/2017-time-100/4736325/elizabeth-warren/",,,,,,,,,"x970207298","SenWarren","en",,,,,,,,,,,,,
"x856274372126019584",2017-04-23 22:31:33,"x803694179079458816","SenKamalaHarris","It’s always great to be home, thank you to everyone who joined me Friday at my town hall! https://t.co/916js8QIco","Twitter for iPhone",,,,FALSE,FALSE,290,43,,,"abc7.com/politics/sen-k…","https://t.co/916js8QIco","http://abc7.com/politics/sen-kamala-harris-holds-town-hall-at-south-la-church/1901621/",,,,,,,,,,,"en",,,,,,,,,,,,,
"x856248720215748609",2017-04-23 20:49:37,"x803694179079458816","SenKamalaHarris","Inspired by all those around the world who marched in defense of science yesterday. https://t.co/5QWlwSoZwG","Twitter Web Client",,,,FALSE,FALSE,504,89,,,"cnn.com/2017/04/22/hea…","https://t.co/5QWlwSoZwG","http://www.cnn.com/2017/04/22/health/global-march-for-science/",,,,,,,,,,,"en",,,,,,,,,,,,,
"x856209359101194243",2017-04-23 18:13:13,"x803694179079458816","SenKamalaHarris","This week we celebrated conservation advocate John Muir. I’ve sponsored a bill to expand @JohnMuirNPS so we can better preserve his legacy.","Twitter for iPhone",,,,FALSE,FALSE,365,67,,,,,,,,,,,,,,"x3302474898","JohnMuirNPS","en",,,,,,,,,,,,,
"x856145650102280192",2017-04-23 14:00:04,"x803694179079458816","SenKamalaHarris","Trump’s border wall is just a stupid use of money. I will fight any funding for it. https://t.co/lHYnxvPd0h","TweetDeck",,,,FALSE,FALSE,1615,271,,,"thehill.com/blogs/blog-bri…","https://t.co/lHYnxvPd0h","http://thehill.com/blogs/blog-briefing-room/news/330024-kamala-harris-trumps-border-wall-just-a-stupid-use-of-money",,,,,,,,,,,"en",,,,,,,,,,,,,
"x855891460138295296",2017-04-22 21:10:00,"x803694179079458816","SenKamalaHarris","Leaving scientist positions across the government vacant is an attack on science. #MarchForScience","TweetDeck",,,,FALSE,FALSE,1090,361,"MarchForScience",,,,,,,,,,,,,,,"en",,,,,,,,,,,,,
"x855876361675612160",2017-04-22 20:10:00,"x803694179079458816","SenKamalaHarris","Cutting the @EPA's budget is an attack on science. #MarchForScience","TweetDeck",,,,FALSE,FALSE,906,285,"MarchForScience",,,,,,,,,,,,,"x14615871","EPA","en",,,,,,,,,,,,,
"x855862530219974656",2017-04-22 19:15:03,"x803694179079458816","SenKamalaHarris","Cutting the budget for medical research is an attack on science. #ScienceMarch https://t.co/HcPs28o3zT","Media Studio",,,,FALSE,FALSE,303,156,"ScienceMarch",,,,,"http://pbs.twimg.com/media/C9OJ4I9XUAE18ad.jpg","https://t.co/HcPs28o3zT","https://twitter.com/SenKamalaHarris/status/855862530219974656/photo/1","photo","http://pbs.twimg.com/media/C9OJ4I9XUAE18ad.jpg","https://t.co/HcPs28o3zT","https://twitter.com/SenKamalaHarris/status/855862530219974656/photo/1",,,,"en",,,,,,,,,,,,,
"x855846413862805504",2017-04-22 18:11:00,"x803694179079458816","SenKamalaHarris","Appointing an EPA chief who is a climate change denier is an attack on science. #ScienceMarch","TweetDeck",,,,FALSE,FALSE,1174,411,"ScienceMarch",,,,,,,,,,,,,,,"en",,,,,,,,,,,,,
"x855831064446722049",2017-04-22 17:10:00,"x803694179079458816","SenKamalaHarris","Science is under attack by this administration &amp; it’s not just climate science, it’s tech. development &amp; medical research too. #ScienceMarch","TweetDeck",,,,FALSE,FALSE,2048,858,"ScienceMarch",,,,,,,,,,,,,,,"en",,,,,,,,,,,,,
"x855816949338693633",2017-04-22 16:13:55,"x803694179079458816","SenKamalaHarris","Happy Earth Day! https://t.co/brOKUR3DqE","Media Studio",,,,FALSE,FALSE,889,230,,,,,,"http://pbs.twimg.com/tweet_video_thumb/C-B429_XUAA-YyH.jpg","https://t.co/brOKUR3DqE","https://twitter.com/SenKamalaHarris/status/855816949338693633/photo/1","photo","http://pbs.twimg.com/tweet_video_thumb/C-B429_XUAA-YyH.jpg","https://t.co/brOKUR3DqE","https://twitter.com/SenKamalaHarris/status/855816949338693633/photo/1",,,,"en",,,,,,,,,,,,,
"x855608248044539904",2017-04-22 02:24:37,"x803694179079458816","SenKamalaHarris","Yesterday, I held an economic roundtable in Los Angeles to talk about investing in job training for the future. https://t.co/d5VUWj9lzO","Twitter for iPhone",,,,FALSE,FALSE,240,52,,,"abc7.com/education/sen-…","https://t.co/d5VUWj9lzO","http://abc7.com/education/sen-kamala-harris-concerned-about-cuts-to-technical-education/1898696/",,,,,,,,,,,"en",,,,,,,,,,,,,
"x855517155827298309",2017-04-21 20:22:39,"x803694179079458816","SenKamalaHarris","Yesterday Trump hit his 90-day deadline, and “There is no team, there is no plan...”  https://t.co/R6BODrTrQE","Twitter Web Client",,,,FALSE,FALSE,405,185,,,"politico.com/story/2017/04/…","https://t.co/R6BODrTrQE","http://www.politico.com/story/2017/04/20/trump-cybersecurity-hackers-237385",,,,,,,,,,,"en",,,,,,,,,,,,,
"x855495288043302914",2017-04-21 18:55:45,"x803694179079458816","SenKamalaHarris","“EPA Chief Scott Pruitt Continues Dirty Energy Tour” https://t.co/syKrQCx21n","Twitter Web Client",,,,FALSE,FALSE,195,148,,,"huffingtonpost.com/entry/scott-pr…","https://t.co/syKrQCx21n","http://www.huffingtonpost.com/entry/scott-pruitt-tour-missouri-coal_us_58f8cb29e4b018a9ce58d23a",,,,,,,,,,,"en",,,,,,,,,,,,,
"x855477482597765120",2017-04-21 17:45:00,"x803694179079458816","SenKamalaHarris","Admission to a bunch of National Parks is free this weekend, a great opportunity to explore. #FindYourPark: https://t.co/XE5Ji9Kibb.","TweetDeck",,,,FALSE,FALSE,187,76,"FindYourPark",,"nps.gov/findapark/inde…","https://t.co/XE5Ji9Kibb","https://www.nps.gov/findapark/index.htm",,,,,,,,,,,"en",,,,,,,,,,,,,
"x855462943290478593",2017-04-21 16:47:14,"x803694179079458816","SenKamalaHarris","This is a moral issue. These are the questions we need to be asking ourselves as a country. https://t.co/Brm96AyP40","Twitter Web Client",,,,FALSE,FALSE,268,147,,,"calmatters.org/articles/depor…","https://t.co/Brm96AyP40","https://calmatters.org/articles/deportations-orphans-cares-children-parents-sent-away/",,,,,,,,,,,"en",,,,,,,,,,,,,
"x855202421227892736",2017-04-20 23:32:00,"x803694179079458816","SenKamalaHarris","The Trump administration's proposed $16 million cuts to the @EPA would result in more kids with lead poisoning. https://t.co/toEb71vZZU","TweetDeck",,,,FALSE,FALSE,234,206,,,"mercurynews.com/2017/04/19/tru…","https://t.co/toEb71vZZU","http://www.mercurynews.com/2017/04/19/trump-epa-cuts-lead-prevention-oakand-fruitvale/",,,,,,,,,"x14615871","EPA","en",,,,,,,,,,,,,
"x855167867939061760",2017-04-20 21:14:42,"x803694179079458816","SenKamalaHarris","Join me on Facebook live tomorrow at 3:30 PM PST for a town hall in Los Angeles. #AskKamala https://t.co/LoYkmt7ac2","Twitter Web Client",,,,FALSE,FALSE,91,33,"AskKamala",,,,,"http://pbs.twimg.com/media/C94qZNGWAAAMM2w.jpg","https://t.co/LoYkmt7ac2","https://twitter.com/SenKamalaHarris/status/855167867939061760/photo/1","photo","http://pbs.twimg.com/media/C94qZNGWAAAMM2w.jpg","https://t.co/LoYkmt7ac2","https://twitter.com/SenKamalaHarris/status/855167867939061760/photo/1",,,,"en",,,,,,,,,,,,,
"x855149575761428487",2017-04-20 20:02:01,"x803694179079458816","SenKamalaHarris","Compelling story about a Humboldt State University student caught in the chaos of Trump’s Muslim Ban. #NoBanNoWall https://t.co/WZgAcvDPAB","TweetDeck",,,,FALSE,FALSE,90,51,"NoBanNoWall",,"northcoastjournal.com/humboldt/banne…","https://t.co/WZgAcvDPAB","http://www.northcoastjournal.com/humboldt/banned/Content?oid=4839078",,,,,,,,,,,"en",,,,,,,,,,,,,
"x855124912343838720",2017-04-20 18:24:01,"x803694179079458816","SenKamalaHarris","EPA regulations aren’t just about environmental protection, they’re about human protection. https://t.co/RtsZqGuYNU","TweetDeck",,,,FALSE,FALSE,380,179,,,"theguardian.com/us-news/2017/a…","https://t.co/RtsZqGuYNU","https://www.theguardian.com/us-news/2017/apr/17/california-pesticides-central-valley-trump",,,,,,,,,,,"en",,,,,,,,,,,,,
"x855099995422314496",2017-04-20 16:45:00,"x803694179079458816","SenKamalaHarris","#EveryoneBelongsHere. https://t.co/4v5q9dZ0Yi","TweetDeck",,,,FALSE,FALSE,168,72,"EveryoneBelongsHere",,"ww2.kqed.org/stateofhealth/…","https://t.co/4v5q9dZ0Yi","https://ww2.kqed.org/stateofhealth/2017/04/19/pediatricians-see-more-trump-related-trauma-in-kids/",,,,,,,,,,,"und",,,,,,,,,,,,,
"x855052019303895040",2017-04-20 13:34:22,"x803694179079458816","SenKamalaHarris",".@SenWarren persists, and we’re lucky she does. It’s an honor to write this year’s #Time100 tribute to her. https://t.co/DroCX21JuN","Twitter for iPhone",,,,FALSE,FALSE,1050,228,"Time100",,"time.com/collection/201…","https://t.co/DroCX21JuN","http://time.com/collection/2017-time-100/4736325/elizabeth-warren/",,,,,,,,,"x970207298","SenWarren","en",,,,,,,,,,,,,
"x854818139237785601",2017-04-19 22:05:00,"x803694179079458816","SenKamalaHarris","I will stand and fight on behalf of California’s more than 250,000 DREAMers.","TweetDeck",,,,FALSE,FALSE,1193,182,,,,,,,,,,,,,,,,"en",,,,,,,,,,,,,
"x854801790084186113",2017-04-19 21:00:02,"x803694179079458816","SenKamalaHarris","Remarkable: DJ (age 12) started an ongoing river cleanup project. He's already cleaned up 2,215 lbs. of trash! https://t.co/lmiR4AMPUK","TweetDeck",,,,FALSE,FALSE,403,100,,,"pressdemocrat.com/news/6898734-1…","https://t.co/lmiR4AMPUK","http://www.pressdemocrat.com/news/6898734-181/petaluma-boy-pulls-2215-pounds?artslide=0",,,,,,,,,,,"en",,,,,,,,,,,,,
"x854786695585083392",2017-04-19 20:00:04,"x803694179079458816","SenKamalaHarris","I sat down to talk with @NBCBayArea yesterday. My message: we have to keep fighting. https://t.co/nkn2oDPBWg","TweetDeck",,,,FALSE,FALSE,229,49,,,"nbcbayarea.com/news/local/Sen…","https://t.co/nkn2oDPBWg","http://www.nbcbayarea.com/news/local/Sen-Kamala-Harris-in-Bay-Area-to-Talk-About-Trump-Future-419799104.html",,,,,,,,,"x20097362","nbcbayarea","en",,,,,,,,,,,,,
"x854766809790238725",2017-04-19 18:41:02,"x803694179079458816","SenKamalaHarris","Trump family companies don’t always follow his “Hire American, buy American” slogan… https://t.co/Tdm2EeCl2z","Twitter Web Client",,,,FALSE,FALSE,551,305,,,"nbcnews.com/news/us-news/t…","https://t.co/Tdm2EeCl2z","http://www.nbcnews.com/news/us-news/trumps-made-america-slogan-doesnt-fit-ivankas-clothing-line-n743056",,,,,,,,,,,"en",,,,,,,,,,,,,
"x854715052196319232",2017-04-19 15:15:22,"x803694179079458816","SenKamalaHarris","Our country made a promise to these kids. This Administration’s decision to break that promise is callous. https://t.co/BN4wjHBEXK","Twitter Web Client",,,,FALSE,FALSE,611,336,,,"usatoday.com/story/news/wor…","https://t.co/BN4wjHBEXK","https://www.usatoday.com/story/news/world/2017/04/19/trump-increases-deportations-former-dreamers/100609524/",,,,,,,,,,,"en",,,,,,,,,,,,,
"x854496109938577408",2017-04-19 00:45:23,"x803694179079458816","SenKamalaHarris","A model for others. Paid maternity leave makes good economic sense. https://t.co/iF0T8fK2Vd","Twitter for iPhone",,,,FALSE,FALSE,515,99,,,"buzzfeed.com/coralewis/wome…","https://t.co/iF0T8fK2Vd","https://www.buzzfeed.com/coralewis/women-ironworkers-will-get-six-months-of-paid-maternity?utm_term=.ipAQo85Be",,,,,,,,,,,"en",,,,,,,,,,,,,
"x854395105578553344",2017-04-18 18:04:01,"x803694179079458816","SenKamalaHarris","On #TaxDay, a reminder that undocumented immigrants pay taxes. https://t.co/peJSzigfHk","TweetDeck",,,,FALSE,FALSE,541,315,"TaxDay",,"vox.com/policy-and-pol…","https://t.co/peJSzigfHk","http://www.vox.com/policy-and-politics/2017/4/17/15290950/undocumented-immigrants-file-tax-returns",,,,,,,,,,,"en",,,,,,,,,,,,,
"x854375233356091392",2017-04-18 16:45:03,"x803694179079458816","SenKamalaHarris","A reminder that I’ll take some of your tweeted questions at my town hall in Los Angeles on Friday. Keep tweeting at me. #AskKamala https://t.co/jjqV2IdQrt","Media Studio",,,,FALSE,FALSE,204,78,"AskKamala",,,,,"http://pbs.twimg.com/media/C9tQcjMXkAAtcAe.jpg","https://t.co/jjqV2IdQrt","https://twitter.com/SenKamalaHarris/status/854375233356091392/photo/1","photo","http://pbs.twimg.com/media/C9tQcjMXkAAtcAe.jpg","https://t.co/jjqV2IdQrt","https://twitter.com/SenKamalaHarris/status/854375233356091392/photo/1",,,,"en",,,,,,,,,,,,,
"x854346164820488192",2017-04-18 14:49:33,"x803694179079458816","SenKamalaHarris","The future is female (&amp; green &amp; renewable). https://t.co/Ux7BliiF3z","Twitter Web Client",,,,FALSE,FALSE,423,102,,,"ksby.com/story/35154112…","https://t.co/Ux7BliiF3z","http://www.ksby.com/story/35154112/cal-poly-freshman-to-drive-in-solar-powered-vehicle-speed-record-attempt",,,,,,,,,,,"en",,,,,,,,,,,,,
"x854092110475083776",2017-04-17 22:00:02,"x803694179079458816","SenKamalaHarris","Californians, are you 16 or 17 and excited to vote? You can now pre-register. https://t.co/J4mOQZBjkB","TweetDeck",,,,FALSE,FALSE,1606,854,,,"latimes.com/local/educatio…","https://t.co/J4mOQZBjkB","http://www.latimes.com/local/education/la-essential-education-updates-southern-most-of-california-s-16-and-1492209759-htmlstory.html",,,,,,,,,,,"en",,,,,,,,,,,,,
"x854073233842348036",2017-04-17 20:45:01,"x803694179079458816","SenKamalaHarris","The Trump Administration has been giving secret waivers to get around ethics rules. https://t.co/mfKk95jw0Z","TweetDeck",,,,FALSE,FALSE,285,261,,,"nyti.ms/2oemoXa","https://t.co/mfKk95jw0Z","https://nyti.ms/2oemoXa",,,,,,,,,,,"en",,,,,,,,,,,,,
"x854053739149365249",2017-04-17 19:27:33,"x803694179079458816","SenKamalaHarris","The Administration’s mass deportation force is real, and it's jeopardizing public safety &amp; tearing families apart. https://t.co/QNqZWl8V67","TweetDeck",,,,FALSE,FALSE,339,263,,,"wapo.st/2oE5fsY?tid=ss…","https://t.co/QNqZWl8V67","http://wapo.st/2oE5fsY?tid=ss_tw",,,,,,,,,,,"en",,,,,,,,,,,,,
"x854027932670468096",2017-04-17 17:45:00,"x803694179079458816","SenKamalaHarris","It’s a huge honor to be recognized by @Essence alongside these talented &amp; brilliant women. #StayWoke https://t.co/heLE6xOd5V","TweetDeck",,,,FALSE,FALSE,249,49,"StayWoke",,"essence.com/entertainment/…","https://t.co/heLE6xOd5V","http://www.essence.com/entertainment/100-woke-women-may-2017-issue",,,,,,,,,"x27677483","Essence","en",,,,,,,,,,,,,
"x854018019688947712",2017-04-17 17:05:37,"x803694179079458816","SenKamalaHarris","Last week I traveled to the Middle East to meet with CA servicemembers &amp; other U.S. personnel in the region. https://t.co/69GLtFy3Qo https://t.co/9M47m2o9KH","Twitter Web Client",,,,FALSE,FALSE,314,49,,,"harris.senate.gov/content/senato…","https://t.co/69GLtFy3Qo","https://www.harris.senate.gov/content/senator-harris-returns-trip-middle-east","http://pbs.twimg.com/media/C9oTfXDWsAIl0Ch.jpg","https://t.co/9M47m2o9KH","https://twitter.com/SenKamalaHarris/status/854018019688947712/photo/1","photo","http://pbs.twimg.com/media/C9oTfXDWsAIl0Ch.jpg","https://t.co/9M47m2o9KH","https://twitter.com/SenKamalaHarris/status/854018019688947712/photo/1",,,,"en",,,,,,,,,,,,,
"x853977516624752641",2017-04-17 14:24:40,"x803694179079458816","SenKamalaHarris",".@EPAScottPruitt wants to take the EPA “back to basics,” like back when Los Angeles looked like this? https://t.co/7DaYr1wszG","Twitter Web Client",,,,FALSE,FALSE,1010,699,,,,,,"http://pbs.twimg.com/media/C9nvWpFW0AAXu0q.jpg","https://t.co/7DaYr1wszG","https://twitter.com/SenKamalaHarris/status/853977516624752641/photo/1","photo","http://pbs.twimg.com/media/C9nvWpFW0AAXu0q.jpg","https://t.co/7DaYr1wszG","https://twitter.com/SenKamalaHarris/status/853977516624752641/photo/1",,"x832672006113931269","EPAScottPruitt","en",,,,,,,,,,,,,
"x853752370051903489",2017-04-16 23:30:01,"x803694179079458816","SenKamalaHarris","Proud of California's leadership in combating climate change, but we need help.
https://t.co/wYzClB5Y5H","TweetDeck",,,,FALSE,FALSE,371,108,,,"latimes.com/politics/la-po…","https://t.co/wYzClB5Y5H","http://www.latimes.com/politics/la-pol-sac-california-national-climate-leadership-20170415-story.html",,,,,,,,,,,"en",,,,,,,,,,,,,
"x853691971281592321",2017-04-16 19:30:01,"x803694179079458816","SenKamalaHarris","Still taking your questions for my town hall in Los Angeles on Friday. Tweet them at me! #AskKamala","TweetDeck",,,,FALSE,FALSE,219,69,"AskKamala",,,,,,,,,,,,,,,"en",,,,,,,,,,,,,
"x853661771621687297",2017-04-16 17:30:01,"x803694179079458816","SenKamalaHarris","""Mexican tourists don't want to visit Trump's America. It will cost us billions."" https://t.co/suGAKbdRuU","TweetDeck",,,,FALSE,FALSE,399,171,,,"lat.ms/2oGN3zj","https://t.co/suGAKbdRuU","http://lat.ms/2oGN3zj",,,,,,,,,,,"en",,,,,,,,,,,,,
"x853639124405899264",2017-04-16 16:00:01,"x803694179079458816","SenKamalaHarris","This - right here - is why we need to be a leader in combating climate change &amp; not back out of the Paris Agreement.
https://t.co/5DiwDJkQ7D","TweetDeck",,,,FALSE,FALSE,389,202,,,"washingtonpost.com/news/energy-en…","https://t.co/5DiwDJkQ7D","https://www.washingtonpost.com/news/energy-environment/wp/2017/04/15/nasa-just-snapped-the-first-photos-of-a-new-crack-in-one-of-greenlands-largest-glaciers/",,,,,,,,,,,"en",,,,,,,,,,,,,
"x853607910856949761",2017-04-16 13:55:59,"x803694179079458816","SenKamalaHarris","Easter reminds us of the importance of hope &amp; the promise of new beginnings. #HappyEaster to all the families celebrating today.","Twitter Web Client",,,,FALSE,FALSE,304,54,"HappyEaster",,,,,,,,,,,,,,,"en",,,,,,,,,,,,,
