"status_id","created_at","user_id","screen_name","text","source","reply_to_status_id","reply_to_user_id","reply_to_screen_name","is_quote","is_retweet","favorite_count","retweet_count","hashtags","symbols","urls_url","urls_t.co","urls_expanded_url","media_url","media_t.co","media_expanded_url","media_type","ext_media_url","ext_media_t.co","ext_media_expanded_url","ext_media_type","mentions_user_id","mentions_screen_name","lang","quoted_status_id","quoted_text","retweet_status_id","retweet_text","place_url","place_name","place_full_name","place_type","country","country_code","geo_coords","coords_coords","bbox_coords"
"x173062251736072196",2012-02-24 15:10:30,"x19318314","repbenraylujan","News: Luján Writes to NNSA Administrator Regarding Plan to Reduce LANL Workforce http://t.co/1cl9gFax","twitterfeed",,,,FALSE,FALSE,0,1,,,"1.usa.gov/zpgJ5v","http://t.co/1cl9gFax","http://1.usa.gov/zpgJ5v",,,,,,,,,,,"en",,,,,,,,,,,,,
"x172331557816766465",2012-02-22 14:46:59,"x19318314","repbenraylujan","Blog: Rep. Luján’s Staff to Hold Open Office Hours Across Northern New Mexico on Thursday, Feb. 23 http://t.co/h24QoY5E","twitterfeed",,,,FALSE,FALSE,0,1,,,"1.usa.gov/zz0T0O","http://t.co/h24QoY5E","http://1.usa.gov/zz0T0O",,,,,,,,,,,"en",,,,,,,,,,,,,
"x170624878494494720",2012-02-17 21:45:15,"x19318314","repbenraylujan","News: Luján: Report Examining Stewardship of Scientific and Engineering Capability at NNSA Labs ... http://t.co/yiAI4Tit","twitterfeed",,,,FALSE,FALSE,0,3,,,"1.usa.gov/wByuPT","http://t.co/yiAI4Tit","http://1.usa.gov/wByuPT",,,,,,,,,,,"en",,,,,,,,,,,,,
"x170578408558964736",2012-02-17 18:40:36,"x19318314","repbenraylujan","News: Luján Votes to Extend Payroll Tax Cut for Hard-Working New Mexicans http://t.co/wu6lx6LY","twitterfeed",,,,FALSE,FALSE,0,0,,,"1.usa.gov/AoG4Vu","http://t.co/wu6lx6LY","http://1.usa.gov/AoG4Vu",,,,,,,,,,,"en",,,,,,,,,,,,,
"x170321262344798208",2012-02-17 01:38:48,"x19318314","repbenraylujan","News: Luján Cosponsors DISCLOSE Act to Increase Transparency in Elections http://t.co/9pkfuVdu","twitterfeed",,,,FALSE,FALSE,0,1,,,"1.usa.gov/woKmMR","http://t.co/9pkfuVdu","http://1.usa.gov/woKmMR",,,,,,,,,,,"en",,,,,,,,,,,,,
"x169464352125100032",2012-02-14 16:53:44,"x19318314","repbenraylujan","News: Luján Highlights President’s Blueprint to Train Workers for ... http://t.co/UVkUqTyI","twitterfeed",,,,FALSE,FALSE,0,1,,,"1.usa.gov/x0nFtX","http://t.co/UVkUqTyI","http://1.usa.gov/x0nFtX",,,,,,,,,,,"en",,,,,,,,,,,,,
"x167696349100388353",2012-02-09 19:48:19,"x19318314","repbenraylujan","News: Luján Votes to Reform Washington by Strengthening Rules Against Insider Trading http://t.co/mxRBzWJ6","twitterfeed",,,,FALSE,FALSE,0,2,,,"1.usa.gov/zLbLm3","http://t.co/mxRBzWJ6","http://1.usa.gov/zLbLm3",,,,,,,,,,,"en",,,,,,,,,,,,,
"x167298794352951297",2012-02-08 17:28:35,"x19318314","repbenraylujan","Blog: Luján to Hold ‘Conversations with Ben Ray’ in Raton on Friday, Feb. 10 http://t.co/PkMYD9t2","twitterfeed",,,,FALSE,FALSE,0,0,,,"1.usa.gov/zMtQWk","http://t.co/PkMYD9t2","http://1.usa.gov/zMtQWk",,,,,,,,,,,"en",,,,,,,,,,,,,
"x164875340022415361",2012-02-02 00:58:38,"x19318314","repbenraylujan","Blog: Luján to Hold Open Office Hours in Las Vegas on Saturday, Feb. 4 http://t.co/8B3cl13P","twitterfeed",,,,FALSE,FALSE,0,1,,,"1.usa.gov/zwKu8W","http://t.co/8B3cl13P","http://1.usa.gov/zwKu8W",,,,,,,,,,,"en",,,,,,,,,,,,,
"x164857341882281984",2012-02-01 23:47:07,"x19318314","repbenraylujan","News: Luján Cosponsors Legislation to Block Congressional Pay Raise http://t.co/FM0LVMqt","twitterfeed",,,,FALSE,FALSE,0,2,,,"1.usa.gov/yW9bA8","http://t.co/FM0LVMqt","http://1.usa.gov/yW9bA8",,,,,,,,,,,"en",,,,,,,,,,,,,
"x164759191221837825",2012-02-01 17:17:06,"x19318314","repbenraylujan","News: Luján: New Report Reinforces the Need to Extend the Payroll Tax Cut http://t.co/qE9Zkc8g","twitterfeed",,,,FALSE,FALSE,0,2,,,"1.usa.gov/zSI2u1","http://t.co/qE9Zkc8g","http://1.usa.gov/zSI2u1",,,,,,,,,,,"en",,,,,,,,,,,,,
"x162215644182491136",2012-01-25 16:49:58,"x19318314","repbenraylujan","It's been an honor 2 serve w/ Gabby #Giffords and she will be missed in the House. She's an inspiration 2 so many. I wish her the best.","Twitter Web Client",,,,FALSE,FALSE,0,1,"Giffords",,,,,,,,,,,,,,,"en",,,,,,,,,,,,,
"x162038648131424256",2012-01-25 05:06:38,"x19318314","repbenraylujan","News: Luján Statement on the President’s State of the Union Address http://t.co/ThETNGTc","twitterfeed",,,,FALSE,FALSE,1,2,,,"1.usa.gov/wrWJ1T","http://t.co/ThETNGTc","http://1.usa.gov/wrWJ1T",,,,,,,,,,,"en",,,,,,,,,,,,,
"x161906018236899328",2012-01-24 20:19:37,"x19318314","repbenraylujan","Blog: Rep. Luján’s Staff to Hold Mobile Office Hours Across Northern New Mexico on Thursday, Jan. 26 http://t.co/LVLmSDMD","twitterfeed",,,,FALSE,FALSE,0,0,,,"1.usa.gov/x0BcPN","http://t.co/LVLmSDMD","http://1.usa.gov/x0BcPN",,,,,,,,,,,"en",,,,,,,,,,,,,
"x157949545890852864",2012-01-13 22:18:00,"x19318314","repbenraylujan","News: Luján Statement Celebrating Martin Luther King, Jr. Day http://t.co/OITkopio","twitterfeed",,,,FALSE,FALSE,0,0,,,"1.usa.gov/ydos5V","http://t.co/OITkopio","http://1.usa.gov/ydos5V",,,,,,,,,,,"en",,,,,,,,,,,,,
"x157152018333564928",2012-01-11 17:28:55,"x19318314","repbenraylujan","Blog: Luján to Hold ‘Conversations with Ben Ray’ in Chama on Friday, January 13 http://t.co/u40A6h4I","twitterfeed",,,,FALSE,FALSE,0,1,,,"1.usa.gov/wCjM5y","http://t.co/u40A6h4I","http://1.usa.gov/wCjM5y",,,,,,,,,,,"en",,,,,,,,,,,,,
"x150042122622480384",2011-12-23 02:36:44,"x19318314","repbenraylujan","News: Luján Statement on Two-Month Extension of the Payroll Tax Cut http://t.co/0zF1ZAwD","twitterfeed",,,,FALSE,FALSE,0,3,,,"1.usa.gov/vGnIxE","http://t.co/0zF1ZAwD","http://1.usa.gov/vGnIxE",,,,,,,,,,,"en",,,,,,,,,,,,,
"x149220672969773056",2011-12-20 20:12:35,"x19318314","repbenraylujan","News: Luján: House Republicans Threaten Tax Increase on Hard-Working New Mexicans http://t.co/ZEUNxm3c","twitterfeed",,,,FALSE,FALSE,0,0,,,"1.usa.gov/vMPQs8","http://t.co/ZEUNxm3c","http://1.usa.gov/vMPQs8",,,,,,,,,,,"en",,,,,,,,,,,,,
"x147819171114262528",2011-12-16 23:23:31,"x19318314","repbenraylujan","Blog: Buying Local This Holiday Season http://t.co/a328mpFT","twitterfeed",,,,FALSE,FALSE,0,0,,,"1.usa.gov/s6j22k","http://t.co/a328mpFT","http://1.usa.gov/s6j22k",,,,,,,,,,,"en",,,,,,,,,,,,,
"x147412785419137026",2011-12-15 20:28:41,"x19318314","repbenraylujan","News: Luján Statement on the End of the War in Iraq http://t.co/Z9RGIrZy","twitterfeed",,,,FALSE,FALSE,0,1,,,"1.usa.gov/uQrbVa","http://t.co/Z9RGIrZy","http://1.usa.gov/uQrbVa",,,,,,,,,,,"en",,,,,,,,,,,,,
"x146751475740180480",2011-12-14 00:40:52,"x19318314","repbenraylujan","News: Luján: Republican Bill Protects Top One Percent While Asking More From the Middle Class http://t.co/VKUlHeNm","twitterfeed",,,,FALSE,FALSE,0,1,,,"1.usa.gov/ssqSgQ","http://t.co/VKUlHeNm","http://1.usa.gov/ssqSgQ",,,,,,,,,,,"en",,,,,,,,,,,,,
"x144855745026998272",2011-12-08 19:07:55,"x19318314","repbenraylujan","News: Luján Honors the World War II Service of Navajo Code Talkers http://t.co/4vPX9hsz","twitterfeed",,,,FALSE,FALSE,0,1,,,"1.usa.gov/v8yulE","http://t.co/4vPX9hsz","http://1.usa.gov/v8yulE",,,,,,,,,,,"ro",,,,,,,,,,,,,
"x144178984861696000",2011-12-06 22:18:43,"x19318314","repbenraylujan","Blog: SBA Disaster Assistance Available to New Mexico Private, Nonprofit Organizations http://t.co/lmDoQdKX","twitterfeed",,,,FALSE,FALSE,0,0,,,"1.usa.gov/so6OLM","http://t.co/lmDoQdKX","http://1.usa.gov/so6OLM",,,,,,,,,,,"en",,,,,,,,,,,,,
"x138688072136138752",2011-11-21 18:39:47,"x19318314","repbenraylujan","News: Luján Statement on Native American Heritage Month http://t.co/K8gwi9AO","twitterfeed",,,,FALSE,FALSE,0,1,,,"1.usa.gov/uhUDjf","http://t.co/K8gwi9AO","http://1.usa.gov/uhUDjf",,,,,,,,,,,"ro",,,,,,,,,,,,,
"x137639631125626882",2011-11-18 21:13:39,"x19318314","repbenraylujan","Blog: Luján to Hold ‘Conversations with Ben Ray’ in Edgewood on Saturday, Nov 19 http://t.co/jphWEIQL","twitterfeed",,,,FALSE,FALSE,0,0,,,"1.usa.gov/uZnJTp","http://t.co/jphWEIQL","http://1.usa.gov/uZnJTp",,,,,,,,,,,"en",,,,,,,,,,,,,
"x136955245543690240",2011-11-16 23:54:09,"x19318314","repbenraylujan","News: Luján: Roosevelt County Telephone Cooperative to Receive $12 Million to Enhance Broadband Network http://t.co/u0eUlZMS","twitterfeed",,,,FALSE,FALSE,0,2,,,"1.usa.gov/uDtZZW","http://t.co/u0eUlZMS","http://1.usa.gov/uDtZZW",,,,,,,,,,,"en",,,,,,,,,,,,,
"x134791661904605184",2011-11-11 00:36:51,"x19318314","repbenraylujan","News: Luján Statement Celebrating Veterans Day http://t.co/qczEG0yw","twitterfeed",,,,FALSE,FALSE,0,1,,,"1.usa.gov/uxsvqd","http://t.co/qczEG0yw","http://1.usa.gov/uxsvqd",,,,,,,,,,,"und",,,,,,,,,,,,,
"x133962669203001344",2011-11-08 17:42:43,"x19318314","repbenraylujan","Thurs 11-4 ET, the VA is hosting a virtual online job fair 4 vets - view openings, apply 4 jobs. Visit http://t.co/uIavEs8Q 2 register.","Twitter Web Client",,,,FALSE,FALSE,0,1,,,"veteranscareerfair.com","http://t.co/uIavEs8Q","http://www.veteranscareerfair.com",,,,,,,,,,,"en",,,,,,,,,,,,,
"x132536232361209857",2011-11-04 19:14:34,"x19318314","repbenraylujan","News: Luján Introduces Heroes Hiring Heroes Act to Help Veterans Get Back to Work http://t.co/A3SS9xyC","twitterfeed",,,,FALSE,FALSE,0,1,,,"1.usa.gov/rDfrSc","http://t.co/A3SS9xyC","http://1.usa.gov/rDfrSc",,,,,,,,,,,"en",,,,,,,,,,,,,
"x131136052340588545",2011-10-31 22:30:45,"x19318314","repbenraylujan","News: Luján Applauds Obama’s Efforts to Spur Job Creation by Moving Technology from the Lab to the ... http://t.co/0Qw1UAvv","twitterfeed",,,,FALSE,FALSE,0,1,,,"1.usa.gov/s1c1GJ","http://t.co/0Qw1UAvv","http://1.usa.gov/s1c1GJ",,,,,,,,,,,"en",,,,,,,,,,,,,
"x131108854145630208",2011-10-31 20:42:41,"x19318314","repbenraylujan","Blog: Luján to Hold a Telephone Town Hall to Discuss Economic Issues on Wednesday Evening, Nov. 2 http://t.co/oTMgdgR5","twitterfeed",,,,FALSE,FALSE,0,0,,,"1.usa.gov/vzPKjK","http://t.co/oTMgdgR5","http://1.usa.gov/vzPKjK",,,,,,,,,,,"en",,,,,,,,,,,,,
"x129332702448070656",2011-10-26 23:04:53,"x19318314","repbenraylujan","News: Luján Applauds President Obama’s Move to Lower Student Loan Payments http://t.co/1dn22BLB","twitterfeed",,,,FALSE,FALSE,0,1,,,"1.usa.gov/trdxKb","http://t.co/1dn22BLB","http://1.usa.gov/trdxKb",,,,,,,,,,,"en",,,,,,,,,,,,,
"x129257188249190403",2011-10-26 18:04:49,"x19318314","repbenraylujan","Blog: Rep. Luján’s Staff to Hold Mobile Office Hours Across Northern New Mexico on Thursday, Oct. 27 http://t.co/Xx9lza61","twitterfeed",,,,FALSE,FALSE,0,0,,,"1.usa.gov/rSbPP5","http://t.co/Xx9lza61","http://1.usa.gov/rSbPP5",,,,,,,,,,,"en",,,,,,,,,,,,,
"x127520049278894080",2011-10-21 23:02:03,"x19318314","repbenraylujan","Blog: Luján to Partner with Santa Fe Leaders and Community Groups to Host Community Take Back Walk ... http://t.co/iFRGEl1u","twitterfeed",,,,FALSE,FALSE,0,1,,,"1.usa.gov/n1dVqt","http://t.co/iFRGEl1u","http://1.usa.gov/n1dVqt",,,,,,,,,,,"en",,,,,,,,,,,,,
"x127482874520801281",2011-10-21 20:34:20,"x19318314","repbenraylujan","News: Luján Statement on the Withdrawal of U.S. Troops From Iraq http://t.co/OqL0X8Ma","twitterfeed",,,,FALSE,FALSE,0,0,,,"1.usa.gov/oA1X54","http://t.co/OqL0X8Ma","http://1.usa.gov/oA1X54",,,,,,,,,,,"en",,,,,,,,,,,,,
"x127170356925575168",2011-10-20 23:52:30,"x19318314","repbenraylujan","News: Luján Hosts Innovation Workforce Development Summit http://t.co/t1frNIcs","twitterfeed",,,,FALSE,FALSE,0,0,,,"1.usa.gov/rueCMt","http://t.co/t1frNIcs","http://1.usa.gov/rueCMt",,,,,,,,,,,"en",,,,,,,,,,,,,
"x126815179613806593",2011-10-20 00:21:09,"x19318314","repbenraylujan","News: Luján: Cost of Living Adjustment for Social Security Recipients Will Benefit New Mexico’s Seniors http://t.co/xn2j1r3w","twitterfeed",,,,FALSE,FALSE,0,0,,,"1.usa.gov/p59SHc","http://t.co/xn2j1r3w","http://1.usa.gov/p59SHc",,,,,,,,,,,"en",,,,,,,,,,,,,
"x123878179571122178",2011-10-11 21:50:34,"x19318314","repbenraylujan","News: Luján Highlights Expedited Permitting Process for Navajo Gallup Water Supply Project http://t.co/ejGCV8Gs","twitterfeed",,,,FALSE,FALSE,0,2,,,"1.usa.gov/pQJT4F","http://t.co/ejGCV8Gs","http://1.usa.gov/pQJT4F",,,,,,,,,,,"en",,,,,,,,,,,,,
"x121680322780868608",2011-10-05 20:17:04,"x19318314","repbenraylujan","I joined House Dems 2 unveil #MakeItInAmerica documentary on our plan 2 help businesses create #jobs: http://t.co/0ExI0VoI","Twitter Web Client",,,,FALSE,FALSE,0,1,"MakeItInAmerica jobs",,"bit.ly/qVEZYY","http://t.co/0ExI0VoI","http://bit.ly/qVEZYY",,,,,,,,,,,"en",,,,,,,,,,,,,
"x121620733829988355",2011-10-05 16:20:17,"x19318314","repbenraylujan","4 Hispanic Heritage Month, House Dems highlight entrepreneur Abby Martinez of Los Ojos, NM - http://t.co/yHEolth5 #HHM2011","Twitter Web Client",,,,FALSE,FALSE,0,1,"HHM2011",,"bit.ly/qjpZF9","http://t.co/yHEolth5","http://bit.ly/qjpZF9",,,,,,,,,,,"en",,,,,,,,,,,,,
"x120978081996480512",2011-10-03 21:46:37,"x19318314","repbenraylujan","Blog: Small Business Owners: Share Your Ideas on How We Spur Job Creation and Strengthen Our Local ... http://t.co/nJtEfQSn","twitterfeed",,,,FALSE,FALSE,0,0,,,"1.usa.gov/oIZ0Ox","http://t.co/nJtEfQSn","http://1.usa.gov/oIZ0Ox",,,,,,,,,,,"en",,,,,,,,,,,,,
"x119547261876318209",2011-09-29 23:01:02,"x19318314","repbenraylujan","News: Luján Applauds EPA Plan to Cleanup Largest Abandoned Uranium Mine on Navajo Nation http://t.co/6axAmiVR","twitterfeed",,,,FALSE,FALSE,0,1,,,"1.usa.gov/pzAe5Q","http://t.co/6axAmiVR","http://1.usa.gov/pzAe5Q",,,,,,,,,,,"en",,,,,,,,,,,,,
"x118773857992704000",2011-09-27 19:47:49,"x19318314","repbenraylujan","Blog: Luján to Hold ‘Conversations with Ben Ray’ in Mora on Thursday, September 29 http://t.co/ehIrDtaR","twitterfeed",,,,FALSE,FALSE,0,1,,,"1.usa.gov/qJqsNs","http://t.co/ehIrDtaR","http://1.usa.gov/qJqsNs",,,,,,,,,,,"en",,,,,,,,,,,,,
"x118405951870091264",2011-09-26 19:25:53,"x19318314","repbenraylujan","News: Luján Announces Nearly $400,000 for San Juan College Through a Federal Grant http://t.co/xinxI9eR","twitterfeed",,,,FALSE,FALSE,0,0,,,"1.usa.gov/roF7Gd","http://t.co/xinxI9eR","http://1.usa.gov/roF7Gd",,,,,,,,,,,"en",,,,,,,,,,,,,
"x117326010780876800",2011-09-23 19:54:35,"x19318314","repbenraylujan","Blog: Luján to Host Service Academy Days in Rio Rancho and Los Alamos Next Week http://t.co/G6OhO8Kv","twitterfeed",,,,FALSE,FALSE,0,1,,,"1.usa.gov/rizJ7J","http://t.co/G6OhO8Kv","http://1.usa.gov/rizJ7J",,,,,,,,,,,"en",,,,,,,,,,,,,
"x116233612331978752",2011-09-20 19:33:47,"x19318314","repbenraylujan","Blog: Rep. Luján’s Staff to Hold Mobile Office Hours Across Northern New Mexico on Thursday, ... http://t.co/vPZibhfB","twitterfeed",,,,FALSE,FALSE,0,0,,,"1.usa.gov/poRsBi","http://t.co/vPZibhfB","http://1.usa.gov/poRsBi",,,,,,,,,,,"en",,,,,,,,,,,,,
"x115811314378612736",2011-09-19 15:35:43,"x19318314","repbenraylujan","News: Luján Announces $500,000 Grant for Northern New Mexico College to Encourage Continued Education http://t.co/ARJuNfvn","twitterfeed",,,,FALSE,FALSE,0,0,,,"1.usa.gov/ogQfZv","http://t.co/ARJuNfvn","http://1.usa.gov/ogQfZv",,,,,,,,,,,"en",,,,,,,,,,,,,
"x114481702134489088",2011-09-15 23:32:19,"x19318314","repbenraylujan","News: Luján Statement on Hispanic Heritage Month http://t.co/ZXGzIYAK","twitterfeed",,,,FALSE,FALSE,0,0,,,"1.usa.gov/qg6kEw","http://t.co/ZXGzIYAK","http://1.usa.gov/qg6kEw",,,,,,,,,,,"ro",,,,,,,,,,,,,
"x112262869697040385",2011-09-09 20:35:28,"x19318314","repbenraylujan","News: Luján Statement on the 10th Anniversary of the 9/11 Terrorist Attacks http://t.co/ZABlF0e","twitterfeed",,,,FALSE,FALSE,0,0,,,"1.usa.gov/n9KPj0","http://t.co/ZABlF0e","http://1.usa.gov/n9KPj0",,,,,,,,,,,"en",,,,,,,,,,,,,
"x111969771150520321",2011-09-09 01:10:48,"x19318314","repbenraylujan","News: Luján Statement on President Obama’s Jobs Plan http://t.co/0AJq2PF","twitterfeed",,,,FALSE,FALSE,0,0,,,"1.usa.gov/oC7dvg","http://t.co/0AJq2PF","http://1.usa.gov/oC7dvg",,,,,,,,,,,"en",,,,,,,,,,,,,
"x111937581540835328",2011-09-08 23:02:53,"x19318314","repbenraylujan","News: Luján Amendment Improves STEM Education in Charter Schools http://t.co/6NIQ3do","twitterfeed",,,,FALSE,FALSE,0,1,,,"1.usa.gov/r2q4Gs","http://t.co/6NIQ3do","http://1.usa.gov/r2q4Gs",,,,,,,,,,,"en",,,,,,,,,,,,,
"x111887318843015168",2011-09-08 19:43:10,"x19318314","repbenraylujan","News: Luján Encourages New Mexico’s National Labs and Military Bases to Contract More with Local ... http://t.co/uVrV9ej","twitterfeed",,,,FALSE,FALSE,0,1,,,"1.usa.gov/reefaZ","http://t.co/uVrV9ej","http://1.usa.gov/reefaZ",,,,,,,,,,,"en",,,,,,,,,,,,,
"x107146308229406720",2011-08-26 17:44:05,"x19318314","repbenraylujan","Blog: Luján to Hold ‘Conversations with Ben Ray’ in Tucumcari on Tuesday, August 30 http://t.co/ptCN3uP","twitterfeed",,,,FALSE,FALSE,0,0,,,"1.usa.gov/pCge3B","http://t.co/ptCN3uP","http://1.usa.gov/pCge3B",,,,,,,,,,,"en",,,,,,,,,,,,,
"x106782469746982912",2011-08-25 17:38:19,"x19318314","repbenraylujan","Blog: Luján to Hold ‘Conversations with Ben Ray’ in Española on Saturday, August 27 http://t.co/G68xkko","twitterfeed",,,,FALSE,FALSE,0,0,,,"1.usa.gov/q7myl2","http://t.co/G68xkko","http://1.usa.gov/q7myl2",,,,,,,,,,,"ro",,,,,,,,,,,,,
"x106185766551560192",2011-08-24 02:07:14,"x19318314","repbenraylujan","Blog: Luján to Visit Valle Vidal to Participate in ‘Great Outdoors Week’ Tomorrow http://t.co/KCyIDHm","twitterfeed",,,,FALSE,FALSE,0,1,,,"1.usa.gov/qtRph1","http://t.co/KCyIDHm","http://1.usa.gov/qtRph1",,,,,,,,,,,"en",,,,,,,,,,,,,
"x104292277752578048",2011-08-18 20:43:11,"x19318314","repbenraylujan","Blog: Luján to Hold ‘Conversations with Ben Ray’ in Shiprock on Tuesday, August 23 http://t.co/8xeLqVb","twitterfeed",,,,FALSE,FALSE,0,0,,,"1.usa.gov/oM16ur","http://t.co/8xeLqVb","http://1.usa.gov/oM16ur",,,,,,,,,,,"en",,,,,,,,,,,,,
"x103606987580899328",2011-08-16 23:20:05,"x19318314","repbenraylujan","Blog: Luján to Hold ‘Conversations with Ben Ray’ in Rio Rancho and Santa Fe on Saturday, August 20 http://t.co/6k4n0Pk","twitterfeed",,,,FALSE,FALSE,0,1,,,"1.usa.gov/nmz0Kp","http://t.co/6k4n0Pk","http://1.usa.gov/nmz0Kp",,,,,,,,,,,"en",,,,,,,,,,,,,
"x98821041727614976",2011-08-03 18:22:27,"x19318314","repbenraylujan","News: Luján: Congress Should Stay in Session to Focus on Jobs and End the FAA Shutdown http://1.usa.gov/mYCuJI","twitterfeed",,,,FALSE,FALSE,0,0,,,,,,,,,,,,,,,,"en",,,,,,,,,,,,,
"x98197785999974400",2011-08-02 01:05:51,"x19318314","repbenraylujan","News: Luján Opposes Debt Ceiling Bill http://1.usa.gov/qktehI","twitterfeed",,,,FALSE,FALSE,1,2,,,,,,,,,,,,,,,,"en",,,,,,,,,,,,,
"x98181806054047744",2011-08-02 00:02:21,"x19318314","repbenraylujan","I was excited 2 c my friend Rep. Gabby Giffords return 2 the House floor 2nite. I wish her well in her continued recovery #WelcomeBackGabby","Twitter Web Client",,,,FALSE,FALSE,0,1,"WelcomeBackGabby",,,,,,,,,,,,,,,"en",,,,,,,,,,,,,
"x96729380574871552",2011-07-28 23:50:56,"x19318314","repbenraylujan","News: Luján Opposes Republican Debt Limit Plan that Threatens a Downgrade of U.S. Credit Rating http://1.usa.gov/rohL0b","twitterfeed",,,,FALSE,FALSE,0,1,,,,,,,,,,,,,,,,"en",,,,,,,,,,,,,
"x95943681307193345",2011-07-26 19:48:50,"x19318314","repbenraylujan","Blog: Rep. Luján’s Staff to Hold Mobile Office Hours Across Northern New Mexico on Thursday, July 28 http://1.usa.gov/ntourg","twitterfeed",,,,FALSE,FALSE,0,2,,,,,,,,,,,,,,,,"en",,,,,,,,,,,,,
"x94137312346255360",2011-07-21 20:10:58,"x19318314","repbenraylujan","News: Luján Introduces Legislation to Protect National Forests from Devastating Wildfires http://1.usa.gov/ocfnEi","twitterfeed",,,,FALSE,FALSE,0,0,,,,,,,,,,,,,,,,"en",,,,,,,,,,,,,
"x93807073724334080",2011-07-20 22:18:43,"x19318314","repbenraylujan","News: Luján Announces $300,000 for EPA Job Training at Santa Fe Community College http://1.usa.gov/pHZmqo","twitterfeed",,,,FALSE,FALSE,0,1,,,,,,,,,,,,,,,,"en",,,,,,,,,,,,,
"x93728277730045952",2011-07-20 17:05:37,"x19318314","repbenraylujan","News: Luján Highlights Need for More Funding to Protect Watersheds Damaged by Fire and Drought http://1.usa.gov/oDeQcB","twitterfeed",,,,FALSE,FALSE,0,2,,,,,,,,,,,,,,,,"en",,,,,,,,,,,,,
"x93453508086468608",2011-07-19 22:53:47,"x19318314","repbenraylujan","News: Luján Statement on Moody’s Review of New Mexico’s Credit Rating http://1.usa.gov/oJXEZ7","twitterfeed",,,,FALSE,FALSE,0,0,,,,,,,,,,,,,,,,"en",,,,,,,,,,,,,
"x93067602867392513",2011-07-18 21:20:20,"x19318314","repbenraylujan","Blog: Firea and Flood Recovery Workshops - July 26 and 28 http://1.usa.gov/n8CdBs","twitterfeed",,,,FALSE,FALSE,0,1,,,,,,,,,,,,,,,,"en",,,,,,,,,,,,,
"x90838387279409152",2011-07-12 17:42:13,"x19318314","repbenraylujan","News: Luján Honors Medal of Honor Recipient Sgt. Petry http://1.usa.gov/qSc1sU","twitterfeed",,,,FALSE,FALSE,0,0,,,,,,,,,,,,,,,,"ro",,,,,,,,,,,,,
"x90832668777906176",2011-07-12 17:19:30,"x19318314","repbenraylujan","Sgt. Petry of Santa Fe 2 receive Medal of Honor this afternoon. Thank you 4 your service 2 our nation: http://t.co/lLtrJQy #MOHPetry","Twitter Web Client",,,,FALSE,FALSE,0,1,"MOHPetry",,"bit.ly/q3sZ4a","http://t.co/lLtrJQy","http://bit.ly/q3sZ4a",,,,,,,,,,,"en",,,,,,,,,,,,,
"x86948473076854784",2011-07-02 00:05:06,"x19318314","repbenraylujan","News: Luján, Udall, and Bingaman Send Letter to FEMA Requesting Support for More Counties and Pueblos http://1.usa.gov/jWvAha","twitterfeed",,,,FALSE,FALSE,0,0,,,,,,,,,,,,,,,,"en",,,,,,,,,,,,,
"x86893798596153344",2011-07-01 20:27:50,"x19318314","repbenraylujan","Blog: NMDOT Road Closures for Fourth of July Holiday Weekend http://1.usa.gov/kRSBMA","twitterfeed",,,,FALSE,FALSE,0,0,,,,,,,,,,,,,,,,"en",,,,,,,,,,,,,
"x86818532897193985",2011-07-01 15:28:45,"x19318314","repbenraylujan","This am I met w/ Forest Service + Governors from a number of Pueblos impacted by the #conchas fire, including Santa Clara, Cochiti + Jemez","Twitter Web Client",,,,FALSE,FALSE,0,0,"conchas",,,,,,,,,,,,,,,"en",,,,,,,,,,,,,
"x86501163184295936",2011-06-30 18:27:39,"x19318314","repbenraylujan","Visited the Red Cross shelter this morning 2 meet w/evacuees and thank volunteers. Heading 2 White Rock 4 latest briefing on #nmfire.","Twitter Web Client",,,,FALSE,FALSE,0,1,"nmfire",,,,,,,,,,,,,,,"en",,,,,,,,,,,,,
"x86500595887898625",2011-06-30 18:25:23,"x19318314","repbenraylujan","Met w/Sec. Vilsack and visited the SW Coordination Center the other day to receive latest briefing on #nmfire http://t.co/Fc1jrt3","Twitter Web Client",,,,FALSE,FALSE,0,0,"nmfire",,"on.fb.me/mMfbUp","http://t.co/Fc1jrt3","http://on.fb.me/mMfbUp",,,,,,,,,,,"en",,,,,,,,,,,,,
"x85457097365524480",2011-06-27 21:18:54,"x19318314","repbenraylujan","Blog: Latest Update on Mandatory Evacuations Due to Las Conchas Fire http://1.usa.gov/lalCMQ","twitterfeed",,,,FALSE,FALSE,0,0,,,,,,,,,,,,,,,,"en",,,,,,,,,,,,,
"x84382287952740352",2011-06-24 22:07:59,"x19318314","repbenraylujan","News: Luján and Heinrich Urge Support for Funding to Help New Mexico Recover from Fires http://1.usa.gov/iENHU5","twitterfeed",,,,FALSE,FALSE,0,0,,,,,,,,,,,,,,,,"en",,,,,,,,,,,,,
"x84052751994204161",2011-06-24 00:18:32,"x19318314","repbenraylujan","Blog: Luján Amendment to Patent Reform Improves Process of Selecting Patent Satellite Offices http://1.usa.gov/kAygxO","twitterfeed",,,,FALSE,FALSE,0,1,,,,,,,,,,,,,,,,"en",,,,,,,,,,,,,
"x83934159768268800",2011-06-23 16:27:17,"x19318314","repbenraylujan","News: Luján Sponsors Legislation to Support Firefighters and First Responders http://1.usa.gov/kbitwo","twitterfeed",,,,FALSE,FALSE,0,1,,,,,,,,,,,,,,,,"en",,,,,,,,,,,,,
"x83599395467169793",2011-06-22 18:17:03,"x19318314","repbenraylujan","News: Luján Introduces Legislation to Encourage Innovation in STEM Education http://1.usa.gov/lIsnom","twitterfeed",,,,FALSE,FALSE,0,1,,,,,,,,,,,,,,,,"en",,,,,,,,,,,,,
"x83204514785656832",2011-06-21 16:07:56,"x19318314","repbenraylujan","News: Luján Announces $560,000 Grant for Youth Shelters and Family Services in Santa Fe http://1.usa.gov/k4WXOs","twitterfeed",,,,FALSE,FALSE,0,2,,,,,,,,,,,,,,,,"en",,,,,,,,,,,,,
"x81489421756661760",2011-06-16 22:32:46,"x19318314","repbenraylujan","News: Luján: Republican Spending Bill Makes Cuts on the Backs of Vulnerable Americans http://1.usa.gov/kqcaA1","twitterfeed",,,,FALSE,FALSE,0,0,,,,,,,,,,,,,,,,"en",,,,,,,,,,,,,
"x80674089471193088",2011-06-14 16:32:56,"x19318314","repbenraylujan","News: Luján Highlights SBA Loan Program to Help Businesses Impacted By Natural Gas Outage http://1.usa.gov/mLQKdd","twitterfeed",,,,FALSE,FALSE,0,0,,,,,,,,,,,,,,,,"en",,,,,,,,,,,,,
"x75549333910597632",2011-05-31 13:08:59,"x19318314","repbenraylujan","News: Luján Honors our Veterans and Troops on Memorial Day http://1.usa.gov/myFFJG","twitterfeed",,,,FALSE,FALSE,0,0,,,,,,,,,,,,,,,,"en",,,,,,,,,,,,,
"x74098295936520193",2011-05-27 13:03:05,"x19318314","repbenraylujan","Help me decode the Republican rhetoric: http://bit.ly/iW5RdS","Twitter Web Client",,,,FALSE,FALSE,0,0,,,,,,,,,,,,,,,,"en",,,,,,,,,,,,,
"x73067898737930240",2011-05-24 16:48:39,"x19318314","repbenraylujan","Blog: Rep. Luján’s Staff to Hold Mobile Office Hours Across Northern New Mexico This Week http://1.usa.gov/lrUWem","twitterfeed",,,,FALSE,FALSE,0,0,,,,,,,,,,,,,,,,"en",,,,,,,,,,,,,
"x72799957979107328",2011-05-23 23:03:57,"x19318314","repbenraylujan","News: Luján: Republican Plan to End Medicare As We Know It Doubles Out-Of-Pocket Costs for Seniors http://1.usa.gov/j1Iu7l","twitterfeed",,,,FALSE,FALSE,0,0,,,,,,,,,,,,,,,,"en",,,,,,,,,,,,,
"x69104310855806977",2011-05-13 18:18:46,"x19318314","repbenraylujan","News: Luján Highlights Opportunities for Rural Small Businesses and Agricultural Producers to Earn ... http://1.usa.gov/jp3beK","twitterfeed",,,,FALSE,FALSE,0,1,,,,,,,,,,,,,,,,"en",,,,,,,,,,,,,
