"status_id","created_at","user_id","screen_name","text","source","reply_to_status_id","reply_to_user_id","reply_to_screen_name","is_quote","is_retweet","favorite_count","retweet_count","hashtags","symbols","urls_url","urls_t.co","urls_expanded_url","media_url","media_t.co","media_expanded_url","media_type","ext_media_url","ext_media_t.co","ext_media_expanded_url","ext_media_type","mentions_user_id","mentions_screen_name","lang","quoted_status_id","quoted_text","retweet_status_id","retweet_text","place_url","place_name","place_full_name","place_type","country","country_code","geo_coords","coords_coords","bbox_coords"
"x873689408616181760",2017-06-10 23:52:42,"x221792092","NitaLowey","My letter to ICE to requesting a stay of removal for Diego Puma. ICE should focus its enforcement on criminals, not children and students. https://t.co/iZMiXa3HRJ","Twitter Web Client",,,,FALSE,FALSE,62,43,,,,,,"http://pbs.twimg.com/media/DB_34HiXYAAg4ew.jpg","https://t.co/iZMiXa3HRJ","https://twitter.com/NitaLowey/status/873689408616181760/photo/1","photo","http://pbs.twimg.com/media/DB_34HiXYAAg4ew.jpg","https://t.co/iZMiXa3HRJ","https://twitter.com/NitaLowey/status/873689408616181760/photo/1",,,,"en",,,,,,,,,,,,,
"x873297949127823360",2017-06-09 21:57:10,"x221792092","NitaLowey","An #Ossining HS senior was arrested by ICE. President Trump's deportation-first policy simply does not reflect our nation's founding values. https://t.co/FCPp9zyl3G","Twitter Web Client",,,,FALSE,FALSE,36,21,"Ossining",,,,,"http://pbs.twimg.com/media/DB6Ts9MXkAUcclh.jpg","https://t.co/FCPp9zyl3G","https://twitter.com/NitaLowey/status/873297949127823360/photo/1","photo","http://pbs.twimg.com/media/DB6Ts9MXkAUcclh.jpg","https://t.co/FCPp9zyl3G","https://twitter.com/NitaLowey/status/873297949127823360/photo/1",,,,"en",,,,,,,,,,,,,
"x872904943857958912",2017-06-08 19:55:31,"x221792092","NitaLowey","James Comey’s sworn testimony revealed @POTUS's increasingly unhinged attempts to obstruct an ongoing criminal investigation. #ComeyHearing","Twitter for iPhone",,,,FALSE,FALSE,23,5,"ComeyHearing",,,,,,,,,,,,,"x822215679726100480","POTUS","en",,,,,,,,,,,,,
"x872208239705833472",2017-06-06 21:47:03,"x221792092","NitaLowey","I was honored to meet with Marcia Earle of Ossining &amp; Parris Lloyd of White Plains to receive the @OVAC Congressional Cancer Champion Award. https://t.co/pvuK0Cbm6A","Twitter for iPhone",,,,FALSE,FALSE,10,2,,,,,,"http://pbs.twimg.com/media/DBq0wBNWsAA-KRg.jpg","https://t.co/pvuK0Cbm6A","https://twitter.com/NitaLowey/status/872208239705833472/photo/1","photo","http://pbs.twimg.com/media/DBq0wBNWsAA-KRg.jpg","https://t.co/pvuK0Cbm6A","https://twitter.com/NitaLowey/status/872208239705833472/photo/1",,"x18927430","ovac","en",,,,,,,,,,,,,
"x871863775179280386",2017-06-05 22:58:17,"x221792092","NitaLowey","The world has lost a giant in the fight for women's rights &amp; reproductive health. Thank you @BabatundeUNFPA for your courage and leadership.","Twitter for iPhone",,,,FALSE,FALSE,10,6,,,,,,,,,,,,,,"x284647429","BabatundeUNFPA","en",,,,,,,,,,,,,
"x871846434844418048",2017-06-05 21:49:22,"x221792092","NitaLowey","New York won't sit on the sidelines as @POTUS works to kick millions off their health coverage. https://t.co/uuGV9I4kVX","Twitter for iPhone",,,,FALSE,FALSE,25,7,,,"nytimes.com/2017/06/04/nyr…","https://t.co/uuGV9I4kVX","https://www.nytimes.com/2017/06/04/nyregion/cuomo-health-insurance-affordable-care-act-repeal.html?action=click&contentCollection=nyregion&region=rank&module=package&version=highlights&contentPlacement=1&pgtype=sectionfront",,,,,,,,,"x822215679726100480","POTUS","en",,,,,,,,,,,,,
"x871174997594841089",2017-06-04 01:21:19,"x221792092","NitaLowey","The heinous acts of terrorism in London tonight are an assault on freedom everywhere. The U.S. stands with our friend and ally the U.K.","Twitter for iPhone",,,,FALSE,FALSE,30,6,,,,,,,,,,,,,,,,"en",,,,,,,,,,,,,
"x870364689838026753",2017-06-01 19:41:27,"x221792092","NitaLowey","We have a moral responsibility to safeguard our planet &amp; ensure our children &amp; grandchildren inherit a clean, healthy future. #ParisAccords","Twitter for iPhone",,,,FALSE,FALSE,30,13,"ParisAccords",,,,,,,,,,,,,,,"en",,,,,,,,,,,,,
"x870363977578151937",2017-06-01 19:38:37,"x221792092","NitaLowey","After Superstorm Sandy, New Yorkers understand that the threats posed by increasingly powerful storms are not abstract scientific warnings.","Twitter for iPhone",,,,FALSE,FALSE,23,6,,,,,,,,,,,,,,,,"en",,,,,,,,,,,,,
"x870363428648607744",2017-06-01 19:36:26,"x221792092","NitaLowey","#ClimateChange poses an existential threat to our planet that must be confronted quickly and seriously.","Twitter for iPhone",,,,FALSE,FALSE,14,5,"ClimateChange",,,,,,,,,,,,,,,"en",,,,,,,,,,,,,
"x870009629010350082",2017-05-31 20:10:34,"x221792092","NitaLowey","I condemn @POTUS's reported decision to pull out of the #ParisAgreement, which would undermine our global leadership &amp; endanger our planet.","Twitter for iPhone",,,,FALSE,FALSE,54,18,"ParisAgreement",,,,,,,,,,,,,"x822215679726100480","POTUS","en",,,,,,,,,,,,,
"x867504073146290176",2017-05-24 22:14:23,"x221792092","NitaLowey","#TrumpCare remains a complete disaster for American families. Read my statement on TrumpCare's updated #CBO score: https://t.co/ZkEB66xMbE","Twitter Web Client",,,,FALSE,FALSE,32,17,"TrumpCare CBO",,,,,"http://pbs.twimg.com/media/DAn-WjNWAAA65Az.jpg","https://t.co/ZkEB66xMbE","https://twitter.com/NitaLowey/status/867504073146290176/photo/1","photo","http://pbs.twimg.com/media/DAn-WjNWAAA65Az.jpg","https://t.co/ZkEB66xMbE","https://twitter.com/NitaLowey/status/867504073146290176/photo/1",,,,"en",,,,,,,,,,,,,
"x867472102949097472",2017-05-24 20:07:20,"x221792092","NitaLowey","I told Sec DeVos the Trump Budget reflects an Administration filled with those who never had to worry about paying for their kids' education https://t.co/tasKS7tCvc","Media Studio",,,,FALSE,FALSE,115,52,,,,,,"http://pbs.twimg.com/media/DAnfcNYXYAApdDd.jpg","https://t.co/tasKS7tCvc","https://twitter.com/NitaLowey/status/867472102949097472/video/1","photo","http://pbs.twimg.com/media/DAnfcNYXYAApdDd.jpg","https://t.co/tasKS7tCvc","https://twitter.com/NitaLowey/status/867472102949097472/video/1",,,,"en",,,,,,,,,,,,,
"x867387805361733633",2017-05-24 14:32:22,"x221792092","NitaLowey","I sent a letter with @RepEliotEngel to @NTSB RE the @MetroNorth derailment in #Rye &amp; the importance of implementing Positive Train Control. https://t.co/OT0AFdUhXJ","Twitter Web Client",,,,FALSE,FALSE,8,2,"Rye",,,,,"http://pbs.twimg.com/media/DAmUdrVWAAA323H.jpg","https://t.co/OT0AFdUhXJ","https://twitter.com/NitaLowey/status/867387805361733633/photo/1","photo","http://pbs.twimg.com/media/DAmUdrVWAAA323H.jpg","https://t.co/OT0AFdUhXJ","https://twitter.com/NitaLowey/status/867387805361733633/photo/1",,"x164007407 161023696 101803450","RepEliotEngel NTSB MetroNorth","en",,,,,,,,,,,,,
"x867118230921457664",2017-05-23 20:41:11,"x221792092","NitaLowey","Read my full statement on the dangerous impact of Trump's budget proposal on #NewYork #TrumpCuts https://t.co/cgRJQi8uZF","Twitter for iPhone",,,,FALSE,FALSE,17,8,"NewYork TrumpCuts",,"lowey.house.gov/media-center/p…","https://t.co/cgRJQi8uZF","https://lowey.house.gov/media-center/press-releases/lowey-outlines-dangerous-impact-trump-budget-new-york-families",,,,,,,,,,,"en",,,,,,,,,,,,,
"x867108627206811649",2017-05-23 20:03:01,"x221792092","NitaLowey",".@realDonaldTrump's budget proposal is dead on arrival. #TrumpCuts","Twitter for iPhone",,,,FALSE,FALSE,40,7,"TrumpCuts",,,,,,,,,,,,,"x25073877","realDonaldTrump","en",,,,,,,,,,,,,
"x866814125476909057",2017-05-23 00:32:46,"x221792092","NitaLowey","Horrible tragedy in Manchester. Praying for the safety of the victims and first responders tonight. Heartbreaking.","Twitter for iPhone",,,,FALSE,FALSE,21,4,,,,,,,,,,,,,,,,"en",,,,,,,,,,,,,
"x865026078980673536",2017-05-18 02:07:43,"x221792092","NitaLowey","Read my statement on the appointment of Robert Mueller as Special Counsel to investigate #Trump's #Russia ties. #TrumpRussia #Trumpleaks https://t.co/Ws5wxNQoLM","Twitter Web Client",,,,FALSE,FALSE,32,5,"Trump Russia TrumpRussia Trumpleaks",,,,,"http://pbs.twimg.com/media/DAEwerAXkAALE-n.jpg","https://t.co/Ws5wxNQoLM","https://twitter.com/NitaLowey/status/865026078980673536/photo/1","photo","http://pbs.twimg.com/media/DAEwerAXkAALE-n.jpg","https://t.co/Ws5wxNQoLM","https://twitter.com/NitaLowey/status/865026078980673536/photo/1",,,,"en",,,,,,,,,,,,,
"x864613696953339904",2017-05-16 22:49:03,"x221792092","NitaLowey",".@POTUS's indefensible and apparently sinister behavior has become a cancer on our nation’s democratic institutions. https://t.co/gJmSc9oHPC","Twitter for iPhone",,,,FALSE,FALSE,28,13,,,"nytimes.com/2017/05/16/us/…","https://t.co/gJmSc9oHPC","https://www.nytimes.com/2017/05/16/us/politics/james-comey-trump-flynn-russia-investigation.html",,,,,,,,,"x822215679726100480","POTUS","en",,,,,,,,,,,,,
"x864284903332081665",2017-05-16 01:02:33,"x221792092","NitaLowey","The White House must immediately clarify reports indicating @POTUS revealed code-word clearance level intelligence to Russian officials.","Twitter for iPhone",,,,FALSE,FALSE,56,34,,,,,,,,,,,,,,"x822215679726100480","POTUS","en",,,,,,,,,,,,,
"x864178306354221058",2017-05-15 17:58:58,"x221792092","NitaLowey",".@realDonaldTrump chose #WomensHealthWeek to expand his #TrumpGlobalGag Rule and threaten vital women's health programs around the world.","Twitter for iPhone",,,,FALSE,FALSE,18,10,"WomensHealthWeek TrumpGlobalGag",,,,,,,,,,,,,"x25073877","realDonaldTrump","en",,,,,,,,,,,,,
"x862333764608946176",2017-05-10 15:49:25,"x221792092","NitaLowey",".@POTUS's decision to fire FBI Director #Comey raises serious questions. We need a special prosecutor &amp; independent commission immediately. https://t.co/RhA5dMaEkv","Twitter Web Client",,,,FALSE,FALSE,45,15,"Comey",,,,,"http://pbs.twimg.com/media/C_efMHnXkAEPANO.jpg","https://t.co/RhA5dMaEkv","https://twitter.com/NitaLowey/status/862333764608946176/photo/1","photo","http://pbs.twimg.com/media/C_efMHnXkAEPANO.jpg","https://t.co/RhA5dMaEkv","https://twitter.com/NitaLowey/status/862333764608946176/photo/1",,"x822215679726100480","POTUS","en",,,,,,,,,,,,,
"x862134576654712832",2017-05-10 02:37:55,"x221792092","NitaLowey","Comey firing raises serious questions about if @POTUS is trying to stifle an ongoing investigation. A special prosecutor must be appointed.","Twitter for iPhone",,,,FALSE,FALSE,95,41,,,,,,,,,,,,,,"x822215679726100480","POTUS","en",,,,,,,,,,,,,
"x860261456264269826",2017-05-04 22:34:48,"x221792092","NitaLowey","The American people deserve deserve solutions that will improve their health care and their lives, not endanger them. #TrumpCare https://t.co/OV2mBqKNbQ","Twitter Web Client",,,,FALSE,FALSE,24,10,"TrumpCare",,,,,"http://pbs.twimg.com/media/C_BDN5bXkAQRLyv.jpg","https://t.co/OV2mBqKNbQ","https://twitter.com/NitaLowey/status/860261456264269826/photo/1","photo","http://pbs.twimg.com/media/C_BDN5bXkAQRLyv.jpg","https://t.co/OV2mBqKNbQ","https://twitter.com/NitaLowey/status/860261456264269826/photo/1",,,,"en",,,,,,,,,,,,,
"x860160225625722880",2017-05-04 15:52:33,"x221792092","NitaLowey","#ACA:
✔️79 hearings
✔️Bill public 30 days before markup
✔️Final bill public 3 days before vote
 
But @GOP wants to keep #Trumpcare secret.","Twitter for iPhone",,,,FALSE,FALSE,35,22,"ACA Trumpcare",,,,,,,,,,,,,"x11134252","GOP","en",,,,,,,,,,,,,
"x859814988109754369",2017-05-03 17:00:42,"x221792092","NitaLowey","Instead of $8 bil to “help” Americans with preexist conditions who will lose protections, let’s just guarantee their protections. #TrumpCare","Twitter for iPhone",,,,FALSE,FALSE,23,4,"TrumpCare",,,,,,,,,,,,,,,"en",,,,,,,,,,,,,
"x859812934410743809",2017-05-03 16:52:32,"x221792092","NitaLowey","Rs having trouble negotiating themselves out of a paper bag. Can't escape reality that #Trumpcare will raise costs &amp; hurt working #families.","Twitter for iPhone",,,,FALSE,FALSE,12,4,"Trumpcare families",,,,,,,,,,,,,,,"en",,,,,,,,,,,,,
"x859517700107902977",2017-05-02 21:19:23,"x221792092","NitaLowey","Today my colleague @davidcicilline introduced the Equality Act, which would ban discrimination based on sexual orientation &amp; gender identity","Twitter for iPhone",,,,FALSE,FALSE,20,4,,,,,,,,,,,,,,"x23593446","davidcicilline","en",,,,,,,,,,,,,
"x859468033416450048",2017-05-02 18:02:01,"x221792092","NitaLowey","NY taxpayers shouldn't be on the hook for cost of protecting @POTUS &amp; First Family. Pleased to have secured this $ https://t.co/TqWw2ojfG9","Twitter for iPhone",,,,FALSE,FALSE,18,1,,,"nypost.com/2017/05/01/spe…","https://t.co/TqWw2ojfG9","http://nypost.com/2017/05/01/spending-deal-gives-millions-to-nypd-for-protecting-trump-and-family/",,,,,,,,,"x822215679726100480","POTUS","en",,,,,,,,,,,,,
"x858023983287074817",2017-04-28 18:23:53,"x221792092","NitaLowey","#Guns kill 93 #Americans per day but @realDonaldTrump continues his thank you tour by headlining the #NRA conference https://t.co/NNLgPqzp96","Twitter for iPhone",,,,FALSE,FALSE,6,6,"Guns Americans NRA",,"nytimes.com/2017/04/28/us/…","https://t.co/NNLgPqzp96","https://www.nytimes.com/2017/04/28/us/politics/donald-trump-nra.html?rref=collection%2Fsectioncollection%2Fus&action=click&contentCollection=us&region=stream&module=stream_unit&version=latest&contentPlacement=4&pgtype=sectionfront",,,,,,,,,"x25073877","realDonaldTrump","en",,,,,,,,,,,,,
"x857398513688338432",2017-04-27 00:58:30,"x221792092","NitaLowey","#Trumpcare 2.0:
❌ Families pay more for less
❌ Age Tax
❌ Destroy protections for preexisting conditions
❌ 20+ million lose care

No thanks.","Twitter for iPhone",,,,FALSE,FALSE,29,29,"Trumpcare",,,,,,,,,,,,,,,"en",,,,,,,,,,,,,
"x857358181508550656",2017-04-26 22:18:14,"x221792092","NitaLowey","After weeks of secret backroom deals @HouseGOP is back with another attempt to destroy health coverage for millions of Americans #Trumpcare","Twitter for iPhone",,,,FALSE,FALSE,11,11,"Trumpcare",,,,,,,,,,,,,"x15207668","HouseGOP","en",,,,,,,,,,,,,
"x856667148864946179",2017-04-25 00:32:19,"x221792092","NitaLowey","Thanks to @WorldJewishCong for a great panel discussion today, it was an honor to be with you. https://t.co/Z9lM7KmuJm","Twitter for iPhone",,,,FALSE,FALSE,6,1,,,,,,"http://pbs.twimg.com/media/C-N-NxZXcAAmvUI.jpg","https://t.co/Z9lM7KmuJm","https://twitter.com/NitaLowey/status/856667148864946179/photo/1","photo","http://pbs.twimg.com/media/C-N-NxZXcAAmvUI.jpg","https://t.co/Z9lM7KmuJm","https://twitter.com/NitaLowey/status/856667148864946179/photo/1",,"x52730608","WorldJewishCong","en",,,,,,,,,,,,,
"x856629638075994113",2017-04-24 22:03:15,"x221792092","NitaLowey","Today, on Holocaust Remembrance Day, we honor the lives of six million Jews systemically targeted and killed during the Holocaust.","Twitter for iPhone",,,,FALSE,FALSE,21,13,,,,,,,,,,,,,,,,"en",,,,,,,,,,,,,
"x856613827257020416",2017-04-24 21:00:26,"x221792092","NitaLowey","I spoke with @NPRinskeep this morning about why Democrats sent a letter to @POTUS demanding he fire Sebastian Gorka. https://t.co/rMNAPTzrZ6","Twitter Web Client",,,,FALSE,FALSE,7,0,,,"npr.org/2017/04/24/525…","https://t.co/rMNAPTzrZ6","http://www.npr.org/2017/04/24/525367166/democrats-question-trump-about-adviser-sebastian-gorka",,,,,,,,,"x115710058 822215679726100480","NPRinskeep POTUS","en",,,,,,,,,,,,,
"x855819978607661056",2017-04-22 16:25:57,"x221792092","NitaLowey","Today, on the 47th anniversary of #EarthDay, we have reached a decisive moment in our world’s history. #EarthDay2017","TweetDeck",,,,FALSE,FALSE,16,2,"EarthDay EarthDay2017",,,,,,,,,,,,,,,"en",,,,,,,,,,,,,
"x855147104272089088",2017-04-20 19:52:12,"x221792092","NitaLowey",".@GOP trying to resurrect #Trumpcare? Don’t bother. Americans haven’t forgotten taking health care from millions is dangerous &amp; reckless.","Twitter for iPhone",,,,FALSE,FALSE,27,6,"Trumpcare",,,,,,,,,,,,,"x11134252","GOP","en",,,,,,,,,,,,,
"x852552953508614146",2017-04-13 16:03:58,"x221792092","NitaLowey","I was proud to join @NPWestchester to discuss the dangerous impact @realDonaldTrump's budget proposal would have on New York families. https://t.co/dLKpkDMBX1","Twitter for iPhone",,,,FALSE,FALSE,18,1,,,,,,"http://pbs.twimg.com/media/C9TgWcZVoAEp1AA.jpg","https://t.co/dLKpkDMBX1","https://twitter.com/NitaLowey/status/852552953508614146/photo/1","photo","http://pbs.twimg.com/media/C9TgWcZVoAEp1AA.jpg http://pbs.twimg.com/media/C9TgWcoUAAAaIAa.jpg http://pbs.twimg.com/media/C9TgWcmV0AERUId.jpg","https://t.co/dLKpkDMBX1 https://t.co/dLKpkDMBX1 https://t.co/dLKpkDMBX1","https://twitter.com/NitaLowey/status/852552953508614146/photo/1 https://twitter.com/NitaLowey/status/852552953508614146/photo/1 https://twitter.com/NitaLowey/status/852552953508614146/photo/1",,"x633747797 25073877","NPWestchester realDonaldTrump","en",,,,,,,,,,,,,
"x851915293488279552",2017-04-11 21:50:08,"x221792092","NitaLowey","Sean Spicer's lack of credibility renders his multiple clarifications meaningless. He must apologize and resign immediately. https://t.co/5ZZNe7Edm0","Twitter Web Client",,,,FALSE,FALSE,45,23,,,,,,"http://pbs.twimg.com/media/C9KcaitXoAAaPxg.jpg","https://t.co/5ZZNe7Edm0","https://twitter.com/NitaLowey/status/851915293488279552/photo/1","photo","http://pbs.twimg.com/media/C9KcaitXoAAaPxg.jpg","https://t.co/5ZZNe7Edm0","https://twitter.com/NitaLowey/status/851915293488279552/photo/1",,,,"en",,,,,,,,,,,,,
"x851538344119074817",2017-04-10 20:52:16,"x221792092","NitaLowey","Heartbreaking tragedy today in #SanBernadino. My prayers are with the victims and their families.","Twitter for iPhone",,,,FALSE,FALSE,9,1,"SanBernadino",,,,,,,,,,,,,,,"en",,,,,,,,,,,,,
"x850367543093186561",2017-04-07 15:19:55,"x221792092","NitaLowey",".@POTUS missile strike was a measured response. However, it will not solve this crisis nor provide assistance to millions of Syrians in need https://t.co/4ctFRqLlDZ","TweetDeck",,,,FALSE,FALSE,11,4,,,,,,"http://pbs.twimg.com/media/C80ct2MXUAAnucn.jpg","https://t.co/4ctFRqLlDZ","https://twitter.com/NitaLowey/status/850367543093186561/photo/1","photo","http://pbs.twimg.com/media/C80ct2MXUAAnucn.jpg","https://t.co/4ctFRqLlDZ","https://twitter.com/NitaLowey/status/850367543093186561/photo/1",,"x822215679726100480","POTUS","en",,,,,,,,,,,,,
"x849805266480750593",2017-04-06 02:05:38,"x221792092","NitaLowey","I was proud to meet w/ @JGreenblattADL today to talk about how we can combat anti-Semitism in our community &amp; around the world @ADL_National https://t.co/EBLS1YY5xp","Twitter for iPhone",,,,FALSE,FALSE,44,14,,,,,,"http://pbs.twimg.com/media/C8sdYO8XkAAu2cv.jpg","https://t.co/EBLS1YY5xp","https://twitter.com/NitaLowey/status/849805266480750593/photo/1","photo","http://pbs.twimg.com/media/C8sdYO8XkAAu2cv.jpg","https://t.co/EBLS1YY5xp","https://twitter.com/NitaLowey/status/849805266480750593/photo/1",,"x14772775 19670226","JGreenblattADL ADL_National","en",,,,,,,,,,,,,
"x849665187326173185",2017-04-05 16:49:01,"x221792092","NitaLowey","RT if you think it’s time to #DemandAVote to release Trump’s tax returns to the American people. https://t.co/P8N5J0M2uz","Twitter for iPhone",,,,FALSE,FALSE,7,14,"DemandAVote",,,,,"http://pbs.twimg.com/media/C8qd-YEUwAA_vzx.jpg","https://t.co/P8N5J0M2uz","https://twitter.com/NitaLowey/status/849665187326173185/photo/1","photo","http://pbs.twimg.com/media/C8qd-YEUwAA_vzx.jpg","https://t.co/P8N5J0M2uz","https://twitter.com/NitaLowey/status/849665187326173185/photo/1",,,,"en",,,,,,,,,,,,,
"x849659318735691776",2017-04-05 16:25:42,"x221792092","NitaLowey","Americans deserve the truth. I #DemandAVote to release @realDonaldTrump’s tax returns.","Twitter for iPhone",,,,FALSE,FALSE,17,5,"DemandAVote",,,,,,,,,,,,,"x25073877","realDonaldTrump","en",,,,,,,,,,,,,
"x849277659297325057",2017-04-04 15:09:07,"x221792092","NitaLowey","Women in the US who work full-time still earn only 80 cents for every dollar earned by men. Women of color earn even less. #EqualPayDay","Twitter Web Client",,,,FALSE,FALSE,18,10,"EqualPayDay",,,,,,,,,,,,,,,"en",,,,,,,,,,,,,
"x847566248976289793",2017-03-30 21:48:35,"x221792092","NitaLowey","Two White House officials were @DevinNunes' sources. We need independent commission to #FollowTheFacts https://t.co/cllZuAxNnh","Twitter for iPhone",,,,FALSE,FALSE,126,96,"FollowTheFacts",,"nytimes.com/2017/03/30/us/…","https://t.co/cllZuAxNnh","https://www.nytimes.com/2017/03/30/us/politics/devin-nunes-intelligence-reports.html?hp&action=click&pgtype=Homepage&clickSource=story-heading&module=first-column-region&region=top-news&WT.nav=top-news",,,,,,,,,"x54412900","DevinNunes","en",,,,,,,,,,,,,
"x847176410372427777",2017-03-29 19:59:30,"x221792092","NitaLowey","Speaker Ryan it’s time for leadership. @DevinNunes refuses to do his job &amp; #FollowTheFacts. He must recuse – or you should make him do so.","Twitter for iPhone",,,,FALSE,FALSE,69,26,"FollowTheFacts",,,,,,,,,,,,,"x54412900","DevinNunes","en",,,,,,,,,,,,,
"x847162227056693248",2017-03-29 19:03:09,"x221792092","NitaLowey",".@DevinNunes refuses to allow House Intel committee to #FollowTheFacts on #Russia. Speaker Ryan must force him to recuse himself.","Twitter for iPhone",,,,FALSE,FALSE,20,5,"FollowTheFacts Russia",,,,,,,,,,,,,"x54412900","DevinNunes","en",,,,,,,,,,,,,
"x846747607062003712",2017-03-28 15:35:35,"x221792092","NitaLowey","As you read this, you should know that Congressional Republicans are threatening Americans’ online #privacy. https://t.co/jGiuDawd1Q","Twitter for iPhone",,,,FALSE,FALSE,11,8,"privacy",,"washingtonpost.com/news/the-switc…","https://t.co/jGiuDawd1Q","https://www.washingtonpost.com/news/the-switch/wp/2017/03/23/congress-is-poised-to-undo-landmark-rules-covering-your-internet-privacy/",,,,,,,,,,,"en",,,,,,,,,,,,,
"x845377317979525123",2017-03-24 20:50:33,"x221792092","NitaLowey",".@realDonaldTrump promised ""so much winning."" Today, hardworking American families won. #TrumpCare #KillTheBill #PayLessForMore https://t.co/CvaVKs2ZSv","TweetDeck",,,,FALSE,FALSE,45,13,"TrumpCare KillTheBill PayLessForMore",,,,,"http://pbs.twimg.com/media/C7tiLhLX0AADIE_.jpg","https://t.co/CvaVKs2ZSv","https://twitter.com/NitaLowey/status/845377317979525123/photo/1","photo","http://pbs.twimg.com/media/C7tiLhLX0AADIE_.jpg","https://t.co/CvaVKs2ZSv","https://twitter.com/NitaLowey/status/845377317979525123/photo/1",,"x25073877","realDonaldTrump","en",,,,,,,,,,,,,
"x844962075214581760",2017-03-23 17:20:32,"x221792092","NitaLowey","New Yorkers across the #LowerHudsonValley have shared stories about how #healthcare reform has helped them receive quality, affordable care.","TweetDeck",,,,FALSE,FALSE,59,20,"LowerHudsonValley healthcare",,,,,,,,,,,,,,,"en",,,,,,,,,,,,,
"x844590497100447745",2017-03-22 16:44:00,"x221792092","NitaLowey","We cannot return to a time when a single hospital trip could bankrupt families. #Trumpcare is unacceptable.","Twitter for iPhone",,,,FALSE,FALSE,15,15,"Trumpcare",,,,,,,,,,,,,,,"en",,,,,,,,,,,,,
"x844590377663414274",2017-03-22 16:43:32,"x221792092","NitaLowey","Right now, the health &amp; financial stability of millions in the LHV are at risk due to #Trumpcare. We do not want to #PayMoreForLess.","Twitter for iPhone",,,,FALSE,FALSE,4,7,"Trumpcare PayMoreForLess",,,,,,,,,,,,,,,"en",,,,,,,,,,,,,
"x844580013085220865",2017-03-22 16:02:21,"x221792092","NitaLowey","#TrumpCare will raise premiums, cut coverage, and force Americans to #PayMoreForLess","Twitter for iPhone",,,,FALSE,FALSE,4,7,"TrumpCare PayMoreForLess",,,,,,,,,,,,,,,"en",,,,,,,,,,,,,
"x844579072168677379",2017-03-22 15:58:36,"x221792092","NitaLowey","Under #TrumpCare, working families &amp; older New Yorkers will lose coverage and #PayMoreForLess.","Twitter for iPhone",,,,FALSE,FALSE,2,3,"TrumpCare PayMoreForLess",,,,,,,,,,,,,,,"en",,,,,,,,,,,,,
"x844578752894046208",2017-03-22 15:57:20,"x221792092","NitaLowey","#TrumpCare is opposed by Dems, many Republicans, hospitals, doctors &amp; patient advocates because it would force Americans to #PayMoreForLess","Twitter for iPhone",,,,FALSE,FALSE,1,2,"TrumpCare PayMoreForLess",,,,,,,,,,,,,,,"en",,,,,,,,,,,,,
"x844578667829309441",2017-03-22 15:57:00,"x221792092","NitaLowey",".@RulesReps are moving forward with #TrumpCare, putting 24 million people at risk of losing coverage &amp; forcing families to #PayMoreForLess","Twitter for iPhone",,,,FALSE,FALSE,0,1,"TrumpCare PayMoreForLess",,,,,,,,,,,,,"x78369108","RulesReps","en",,,,,,,,,,,,,
"x843880593175797760",2017-03-20 17:43:06,"x221792092","NitaLowey","Read my statement on #FBI investigation into #Russian hacking &amp; ties to the #Trump campaign, &amp; @realDonaldTrump's debunked wiretap claims: https://t.co/jQYD8KllBt","TweetDeck",,,,FALSE,FALSE,8,5,"FBI Russian Trump",,,,,"http://pbs.twimg.com/media/C7YQ2EKWkAA26_6.jpg","https://t.co/jQYD8KllBt","https://twitter.com/NitaLowey/status/843880593175797760/photo/1","photo","http://pbs.twimg.com/media/C7YQ2EKWkAA26_6.jpg","https://t.co/jQYD8KllBt","https://twitter.com/NitaLowey/status/843880593175797760/photo/1",,"x25073877","realDonaldTrump","en",,,,,,,,,,,,,
"x843878261344092162",2017-03-20 17:33:50,"x221792092","NitaLowey",".@POTUS must apologize to Pres Obama &amp; think before tweeting so he doesn't continue to erode the credibility of the Office of the President.","Twitter for iPhone",,,,FALSE,FALSE,28,10,,,,,,,,,,,,,,"x822215679726100480","POTUS","en",,,,,,,,,,,,,
"x843876758403399682",2017-03-20 17:27:52,"x221792092","NitaLowey","I renew my call for an independent commission to investigate #Russian hacking &amp; present all of the facts to the people of the United States.","Twitter for iPhone",,,,FALSE,FALSE,29,7,"Russian",,,,,,,,,,,,,,,"en",,,,,,,,,,,,,
