"status_id","created_at","user_id","screen_name","text","source","reply_to_status_id","reply_to_user_id","reply_to_screen_name","is_quote","is_retweet","favorite_count","retweet_count","hashtags","symbols","urls_url","urls_t.co","urls_expanded_url","media_url","media_t.co","media_expanded_url","media_type","ext_media_url","ext_media_t.co","ext_media_expanded_url","ext_media_type","mentions_user_id","mentions_screen_name","lang","quoted_status_id","quoted_text","retweet_status_id","retweet_text","place_url","place_name","place_full_name","place_type","country","country_code","geo_coords","coords_coords","bbox_coords"
"x869345441460215811",2017-05-30 00:11:19,"x19318314","repbenraylujan","Briefing at Cannon AFB-Got the official visitor pic w Ms. Cannon-Honored that the dedicated men &amp; women of Cannon spent some time w me today https://t.co/l3xB5uORvE","Twitter Web Client",,,,FALSE,FALSE,17,1,,,,,,"http://pbs.twimg.com/media/DBCJAxEW0AANOES.jpg","https://t.co/l3xB5uORvE","https://twitter.com/repbenraylujan/status/869345441460215811/photo/1","photo","http://pbs.twimg.com/media/DBCJAxEW0AANOES.jpg","https://t.co/l3xB5uORvE","https://twitter.com/repbenraylujan/status/869345441460215811/photo/1",,,,"en",,,,,,,,,,,,,
"x869281664316432384",2017-05-29 19:57:53,"x19318314","repbenraylujan","Great to see so many engaged &amp; enthusiastic students at NM Boy's State today. Boy's State program helps teach basics principles of democracy https://t.co/FrXcJnDZuW","Twitter Web Client",,,,FALSE,FALSE,15,1,,,,,,"http://pbs.twimg.com/media/DBBPDSKXoAE-kMl.jpg","https://t.co/FrXcJnDZuW","https://twitter.com/repbenraylujan/status/869281664316432384/photo/1","photo","http://pbs.twimg.com/media/DBBPDSKXoAE-kMl.jpg","https://t.co/FrXcJnDZuW","https://twitter.com/repbenraylujan/status/869281664316432384/photo/1",,,,"en",,,,,,,,,,,,,
"x869272403272245248",2017-05-29 19:21:05,"x19318314","repbenraylujan","Today as we honor the memories,  valor and sacrifice of the men and women we’ve lost, we must fulfill our nation’s promise to those who live https://t.co/1887vf4Ry0","Twitter Web Client",,,,FALSE,FALSE,28,4,,,,,,"http://pbs.twimg.com/media/DBBGod2XYAARGzy.jpg","https://t.co/1887vf4Ry0","https://twitter.com/repbenraylujan/status/869272403272245248/photo/1","photo","http://pbs.twimg.com/media/DBBGod2XYAARGzy.jpg","https://t.co/1887vf4Ry0","https://twitter.com/repbenraylujan/status/869272403272245248/photo/1",,,,"en",,,,,,,,,,,,,
"x867788181332123649",2017-05-25 17:03:19,"x19318314","repbenraylujan","Met Pamela Foster whose daughter was abducted/ murdered last yr.  Amber Alert wasn’t issued for full day-Working w Navajo to improve system https://t.co/3a2HIOcpgL","Twitter Web Client",,,,FALSE,FALSE,28,8,,,,,,"http://pbs.twimg.com/media/DAsAs5LXgAEHnh-.jpg","https://t.co/3a2HIOcpgL","https://twitter.com/repbenraylujan/status/867788181332123649/photo/1","photo","http://pbs.twimg.com/media/DAsAs5LXgAEHnh-.jpg","https://t.co/3a2HIOcpgL","https://twitter.com/repbenraylujan/status/867788181332123649/photo/1",,,,"en",,,,,,,,,,,,,
"x867506486435393536",2017-05-24 22:23:58,"x19318314","repbenraylujan","The first CBO analysis of #TrumpCare said premiums would go up for seniors by 750% compared to ACA. New estimate: 850 percent increase! https://t.co/tzOwRi0n8v","Twitter Web Client",,,,FALSE,FALSE,12,14,"TrumpCare",,,,,"http://pbs.twimg.com/media/DAoAfKIWsAAzOXa.jpg","https://t.co/tzOwRi0n8v","https://twitter.com/repbenraylujan/status/867506486435393536/photo/1","photo","http://pbs.twimg.com/media/DAoAfKIWsAAzOXa.jpg","https://t.co/tzOwRi0n8v","https://twitter.com/repbenraylujan/status/867506486435393536/photo/1",,,,"en",,,,,,,,,,,,,
"x867506202623737856",2017-05-24 22:22:50,"x19318314","repbenraylujan","CBO confirms #TrumpCare will: 
-Leave 23 million uninsured 
-Increase premiums– as much as 700% 
-Jack up costs for pre-existing conditions https://t.co/OmgTNNTuxg","Twitter Web Client",,,,FALSE,FALSE,7,9,"TrumpCare",,,,,"http://pbs.twimg.com/media/DAoAR56XYAAv2rg.jpg","https://t.co/OmgTNNTuxg","https://twitter.com/repbenraylujan/status/867506202623737856/photo/1","photo","http://pbs.twimg.com/media/DAoAR56XYAAv2rg.jpg","https://t.co/OmgTNNTuxg","https://twitter.com/repbenraylujan/status/867506202623737856/photo/1",,,,"en",,,,,,,,,,,,,
"x867100369259827206",2017-05-23 19:30:12,"x19318314","repbenraylujan","Trump budget stacks the deck for millionaires while undermining hard-working families in NM and rest of small-town America.  #Trumpcuts","Twitter Web Client",,,,FALSE,FALSE,25,14,"Trumpcuts",,,,,,,,,,,,,,,"en",,,,,,,,,,,,,
"x867079545685516289",2017-05-23 18:07:27,"x19318314","repbenraylujan","Today’s #Trumpcuts budget is an insult to NM working families, rural communities &amp; our economy/security. The American people deserve better! https://t.co/7ZzHQD2T5f","Twitter Web Client",,,,FALSE,FALSE,30,18,"Trumpcuts",,,,,"http://pbs.twimg.com/media/DAh8MeSXcAICvaU.jpg","https://t.co/7ZzHQD2T5f","https://twitter.com/repbenraylujan/status/867079545685516289/photo/1","photo","http://pbs.twimg.com/media/DAh8MeSXcAICvaU.jpg","https://t.co/7ZzHQD2T5f","https://twitter.com/repbenraylujan/status/867079545685516289/photo/1",,,,"en",,,,,,,,,,,,,
"x865605484778143745",2017-05-19 16:30:04,"x19318314","repbenraylujan","Was briefed by Dep. Atty Gen. today. While special counsel Mueller’s been appointed, we still need 9/11-style commission to #FollowTheFacts https://t.co/LbW8xC1sSw","Twitter Web Client",,,,FALSE,FALSE,33,6,"FollowTheFacts",,,,,"http://pbs.twimg.com/media/DAM_jW_VYAEoEJO.jpg","https://t.co/LbW8xC1sSw","https://twitter.com/repbenraylujan/status/865605484778143745/photo/1","photo","http://pbs.twimg.com/media/DAM_jW_VYAEoEJO.jpg","https://t.co/LbW8xC1sSw","https://twitter.com/repbenraylujan/status/865605484778143745/photo/1",,,,"en",,,,,,,,,,,,,
"x864960750162518016",2017-05-17 21:48:07,"x19318314","repbenraylujan","We need an independent investigation of Trump’s reckless actions. Republicans shouldn’t stand in the way of efforts to #FollowTheFacts https://t.co/Lo9VBj5l4B","Twitter Web Client",,,,FALSE,FALSE,35,11,"FollowTheFacts",,,,,"http://pbs.twimg.com/media/DAD1CczXkAAV-17.jpg","https://t.co/Lo9VBj5l4B","https://twitter.com/repbenraylujan/status/864960750162518016/photo/1","photo","http://pbs.twimg.com/media/DAD1CczXkAAV-17.jpg","https://t.co/Lo9VBj5l4B","https://twitter.com/repbenraylujan/status/864960750162518016/photo/1",,,,"en",,,,,,,,,,,,,
"x863484236300509184",2017-05-13 20:00:59,"x19318314","repbenraylujan","Honored to speak at NNMC commencement-told grads no matter what their degree–they’re all architects of their futures–and of all our futures! https://t.co/ao5GuS7H1y","Twitter Web Client",,,,FALSE,FALSE,17,3,,,,,,"http://pbs.twimg.com/media/C_u2UncXoAEslSt.jpg","https://t.co/ao5GuS7H1y","https://twitter.com/repbenraylujan/status/863484236300509184/photo/1","photo","http://pbs.twimg.com/media/C_u2UncXoAEslSt.jpg","https://t.co/ao5GuS7H1y","https://twitter.com/repbenraylujan/status/863484236300509184/photo/1",,,,"en",,,,,,,,,,,,,
"x862076628825915393",2017-05-09 22:47:39,"x19318314","repbenraylujan","Firing the FBI Director in the midst of the Trump-Russia probe is staggering! What’s the President hiding? No one is above the law Mr Trump! https://t.co/ex5EqyroRe","Twitter Web Client",,,,FALSE,FALSE,91,63,,,,,,"http://pbs.twimg.com/media/C_a2HQ1UIAEsBIH.jpg","https://t.co/ex5EqyroRe","https://twitter.com/repbenraylujan/status/862076628825915393/photo/1","photo","http://pbs.twimg.com/media/C_a2HQ1UIAEsBIH.jpg","https://t.co/ex5EqyroRe","https://twitter.com/repbenraylujan/status/862076628825915393/photo/1",,,,"en",,,,,,,,,,,,,
"x860208804897722368",2017-05-04 19:05:35,"x19318314","repbenraylujan","Despite GOP claims, shameful Trumpcare bill is bad for seniors; it’s bad for veterans; and it’s bad for middle-class and working families. https://t.co/RQaJHa7CzW","Twitter Web Client",,,,FALSE,FALSE,66,30,,,,,,"http://pbs.twimg.com/media/C_ATUzHXcAAgf6m.jpg","https://t.co/RQaJHa7CzW","https://twitter.com/repbenraylujan/status/860208804897722368/photo/1","photo","http://pbs.twimg.com/media/C_ATUzHXcAAgf6m.jpg","https://t.co/RQaJHa7CzW","https://twitter.com/repbenraylujan/status/860208804897722368/photo/1",,,,"en",,,,,,,,,,,,,
"x859876192698204160",2017-05-03 21:03:54,"x19318314","repbenraylujan","Those bashing @jimmykimmel lack basic compassion/decency. He deserves better &amp; we all deserve better than #Trumpcare https://t.co/sTOkGoQbY0","Twitter Web Client",,,,FALSE,FALSE,31,6,"Trumpcare",,"theguardian.com/commentisfree/…","https://t.co/sTOkGoQbY0","https://www.theguardian.com/commentisfree/2017/may/03/jimmy-kimmel-heartlessness-healthcare-america",,,,,,,,,"x26053643","jimmykimmel","en",,,,,,,,,,,,,
"x859871700544090113",2017-05-03 20:46:03,"x19318314","repbenraylujan","Trying to ram thru same bad bill-calling it Trumpcare 2.0 must be GOP’s idea of recycling! Raises costs &amp; hurts those w preexisting condtns! https://t.co/taxGLiee0t","Twitter Web Client",,,,FALSE,FALSE,28,10,,,,,,"http://pbs.twimg.com/media/C-7grt5WsAE1MNQ.jpg","https://t.co/taxGLiee0t","https://twitter.com/repbenraylujan/status/859871700544090113/photo/1","photo","http://pbs.twimg.com/media/C-7grt5WsAE1MNQ.jpg","https://t.co/taxGLiee0t","https://twitter.com/repbenraylujan/status/859871700544090113/photo/1",,,,"en",,,,,,,,,,,,,
"x859530020586491904",2017-05-02 22:08:20,"x19318314","repbenraylujan","Moved by @jimmykimmel’s story. Why would GOP axe protections for preexisting conditions!? Fighting to keep protections for all families. https://t.co/cBAay2EytD","Twitter Web Client",,,,FALSE,FALSE,47,9,,,,,,"http://pbs.twimg.com/media/C-2p8WBXoAAXY0f.jpg","https://t.co/cBAay2EytD","https://twitter.com/repbenraylujan/status/859530020586491904/photo/1","photo","http://pbs.twimg.com/media/C-2p8WBXoAAXY0f.jpg","https://t.co/cBAay2EytD","https://twitter.com/repbenraylujan/status/859530020586491904/photo/1",,"x26053643","jimmykimmel","en",,,,,,,,,,,,,
"x859078708539396096",2017-05-01 16:14:59,"x19318314","repbenraylujan","Los Alamos HS is representing NM in the National Science Bowl national today in DC-116 teams competing for the national title-Go Los Alamos! https://t.co/f8g35xpiXq","Twitter Web Client",,,,FALSE,FALSE,20,1,,,,,,"http://pbs.twimg.com/media/C-wPfKyXkAI7S6M.jpg","https://t.co/f8g35xpiXq","https://twitter.com/repbenraylujan/status/859078708539396096/photo/1","photo","http://pbs.twimg.com/media/C-wPfKyXkAI7S6M.jpg","https://t.co/f8g35xpiXq","https://twitter.com/repbenraylujan/status/859078708539396096/photo/1",,,,"en",,,,,,,,,,,,,
"x858091036412973058",2017-04-28 22:50:20,"x19318314","repbenraylujan","Had fun talking w/ students from Dulce HS who were in Washington this week as part of the Close Up Foundation program. Doing a little Q&amp;A. https://t.co/kFFzCcL9dJ","Twitter Web Client",,,,FALSE,FALSE,20,5,,,,,,"http://pbs.twimg.com/media/C-iM-5zXsAABNYD.jpg","https://t.co/kFFzCcL9dJ","https://twitter.com/repbenraylujan/status/858091036412973058/photo/1","photo","http://pbs.twimg.com/media/C-iM-5zXsAABNYD.jpg","https://t.co/kFFzCcL9dJ","https://twitter.com/repbenraylujan/status/858091036412973058/photo/1",,,,"en",,,,,,,,,,,,,
"x858090267806715904",2017-04-28 22:47:17,"x19318314","repbenraylujan","Honored to meet w/ NM Teacher of the Year Stephanie Gurule-Leyba and her family in the US Capitol https://t.co/AS8ivHIgHT","Twitter Web Client",,,,FALSE,FALSE,9,0,,,,,,"http://pbs.twimg.com/media/C-iMhz9W0AAm3uw.jpg","https://t.co/AS8ivHIgHT","https://twitter.com/repbenraylujan/status/858090267806715904/photo/1","photo","http://pbs.twimg.com/media/C-iMhz9W0AAm3uw.jpg","https://t.co/AS8ivHIgHT","https://twitter.com/repbenraylujan/status/858090267806715904/photo/1",,,,"en",,,,,,,,,,,,,
"x857709916768931842",2017-04-27 21:35:54,"x19318314","repbenraylujan","Trumpcare 2.0 breaks almost all the promises the GOP made to American people. See my op-ed in US News &amp; World Report:https://t.co/OqgsV3yaak","Twitter Web Client",,,,FALSE,FALSE,17,5,,,"usnews.com/opinion/policy…","https://t.co/OqgsV3yaak","https://www.usnews.com/opinion/policy-dose/articles/2017-04-27/republicans-are-breaking-6-health-care-promises-in-trumpcare-20",,,,,,,,,,,"en",,,,,,,,,,,,,
"x857284673596207104",2017-04-26 17:26:08,"x19318314","repbenraylujan","Trump’s new Exec Order to review/downgrade nat’l monuments-like Rio Grande Del Norte-is a direct attack on America’s parks, public lands. https://t.co/HxaQF8gE7o","Twitter Web Client",,,,FALSE,FALSE,46,25,,,,,,"http://pbs.twimg.com/media/C-Wv0gEXsAA_z2M.jpg","https://t.co/HxaQF8gE7o","https://twitter.com/repbenraylujan/status/857284673596207104/photo/1","photo","http://pbs.twimg.com/media/C-Wv0gEXsAA_z2M.jpg","https://t.co/HxaQF8gE7o","https://twitter.com/repbenraylujan/status/857284673596207104/photo/1",,,,"en",,,,,,,,,,,,,
"x855519003166552066",2017-04-21 20:29:59,"x19318314","repbenraylujan","In this week’s Democratic Address, I draw attention to @realDonaldTrump’s strained relationship w/ the truth in his first 100 days. https://t.co/nTjDr6sBmn","Media Studio",,,,FALSE,FALSE,227,122,,,,,,"http://pbs.twimg.com/amplify_video_thumb/855514801220485120/img/F5V45jqQkHyVssJQ.jpg","https://t.co/nTjDr6sBmn","https://twitter.com/repbenraylujan/status/855519003166552066/video/1","photo","http://pbs.twimg.com/amplify_video_thumb/855514801220485120/img/F5V45jqQkHyVssJQ.jpg","https://t.co/nTjDr6sBmn","https://twitter.com/repbenraylujan/status/855519003166552066/video/1",,"x25073877","realDonaldTrump","en",,,,,,,,,,,,,
"x855140731756957696",2017-04-20 19:26:52,"x19318314","repbenraylujan","Tremendous visit at Santa Fe Community College - learned more about SFCC programs to help students enter the renewable energy job market! https://t.co/kBLFsxRVgK","Twitter Web Client",,,,FALSE,FALSE,15,0,,,,,,"http://pbs.twimg.com/media/C94Rz2nXUAAMw-e.jpg","https://t.co/kBLFsxRVgK","https://twitter.com/repbenraylujan/status/855140731756957696/photo/1","photo","http://pbs.twimg.com/media/C94Rz2nXUAAMw-e.jpg","https://t.co/kBLFsxRVgK","https://twitter.com/repbenraylujan/status/855140731756957696/photo/1",,,,"en",,,,,,,,,,,,,
"x851909232144384001",2017-04-11 21:26:03,"x19318314","repbenraylujan","Had a great time talking about our government with students in Mr. Ellis' class! Of course we had to take a selfie, right?! https://t.co/K4pCfmizIO","Twitter Web Client",,,,FALSE,FALSE,35,3,,,,,,"http://pbs.twimg.com/media/C9KWhKmXsAALXO8.jpg","https://t.co/K4pCfmizIO","https://twitter.com/repbenraylujan/status/851909232144384001/photo/1","photo","http://pbs.twimg.com/media/C9KWhKmXsAALXO8.jpg","https://t.co/K4pCfmizIO","https://twitter.com/repbenraylujan/status/851909232144384001/photo/1",,,,"en",,,,,,,,,,,,,
"x851895771494584320",2017-04-11 20:32:34,"x19318314","repbenraylujan","Great visit with students at Miyamura HS in Gallup! Teacher John Ellis invited me for a Q&amp;A session w/ his  Advanced Placement History class https://t.co/aZNLRnTHbA","Twitter Web Client",,,,FALSE,FALSE,15,2,,,,,,"http://pbs.twimg.com/media/C9KKpeZXgAAcqCo.jpg","https://t.co/aZNLRnTHbA","https://twitter.com/repbenraylujan/status/851895771494584320/photo/1","photo","http://pbs.twimg.com/media/C9KKpeZXgAAcqCo.jpg","https://t.co/aZNLRnTHbA","https://twitter.com/repbenraylujan/status/851895771494584320/photo/1",,,,"en",,,,,,,,,,,,,
"x851874115334090752",2017-04-11 19:06:30,"x19318314","repbenraylujan","In Gallup today to meet w/ more than a dozen veterans at Gallup Veterans Center to discuss veterans issues &amp; legislation before Congress. https://t.co/apvRqbpRoV","Twitter Web Client",,,,FALSE,FALSE,22,3,,,,,,"http://pbs.twimg.com/media/C9J29HVXcAAh24m.jpg","https://t.co/apvRqbpRoV","https://twitter.com/repbenraylujan/status/851874115334090752/photo/1","photo","http://pbs.twimg.com/media/C9J29HVXcAAh24m.jpg","https://t.co/apvRqbpRoV","https://twitter.com/repbenraylujan/status/851874115334090752/photo/1",,,,"en",,,,,,,,,,,,,
"x850366726466416640",2017-04-07 15:16:41,"x19318314","repbenraylujan","My statement on last night's U.S. missile strikes in Syria https://t.co/6dtOgpUSio","Twitter Web Client",,,,FALSE,FALSE,32,10,,,,,,"http://pbs.twimg.com/media/C80b87RXgAAX99m.jpg","https://t.co/6dtOgpUSio","https://twitter.com/repbenraylujan/status/850366726466416640/photo/1","photo","http://pbs.twimg.com/media/C80b87RXgAAX99m.jpg","https://t.co/6dtOgpUSio","https://twitter.com/repbenraylujan/status/850366726466416640/photo/1",,,,"en",,,,,,,,,,,,,
"x849997310608191494",2017-04-06 14:48:45,"x19318314","repbenraylujan","GOP can spin it but pressure from American people forced Nunes to recuse himself  from Russia probe-now need inpdnt invstgtn #FollowTheFacts https://t.co/U5eyEES3R3","Twitter Web Client",,,,FALSE,FALSE,142,98,"FollowTheFacts",,,,,"http://pbs.twimg.com/media/C8vL8ICXYAEjjGW.jpg","https://t.co/U5eyEES3R3","https://twitter.com/repbenraylujan/status/849997310608191494/photo/1","photo","http://pbs.twimg.com/media/C8vL8ICXYAEjjGW.jpg","https://t.co/U5eyEES3R3","https://twitter.com/repbenraylujan/status/849997310608191494/photo/1",,,,"en",,,,,,,,,,,,,
"x849690226838712327",2017-04-05 18:28:31,"x19318314","repbenraylujan","There’s no excuse for a president to be able to hide his financial dealings from the public. I #DemandAVote to release Trump’s tax returns! https://t.co/Ehrz5UKDCa","Twitter Web Client",,,,FALSE,FALSE,51,22,"DemandAVote",,,,,"http://pbs.twimg.com/media/C8q0tbPWAAAq6Tl.jpg","https://t.co/Ehrz5UKDCa","https://twitter.com/repbenraylujan/status/849690226838712327/photo/1","photo","http://pbs.twimg.com/media/C8q0tbPWAAAq6Tl.jpg","https://t.co/Ehrz5UKDCa","https://twitter.com/repbenraylujan/status/849690226838712327/photo/1",,,,"en",,,,,,,,,,,,,
"x849407007824257028",2017-04-04 23:43:06,"x19318314","repbenraylujan",".@HispanicCaucus  met w Homeland Sec. Kelly–discussed tough issues—ICE raids; family separations &amp; immigration–need answers &amp; fairness! https://t.co/rnJQxXX3jX","Twitter Web Client",,,,FALSE,FALSE,33,17,,,,,,"http://pbs.twimg.com/media/C8mzH2FWsAAeeaA.jpg","https://t.co/rnJQxXX3jX","https://twitter.com/repbenraylujan/status/849407007824257028/photo/1","photo","http://pbs.twimg.com/media/C8mzH2FWsAAeeaA.jpg","https://t.co/rnJQxXX3jX","https://twitter.com/repbenraylujan/status/849407007824257028/photo/1",,"x33530012","HispanicCaucus","en",,,,,,,,,,,,,
"x847840389524541440",2017-03-31 15:57:55,"x19318314","repbenraylujan","Enough is enough! Americans deserve the truth. Time for an independent commission to #FollowTheFacts on Russia’s meddling in our election!","Twitter Web Client",,,,FALSE,FALSE,401,246,"FollowTheFacts",,,,,,,,,,,,,,,"en",,,,,,,,,,,,,
"x846803809204654083",2017-03-28 19:18:55,"x19318314","repbenraylujan","I’m voting against SJ Res 34, because I believe that Americans have a right to protect their private information. https://t.co/lAtwUzIl2n","Twitter Web Client",,,,FALSE,FALSE,62,18,,,"fortune.com/2017/03/27/onl…","https://t.co/lAtwUzIl2n","http://fortune.com/2017/03/27/online-privacy-data-collection-verizon-att-comcast-congress/",,,,,,,,,,,"en",,,,,,,,,,,,,
"x846795485121843201",2017-03-28 18:45:51,"x19318314","repbenraylujan","Trump’s latest ExecOrder walks away from nat’l clean power plan &amp; will have deep impact on our environment, economy &amp; health. #climatechange","Twitter Web Client",,,,FALSE,FALSE,31,12,"climatechange",,,,,,,,,,,,,,,"en",,,,,,,,,,,,,
"x846775683812610049",2017-03-28 17:27:10,"x19318314","repbenraylujan","Intelligence Chair has a solemn responsibility to the nation. Nunes must recuse himself from Trump-Russia investigation now! #FollowTheFacts https://t.co/ldx6ti1BGP","Twitter Web Client",,,,FALSE,FALSE,855,444,"FollowTheFacts",,,,,"http://pbs.twimg.com/media/C8BZ8u2WsAAoDt0.jpg","https://t.co/ldx6ti1BGP","https://twitter.com/repbenraylujan/status/846775683812610049/photo/1","photo","http://pbs.twimg.com/media/C8BZ8u2WsAAoDt0.jpg","https://t.co/ldx6ti1BGP","https://twitter.com/repbenraylujan/status/846775683812610049/photo/1",,,,"en",,,,,,,,,,,,,
"x845396109732315140",2017-03-24 22:05:13,"x19318314","repbenraylujan",".@HouseDemocrats Watch on #Periscope .@NancyPelosi @WhipHoyer @Clyburn @repj… https://t.co/M69qZBOYuc","Twitter Web Client",,,,FALSE,FALSE,8,4,"Periscope",,"pscp.tv/HouseDemocrats…","https://t.co/M69qZBOYuc","https://www.pscp.tv/HouseDemocrats/1mrGmeYYmPwGy?t=19m36s",,,,,,,,,"x43963249 15764644 22012091 188019606 250108922","HouseDemocrats NancyPelosi WhipHoyer Clyburn REPJ","en",,,,,,,,,,,,,
"x845364182451138561",2017-03-24 19:58:21,"x19318314","repbenraylujan","GOP pulled Trumpcare when they lacked votes-you can fool all of the people some of the time &amp; some of the people all the time-but not today!","Twitter Web Client",,,,FALSE,FALSE,101,52,,,,,,,,,,,,,,,,"en",,,,,,,,,,,,,
"x845274067246727169",2017-03-24 14:00:16,"x19318314","repbenraylujan","Big vote in US House today. Trump/GOP  desperate to win conservative votes. Makes a bad bill even worse for working families #ProtectOurCare https://t.co/BNzSoZbrSZ","Twitter Web Client",,,,FALSE,FALSE,19,18,"ProtectOurCare",,,,,"http://pbs.twimg.com/media/C7sEQSTXUAEIV5g.jpg","https://t.co/BNzSoZbrSZ","https://twitter.com/repbenraylujan/status/845274067246727169/photo/1","photo","http://pbs.twimg.com/media/C7sEQSTXUAEIV5g.jpg","https://t.co/BNzSoZbrSZ","https://twitter.com/repbenraylujan/status/845274067246727169/photo/1",,,,"en",,,,,,,,,,,,,
"x845033562852216832",2017-03-23 22:04:36,"x19318314","repbenraylujan","EHBs mean coverage for doctor &amp; ER visits, Rx drugs. If you’re buying insurance w/o these things, what’s the point? https://t.co/R09EzGQ7Sm","Twitter Web Client",,,,FALSE,FALSE,20,8,,,"abqjournal.com/974432/pearce-…","https://t.co/R09EzGQ7Sm","https://www.abqjournal.com/974432/pearce-leaning-no-on-gop-health-plan.html",,,,,,,,,,,"en",,,,,,,,,,,,,
"x844570997776945152",2017-03-22 15:26:31,"x19318314","repbenraylujan","Trumpcare bad on many levels-Raises your health costs (premiums/deductibles/copays)-imposes age tax on those 50+ &amp; strips care from millions","Twitter Web Client",,,,FALSE,FALSE,29,14,,,,,,,,,,,,,,,,"en",,,,,,,,,,,,,
"x844319449012424704",2017-03-21 22:46:57,"x19318314","repbenraylujan","#Trumpcare
-increases premiums &amp; out-of-pocket costs on families/seniors
-kills NM healthcare jobs
-includes huge tax cuts for wealthiest","Twitter Web Client",,,,FALSE,FALSE,35,21,"Trumpcare",,,,,,,,,,,,,,,"en",,,,,,,,,,,,,
"x842784646568067073",2017-03-17 17:08:12,"x19318314","repbenraylujan","Best of luck to NM State’s men’s and women’s teams who are in this year’s NCAA tourney. We’re all Aggies this month! Go NMSU! #MarchMadness https://t.co/4dUn8XLcfr","Twitter Web Client",,,,FALSE,FALSE,18,4,"MarchMadness",,,,,"http://pbs.twimg.com/media/C7IsJXvWkAAoMD9.jpg","https://t.co/4dUn8XLcfr","https://twitter.com/repbenraylujan/status/842784646568067073/photo/1","photo","http://pbs.twimg.com/media/C7IsJXvWkAAoMD9.jpg","https://t.co/4dUn8XLcfr","https://twitter.com/repbenraylujan/status/842784646568067073/photo/1",,,,"en",,,,,,,,,,,,,
"x842771297776091142",2017-03-17 16:15:09,"x19318314","repbenraylujan","Met w/ DHS Sec. Kelly - proud to stand w Cong. Hispanic Caucus colleagues &amp; ask tough questions on DACA students; ICE raids &amp; border wall. https://t.co/6ClhaMnebh","Twitter Web Client",,,,FALSE,FALSE,15,4,,,,,,"http://pbs.twimg.com/media/C7If47MX4AA7xVG.jpg","https://t.co/6ClhaMnebh","https://twitter.com/repbenraylujan/status/842771297776091142/photo/1","photo","http://pbs.twimg.com/media/C7If47MX4AA7xVG.jpg","https://t.co/6ClhaMnebh","https://twitter.com/repbenraylujan/status/842771297776091142/photo/1",,,,"en",,,,,,,,,,,,,
"x842489857096278022",2017-03-16 21:36:49,"x19318314","repbenraylujan","#MealsOnWheels For some, it may be their only meal of the day &amp; the meal deliverer may be the only person they see. Trump budget cuts it. https://t.co/hEwZuwF2Lf","Twitter Web Client",,,,FALSE,FALSE,57,54,"MealsOnWheels",,,,,"http://pbs.twimg.com/media/C7EgAWkWkAIeo2K.jpg","https://t.co/hEwZuwF2Lf","https://twitter.com/repbenraylujan/status/842489857096278022/photo/1","photo","http://pbs.twimg.com/media/C7EgAWkWkAIeo2K.jpg","https://t.co/hEwZuwF2Lf","https://twitter.com/repbenraylujan/status/842489857096278022/photo/1",,,,"en",,,,,,,,,,,,,
"x842487357874094080",2017-03-16 21:26:53,"x19318314","repbenraylujan","Prez didn’t send full budget, just “blueprint” w/ few details. But more we see, worse it gets. Cuts #pellgrants, workstudy, #MealsOnWheels https://t.co/XiKllY57QN","Twitter Web Client",,,,FALSE,FALSE,21,14,"pellgrants MealsOnWheels",,,,,"http://pbs.twimg.com/media/C7EdddNXwAIXXIP.jpg","https://t.co/XiKllY57QN","https://twitter.com/repbenraylujan/status/842487357874094080/photo/1","photo","http://pbs.twimg.com/media/C7EdddNXwAIXXIP.jpg","https://t.co/XiKllY57QN","https://twitter.com/repbenraylujan/status/842487357874094080/photo/1",,,,"en",,,,,,,,,,,,,
"x842466998487547904",2017-03-16 20:05:59,"x19318314","repbenraylujan","Pres. Trump’s education budget doesn’t make America great; it just drives middle-class and working students into greater debt #TrumpCuts https://t.co/weGe9z0zks","Twitter Web Client",,,,FALSE,FALSE,22,5,"TrumpCuts",,,,,"http://pbs.twimg.com/media/C7ELPV-WkAAZBf8.jpg","https://t.co/weGe9z0zks","https://twitter.com/repbenraylujan/status/842466998487547904/photo/1","photo","http://pbs.twimg.com/media/C7ELPV-WkAAZBf8.jpg","https://t.co/weGe9z0zks","https://twitter.com/repbenraylujan/status/842466998487547904/photo/1",,,,"en",,,,,,,,,,,,,
