"status_id","created_at","user_id","screen_name","text","source","reply_to_status_id","reply_to_user_id","reply_to_screen_name","is_quote","is_retweet","favorite_count","retweet_count","hashtags","symbols","urls_url","urls_t.co","urls_expanded_url","media_url","media_t.co","media_expanded_url","media_type","ext_media_url","ext_media_t.co","ext_media_expanded_url","ext_media_type","mentions_user_id","mentions_screen_name","lang","quoted_status_id","quoted_text","retweet_status_id","retweet_text","place_url","place_name","place_full_name","place_type","country","country_code","geo_coords","coords_coords","bbox_coords"
"x600662931508977664",2015-05-19 14:02:57,"x221792092","NitaLowey","W/ #HighwayTrustFund expiring on May 31, roughly $5m for Ashford Avenue Bridge in Dobbs Ferry is at risk. http://t.co/8RaBi0U3ev","Twitter Web Client",,,,FALSE,FALSE,1,3,"HighwayTrustFund",,,,,"http://pbs.twimg.com/media/CFX7wMSWgAAqZ4K.jpg","http://t.co/8RaBi0U3ev","https://twitter.com/NitaLowey/status/600662931508977664/photo/1","photo","http://pbs.twimg.com/media/CFX7wMSWgAAqZ4K.jpg","http://t.co/8RaBi0U3ev","https://twitter.com/NitaLowey/status/600662931508977664/photo/1",,,,"en",,,,,,,,,,,,,
"x600662365596712960",2015-05-19 14:00:42,"x221792092","NitaLowey","Yesterday in Dobbs Ferry, I called on Congress to pass a long-term reauthorization of the #HighwayTrustFund http://t.co/MguY8HitFs","Twitter Web Client",,,,FALSE,FALSE,0,3,"HighwayTrustFund",,"1.usa.gov/1AcE2zj","http://t.co/MguY8HitFs","http://1.usa.gov/1AcE2zj",,,,,,,,,,,"en",,,,,,,,,,,,,
"x600335085800415232",2015-05-18 16:20:12,"x221792092","NitaLowey","I’ll continue supporting Head Start b/c nothing produces better returns than investing in our children. #HeadStart50 http://t.co/vezI3fT542","Twitter Web Client",,,,FALSE,FALSE,0,2,"HeadStart50",,,,,"http://pbs.twimg.com/media/CFTRlEOWoAECMQT.jpg","http://t.co/vezI3fT542","https://twitter.com/NitaLowey/status/600335085800415232/photo/1","photo","http://pbs.twimg.com/media/CFTRlEOWoAECMQT.jpg","http://t.co/vezI3fT542","https://twitter.com/NitaLowey/status/600335085800415232/photo/1",,,,"en",,,,,,,,,,,,,
"x600334766928441344",2015-05-18 16:18:56,"x221792092","NitaLowey","Today marks the 50th Anniversary of Head Start, which served &gt;3K children + families in Rockland and Westchester last year. #HeadStart50","Twitter Web Client",,,,FALSE,FALSE,1,2,"HeadStart50",,,,,,,,,,,,,,,"en",,,,,,,,,,,,,
"x598858773520883712",2015-05-14 14:33:52,"x221792092","NitaLowey","Proud to receive @HumaneSociety Legislative Leader award for perfect score on 2014 Humane Scorecard http://t.co/r7SZFs2gdC","Twitter Web Client",,,,FALSE,FALSE,3,2,,,,,,"http://pbs.twimg.com/media/CE-S4X8VAAADL9H.jpg","http://t.co/r7SZFs2gdC","https://twitter.com/NitaLowey/status/598858773520883712/photo/1","photo","http://pbs.twimg.com/media/CE-S4X8VAAADL9H.jpg","http://t.co/r7SZFs2gdC","https://twitter.com/NitaLowey/status/598858773520883712/photo/1",,"x15769327","HumaneSociety","en",,,,,,,,,,,,,
"x598577019736203264",2015-05-13 19:54:17,"x221792092","NitaLowey","As RM of House Approps Cmte, I will continue working to increase @NIH funding so we can find cures for diseases like #ALS @alsassociation","Twitter Web Client",,,,FALSE,FALSE,0,4,"ALS",,,,,,,,,,,,,"x15134240 21416670","NIH alsassociation","en",,,,,,,,,,,,,
"x598576818573156352",2015-05-13 19:53:29,"x221792092","NitaLowey","Met w/ @alsassociation reps, including constituents from Cortlandt and Port Chester, in my Washington DC office http://t.co/YtzgmIelen","Twitter Web Client",,,,FALSE,FALSE,0,4,,,,,,"http://pbs.twimg.com/media/CE6ScbyXIAALs8U.jpg","http://t.co/YtzgmIelen","https://twitter.com/NitaLowey/status/598576818573156352/photo/1","photo","http://pbs.twimg.com/media/CE6ScbyXIAALs8U.jpg","http://t.co/YtzgmIelen","https://twitter.com/NitaLowey/status/598576818573156352/photo/1",,"x21416670","alsassociation","en",,,,,,,,,,,,,
"x596747787456352257",2015-05-08 18:45:34,"x221792092","NitaLowey","As RM on House Approps Cmte, I’ll continue supporting #smallbiz in the Lower Hudson Valley – the backbone of our economy. #SmallBusinessWeek","Hootsuite",,,,FALSE,FALSE,0,3,"smallbiz SmallBusinessWeek",,,,,,,,,,,,,,,"en",,,,,,,,,,,,,
"x596744071554670592",2015-05-08 18:30:48,"x221792092","NitaLowey","In 2013, @SBAgov supported $29m in capital to businesses in Westchester and Rockland #DreamSmallBiz #SmallBusinessWeek","Hootsuite",,,,FALSE,FALSE,0,1,"DreamSmallBiz SmallBusinessWeek",,,,,,,,,,,,,"x153149305","SBAgov","en",,,,,,,,,,,,,
"x596741048254255105",2015-05-08 18:18:47,"x221792092","NitaLowey","Great walking tour today with @LtGovHochulNY &amp; @wpmayorroach in White Plains to celebrate #smallbusinessweek http://t.co/YRYOBqKcSQ","Twitter Web Client",,,,FALSE,FALSE,0,6,"smallbusinessweek",,,,,"http://pbs.twimg.com/media/CEgM0VSWYAADMA0.jpg","http://t.co/YRYOBqKcSQ","https://twitter.com/NitaLowey/status/596741048254255105/photo/1","photo","http://pbs.twimg.com/media/CEgM0VSWYAADMA0.jpg http://pbs.twimg.com/media/CEgM0iRWEAA0Ujr.jpg http://pbs.twimg.com/media/CEgM0dgWEAALkbb.jpg","http://t.co/YRYOBqKcSQ http://t.co/YRYOBqKcSQ http://t.co/YRYOBqKcSQ","https://twitter.com/NitaLowey/status/596741048254255105/photo/1 https://twitter.com/NitaLowey/status/596741048254255105/photo/1 https://twitter.com/NitaLowey/status/596741048254255105/photo/1",,"x2977083957 925128368","LtGovHochulNY wpmayorroach","en",,,,,,,,,,,,,
"x596740818033111041",2015-05-08 18:17:52,"x221792092","NitaLowey","I visited the General Bearing Corporation manufacturing facility in West Nyack #DreamSmallBiz http://t.co/ULIU1Dw8Jv","Twitter Web Client",,,,FALSE,FALSE,0,1,"DreamSmallBiz",,,,,"http://pbs.twimg.com/media/CEgMnIjWMAElGeH.jpg","http://t.co/ULIU1Dw8Jv","https://twitter.com/NitaLowey/status/596740818033111041/photo/1","photo","http://pbs.twimg.com/media/CEgMnIjWMAElGeH.jpg","http://t.co/ULIU1Dw8Jv","https://twitter.com/NitaLowey/status/596740818033111041/photo/1",,,,"en",,,,,,,,,,,,,
"x596740677926551554",2015-05-08 18:17:19,"x221792092","NitaLowey","This week is #SmallBusinessWeek, where we recognize the important contributions of America’s entrepreneurs and #smallbiz owners.","Twitter Web Client",,,,FALSE,FALSE,1,2,"SmallBusinessWeek smallbiz",,,,,,,,,,,,,,,"en",,,,,,,,,,,,,
"x596432841031946240",2015-05-07 21:54:05,"x221792092","NitaLowey","I am pleased the Senate passed #Iran Review Act. Looking forward to working with my colleagues to quickly pass the measure in the House.","Twitter Web Client",,,,FALSE,FALSE,0,3,"Iran",,,,,,,,,,,,,,,"en",,,,,,,,,,,,,
"x596331198600843265",2015-05-07 15:10:11,"x221792092","NitaLowey","I look forward to working with the new Israeli government to advance our common interests and protect our shared security needs.","Twitter Web Client",,,,FALSE,FALSE,4,7,,,,,,,,,,,,,,,,"en",,,,,,,,,,,,,
"x596330280320966656",2015-05-07 15:06:32,"x221792092","NitaLowey","I congratulate @IsraeliPM on his successful formation of the new #Israel governing coalition. http://t.co/QPSExJshpd","Twitter Web Client",,,,FALSE,FALSE,1,2,"Israel",,"1.usa.gov/1IkOTbn","http://t.co/QPSExJshpd","http://1.usa.gov/1IkOTbn",,,,,,,,,"x141084952","IsraeliPM","en",,,,,,,,,,,,,
"x595997750354911232",2015-05-06 17:05:11,"x221792092","NitaLowey","As RM of House Approps Cmte, I will continue fighting to ensure the safe transport of hazardous materials via rail. http://t.co/lG5Re7x3r9","Hootsuite",,,,FALSE,FALSE,0,3,,,"1.usa.gov/1GPie9F","http://t.co/lG5Re7x3r9","http://1.usa.gov/1GPie9F",,,,,,,,,,,"en",,,,,,,,,,,,,
"x595992583219912705",2015-05-06 16:44:39,"x221792092","NitaLowey","I'll be introducing a bill to immediately ban interstate shipment of high-volatility crude oil http://t.co/lG5Re7x3r9 http://t.co/5AsYt9IA62","Twitter Web Client",,,,FALSE,FALSE,4,5,,,"1.usa.gov/1GPie9F","http://t.co/lG5Re7x3r9","http://1.usa.gov/1GPie9F","http://pbs.twimg.com/media/CEVkGIiUsAABX7I.jpg","http://t.co/5AsYt9IA62","https://twitter.com/NitaLowey/status/595992583219912705/photo/1","photo","http://pbs.twimg.com/media/CEVkGIiUsAABX7I.jpg","http://t.co/5AsYt9IA62","https://twitter.com/NitaLowey/status/595992583219912705/photo/1",,,,"en",,,,,,,,,,,,,
"x595991612544671744",2015-05-06 16:40:48,"x221792092","NitaLowey","We need to act faster to guarantee safety of people living near railways.","Twitter Web Client",,,,FALSE,FALSE,0,2,,,,,,,,,,,,,,,,"en",,,,,,,,,,,,,
"x595640685694492672",2015-05-05 17:26:20,"x221792092","NitaLowey","No student should fear sexual assault on a college campus &amp; parents deserve peace of mind that children are as safe as possible.","Twitter Web Client",,,,FALSE,FALSE,0,3,,,,,,,,,,,,,,,,"en",,,,,,,,,,,,,
"x594129176078196737",2015-05-01 13:20:08,"x221792092","NitaLowey","#RaiseTheWage Act would raise the min. wage to $12 by 2020, eliminate the subminimum tipped wage system, &amp; index min. wage to median wage.","Hootsuite",,,,FALSE,FALSE,1,4,"RaiseTheWage",,,,,,,,,,,,,,,"en",,,,,,,,,,,,,
"x594124139021135873",2015-05-01 13:00:07,"x221792092","NitaLowey","I co-sponsored the #RaiseTheWage Act in the House, because hardworking Americans deserve a raise. http://t.co/IZ5IrJIlxG","Twitter Web Client",,,,FALSE,FALSE,0,1,"RaiseTheWage",,,,,"http://pbs.twimg.com/media/CD7AwZfVEAEc_HW.png","http://t.co/IZ5IrJIlxG","https://twitter.com/NitaLowey/status/594124139021135873/photo/1","photo","http://pbs.twimg.com/media/CD7AwZfVEAEc_HW.png","http://t.co/IZ5IrJIlxG","https://twitter.com/NitaLowey/status/594124139021135873/photo/1",,,,"en",,,,,,,,,,,,,
"x593111803317616640",2015-04-28 17:57:28,"x221792092","NitaLowey","RT if you agree @budlight #UpForWhatever campaign should promote responsible - not reckless - drinking. #NoMeansNo http://t.co/EFxwi2nZ4w","Twitter Web Client",,,,FALSE,FALSE,103,167,"UpForWhatever NoMeansNo",,,,,"http://pbs.twimg.com/media/CDsoCs1W0AAcDz0.jpg","http://t.co/EFxwi2nZ4w","https://twitter.com/NitaLowey/status/593111803317616640/photo/1","photo","http://pbs.twimg.com/media/CDsoCs1W0AAcDz0.jpg","http://t.co/EFxwi2nZ4w","https://twitter.com/NitaLowey/status/593111803317616640/photo/1",,"x742011151","budlight","en",,,,,,,,,,,,,
"x593082226167906305",2015-04-28 15:59:56,"x221792092","NitaLowey","RT if you agree: Our laws must support ALL Americans, regardless of sexual orientation! #SCOTUS #MarriageEquality http://t.co/zQwtPOL8Vu","Twitter Web Client",,,,FALSE,FALSE,9,10,"SCOTUS MarriageEquality",,,,,"http://pbs.twimg.com/media/CDsNJFeUEAAIOxc.jpg","http://t.co/zQwtPOL8Vu","https://twitter.com/NitaLowey/status/593082226167906305/photo/1","photo","http://pbs.twimg.com/media/CDsNJFeUEAAIOxc.jpg","http://t.co/zQwtPOL8Vu","https://twitter.com/NitaLowey/status/593082226167906305/photo/1",,,,"en",,,,,,,,,,,,,
"x591716734610055168",2015-04-24 21:33:57,"x221792092","NitaLowey","Congrats to Rockland Water Coalition on being named an @EPA Environmental Champion! Thanks for protecting our water! http://t.co/WfrXshKMPK","Twitter Web Client",,,,FALSE,FALSE,0,4,,,"lohud.us/1EoSNhX","http://t.co/WfrXshKMPK","http://lohud.us/1EoSNhX",,,,,,,,,"x14615871","EPA","en",,,,,,,,,,,,,
"x591677761506381824",2015-04-24 18:59:05,"x221792092","NitaLowey","Was in Palisades today to announce $35m @NSF agreement with @LamontEarth for oceanic research http://t.co/FUJoXrnMpN http://t.co/egUWMc3oaU","Twitter Web Client",,,,FALSE,FALSE,8,13,,,"1.usa.gov/1FkwR8J","http://t.co/FUJoXrnMpN","http://1.usa.gov/1FkwR8J","http://pbs.twimg.com/media/CDYPydMUsAAyS6L.jpg","http://t.co/egUWMc3oaU","https://twitter.com/NitaLowey/status/591677761506381824/photo/1","photo","http://pbs.twimg.com/media/CDYPydMUsAAyS6L.jpg","http://t.co/egUWMc3oaU","https://twitter.com/NitaLowey/status/591677761506381824/photo/1",,"x16245822 498123757","NSF LamontEarth","en",,,,,,,,,,,,,
"x591628629626462208",2015-04-24 15:43:51,"x221792092","NitaLowey",".@MTA’s application to install positive train control technology will be approved by the federal govt http://t.co/XSxQbhFWUd","Twitter Web Client",,,,FALSE,FALSE,0,1,,,"1.usa.gov/1DHxT9b","http://t.co/XSxQbhFWUd","http://1.usa.gov/1DHxT9b",,,,,,,,,"x94129050","MTA","en",,,,,,,,,,,,,
"x591348000275988481",2015-04-23 21:08:44,"x221792092","NitaLowey","I join #Israel in celebrating 67 yrs of independence &amp; 6+ decades of steadfast support by the U.S. http://t.co/A6bWk7U65S #YomHaatzmaut","Twitter Web Client",,,,FALSE,FALSE,1,2,"Israel YomHaatzmaut",,"1.usa.gov/1DmWvoy","http://t.co/A6bWk7U65S","http://1.usa.gov/1DmWvoy",,,,,,,,,,,"en",,,,,,,,,,,,,
"x590572077276655616",2015-04-21 17:45:30,"x221792092","NitaLowey","As RM of the House Approps Cmte, I will continue fighting for increased #education funding to ensure hardworking New Yorkers can find jobs.","Hootsuite",,,,FALSE,FALSE,1,2,"education",,,,,,,,,,,,,,,"en",,,,,,,,,,,,,
"x590566493793996800",2015-04-21 17:23:18,"x221792092","NitaLowey","2500 unfilled positions in #Westchester County that require STEM education. We must provide students w/ #STEM skills. http://t.co/8hOATE00qJ","Twitter Web Client",,,,FALSE,FALSE,1,3,"Westchester STEM",,,,,"http://pbs.twimg.com/media/CDIdGKzW0AAZfLU.jpg","http://t.co/8hOATE00qJ","https://twitter.com/NitaLowey/status/590566493793996800/photo/1","photo","http://pbs.twimg.com/media/CDIdGKzW0AAZfLU.jpg","http://t.co/8hOATE00qJ","https://twitter.com/NitaLowey/status/590566493793996800/photo/1",,,,"en",,,,,,,,,,,,,
"x590564515865042947",2015-04-21 17:15:27,"x221792092","NitaLowey",".@mercycollege #STEM Research Center made possible by a $3.7m federal grant I helped secure http://t.co/I9ci4Ja7mN","Hootsuite",,,,FALSE,FALSE,0,2,"STEM",,"1.usa.gov/1ObkMbr","http://t.co/I9ci4Ja7mN","http://1.usa.gov/1ObkMbr",,,,,,,,,"x21915917","mercycollege","en",,,,,,,,,,,,,
"x590559688862859264",2015-04-21 16:56:16,"x221792092","NitaLowey","I was at @mercycollege this morning for their #STEM Research Center ribbon cutting http://t.co/I9ci4Ja7mN http://t.co/XDKtYyvsAm","Twitter Web Client",,,,FALSE,FALSE,0,1,"STEM",,"1.usa.gov/1ObkMbr","http://t.co/I9ci4Ja7mN","http://1.usa.gov/1ObkMbr","http://pbs.twimg.com/media/CDIW6E2WEAENSmX.jpg","http://t.co/XDKtYyvsAm","https://twitter.com/NitaLowey/status/590559688862859264/photo/1","photo","http://pbs.twimg.com/media/CDIW6E2WEAENSmX.jpg","http://t.co/XDKtYyvsAm","https://twitter.com/NitaLowey/status/590559688862859264/photo/1",,"x21915917","mercycollege","en",,,,,,,,,,,,,
"x590249887717031937",2015-04-20 20:25:14,"x221792092","NitaLowey","As a member of the Congressional Cancer Caucus, I will continue to help the 45K Americans diagnosed every year with pancreatic cancer.","Hootsuite",,,,FALSE,FALSE,1,3,,,,,,,,,,,,,,,,"en",,,,,,,,,,,,,
"x590247459391156225",2015-04-20 20:15:35,"x221792092","NitaLowey","I was at Rye Playland for the 6th Annual Pancreatic Cancer Walk. NIH investing &gt;$127m in pancreatic #cancer research. http://t.co/EB1sSIrwY8","Twitter Web Client",,,,FALSE,FALSE,1,1,"cancer",,,,,"http://pbs.twimg.com/media/CDD6747VIAAdt2E.jpg","http://t.co/EB1sSIrwY8","https://twitter.com/NitaLowey/status/590247459391156225/photo/1","photo","http://pbs.twimg.com/media/CDD6747VIAAdt2E.jpg","http://t.co/EB1sSIrwY8","https://twitter.com/NitaLowey/status/590247459391156225/photo/1",,,,"en",,,,,,,,,,,,,
"x588753600182104065",2015-04-16 17:19:31,"x221792092","NitaLowey","Today, we remember the 6m innocent Jewish men, women, &amp; children who perished during the Holocaust. #NeverAgain http://t.co/ODUsjLPWkQ","Twitter Web Client",,,,FALSE,FALSE,1,7,"NeverAgain",,"1.usa.gov/1zkNbzH","http://t.co/ODUsjLPWkQ","http://1.usa.gov/1zkNbzH",,,,,,,,,,,"en",,,,,,,,,,,,,
"x588431790513201152",2015-04-15 20:00:46,"x221792092","NitaLowey","Raising the minimum wage would help hard-working men and women in Westchester and Rockland. It’s time to #RaiseTheWage","Hootsuite",,,,FALSE,FALSE,0,1,"RaiseTheWage",,,,,,,,,,,,,,,"en",,,,,,,,,,,,,
"x588387464873582592",2015-04-15 17:04:37,"x221792092","NitaLowey","The United States must stand unequivocally behind our ally Israel at the UN &amp; oppose counter-productive resolutions. http://t.co/InJxDJ6xvP","Twitter Web Client",,,,FALSE,FALSE,0,2,,,"bit.ly/1awqfak","http://t.co/InJxDJ6xvP","http://bit.ly/1awqfak",,,,,,,,,,,"en",,,,,,,,,,,,,
"x588358712730984448",2015-04-15 15:10:22,"x221792092","NitaLowey","I'll continue to fight to make it easier for hardworking families to own a home, send kids to college, and enjoy a secure retirement.","Hootsuite",,,,FALSE,FALSE,0,4,,,,,,,,,,,,,,,,"en",,,,,,,,,,,,,
"x588348790706413569",2015-04-15 14:30:57,"x221792092","NitaLowey","I introduced the Tax Equity Act: adjusts federal tax brackets to reflect actual cost of living in major metro areas like ours. #TaxEquityAct","Hootsuite",,,,FALSE,FALSE,0,2,"TaxEquityAct",,,,,,,,,,,,,,,"en",,,,,,,,,,,,,
"x588338543380017152",2015-04-15 13:50:14,"x221792092","NitaLowey","We pay more for housing, food, and utilities, and it’s only fair for the tax code to reflect that reality. #TaxEquityAct","Hootsuite",,,,FALSE,FALSE,1,2,"TaxEquityAct",,,,,,,,,,,,,,,"en",,,,,,,,,,,,,
"x588329765125390336",2015-04-15 13:15:21,"x221792092","NitaLowey","Each tax day, hardworking families in New York realize they need a tax code that works for them. #TaxEquityAct","Hootsuite",,,,FALSE,FALSE,1,3,"TaxEquityAct",,,,,,,,,,,,,,,"en",,,,,,,,,,,,,
"x588079387595137025",2015-04-14 20:40:26,"x221792092","NitaLowey","This Equal Pay Day, the message is clear: women deserve #EqualPayNow.","Hootsuite",,,,FALSE,FALSE,5,4,"EqualPayNow",,,,,,,,,,,,,,,"en",,,,,,,,,,,,,
"x588061734306459648",2015-04-14 19:30:17,"x221792092","NitaLowey","I co-sponsored the #PaycheckFairnessAct to help women fight wage discrimination. #EqualPayNow","Hootsuite",,,,FALSE,FALSE,1,1,"PaycheckFairnessAct EqualPayNow",,,,,,,,,,,,,,,"en",,,,,,,,,,,,,
"x588041595502596096",2015-04-14 18:10:16,"x221792092","NitaLowey","NY gender pay gap is $7,300/year = unconscionable and runs contrary to our country’s ideals of freedom and equality. #EqualPayNow","Hootsuite",,,,FALSE,FALSE,3,5,"EqualPayNow",,,,,,,,,,,,,,,"en",,,,,,,,,,,,,
"x587972498513338368",2015-04-14 13:35:42,"x221792092","NitaLowey","NY women working hard in the same job for the same hours are paid $0.86 on average for every $1 paid to NY men. #EqualPayNow","Hootsuite",,,,FALSE,FALSE,5,10,"EqualPayNow",,,,,,,,,,,,,,,"en",,,,,,,,,,,,,
"x587686224011403265",2015-04-13 18:38:09,"x221792092","NitaLowey","Hard-working families need bigger paychecks &amp; better infrastructure. http://t.co/VpTZcWkgq7","Twitter Web Client",,,,FALSE,FALSE,0,3,,,,,,"http://pbs.twimg.com/media/CCfhgbgXIAEpJnq.jpg","http://t.co/VpTZcWkgq7","https://twitter.com/NitaLowey/status/587686224011403265/photo/1","photo","http://pbs.twimg.com/media/CCfhgbgXIAEpJnq.jpg","http://t.co/VpTZcWkgq7","https://twitter.com/NitaLowey/status/587686224011403265/photo/1",,,,"en",,,,,,,,,,,,,
"x587632667111378945",2015-04-13 15:05:20,"x221792092","NitaLowey","I will continue working to address the critical need for skilled workers in the Lower Hudson Valley.","Hootsuite",,,,FALSE,FALSE,2,2,,,,,,,,,,,,,,,,"en",,,,,,,,,,,,,
"x587630140693295105",2015-04-13 14:55:17,"x221792092","NitaLowey","I invited @USDOL to a roundtable discussion w/ @TheWCA about resources available for job training &amp; re-training http://t.co/OrQKC0ilAl","Twitter Web Client",,,,FALSE,FALSE,0,2,,,,,,"http://pbs.twimg.com/media/CCeuf8MWEAA-joH.jpg","http://t.co/OrQKC0ilAl","https://twitter.com/NitaLowey/status/587630140693295105/photo/1","photo","http://pbs.twimg.com/media/CCeuf8MWEAA-joH.jpg","http://t.co/OrQKC0ilAl","https://twitter.com/NitaLowey/status/587630140693295105/photo/1",,"x20179628 104923212","USDOL TheWCA","en",,,,,,,,,,,,,
"x585881673180585984",2015-04-08 19:07:30,"x221792092","NitaLowey","I will miss my good friend &amp; colleague @RepLoisCapps – a leader on public health and environmental issues – when she retires after this term","Twitter Web Client",,,,FALSE,FALSE,0,3,,,,,,,,,,,,,,"x292990703","RepLoisCapps","en",,,,,,,,,,,,,
"x585874889757872129",2015-04-08 18:40:33,"x221792092","NitaLowey","Today is National Dog Fighting Awareness Day, and I urge @TheJusticeDept to #GetTough on dog fighting. #NDFAD","Twitter Web Client",,,,FALSE,FALSE,35,62,"GetTough NDFAD",,,,,,,,,,,,,"x73181712","TheJusticeDept","en",,,,,,,,,,,,,
"x585530009181380610",2015-04-07 19:50:07,"x221792092","NitaLowey","I will continue to do everything in my power to improve the safety of crude oil transport in Rockland County.","Hootsuite",,,,FALSE,FALSE,0,5,,,,,,,,,,,,,,,,"en",,,,,,,,,,,,,
"x585521217324580865",2015-04-07 19:15:11,"x221792092","NitaLowey","W/ 40-80 train cars/day carrying crude oil thu Rockland County &amp; numerous accidents nationally, we must act now to protect our communities.","Hootsuite",,,,FALSE,FALSE,1,3,,,,,,,,,,,,,,,,"en",,,,,,,,,,,,,
"x585515706827046914",2015-04-07 18:53:17,"x221792092","NitaLowey","I’m glad that the @NTSB agrees: We need tighter safety regulations for transporting crude oil. http://t.co/rolSs9s0ZJ","Twitter Web Client",,,,FALSE,FALSE,0,3,,,"on.fb.me/1HN2nur","http://t.co/rolSs9s0ZJ","http://on.fb.me/1HN2nur",,,,,,,,,"x161023696","NTSB","en",,,,,,,,,,,,,
"x583664173634158592",2015-04-02 16:15:57,"x221792092","NitaLowey","As RM on House Approps Cmte, I fight for greater investments for NIH, which will spend $189m on autism initiatives in 2015 #Congress4LIUB","Hootsuite",,,,FALSE,FALSE,7,9,"Congress4LIUB",,,,,,,,,,,,,,,"en",,,,,,,,,,,,,
"x583657801882271745",2015-04-02 15:50:38,"x221792092","NitaLowey","We must call greater attention to autism and the importance of early diagnosis and early intervention #Congress4LIUB","Hootsuite",,,,FALSE,FALSE,2,2,"Congress4LIUB",,,,,,,,,,,,,,,"en",,,,,,,,,,,,,
"x583653818111549440",2015-04-02 15:34:48,"x221792092","NitaLowey","Today is World Autism Awareness Day, when we celebrate the talents and skills of persons w/ autism #Congress4LIUB http://t.co/z1UfpNqi9L","Twitter Web Client",,,,FALSE,FALSE,29,35,"Congress4LIUB",,,,,"http://pbs.twimg.com/media/CBmODgZUkAAiRjs.jpg","http://t.co/z1UfpNqi9L","https://twitter.com/NitaLowey/status/583653818111549440/photo/1","photo","http://pbs.twimg.com/media/CBmODgZUkAAiRjs.jpg","http://t.co/z1UfpNqi9L","https://twitter.com/NitaLowey/status/583653818111549440/photo/1",,,,"en",,,,,,,,,,,,,
"x582988550129336322",2015-03-31 19:31:16,"x221792092","NitaLowey","As RM of the House Appropriations Cmte, I will be fighting to protect &amp; increase funding for rail crossing safety initiatives. #MetroNorth","Hootsuite",,,,FALSE,FALSE,0,4,"MetroNorth",,,,,,,,,,,,,,,"en",,,,,,,,,,,,,
"x582981186605158401",2015-03-31 19:02:00,"x221792092","NitaLowey","I led a moment of silence w/ NY Delegation colleagues on House floor to honor #MetroNorth victims in Valhalla. https://t.co/MbeqAVzT3u","Hootsuite",,,,FALSE,FALSE,1,3,"MetroNorth",,"youtube.com/watch?v=6yrTWG…","https://t.co/MbeqAVzT3u","https://www.youtube.com/watch?v=6yrTWGwQBgM&feature=youtu.be",,,,,,,,,,,"en",,,,,,,,,,,,,
"x582974512003751936",2015-03-31 18:35:29,"x221792092","NitaLowey","I co-sponsored HR 705 w/ @RepSeanMaloney that passed the House as part of #PRRIA to improve grade crossing safety. http://t.co/WGR2VsoC2t","Hootsuite",,,,FALSE,FALSE,1,2,"PRRIA",,"1.usa.gov/1GcgRq1","http://t.co/WGR2VsoC2t","http://1.usa.gov/1GcgRq1",,,,,,,,,"x1072467470","RepSeanMaloney","en",,,,,,,,,,,,,
"x582969517401341952",2015-03-31 18:15:38,"x221792092","NitaLowey","I’ve spoken w/ @NTSB’s Robert Sumwalt about exploring investments in new technologies to detect objects on tracks. http://t.co/PGrgmfEDRn","Hootsuite",,,,FALSE,FALSE,0,2,,,"1.usa.gov/1HhrSUe","http://t.co/PGrgmfEDRn","http://1.usa.gov/1HhrSUe",,,,,,,,,"x161023696","NTSB","en",,,,,,,,,,,,,
"x582961882052562945",2015-03-31 17:45:18,"x221792092","NitaLowey","I asked @USDOTFRA’s Sarah Feinberg about effective approaches to increasing safety at a House Approps Cmte hearing. https://t.co/vhBbudbXwM","Hootsuite",,,,FALSE,FALSE,0,1,,,"youtube.com/watch?v=CKKSkp…","https://t.co/vhBbudbXwM","https://www.youtube.com/watch?v=CKKSkpgVbN0&list=UUkmeBYqhbomcWNNWzQCqcbg",,,,,,,,,"x556051103","USDOTFRA","en",,,,,,,,,,,,,
"x582955559885926401",2015-03-31 17:20:10,"x221792092","NitaLowey","We must eliminate the most dangerous grade crossings &amp; seek a high-profile public awareness campaign to inform drivers. #MetroNorth","Hootsuite",,,,FALSE,FALSE,1,1,"MetroNorth",,,,,,,,,,,,,,,"en",,,,,,,,,,,,,
"x582954308485931008",2015-03-31 17:15:12,"x221792092","NitaLowey","W/ 250K public &amp; private grade crossings in U.S., we must tackle this important safety challenge w/ multi-faceted approach. #MetroNorth","Hootsuite",,,,FALSE,FALSE,0,1,"MetroNorth",,,,,,,,,,,,,,,"en",,,,,,,,,,,,,
"x582950635936595968",2015-03-31 17:00:36,"x221792092","NitaLowey","I hosted @USDOTFRA’s Sarah Feinberg &amp; local officials at Roaring Brook Road to show danger of rail grade crossings. http://t.co/Kv2ZRWSIl8","Twitter Web Client",,,,FALSE,FALSE,0,1,,,,,,"http://pbs.twimg.com/media/CBcOg3-W8AEKXK7.jpg","http://t.co/Kv2ZRWSIl8","https://twitter.com/NitaLowey/status/582950635936595968/photo/1","photo","http://pbs.twimg.com/media/CBcOg3-W8AEKXK7.jpg","http://t.co/Kv2ZRWSIl8","https://twitter.com/NitaLowey/status/582950635936595968/photo/1",,"x556051103","USDOTFRA","en",,,,,,,,,,,,,
"x582950116040056834",2015-03-31 16:58:33,"x221792092","NitaLowey","The #MetroNorth crossing at Roaring Brook Rd. is a dangerous example of the dangers posed by rail grade crossings. http://t.co/HQzTRSQblt","Twitter Web Client",,,,FALSE,FALSE,0,1,"MetroNorth",,"1.usa.gov/1BIuOEU","http://t.co/HQzTRSQblt","http://1.usa.gov/1BIuOEU",,,,,,,,,,,"en",,,,,,,,,,,,,
"x581539506588770304",2015-03-27 19:33:17,"x221792092","NitaLowey","I commend #Israel for releasing withheld Palestinian Tax revenue. PA must now abandon unilateral UN/ICC actions against Israel.","Twitter Web Client",,,,FALSE,FALSE,0,5,"Israel",,,,,,,,,,,,,,,"en",,,,,,,,,,,,,
