"status_id","created_at","user_id","screen_name","text","source","reply_to_status_id","reply_to_user_id","reply_to_screen_name","is_quote","is_retweet","favorite_count","retweet_count","hashtags","symbols","urls_url","urls_t.co","urls_expanded_url","media_url","media_t.co","media_expanded_url","media_type","ext_media_url","ext_media_t.co","ext_media_expanded_url","ext_media_type","mentions_user_id","mentions_screen_name","lang","quoted_status_id","quoted_text","retweet_status_id","retweet_text","place_url","place_name","place_full_name","place_type","country","country_code","geo_coords","coords_coords","bbox_coords"
"x872564132016513025",2017-06-07 21:21:15,"x258900199","RepMaloney","Thanks to @AARPNY for visiting with me in DC to discuss how we can protect seniors from #Trumpcare and better meet seniors' needs. https://t.co/C7lA8zD84W","Hootsuite",,,,FALSE,FALSE,13,3,"Trumpcare",,,,,"http://pbs.twimg.com/media/DBv4c3qXgAENRNI.jpg","https://t.co/C7lA8zD84W","https://twitter.com/RepMaloney/status/872564132016513025/photo/1","photo","http://pbs.twimg.com/media/DBv4c3qXgAENRNI.jpg","https://t.co/C7lA8zD84W","https://twitter.com/RepMaloney/status/872564132016513025/photo/1",,"x39811240","AARPNY","en",,,,,,,,,,,,,
"x872531102979702784",2017-06-07 19:10:00,"x258900199","RepMaloney","New @nberpubs study shows improved gender diversity improves deal &amp; fund performances on Wall Street. #FearlessGirl https://t.co/0P9aBckkC9 https://t.co/7iC0kez869","TweetDeck",,,,FALSE,FALSE,11,4,"FearlessGirl",,"bit.ly/2rUazKz","https://t.co/0P9aBckkC9","http://bit.ly/2rUazKz","http://pbs.twimg.com/media/DBue9ZSWsAAV9D3.jpg","https://t.co/7iC0kez869","https://twitter.com/RepMaloney/status/872531102979702784/photo/1","photo","http://pbs.twimg.com/media/DBue9ZSWsAAV9D3.jpg","https://t.co/7iC0kez869","https://twitter.com/RepMaloney/status/872531102979702784/photo/1",,"x41821987","nberpubs","en",,,,,,,,,,,,,
"x872528356545372161",2017-06-07 18:59:05,"x258900199","RepMaloney","#LIC leads the nation in rental unit construction w 12533 new units built from 2010-16! So privileged to represent such a thriving community https://t.co/6tIBB2KcmG","Twitter Web Client",,,,FALSE,FALSE,3,1,"LIC",,,,,"http://pbs.twimg.com/media/DBvXmbtWAAko1W3.jpg","https://t.co/6tIBB2KcmG","https://twitter.com/RepMaloney/status/872528356545372161/photo/1","photo","http://pbs.twimg.com/media/DBvXmbtWAAko1W3.jpg","https://t.co/6tIBB2KcmG","https://twitter.com/RepMaloney/status/872528356545372161/photo/1",,,,"en",,,,,,,,,,,,,
"x872513498105864192",2017-06-07 18:00:03,"x258900199","RepMaloney","Fact: Going all the way back to Truman admin, stocks have gained 6.7% annual return under Repub presidents vs. 9.6% under Dems (h/t @CNBC) https://t.co/WkouRCXwzA","TweetDeck",,,,FALSE,FALSE,9,4,,,,,,"http://pbs.twimg.com/media/DBu6uN1XkAEH5lz.jpg","https://t.co/WkouRCXwzA","https://twitter.com/RepMaloney/status/872513498105864192/photo/1","photo","http://pbs.twimg.com/media/DBu6uN1XkAEH5lz.jpg","https://t.co/WkouRCXwzA","https://twitter.com/RepMaloney/status/872513498105864192/photo/1",,"x20402945","CNBC","en",,,,,,,,,,,,,
"x872498382530654209",2017-06-07 16:59:59,"x258900199","RepMaloney","The #WrongCHOICEAct would be a disaster for our financial system and why I'm urging all my colleagues to vote no on this terrible bill. https://t.co/R4WvABT055","Twitter Web Client",,,,FALSE,FALSE,21,9,"WrongCHOICEAct",,,,,"http://pbs.twimg.com/ext_tw_video_thumb/872498260992290816/pu/img/S5Ibvika6BMnBgBT.jpg","https://t.co/R4WvABT055","https://twitter.com/RepMaloney/status/872498382530654209/video/1","photo","http://pbs.twimg.com/ext_tw_video_thumb/872498260992290816/pu/img/S5Ibvika6BMnBgBT.jpg","https://t.co/R4WvABT055","https://twitter.com/RepMaloney/status/872498382530654209/video/1",,,,"en",,,,,,,,,,,,,
"x872472719941677057",2017-06-07 15:18:00,"x258900199","RepMaloney","A lack of transparency and the endless stream of conflicting statements = Americans losing trust in @POTUS. (h/t @ABC) https://t.co/zKBqhOKVNK","TweetDeck",,,,FALSE,FALSE,8,3,,,,,,"http://pbs.twimg.com/media/DBuerEVXoAAL89H.jpg","https://t.co/zKBqhOKVNK","https://twitter.com/RepMaloney/status/872472719941677057/photo/1","photo","http://pbs.twimg.com/media/DBuerEVXoAAL89H.jpg","https://t.co/zKBqhOKVNK","https://twitter.com/RepMaloney/status/872472719941677057/photo/1",,"x822215679726100480 28785486","POTUS ABC","en",,,,,,,,,,,,,
"x872465310414249984",2017-06-07 14:48:34,"x258900199","RepMaloney","Must read: Former Dir of Natl Intel James Clapper says American institutions are under ""assault"" by @POTUS https://t.co/JNWFxuZdnR","Twitter Web Client",,,,FALSE,FALSE,34,18,,,"cbsn.ws/2rUsFMz","https://t.co/JNWFxuZdnR","http://cbsn.ws/2rUsFMz",,,,,,,,,"x822215679726100480","POTUS","en",,,,,,,,,,,,,
"x872442410441330689",2017-06-07 13:17:34,"x258900199","RepMaloney","The #WrongChoiceAct would fundamentally weaken the ability of the Consumer Bureau to fight for Americans. We can’t let it pass. https://t.co/Z3onbmWInv","Twitter Web Client",,,,FALSE,FALSE,304,276,"WrongChoiceAct",,,,,"http://pbs.twimg.com/media/DBuJuWeXYAAn4Ss.jpg","https://t.co/Z3onbmWInv","https://twitter.com/RepMaloney/status/872442410441330689/photo/1","photo","http://pbs.twimg.com/media/DBuJuWeXYAAn4Ss.jpg","https://t.co/Z3onbmWInv","https://twitter.com/RepMaloney/status/872442410441330689/photo/1",,,,"en",,,,,,,,,,,,,
"x872196407934844928",2017-06-06 21:00:02,"x258900199","RepMaloney","Proud to join w/ @womensmarch's Teresa Shook to call for equal rep on boards &amp; for #FearlessGirl to be permanent https://t.co/vvCmTZBsQG","TweetDeck",,,,FALSE,FALSE,52,27,"FearlessGirl",,"cbsloc.al/2rPSbT2","https://t.co/vvCmTZBsQG","http://cbsloc.al/2rPSbT2",,,,,,,,,"x800942537083068416","womensmarch","en",,,,,,,,,,,,,
"x872169729263378433",2017-06-06 19:14:02,"x258900199","RepMaloney","In case anyone needs further convincing of need for independent commission: Russia hacked voting software supplier: https://t.co/BtJLCxbZnl","Twitter Web Client",,,,FALSE,FALSE,18,11,,,"npr.org/2017/06/05/531…","https://t.co/BtJLCxbZnl","http://www.npr.org/2017/06/05/531649602/report-russia-launched-cyberattack-on-voting-vendor-ahead-of-election",,,,,,,,,,,"en",,,,,,,,,,,,,
"x872166210284146688",2017-06-06 19:00:03,"x258900199","RepMaloney","Chart of the week: 59% of #TrumpCuts come from $2.5 trillion of cuts to programs that assist low- and moderate-income Americans https://t.co/xvEkA1tAOh","TweetDeck",,,,FALSE,FALSE,56,89,"TrumpCuts",,,,,"http://pbs.twimg.com/media/DBpxeB3WsAEbYlW.jpg","https://t.co/xvEkA1tAOh","https://twitter.com/RepMaloney/status/872166210284146688/photo/1","photo","http://pbs.twimg.com/media/DBpxeB3WsAEbYlW.jpg","https://t.co/xvEkA1tAOh","https://twitter.com/RepMaloney/status/872166210284146688/photo/1",,,,"en",,,,,,,,,,,,,
"x872162189674721281",2017-06-06 18:44:04,"x258900199","RepMaloney","We’re closer now to a women’s history museum than ever before. https://t.co/wbSZTCL3mf","Twitter Web Client",,,,FALSE,FALSE,14,7,,,"maloney.house.gov/media-center/p…","https://t.co/wbSZTCL3mf","https://maloney.house.gov/media-center/press-releases/movement-for-smithsonian-women-s-history-museum-gains-steam",,,,,,,,,,,"en",,,,,,,,,,,,,
"x872153868313939968",2017-06-06 18:11:00,"x258900199","RepMaloney","Thank you to the heroes who still walk among us and those who gave their lives to liberate Normandy 73 yrs ago today. https://t.co/ZZ4PWvshu4","TweetDeck",,,,FALSE,FALSE,32,12,,,,,,"http://pbs.twimg.com/media/DBpxFGbWAAAdjPm.jpg","https://t.co/ZZ4PWvshu4","https://twitter.com/RepMaloney/status/872153868313939968/photo/1","photo","http://pbs.twimg.com/media/DBpxFGbWAAAdjPm.jpg","https://t.co/ZZ4PWvshu4","https://twitter.com/RepMaloney/status/872153868313939968/photo/1",,,,"en",,,,,,,,,,,,,
"x872137510339584002",2017-06-06 17:06:00,"x258900199","RepMaloney","Important read on recent #fakenews coming from the @WhiteHouse on Saudi arms deal via researchers @BrookingsInst: https://t.co/J88WKYvO7K","TweetDeck",,,,FALSE,FALSE,12,12,"fakenews",,"brook.gs/2rE66tf","https://t.co/J88WKYvO7K","http://brook.gs/2rE66tf",,,,,,,,,"x822215673812119553 151106990","WhiteHouse BrookingsInst","en",,,,,,,,,,,,,
"x871864215077883907",2017-06-05 23:00:01,"x258900199","RepMaloney","History made by #WonderWoman Patty Jenkins! Congrats on biggest single day gross for a female directed film! https://t.co/n6nRH2Ek9l","TweetDeck",,,,FALSE,FALSE,15,3,"WonderWoman",,"forbes.com/sites/scottmen…","https://t.co/n6nRH2Ek9l","https://www.forbes.com/sites/scottmendelson/2017/06/03/box-office-wonder-woman-soars-to-record-breaking-39m-friday/#5fafe4e14fb9",,,,,,,,,,,"en",,,,,,,,,,,,,
"x871824801572245504",2017-06-05 20:23:25,"x258900199","RepMaloney","Another reason we need an #ERAnow! Women &amp; girls shouldn't need to worry about access to meds due to discrimination. https://t.co/UBoYfJqlrk","Twitter Web Client",,,,FALSE,FALSE,14,7,"ERAnow",,"huffingtonpost.com/entry/pharmaci…","https://t.co/UBoYfJqlrk","http://www.huffingtonpost.com/entry/pharmacist-allegedly-refused-to-fill-teens-iud-related-prescription_us_59357d8ee4b0fa3f6ae63c3d?utm_campaign=hp_fb_pages&utm_source=women_fb&utm_medium=facebook&section=women&ncid=fcbklnkushpmg00000046",,,,,,,,,,,"en",,,,,,,,,,,,,
"x871153303245266950",2017-06-03 23:55:07,"x258900199","RepMaloney","My heart is with the people of London. What heinous and cowardly acts. We will always stand with the U.K. https://t.co/SOeLlFmG2L","Twitter for iPhone",,,,FALSE,FALSE,30,6,,,"cnn.com/2017/06/03/eur…","https://t.co/SOeLlFmG2L","http://www.cnn.com/2017/06/03/europe/london-bridge-incident/index.html",,,,,,,,,,,"en",,,,,,,,,,,,,
"x871039687447760897",2017-06-03 16:23:39,"x258900199","RepMaloney","Thank you to @NYPDnews for solving the case! We cannot allow such hateful actions in our city. https://t.co/C4JMaLaxDy","Twitter for iPhone",,,,FALSE,FALSE,3,1,,,"m.qchron.com/mobile/edition…","https://t.co/C4JMaLaxDy","http://m.qchron.com/mobile/editions/queenswide/bigoted-astoria-graffiti-vandal-caught-cops-say/article_24eeb548-47d2-11e7-aed5-c370af929d9d.html",,,,,,,,,"x17393196","NYPDnews","en",,,,,,,,,,,,,
"x870744630316457984",2017-06-02 20:51:12,"x258900199","RepMaloney","On National #GunViolenceAwarenessDay, I #WearOrange for all those who've lost loved ones &amp; as a promise to keep fighting for #gunsafety. https://t.co/anJPMzrAf6","Twitter Web Client",,,,FALSE,FALSE,15,9,"GunViolenceAwarenessDay WearOrange gunsafety",,,,,"http://pbs.twimg.com/tweet_video_thumb/DBWBm_UXkAIuD74.jpg","https://t.co/anJPMzrAf6","https://twitter.com/RepMaloney/status/870744630316457984/photo/1","photo","http://pbs.twimg.com/tweet_video_thumb/DBWBm_UXkAIuD74.jpg","https://t.co/anJPMzrAf6","https://twitter.com/RepMaloney/status/870744630316457984/photo/1",,,,"en",,,,,,,,,,,,,
"x870716651729113088",2017-06-02 19:00:01,"x258900199","RepMaloney","Congrats to #FearlessGirl #AnanyaVinay - 12 yr old winner of @ScrippsBee - she calmly spelled ""marocain"" https://t.co/UceVygPPOD","TweetDeck",,,,FALSE,FALSE,2,1,"FearlessGirl AnanyaVinay",,"cnn.it/2rypYjx","https://t.co/UceVygPPOD","http://cnn.it/2rypYjx",,,,,,,,,"x24189067","ScrippsBee","en",,,,,,,,,,,,,
"x870698277020282880",2017-06-02 17:47:00,"x258900199","RepMaloney",".@WhiteHouse idea of appointing Steve Bannon as head of @VOANews is in the running for 100 worst ideas of the decade https://t.co/42NCyxjnLE","TweetDeck",,,,FALSE,FALSE,18,12,,,"politi.co/2rupivK","https://t.co/42NCyxjnLE","http://politi.co/2rupivK",,,,,,,,,"x822215673812119553 16273831","WhiteHouse VOANews","en",,,,,,,,,,,,,
"x870667826306187265",2017-06-02 15:46:00,"x258900199","RepMaloney","Nancy Murdock of Equal Rights Maine hits the nail on the head - we need an #ERAnow! https://t.co/sVGOrpPC6C via @PressHerald","TweetDeck",,,,FALSE,FALSE,2,1,"ERAnow",,"bit.ly/2qIi2Jt","https://t.co/sVGOrpPC6C","http://bit.ly/2qIi2Jt",,,,,,,,,"x8859092","PressHerald","en",,,,,,,,,,,,,
"x870647836471382017",2017-06-02 14:26:34,"x258900199","RepMaloney","New #JobsReport shows economy gained 138,000 jobs in May. @BLS_gov chart shows gain is right in line with Obama era trends. #ThanksObama https://t.co/RYvbmIWXl2","Twitter Web Client",,,,FALSE,FALSE,5,4,"JobsReport ThanksObama",,,,,"http://pbs.twimg.com/media/DBUpU9RXUAAJLwF.png","https://t.co/RYvbmIWXl2","https://twitter.com/RepMaloney/status/870647836471382017/photo/1","photo","http://pbs.twimg.com/media/DBUpU9RXUAAJLwF.png","https://t.co/RYvbmIWXl2","https://twitter.com/RepMaloney/status/870647836471382017/photo/1",,"x612896910","BLS_gov","en",,,,,,,,,,,,,
"x870446536613822466",2017-06-02 01:06:41,"x258900199","RepMaloney",".@realDonaldTrump’s choice to drop out of #ParisAgreement leaves us isolated from all major allies &amp; weakens US standing as global leader.","Twitter for iPhone",,,,FALSE,FALSE,52,12,"ParisAgreement",,,,,,,,,,,,,"x25073877","realDonaldTrump","en",,,,,,,,,,,,,
"x870381269204520964",2017-06-01 20:47:20,"x258900199","RepMaloney","Totally dismayed that @POTUS has withdrawn the US from the #ParisAgreement. This is shortsighted &amp; dangerous. 194 countries can't be wrong.","Twitter Web Client",,,,FALSE,FALSE,61,7,"ParisAgreement",,,,,,,,,,,,,"x822215679726100480","POTUS","en",,,,,,,,,,,,,
"x870332896011313152",2017-06-01 17:35:07,"x258900199","RepMaloney","Delighted to speak with @CathyEngelbert and a wonderful group of business leaders at the @partnership4nyc women's lunch https://t.co/KQ57c7BU7e","Twitter Web Client",,,,FALSE,FALSE,7,3,,,,,,"http://pbs.twimg.com/media/DBQKhkDWsAEl5Pn.jpg","https://t.co/KQ57c7BU7e","https://twitter.com/RepMaloney/status/870332896011313152/photo/1","photo","http://pbs.twimg.com/media/DBQKhkDWsAEl5Pn.jpg","https://t.co/KQ57c7BU7e","https://twitter.com/RepMaloney/status/870332896011313152/photo/1",,"x4528897162 82945896","CathyEngelbert Partnership4NYC","en",,,,,,,,,,,,,
"x870306446956785665",2017-06-01 15:50:01,"x258900199","RepMaloney","New #ADP Jobs report shows the steady job growth that began 6 yrs ago under Obama continues - up 253,000 in May. https://t.co/6wwtZghDJP","TweetDeck",,,,FALSE,FALSE,6,3,"ADP",,"bit.ly/2rtokQo","https://t.co/6wwtZghDJP","http://bit.ly/2rtokQo",,,,,,,,,,,"en",,,,,,,,,,,,,
"x870271211598737410",2017-06-01 13:30:00,"x258900199","RepMaloney","7 out of 10 Americans support remaining in #ParisAgreement. @POTUS should listen to the voice of the people! https://t.co/8GF8Ba5TqJ","Twitter Web Client",,,,FALSE,FALSE,48,19,"ParisAgreement",,"theatln.tc/2qJCbxN","https://t.co/8GF8Ba5TqJ","http://theatln.tc/2qJCbxN",,,,,,,,,"x822215679726100480","POTUS","en",,,,,,,,,,,,,
"x870022676928221184",2017-05-31 21:02:25,"x258900199","RepMaloney","As we end #APAHM17, we celebrate the accomplishments &amp; contributions of Asian Pacific Americans to our country. Thank you. https://t.co/zqm7Px1iHb","Twitter for iPhone",,,,FALSE,FALSE,2,2,"APAHM17",,,,,"http://pbs.twimg.com/media/DBLxAlTWsAAHwjh.jpg","https://t.co/zqm7Px1iHb","https://twitter.com/RepMaloney/status/870022676928221184/photo/1","photo","http://pbs.twimg.com/media/DBLxAlTWsAAHwjh.jpg","https://t.co/zqm7Px1iHb","https://twitter.com/RepMaloney/status/870022676928221184/photo/1",,,,"en",,,,,,,,,,,,,
"x869977633030909952",2017-05-31 18:03:25,"x258900199","RepMaloney","It's disturbingly simple: #TrumpCuts, like too many of @POTUS's policies, are #BadForWomen. @nwlc outlines it here: https://t.co/UC2vkSjSms https://t.co/pujvvQYNoy","Twitter Web Client",,,,FALSE,FALSE,10,10,"TrumpCuts BadForWomen",,"bit.ly/2qnLJOG","https://t.co/UC2vkSjSms","http://bit.ly/2qnLJOG","http://pbs.twimg.com/media/DBLH9rMW0AEY0OM.jpg","https://t.co/pujvvQYNoy","https://twitter.com/RepMaloney/status/869977633030909952/photo/1","photo","http://pbs.twimg.com/media/DBLH9rMW0AEY0OM.jpg","https://t.co/pujvvQYNoy","https://twitter.com/RepMaloney/status/869977633030909952/photo/1",,"x822215679726100480 16967845","POTUS nwlc","en",,,,,,,,,,,,,
"x869922049468379137",2017-05-31 14:22:33,"x258900199","RepMaloney",".@POTUS's decision to pull US from #ParisAgreement is a huge mistake. https://t.co/CKhH043pHl https://t.co/GDRrLHZEWJ","Twitter for iPhone",,,,FALSE,FALSE,59,23,"ParisAgreement",,"Bit.ly/2qB7KdX","https://t.co/CKhH043pHl","http://Bit.ly/2qB7KdX","http://pbs.twimg.com/media/DBKVfUmXgAECvFx.jpg","https://t.co/GDRrLHZEWJ","https://twitter.com/RepMaloney/status/869922049468379137/photo/1","photo","http://pbs.twimg.com/media/DBKVfUmXgAECvFx.jpg","https://t.co/GDRrLHZEWJ","https://twitter.com/RepMaloney/status/869922049468379137/photo/1",,"x822215679726100480","POTUS","en",,,,,,,,,,,,,
"x869704993175027712",2017-05-31 00:00:03,"x258900199","RepMaloney","Another assault on women. Another reason why we need an #ERANow https://t.co/GPzdMLZeZ7","TweetDeck",,,,FALSE,FALSE,16,7,"ERANow",,"nytimes.com/2017/05/29/us/…","https://t.co/GPzdMLZeZ7","https://www.nytimes.com/2017/05/29/us/politics/birth-control-trump-obamacare-religion.html",,,,,,,,,,,"en",,,,,,,,,,,,,
"x869629307525746688",2017-05-30 18:59:18,"x258900199","RepMaloney","NYCHA can't solve budget woes by sacrificing the community's open air &amp; public space-this deal won't cut it! #NYCHA https://t.co/wI8ccHhlfH","Twitter for iPhone",,,,FALSE,FALSE,14,9,"NYCHA",,,,,"http://pbs.twimg.com/media/DBGLPSVXkAADw1O.jpg","https://t.co/wI8ccHhlfH","https://twitter.com/RepMaloney/status/869629307525746688/photo/1","photo","http://pbs.twimg.com/media/DBGLPSVXkAADw1O.jpg","https://t.co/wI8ccHhlfH","https://twitter.com/RepMaloney/status/869629307525746688/photo/1",,,,"en",,,,,,,,,,,,,
"x869606466189234177",2017-05-30 17:28:32,"x258900199","RepMaloney","Thousands of 9/11 heroes got us through that horrible day &amp; aftermath-New monument is a testament to their sacrifice https://t.co/fRRvXcejhL","Twitter Web Client",,,,FALSE,FALSE,9,4,,,"maloney.house.gov/media-center/p…","https://t.co/fRRvXcejhL","https://maloney.house.gov/media-center/press-releases/maloney-applauds-announcement-of-new-dedication-for-911-rescue-and",,,,,,,,,,,"en",,,,,,,,,,,,,
"x869584872100294661",2017-05-30 16:02:44,"x258900199","RepMaloney",".@RepDonBeyer and I are calling on new @SEC_News Chair Clayton to act to increase boardroom diversity! https://t.co/NJ7ku1m1Qw","Twitter Web Client",,,,FALSE,FALSE,13,4,,,"maloney.house.gov/media-center/p…","https://t.co/NJ7ku1m1Qw","https://maloney.house.gov/media-center/press-releases/reps-maloney-and-beyer-press-new-sec-chairman-to-act-on-boardroom",,,,,,,,,"x2962868158 18481050","RepDonBeyer SEC_News","en",,,,,,,,,,,,,
"x869555679111122946",2017-05-30 14:06:44,"x258900199","RepMaloney","Nothing can tear down #FearlessGirl &amp; those she's inspired, but still glad obnoxious dog statue was removed. https://t.co/87KC6sA5Ng","Twitter Web Client",,,,FALSE,FALSE,19,2,"FearlessGirl",,"ny1.com/nyc/all-boroug…","https://t.co/87KC6sA5Ng","http://www.ny1.com/nyc/all-boroughs/news/2017/05/30/dog-gone--statue-meant-to-protest--fearless-girl--removed.html",,,,,,,,,,,"en",,,,,,,,,,,,,
"x869361318708600836",2017-05-30 01:14:24,"x258900199","RepMaloney","The brutal murders of Egyptian Coptic Christians by ISIS must stop. US must support efforts to end this persecution. https://t.co/8ByniJGyrk","Twitter for iPhone",,,,FALSE,FALSE,12,3,,,"tinyurl.com/y6wvsm53","https://t.co/8ByniJGyrk","http://tinyurl.com/y6wvsm53",,,,,,,,,,,"en",,,,,,,,,,,,,
"x869191609954349056",2017-05-29 14:00:03,"x258900199","RepMaloney","On #MemorialDay, let's all pause to remember and thank all those who gave their lives to protect our country and values.","TweetDeck",,,,FALSE,FALSE,28,5,"MemorialDay",,,,,,,,,,,,,,,"en",,,,,,,,,,,,,
"x868991682242641922",2017-05-29 00:45:36,"x258900199","RepMaloney","Ray Pfeifer was an example for us all to follow, a true hero. An honor to work w him to get my Zadroga bill passed. https://t.co/DkaMzDXyIN","Twitter for iPhone",,,,FALSE,FALSE,14,6,,,"abc7ny.com/news/former-fd…","https://t.co/DkaMzDXyIN","http://abc7ny.com/news/former-fdny-firefighter-ray-pfeifer-loses-cancer-battle/2048162/",,,,,,,,,,,"en",,,,,,,,,,,,,
"x868844319767003136",2017-05-28 15:00:02,"x258900199","RepMaloney","Education about periods can transform lives and empowers women &amp; girls around the world. #MHDay #MenstrualHygiene https://t.co/eknbvoOnHQ","TweetDeck",,,,FALSE,FALSE,7,1,"MHDay MenstrualHygiene",,"menstrualhygieneday.org","https://t.co/eknbvoOnHQ","http://menstrualhygieneday.org/",,,,,,,,,,,"en",,,,,,,,,,,,,
"x868173643871924224",2017-05-26 18:35:01,"x258900199","RepMaloney","I wish all those observing #Ramadan a meaningful month of study &amp; contemplation. May it bring joy, peace and wisdom.","TweetDeck",,,,FALSE,FALSE,26,4,"Ramadan",,,,,,,,,,,,,,,"en",,,,,,,,,,,,,
"x868094104806281216",2017-05-26 13:18:57,"x258900199","RepMaloney","STEM fields = future of our economy, which is why I'm proud to reintro Women &amp; Minorities in STEM Booster Act. https://t.co/ZxM6uEXo3g","Twitter Web Client",,,,FALSE,FALSE,11,2,,,"maloney.house.gov/media-center/p…","https://t.co/ZxM6uEXo3g","https://maloney.house.gov/media-center/press-releases/maloney-works-to-increase-opportunities-for-women-and-minorities-in-stem",,,,,,,,,,,"en",,,,,,,,,,,,,
"x867820818142777344",2017-05-25 19:13:01,"x258900199","RepMaloney","#Trumpcare means that 650K+ New Yorkers will lose health insurance. This bill is unacceptable for our state and our country! h/t @JECDems https://t.co/YgvoEzMoef","TweetDeck",,,,FALSE,FALSE,22,10,"Trumpcare",,,,,"http://pbs.twimg.com/media/DAsMamrXgAAKx_k.jpg","https://t.co/YgvoEzMoef","https://twitter.com/RepMaloney/status/867820818142777344/photo/1","photo","http://pbs.twimg.com/media/DAsMamrXgAAKx_k.jpg","https://t.co/YgvoEzMoef","https://twitter.com/RepMaloney/status/867820818142777344/photo/1",,"x116505994","JECDems","en",,,,,,,,,,,,,
"x867792372549140481",2017-05-25 17:19:59,"x258900199","RepMaloney","10 years after passage of the Fair Minimum Wage Act, we still have work to do. All Americans must be guaranteed a living wage!","Twitter Web Client",,,,FALSE,FALSE,6,1,,,,,,,,,,,,,,,,"en",,,,,,,,,,,,,
"x867492905597812737",2017-05-24 21:30:00,"x258900199","RepMaloney","Investing in our kids’ education = investing in their future, our country's future. We should be increasing funding not cutting #TrumpCuts https://t.co/0DYZpY4rkO","TweetDeck",,,,FALSE,FALSE,2,1,"TrumpCuts",,,,,"http://pbs.twimg.com/media/DAnPI0gW0AAplkk.jpg","https://t.co/0DYZpY4rkO","https://twitter.com/RepMaloney/status/867492905597812737/photo/1","photo","http://pbs.twimg.com/media/DAnPI0gW0AAplkk.jpg","https://t.co/0DYZpY4rkO","https://twitter.com/RepMaloney/status/867492905597812737/photo/1",,,,"en",,,,,,,,,,,,,
"x867486404053520385",2017-05-24 21:04:10,"x258900199","RepMaloney",".@USCBO confirms worst #Trumpcare fears: Millions lose coverage; premiums go up esp 4 those w preexisting conditions https://t.co/o6rMbdyRsE","Twitter Web Client",,,,FALSE,FALSE,3,3,"Trumpcare",,"thehill.com/policy/healthc…","https://t.co/o6rMbdyRsE","http://thehill.com/policy/healthcare/335000-cbo-obamacare-repeal-bill-would-leave-23m-fewer-people-with-insurance",,,,,,,,,"x1531265618","USCBO","en",,,,,,,,,,,,,
"x867466483995226112",2017-05-24 19:45:01,"x258900199","RepMaloney","Trump budget doesnt put America first, it puts lives at risk. We cant afford #TrumpCuts &amp; the harm they will cause. https://t.co/LuIbzQFuEk","TweetDeck",,,,FALSE,FALSE,9,6,"TrumpCuts",,"nyti.ms/2rRErnt","https://t.co/LuIbzQFuEk","https://nyti.ms/2rRErnt",,,,,,,,,,,"en",,,,,,,,,,,,,
"x867451886462529536",2017-05-24 18:47:00,"x258900199","RepMaloney","In terms @POTUS will understand: losers in his budget are living in poverty &amp; w/ disabilities. This is just wrong. https://t.co/d262AMd557","Twitter Web Client",,,,FALSE,FALSE,23,27,,,"wapo.st/2qNJSpS","https://t.co/d262AMd557","http://wapo.st/2qNJSpS",,,,,,,,,"x822215679726100480","POTUS","en",,,,,,,,,,,,,
"x867096843456524289",2017-05-23 19:16:12,"x258900199","RepMaloney",".@POTUS proposed budget would be nothing short of a disaster for NYC &amp; our country. https://t.co/DQBz5oRfZX https://t.co/kgAuUeIBAW","Twitter for iPhone",,,,FALSE,FALSE,28,16,,,"maloney.house.gov/media-center/p…","https://t.co/DQBz5oRfZX","https://maloney.house.gov/media-center/press-releases/rep-maloney-trump-s-budget-is-a-disaster-for-ny","http://pbs.twimg.com/media/DAiL7YYXcAAiMGo.jpg","https://t.co/kgAuUeIBAW","https://twitter.com/RepMaloney/status/867096843456524289/photo/1","photo","http://pbs.twimg.com/media/DAiL7YYXcAAiMGo.jpg","https://t.co/kgAuUeIBAW","https://twitter.com/RepMaloney/status/867096843456524289/photo/1",,"x822215679726100480","POTUS","en",,,,,,,,,,,,,
"x867081055001600000",2017-05-23 18:13:27,"x258900199","RepMaloney","Women deserve to know what's in feminine hygiene products. Thanks @women4earth for supporting my bill for fem hygiene safety research. https://t.co/lOMVDNu6An","Twitter Web Client",,,,FALSE,FALSE,49,18,,,,,,"http://pbs.twimg.com/media/DAh9nFPXUAA6nN5.jpg","https://t.co/lOMVDNu6An","https://twitter.com/RepMaloney/status/867081055001600000/photo/1","photo","http://pbs.twimg.com/media/DAh9nFPXUAA6nN5.jpg","https://t.co/lOMVDNu6An","https://twitter.com/RepMaloney/status/867081055001600000/photo/1",,"x122419056","women4earth","en",,,,,,,,,,,,,
"x867052415362768898",2017-05-23 16:19:39,"x258900199","RepMaloney","How is this putting America first? @POTUS budget would devastate cancer research w/ 19% cut for @NIH! https://t.co/o5H4hilhYb","Twitter Web Client",,,,FALSE,FALSE,27,40,,,"wapo.st/2rLZV5Z","https://t.co/o5H4hilhYb","http://wapo.st/2rLZV5Z",,,,,,,,,"x822215679726100480 15134240","POTUS NIH","en",,,,,,,,,,,,,
