"status_id","created_at","user_id","screen_name","text","source","reply_to_status_id","reply_to_user_id","reply_to_screen_name","is_quote","is_retweet","favorite_count","retweet_count","hashtags","symbols","urls_url","urls_t.co","urls_expanded_url","media_url","media_t.co","media_expanded_url","media_type","ext_media_url","ext_media_t.co","ext_media_expanded_url","ext_media_type","mentions_user_id","mentions_screen_name","lang","quoted_status_id","quoted_text","retweet_status_id","retweet_text","place_url","place_name","place_full_name","place_type","country","country_code","geo_coords","coords_coords","bbox_coords"
"x643570684614995968",2015-09-14 23:43:02,"x18137749","ChrisVanHollen","The Tea Party is intent on shutting down the gov't over women's health &amp; @PPFA. We can't let that happen—http://t.co/PZ7l2euHx7 #StandWithPP","TweetDeck",,,,FALSE,FALSE,17,17,"StandWithPP",,"bit.ly/1J8tI8U","http://t.co/PZ7l2euHx7","http://bit.ly/1J8tI8U",,,,,,,,,"x402957663","PPFA","en",,,,,,,,,,,,,
"x643524993356328960",2015-09-14 20:41:29,"x18137749","ChrisVanHollen","7 in 10 want a budget, not a #GOPshutdown. @SpeakerBoehner, #pullupachair &amp; let's get to work. http://t.co/aRr0mYoC25 #StandWithPP","TweetDeck",,,,FALSE,FALSE,25,23,"GOPshutdown pullupachair StandWithPP",,"politi.co/1J8tkHj","http://t.co/aRr0mYoC25","http://politi.co/1J8tkHj",,,,,,,,,"x7713202","SpeakerBoehner","en",,,,,,,,,,,,,
"x643145874571440129",2015-09-13 19:35:00,"x18137749","ChrisVanHollen","Avoiding a shutdown starts w/ negotiating. I've intro'd a bill to start the process. @SpeakerBoehner, #pullupachair  http://t.co/RNwzJxsm0T","Twitter Lite",,,,FALSE,FALSE,12,9,"pullupachair",,"federalnewsradio.com/congress/2015/…","http://t.co/RNwzJxsm0T","http://federalnewsradio.com/congress/2015/09/ultimatum-funding-bill-calls-deal-cap-raise/",,,,,,,,,"x7713202","SpeakerBoehner","en",,,,,,,,,,,,,
"x642393330157023232",2015-09-11 17:44:39,"x18137749","ChrisVanHollen","Let's do right by our first responders &amp; survivors and extend the James Zadroga 9/11 Health and Compensation Act. http://t.co/PEh3FPxI55","TweetDeck",,,,FALSE,FALSE,17,27,,,"usat.ly/1i46Lhg","http://t.co/PEh3FPxI55","http://usat.ly/1i46Lhg",,,,,,,,,,,"en",,,,,,,,,,,,,
"x642333636268793856",2015-09-11 13:47:27,"x18137749","ChrisVanHollen","14 years ago terrorists struck a horrible blow – but we are stronger than ever. Today we recommit to working together to keep America great.","TweetDeck",,,,FALSE,FALSE,8,5,,,,,,,,,,,,,,,,"en",,,,,,,,,,,,,
"x642094652707983360",2015-09-10 21:57:49,"x18137749","ChrisVanHollen","If the GOP continues to refuse budget negotiations, we should #RaiseTheCaps to match @POTUS's budget and let appropriators do their job.","TweetDeck",,,,FALSE,FALSE,8,10,"RaiseTheCaps",,,,,,,,,,,,,"x822215679726100480","POTUS","en",,,,,,,,,,,,,
"x642072118495211521",2015-09-10 20:28:16,"x18137749","ChrisVanHollen","We must dramatically increase no. of Syrian refugees allowed into the U.S. It's our moral duty to lead int'l effort to deal w/ this crisis.","Twitter for iPhone",,,,FALSE,FALSE,9,5,,,,,,,,,,,,,,,,"en",,,,,,,,,,,,,
"x642061739249520640",2015-09-10 19:47:02,"x18137749","ChrisVanHollen",".@HouseGOP won't come to the table to avoid a #GOPshutdown, so today Democrats are taking matters into our own hands: http://t.co/mt8XwrAnEs","TweetDeck",,,,FALSE,FALSE,8,27,"GOPshutdown",,"1.usa.gov/1EYF6ch","http://t.co/mt8XwrAnEs","http://1.usa.gov/1EYF6ch",,,,,,,,,"x15207668","HouseGOP","en",,,,,,,,,,,,,
"x642053392932712448",2015-09-10 19:13:52,"x18137749","ChrisVanHollen","Honored to join @everytown, @MomsDemand &amp; hundreds more willing to do #WhateverItTakes to end senseless gun violence. http://t.co/1eCZkVEdKp","TweetDeck",,,,FALSE,FALSE,29,38,"WhateverItTakes",,,,,"http://pbs.twimg.com/media/COkIDI5WIAAgcwJ.jpg","http://t.co/1eCZkVEdKp","https://twitter.com/ChrisVanHollen/status/642053392932712448/photo/1","photo","http://pbs.twimg.com/media/COkIDI5WIAAgcwJ.jpg","http://t.co/1eCZkVEdKp","https://twitter.com/ChrisVanHollen/status/642053392932712448/photo/1",,"x250386727 1017637447","Everytown MomsDemand","en",,,,,,,,,,,,,
"x642017212476211200",2015-09-10 16:50:06,"x18137749","ChrisVanHollen","Today I intro'd a bill to avert another costly #GOPshutdown. The American people deserve a budget, not a crisis: http://t.co/mt8XwriMfS","TweetDeck",,,,FALSE,FALSE,15,20,"GOPshutdown",,"1.usa.gov/1EYF6ch","http://t.co/mt8XwriMfS","http://1.usa.gov/1EYF6ch",,,,,,,,,,,"en",,,,,,,,,,,,,
"x642010697455566848",2015-09-10 16:24:12,"x18137749","ChrisVanHollen","With @rosadelauro @RepBarbaraLee and @nddunited to demand budget negotiations to avoid a #GOPshutdown! #RaiseTheCaps http://t.co/j4ElbrZug1","TweetDeck",,,,FALSE,FALSE,18,27,"GOPshutdown RaiseTheCaps",,,,,"http://pbs.twimg.com/media/COjhDp4WEAAwqjW.jpg","http://t.co/j4ElbrZug1","https://twitter.com/ChrisVanHollen/status/642010697455566848/photo/1","photo","http://pbs.twimg.com/media/COjhDp4WEAAwqjW.jpg","http://t.co/j4ElbrZug1","https://twitter.com/ChrisVanHollen/status/642010697455566848/photo/1",,"x140519774 248735463 1380068432","rosadelauro RepBarbaraLee NDDUnited","en",,,,,,,,,,,,,
"x641677908063469568",2015-09-09 18:21:49,"x18137749","ChrisVanHollen","Over 200 of the schoolgirls kidnapped by Boko Haram are still missing. We must not forget. #BringBackOurGirls http://t.co/w0jUcQHWw4","TweetDeck",,,,FALSE,FALSE,7,9,"BringBackOurGirls",,,,,"http://pbs.twimg.com/media/COeyJ3qW8AE46pQ.jpg","http://t.co/w0jUcQHWw4","https://twitter.com/ChrisVanHollen/status/641677908063469568/photo/1","photo","http://pbs.twimg.com/media/COeyJ3qW8AE46pQ.jpg","http://t.co/w0jUcQHWw4","https://twitter.com/ChrisVanHollen/status/641677908063469568/photo/1",,,,"en",,,,,,,,,,,,,
"x641409265673089024",2015-09-09 00:34:20,"x18137749","ChrisVanHollen","We support the #IranDeal. It is the best path to achieve our goal of preventing Iran from building a nuclear bomb. http://t.co/UnekgzWZwT","Twitter Web Client",,,,FALSE,FALSE,38,50,"IranDeal",,,,,"http://pbs.twimg.com/media/COa-U-PUsAAVkX_.jpg","http://t.co/UnekgzWZwT","https://twitter.com/ChrisVanHollen/status/641409265673089024/photo/1","photo","http://pbs.twimg.com/media/COa-U-PUsAAVkX_.jpg","http://t.co/UnekgzWZwT","https://twitter.com/ChrisVanHollen/status/641409265673089024/photo/1",,,,"en",,,,,,,,,,,,,
"x641368714613522436",2015-09-08 21:53:12,"x18137749","ChrisVanHollen",".@SpeakerBoehner, we're ready to work with you to avoid another costly #GOPshutdown. Pull up a chair. #StandWithPP http://t.co/umI63X1ZF8","TweetDeck",,,,FALSE,FALSE,29,44,"GOPshutdown StandWithPP",,,,,"http://pbs.twimg.com/media/COaZciRWsAAmKRK.png","http://t.co/umI63X1ZF8","https://twitter.com/ChrisVanHollen/status/641368714613522436/photo/1","photo","http://pbs.twimg.com/media/COaZciRWsAAmKRK.png","http://t.co/umI63X1ZF8","https://twitter.com/ChrisVanHollen/status/641368714613522436/photo/1",,"x7713202","SpeakerBoehner","en",,,,,,,,,,,,,
"x640985748775301120",2015-09-07 20:31:26,"x18137749","ChrisVanHollen","Applaud @POTUS's steps to make paid sick leave standard for fed contractors. No one shld fear losing their job due to illness. #leadonleave","Twitter for iPhone",,,,FALSE,FALSE,36,37,"leadonleave",,,,,,,,,,,,,"x822215679726100480","POTUS","en",,,,,,,,,,,,,
"x639911323153776640",2015-09-04 21:22:03,"x18137749","ChrisVanHollen","Another positive step toward ending discrimination based on gender identity. #ACAworks http://t.co/BZ8LvXqwru","Twitter Web Client",,,,FALSE,FALSE,6,5,"ACAworks",,"washingtonpost.com/national/healt…","http://t.co/BZ8LvXqwru","http://www.washingtonpost.com/national/health-science/us-offers-new-health-rules-to-protect-women-transgender-people-others/2015/09/03/ddf90170-5246-11e5-9812-92d5948a40f8_story.html",,,,,,,,,,,"en",,,,,,,,,,,,,
"x639899823076974592",2015-09-04 20:36:21,"x18137749","ChrisVanHollen","After another solid employment report, let's not undo our progress with another costly #GOPshutdown over women's health. #StandWithPP","Twitter for iPhone",,,,FALSE,FALSE,16,20,"GOPshutdown StandWithPP",,,,,,,,,,,,,,,"en",,,,,,,,,,,,,
"x639518722143744000",2015-09-03 19:21:59,"x18137749","ChrisVanHollen","I'm fighting the GOP's attempt to shut down the gov't over women's health &amp; @PPFA. It's bad for Md. &amp; the country. 
http://t.co/9Y4iKyiKmz","Twitter for iPhone",,,,FALSE,FALSE,25,28,,,"wtop.com/congress/2015/…","http://t.co/9Y4iKyiKmz","http://wtop.com/congress/2015/09/budget-battle-possible-government-shutdown-looms-labor-day/",,,,,,,,,"x402957663","PPFA","en",,,,,,,,,,,,,
"x639481593996935168",2015-09-03 16:54:27,"x18137749","ChrisVanHollen","One of the best things we can do to help our veterans and honor their service is end sequestration once and for all. http://t.co/fyN8gdPkuW","Twitter for iPhone",,,,FALSE,FALSE,11,10,,,"legion.org/legislative/22…","http://t.co/fyN8gdPkuW","http://www.legion.org/legislative/229731/van-hollen-sequestration-can-affect-veterans-programs",,,,,,,,,,,"en",,,,,,,,,,,,,
"x639062545853227008",2015-09-02 13:09:18,"x18137749","ChrisVanHollen","I've asked @TheJusticeDept to investigate the disturbing practice of profiting off victims of lead poisoning: http://t.co/8MrxnPuj2d","Twitter for iPhone",,,,FALSE,FALSE,11,7,,,"baltimoresun.com/news/maryland/…","http://t.co/8MrxnPuj2d","http://www.baltimoresun.com/news/maryland/politics/blog/bal-van-hollen-slaughter-seek-probe-of-lead-paint-deals-20150901-story.html",,,,,,,,,"x73181712","TheJusticeDept","en",,,,,,,,,,,,,
"x638794902302818304",2015-09-01 19:25:47,"x18137749","ChrisVanHollen","MD veterans shouldn't battle DC gridlock to receive care. Montgomery County will finally get @VeteransHealth clinic https://t.co/SePYxdn4u5","Twitter Web Client",,,,FALSE,FALSE,5,9,,,"vanhollen.house.gov/media-center/p…","https://t.co/SePYxdn4u5","https://vanhollen.house.gov/media-center/press-releases/mikulski-cardin-van-hollen-and-leggett-announce-department-of-veterans",,,,,,,,,"x17346287","VeteransHealth","en",,,,,,,,,,,,,
"x638793453636329472",2015-09-01 19:20:02,"x18137749","ChrisVanHollen","Last chance to vote for my social media photo contest! Deadline is 5pm EDT today: https://t.co/YfD76sGEaY","Twitter for iPhone",,,,FALSE,FALSE,0,1,,,"facebook.com/media/set/?set…","https://t.co/YfD76sGEaY","https://www.facebook.com/media/set/?set=a.10153238899013878.1073741833.109304033877&type=3&refid=17&_ft_=top_level_post_id.10153247464858878",,,,,,,,,,,"en",,,,,,,,,,,,,
"x638460812894584833",2015-08-31 21:18:14,"x18137749","ChrisVanHollen","1 day left to vote for my photo contest! Pic w/ most likes @ 5pm ET tomorrow will become my new FB/Twitter banners: http://t.co/AuxX4aKbfb","TweetDeck",,,,FALSE,FALSE,3,2,,,"on.fb.me/1N5vcbx","http://t.co/AuxX4aKbfb","http://on.fb.me/1N5vcbx",,,,,,,,,,,"en",,,,,,,,,,,,,
"x638387229941960704",2015-08-31 16:25:50,"x18137749","ChrisVanHollen","Today in 1964, LBJ signed the Food Stamp Act - a valuable tool in the war on poverty, it remains a vital tool to help families get ahead","Twitter Web Client",,,,FALSE,FALSE,11,9,,,,,,,,,,,,,,,,"en",,,,,,,,,,,,,
"x637681626043011073",2015-08-29 17:42:01,"x18137749","ChrisVanHollen","Katrina exposed how vulnerable we are when poverty, infrastructure, &amp; rising seas are ignored. We've made progress, but the work continues","Twitter Web Client",,,,FALSE,FALSE,8,10,,,,,,,,,,,,,,,,"en",,,,,,,,,,,,,
"x637361692008181760",2015-08-28 20:30:43,"x18137749","ChrisVanHollen","I've intro'd a bill to help keep handguns out of the hands of criminals because words are not enough - we need action http://t.co/Ifwp9zWCVA","Twitter Web Client",,,,FALSE,FALSE,17,19,,,"thetrace.org/2015/08/anger-…","http://t.co/Ifwp9zWCVA","http://www.thetrace.org/2015/08/anger-issues-gun-violence-prevention-wdbj-shooter/",,,,,,,,,,,"en",,,,,,,,,,,,,
"x637342271181037568",2015-08-28 19:13:33,"x18137749","ChrisVanHollen","These safety lapses are unacceptable &amp; cannot be tolerated in a system that &gt;700K people rely on every day https://t.co/QCS9lGxEDD","Twitter Web Client",,,,FALSE,FALSE,2,4,,,"vanhollen.house.gov/media-center/p…","https://t.co/QCS9lGxEDD","https://vanhollen.house.gov/media-center/press-releases/van-hollen-statement-on-wmata-report-on-silver-line-derailment",,,,,,,,,,,"en",,,,,,,,,,,,,
"x637335562148417536",2015-08-28 18:46:53,"x18137749","ChrisVanHollen","I join every @wmata rider in demanding immediate action to solve the multiple problems outlined in this report https://t.co/QCS9lGg3f3","Twitter Web Client",,,,FALSE,FALSE,7,6,,,"vanhollen.house.gov/media-center/p…","https://t.co/QCS9lGg3f3","https://vanhollen.house.gov/media-center/press-releases/van-hollen-statement-on-wmata-report-on-silver-line-derailment",,,,,,,,,"x18938912","wmata","en",,,,,,,,,,,,,
"x637065152530092032",2015-08-28 00:52:23,"x18137749","ChrisVanHollen","Hatred &amp; anti-Semitism is unacceptable. Our entire community condemns this &amp; I urge swift action to find perpetrators http://t.co/MIBHY8S5Xu","Twitter Web Client",,,,FALSE,FALSE,13,13,,,"wtop.com/montgomery-cou…","http://t.co/MIBHY8S5Xu","http://wtop.com/montgomery-county/2015/08/swastikas-painted-on-montgomery-co-speed-cameras-sign/slide/1/",,,,,,,,,,,"en",,,,,,,,,,,,,
"x637022120120352768",2015-08-27 22:01:23,"x18137749","ChrisVanHollen",".@SenTedCruz is threatening a shutdown in order to restrict healthcare for women. We have a fight on our hands. https://t.co/unnSrT9Uzt","Twitter Web Client",,,,FALSE,FALSE,15,28,,,"facebook.com/chrisvanhollen…","https://t.co/unnSrT9Uzt","https://www.facebook.com/chrisvanhollen/videos/10153237758713878/",,,,,,,,,"x1074480192","SenTedCruz","en",,,,,,,,,,,,,
"x636650059443122177",2015-08-26 21:22:57,"x18137749","ChrisVanHollen","Proud to work with @RepDonaldPayne and 82 other colleagues to build an economy that works for everyone -http://t.co/8isPShHjOS","TweetDeck",,,,FALSE,FALSE,5,2,,,"1.usa.gov/1Ihlriv","http://t.co/8isPShHjOS","http://1.usa.gov/1Ihlriv",,,,,,,,,"x1155335864","RepDonaldPayne","en",,,,,,,,,,,,,
"x636614361604198400",2015-08-26 19:01:06,"x18137749","ChrisVanHollen","Equal work deserves #equalpay - period. Congress must pass the Paycheck Fairness Act! #WomensEqualityDay #Shequality","TweetDeck",,,,FALSE,FALSE,10,8,"equalpay WomensEqualityDay Shequality",,,,,,,,,,,,,,,"en",,,,,,,,,,,,,
"x636601265183592448",2015-08-26 18:09:03,"x18137749","ChrisVanHollen","Unacceptable that the U.S. is one of the few countries that doesn't require paid maternity leave. Together we must fix this. #Shequality","TweetDeck",,,,FALSE,FALSE,23,25,"Shequality",,,,,,,,,,,,,,,"en",,,,,,,,,,,,,
"x636589177354649600",2015-08-26 17:21:01,"x18137749","ChrisVanHollen","On #WomensEqualityDay we must redouble our efforts to ensure #EqualPay and fight GOP attempts to limit women's access to health care.","TweetDeck",,,,FALSE,FALSE,5,4,"WomensEqualityDay EqualPay",,,,,,,,,,,,,,,"en",,,,,,,,,,,,,
"x636578706283196416",2015-08-26 16:39:25,"x18137749","ChrisVanHollen","My heart breaks for Alison, Adam &amp; the entire @WDBJ7 family after today's horrific shooting. How many more have to die before Congress acts?","TweetDeck",,,,FALSE,FALSE,18,27,,,,,,,,,,,,,,"x14857413","WDBJ7","en",,,,,,,,,,,,,
"x636322132495069185",2015-08-25 23:39:53,"x18137749","ChrisVanHollen","Racial profiling by police is a national issue we must address. I applaud MD &amp; AG Frosh for leading by example. http://t.co/7LcdzsKlhW","Twitter for iPhone",,,,FALSE,FALSE,12,15,,,"reuters.com/article/2015/0…","http://t.co/7LcdzsKlhW","http://www.reuters.com/article/2015/08/25/us-usa-police-maryland-idUSKCN0QU26020150825",,,,,,,,,,,"en",,,,,,,,,,,,,
"x636269095395069953",2015-08-25 20:09:08,"x18137749","ChrisVanHollen",".@USCBO outlook underscores need to grow econ &amp; wages, not another @sentedcruz gov shutdown over @PPFA. #StandwithPP http://t.co/SaESSQ7ZTb","TweetDeck",,,,FALSE,FALSE,4,7,"StandwithPP",,"1.usa.gov/1hcjfTx","http://t.co/SaESSQ7ZTb","http://1.usa.gov/1hcjfTx",,,,,,,,,"x1531265618 1074480192 402957663","USCBO SenTedCruz PPFA","en",,,,,,,,,,,,,
"x636251020302098433",2015-08-25 18:57:18,"x18137749","ChrisVanHollen","Happy 99th birthday @NatlParkService! #FindYourPark in Maryland and pay $0 admission today: http://t.co/BFjDoeYpwX #NPS99","TweetDeck",,,,FALSE,FALSE,4,3,"FindYourPark NPS99",,"1.usa.gov/1hchdD5","http://t.co/BFjDoeYpwX","http://1.usa.gov/1hchdD5",,,,,,,,,"x36771809","NatlParkService","en",,,,,,,,,,,,,
"x636248271753736192",2015-08-25 18:46:23,"x18137749","ChrisVanHollen","The #EITC is one of our best anti-#poverty measures -- making it more complex is a bad idea. http://t.co/TPGwH09B4j","Twitter for iPhone",,,,FALSE,FALSE,13,7,"EITC poverty",,"vox.com/2015/8/24/9195…","http://t.co/TPGwH09B4j","http://www.vox.com/2015/8/24/9195129/h-r-block",,,,,,,,,,,"en",,,,,,,,,,,,,
"x636159127195123712",2015-08-25 12:52:09,"x18137749","ChrisVanHollen","Glad to see @whitehouse #ActOnClimate by encouraging use of solar. It's a win-win for the environment &amp; the economy http://t.co/1wGA8J8St9","Twitter for iPhone",,,,FALSE,FALSE,15,15,"ActOnClimate",,"nytimes.com/2015/08/25/us/…","http://t.co/1wGA8J8St9","http://www.nytimes.com/2015/08/25/us/obama-solar-power-renewable-energy.html?_r=0",,,,,,,,,"x822215673812119553","WhiteHouse","en",,,,,,,,,,,,,
"x634837400238166016",2015-08-21 21:20:05,"x18137749","ChrisVanHollen","Congrats to the first two female graduates of the @FortBenning @USArmy Rangers school. Great day for #GenderEquality! http://t.co/m1wscqYwi8","TweetDeck",,,,FALSE,FALSE,12,7,"GenderEquality",,"n.pr/1NAF63N","http://t.co/m1wscqYwi8","http://n.pr/1NAF63N",,,,,,,,,"x41587954 8775672","FortBenning USArmy","en",,,,,,,,,,,,,
"x634827080098795520",2015-08-21 20:39:05,"x18137749","ChrisVanHollen","Learning about new @usedgov program to help inmates get a college education—a promising way to break cycle of crime http://t.co/vVouWBRSO9","Twitter for iPhone",,,,FALSE,FALSE,6,5,,,,,,"http://pbs.twimg.com/media/CM9b3P5WsAA0d-u.jpg","http://t.co/vVouWBRSO9","https://twitter.com/ChrisVanHollen/status/634827080098795520/photo/1","photo","http://pbs.twimg.com/media/CM9b3P5WsAA0d-u.jpg","http://t.co/vVouWBRSO9","https://twitter.com/ChrisVanHollen/status/634827080098795520/photo/1",,"x20437286","usedgov","en",,,,,,,,,,,,,
"x634442034040848385",2015-08-20 19:09:02,"x18137749","ChrisVanHollen","No one working full time should have to raise a family in poverty. We must build on LBJ's War on Poverty &amp; oppose the GOP's war on the poor.","TweetDeck",,,,FALSE,FALSE,9,8,,,,,,,,,,,,,,,,"en",,,,,,,,,,,,,
"x634426581327462400",2015-08-20 18:07:38,"x18137749","ChrisVanHollen","On this day in 1964, LBJ signed the Economic Opportunity Act, marking the start of the War on Poverty. http://t.co/VTf5fzvO01","TweetDeck",,,,FALSE,FALSE,9,11,,,,,,"http://pbs.twimg.com/media/CM3vj04XAAAzQo3.jpg","http://t.co/VTf5fzvO01","https://twitter.com/ChrisVanHollen/status/634426581327462400/photo/1","photo","http://pbs.twimg.com/media/CM3vj04XAAAzQo3.jpg","http://t.co/VTf5fzvO01","https://twitter.com/ChrisVanHollen/status/634426581327462400/photo/1",,,,"en",,,,,,,,,,,,,
"x634072210081251329",2015-08-19 18:39:30,"x18137749","ChrisVanHollen","#StartupDay is the perfect time to turn your business idea into reality, and @MDBiz is here to help: http://t.co/AMlzi16Zpg","TweetDeck",,,,FALSE,FALSE,5,1,"StartupDay",,"1.usa.gov/1hpGsCq","http://t.co/AMlzi16Zpg","http://1.usa.gov/1hpGsCq",,,,,,,,,"x31138753","MDBiz","en",,,,,,,,,,,,,
"x633722304971821056",2015-08-18 19:29:06,"x18137749","ChrisVanHollen","Methane has an outsized impact on global warming. Today's @EPA proposal is an important step toward a safer climate. https://t.co/uYDhbXSekd","Twitter for iPhone",,,,FALSE,FALSE,7,12,,,"vanhollen.house.gov/media-center/p…","https://t.co/uYDhbXSekd","https://vanhollen.house.gov/media-center/press-releases/van-hollen-statement-on-epa-methane-pollution-standards",,,,,,,,,"x14615871","EPA","en",,,,,,,,,,,,,
"x633713132423237632",2015-08-18 18:52:39,"x18137749","ChrisVanHollen","Participating in a documentary on Quince Orchard, a little known but important part of African American history in MD http://t.co/HkHEGGm1pu","Twitter for iPhone",,,,FALSE,FALSE,4,3,,,,,,"http://pbs.twimg.com/media/CMtmuPaWsAAO5Jg.jpg","http://t.co/HkHEGGm1pu","https://twitter.com/ChrisVanHollen/status/633713132423237632/photo/1","photo","http://pbs.twimg.com/media/CMtmuPaWsAAO5Jg.jpg","http://t.co/HkHEGGm1pu","https://twitter.com/ChrisVanHollen/status/633713132423237632/photo/1",,,,"en",,,,,,,,,,,,,
"x633657335802634240",2015-08-18 15:10:56,"x18137749","ChrisVanHollen","(2/2) We must build on the progress made by this landmark legislation &amp; work to end the #HIVAIDS epidemic in America once and for all.","Twitter for iPhone",,,,FALSE,FALSE,4,6,"HIVAIDS",,,,,,,,,,,,,,,"en",,,,,,,,,,,,,
"x633657160849731586",2015-08-18 15:10:14,"x18137749","ChrisVanHollen","For 25 years the Ryan White CARE Act has helped millions of underserved Americans get the #HIVAIDS treatment they need. (1/2)","Twitter for iPhone",,,,FALSE,FALSE,4,9,"HIVAIDS",,,,,,,,,,,,,,,"en",,,,,,,,,,,,,
"x633307647819837440",2015-08-17 16:01:24,"x18137749","ChrisVanHollen","Addiction is a public health issue, not a criminal one. Proud MD is part of @WhiteHouse plan to put treatment first—http://t.co/cw6suyjgIP","Twitter for iPhone",,,,FALSE,FALSE,8,11,,,"washingtonpost.com/politics/in-he…","http://t.co/cw6suyjgIP","http://www.washingtonpost.com/politics/in-heroin-fight-white-house-tries-to-break-down-walls-between-public-health-police/2015/08/16/f63d63c2-4425-11e5-8ab4-c73967a143d3_story.html",,,,,,,,,"x822215673812119553","WhiteHouse","en",,,,,,,,,,,,,
"x633027241543376896",2015-08-16 21:27:10,"x18137749","ChrisVanHollen","RIP #JulianBond, tireless fighter for equal justice and a father of the civil rights movement. May he rest in peace as his legacy lives on.","Twitter for iPhone",,,,FALSE,FALSE,28,26,"JulianBond",,,,,,,,,,,,,,,"en",,,,,,,,,,,,,
"x632270403063386112",2015-08-14 19:19:45,"x18137749","ChrisVanHollen","8 months after @AlanPGross came home, it's great to see us reach another milestone as we open @USEmbCuba in Havana. http://t.co/J2UctYLOwO","Twitter for iPhone",,,,FALSE,FALSE,12,16,,,,,,"http://pbs.twimg.com/media/CMZGkqZUsAA1ACf.jpg","http://t.co/J2UctYLOwO","https://twitter.com/ChrisVanHollen/status/632270403063386112/photo/1","photo","http://pbs.twimg.com/media/CMZGkqZUsAA1ACf.jpg","http://t.co/J2UctYLOwO","https://twitter.com/ChrisVanHollen/status/632270403063386112/photo/1",,"x2942226411 133769083","AlanPGross USEmbCuba","en",,,,,,,,,,,,,
"x632261586548326400",2015-08-14 18:44:43,"x18137749","ChrisVanHollen","#SocialSecurity keeps hundreds of thousands of Marylanders – including many kids – out of poverty. Happy anniversary! #SocialSecurity80","Twitter for iPhone",,,,FALSE,FALSE,13,10,"SocialSecurity SocialSecurity80",,,,,,,,,,,,,,,"en",,,,,,,,,,,,,
"x632238970194292736",2015-08-14 17:14:51,"x18137749","ChrisVanHollen","#SocialSecurity is an earned benefit that we MUST preserve and strengthen for tomorrow's seniors. #SocialSecurity80","Twitter for iPhone",,,,FALSE,FALSE,12,18,"SocialSecurity SocialSecurity80",,,,,,,,,,,,,,,"en",,,,,,,,,,,,,
"x631882429783937029",2015-08-13 17:38:05,"x18137749","ChrisVanHollen","#SocialSecurity has lifted millions of seniors out of poverty, allowing them to live independent, more dignified lives. #SocialSecurity80","TweetDeck",,,,FALSE,FALSE,17,10,"SocialSecurity SocialSecurity80",,,,,,,,,,,,,,,"en",,,,,,,,,,,,,
"x631823504095232000",2015-08-13 13:43:56,"x18137749","ChrisVanHollen",".@wmata knew of defect pre-derailment &amp; did nothing. Riders deserve their safety to be guaranteed by more than luck. http://t.co/mJN7oF6d2z","Twitter for iPhone",,,,FALSE,FALSE,10,10,,,"washingtonpost.com/local/traffica…","http://t.co/mJN7oF6d2z","http://www.washingtonpost.com/local/trafficandcommuting/cause-of-last-weeks-metro-derailment-had-been-detected-in-early-july/2015/08/12/a77540f8-4131-11e5-8ab4-c73967a143d3_story.html",,,,,,,,,"x18938912","wmata","en",,,,,,,,,,,,,
"x631651402717265920",2015-08-13 02:20:04,"x18137749","ChrisVanHollen","President Carter is a great American who has done so much to advance peace. Thinking of him &amp; his family as he begins his cancer treatment.","Twitter for iPhone",,,,FALSE,FALSE,44,35,,,,,,,,,,,,,,,,"en",,,,,,,,,,,,,
"x631204842086793217",2015-08-11 20:45:36,"x18137749","ChrisVanHollen","The #ACAisWorking in MD! Proud to announce $1.5M in funding for community health centers in Bethesda &amp; Silver Spring—http://t.co/pJCFrP7D0C","TweetDeck",,,,FALSE,FALSE,10,22,"ACAisWorking",,"1.usa.gov/1gxwNJ0","http://t.co/pJCFrP7D0C","http://1.usa.gov/1gxwNJ0",,,,,,,,,,,"en",,,,,,,,,,,,,
"x631134682155995136",2015-08-11 16:06:48,"x18137749","ChrisVanHollen","Way to go @katieledecky! Making Maryland proud as I'm sure you'll make the #USA proud with @usaswimming in #Rio2016 — http://t.co/wb1YNsCvID","TweetDeck",,,,FALSE,FALSE,4,4,"USA Rio2016",,"bit.ly/1hvRgyJ","http://t.co/wb1YNsCvID","http://bit.ly/1hvRgyJ",,,,,,,,,"x743538714 76682652","katieledecky USASwimming","en",,,,,,,,,,,,,
"x629787223072837632",2015-08-07 22:52:29,"x18137749","ChrisVanHollen","The system is broken. @LarryHogan &amp; @SpeakerBoehner should support HR 2173 to end partisan redistricting nationwide: https://t.co/QO3ilziHfa","Twitter for iPhone",,,,FALSE,FALSE,10,22,,,"vanhollen.house.gov/media-center/p…","https://t.co/QO3ilziHfa","https://vanhollen.house.gov/media-center/press-releases/van-hollen-calls-on-hogan-and-boehner-to-support-national-redistricting",,,,,,,,,"x2987671552 7713202","LarryHogan SpeakerBoehner","en",,,,,,,,,,,,,
"x629760712504688640",2015-08-07 21:07:08,"x18137749","ChrisVanHollen","SEC's CEO-worker pay ratio rule is a good step. My CEO-worker pay fairness bill would start to close the huge gap: http://t.co/LZkLKzyK2Z","TweetDeck",,,,FALSE,FALSE,1,5,,,"1.usa.gov/ZCddDb","http://t.co/LZkLKzyK2Z","http://1.usa.gov/ZCddDb",,,,,,,,,,,"en",,,,,,,,,,,,,
