"status_id","created_at","user_id","screen_name","text","source","reply_to_status_id","reply_to_user_id","reply_to_screen_name","is_quote","is_retweet","favorite_count","retweet_count","hashtags","symbols","urls_url","urls_t.co","urls_expanded_url","media_url","media_t.co","media_expanded_url","media_type","ext_media_url","ext_media_t.co","ext_media_expanded_url","ext_media_type","mentions_user_id","mentions_screen_name","lang","quoted_status_id","quoted_text","retweet_status_id","retweet_text","place_url","place_name","place_full_name","place_type","country","country_code","geo_coords","coords_coords","bbox_coords"
"x861219332990410757",2017-05-07 14:01:04,"x18137749","ChrisVanHollen","Community colleges like @hagerstowncc are an essential linchpin in MD’s education system. I know our future is in good hands! https://t.co/74vgIHHiA6","Twitter for iPhone",,,,FALSE,FALSE,33,4,,,,,,"http://pbs.twimg.com/media/C_OqakxXcAEbELX.jpg","https://t.co/74vgIHHiA6","https://twitter.com/ChrisVanHollen/status/861219332990410757/photo/1","photo","http://pbs.twimg.com/media/C_OqakxXcAEbELX.jpg","https://t.co/74vgIHHiA6","https://twitter.com/ChrisVanHollen/status/861219332990410757/photo/1",,"x20266896","hagerstowncc","en",,,,,,,,,,,,,
"x860979269715079168",2017-05-06 22:07:08,"x18137749","ChrisVanHollen","The @cocanalnps revitalization project is a great example of local, state &amp; federal resources coming together to support historic landmarks. https://t.co/fiWPPDHvtf","Twitter Web Client",,,,FALSE,FALSE,31,4,,,,,,"http://pbs.twimg.com/media/C_LPzcRXgAEXPLE.jpg","https://t.co/fiWPPDHvtf","https://twitter.com/ChrisVanHollen/status/860979269715079168/photo/1","photo","http://pbs.twimg.com/media/C_LPzcRXgAEXPLE.jpg http://pbs.twimg.com/media/C_LP1SVXUAAsfEs.jpg","https://t.co/fiWPPDHvtf https://t.co/fiWPPDHvtf","https://twitter.com/ChrisVanHollen/status/860979269715079168/photo/1 https://twitter.com/ChrisVanHollen/status/860979269715079168/photo/1",,"x49661993","COcanalNPS","en",,,,,,,,,,,,,
"x860950943281623040",2017-05-06 20:14:35,"x18137749","ChrisVanHollen","They can try to take away our health care, but they can’t take away our grit to fight back. #ProtectOurCare https://t.co/bDsLYqNe7v","Twitter for iPhone",,,,FALSE,FALSE,153,58,"ProtectOurCare",,,,,"http://pbs.twimg.com/media/C_K2UQyUIAA5gSP.jpg","https://t.co/bDsLYqNe7v","https://twitter.com/ChrisVanHollen/status/860950943281623040/photo/1","photo","http://pbs.twimg.com/media/C_K2UQyUIAA5gSP.jpg","https://t.co/bDsLYqNe7v","https://twitter.com/ChrisVanHollen/status/860950943281623040/photo/1",,,,"en",,,,,,,,,,,,,
"x860893761399910404",2017-05-06 16:27:22,"x18137749","ChrisVanHollen","The first battle of the budgets: President Trump cuts were pushed back and Marylanders won. https://t.co/3EZ5y3zEkv","Twitter Web Client",,,,FALSE,FALSE,118,34,,,"medium.com/@ChrisVanHolle…","https://t.co/3EZ5y3zEkv","https://medium.com/@ChrisVanHollen/the-first-battle-of-the-budgets-trump-cuts-were-pushed-back-and-marylanders-won-38f54579118f",,,,,,,,,,,"en",,,,,,,,,,,,,
"x860631749432356864",2017-05-05 23:06:13,"x18137749","ChrisVanHollen","Today on #ForeignServiceDay, I want to honor our foreign service officers, who work tirelessly for our country. https://t.co/IaHf5MX5ez","Twitter Web Client",,,,FALSE,FALSE,84,24,"ForeignServiceDay",,,,,"http://pbs.twimg.com/ext_tw_video_thumb/860631103882833921/pu/img/aovBl5RIJvI1u-wg.jpg","https://t.co/IaHf5MX5ez","https://twitter.com/ChrisVanHollen/status/860631749432356864/video/1","photo","http://pbs.twimg.com/ext_tw_video_thumb/860631103882833921/pu/img/aovBl5RIJvI1u-wg.jpg","https://t.co/IaHf5MX5ez","https://twitter.com/ChrisVanHollen/status/860631749432356864/video/1",,,,"en",,,,,,,,,,,,,
"x860578011342614529",2017-05-05 19:32:41,"x18137749","ChrisVanHollen","Sending well wishes to @jimvance4 and his family. https://t.co/xOUEInf13p","Twitter Web Client",,,,FALSE,FALSE,93,16,,,"nbcwashington.com/news/local/Jim…","https://t.co/xOUEInf13p","http://www.nbcwashington.com/news/local/Jim-Vance_Washington-DC-421393873.html",,,,,,,,,"x267912413","jimvance4","en",,,,,,,,,,,,,
"x860275417214857218",2017-05-04 23:30:17,"x18137749","ChrisVanHollen","Proud to be in the fight for common sense gun reform w/ @SenBlumenthal, @ChrisMurphyCT, &amp; @RepEsty. The time for Rs to act is long past due. https://t.co/g4Ige4PBzC","Twitter Web Client",,,,FALSE,FALSE,118,35,,,,,,"http://pbs.twimg.com/media/C_BOwNMW0AAQ294.jpg","https://t.co/g4Ige4PBzC","https://twitter.com/ChrisVanHollen/status/860275417214857218/photo/1","photo","http://pbs.twimg.com/media/C_BOwNMW0AAQ294.jpg","https://t.co/g4Ige4PBzC","https://twitter.com/ChrisVanHollen/status/860275417214857218/photo/1",,"x278124059 150078976 1060984272","SenBlumenthal ChrisMurphyCT RepEsty","en",,,,,,,,,,,,,
"x860207557071310857",2017-05-04 19:00:38,"x18137749","ChrisVanHollen","We need to work non-stop to block the destructive House anti-healthcare bill in the U.S. Senate.","Twitter Web Client",,,,FALSE,FALSE,536,177,,,,,,,,,,,,,,,,"en",,,,,,,,,,,,,
"x860176477161172994",2017-05-04 16:57:08,"x18137749","ChrisVanHollen","Republicans are sending a clear message: They will put partisan politics above Americans’ lives and the right to affordable health care.","Twitter Web Client",,,,FALSE,FALSE,308,183,,,,,,,,,,,,,,,,"en",,,,,,,,,,,,,
"x859942564744630272",2017-05-04 01:27:39,"x18137749","ChrisVanHollen","Unconscionable that Senate R's today voted to deny millions of Americans access to the kind of 401k savings plans that they get as senators.","Twitter for iPhone",,,,FALSE,FALSE,235,162,,,,,,,,,,,,,,,,"en",,,,,,,,,,,,,
"x859923592875847680",2017-05-04 00:12:15,"x18137749","ChrisVanHollen","Over 400K Americans suffer from MS every day. Proud of the work being done @UofMaryland to combat this disease.
https://t.co/NeW13DVMs9","Twitter for iPhone",,,,FALSE,FALSE,85,26,,,"baltimoresun.com/health/bs-hs-l…","https://t.co/NeW13DVMs9","http://www.baltimoresun.com/health/bs-hs-lemelson-award-20170506-story.html",,,,,,,,,"x16129880","UofMaryland","en",,,,,,,,,,,,,
"x859852136502439946",2017-05-03 19:28:19,"x18137749","ChrisVanHollen","Question, @SenateGOP: Why are you working to strip away access to retirement savings for millions of Americans? #SaveRetirement","Twitter Web Client",,,,FALSE,FALSE,133,71,"SaveRetirement",,,,,,,,,,,,,"x14344823","SenateGOP","en",,,,,,,,,,,,,
"x859828260393320448",2017-05-03 17:53:26,"x18137749","ChrisVanHollen",".@SenateGOP want to make it harder for Americans to save for retirement. We can’t let this happen. Watch live: https://t.co/JhwyJ8gzOA","Twitter Web Client",,,,FALSE,FALSE,34,15,,,"facebook.com/chrisvanhollen…","https://t.co/JhwyJ8gzOA","https://www.facebook.com/chrisvanhollen/videos/10154790475308878/",,,,,,,,,"x14344823","SenateGOP","en",,,,,,,,,,,,,
"x859554174824050688",2017-05-02 23:44:19,"x18137749","ChrisVanHollen","I was proud to lead the fight in MD Senate for our anti-discrimination law, and now proud to cosponsor @SenJeffMerkley’s #EqualityAct. https://t.co/XOITLJLAEl","Twitter Web Client",,,,FALSE,FALSE,157,49,"EqualityAct",,,,,"http://pbs.twimg.com/media/C-2_7l9XgAAxFpu.jpg","https://t.co/XOITLJLAEl","https://twitter.com/ChrisVanHollen/status/859554174824050688/photo/1","photo","http://pbs.twimg.com/media/C-2_7l9XgAAxFpu.jpg","https://t.co/XOITLJLAEl","https://twitter.com/ChrisVanHollen/status/859554174824050688/photo/1",,"x29201047","SenJeffMerkley","en",,,,,,,,,,,,,
"x859188188535017472",2017-05-01 23:30:01,"x18137749","ChrisVanHollen","Despite @POTUS’ attempt to make massive budget cuts, @EPA, @NIH, and @PPFA will be funded. Good news for Marylanders. https://t.co/XvA1BFijgI","TweetDeck",,,,FALSE,FALSE,250,85,,,,,,"http://pbs.twimg.com/media/C-xozD-XoAEgNj0.jpg","https://t.co/XvA1BFijgI","https://twitter.com/ChrisVanHollen/status/859188188535017472/photo/1","photo","http://pbs.twimg.com/media/C-xozD-XoAEgNj0.jpg","https://t.co/XvA1BFijgI","https://twitter.com/ChrisVanHollen/status/859188188535017472/photo/1",,"x822215679726100480 14615871 15134240 402957663","POTUS EPA NIH PPFA","en",,,,,,,,,,,,,
"x859136748508631042",2017-05-01 20:05:37,"x18137749","ChrisVanHollen","Our President should condemn leaders who brag about killing their own people, not welcome them to the White House.
https://t.co/wr0HBtmucs","Twitter for iPhone",,,,FALSE,FALSE,187,81,,,"washingtonpost.com/news/worldview…","https://t.co/wr0HBtmucs","https://www.washingtonpost.com/news/worldviews/wp/2017/04/30/trump-invites-controversial-philippine-leader-duterte-to-the-white-house/?utm_term=.7803374c786e",,,,,,,,,,,"en",,,,,,,,,,,,,
"x859075880836108289",2017-05-01 16:03:45,"x18137749","ChrisVanHollen","A trail of broken promises: The real story of #Trump100Days in office. https://t.co/sdgfOhSySV","Twitter Web Client",,,,FALSE,FALSE,70,36,"Trump100Days",,"medium.com/@ChrisVanHolle…","https://t.co/sdgfOhSySV","https://medium.com/@ChrisVanHollen/broken-promises-the-story-of-president-trumps-first-100-days-in-office-3f3b144a2672",,,,,,,,,,,"en",,,,,,,,,,,,,
"x858351467161309184",2017-04-29 16:05:11,"x18137749","ChrisVanHollen","5th grader Caitlin's letter hits the nail on the head: It's up to all of us to #ActOnClimate #ClimateMarch https://t.co/p9MIaXhmaU","Media Studio",,,,FALSE,FALSE,68,28,"ActOnClimate ClimateMarch",,,,,"http://pbs.twimg.com/amplify_video_thumb/858349677586006016/img/gw0bKqbNJ_RT_z6M.jpg","https://t.co/p9MIaXhmaU","https://twitter.com/ChrisVanHollen/status/858351467161309184/video/1","photo","http://pbs.twimg.com/amplify_video_thumb/858349677586006016/img/gw0bKqbNJ_RT_z6M.jpg","https://t.co/p9MIaXhmaU","https://twitter.com/ChrisVanHollen/status/858351467161309184/video/1",,,,"en",,,,,,,,,,,,,
"x858320687269896192",2017-04-29 14:02:53,"x18137749","ChrisVanHollen","Dear @POTUS, on your 100th day in office, @SenDuckworth and I have a message for you: Stop breaking your promises to the American people. https://t.co/mkodM53C3M","Media Studio",,,,FALSE,FALSE,391,168,,,,,,"http://pbs.twimg.com/media/C-leB28V0AAzXe4.jpg","https://t.co/mkodM53C3M","https://twitter.com/ChrisVanHollen/status/858320687269896192/video/1","photo","http://pbs.twimg.com/media/C-leB28V0AAzXe4.jpg","https://t.co/mkodM53C3M","https://twitter.com/ChrisVanHollen/status/858320687269896192/video/1",,"x822215679726100480 1058520120","POTUS SenDuckworth","en",,,,,,,,,,,,,
"x858066625681117185",2017-04-28 21:13:20,"x18137749","ChrisVanHollen","Congratulations to Maryland’s #TeacheroftheYear Sia Kyriakakos. Your incredible work and passion for the arts are awe inspiring. https://t.co/54ae1JhNnI","Media Studio",,,,FALSE,FALSE,69,15,"TeacheroftheYear",,,,,"http://pbs.twimg.com/amplify_video_thumb/858061823974748160/img/ZBi9liojzfbb8SFb.jpg","https://t.co/54ae1JhNnI","https://twitter.com/ChrisVanHollen/status/858066625681117185/video/1","photo","http://pbs.twimg.com/amplify_video_thumb/858061823974748160/img/ZBi9liojzfbb8SFb.jpg","https://t.co/54ae1JhNnI","https://twitter.com/ChrisVanHollen/status/858066625681117185/video/1",,,,"en",,,,,,,,,,,,,
"x857983700042223619",2017-04-28 15:43:49,"x18137749","ChrisVanHollen","We must rise above partisan politics and put democracy first. I’m fighting with @SenateDems to make sure that happens. https://t.co/3EvumSyKb3","Twitter Web Client",,,,FALSE,FALSE,140,66,,,,,,"http://pbs.twimg.com/media/C-gm8DmXsAANZ3-.jpg","https://t.co/3EvumSyKb3","https://twitter.com/ChrisVanHollen/status/857983700042223619/photo/1","photo","http://pbs.twimg.com/media/C-gm8DmXsAANZ3-.jpg","https://t.co/3EvumSyKb3","https://twitter.com/ChrisVanHollen/status/857983700042223619/photo/1",,"x73238146","SenateDems","en",,,,,,,,,,,,,
"x857648873988292609",2017-04-27 17:33:20,"x18137749","ChrisVanHollen","From one wild man to another, happy birthday @CoryBooker. https://t.co/HSDwXO3HQI","Media Studio",,,,FALSE,FALSE,107,19,,,,,,"http://pbs.twimg.com/media/C-b6_04XkAA3yY6.jpg","https://t.co/HSDwXO3HQI","https://twitter.com/ChrisVanHollen/status/857648873988292609/video/1","photo","http://pbs.twimg.com/media/C-b6_04XkAA3yY6.jpg","https://t.co/HSDwXO3HQI","https://twitter.com/ChrisVanHollen/status/857648873988292609/video/1",,"x15808765","CoryBooker","en",,,,,,,,,,,,,
"x857347127156113409",2017-04-26 21:34:18,"x18137749","ChrisVanHollen","The @FCC's plan to destroy #NetNeutrality is shameful. We should be putting American consumers first, not corporations.","Twitter Web Client",,,,FALSE,FALSE,234,141,"NetNeutrality",,,,,,,,,,,,,"x66369206","FCC","en",,,,,,,,,,,,,
"x857293830160338944",2017-04-26 18:02:31,"x18137749","ChrisVanHollen","The Trump tax plan stacks the deck even more in favor of the super wealthy and companies like his.","Twitter Web Client",,,,FALSE,FALSE,100,55,,,,,,,,,,,,,,,,"en",,,,,,,,,,,,,
"x856980460521623552",2017-04-25 21:17:18,"x18137749","ChrisVanHollen","The best way to make America strong is to help Americans prosper. An ineffective wall paid for by taxpayers isn't the way to get there. https://t.co/1Yn9sB13Rj","Twitter Web Client",,,,FALSE,FALSE,172,57,,,,,,"http://pbs.twimg.com/media/C-SbDwJWAAAXv4Y.jpg","https://t.co/1Yn9sB13Rj","https://twitter.com/ChrisVanHollen/status/856980460521623552/photo/1","photo","http://pbs.twimg.com/media/C-SbDwJWAAAXv4Y.jpg","https://t.co/1Yn9sB13Rj","https://twitter.com/ChrisVanHollen/status/856980460521623552/photo/1",,,,"en",,,,,,,,,,,,,
"x856617893605330945",2017-04-24 21:16:35,"x18137749","ChrisVanHollen","On #HolocaustRemembranceDay and every day, we must never forget this tragic history and reflect on the lessons it holds for our lives today. https://t.co/w6Fkv7qCT2","Twitter Web Client",,,,FALSE,FALSE,83,25,"HolocaustRemembranceDay",,,,,"http://pbs.twimg.com/media/C-NRVTJW0AAFz-Q.jpg","https://t.co/w6Fkv7qCT2","https://twitter.com/ChrisVanHollen/status/856617893605330945/photo/1","photo","http://pbs.twimg.com/media/C-NRVTJW0AAFz-Q.jpg","https://t.co/w6Fkv7qCT2","https://twitter.com/ChrisVanHollen/status/856617893605330945/photo/1",,,,"en",,,,,,,,,,,,,
"x855779611485057027",2017-04-22 13:45:33,"x18137749","ChrisVanHollen","This #EarthDay, I’m joining thousands of Americans to stand up for human progress at the #ScienceMarch. Here’s why ↓ https://t.co/TLsPAYXKSQ","Twitter Web Client",,,,FALSE,FALSE,189,40,"EarthDay ScienceMarch",,"medium.com/@ChrisVanHolle…","https://t.co/TLsPAYXKSQ","https://medium.com/@ChrisVanHollen/marching-in-support-of-science-8a1ed4c05729",,,,,,,,,,,"en",,,,,,,,,,,,,
"x855544305678680065",2017-04-21 22:10:32,"x18137749","ChrisVanHollen","Trump’s new executive orders are outrageous! He promised to help working people, but only protects his pals on Wall Street. Trump = Con man. https://t.co/C0kF9rEzDI","Twitter Web Client",,,,FALSE,FALSE,285,126,,,,,,"http://pbs.twimg.com/ext_tw_video_thumb/855543470618030081/pu/img/7tSXraAYOsZNCtod.jpg","https://t.co/C0kF9rEzDI","https://twitter.com/ChrisVanHollen/status/855544305678680065/video/1","photo","http://pbs.twimg.com/ext_tw_video_thumb/855543470618030081/pu/img/7tSXraAYOsZNCtod.jpg","https://t.co/C0kF9rEzDI","https://twitter.com/ChrisVanHollen/status/855544305678680065/video/1",,,,"en",,,,,,,,,,,,,
"x855391142472556544",2017-04-21 12:01:55,"x18137749","ChrisVanHollen","Great #BMoreTownHall last night! Looking forward to continuing the discussion and sharing ideas about how to move Maryland forward. https://t.co/DqnMy5c7vV","Twitter for iPhone",,,,FALSE,FALSE,111,31,"BMoreTownHall",,,,,"http://pbs.twimg.com/media/C971tG3XgAE3eE5.jpg","https://t.co/DqnMy5c7vV","https://twitter.com/ChrisVanHollen/status/855391142472556544/photo/1","photo","http://pbs.twimg.com/media/C971tG3XgAE3eE5.jpg","https://t.co/DqnMy5c7vV","https://twitter.com/ChrisVanHollen/status/855391142472556544/photo/1",,,,"en",,,,,,,,,,,,,
"x855203544718229504",2017-04-20 23:36:28,"x18137749","ChrisVanHollen","Tune in to the #BmoreTownHall - this is what democracy looks like. https://t.co/nnSmEGKKhY","Periscope",,,,FALSE,FALSE,520,194,"BmoreTownHall",,"pscp.tv/w/a8fr_DF4a2pE…","https://t.co/nnSmEGKKhY","https://www.pscp.tv/w/a8fr_DF4a2pEWURHVmFlRXp8MWt2SnBRcmpBWU14RdDBExQB6hfkaYAWbjP9XGrawWiO6V83HusPN0ywVPZl",,,,,,,,,,,"en",,,,,,,,,,,,,
"x855196316091260928",2017-04-20 23:07:45,"x18137749","ChrisVanHollen","Tonight, I'm joining @RepCummings, @RepSarbanes, @Call_Me_Dutch for a town hall hosted by @indivisible410. Tune in:

#BMoreTownHall https://t.co/nR40TuPeXB","Twitter for iPhone",,,,FALSE,FALSE,45,15,"BMoreTownHall",,"twitter.com/therealnews/st…","https://t.co/nR40TuPeXB","https://twitter.com/therealnews/status/855194369040670721",,,,,,,,,"x787373558 364415553 305620929 822478908587175936","RepCummings RepSarbanes Call_Me_Dutch indivisible410","en",,,,,,,,,,,,,
"x854802249662464000",2017-04-19 21:01:52,"x18137749","ChrisVanHollen","Some of my fondest memories have been in our national parks―exploring, fishing, &amp; hiking w/ family. #FindYourpark during #NationalParksWeek https://t.co/TpyJR2Zj0Q","Twitter Web Client",,,,FALSE,FALSE,120,24,"FindYourpark NationalParksWeek",,,,,"http://pbs.twimg.com/media/C9zPohpXgAAr2hU.jpg","https://t.co/TpyJR2Zj0Q","https://twitter.com/ChrisVanHollen/status/854802249662464000/photo/1","photo","http://pbs.twimg.com/media/C9zPohpXgAAr2hU.jpg","https://t.co/TpyJR2Zj0Q","https://twitter.com/ChrisVanHollen/status/854802249662464000/photo/1",,,,"en",,,,,,,,,,,,,
"x854457693876236288",2017-04-18 22:12:43,"x18137749","ChrisVanHollen","He said not to worry b/c he had a ""big heart."" And now Donald Trump wonders why no one can take him at his word? https://t.co/s1Pr7k17sY","Twitter Web Client",,,,FALSE,FALSE,61,50,,,"usatoday.com/story/news/wor…","https://t.co/s1Pr7k17sY","https://www.usatoday.com/story/news/world/2017/04/18/first-protected-dreamer-deported-under-trump/100583274/",,,,,,,,,,,"en",,,,,,,,,,,,,
"x853599374944980992",2017-04-16 13:22:04,"x18137749","ChrisVanHollen","Trump claimed he was the champion of the ""forgotten people."" Yet, his tax plan gives a massive tax cut to billionaires. 

Betrayal.","Twitter for iPhone",,,,FALSE,FALSE,257,96,,,,,,,,,,,,,,,,"en",,,,,,,,,,,,,
"x853323385912340481",2017-04-15 19:05:23,"x18137749","ChrisVanHollen","On #TaxDay, don't forget:

→ Trump has yet to release his tax returns.

→ Trump's tax plan would give a massive tax cut to the upper 1%.","Twitter for iPhone",,,,FALSE,FALSE,382,213,"TaxDay",,,,,,,,,,,,,,,"en",,,,,,,,,,,,,
"x852619230470078464",2017-04-13 20:27:20,"x18137749","ChrisVanHollen","Airlines must treat passengers like #CustomersNotCargo. Taking immediate legislative action: https://t.co/47eC5G7HTS https://t.co/PdzypnL9bh","Twitter Web Client",,,,FALSE,FALSE,109,60,"CustomersNotCargo",,"bit.ly/2oEgEcA","https://t.co/47eC5G7HTS","http://bit.ly/2oEgEcA","http://pbs.twimg.com/media/C9UcBHkXkAAZjBE.jpg","https://t.co/PdzypnL9bh","https://twitter.com/ChrisVanHollen/status/852619230470078464/photo/1","photo","http://pbs.twimg.com/media/C9UcBHkXkAAZjBE.jpg","https://t.co/PdzypnL9bh","https://twitter.com/ChrisVanHollen/status/852619230470078464/photo/1",,,,"en",,,,,,,,,,,,,
"x852572829342158854",2017-04-13 17:22:57,"x18137749","ChrisVanHollen","Instead of throwing a monkey wrench into the system, President Trump needs to work with Democrats to fix the problems with the #ACA. https://t.co/SxHnMePkMU","Media Studio",,,,FALSE,FALSE,81,40,"ACA",,,,,"http://pbs.twimg.com/media/C9Tx1ZCXoAUdU4a.jpg","https://t.co/SxHnMePkMU","https://twitter.com/ChrisVanHollen/status/852572829342158854/video/1","photo","http://pbs.twimg.com/media/C9Tx1ZCXoAUdU4a.jpg","https://t.co/SxHnMePkMU","https://twitter.com/ChrisVanHollen/status/852572829342158854/video/1",,,,"en",,,,,,,,,,,,,
"x852551349476708352",2017-04-13 15:57:36,"x18137749","ChrisVanHollen","Trump's threat to blow-up ObamaCare shows moral depravity. Would harm millions to give a tax cut to the rich. https://t.co/fm9SWCET9K","Twitter Web Client",,,,FALSE,FALSE,181,138,,,"wsj.com/articles/trump…","https://t.co/fm9SWCET9K","https://www.wsj.com/articles/trump-threatens-to-withhold-payments-to-insurers-to-press-democrats-on-health-bill-1492029844?emailToken=JRrydf96Yn6fh9wzb8wgzkAtduwUC/WET0/aKmuPJk+Jq33JoeKmw6lwn9KmpG6pWV0/+9dB7mgkWCfcmnEvQMjUg6Ryikzhd3RYqZre2BGQf0Pd2U6HdO4Atuzf/y1tq/AHS1IIOIlDgR0",,,,,,,,,,,"en",,,,,,,,,,,,,
"x852175904210116609",2017-04-12 15:05:42,"x18137749","ChrisVanHollen","Treat passengers with respect, not as cargo. No one should be forced off a plane b/c it’s overbooked. Taking steps to stop this outrage. https://t.co/JTAoPwSKOJ","Media Studio",,,,FALSE,FALSE,165,41,,,,,,"http://pbs.twimg.com/media/C9OJVU9W0AAh689.jpg","https://t.co/JTAoPwSKOJ","https://twitter.com/ChrisVanHollen/status/852175904210116609/video/1","photo","http://pbs.twimg.com/media/C9OJVU9W0AAh689.jpg","https://t.co/JTAoPwSKOJ","https://twitter.com/ChrisVanHollen/status/852175904210116609/video/1",,,,"en",,,,,,,,,,,,,
"x851939624540831744",2017-04-11 23:26:49,"x18137749","ChrisVanHollen","Joined colleagues to demand answers from #United CEO Oscar Munoz about outrageous incident. Looking at legislative action, too. https://t.co/5JIUe1YDuc","Twitter Web Client",,,,FALSE,FALSE,196,76,"United",,,,,"http://pbs.twimg.com/media/C9KyZzhXsAAqJ3F.jpg","https://t.co/5JIUe1YDuc","https://twitter.com/ChrisVanHollen/status/851939624540831744/photo/1","photo","http://pbs.twimg.com/media/C9KyZzhXsAAqJ3F.jpg http://pbs.twimg.com/media/C9KyagsWAAUCvop.jpg http://pbs.twimg.com/media/C9KybNfWAAAJHpk.jpg http://pbs.twimg.com/media/C9KybyNXkAARJzE.jpg","https://t.co/5JIUe1YDuc https://t.co/5JIUe1YDuc https://t.co/5JIUe1YDuc https://t.co/5JIUe1YDuc","https://twitter.com/ChrisVanHollen/status/851939624540831744/photo/1 https://twitter.com/ChrisVanHollen/status/851939624540831744/photo/1 https://twitter.com/ChrisVanHollen/status/851939624540831744/photo/1 https://twitter.com/ChrisVanHollen/status/851939624540831744/photo/1",,,,"en",,,,,,,,,,,,,
"x851922293915881472",2017-04-11 22:17:57,"x18137749","ChrisVanHollen","Seriously, @PressSec? Forgetting the atrocities of the Holocaust is inexcusable.
 
Clearly, it's time for a visit. CC: @HolocaustMuseum https://t.co/Od9IUzPMDp","Twitter for iPhone",,,,FALSE,FALSE,363,145,,,,,,"http://pbs.twimg.com/media/C9KizNvXcAEpZ2g.jpg","https://t.co/Od9IUzPMDp","https://twitter.com/ChrisVanHollen/status/851922293915881472/photo/1","photo","http://pbs.twimg.com/media/C9KizNvXcAEpZ2g.jpg","https://t.co/Od9IUzPMDp","https://twitter.com/ChrisVanHollen/status/851922293915881472/photo/1",,"x818927131883356161 8487622","PressSec HolocaustMuseum","en",,,,,,,,,,,,,
"x851880519000367105",2017-04-11 19:31:57,"x18137749","ChrisVanHollen","I sat down with @CoryBooker to discuss the urgent need to end federal reliance on our private prison system. Watch ↓ https://t.co/40iQsZACoM","Twitter Web Client",,,,FALSE,FALSE,265,114,,,,,,"http://pbs.twimg.com/ext_tw_video_thumb/851880065008898049/pu/img/cd9E-F1lKGJnxgPH.jpg","https://t.co/40iQsZACoM","https://twitter.com/ChrisVanHollen/status/851880519000367105/video/1","photo","http://pbs.twimg.com/ext_tw_video_thumb/851880065008898049/pu/img/cd9E-F1lKGJnxgPH.jpg","https://t.co/40iQsZACoM","https://twitter.com/ChrisVanHollen/status/851880519000367105/video/1",,"x15808765","CoryBooker","en",,,,,,,,,,,,,
"x851597365849075713",2017-04-11 00:46:48,"x18137749","ChrisVanHollen","#United must do more than ""apologize"". Full investigation needed. Airlines must start treating passengers with respect, not like cargo.","Twitter Web Client",,,,FALSE,FALSE,760,246,"United",,,,,,,,,,,,,,,"en",,,,,,,,,,,,,
"x851113383713808385",2017-04-09 16:43:38,"x18137749","ChrisVanHollen","ISIS must be stopped. Horrified by the terrorist attack on Coptic churches in Egypt. My thoughts are with the victims and their families.","Twitter for iPhone",,,,FALSE,FALSE,142,41,,,,,,,,,,,,,,,,"en",,,,,,,,,,,,,
"x850852096081633280",2017-04-08 23:25:22,"x18137749","ChrisVanHollen","Trump’s proposal to eliminate the Appalachian Regional Commission would cut critical projects like this in rural MD: https://t.co/1GCIXDiXSX","Twitter for iPhone",,,,FALSE,FALSE,68,69,,,"stardem.com/news/state_new…","https://t.co/1GCIXDiXSX","http://www.stardem.com/news/state_news/article_ff706709-380e-54b2-9714-5c3f879cb4ea.html",,,,,,,,,,,"en",,,,,,,,,,,,,
"x850411070556655616",2017-04-07 18:12:53,"x18137749","ChrisVanHollen","Thanks for your Qs. Let's pass #ABLE 2.0. For the next #ChatswithChris, send me topics you're interested in.","Twitter Web Client",,,,FALSE,FALSE,17,4,"ABLE ChatswithChris",,,,,,,,,,,,,,,"en",,,,,,,,,,,,,
"x850410002263273477",2017-04-07 18:08:39,"x18137749","ChrisVanHollen","Thanks for joining me in the chat today. Here’s a good resource to understand ABLE accounts: https://t.co/trG6PONOpd #InclusionWorks","Twitter Web Client",,,,FALSE,FALSE,12,9,"InclusionWorks",,"ablenrc.org/about/what-are…","https://t.co/trG6PONOpd","http://ablenrc.org/about/what-are-able-accounts",,,,,,,,,,,"en",,,,,,,,,,,,,
"x850403780462075904",2017-04-07 17:43:55,"x18137749","ChrisVanHollen","We are building on the #ABLEAct in three ways: Work Act, Financial Planning Act, and Age Adjustment Act. #InclusionWorks","Twitter Web Client",,,,FALSE,FALSE,25,12,"ABLEAct InclusionWorks",,,,,,,,,,,,,,,"en",,,,,,,,,,,,,
"x850402272270057473",2017-04-07 17:37:56,"x18137749","ChrisVanHollen","Hi, Twitter! It's Chris. I'm ready to answer your questions on ABLE Act 2.0. Let's do this! #InclusionWorks #ChatswithChris https://t.co/WvG1lYyZca","Twitter for iPhone",,,,FALSE,FALSE,29,18,"InclusionWorks ChatswithChris",,,,,"http://pbs.twimg.com/media/C808Re6XkAA5ibV.jpg","https://t.co/WvG1lYyZca","https://twitter.com/ChrisVanHollen/status/850402272270057473/photo/1","photo","http://pbs.twimg.com/media/C808Re6XkAA5ibV.jpg","https://t.co/WvG1lYyZca","https://twitter.com/ChrisVanHollen/status/850402272270057473/photo/1",,,,"en",,,,,,,,,,,,,
