"status_id","created_at","user_id","screen_name","text","source","reply_to_status_id","reply_to_user_id","reply_to_screen_name","is_quote","is_retweet","favorite_count","retweet_count","hashtags","symbols","urls_url","urls_t.co","urls_expanded_url","media_url","media_t.co","media_expanded_url","media_type","ext_media_url","ext_media_t.co","ext_media_expanded_url","ext_media_type","mentions_user_id","mentions_screen_name","lang","quoted_status_id","quoted_text","retweet_status_id","retweet_text","place_url","place_name","place_full_name","place_type","country","country_code","geo_coords","coords_coords","bbox_coords"
"x648276501570449408",2015-09-27 23:22:17,"x24735461","PeteSessions","Congratulations to @JordanSpieth on rounding out his great year by taking home the #FexExCup and winning the #TourChampionship. #TX32","TweetDeck",,,,FALSE,FALSE,2,4,"FexExCup TourChampionship TX32",,,,,,,,,,,,,"x783763632","JordanSpieth","en",,,,,,,,,,,,,
"x644142471170138112",2015-09-16 13:35:07,"x24735461","PeteSessions","Fantastic walk-off win last night for the 1st place @Rangers. Another big game tonight against the @astros. Lets go Rangers! #TX","TweetDeck",,,,FALSE,FALSE,2,1,"TX",,,,,,,,,,,,,"x40931019 52803520","Rangers astros","en",,,,,,,,,,,,,
"x643829553421533184",2015-09-15 16:51:41,"x24735461","PeteSessions","Proud to celebrate all Hispanic Americans in #TX32 and across the nation during #HispanicHeritageMonth.","TweetDeck",,,,FALSE,FALSE,7,10,"TX32 HispanicHeritageMonth",,,,,,,,,,,,,,,"en",,,,,,,,,,,,,
"x643436879040409600",2015-09-14 14:51:21,"x24735461","PeteSessions","Wishing a happy and blessed New Year to my friends who are celebrating Rosh Hashanah. L'shanah Tovah!","TweetDeck",,,,FALSE,FALSE,3,3,,,,,,,,,,,,,,,,"en",,,,,,,,,,,,,
"x642319047896530944",2015-09-11 12:49:29,"x24735461","PeteSessions","As a nation we will #NeverForget the lives lost 14 yrs ago.Let us pause to remember the victims &amp; pray for the heroes who protect our nation","TweetDeck",,,,FALSE,FALSE,3,2,"NeverForget",,,,,,,,,,,,,,,"en",,,,,,,,,,,,,
"x641960976519176192",2015-09-10 13:06:38,"x24735461","PeteSessions","Yesterday the court made a historic decision to allow the lawsuit against the Obama Admin's abuse of executive authority to move forward.","TweetDeck",,,,FALSE,FALSE,5,4,,,,,,,,,,,,,,,,"en",,,,,,,,,,,,,
"x637975978896171008",2015-08-30 13:11:41,"x24735461","PeteSessions","At 8:40 AM CST I will be on Lone Star Politics with @JulieFineNBC5 to discuss my new bill that would crack down on sanctuary cities. #TX32","Twitter for iPhone",,,,FALSE,FALSE,2,3,"TX32",,,,,,,,,,,,,"x71421886","JulieFineNBC5","en",,,,,,,,,,,,,
"x636588391329603584",2015-08-26 17:17:54,"x24735461","PeteSessions","This morning @GovAbbott presented the Texas Legislative Medal of Honor to a true American hero, the late Navy SEAL sniper Chris Kyle.","TweetDeck",,,,FALSE,FALSE,6,7,,,,,,,,,,,,,,"x19291441","GovAbbott","en",,,,,,,,,,,,,
"x636563659674791936",2015-08-26 15:39:37,"x24735461","PeteSessions","We had a great turn out last night at our town hall meeting. Thank you to the 350+ North Texans who participated! #TX32","TweetDeck",,,,FALSE,FALSE,2,2,"TX32",,,,,,,,,,,,,,,"en",,,,,,,,,,,,,
"x635980601456136193",2015-08-25 01:02:45,"x24735461","PeteSessions","Looking forward to joining @TheWellsReport on @660KSKY to discuss my bill to strengthen interior enforcement and end sanctuary cities. #TX32","Twitter for iPhone",,,,FALSE,FALSE,2,3,"TX32",,,,,,,,,,,,,"x34969929 76793189","TheWellsReport 660KSKY","en",,,,,,,,,,,,,
"x629679194935590912",2015-08-07 15:43:13,"x24735461","PeteSessions","While today's jobs report shows that some Americans have found work, the labor force participation rate is at its lowest point since 1977.","TweetDeck",,,,FALSE,FALSE,0,2,,,,,,,,,,,,,,,,"en",,,,,,,,,,,,,
"x627205316917248000",2015-07-31 19:52:55,"x24735461","PeteSessions","I am pleased to join my friend and colleague @SenatorSessions  in introducing the House companion to the “Protect American Lives Act.”","TweetDeck",,,,FALSE,FALSE,1,2,,,,,,,,,,,,,,,,"en",,,,,,,,,,,,,
"x626514259128774656",2015-07-29 22:06:54,"x24735461","PeteSessions","I proudly supported the #VAAccountabilityAct to ensure our veterans receive the quality care they deserve.","TweetDeck",,,,FALSE,FALSE,5,2,"VAAccountabilityAct",,,,,,,,,,,,,,,"en",,,,,,,,,,,,,
"x626438295518609408",2015-07-29 17:05:02,"x24735461","PeteSessions","I'd also like to recognize Ralph Smith from Irving who served as an Army Ranger Chaplain. We appreciate your service to our great nation.","TweetDeck",,,,FALSE,FALSE,4,4,,,,,,,,,,,,,,,,"en",,,,,,,,,,,,,
"x626432579655364609",2015-07-29 16:42:20,"x24735461","PeteSessions","Today we celebrate 240 yrs of Military Chaplains. My grandfather proudly served in WWII as a US Army Chaplain. Today we salute you.","TweetDeck",,,,FALSE,FALSE,12,6,,,,,,,,,,,,,,,,"en",,,,,,,,,,,,,
"x624237117267439616",2015-07-23 15:18:21,"x24735461","PeteSessions","I believe policies like executive amnesty &amp; sanctuary cities undermine our rule of law by encouraging illegal immigration,and they must end.","TweetDeck",,,,FALSE,FALSE,3,4,,,,,,,,,,,,,,,,"en",,,,,,,,,,,,,
"x623990393177276417",2015-07-22 22:57:57,"x24735461","PeteSessions","Pleased to support legislation that protects 300,000 American jobs, empowers states, and reduces regulatory burdens.","TweetDeck",,,,FALSE,FALSE,1,2,,,,,,,,,,,,,,,,"en",,,,,,,,,,,,,
"x623130978140225536",2015-07-20 14:02:57,"x24735461","PeteSessions","ATTN #TX32: My staff is holding Mobile Office Hours today at Garland Central Library and Rowlett City Hall from 9:00 AM - 1:00 PM CST.","TweetDeck",,,,FALSE,FALSE,1,3,"TX32",,,,,,,,,,,,,,,"en",,,,,,,,,,,,,
"x621822657122709504",2015-07-16 23:24:09,"x24735461","PeteSessions","My thoughts and prayers are with the families and loved ones of the 4 marines whose lives were taken by the senseless act in #Chattanooga","Twitter for iPhone",,,,FALSE,FALSE,3,4,"Chattanooga",,,,,,,,,,,,,,,"en",,,,,,,,,,,,,
"x620361428202057728",2015-07-12 22:37:44,"x24735461","PeteSessions","The Dallas native does it again! Congratulations on yet another PGA Tour win @JordanSpieth. Texas will be behind you at the British Open.","Twitter for iPhone",,,,FALSE,FALSE,8,9,,,,,,,,,,,,,,"x783763632","JordanSpieth","en",,,,,,,,,,,,,
"x617811848960720898",2015-07-05 21:46:37,"x24735461","PeteSessions","Wishing the best of luck to the #USWomensSoccer team in the World Cup tonight. Go Team USA!","Twitter for iPhone",,,,FALSE,FALSE,4,4,"USWomensSoccer",,,,,,,,,,,,,,,"en",,,,,,,,,,,,,
"x615907077047758848",2015-06-30 15:37:44,"x24735461","PeteSessions","""Texas Instruments ranks among 10 most reputable U.S. tech companies, says Reputation Institute."" Proud to have @TXInstruments in #TX32","TweetDeck",,,,FALSE,FALSE,1,1,"TX32",,,,,,,,,,,,,"x13613292","TXInstruments","en",,,,,,,,,,,,,
"x614870173527314432",2015-06-27 18:57:27,"x24735461","PeteSessions","Thank you to everyone who came to my Town Hall Meeting this morning. I enjoyed discussing important issues &amp; listening to your concerns.","Twitter for iPhone",,,,FALSE,FALSE,3,2,,,,,,,,,,,,,,,,"en",,,,,,,,,,,,,
"x614114285816516608",2015-06-25 16:53:50,"x24735461","PeteSessions","#SCOTUS decision doesn't change the fact that our healthcare system is broken and Americans deserve better.","TweetDeck",,,,FALSE,FALSE,5,6,"SCOTUS",,,,,,,,,,,,,,,"en",,,,,,,,,,,,,
"x614114211283738627",2015-06-25 16:53:32,"x24735461","PeteSessions","If the #SCOTUS decision proved one thing, it is that the Court no longer believes that words matter.","TweetDeck",,,,FALSE,FALSE,2,8,"SCOTUS",,,,,,,,,,,,,,,"en",,,,,,,,,,,,,
"x612807409535467520",2015-06-22 02:20:46,"x24735461","PeteSessions","Halfway to a Grand Slam! Congratulations to TX32's own @JordanSpieth for winning the #USOpen2015.","Twitter for iPhone",,,,FALSE,FALSE,8,9,"USOpen2015",,,,,,,,,,,,,"x783763632","JordanSpieth","en",,,,,,,,,,,,,
"x610442440332472320",2015-06-15 13:43:13,"x24735461","PeteSessions","ATTN #TX32: Today my staff will be holding Mobile Office Hours from 9 AM - 1 PM CST at Garland Central Library and Rowlett City Hall.","TweetDeck",,,,FALSE,FALSE,1,2,"TX32",,,,,,,,,,,,,,,"en",,,,,,,,,,,,,
"x609809684447535104",2015-06-13 19:48:53,"x24735461","PeteSessions","My thoughts and prayers are with the @DallasPD and their families as this situation continues to unfold.","Twitter for iPhone",,,,FALSE,FALSE,3,2,,,,,,,,,,,,,,"x28758060","DallasPD","en",,,,,,,,,,,,,
"x609446048491245568",2015-06-12 19:43:55,"x24735461","PeteSessions","When America competes globally, America wins. While there is more work to be done, I believe the passage of TPA is a victory for America.","TweetDeck",,,,FALSE,FALSE,0,1,,,,,,,,,,,,,,,,"en",,,,,,,,,,,,,
"x609373569349480449",2015-06-12 14:55:55,"x24735461","PeteSessions","America needs #TPA so that Congress and the American people are empowered instead of the president.  #ConservativesForTPA","TweetDeck",,,,FALSE,FALSE,0,3,"TPA ConservativesForTPA",,,,,,,,,,,,,,,"en",,,,,,,,,,,,,
"x609363581184942080",2015-06-12 14:16:13,"x24735461","PeteSessions","""In those periods, more than 100 regional trade agreements were negotiated w/o us. We cannot afford to have that cont."" @CondoleezzaRice","Twitter for iPhone",,,,FALSE,FALSE,0,1,,,,,,,,,,,,,,"x388555493","CondoleezzaRice","en",,,,,,,,,,,,,
"x609363494866169856",2015-06-12 14:15:53,"x24735461","PeteSessions","""For 40 yrs, #TPA has effectively balanced the role of the exec&amp;legis branches. When it has lapsed, the US has had to sit on the sidelines.""","Twitter for iPhone",,,,FALSE,FALSE,2,4,"TPA",,,,,,,,,,,,,,,"en",,,,,,,,,,,,,
"x609360600150491136",2015-06-12 14:04:23,"x24735461","PeteSessions","""When or if #TPA is passed, the gen. public will have mnths to review TPP before Congress acts on it."" @Scottlincicome #ConservativesforTPA","Twitter for iPhone",,,,FALSE,FALSE,2,5,"TPA ConservativesforTPA",,,,,,,,,,,,,"x100250921","scottlincicome","en",,,,,,,,,,,,,
"x609354586718097408",2015-06-12 13:40:29,"x24735461","PeteSessions","""Some believe that TPA takes legis power away from Congress. But it doesn't."" @StephenMoore, @larry_Kudlow #Art Laffer #ConservativesforTPA","Twitter for iPhone",,,,FALSE,FALSE,2,6,"Art ConservativesforTPA",,,,,,,,,,,,,"x2304017702 44401911","StephenMoore larry_kudlow","en",,,,,,,,,,,,,
"x609349970857213952",2015-06-12 13:22:08,"x24735461","PeteSessions","“Fast track has been the norm for 81 yrs..The final say on any trade agrment rests entirely with Congress.”@krauthammer #ConservativesforTPA","TweetDeck",,,,FALSE,FALSE,0,3,"ConservativesforTPA",,,,,,,,,,,,,"x27744185","krauthammer","en",,,,,,,,,,,,,
"x609345235236352000",2015-06-12 13:03:19,"x24735461","PeteSessions","""There is no congressional forfeiture of power."" @krauthammer 
#ConservativesforTPA","Twitter for iPhone",,,,FALSE,FALSE,3,4,"ConservativesforTPA",,,,,,,,,,,,,"x27744185","krauthammer","en",,,,,,,,,,,,,
"x609337113037946880",2015-06-12 12:31:03,"x24735461","PeteSessions","Conservatives across the nation support #TPA because we are the party of #freetrade #ConservativesforTPA","TweetDeck",,,,FALSE,FALSE,1,3,"TPA freetrade ConservativesforTPA",,,,,,,,,,,,,,,"en",,,,,,,,,,,,,
"x609030263138439169",2015-06-11 16:11:44,"x24735461","PeteSessions","When America competes, America wins. Trade agreements will help the U.S. compete for the 95% of customers who live outside of our borders.","TweetDeck",,,,FALSE,FALSE,1,2,,,,,,,,,,,,,,,,"en",,,,,,,,,,,,,
"x609011226878849024",2015-06-11 14:56:06,"x24735461","PeteSessions","As a staunch defender of our nation’s rule of law, I made sure that the President cannot insert any immigration language into #TPA.","TweetDeck",,,,FALSE,FALSE,9,6,"TPA",,,,,,,,,,,,,,,"en",,,,,,,,,,,,,
"x608982862113722369",2015-06-11 13:03:23,"x24735461","PeteSessions","Trade-related jobs support higher wages for workers and lower costs for companies and American consumers. #TPA4USjobs","TweetDeck",,,,FALSE,FALSE,0,4,"TPA4USjobs",,,,,,,,,,,,,,,"en",,,,,,,,,,,,,
"x608667843274665986",2015-06-10 16:11:36,"x24735461","PeteSessions","Texas trade-related employment grew 1.6 faster than total employment from 2004-2013. #TPA4USjobs","TweetDeck",,,,FALSE,FALSE,2,1,"TPA4USjobs",,,,,,,,,,,,,,,"en",,,,,,,,,,,,,
"x608641049716756480",2015-06-10 14:25:08,"x24735461","PeteSessions","Last year Texas led the nation for the 13th year in a row with a total of $289 billion worth of exports. #TPA4USjobs","TweetDeck",,,,FALSE,FALSE,1,2,"TPA4USjobs",,,,,,,,,,,,,,,"en",,,,,,,,,,,,,
"x608367930330497025",2015-06-09 20:19:52,"x24735461","PeteSessions","Watch the @RulesReps hearing on H.R. 2393, Country of Origin Labeling Amendments Act &amp; H.R. 2685, DOD Approps at 4:00 PM CST on @cspan.","TweetDeck",,,,FALSE,FALSE,3,2,,,,,,,,,,,,,,"x78369108 15675138","RulesReps cspan","en",,,,,,,,,,,,,
"x607908606034374658",2015-06-08 13:54:40,"x24735461","PeteSessions","ATTN WYLIE &amp; SACHSE: Today my staff will be holding Mobile Office Hours from 9AM - 1PM at Sachse City Hall &amp; 2PM - 6PM at Wylie City Hall.","TweetDeck",,,,FALSE,FALSE,1,2,,,,,,,,,,,,,,,,"en",,,,,,,,,,,,,
"x606910818744201216",2015-06-05 19:49:49,"x24735461","PeteSessions","Special thanks to @sealmomdietz for speaking at the @retailreadycc  graduation &amp; cutting the ribbon for the #OperationRedWings shop.  #TX32","TweetDeck",,,,FALSE,FALSE,2,2,"OperationRedWings TX32",,,,,,,,,,,,,"x1627979484 3181996177","sealmomdietz retailreadycc","en",,,,,,,,,,,,,
"x606869562924126208",2015-06-05 17:05:53,"x24735461","PeteSessions","While today's jobs report brings welcome news, I believe we can and must take every opportunity to grow our economy and create jobs.","TweetDeck",,,,FALSE,FALSE,2,2,,,,,,,,,,,,,,,,"en",,,,,,,,,,,,,
"x606535286911344640",2015-06-04 18:57:35,"x24735461","PeteSessions","ICYMI: I introduced an amendment that would cut $500 million of wasteful spending by eliminating funding for Amtrak's long distance routes.","TweetDeck",,,,FALSE,FALSE,1,2,,,,,,,,,,,,,,,,"en",,,,,,,,,,,,,
"x606470991817023490",2015-06-04 14:42:06,"x24735461","PeteSessions","I'm heading to the @HouseFloor to introduce two amendments that cut wasteful taxpayer-funded subsidies to inefficient Amtrak routes.","TweetDeck",,,,FALSE,FALSE,1,3,,,,,,,,,,,,,,"x7402662","HouseFloor","en",,,,,,,,,,,,,
"x606117207156793345",2015-06-03 15:16:17,"x24735461","PeteSessions","I commend the leadership of Mayor @DouglasAthas and the professionalism of @GarlandPD. #TX32 is lucky to have such exceptional officials.","TweetDeck",,,,FALSE,FALSE,5,1,"TX32",,,,,,,,,,,,,"x21624812 107199355","DouglasAthas GarlandPD","en",,,,,,,,,,,,,
"x606104783813021696",2015-06-03 14:26:56,"x24735461","PeteSessions","I'm about to address the @HouseHomeland to commend the leaders in Garland and the @GarlandPD for their efforts in the Isis inspired attack","Twitter for iPhone",,,,FALSE,FALSE,2,4,,,,,,,,,,,,,,"x239964567 107199355","HouseHomeland GarlandPD","en",,,,,,,,,,,,,
"x606092036026986498",2015-06-03 13:36:16,"x24735461","PeteSessions","At 9:00 AM CST I will be participating in the @HouseHomeland hearing to discuss the ISIS-inspired terror attack in Garland. #TX32","TweetDeck",,,,FALSE,FALSE,0,3,"TX32",,,,,,,,,,,,,"x239964567","HouseHomeland","en",,,,,,,,,,,,,
"x605008036420288512",2015-05-31 13:48:51,"x24735461","PeteSessions","This morning at 9:00 AM CST I will be on @wfaachannel8's ""Inside Texas Politics"" with @JasonWhitely and @BudKennedy. #TX32","TweetDeck",,,,FALSE,FALSE,1,2,"TX32",,,,,,,,,,,,,"x926150962632327168 20494730 15970567","wfaachannel8 JasonWhitely BudKennedy","en",,,,,,,,,,,,,
"x604663075929788416",2015-05-30 14:58:06,"x24735461","PeteSessions","Make sure to tune into @wfaachannel8 tomorrow at 9:00 AM CST. I will be joining my friend @JasonWhitely on ""Inside Texas Politics"" #TX32","Twitter for iPhone",,,,FALSE,FALSE,4,4,"TX32",,,,,,,,,,,,,"x926150962632327168 20494730","wfaachannel8 JasonWhitely","en",,,,,,,,,,,,,
"x603377855712665600",2015-05-27 01:51:05,"x24735461","PeteSessions","Looking forward to joining @TheWellsReport at 9:05PMCST to talk about the Fifth Circuit Court's ruling to block the President's amnesty plan","Twitter for iPhone",,,,FALSE,FALSE,0,4,,,,,,,,,,,,,,"x34969929","TheWellsReport","en",,,,,,,,,,,,,
"x601435753550192640",2015-05-21 17:13:52,"x24735461","PeteSessions","Govt. regs should never interfere w/discovery &amp; innovation. Proud to support legislation that fosters a strong commercial space industry.","TweetDeck",,,,FALSE,FALSE,4,5,,,,,,,,,,,,,,,,"en",,,,,,,,,,,,,
"x601002718245826560",2015-05-20 12:33:08,"x24735461","PeteSessions","Looking forward to joining @MarkDavis on @660KSKY at 8:35 AM CST to discuss my role in stopping a back door amnesty provision in the #NDAA","TweetDeck",,,,FALSE,FALSE,0,2,"NDAA",,,,,,,,,,,,,"x25916881 76793189","MarkDavis 660KSKY","en",,,,,,,,,,,,,
"x599391208331423744",2015-05-16 01:49:34,"x24735461","PeteSessions","I will be on @660KSKY on @TheWellsReport at 9:05 PM CST to discuss my efforts to halt the President's lawless executive amnesty plan.","TweetDeck",,,,FALSE,FALSE,0,2,,,,,,,,,,,,,,"x76793189 34969929","660KSKY TheWellsReport","en",,,,,,,,,,,,,
"x599333441461714944",2015-05-15 22:00:02,"x24735461","PeteSessions","Today we pause to remember and pay tribute to those who lost their lives in the line of duty. #PeaceOfficersMemorialDay #NationalPoliceWeek","TweetDeck",,,,FALSE,FALSE,5,3,"PeaceOfficersMemorialDay NationalPoliceWeek",,,,,,,,,,,,,,,"en",,,,,,,,,,,,,
"x598271542150242304",2015-05-12 23:40:25,"x24735461","PeteSessions","The House just passed HR. 1732. Proud to support legislation to stop #EPA overreach &amp; stop the #WOTUS rule. #DitchTheRule","TweetDeck",,,,FALSE,FALSE,5,6,"EPA WOTUS DitchTheRule",,,,,,,,,,,,,,,"en",,,,,,,,,,,,,
"x598186681297154051",2015-05-12 18:03:13,"x24735461","PeteSessions","Thank you to the 900,000 police officers around the country who bravely protect our homes, families, and communities. #PoliceWeek","TweetDeck",,,,FALSE,FALSE,10,11,"PoliceWeek",,,,,,,,,,,,,,,"en",,,,,,,,,,,,,
"x597416531572563968",2015-05-10 15:02:55,"x24735461","PeteSessions","Happy Mother's Day to all of the mothers in #TX32 and across the country. I hope you all have a wonderful day.","Twitter for iPhone",,,,FALSE,FALSE,5,2,"TX32",,,,,,,,,,,,,,,"en",,,,,,,,,,,,,
"x595045403474599936",2015-05-04 02:00:54,"x24735461","PeteSessions","My thoughts and prayers go out to all those in attendance and affected by the shooting at today's Mohammed Art Exhibit in Garland.","Twitter for iPhone",,,,FALSE,FALSE,24,26,,,,,,,,,,,,,,,,"en",,,,,,,,,,,,,
"x593921295844286465",2015-04-30 23:34:06,"x24735461","PeteSessions","The House just passed the #MilConVA Appropriations bill that provides critical funding for military families &amp; veterans services.","TweetDeck",,,,FALSE,FALSE,1,4,"MilConVA",,,,,,,,,,,,,,,"en",,,,,,,,,,,,,
"x592796348900057093",2015-04-27 21:03:57,"x24735461","PeteSessions","Free trade agreements increase imports which lowers prices and increases choices for American companies and families. #TPA4jobs","TweetDeck",,,,FALSE,FALSE,0,4,"TPA4jobs",,,,,,,,,,,,,,,"en",,,,,,,,,,,,,
"x592777450343497728",2015-04-27 19:48:52,"x24735461","PeteSessions","Last year Texas led the nation for the 13th year in a row with a total of $289 billion worth of exports. #TPA4jobs","TweetDeck",,,,FALSE,FALSE,0,2,"TPA4jobs",,,,,,,,,,,,,,,"en",,,,,,,,,,,,,
"x592744380554940416",2015-04-27 17:37:27,"x24735461","PeteSessions","The number of jobs in Texas supported by trade have increased by 81% in the past 20 years. #TPA4USJobs","TweetDeck",,,,FALSE,FALSE,0,4,"TPA4USJobs",,,,,,,,,,,,,,,"en",,,,,,,,,,,,,
"x592720760243933184",2015-04-27 16:03:36,"x24735461","PeteSessions","Trade supports 3 million jobs in Texas. #TPA4USjobs","TweetDeck",,,,FALSE,FALSE,2,2,"TPA4USjobs",,,,,,,,,,,,,,,"en",,,,,,,,,,,,,
"x591221054300942336",2015-04-23 12:44:18,"x24735461","PeteSessions","Cyber security is one of the most important issues of our time. It is imperative that we work effectively to protect data &amp; critical systems","TweetDeck",,,,FALSE,FALSE,0,1,,,,,,,,,,,,,,,,"en",,,,,,,,,,,,,
"x590914148533403648",2015-04-22 16:24:46,"x24735461","PeteSessions","Free trade agreements would create $14 billion in new global investment in Texas as well as 120,000 new jobs. #TPA4USjobs","TweetDeck",,,,FALSE,FALSE,2,4,"TPA4USjobs",,,,,,,,,,,,,,,"en",,,,,,,,,,,,,
"x590290657559740416",2015-04-20 23:07:14,"x24735461","PeteSessions","Looking forward to joining the 5th Anniversary Show of @TheWellsReport tonight at 10:35 PM CST. #TX32","TweetDeck",,,,FALSE,FALSE,0,2,"TX32",,,,,,,,,,,,,"x34969929","TheWellsReport","en",,,,,,,,,,,,,
"x590152890972577792",2015-04-20 13:59:48,"x24735461","PeteSessions","ATTN Rowlett: My staff will be holding mobile office hours this morning from 9 AM - 1 PM at Rowlett City Hall, 4000 Main Street. #TX32","TweetDeck",,,,FALSE,FALSE,0,2,"TX32",,,,,,,,,,,,,,,"en",,,,,,,,,,,,,
"x590152640195125248",2015-04-20 13:58:48,"x24735461","PeteSessions","ATTN Garland: My staff will be holding mobile office hours this morning from 10 AM - 11 AM CST at Garland Central Library, 625 Austin St.","TweetDeck",,,,FALSE,FALSE,0,2,,,,,,,,,,,,,,,,"en",,,,,,,,,,,,,
"x589461755673370625",2015-04-18 16:13:28,"x24735461","PeteSessions","Good luck to the Wylie East Girls Soccer team today as they take on Vandegrift in the State Championship. Go Raiders! #TX32","Twitter for iPhone",,,,FALSE,FALSE,13,11,"TX32",,,,,,,,,,,,,,,"en",,,,,,,,,,,,,
"x588815610424885248",2015-04-16 21:25:55,"x24735461","PeteSessions","TPA is a top priority because it is a vital part of our free trade agenda. Increased trade will help grow the economy &amp; create American jobs","TweetDeck",,,,FALSE,FALSE,2,2,,,,,,,,,,,,,,,,"en",,,,,,,,,,,,,
"x588354036769906688",2015-04-15 14:51:48,"x24735461","PeteSessions","Did you know that Americans spend 7.6 billion hours complying with IRS regulations? It’s time for a simpler, flatter, fairer tax code.","TweetDeck",,,,FALSE,FALSE,8,5,,,,,,,,,,,,,,,,"en",,,,,,,,,,,,,
"x588044016689754112",2015-04-14 18:19:53,"x24735461","PeteSessions","We are debating the #DeathTax in @RulesReps at 2:00 PM CST.The #DeathTax is bad for landowners, small biz owners,farmers, ranchers &amp;families","TweetDeck",,,,FALSE,FALSE,3,9,"DeathTax DeathTax",,,,,,,,,,,,,"x78369108","RulesReps","en",,,,,,,,,,,,,
"x588017088641560576",2015-04-14 16:32:53,"x24735461","PeteSessions","I'm heading to the @HouseFloor to manage the rule on 2 housing bills that will create 1000s of new constructions jobs &amp; boost the economy.","TweetDeck",,,,FALSE,FALSE,2,3,,,,,,,,,,,,,,"x7402662","HouseFloor","en",,,,,,,,,,,,,
"x587718457971576833",2015-04-13 20:46:14,"x24735461","PeteSessions","At 4:00 PM CST I will be chairing the @RulesReps hearing on HR 650-Preserving Access to Manufactured Housing &amp; HR 685-Mortgage Choice Act.","TweetDeck",,,,FALSE,FALSE,0,1,,,,,,,,,,,,,,"x78369108","RulesReps","en",,,,,,,,,,,,,
"x587617201164804096",2015-04-13 14:03:52,"x24735461","PeteSessions","ATTN SACHSE &amp; WYLIE:My office will be holding Mobile Office Hours at Sachse City Hall from 9 AM - 1 PM &amp; at Wylie City Hall from 2 PM - 6 PM","TweetDeck",,,,FALSE,FALSE,0,2,,,,,,,,,,,,,,,,"en",,,,,,,,,,,,,
"x587426332549742592",2015-04-13 01:25:26,"x24735461","PeteSessions","Congratulations to #TX32's very own @JordanSpieth on his 2015 Masters win!","Twitter for iPhone",,,,FALSE,FALSE,8,6,"TX32",,,,,,,,,,,,,"x783763632","JordanSpieth","en",,,,,,,,,,,,,
"x586993178344960003",2015-04-11 20:44:14,"x24735461","PeteSessions","Great afternoon celebrating the first-ever Texas Historical Marker for a residential neighborhood, Travis College Hill district in Garland.","Twitter for iPhone",,,,FALSE,FALSE,2,1,,,,,,,,,,,,,,,,"en",,,,,,,,,,,,,
"x586262002177335296",2015-04-09 20:18:48,"x24735461","PeteSessions","Looking forward to seeing everyone at my Town Hall Meeting at 7:00 PM at Highland Park Middle School. #TX32","TweetDeck",,,,FALSE,FALSE,1,1,"TX32",,,,,,,,,,,,,,,"en",,,,,,,,,,,,,
"x586210404344266752",2015-04-09 16:53:46,"x24735461","PeteSessions","Good luck to @JordanSpieth in the Master's this week. #TX32 will be cheering for you!","Twitter for iPhone",,,,FALSE,FALSE,4,1,"TX32",,,,,,,,,,,,,"x783763632","JordanSpieth","en",,,,,,,,,,,,,
"x585942784714022912",2015-04-08 23:10:20,"x24735461","PeteSessions","Congratulations to the Wylie East Boys Soccer team on their big win last night against Frisco Centennial! #TX32","Twitter for iPhone",,,,FALSE,FALSE,0,3,"TX32",,,,,,,,,,,,,,,"en",,,,,,,,,,,,,
"x584801076588716032",2015-04-05 19:33:36,"x24735461","PeteSessions","Wishing everyone a very Happy Easter!","Twitter for iPhone",,,,FALSE,FALSE,7,4,,,,,,,,,,,,,,,,"en",,,,,,,,,,,,,
"x581503127918100482",2015-03-27 17:08:44,"x24735461","PeteSessions","Yesterday I introduced the Collegiate Housing and Infrastructure Act of 2015, a bipartisan solution to help make college more affordable.","TweetDeck",,,,FALSE,FALSE,1,3,,,,,,,,,,,,,,,,"en",,,,,,,,,,,,,
"x581129388256833537",2015-03-26 16:23:37,"x24735461","PeteSessions","Proud to support a bipartisan plan to fix the broken SGR model, get Medicare on a path toward solvency, &amp; ensure seniors get quality care.","TweetDeck",,,,FALSE,FALSE,1,4,,,,,,,,,,,,,,,,"en",,,,,,,,,,,,,
"x580869761543872512",2015-03-25 23:11:57,"x24735461","PeteSessions","I supported the GOP Budget b/c it cuts spending by $5.5 trillion, provides for a strong natl defense &amp; calls for a full repeal of ObamaCare.","TweetDeck",,,,FALSE,FALSE,8,11,,,,,,,,,,,,,,,,"en",,,,,,,,,,,,,
"x578596509412900865",2015-03-19 16:38:52,"x24735461","PeteSessions","Workers need time to make informed decision on #union efforts. Proud to support legislation to express disapproval of the #NLRB ambush rule","TweetDeck",,,,FALSE,FALSE,2,0,"union NLRB",,,,,,,,,,,,,,,"en",,,,,,,,,,,,,
