"status_id","created_at","user_id","screen_name","text","source","reply_to_status_id","reply_to_user_id","reply_to_screen_name","is_quote","is_retweet","favorite_count","retweet_count","hashtags","symbols","urls_url","urls_t.co","urls_expanded_url","media_url","media_t.co","media_expanded_url","media_type","ext_media_url","ext_media_t.co","ext_media_expanded_url","ext_media_type","mentions_user_id","mentions_screen_name","lang","quoted_status_id","quoted_text","retweet_status_id","retweet_text","place_url","place_name","place_full_name","place_type","country","country_code","geo_coords","coords_coords","bbox_coords"
"x3192553797066752",2010-11-12 21:08:58,"x19407835","RepMikeCoffman","Photo from my visit to the WWII Aviation Museum in #Colorado Springs last week: http://flic.kr/p/8SsSNu","TweetDeck",,,,FALSE,FALSE,0,0,"Colorado",,,,,,,,,,,,,,,"en",,,,,,,,,,,,,
"x3190206547099648",2010-11-12 20:59:39,"x19407835","RepMikeCoffman","It was an honor to speak at Ft. Logan yesterday for #Veterans Day. Thank you to all who joined us. http://bit.ly/cbKtW3","TweetDeck",,,,FALSE,FALSE,0,0,"Veterans",,,,,,,,,,,,,,,"en",,,,,,,,,,,,,
"x3184352435376129",2010-11-12 20:36:23,"x19407835","RepMikeCoffman","Visited @NREL today in Golden. I’m interested in what kinds of developments are happening in the energy field right here in #Colorado.","TweetDeck",,,,FALSE,FALSE,0,1,"Colorado",,,,,,,,,,,,,"x24898621","NREL","en",,,,,,,,,,,,,
"x2474447420264448",2010-11-10 21:35:28,"x19407835","RepMikeCoffman","Obama to begin backing away from 2011 Afghan pullout date http://bit.ly/cRzWpx","TweetDeck",,,,FALSE,FALSE,0,3,,,,,,,,,,,,,,,,"en",,,,,,,,,,,,,
"x2464318780080128",2010-11-10 20:55:14,"x19407835","RepMikeCoffman","Seniors: Medicare Part D open enrollment begins Monday, Nov. 15.  Now is a good time to review your plan. Contact my office for info.","TweetDeck",,,,FALSE,FALSE,0,0,,,,,,,,,,,,,,,,"en",,,,,,,,,,,,,
"x2424550750949376",2010-11-10 18:17:12,"x19407835","RepMikeCoffman","Veterans Day is tomorrow.  The @DenverPost has compiled a list of events: http://bit.ly/c8VIya I’ll be speaking at Ft. Logan.","TweetDeck",,,,FALSE,FALSE,0,0,,,,,,,,,,,,,,"x8216772","denverpost","en",,,,,,,,,,,,,
"x2417505217810432",2010-11-10 17:49:12,"x19407835","RepMikeCoffman","Wishing the #USMC a happy 235th b-day. I salute ‘the Few, the Proud,’ before me and those after me who serve Corps and country. #mil","TweetDeck",,,,FALSE,FALSE,0,3,"USMC mil",,,,,,,,,,,,,,,"en",,,,,,,,,,,,,
"x2140721746284544",2010-11-09 23:29:22,"x19407835","RepMikeCoffman","AP source: US reviewing its Afghanistan war plan http://bit.ly/dzZTlU","TweetDeck",,,,FALSE,FALSE,0,0,,,,,,,,,,,,,,,,"en",,,,,,,,,,,,,
"x2134387634216960",2010-11-09 23:04:12,"x19407835","RepMikeCoffman","Visited Nat’l Museum of WWII Aviation 2day; ‘Further away in time we move from WWII, the less we remember about the lessons it taught.’","TweetDeck",,,,FALSE,FALSE,0,1,,,,,,,,,,,,,,,,"en",,,,,,,,,,,,,
"x1745372540047361",2010-11-08 21:18:23,"x19407835","RepMikeCoffman","The USDA Forest Service is waiving entrance fees on Veterans Day this Thursday, Nov. 11. Info: http://bit.ly/cT0WSa","TweetDeck",,,,FALSE,FALSE,0,1,,,,,,,,,,,,,,,,"en",,,,,,,,,,,,,
"x1729799429033984",2010-11-08 20:16:30,"x19407835","RepMikeCoffman","The Denver Zoo is offering free admission this Saturday, November 13 from 10am-4pm.","TweetDeck",,,,FALSE,FALSE,0,2,,,,,,,,,,,,,,,,"en",,,,,,,,,,,,,
"x1709314548957184",2010-11-08 18:55:07,"x19407835","RepMikeCoffman","Last Thurs I joined Mike Rosen on @Newsradio850KOA to talk about elections and military voting. Listen here: http://bit.ly/gEz9t","TweetDeck",,,,FALSE,FALSE,0,1,,,,,,,,,,,,,,,,"en",,,,,,,,,,,,,
"x689220922384384",2010-11-05 23:21:37,"x19407835","RepMikeCoffman","Thank you for the #FF @MrHappy4870 @DesertScene @bellapatriot @spearsre @joebellis @FattiMaschii #followfriday","TweetDeck",,,,FALSE,FALSE,0,0,"FF followfriday",,,,,,,,,,,,,"x124735878 2982337323 2702398107 838837922 3900933441 191252035","MrHappy4870 DesertScene Bellapatriot Spearsre JoeBellis FattiMaschii","en",,,,,,,,,,,,,
"x686042776604672",2010-11-05 23:09:00,"x19407835","RepMikeCoffman","I’ll be at the Denver United Veterans Council 2010 Veterans Day Parade tomorrow.  I encourage everyone to attend.","Twitter Web Client",,,,FALSE,FALSE,0,1,,,,,,,,,,,,,,,,"en",,,,,,,,,,,,,
"x649031705436160",2010-11-05 20:41:55,"x19407835","RepMikeCoffman","This is your friendly reminder to turn back your clocks this weekend.  Daylight savings time ends this Sunday.","TweetDeck",,,,FALSE,FALSE,0,3,,,,,,,,,,,,,,,,"en",,,,,,,,,,,,,
"x644413277609985",2010-11-05 20:23:34,"x19407835","RepMikeCoffman","Honoring an American hero http://bit.ly/diw9HW Great read from @ChrisReporter of @ccnlocalmatters #mil #veterans","TweetDeck",,,,FALSE,FALSE,0,1,"mil veterans",,,,,,,,,,,,,"x28204052","ChrisReporter","en",,,,,,,,,,,,,
"x601124943958016",2010-11-05 17:31:34,"x19407835","RepMikeCoffman","Veterans Day 2010 – All Those Who Served Should be Honored http://bit.ly/d2FRlg #veterans #mil #redco #tcot #hhrs","TweetDeck",,,,FALSE,FALSE,0,1,"veterans mil redco tcot hhrs",,,,,,,,,,,,,,,"en",,,,,,,,,,,,,
"x582568835551232",2010-11-05 16:17:49,"x19407835","RepMikeCoffman","Great to speak with folks at the DougCo First Friday Breakfast this morning.  Thank you to everyone for coming out.","TweetDeck",,,,FALSE,FALSE,0,0,,,,,,,,,,,,,,,,"en",,,,,,,,,,,,,
"x313659758743552",2010-11-04 22:29:16,"x19407835","RepMikeCoffman","From my colleague from Illinois @PeterRoskam: Which Barack Obama Will Show Up For the Next Two Years? http://bit.ly/akFfX8 #tcot #hhrs","TweetDeck",,,,FALSE,FALSE,1,2,"tcot hhrs",,,,,,,,,,,,,"x20015903","PeterRoskam","en",,,,,,,,,,,,,
"x29698764919",2010-11-04 20:32:37,"x19407835","RepMikeCoffman","The new ‘Victory Caucus’ in Congress http://bit.ly/b5PhG5  #mil #veterans","TweetDeck",,,,FALSE,FALSE,0,3,"mil veterans",,,,,,,,,,,,,,,"en",,,,,,,,,,,,,
"x29697634795",2010-11-04 20:16:06,"x19407835","RepMikeCoffman","Its critical for our service members to know we r paying close attention to & vigorously defending their voting rights http://bit.ly/cOHcKI","TweetDeck",,,,FALSE,FALSE,0,1,,,,,,,,,,,,,,,,"en",,,,,,,,,,,,,
"x29692698463",2010-11-04 19:02:47,"x19407835","RepMikeCoffman","Please take a moment to visit the new House GOP majority transition website and submit your comments: http://bit.ly/c165uL","TweetDeck",,,,FALSE,FALSE,0,4,,,,,,,,,,,,,,,,"en",,,,,,,,,,,,,
"x29690903992",2010-11-04 18:36:40,"x19407835","RepMikeCoffman","I want to thank Coloradans in the 6th District for all of the support.  I am honored to serve you in the U.S. House.","TweetDeck",,,,FALSE,FALSE,0,0,,,,,,,,,,,,,,,,"en",,,,,,,,,,,,,
"x29598797555",2010-11-03 19:24:04,"x19407835","RepMikeCoffman","Forming a military voting working group w/Reps. Hunter & Lamborn to address poss. issues w/military ballots http://bit.ly/9sg3tL #mil","TweetDeck",,,,FALSE,FALSE,0,2,"mil",,,,,,,,,,,,,,,"en",,,,,,,,,,,,,
"x29499568582",2010-11-02 19:43:04,"x19407835","RepMikeCoffman","I strongly disagree with the recent DoD report on China’s monopoly on rare earth metals. It’s short-sighted http://bit.ly/chJzd5","TweetDeck",,,,FALSE,FALSE,0,0,,,,,,,,,,,,,,,,"en",,,,,,,,,,,,,
"x29489636186",2010-11-02 17:22:05,"x19407835","RepMikeCoffman","I saw ‘Waiting for Superman’ last weekend.  I encourage everyone to see it.  http://bit.ly/bfP7RE","TweetDeck",,,,FALSE,FALSE,0,0,,,,,,,,,,,,,,,,"en",,,,,,,,,,,,,
"x29485456267",2010-11-02 16:30:02,"x19407835","RepMikeCoffman","Just voted in Aurora.  Happy Election Day to everyone.","TweetDeck",,,,FALSE,FALSE,0,0,,,,,,,,,,,,,,,,"en",,,,,,,,,,,,,
"x29124238594",2010-10-29 21:29:19,"x19407835","RepMikeCoffman","Joining members of the CO delegation tomorrow @ the #Colorado capitol for a national day of remembrance for nuclear workers of America.","TweetDeck",,,,FALSE,FALSE,0,2,"Colorado",,,,,,,,,,,,,,,"en",,,,,,,,,,,,,
"x29120363521",2010-10-29 20:30:06,"x19407835","RepMikeCoffman","On Sat, Nov. 6th - 15 museums throughout #Denver will offer free admission. Info: http://bit.ly/2J4Hy8 #Colorado","TweetDeck",,,,FALSE,FALSE,0,1,"Denver Colorado",,,,,,,,,,,,,,,"en",,,,,,,,,,,,,
"x29119250407",2010-10-29 20:13:03,"x19407835","RepMikeCoffman","US #Army building smarter robots designed to safeguard soldiers http://bit.ly/c2kdtO #mil","TweetDeck",,,,FALSE,FALSE,0,1,"Army mil",,,,,,,,,,,,,,,"en",,,,,,,,,,,,,
"x29105406249",2010-10-29 16:54:46,"x19407835","RepMikeCoffman","I know, I know, its early, but US Forest Service is selling xmas tree permits starting Nov. 1 http://bit.ly/9hUSZt","TweetDeck",,,,FALSE,FALSE,0,2,,,,,,,,,,,,,,,,"en",,,,,,,,,,,,,
"x29102820824",2010-10-29 16:22:54,"x19407835","RepMikeCoffman","Senator @TomCoburn has released a new oversight report on stimulus checks going to dead people: http://bit.ly/czalbB","TweetDeck",,,,FALSE,FALSE,1,1,,,,,,,,,,,,,,"x750683096643624964","TomCoburn","en",,,,,,,,,,,,,
"x29034768779",2010-10-28 23:41:17,"x19407835","RepMikeCoffman","The @AF_Academy decision to release recent cadet survey results is a win for taxpayers http://bit.ly/aq7tTx #mil","TweetDeck",,,,FALSE,FALSE,0,1,"mil",,,,,,,,,,,,,"x69073724","AF_Academy","en",,,,,,,,,,,,,
"x29034321253",2010-10-28 23:35:47,"x19407835","RepMikeCoffman","Today's economic uncertainties and political climate have #smallbiz worried about higher taxes: http://yhoo.it/d7TwIH (via @NFIB)","TweetDeck",,,,FALSE,FALSE,0,0,"smallbiz",,,,,,,,,,,,,"x14587949","NFIB","en",,,,,,,,,,,,,
"x29021981456",2010-10-28 20:48:23,"x19407835","RepMikeCoffman","RT @GOPWhip: Washington's runaway spending amounts to generational theft; VIDEO: http://j.mp/PiggyBank","TweetDeck",,,,FALSE,FALSE,1,0,,,,,,,,,,,,,,"x2693983838","GOPWhip","en",,,,,,,,,,,,,
"x29020305997",2010-10-28 20:23:10,"x19407835","RepMikeCoffman","The #Colorado Supreme Court has ruled that using a stranger’s SSN is not criminal impersonation http://bit.ly/auG1lb","TweetDeck",,,,FALSE,FALSE,1,5,"Colorado",,,,,,,,,,,,,,,"en",,,,,,,,,,,,,
"x28939360880",2010-10-28 00:15:40,"x19407835","RepMikeCoffman","Bloomberg: Employers in U.S. Start Bracing for Higher Tax Withholding http://bit.ly/9KLNKK #tcot","TweetDeck",,,,FALSE,FALSE,1,6,"tcot",,,,,,,,,,,,,,,"en",,,,,,,,,,,,,
"x28934379525",2010-10-27 23:15:58,"x19407835","RepMikeCoffman","RTD approves fare hikes, service cuts for 2011 http://bit.ly/cbxkk8","TweetDeck",,,,FALSE,FALSE,0,0,,,,,,,,,,,,,,,,"en",,,,,,,,,,,,,
"x28921006116",2010-10-27 20:16:19,"x19407835","RepMikeCoffman","Gallup: voters choose economic conditions by nearly a 2-to-1 margin over any other key election issue http://bit.ly/cIL6gO Same for you?","TweetDeck",,,,FALSE,FALSE,0,2,,,,,,,,,,,,,,,,"en",,,,,,,,,,,,,
"x28919890719",2010-10-27 19:59:49,"x19407835","RepMikeCoffman","RT @darrellissa non-partisan bailout watchdog: @WhiteHouse bailouts ""failures of transparency"" VIDEO http://bit.ly/9zf1E7","TweetDeck",,,,FALSE,FALSE,0,1,,,,,,,,,,,,,,"x22509548 822215673812119553","DarrellIssa WhiteHouse","en",,,,,,,,,,,,,
"x28829857351",2010-10-26 22:08:54,"x19407835","RepMikeCoffman","RT @ColoradoTParty: @RepMikeCoffman did not request any earmarks in 2010. The only member of the CO delegation who did not. #copolitics","TweetDeck",,,,FALSE,FALSE,0,1,"copolitics",,,,,,,,,,,,,"x19407835","RepMikeCoffman","en",,,,,,,,,,,,,
"x28829677145",2010-10-26 22:06:30,"x19407835","RepMikeCoffman","Join me on #Facebook: http://on.fb.me/9AfhVV  #hhrs #tcot #teaparty #mil #Colorado #copolitics","TweetDeck",,,,FALSE,FALSE,0,0,"Facebook hhrs tcot teaparty mil Colorado copolitics",,,,,,,,,,,,,,,"en",,,,,,,,,,,,,
"x28825025104",2010-10-26 21:01:19,"x19407835","RepMikeCoffman","Proud to be honored as a “Champion of National Security” by the Center for Security Policy http://bit.ly/bQx9Yq #mil","TweetDeck",,,,FALSE,FALSE,0,0,"mil",,,,,,,,,,,,,,,"en",,,,,,,,,,,,,
"x28821860621",2010-10-26 20:14:36,"x19407835","RepMikeCoffman","TARP IG Barofsky: “it is still far too early to write TARP’s obituary.” http://politi.co/cALLqZ","TweetDeck",,,,FALSE,FALSE,0,1,,,,,,,,,,,,,,,,"en",,,,,,,,,,,,,
"x28820538820",2010-10-26 19:54:34,"x19407835","RepMikeCoffman","It is long overdue that the fed govt become as cost conscious as the states http://bit.ly/cVJqax","TweetDeck",,,,FALSE,FALSE,0,0,,,,,,,,,,,,,,,,"en",,,,,,,,,,,,,
"x28733702794",2010-10-25 23:01:55,"x19407835","RepMikeCoffman","Congrats to Regis Jesuit High School - #Colorado 5A boys tennis team champs in 2010.","TweetDeck",,,,FALSE,FALSE,0,1,"Colorado",,,,,,,,,,,,,,,"en",,,,,,,,,,,,,
"x28733418390",2010-10-25 22:58:32,"x19407835","RepMikeCoffman","Viewer Gallery: Your Scenic Colorado Pictures http://bit.ly/aVnLw3 (via @KDVR) #colorado #photography","TweetDeck",,,,FALSE,FALSE,0,0,"colorado photography",,,,,,,,,,,,,"x18777618","KDVR","en",,,,,,,,,,,,,
"x28731961878",2010-10-25 22:40:31,"x19407835","RepMikeCoffman","Afghan president confirms large cash payments by Iranian officials http://lat.ms/cMFYCg","TweetDeck",,,,FALSE,FALSE,0,0,,,,,,,,,,,,,,,,"en",,,,,,,,,,,,,
"x28730389094",2010-10-25 22:20:38,"x19407835","RepMikeCoffman","From @CNSNews_com: Debt Has Increased $5 Trillion Since Speaker Pelosi Vowed, ‘No New Deficit Spending’ http://bit.ly/db8H7C","TweetDeck",,,,FALSE,FALSE,0,3,,,,,,,,,,,,,,"x1132252933","cnsnews_com","en",,,,,,,,,,,,,
"x28437324568",2010-10-22 20:29:00,"x19407835","RepMikeCoffman","WikiLeaks is to make ‘major’ announcement. Does this website do more harm than good? http://bit.ly/bfUecM","TweetDeck",,,,FALSE,FALSE,0,0,,,,,,,,,,,,,,,,"en",,,,,,,,,,,,,
"x28432291029",2010-10-22 19:13:19,"x19407835","RepMikeCoffman","Krauthammer: the peasants have seen the future - Greece & France - and concluded that it does not work. http://wapo.st/bhuIXl #tcot","TweetDeck",,,,FALSE,FALSE,0,0,"tcot",,,,,,,,,,,,,,,"en",,,,,,,,,,,,,
"x28426397824",2010-10-22 17:49:06,"x19407835","RepMikeCoffman","Noonan in the @WSJ: #TeaParty allowed GOP establishment to get out from under Bush. http://bit.ly/do2xX1 Agree?","TweetDeck",,,,FALSE,FALSE,0,0,"TeaParty",,,,,,,,,,,,,"x3108351","WSJ","en",,,,,,,,,,,,,
"x28415040524",2010-10-22 15:29:25,"x19407835","RepMikeCoffman","Hosting a roundtable meeting with the Front Range Wildland Fire Advisory group.","TweetDeck",,,,FALSE,FALSE,0,0,,,,,,,,,,,,,,,,"en",,,,,,,,,,,,,
"x28061197605",2010-10-21 21:17:22,"x19407835","RepMikeCoffman","Honored to be named a “Champion of the Entrepreneur” by the nonpartisan SBE Council. http://bit.ly/dDwgGE","TweetDeck",,,,FALSE,FALSE,0,1,,,,,,,,,,,,,,,,"en",,,,,,,,,,,,,
"x28052664421",2010-10-21 19:08:36,"x19407835","RepMikeCoffman","Poll: #Colorado among top states where Americans want to live http://bit.ly/cHtoaO","TweetDeck",,,,FALSE,FALSE,0,1,"Colorado",,,,,,,,,,,,,,,"en",,,,,,,,,,,,,
"x28051041004",2010-10-21 18:43:53,"x19407835","RepMikeCoffman","Fannie & Freddie reform passed over during the 111th Congress. Fed #bailout could double in size in 3yrs: http://wapo.st/cIOF8D","TweetDeck",,,,FALSE,FALSE,1,1,"bailout",,,,,,,,,,,,,,,"en",,,,,,,,,,,,,
"x28046501410",2010-10-21 17:36:40,"x19407835","RepMikeCoffman","POTUS fiscal commish member: “govt is going to have to be smaller.” Same Senator who voted for ObamaCare. http://bit.ly/bXs6EM","TweetDeck",,,,FALSE,FALSE,1,1,,,,,,,,,,,,,,,,"en",,,,,,,,,,,,,
"x28042065699",2010-10-21 16:33:01,"x19407835","RepMikeCoffman","RT @TREMCenter: @repmikecoffman Absolutely right - diverse and secure supply of technology metals is essential http://ow.ly/2XcX7","TweetDeck",,,,FALSE,FALSE,0,0,,,,,,,,,,,,,,"x204725464 19407835","TREMCenter RepMikeCoffman","en",,,,,,,,,,,,,
"x28039569770",2010-10-21 16:01:44,"x19407835","RepMikeCoffman","Rare earths prices soar, we need to establish a domestic supply chain to combat the #econ, nat’l security threat http://bit.ly/bLCDa0","TweetDeck",,,,FALSE,FALSE,0,0,"econ",,,,,,,,,,,,,,,"en",,,,,,,,,,,,,
"x27972613872",2010-10-20 23:00:49,"x19407835","RepMikeCoffman",".@ArthurBrooks column in the @DCExaminer: Top 10 ways government kills jobs in America: http://bit.ly/9lcnuX #econ #tcot #hhrs","TweetDeck",,,,FALSE,FALSE,0,1,"econ tcot hhrs",,,,,,,,,,,,,"x28178127 18956073","arthurbrooks dcexaminer","en",,,,,,,,,,,,,
"x27965828516",2010-10-20 21:28:36,"x19407835","RepMikeCoffman","RT @NatResourcesGOP: Don’t get left in the dark on natural resources issues affecting you. Follow @NatResourcesGOP for the latest. #tcot","TweetDeck",,,,FALSE,FALSE,0,1,"tcot",,,,,,,,,,,,,"x234457049 234457049","NatResourcesGOP NatResourcesGOP","en",,,,,,,,,,,,,
"x27963865377",2010-10-20 20:49:25,"x19407835","RepMikeCoffman","Under new ObamaCare rules, you’ll need a Rx for things like Tylenol & cough drops when using a flex spending acct: http://bit.ly/da5XJk","TweetDeck",,,,FALSE,FALSE,0,2,,,,,,,,,,,,,,,,"en",,,,,,,,,,,,,
"x27959729395",2010-10-20 19:45:48,"x19407835","RepMikeCoffman","Relying on China for rare earths is a threat to U.S. #econ & nat’l security. I’m calling on POTUS & Congress to act: http://bit.ly/ar6h2R","TweetDeck",,,,FALSE,FALSE,0,0,"econ",,,,,,,,,,,,,,,"en",,,,,,,,,,,,,
"x27871282261",2010-10-19 21:49:27,"x19407835","RepMikeCoffman","Today in 1781: Cornwallis surrenders at Yorktown. Tour the capitol, see the Trumbull painting: http://bit.ly/d5aHZI","TweetDeck",,,,FALSE,FALSE,0,1,,,,,,,,,,,,,,,,"en",,,,,,,,,,,,,
"x27863349865",2010-10-19 19:53:18,"x19407835","RepMikeCoffman","From my colleague @RepFredUpton: Declaring war on the regulatory state http://bit.ly/di7w6F","TweetDeck",,,,FALSE,FALSE,0,1,,,,,,,,,,,,,,"x124224165","RepFredUpton","en",,,,,,,,,,,,,
"x27855004612",2010-10-19 17:51:31,"x19407835","RepMikeCoffman","New RSC video: Putting the Power Back in Your Hands http://youtu.be/40rYcjQYp6Q #tcot #hhrs (via @RepublicanStudy)","TweetDeck",,,,FALSE,FALSE,0,0,"tcot hhrs",,,,,,,,,,,,,"x22528309","RepublicanStudy","en",,,,,,,,,,,,,
"x27852076472",2010-10-19 17:10:51,"x19407835","RepMikeCoffman","The deadline for those eligible for Retroactive Stop Loss Special Pay (RSLSP) has been extended to 3 Dec. http://bit.ly/daW4UI #mil","TweetDeck",,,,FALSE,FALSE,0,1,"mil",,,,,,,,,,,,,,,"en",,,,,,,,,,,,,
"x27771783083",2010-10-18 21:41:38,"x19407835","RepMikeCoffman","DougCo Water has announced a new program to retrofit sprinklers, create summer jobs for teens. Info: http://bit.ly/bhI07I","TweetDeck",,,,FALSE,FALSE,0,0,,,,,,,,,,,,,,,,"en",,,,,,,,,,,,,
"x27767916429",2010-10-18 20:46:22,"x19407835","RepMikeCoffman","Congrats to Valor Christian High School in Highlands Ranch.  2010 #Colorado 4A boy’s golf state champs.","TweetDeck",,,,FALSE,FALSE,0,1,"Colorado",,,,,,,,,,,,,,,"en",,,,,,,,,,,,,
"x27762533194",2010-10-18 19:25:55,"x19407835","RepMikeCoffman","Great piece about Ms. Bren Wolfe & her exceptional #advocacy for adoptive parents. http://bit.ly/aa8rYY #Colorado","TweetDeck",,,,FALSE,FALSE,0,0,"advocacy Colorado",,,,,,,,,,,,,,,"en",,,,,,,,,,,,,
"x27760252981",2010-10-18 18:51:31,"x19407835","RepMikeCoffman","Use tax cuts to grow the economy – read my op-ed in the @DenverPost: http://bit.ly/9stx9b #redco #tcot #hhrs","TweetDeck",,,,FALSE,FALSE,0,2,"redco tcot hhrs",,,,,,,,,,,,,"x8216772","denverpost","en",,,,,,,,,,,,,
"x27469390500",2010-10-15 18:59:44,"x19407835","RepMikeCoffman","6th District student Missy Franklin is in the running for the 2010 Sports Illustrated SportsKid of the Year: http://bit.ly/d19B7F","TweetDeck",,,,FALSE,FALSE,0,1,,,,,,,,,,,,,,,,"en",,,,,,,,,,,,,
"x27463825773",2010-10-15 17:43:47,"x19407835","RepMikeCoffman","Langone in the @WSJ: Stop  Bashing Business, Mr. President http://bit.ly/9NCXMv","TweetDeck",,,,FALSE,FALSE,0,1,,,,,,,,,,,,,,"x3108351","WSJ","en",,,,,,,,,,,,,
"x27460717620",2010-10-15 17:05:06,"x19407835","RepMikeCoffman","Red ink alert: federal budget deficit exceeded $1 trillion for 2nd straight year http://bit.ly/9J2nos #hhrs #tcot #gop","TweetDeck",,,,FALSE,FALSE,0,0,"hhrs tcot gop",,,,,,,,,,,,,,,"en",,,,,,,,,,,,,
"x27369489379",2010-10-14 19:26:05,"x19407835","RepMikeCoffman","Fed judge in FL has ruled that 20 US states can proceed w/ their lawsuit seeking to overturn ObamaCare. #hcr","TweetDeck",,,,FALSE,FALSE,0,6,"hcr",,,,,,,,,,,,,,,"en",,,,,,,,,,,,,
"x27361137296",2010-10-14 17:26:19,"x19407835","RepMikeCoffman","Medicare official: seniors may have to dig deeper into their wallets next year thanks to the health care law. http://politi.co/bV2p7Q #tcot","TweetDeck",,,,FALSE,FALSE,0,4,"tcot",,,,,,,,,,,,,,,"en",,,,,,,,,,,,,
"x27359184095",2010-10-14 17:01:18,"x19407835","RepMikeCoffman","A #Colorado hero helps rescue trapped miners in #Chile. http://bit.ly/auW4Am","TweetDeck",,,,FALSE,FALSE,0,1,"Colorado Chile",,,,,,,,,,,,,,,"en",,,,,,,,,,,,,
"x27279457163",2010-10-13 21:51:12,"x19407835","RepMikeCoffman","I’m sending out my newsletter on Friday. Do you receive it? If not, sign up here: http://bit.ly/a6MLwY #Colorado #tcot #redco #tlot #hhrs","TweetDeck",,,,FALSE,FALSE,0,0,"Colorado tcot redco tlot hhrs",,,,,,,,,,,,,,,"en",,,,,,,,,,,,,
"x27263747068",2010-10-13 17:59:34,"x19407835","RepMikeCoffman","Today is the 235th birthday of the U.S. Navy.  “Without a decisive naval force we can do nothing definitive.” – George Washington","TweetDeck",,,,FALSE,FALSE,0,10,,,,,,,,,,,,,,,,"en",,,,,,,,,,,,,
"x27261294148",2010-10-13 17:25:24,"x19407835","RepMikeCoffman","No contest. RT @daveweigel: May be willing to concede that #Colorado is prettier than Delaware.","TweetDeck",,,,FALSE,FALSE,0,0,"Colorado",,,,,,,,,,,,,"x13524182","daveweigel","en",,,,,,,,,,,,,
"x27256631994",2010-10-13 16:26:21,"x19407835","RepMikeCoffman","RT @boblatta: @WhiteHouse reflects on ""stimulus"" pkg, admits GOP tax cuts should have been included http://ow.ly/2SRqK #tcot #jobs","TweetDeck",,,,FALSE,FALSE,0,0,"tcot jobs",,,,,,,,,,,,,"x15394954 822215673812119553","boblatta WhiteHouse","en",,,,,,,,,,,,,
"x27171582147",2010-10-12 20:34:31,"x19407835","RepMikeCoffman","Congrats to 6th District resident Thomas Hendershot - inducted in to the #Colorado Aviation Hall of Fame http://bit.ly/9RzZY4","TweetDeck",,,,FALSE,FALSE,0,0,"Colorado",,,,,,,,,,,,,,,"en",,,,,,,,,,,,,
"x27167828939",2010-10-12 19:38:14,"x19407835","RepMikeCoffman","Frost advisory listed for #Colorado tonight.  Lows in the 30s. Might want to disconnect your hoses this afternoon.","TweetDeck",,,,FALSE,FALSE,0,0,"Colorado",,,,,,,,,,,,,,,"en",,,,,,,,,,,,,
"x27163570085",2010-10-12 18:35:03,"x19407835","RepMikeCoffman","This morning I visited Air Methods at the Centennial Airport – an EMS transport company. http://flic.kr/p/8JukHk","TweetDeck",,,,FALSE,FALSE,0,0,,,,,,,,,,,,,,,,"en",,,,,,,,,,,,,
"x27161631561",2010-10-12 18:06:46,"x19407835","RepMikeCoffman","From @WSJ: Govt making money b/c it now controls so much capital, robbing money from priv economy in the process. http://bit.ly/9316Cy","TweetDeck",,,,FALSE,FALSE,0,1,,,,,,,,,,,,,,"x3108351","WSJ","en",,,,,,,,,,,,,
"x26783876514",2010-10-08 20:52:33,"x19407835","RepMikeCoffman","My office closed 12 constituent cases ranging from VA benefits to passport help this week. Need help? http://bit.ly/dA8YSP","TweetDeck",,,,FALSE,FALSE,0,2,,,,,,,,,,,,,,,,"en",,,,,,,,,,,,,
"x26783242961",2010-10-08 20:42:54,"x19407835","RepMikeCoffman","RT @NatResourcesGOP: #FF Natural Resources Republicans @RepFleming @RepMikeCoffman @jasoninthehouse @CynthiaLummis @RepMcClintock @DrCassidy","TweetDeck",,,,FALSE,FALSE,0,0,"FF",,,,,,,,,,,,,"x234457049 84620376 19407835 17800215 22831059 50152441 270038449","NatResourcesGOP RepFleming RepMikeCoffman jasoninthehouse CynthiaLummis RepMcClintock DrCassidy","fr",,,,,,,,,,,,,
"x26769344276",2010-10-08 17:20:15,"x19407835","RepMikeCoffman","This week my office helped 2 constituents w/loan mods – lowered their home loans by up to 1/3. Need help? Visit: http://bit.ly/dA8YSP","TweetDeck",,,,FALSE,FALSE,1,0,,,,,,,,,,,,,,,,"en",,,,,,,,,,,,,
"x26762982241",2010-10-08 16:04:40,"x19407835","RepMikeCoffman","Just received a call from a local dentist who’s losing his dental assoc-provided coverage due to a 47% rate increase. Repeal, replace. #hcr","TweetDeck",,,,FALSE,FALSE,1,4,"hcr",,,,,,,,,,,,,,,"en",,,,,,,,,,,,,
"x26762415602",2010-10-08 15:58:13,"x19407835","RepMikeCoffman","We’ve got snow in the #Colorado high country.","TweetDeck",,,,FALSE,FALSE,0,2,"Colorado",,,,,,,,,,,,,,,"en",,,,,,,,,,,,,
"x26681273042",2010-10-07 20:10:29,"x19407835","RepMikeCoffman","Psyched for @NBC30Rock tonight.  Jack faces his big day in Congress.  Sneak peak: http://bit.ly/91gvW6","TweetDeck",,,,FALSE,FALSE,0,1,,,,,,,,,,,,,,"x28204375","nbc30rock","en",,,,,,,,,,,,,
"x26678472519",2010-10-07 19:27:32,"x19407835","RepMikeCoffman","6th District artist finds his calling in Hollywood; now an Assistant Director for show ‘American Dad’ http://bit.ly/ddjcLr","TweetDeck",,,,FALSE,FALSE,0,0,,,,,,,,,,,,,,,,"en",,,,,,,,,,,,,
"x26671741949",2010-10-07 17:45:31,"x19407835","RepMikeCoffman","McDonald’s, Jack in the Box, 28 other companies receive ObamaCare coverage waivers http://usat.ly/aOurJE","TweetDeck",,,,FALSE,FALSE,0,3,,,,,,,,,,,,,,,,"en",,,,,,,,,,,,,
"x26582348844",2010-10-06 20:27:44,"x19407835","RepMikeCoffman","#Colorado State Parks Lifetime Pass for Seniors available Nov. 1. Info: http://bit.ly/daKtMh","TweetDeck",,,,FALSE,FALSE,0,0,"Colorado",,,,,,,,,,,,,,,"en",,,,,,,,,,,,,
"x26574902688",2010-10-06 18:32:33,"x19407835","RepMikeCoffman","Recovery.gov promised transparency, except, they forgot to disclose $162 million in stimulus funds http://usat.ly/axDFeX #tcot","TweetDeck",,,,FALSE,FALSE,0,0,"tcot",,,,,,,,,,,,,,,"en",,,,,,,,,,,,,
"x26570997898",2010-10-06 17:32:33,"x19407835","RepMikeCoffman","Conservative values can help get us back on track http://bit.ly/aEWaAj #tcot #redco #hhrs #gop","TweetDeck",,,,FALSE,FALSE,0,0,"tcot redco hhrs gop",,,,,,,,,,,,,,,"en",,,,,,,,,,,,,
