"status_id","created_at","user_id","screen_name","text","source","reply_to_status_id","reply_to_user_id","reply_to_screen_name","is_quote","is_retweet","favorite_count","retweet_count","hashtags","symbols","urls_url","urls_t.co","urls_expanded_url","media_url","media_t.co","media_expanded_url","media_type","ext_media_url","ext_media_t.co","ext_media_expanded_url","ext_media_type","mentions_user_id","mentions_screen_name","lang","quoted_status_id","quoted_text","retweet_status_id","retweet_text","place_url","place_name","place_full_name","place_type","country","country_code","geo_coords","coords_coords","bbox_coords"
"x756537100053413894",2016-07-22 17:11:15,"x37094727","MarioDB","I commend @MayorGimenez @CommBovo + Transit Director Bravo for innovative #transpo solutions, &amp; I look forward to continue working w them.","TweetDeck",,,,FALSE,FALSE,4,6,"transpo",,,,,,,,,,,,,"x331783175 1129038920","MayorGimenez CommBovo","en",,,,,,,,,,,,,
"x756535696710656000",2016-07-22 17:05:40,"x37094727","MarioDB","As South Floridians, we are all too familiar w traffic problems. Glad to have supported a grant program to help alleviate some of it.","TweetDeck",,,,FALSE,FALSE,2,6,,,,,,,,,,,,,,,,"en",,,,,,,,,,,,,
"x755878127524544513",2016-07-20 21:32:43,"x37094727","MarioDB","Saddened to hear of the passing of Rep. Mark Takai. Tia &amp; I keep his wife Sami &amp; their 2 kids in our thoughts during this difficult time.","Twitter for iPhone",,,,FALSE,FALSE,7,2,,,,,,,,,,,,,,,,"en",,,,,,,,,,,,,
"x755741949454417921",2016-07-20 12:31:36,"x37094727","MarioDB","Do you need help with VA or other fed issue? My staff will be holding office hours 11a-1p @ Sunset Lakes Comm Center, 2801 SW 186 Ave","Twitter for iPhone",,,,FALSE,FALSE,0,2,,,,,,,,,,,,,,,,"en",,,,,,,,,,,,,
"x755458859943223297",2016-07-19 17:46:42,"x37094727","MarioDB","Tune in to @radiomambi710 @ 2p - I'll be live in studio w @NinoskaPerezC / Sintonice a Radio Mambi a las 2 - en vivo con Ninoska! #SFL","TweetDeck",,,,FALSE,FALSE,0,2,"SFL",,,,,,,,,,,,,"x176927239 370681787","radiomambi710 NinoskaPerezC","es",,,,,,,,,,,,,
"x754738448683106304",2016-07-17 18:04:03,"x37094727","MarioDB","Praying for our law enforcement community in #BatonRouge and around the country. Those responsible must be brought to justice.","Twitter for iPhone",,,,FALSE,FALSE,10,7,"BatonRouge",,,,,,,,,,,,,,,"en",,,,,,,,,,,,,
"x753999974577401856",2016-07-15 17:09:37,"x37094727","MarioDB","Happy birthday to mi hermana @RosLehtinen! Wishing you a day full of cafecitos and celebration! 🎉","Twitter for iPhone",,,,FALSE,FALSE,13,9,,,,,,,,,,,,,,"x14275291","RosLehtinen","en",,,,,,,,,,,,,
"x753562136761294849",2016-07-14 12:09:48,"x37094727","MarioDB","On air live now w @DrewSteele925 on @925FOX_News. Drew's last show is tomorrow - congrats on a great 28 years in #SWFL + good luck in SLC!","TweetDeck",,,,FALSE,FALSE,1,4,"SWFL",,,,,,,,,,,,,"x2456612064","925FOX_News","en",,,,,,,,,,,,,
"x753350429140983808",2016-07-13 22:08:33,"x37094727","MarioDB","Proud to support S.304, the Conscience Protection Act as co-sponsor. Healthcare providers should not be forced to betray their own beliefs.","TweetDeck",,,,FALSE,FALSE,1,4,,,,,,,,,,,,,,,,"en",,,,,,,,,,,,,
"x752971491587817474",2016-07-12 21:02:47,"x37094727","MarioDB","Lock down at the Captiol has been lifted. Endless appreciation to @CapitolPolice for protecting our staff and visitors.","TweetDeck",,,,FALSE,FALSE,3,3,,,,,,,,,,,,,,"x16503916","CapitolPolice","en",,,,,,,,,,,,,
"x751502127814447104",2016-07-08 19:44:04,"x37094727","MarioDB","...their lives every day to protect our communities. May the souls of those officers rest in eternal peace. (2/2)","TweetDeck",,,,FALSE,FALSE,7,6,,,,,,,,,,,,,,,,"en",,,,,,,,,,,,,
"x751502019236466688",2016-07-08 19:43:38,"x37094727","MarioDB","Praying for families of Dallas officers killed in the line of duty. We must come together as a nation + support those who risk... (1/2)","TweetDeck",,,,FALSE,FALSE,13,10,,,,,,,,,,,,,,,,"en",,,,,,,,,,,,,
"x747897255659700225",2016-06-28 20:59:35,"x37094727","MarioDB","As we continue to learn about the attack in #Instabul, the US stands with #Turkey and against terrorism.","TweetDeck",,,,FALSE,FALSE,10,9,"Instabul Turkey",,,,,,,,,,,,,,,"en",,,,,,,,,,,,,
"x747805393657729024",2016-06-28 14:54:34,"x37094727","MarioDB","Today, the Senate is voting on the #Zika conference report that passed the House. I implore my colleagues in the Senate to vote for funding","TweetDeck",,,,FALSE,FALSE,3,4,"Zika",,,,,,,,,,,,,,,"en",,,,,,,,,,,,,
"x747804515001319424",2016-06-28 14:51:04,"x37094727","MarioDB","Saddened to hear of baby that was born with #Zika related microcephaly – Tia and I have the mother, child, + family in our prayers","TweetDeck",,,,FALSE,FALSE,0,3,"Zika",,,,,,,,,,,,,,,"en",,,,,,,,,,,,,
"x746093160951058432",2016-06-23 21:30:45,"x37094727","MarioDB","House + Senate worked together to address #Zika. White House issues veto threat. We need to respond appropriately + promptly to this virus.","TweetDeck",,,,FALSE,FALSE,3,2,"Zika",,,,,,,,,,,,,,,"en",,,,,,,,,,,,,
"x745598513862615044",2016-06-22 12:45:12,"x37094727","MarioDB","Do you need help with VA or other fed issue? My staff will be holding office hours 11a-1p @ Hialeah City Hall, 3rd Flr, 501 Palm Ave","TweetDeck",,,,FALSE,FALSE,1,1,,,,,,,,,,,,,,,,"en",,,,,,,,,,,,,
"x742009592478044160",2016-06-12 15:04:07,"x37094727","MarioDB","Prayers to the victims of the #OrlandoShooting. May the victims and their families find peace after this senseless act of violence.","Twitter for iPhone",,,,FALSE,FALSE,16,25,"OrlandoShooting",,,,,,,,,,,,,,,"en",,,,,,,,,,,,,
"x740946585857622016",2016-06-09 16:40:06,"x37094727","MarioDB","POTUS extended open hand to regimes in #Cuba #VZ #Iran + left us weakened. We must be clear about how US treats friends vs foes #BetterWay","TweetDeck",,,,FALSE,FALSE,7,10,"Cuba VZ Iran BetterWay",,,,,,,,,,,,,,,"en",,,,,,,,,,,,,
"x740940857671618561",2016-06-09 16:17:21,"x37094727","MarioDB","To defeat #ISIS, we MUST accept the truth: we are at war w a growing + evolving network of Islamist terrorists. #BetterWay #nationalsecurity","TweetDeck",,,,FALSE,FALSE,5,4,"ISIS BetterWay nationalsecurity",,,,,,,,,,,,,,,"en",,,,,,,,,,,,,
"x740938522358603780",2016-06-09 16:08:04,"x37094727","MarioDB",".@HouseGOP's #BetterWay on #nationalsecurity to defeat #ISIS: working with our allies to counter these terror groups","TweetDeck",,,,FALSE,FALSE,1,4,"BetterWay nationalsecurity ISIS",,,,,,,,,,,,,"x15207668","HouseGOP","en",,,,,,,,,,,,,
"x740325114357665792",2016-06-07 23:30:36,"x37094727","MarioDB","It was a privilege to join a mtg w 5 Medal of Honor recipients. I'm grateful for the commitment of these exemplary members of our military.","Twitter for iPhone",,,,FALSE,FALSE,5,3,,,,,,,,,,,,,,,,"en",,,,,,,,,,,,,
"x740278509273251841",2016-06-07 20:25:24,"x37094727","MarioDB","#SWFL has all of the right factors - strong #ag industry, geographic location for #tourism, + ideal economic conditions for #biz.","TweetDeck",,,,FALSE,FALSE,2,1,"SWFL ag tourism biz",,,,,,,,,,,,,,,"en",,,,,,,,,,,,,
"x738830641567956992",2016-06-03 20:32:06,"x37094727","MarioDB","As we start the 1st weekend of Hurricane Season, a #FF to @NHCDirector Dr. Rick Knabb, Director of the Nat'l Hurricane Center @NWSNHC","TweetDeck",,,,FALSE,FALSE,4,2,"FF",,,,,,,,,,,,,"x867437985381445636 3308352436","NHCDirector NWSNHC","en",,,,,,,,,,,,,
"x738115481727578112",2016-06-01 21:10:19,"x37094727","MarioDB","Glad @OAS_official finally invoked Inter-American Democratic Charter; member states must stand up for democracy &amp; human rights in #Venezuela","TweetDeck",,,,FALSE,FALSE,14,33,"Venezuela",,,,,,,,,,,,,"x60685572","OAS_official","en",,,,,,,,,,,,,
"x733139378063724545",2016-05-19 03:37:03,"x37094727","MarioDB","Proudly voted to provide our military with the robust resources they need to defend our country at home and around the world #FY17NDAA","Twitter for iPhone",,,,FALSE,FALSE,3,6,"FY17NDAA",,,,,,,,,,,,,,,"en",,,,,,,,,,,,,
"x732652849180647424",2016-05-17 19:23:45,"x37094727","MarioDB","My #transpo #housing bill includes $ for support services for homeless, transitional + permanent housing; +$237 million over current levels","TweetDeck",,,,FALSE,FALSE,4,3,"transpo housing",,,,,,,,,,,,,,,"en",,,,,,,,,,,,,
"x732623240913399808",2016-05-17 17:26:06,"x37094727","MarioDB","As I continue 2 seek answers as 2 why HUD found Homeless Trust's programs 2 b ineffective, I'm taking action 2 prioritize $ 4 #SFL homeless","TweetDeck",,,,FALSE,FALSE,0,2,"SFL",,,,,,,,,,,,,,,"en",,,,,,,,,,,,,
"x730374635922010112",2016-05-11 12:30:57,"x37094727","MarioDB","My staff will be holding office hours 10:30-11:30a @ Collier Housing Authority 1800 Farm Worker Way if you need help with any federal issues","TweetDeck",,,,FALSE,FALSE,0,1,,,,,,,,,,,,,,,,"en",,,,,,,,,,,,,
"x727598172466520064",2016-05-03 20:38:17,"x37094727","MarioDB","In the month of April, my office assisted 137 constituents with casework #FL25","TweetDeck",,,,FALSE,FALSE,1,1,"FL25",,,,,,,,,,,,,,,"en",,,,,,,,,,,,,
"x727569654512812032",2016-05-03 18:44:57,"x37094727","MarioDB","On #TeacherAppreciationDay, let's take the time to thank our educators for their time + love spent on teaching our children","TweetDeck",,,,FALSE,FALSE,4,4,"TeacherAppreciationDay",,,,,,,,,,,,,,,"en",,,,,,,,,,,,,
"x725364000557535232",2016-04-27 16:40:29,"x37094727","MarioDB","Top Gun, Ferris Bueller's Day Off, Star Trek IV: The Voyage Home - movies released the last time our privacy laws were updated #getawarrant","TweetDeck",,,,FALSE,FALSE,0,4,"getawarrant",,,,,,,,,,,,,,,"en",,,,,,,,,,,,,
"x725325647694970882",2016-04-27 14:08:04,"x37094727","MarioDB","The last time our email privacy laws were updated, ""Walk Like an Egyptian"" was a Billboard 100 hit. #GetAWarrant","TweetDeck",,,,FALSE,FALSE,3,5,"GetAWarrant",,,,,,,,,,,,,,,"en",,,,,,,,,,,,,
"x725308648432504832",2016-04-27 13:00:32,"x37094727","MarioDB","Do you need help with VA or other fed issue? My staff will be holding office hours 11a-1p @ Hialeah City Hall, 3rd Flr, 501 Palm Ave","TweetDeck",,,,FALSE,FALSE,0,2,,,,,,,,,,,,,,,,"en",,,,,,,,,,,,,
"x722772593745510400",2016-04-20 13:03:09,"x37094727","MarioDB","Do you need help with VA or other fed issue? My staff will be holding office hours 11a-1p @ Sunset Lakes Comm Center, 2801 SW 186 Ave","TweetDeck",,,,FALSE,FALSE,0,2,,,,,,,,,,,,,,,,"en",,,,,,,,,,,,,
"x722541762133299200",2016-04-19 21:45:54,"x37094727","MarioDB","Continuing the season of mark-ups, @HouseAppropsGOP passed #ag + energy + water bills out of committee today. Onto the next! #appropriations","TweetDeck",,,,FALSE,FALSE,2,5,"ag appropriations",,,,,,,,,,,,,"x301549400","HouseAppropsGOP","en",,,,,,,,,,,,,
"x721031613774073857",2016-04-15 17:45:07,"x37094727","MarioDB","Our country needs a budget that balances within 10 years - without raising taxes. @RepTomPrice budget does just that. #balancedbudget","TweetDeck",,,,FALSE,FALSE,3,6,"balancedbudget",,,,,,,,,,,,,"x6577802","RepTomPrice","en",,,,,,,,,,,,,
"x720247963231076352",2016-04-13 13:51:10,"x37094727","MarioDB","My staff will be holding office hours 10:30-11:30a @ Collier Housing Authority 1800 Farm Worker Way if you need help with any federal issues","TweetDeck",,,,FALSE,FALSE,1,3,,,,,,,,,,,,,,,,"en",,,,,,,,,,,,,
"x720002016278392832",2016-04-12 21:33:52,"x37094727","MarioDB","Plans for @FIU's new engineering building would create more opportunities for #STEM education in #SFL. FIU continues to be #WorldsAhead!","TweetDeck",,,,FALSE,FALSE,18,14,"STEM SFL WorldsAhead",,,,,,,,,,,,,"x39583267","FIU","en",,,,,,,,,,,,,
"x717755411936448512",2016-04-06 16:46:40,"x37094727","MarioDB","Need help with VA or other fed issue? My staff will be holding office hours 3-5p @ Rose G Price Park, 901 NW 208 Ave","TweetDeck",,,,FALSE,FALSE,0,2,,,,,,,,,,,,,,,,"en",,,,,,,,,,,,,
"x717705753008738304",2016-04-06 13:29:20,"x37094727","MarioDB","Need help with VA or other fed issue? My staff will be holding office hours 10a-12p @ Ave Maria Welcome Center, 5076 Annunciation Circle","TweetDeck",,,,FALSE,FALSE,0,3,,,,,,,,,,,,,,,,"en",,,,,,,,,,,,,
"x714530670786310145",2016-03-28 19:12:41,"x37094727","MarioDB","Extremely grateful for Capitol police and all that they do for us. Thank you, thank you, thank you.","TweetDeck",,,,FALSE,FALSE,6,3,,,,,,,,,,,,,,,,"en",,,,,,,,,,,,,
"x714530082652610560",2016-03-28 19:10:21,"x37094727","MarioDB","My DC staff is all safe. Reports say that a Capitol police officer was shot (not seriously). Please keep that officer in your prayers.","TweetDeck",,,,FALSE,FALSE,16,16,,,,,,,,,,,,,,,,"en",,,,,,,,,,,,,
"x712290426540134404",2016-03-22 14:50:46,"x37094727","MarioDB","Raul #Castro may be in the room listening to POTUS speak about #humanrights #democracy, but it is falling on deaf ears. #ObamaenCuba","TweetDeck",,,,FALSE,FALSE,7,9,"Castro humanrights democracy ObamaenCuba",,,,,,,,,,,,,,,"en",,,,,,,,,,,,,
"x712288719013879810",2016-03-22 14:43:58,"x37094727","MarioDB","POTUS (in Spanish): Future of #Cuba has to be in the hands of the Cuban people. Yeah, tell that to Raul #Castro. #ObamaenCuba","TweetDeck",,,,FALSE,FALSE,5,10,"Cuba Castro ObamaenCuba",,,,,,,,,,,,,,,"en",,,,,,,,,,,,,
"x712287696308277248",2016-03-22 14:39:55,"x37094727","MarioDB","POTUS is speaking of rights + liberties we are lucky to have in USA. Under #Castro regime, Cuban people are not as fortunate. #humanrights","TweetDeck",,,,FALSE,FALSE,9,19,"Castro humanrights",,,,,,,,,,,,,,,"en",,,,,,,,,,,,,
"x712286442718892032",2016-03-22 14:34:56,"x37094727","MarioDB","Continued change in #Cuba would mean things have improved. Reality on the island=things have worsened since POTUS' appeasement. #ObamaenCuba","TweetDeck",,,,FALSE,FALSE,12,22,"Cuba ObamaenCuba",,,,,,,,,,,,,,,"en",,,,,,,,,,,,,
"x712285015938371584",2016-03-22 14:29:16,"x37094727","MarioDB","Normalizing relations=both sides compromising. Instead POTUS has given up leverage+countless concessions in return for nothing. #ObamaenCuba","TweetDeck",,,,FALSE,FALSE,7,11,"ObamaenCuba",,,,,,,,,,,,,,,"en",,,,,,,,,,,,,
"x712284534482534401",2016-03-22 14:27:21,"x37094727","MarioDB","Common religion? Yes. Difference? @DamasdBlanco + others are beaten. Every. Single. Sunday. Just for going to mass. #ObamaenCuba","TweetDeck",,,,FALSE,FALSE,7,12,"ObamaenCuba",,,,,,,,,,,,,"x137763526","DamasdBlanco","en",,,,,,,,,,,,,
"x712284030021066754",2016-03-22 14:25:21,"x37094727","MarioDB","Fact check: Presidents are elected in democratic, free, and fair elections. Raul Castro ≠ President. Dictator, yes. #ObamaenCuba","TweetDeck",,,,FALSE,FALSE,8,9,"ObamaenCuba",,,,,,,,,,,,,,,"en",,,,,,,,,,,,,
"x712068432716390401",2016-03-22 00:08:38,"x37094727","MarioDB","Commitment to #humanrights does not mean rhetoric and empty promises #Obamavisit #ObamaenCuba","Twitter for iPhone",,,,FALSE,FALSE,6,8,"humanrights Obamavisit ObamaenCuba",,,,,,,,,,,,,,,"en",,,,,,,,,,,,,
"x712067276275515392",2016-03-22 00:04:02,"x37094727","MarioDB","POTUS speaks of improving #humanrights in #Cuba, but when? So many brutal arrests. Have not stopped, will only continue. #ObamaenCuba","Twitter for iPhone",,,,FALSE,FALSE,12,30,"humanrights Cuba ObamaenCuba",,,,,,,,,,,,,,,"en",,,,,,,,,,,,,
"x712066856819949568",2016-03-22 00:02:22,"x37094727","MarioDB",".@DirectorioCuba also reports communication via already restricted telephone + Internet has worsened since POTUS arrived #ObamaenCuba","Twitter for iPhone",,,,FALSE,FALSE,4,12,"ObamaenCuba",,,,,,,,,,,,,"x68710659","DirectorioCuba","en",,,,,,,,,,,,,
"x712066284473552896",2016-03-22 00:00:06,"x37094727","MarioDB","#Castro claims no political prisoners today, yet @bertasolerf @AGRodiles + their spouses have been arrested for several hrs #ObamaenCuba","Twitter for iPhone",,,,FALSE,FALSE,7,23,"Castro ObamaenCuba",,,,,,,,,,,,,"x2828320898 1060693213","bertasolerf AGRodiles","en",,,,,,,,,,,,,
"x711989941392314368",2016-03-21 18:56:44,"x37094727","MarioDB","#Castro says #humanrights should not be politicized. Should actually release EVERY single political prisoner w/o fear of rearrest hrs later","TweetDeck",,,,FALSE,FALSE,7,17,"Castro humanrights",,,,,,,,,,,,,,,"en",,,,,,,,,,,,,
"x711986423545597953",2016-03-21 18:42:46,"x37094727","MarioDB","#Castro claims no political prisoners when asked. Would need more than 140 characters... #ObamaenCuba","TweetDeck",,,,FALSE,FALSE,9,12,"Castro ObamaenCuba",,,,,,,,,,,,,,,"en",,,,,,,,,,,,,
"x711986006300430336",2016-03-21 18:41:06,"x37094727","MarioDB","Having ""frank + candid"" conversation ab human rights in #Cuba means discussing it more than when it is politically convenient #ObamaenCuba","TweetDeck",,,,FALSE,FALSE,2,11,"Cuba ObamaenCuba",,,,,,,,,,,,,,,"en",,,,,,,,,,,,,
"x711984652928557056",2016-03-21 18:35:43,"x37094727","MarioDB","POTUS, you cannot ""move forward"" when dozens, if not hundreds, of beatings and political arrests occur daily. #ObamaenCuba","TweetDeck",,,,FALSE,FALSE,13,20,"ObamaenCuba",,,,,,,,,,,,,,,"en",,,,,,,,,,,,,
"x711725430064087040",2016-03-21 01:25:40,"x37094727","MarioDB","For 45th consecutive Sunday, @DamasdBlanco were beaten + arrested in #Cuba. Not even POTUS visit will stop #Castro thuggery #ObamaenCuba","Twitter for iPhone",,,,FALSE,FALSE,20,54,"Cuba Castro ObamaenCuba",,,,,,,,,,,,,"x137763526","DamasdBlanco","en",,,,,,,,,,,,,
"x711592483642318848",2016-03-20 16:37:23,"x37094727","MarioDB","At 1:30 EST, I'm joining @LelandVittert @ShannonBream on @ANHQDC on Fox to discuss POTUS' trip to visit w #Castro regime in Cuba","Twitter for iPhone",,,,FALSE,FALSE,7,9,"Castro",,,,,,,,,,,,,"x21010253 18983793 21301913","LelandVittert ShannonBream ANHQDC","en",,,,,,,,,,,,,
"x710211615313027073",2016-03-16 21:10:18,"x37094727","MarioDB","Met with @FDOT_Secretary yesterday. @MyFDOT is doing a great job at keeping #FL moving at our ports and on our roads!","TweetDeck",,,,FALSE,FALSE,7,13,"FL",,,,,,,,,,,,,"x1006483250 184852821","FDOT_Secretary MyFDOT","en",,,,,,,,,,,,,
"x710094511951708162",2016-03-16 13:24:59,"x37094727","MarioDB","Do you need help with VA or other fed issue? My staff will be holding office hours 11a-1p @ Sunset Lakes Comm Center, 2801 SW 186 Ave","TweetDeck",,,,FALSE,FALSE,0,3,,,,,,,,,,,,,,,,"en",,,,,,,,,,,,,
"x707568061218471936",2016-03-09 14:05:46,"x37094727","MarioDB","My staff will be holding office hours 10:30-11:30a @ Collier Housing Authority 1800 Farm Worker Way if you need help with any federal issues","TweetDeck",,,,FALSE,FALSE,1,5,,,,,,,,,,,,,,,,"en",,,,,,,,,,,,,
"x706534927895044096",2016-03-06 17:40:28,"x37094727","MarioDB","Saddened 2 hear of Nancy Reagan's passing. May her family find comfort in knowing she is finally reunited w her beloved sweetheart in heaven","Twitter for iPhone",,,,FALSE,FALSE,12,7,,,,,,,,,,,,,,,,"en",,,,,,,,,,,,,
"x705570614254440448",2016-03-04 01:48:37,"x37094727","MarioDB",".@JohnKerry finalmente está descubriendo lo que ya sabemos: #DerechosHumanos no han mejorado en #Cuba. Y sólo seguirá empeorando","Twitter for iPhone",,,,FALSE,FALSE,5,22,"DerechosHumanos Cuba",,,,,,,,,,,,,"x15007149","JohnKerry","es",,,,,,,,,,,,,
"x705569106334978050",2016-03-04 01:42:38,"x37094727","MarioDB","Glad @JohnKerry is discovering what we've already known: #humanrights haven't improved in #Cuba. Unfortunately, will only continue to worsen","Twitter for iPhone",,,,FALSE,FALSE,13,17,"humanrights Cuba",,,,,,,,,,,,,"x15007149","JohnKerry","en",,,,,,,,,,,,,
"x704794130967359488",2016-03-01 22:23:09,"x37094727","MarioDB","Very concerned about the arrest of Santiago Uribe, brother of former Colombian President @AlvaroUribeVel","Twitter for iPhone",,,,FALSE,FALSE,145,362,,,,,,,,,,,,,,"x61097151","AlvaroUribeVel","en",,,,,,,,,,,,,
"x704689508009250817",2016-03-01 15:27:25,"x37094727","MarioDB","Happy Birthday to my neighbor to the south, @RepCurbelo!","TweetDeck",,,,FALSE,FALSE,5,4,,,,,,,,,,,,,,"x2853309155","RepCurbelo","en",,,,,,,,,,,,,
"x702626086887284737",2016-02-24 22:48:07,"x37094727","MarioDB","Congratulations to @greta on her 3,500 show tonight! I'm sure it'll be one for the books. Tune in at 7p EST #Greta3500 #OnTheRecord","TweetDeck",,,,FALSE,FALSE,2,4,"Greta3500 OnTheRecord",,,,,,,,,,,,,"x16031927","greta","en",,,,,,,,,,,,,
"x702190705150525441",2016-02-23 17:58:04,"x37094727","MarioDB","With Pres Obama, it's all about creating a legacy. The only legacy he's leaving behind is one that weakens our leverage w our enemies #GTMO","TweetDeck",,,,FALSE,FALSE,3,4,"GTMO",,,,,,,,,,,,,,,"en",,,,,,,,,,,,,
"x702171712935297024",2016-02-23 16:42:36,"x37094727","MarioDB","Return of #GTMO is at top of Castro regime's wish list. POTUS is putting ideology over America's natural security.","TweetDeck",,,,FALSE,FALSE,9,14,"GTMO",,,,,,,,,,,,,,,"en",,,,,,,,,,,,,
"x700333466488041472",2016-02-18 14:58:04,"x37094727","MarioDB","#Castros continue to harbor 70+ fugitives from U.S. justice like ""Most Wanted Terrorist"" Joanne Chesimard. POTUS plans a #Cuba trip anyway!","TweetDeck",,,,FALSE,FALSE,12,29,"Castros Cuba",,,,,,,,,,,,,,,"en",,,,,,,,,,,,,
"x699307069778763777",2016-02-15 18:59:32,"x37094727","MarioDB","Today is a great reminder of the history of the presidents who shaped America's most pivotal moments in its early history. #PresidentsDay","Twitter for iPhone",,,,FALSE,FALSE,5,5,"PresidentsDay",,,,,,,,,,,,,,,"en",,,,,,,,,,,,,
"x698637922778517504",2016-02-13 22:40:35,"x37094727","MarioDB","Deeply saddened to hear of the passing of legal great Supreme Court Associate Justice Scalia. May he rest in eternal peace.","Twitter for iPhone",,,,FALSE,FALSE,3,6,,,,,,,,,,,,,,,,"en",,,,,,,,,,,,,
"x697812531784642560",2016-02-11 16:00:46,"x37094727","MarioDB","Need help with VA or other fed issue? My staff will be holding office hours 3-5p @ La Belle City Hall, 481 West Hickpochee Ave","TweetDeck",,,,FALSE,FALSE,0,2,,,,,,,,,,,,,,,,"en",,,,,,,,,,,,,
"x697424236407885824",2016-02-10 14:17:50,"x37094727","MarioDB","My staff will be holding office hours 10:30-11:30a @ Collier Housing Authority 1800 Farm Worker Way if you need help with any federal issues","TweetDeck",,,,FALSE,FALSE,2,2,,,,,,,,,,,,,,,,"en",,,,,,,,,,,,,
"x694547594366812161",2016-02-02 15:47:05,"x37094727","MarioDB","My staff will be holding office hours 3-5p @ Everglades City Hall, 102 Copeland Ave. if you need help with any federal issues.","TweetDeck",,,,FALSE,FALSE,0,6,,,,,,,,,,,,,,,,"en",,,,,,,,,,,,,
"x689883636766736384",2016-01-20 18:54:11,"x37094727","MarioDB","En unos minutos, sintonice a @radiomambi710. En vivo con @NinoskaPerezC! In a few min, tune in to Ninoska Perez Castellon! I'll be on live.","TweetDeck",,,,FALSE,FALSE,0,3,,,,,,,,,,,,,,"x176927239 370681787","radiomambi710 NinoskaPerezC","en",,,,,,,,,,,,,
"x689818030625460224",2016-01-20 14:33:29,"x37094727","MarioDB","Do you need help with VA or other fed issue? My staff will be holding office hours 11a-1p @ Sunset Lakes Comm Center, 2801 SW 186 Ave","TweetDeck",,,,FALSE,FALSE,1,4,,,,,,,,,,,,,,,,"en",,,,,,,,,,,,,
"x689107948983943169",2016-01-18 15:31:52,"x37094727","MarioDB","""I have decided to stick with love. Hate is too great a burden to bear."" -Dr. Martin Luther King Jr.","Twitter for iPhone",,,,FALSE,FALSE,5,6,,,,,,,,,,,,,,,,"en",,,,,,,,,,,,,
"x687275194268954624",2016-01-13 14:09:09,"x37094727","MarioDB","My staff will be holding office hours 10:30-11:30a @ Collier Housing Authority 1800 Farm Worker Way if you need help with any federal issues","TweetDeck",,,,FALSE,FALSE,1,2,,,,,,,,,,,,,,,,"en",,,,,,,,,,,,,
"x687121778183958528",2016-01-13 03:59:32,"x37094727","MarioDB","...para que Estados Unidos siga siendo el país más grande en la historia de la humanidad.","Twitter Web Client",,,,FALSE,FALSE,2,4,,,,,,,,,,,,,,,,"es",,,,,,,,,,,,,
"x687121756595875840",2016-01-13 03:59:27,"x37094727","MarioDB","Reafirmemos sus valores y virtudes, para comprometernos nuevamente, a hacer lo que sea necesario...","Twitter Web Client",,,,FALSE,FALSE,2,2,,,,,,,,,,,,,,,,"es",,,,,,,,,,,,,
"x687121697758146560",2016-01-13 03:59:13,"x37094727","MarioDB","La orientación que necesitamos, ya la tenemos. Nuestros antepasados nos prepararon el camino.","Twitter Web Client",,,,FALSE,FALSE,2,4,,,,,,,,,,,,,,,,"es",,,,,,,,,,,,,
"x687121608973107200",2016-01-13 03:58:52,"x37094727","MarioDB","Pero no es la primera vez, y el pueblo americano siempre ha estado a la altura de sus desafíos.","Twitter Web Client",,,,FALSE,FALSE,1,2,,,,,,,,,,,,,,,,"es",,,,,,,,,,,,,
"x687121491675234304",2016-01-13 03:58:24,"x37094727","MarioDB","Tenemos grandes decisiones que tomar. Nuestra nación confronta grandes pruebas.","Twitter Web Client",,,,FALSE,FALSE,0,2,,,,,,,,,,,,,,,,"es",,,,,,,,,,,,,
"x687121391947264000",2016-01-13 03:58:00,"x37094727","MarioDB","..para que nuestros amigos y enemigos en todo el mundo supieran que Estados Unidos busca la paz pero cuando luchamos en guerras, las ganamos","Twitter Web Client",,,,FALSE,FALSE,5,6,,,,,,,,,,,,,,,,"es",,,,,,,,,,,,,
"x687121311689216000",2016-01-13 03:57:41,"x37094727","MarioDB","Y en vez de simplemente darles las gracias a nuestros valientes militares, haríamos más fuertes a nuestras fuerzas armadas....","Twitter Web Client",,,,FALSE,FALSE,1,4,,,,,,,,,,,,,,,,"es",,,,,,,,,,,,,
"x687121196584943616",2016-01-13 03:57:14,"x37094727","MarioDB","Haríamos acuerdos internacionales que serían celebrados en Israel y protestados en Irán, no al revés.","Twitter Web Client",,,,FALSE,FALSE,1,1,,,,,,,,,,,,,,,,"es",,,,,,,,,,,,,
"x687121129027317760",2016-01-13 03:56:57,"x37094727","MarioDB","Respetaríamos la separación de poderes y honraríamos la Constitución en su totalidad. Y sí, eso incluye la Segunda y la Décima Enmienda.","Twitter Web Client",,,,FALSE,FALSE,0,3,,,,,,,,,,,,,,,,"es",,,,,,,,,,,,,
"x687120905579921408",2016-01-13 03:56:04,"x37094727","MarioDB","Apoyaríamos la producción de energía de Estados Unidos, para fomentar mayor crecimiento económico para nuestro pueblo.","Twitter Web Client",,,,FALSE,FALSE,0,3,,,,,,,,,,,,,,,,"es",,,,,,,,,,,,,
