"status_id","created_at","user_id","screen_name","text","source","reply_to_status_id","reply_to_user_id","reply_to_screen_name","is_quote","is_retweet","favorite_count","retweet_count","hashtags","symbols","urls_url","urls_t.co","urls_expanded_url","media_url","media_t.co","media_expanded_url","media_type","ext_media_url","ext_media_t.co","ext_media_expanded_url","ext_media_type","mentions_user_id","mentions_screen_name","lang","quoted_status_id","quoted_text","retweet_status_id","retweet_text","place_url","place_name","place_full_name","place_type","country","country_code","geo_coords","coords_coords","bbox_coords"
"x544152385149341696",2014-12-14 15:30:13,"x1055730738","RepLowenthal","Today marks 2nd ann. of tragedy in Newtown. We owe it to the families &amp; our nation to advocate for common sense gun-control. #DemandAction","TweetDeck",,,,FALSE,FALSE,1,1,"DemandAction",,,,,,,,,,,,,,,"en",,,,,,,,,,,,,
"x542764481513021441",2014-12-10 19:35:11,"x1055730738","RepLowenthal","On #HumanRightsDay &amp; every day, we recognize our duty to promote and protect fundamental freedoms for all human beings. #UN #Rights365","TweetDeck",,,,FALSE,FALSE,0,0,"HumanRightsDay UN Rights365",,,,,,,,,,,,,,,"en",,,,,,,,,,,,,
"x542087549079281664",2014-12-08 22:45:17,"x1055730738","RepLowenthal","The 2010 House-passed DREAM Act to provide path to citizenship for immigrant children-We must #ActOnImmigration &amp; repair our broken system.","TweetDeck",,,,FALSE,FALSE,2,1,"ActOnImmigration",,,,,,,,,,,,,,,"en",,,,,,,,,,,,,
"x541634539647275009",2014-12-07 16:45:11,"x1055730738","RepLowenthal","As  #FDR said to Congress, December 7, 1941 will be known as, “a date which will live in infamy.” Remembering those lost, #PearlHarbor.","TweetDeck",,,,FALSE,FALSE,1,4,"FDR PearlHarbor",,,,,,,,,,,,,,,"en",,,,,,,,,,,,,
"x540690808635023360",2014-12-05 02:15:08,"x1055730738","RepLowenthal","Proud to announce Dept. of Labor has implemented rule to ban workplace discrimination on basis of sexual orientation.  #LGBT #Equality","TweetDeck",,,,FALSE,FALSE,2,3,"LGBT Equality",,,,,,,,,,,,,,,"en",,,,,,,,,,,,,
"x539592350582845440",2014-12-02 01:30:16,"x1055730738","RepLowenthal","The @CBSEveningNews tonight &amp; tomorrow at 6:30 pm will feature segment on National Guard Youth ChalleNGe Academy. #LosAlamitos #JFTB","TweetDeck",,,,FALSE,FALSE,0,0,"LosAlamitos JFTB",,,,,,,,,,,,,"x42958829","CBSEveningNews","en",,,,,,,,,,,,,
"x539562162247569408",2014-12-01 23:30:18,"x1055730738","RepLowenthal","Nearly 35-mil people worldwide have HIV. We must commit ourselves to making sure that no more friends &amp; family are lost. #WorldAIDSDay","TweetDeck",,,,FALSE,FALSE,0,1,"WorldAIDSDay",,,,,,,,,,,,,,,"en",,,,,,,,,,,,,
"x537648258659516416",2014-11-26 16:45:08,"x1055730738","RepLowenthal","Proud to stand w/ many members of #CA delegation to urge #President to include funding for #LARiver Restoration project in 2016 budget.","TweetDeck",,,,FALSE,FALSE,0,0,"CA President LARiver",,,,,,,,,,,,,,,"en",,,,,,,,,,,,,
"x536225166611591168",2014-11-22 18:30:16,"x1055730738","RepLowenthal","51 years ago today Pres. #JFK was taken from us. His lasting legacy and impact on our nation will be long remembered.","TweetDeck",,,,FALSE,FALSE,1,5,"JFK",,,,,,,,,,,,,,,"en",,,,,,,,,,,,,
"x535901972487217152",2014-11-21 21:06:01,"x1055730738","RepLowenthal","“I applaud President acting so thousands of families in my district will not have to live w/ fear of being separated.” #ImmigrationAction","TweetDeck",,,,FALSE,FALSE,32,30,"ImmigrationAction",,,,,,,,,,,,,,,"en",,,,,,,,,,,,,
"x535534909428101120",2014-11-20 20:47:26,"x1055730738","RepLowenthal","I've urged President Obama to act on immigration reform while awaiting permanent solution from #Congress. Eager to see details of plan. #CIR","TweetDeck",,,,FALSE,FALSE,1,4,"Congress CIR",,,,,,,,,,,,,,,"en",,,,,,,,,,,,,
"x535273859843239936",2014-11-20 03:30:07,"x1055730738","RepLowenthal","Congrats to Eloy Oakley and John Perez on appointment to #UCBoardOfRegents. Great news for our state’s education system!","TweetDeck",,,,FALSE,FALSE,1,3,"UCBoardOfRegents",,,,,,,,,,,,,,,"en",,,,,,,,,,,,,
"x535204364290641920",2014-11-19 22:53:58,"x1055730738","RepLowenthal","Today in history: #PresidentAbrahamLincoln delivers iconic #GettysburgAddress in 1863.","TweetDeck",,,,FALSE,FALSE,2,2,"PresidentAbrahamLincoln GettysburgAddress",,,,,,,,,,,,,,,"en",,,,,,,,,,,,,
"x534819525150392321",2014-11-18 21:24:45,"x1055730738","RepLowenthal","11yrs ago today, Mass.Sup.Crt. ruled same-sex couples can marry. Today, 33 states do. Still miles to go on road to full #equality for all.","TweetDeck",,,,FALSE,FALSE,1,1,"equality",,,,,,,,,,,,,,,"en",,,,,,,,,,,,,
"x533069348038914049",2014-11-14 01:30:11,"x1055730738","RepLowenthal","Way to go @LongBeachCity on 100-point &amp; #SignalHill on 93-point score on #HRC Municipal Equality Index Report. #Equality #LGBTRights","TweetDeck",,,,FALSE,FALSE,4,2,"SignalHill HRC Equality LGBTRights",,,,,,,,,,,,,"x38808088","LongBeachCity","en",,,,,,,,,,,,,
"x532699435596128256",2014-11-13 01:00:17,"x1055730738","RepLowenthal","Big news: U.S. and China reach momentous agreement to reduce carbon emissions. We must continue to #ActOnClimate.","TweetDeck",,,,FALSE,FALSE,3,5,"ActOnClimate",,,,,,,,,,,,,,,"en",,,,,,,,,,,,,
"x530096151270543360",2014-11-05 20:35:45,"x1055730738","RepLowenthal","Today in history: Octaviano Larrazolo becomes the first #Latino elected to U.S. #Senate in 1928. Today marks anniversary of this milestone!","TweetDeck",,,,FALSE,FALSE,1,1,"Latino Senate",,,,,,,,,,,,,,,"en",,,,,,,,,,,,,
"x529346355240919040",2014-11-03 18:56:20,"x1055730738","RepLowenthal","Completion of #OneWorldTrade Center in #NYC marks emotional milestone. Sept. 11, 2001 is always remembered, never forgotten. #NeverForget","TweetDeck",,,,FALSE,FALSE,0,2,"OneWorldTrade NYC NeverForget",,,,,,,,,,,,,,,"en",,,,,,,,,,,,,
"x528296742975176704",2014-10-31 21:25:33,"x1055730738","RepLowenthal","36 years after the #PregnancyDiscriminationAct, women still face workplace discrimination. We must advocate for #EqualPay for #EqualWork.","TweetDeck",,,,FALSE,FALSE,0,1,"PregnancyDiscriminationAct EqualPay EqualWork",,,,,,,,,,,,,,,"en",,,,,,,,,,,,,
"x527174099366592513",2014-10-28 19:04:34,"x1055730738","RepLowenthal","Today marks 5th anniversary of Shepard-Byrd Act. We’ve come a long way in promoting tolerance, but our journey for #LGBTJUSTICE continues.","TweetDeck",,,,FALSE,FALSE,1,1,"LGBTJUSTICE",,,,,,,,,,,,,,,"en",,,,,,,,,,,,,
"x526805710227931136",2014-10-27 18:40:43,"x1055730738","RepLowenthal","Happy Birthday Teddy!  President #TheodoreRoosevelt was a true trailblazer in the conservation movement and expanding our #NationalParks.","TweetDeck",,,,FALSE,FALSE,2,5,"TheodoreRoosevelt NationalParks",,,,,,,,,,,,,,,"en",,,,,,,,,,,,,
"x525366902928191489",2014-10-23 19:23:25,"x1055730738","RepLowenthal","The #ACA helps put the “Affordable” back into #HealthCoverage. In past year in CA alone, over 1.4 mil people enrolled through @CoveredCA.","TweetDeck",,,,FALSE,FALSE,2,1,"ACA HealthCoverage",,,,,,,,,,,,,"x915514734","CoveredCA","en",,,,,,,,,,,,,
"x523299951736918017",2014-10-18 02:30:05,"x1055730738","RepLowenthal","Big news in #LBUSD, Avalon K-12 School received grant to pilot NatureWorks program, featuring lessons on #Ecology and the #Environment.","TweetDeck",,,,FALSE,FALSE,2,4,"LBUSD Ecology Environment",,,,,,,,,,,,,,,"en",,,,,,,,,,,,,
"x522786555195572224",2014-10-16 16:30:02,"x1055730738","RepLowenthal","8 out of 10 #LGBT youth say they have been bullied. Together, let's take a stand against bullying this #SpiritDay #ImAgainstBullying","TweetDeck",,,,FALSE,FALSE,1,2,"LGBT SpiritDay ImAgainstBullying",,,,,,,,,,,,,,,"en",,,,,,,,,,,,,
"x522441529206796288",2014-10-15 17:39:01,"x1055730738","RepLowenthal","It's National Fossil Day! Fossils are windows to the past helping us learn about our future. #NationalFossilDay #FossilsRock","TweetDeck",,,,FALSE,FALSE,0,0,"NationalFossilDay FossilsRock",,,,,,,,,,,,,,,"en",,,,,,,,,,,,,
"x520695315922317313",2014-10-10 22:00:12,"x1055730738","RepLowenthal","San Gabriel Mountains in #SoCal will be our newest #nationalmonument. Great victory in recognizing #MonumentsMatter. #SGMtnsForever","TweetDeck",,,,FALSE,FALSE,4,3,"SoCal nationalmonument MonumentsMatter SGMtnsForever",,,,,,,,,,,,,,,"en",,,,,,,,,,,,,
"x517065102026342400",2014-09-30 21:35:01,"x1055730738","RepLowenthal","Thank you @ACLU for your help to ensure LGBT students have access to critical online resources at school #DontBlockLGBT","TweetDeck",,,,FALSE,FALSE,2,2,"DontBlockLGBT",,,,,,,,,,,,,"x13393052","ACLU","en",,,,,,,,,,,,,
"x514506383149248512",2014-09-23 20:07:35,"x1055730738","RepLowenthal","Heartfelt gratitude to our 1M+ citizen-soldiers in N.Guard &amp; Reserves during National Employer Support of the Guard and Reserve Week. @ESGR","Twitter Web Client",,,,FALSE,FALSE,3,7,,,,,,,,,,,,,,"x47350034","ESGR","en",,,,,,,,,,,,,
"x514095780970639360",2014-09-22 16:56:00,"x1055730738","RepLowenthal","Climate change is a reality. We must, as a nation, as a world, come together to take immediate action on climate change. #climate2014","Twitter Web Client",,,,FALSE,FALSE,1,4,"climate2014",,,,,,,,,,,,,,,"en",,,,,,,,,,,,,
"x513326758267846658",2014-09-20 14:00:10,"x1055730738","RepLowenthal","Together, our voices and our action can make gender equality a reality. I've added my voice in support. Will you add yours? #heforshe","TweetDeck",,,,FALSE,FALSE,5,3,"heforshe",,,,,,,,,,,,,,,"en",,,,,,,,,,,,,
"x513028088360620032",2014-09-19 18:13:22,"x1055730738","RepLowenthal","Grateful no one was seriously injured on @JetBlue flight that returned to @LGB Long Beach Airport yesterday after engine trouble.","TweetDeck",,,,FALSE,FALSE,1,0,,,,,,,,,,,,,,"x6449282 2551861","JetBlue LGB","en",,,,,,,,,,,,,
"x512649035728297984",2014-09-18 17:07:09,"x1055730738","RepLowenthal","TODAY at 2pm EST join @HouseDemocrats for Twitter Town Hall to contrast our priorities w those of House Rs record of inaction. Use #AskDems","TweetDeck",,,,FALSE,FALSE,1,0,"AskDems",,,,,,,,,,,,,"x43963249","HouseDemocrats","en",,,,,,,,,,,,,
"x507900833485582336",2014-09-05 14:39:29,"x1055730738","RepLowenthal","Great visit yesterday with STARBASE students @ JFTB in Los Alamitos. The program’s #STEM curriculum is what kids need for the future.","Twitter Web Client",,,,FALSE,FALSE,0,0,"STEM",,,,,,,,,,,,,,,"en",,,,,,,,,,,,,
"x507517470920695808",2014-09-04 13:16:08,"x1055730738","RepLowenthal","#TBT to the 1970s when college costs were 1120% less than now. Let's do better by students &amp; increase Pell Grant funding! #MiddleClassFirst","Twitter Web Client",,,,FALSE,FALSE,57,104,"TBT MiddleClassFirst",,,,,,,,,,,,,,,"en",,,,,,,,,,,,,
"x506905458104606720",2014-09-02 20:44:13,"x1055730738","RepLowenthal","Japan signed surrender ending #WWII 69 yrs ago today. The peace that's followed proves the harshest of enemies can become closest of allies.","Twitter Web Client",,,,FALSE,FALSE,2,1,"WWII",,,,,,,,,,,,,,,"en",,,,,,,,,,,,,
"x501806299550875648",2014-08-19 19:01:59,"x1055730738","RepLowenthal","It’s time to #FixHobbyLobby. Congress should pass the Not My Boss’ Business Act as 1st step to safeguard health &amp; religious liberty for all.","Twitter Lite",,,,FALSE,FALSE,2,3,"FixHobbyLobby",,,,,,,,,,,,,,,"en",,,,,,,,,,,,,
"x499998883771334658",2014-08-14 19:19:58,"x1055730738","RepLowenthal","Today is the 79th anniversary of #SocialSecurity, a crucial part of #SocialSafetyNet for many deserving Americans that we must protect!","Twitter Web Client",,,,FALSE,FALSE,1,2,"SocialSecurity SocialSafetyNet",,,,,,,,,,,,,,,"en",,,,,,,,,,,,,
"x497733595780620288",2014-08-08 13:18:31,"x1055730738","RepLowenthal","Design work on new mental health and community living facilities @ LB VA complex set to start. This is good news for our #veterans.","Twitter Web Client",,,,FALSE,FALSE,5,7,"veterans",,,,,,,,,,,,,,,"en",,,,,,,,,,,,,
"x496326580495728640",2014-08-04 16:07:32,"x1055730738","RepLowenthal","I have asked Sec's Kerry and Hagel to pressure Vietnam govt to refurbish unkept Bien Hoa cemetery—resting place of 16k So.Vietnam soldiers.","Twitter Web Client",,,,FALSE,FALSE,1,2,,,,,,,,,,,,,,,,"en",,,,,,,,,,,,,
"x494157063929749506",2014-07-29 16:26:39,"x1055730738","RepLowenthal","Happy 56th birthday to @NASA. Since its creation in 1958, NASA has greatly advanced technology in our daily lives. @NASASpinoff","Twitter Web Client",,,,FALSE,FALSE,1,2,,,,,,,,,,,,,,"x11348282 41147062","NASA NASAspinoff","en",,,,,,,,,,,,,
"x492303733720891392",2014-07-24 13:42:11,"x1055730738","RepLowenthal","It's 5 yrs since the minimum wage was raised. Now's the time. RT to support Dem plan to put #MiddleClassFirst &amp; #RaiseTheWage to $10.10/hr!","Twitter Web Client",,,,FALSE,FALSE,3,16,"MiddleClassFirst RaiseTheWage",,,,,,,,,,,,,,,"en",,,,,,,,,,,,,
"x491578562835910657",2014-07-22 13:40:37,"x1055730738","RepLowenthal","Today marks #100Days since the Nigerian schoolgirls' kidnapping. RT if you care. #BringBackOurGirls #JoinRepWilson","Twitter Web Client",,,,FALSE,FALSE,1,7,"100Days BringBackOurGirls JoinRepWilson",,,,,,,,,,,,,,,"en",,,,,,,,,,,,,
"x491345650463031296",2014-07-21 22:15:06,"x1055730738","RepLowenthal","#MH17 tragedy in #Ukraine: it is becoming apparent that innocent lives were lost for ambitions of reckless few—all tied to #Moscow","Twitter Web Client",,,,FALSE,FALSE,1,1,"MH17 Ukraine Moscow",,,,,,,,,,,,,,,"en",,,,,,,,,,,,,
"x490131154331529216",2014-07-18 13:49:08,"x1055730738","RepLowenthal","Off to #detroit for #netroots 2014.","Twitter Lite",,,,FALSE,FALSE,0,0,"detroit netroots",,,,,,,,,,,,,,,"en",,,,,,,,,,,,,
"x489825483576856577",2014-07-17 17:34:30,"x1055730738","RepLowenthal","Whatever details of the MH17 tragedy develop, we must always keep the victims and their families in our hearts.","Twitter Web Client",,,,FALSE,FALSE,3,0,,,,,,,,,,,,,,,,"en",,,,,,,,,,,,,
"x486506363955474432",2014-07-08 13:45:30,"x1055730738","RepLowenthal","Exactly! RT @RepJerryNadler  Things better than @SpeakerBoehner's silly lawsuit: #ImmigrationReform #RaiseTheWage #RebuildAmerica #RenewUI","Twitter Web Client",,,,FALSE,FALSE,10,19,"ImmigrationReform RaiseTheWage RebuildAmerica RenewUI",,,,,,,,,,,,,"x40302336 7713202","RepJerryNadler SpeakerBoehner","en",,,,,,,,,,,,,
"x486170467301330944",2014-07-07 15:30:46,"x1055730738","RepLowenthal","Yes! RT @RepGaramendi  Pres Ike’s Interstate Highway System just turned 58. Let’s renew the Hwy Trust Fund, create jobs, &amp; #RebuildAmerica.","Twitter Web Client",,,,FALSE,FALSE,0,0,"RebuildAmerica",,,,,,,,,,,,,"x88806753","RepGaramendi","en",,,,,,,,,,,,,
"x484077274762055680",2014-07-01 20:53:10,"x1055730738","RepLowenthal","Go, Team USA! #USMNT #FIFA #WorldCup #USAvsBEL","Twitter Web Client",,,,FALSE,FALSE,1,1,"USMNT FIFA WorldCup USAvsBEL",,,,,,,,,,,,,,,"pt",,,,,,,,,,,,,
"x483694893727219712",2014-06-30 19:33:43,"x1055730738","RepLowenthal","#SCOTUS rules to give more 'rights' to companies, at the expense of actual rights for women #HobbyLobby #jointhedissent","Twitter Web Client",,,,FALSE,FALSE,1,5,"SCOTUS HobbyLobby jointhedissent",,,,,,,,,,,,,,,"en",,,,,,,,,,,,,
"x481993253063913472",2014-06-26 02:52:01,"x1055730738","RepLowenthal","Best of luck to Team USA in their match against Germany tomorrow! #USMNT #FIFA #WorldCup","TweetDeck",,,,FALSE,FALSE,0,2,"USMNT FIFA WorldCup",,,,,,,,,,,,,,,"en",,,,,,,,,,,,,
"x479744531819421697",2014-06-19 21:56:24,"x1055730738","RepLowenthal","Met w/Cambodian Commerce Minister Sun Chanthol to discuss trade issues and improving human rights in Cambodia. @USEmbPhnomPenh","Twitter Web Client",,,,FALSE,FALSE,0,0,,,,,,,,,,,,,,"x167992419","USEmbPhnomPenh","en",,,,,,,,,,,,,
"x478682952126054400",2014-06-16 23:38:03,"x1055730738","RepLowenthal","EO on #LGBT discrimination by #POTUS will be a huge step forward. Congress must now #PassENDA to begin to close this chapter of inequality.","TweetDeck",,,,FALSE,FALSE,1,2,"LGBT POTUS PassENDA",,,,,,,,,,,,,,,"en",,,,,,,,,,,,,
"x478637113299451904",2014-06-16 20:35:55,"x1055730738","RepLowenthal","#POTUS at @UCIrvine: Some in Congress “stubbornly &amp; automatically reject the scientific evidence about climate change.” It’s unfortunate.","Twitter Web Client",,,,FALSE,FALSE,0,3,"POTUS",,,,,,,,,,,,,"x19669207","UCIrvine","en",,,,,,,,,,,,,
"x478205588698955776",2014-06-15 16:01:11,"x1055730738","RepLowenthal","Happy Father’s Day to every father out there!","TweetDeck",,,,FALSE,FALSE,0,1,,,,,,,,,,,,,,,,"en",,,,,,,,,,,,,
"x476733132843270145",2014-06-11 14:30:10,"x1055730738","RepLowenthal","Congratulations to #Israel’s President-elect Reuven Rivlin. I look forward to working with you!","Twitter Web Client",,,,FALSE,FALSE,1,0,"Israel",,,,,,,,,,,,,,,"en",,,,,,,,,,,,,
"x473897420867108865",2014-06-03 18:42:04,"x1055730738","RepLowenthal","We must honor and respect the diversity of all Americans. For often we find that our greatest strength is in our diversity. #LGBTPrideMonth","TweetDeck",,,,FALSE,FALSE,3,3,"LGBTPrideMonth",,,,,,,,,,,,,,,"en",,,,,,,,,,,,,
"x473486117065744384",2014-06-02 15:27:41,"x1055730738","RepLowenthal","With Congress unable to face climate reality, @WhiteHouse proposes decisive action to combat climate change. #ActOnClimate","Twitter for iPad",,,,FALSE,FALSE,7,10,"ActOnClimate",,,,,,,,,,,,,"x822215673812119553","WhiteHouse","en",,,,,,,,,,,,,
"x470981490239492097",2014-05-26 17:35:12,"x1055730738","RepLowenthal","This #MemorialDay we remember the fallen, reflect on the ideals they fought for, and remind ourselves of the debt we owe them.","TweetDeck",,,,FALSE,FALSE,4,4,"MemorialDay",,,,,,,,,,,,,,,"en",,,,,,,,,,,,,
"x466677049151991808",2014-05-14 20:30:53,"x1055730738","RepLowenthal","“Worst brush fire in the region in 20 years” contained this morning by one of the best fire departments in #California. Thank you, @LBFD.","TweetDeck",,,,FALSE,FALSE,1,1,"California",,,,,,,,,,,,,"x18952042","lbfd","en",,,,,,,,,,,,,
"x465920868011372545",2014-05-12 18:26:05,"x1055730738","RepLowenthal","Happy Birthday to @RepJaredPolis of #Colorado’s 2nd District!","TweetDeck",,,,FALSE,FALSE,2,0,"Colorado",,,,,,,,,,,,,"x463132556","RepJaredPolis","en",,,,,,,,,,,,,
"x465567281183862784",2014-05-11 19:01:04,"x1055730738","RepLowenthal","Happy Mother's Day to every mom, mum, and mommy!","TweetDeck",,,,FALSE,FALSE,1,1,,,,,,,,,,,,,,,,"en",,,,,,,,,,,,,
"x464061323953700865",2014-05-07 15:16:56,"x1055730738","RepLowenthal","Happy Birthday to @RepTedDeutch of #FL21!","TweetDeck",,,,FALSE,FALSE,1,0,"FL21",,,,,,,,,,,,,"x137794015","RepTedDeutch","en",,,,,,,,,,,,,
"x463778706360520704",2014-05-06 20:33:54,"x1055730738","RepLowenthal","On #YomHaatzmaut, 66 years since #Israel’s independence, our nation recognizes in Israel a long-lasting friendship that spans generations.","TweetDeck",,,,FALSE,FALSE,12,6,"YomHaatzmaut Israel",,,,,,,,,,,,,,,"en",,,,,,,,,,,,,
"x462283910022725632",2014-05-02 17:34:07,"x1055730738","RepLowenthal","50 months of job growth, #jobsreport shows strong progress. Now we must #raisethewage &amp; #renewui to build an economy that works for all.","Twitter Web Client",,,,FALSE,FALSE,4,3,"jobsreport raisethewage renewui",,,,,,,,,,,,,,,"en",,,,,,,,,,,,,
"x459786287554498561",2014-04-25 20:09:28,"x1055730738","RepLowenthal","Happy Birthday to my neighbor in Cannon, @KeithRothfus of #PA12!","Twitter Web Client",,,,FALSE,FALSE,0,1,"PA12",,,,,,,,,,,,,"x1155212191","KeithRothfus","en",,,,,,,,,,,,,
"x459405211208273920",2014-04-24 18:55:12,"x1055730738","RepLowenthal","Happy Birthday, @JackKingston of #GA1!","Twitter Web Client",,,,FALSE,FALSE,0,0,"GA1",,,,,,,,,,,,,"x36654245","JackKingston","en",,,,,,,,,,,,,
"x459079631736299521",2014-04-23 21:21:28,"x1055730738","RepLowenthal","Happy Birthday, @RepFredUpton!","TweetDeck",,,,FALSE,FALSE,0,0,,,,,,,,,,,,,,"x124224165","RepFredUpton","en",,,,,,,,,,,,,
"x456490971601973249",2014-04-16 17:55:03,"x1055730738","RepLowenthal","Happy Birthday, @RepJohnDelaney!","Twitter Web Client",,,,FALSE,FALSE,0,1,,,,,,,,,,,,,,"x937723303","RepJohnDelaney","en",,,,,,,,,,,,,
"x453599905014370306",2014-04-08 18:26:59,"x1055730738","RepLowenthal","51 years since Equal Pay Act, a woman still earns $0.77 for every $1 a man earns. Congress must pass #PaycheckFairnessAct. #NoMadMenPay","TweetDeck",,,,FALSE,FALSE,1,2,"PaycheckFairnessAct NoMadMenPay",,,,,,,,,,,,,,,"en",,,,,,,,,,,,,
"x451474500459057153",2014-04-02 21:41:23,"x1055730738","RepLowenthal","In McCutcheon vs. FEC decision, #SCOTUS ruled in favor of big money in politics. This is a serious blow to our democracy.","TweetDeck",,,,FALSE,FALSE,1,2,"SCOTUS",,,,,,,,,,,,,,,"en",,,,,,,,,,,,,
"x450682678090932224",2014-03-31 17:14:58,"x1055730738","RepLowenthal","Happy Birthday to #CA29’s @RepCardenas!","Twitter Web Client",,,,FALSE,FALSE,0,0,"CA29",,,,,,,,,,,,,"x1222257180","RepCardenas","en",,,,,,,,,,,,,
"x450326417251651584",2014-03-30 17:39:19,"x1055730738","RepLowenthal","Happy Birthday to my friend, colleague, and district neighbor @Rep_JaniceHahn of #CA44!","TweetDeck",,,,FALSE,FALSE,1,2,"CA44",,,,,,,,,,,,,"x809271061099532288","Rep_JaniceHahn","en",,,,,,,,,,,,,
"x449661021615960064",2014-03-28 21:35:16,"x1055730738","RepLowenthal","More than 6 million have signed up for health care through the state-based marketplaces. Sign up on @CoveredCA by 3/31! #GetCoveredNow","TweetDeck",,,,FALSE,FALSE,0,1,"GetCoveredNow",,,,,,,,,,,,,"x915514734","CoveredCA","en",,,,,,,,,,,,,
"x448575312977494017",2014-03-25 21:41:03,"x1055730738","RepLowenthal","#SCOTUS ruling on #HobbyLobby could set a dangerous precedent. Health care decisions should be made by a woman, not her boss.","Twitter Web Client",,,,FALSE,FALSE,1,2,"SCOTUS HobbyLobby",,,,,,,,,,,,,,,"en",,,,,,,,,,,,,
"x447779591801688065",2014-03-23 16:59:08,"x1055730738","RepLowenthal","Four years since #ACA became law: 3.1 million young adults have the security of coverage under their parents’ plan. #healthcare4all","TweetDeck",,,,FALSE,FALSE,7,23,"ACA healthcare4all",,,,,,,,,,,,,,,"en",,,,,,,,,,,,,
"x447779088485195776",2014-03-23 16:57:08,"x1055730738","RepLowenthal","Four years since #ACA became law: 7.9 million seniors have saved more than $9.9 billion on prescription drugs. #healthcare4all","TweetDeck",,,,FALSE,FALSE,3,20,"ACA healthcare4all",,,,,,,,,,,,,,,"en",,,,,,,,,,,,,
"x447778585084829699",2014-03-23 16:55:08,"x1055730738","RepLowenthal","Four years since #ACA became law: 105 million Americans have received access to free preventive services. #healthcare4all","TweetDeck",,,,FALSE,FALSE,0,3,"ACA healthcare4all",,,,,,,,,,,,,,,"en",,,,,,,,,,,,,
"x447778081814503425",2014-03-23 16:53:08,"x1055730738","RepLowenthal","Four years since #ACA became law: Being a woman is no longer a pre-existing condition. #healthcare4all","TweetDeck",,,,FALSE,FALSE,0,4,"ACA healthcare4all",,,,,,,,,,,,,,,"en",,,,,,,,,,,,,
"x444219659420966913",2014-03-13 21:13:14,"x1055730738","RepLowenthal","If bosses can refuse their employees' birth control, what benefits might they take away next? #NotMyBossBusiness","Twitter Web Client",,,,FALSE,FALSE,2,3,"NotMyBossBusiness",,,,,,,,,,,,,,,"en",,,,,,,,,,,,,
"x440926807106129920",2014-03-04 19:08:37,"x1055730738","RepLowenthal","Women must have equal economic opportunity, pay, &amp; representation to that of men. When women succeed, America succeeds. #womenshistorymonth","Twitter Web Client",,,,FALSE,FALSE,1,5,"womenshistorymonth",,,,,,,,,,,,,,,"en",,,,,,,,,,,,,
"x438819147535749123",2014-02-26 23:33:32,"x1055730738","RepLowenthal","4 million ppl are now enrolled in #ACA marketplaces, including +700,000 Californians in @CoveredCA who want coverage that fits their needs.","TweetDeck",,,,FALSE,FALSE,0,0,"ACA",,,,,,,,,,,,,"x915514734","CoveredCA","en",,,,,,,,,,,,,
"x438745410757087236",2014-02-26 18:40:32,"x1055730738","RepLowenthal","#Windpower employs 80k Americans across the country, including 7,000 Californians. Keep it up, @AWEA. #ActOnClimate","TweetDeck",,,,FALSE,FALSE,0,2,"Windpower ActOnClimate",,,,,,,,,,,,,"x22271644","AWEA","en",,,,,,,,,,,,,
"x436662147603369984",2014-02-21 00:42:23,"x1055730738","RepLowenthal","What do you think the House of Representatives should focus on when they get back to Capitol Hill from the district work period?","TweetDeck",,,,FALSE,FALSE,0,2,,,,,,,,,,,,,,,,"en",,,,,,,,,,,,,
"x433360577197387776",2014-02-11 22:03:07,"x1055730738","RepLowenthal",".@SpeakerBoehner has allowed a clean vote on raising the debt ceiling. No riders, no strings attached. I look forward to voting “yes.”","Twitter Web Client",,,,FALSE,FALSE,1,0,,,,,,,,,,,,,,"x7713202","SpeakerBoehner","en",,,,,,,,,,,,,
"x431950519645380609",2014-02-08 00:40:03,"x1055730738","RepLowenthal","Unemployment at 6.6% + 113,000 new jobs = 4 years of consecutive job growth &amp; lowest unemployment in 5 years. Congress' work is not done.","TweetDeck",,,,FALSE,FALSE,3,3,,,,,,,,,,,,,,,,"en",,,,,,,,,,,,,
"x431910586964647936",2014-02-07 22:01:23,"x1055730738","RepLowenthal","#Sochi will host almost 2,900 athletes in 15 disciplines. Today was the Opening Ceremony, &amp; I wish all of #TeamUSA the best of luck!","Twitter Web Client",,,,FALSE,FALSE,0,0,"Sochi TeamUSA",,,,,,,,,,,,,,,"en",,,,,,,,,,,,,
"x431216418424492032",2014-02-06 00:03:00,"x1055730738","RepLowenthal","Tomorrow, the Senate is expected to vote on a 3-month extension to #RenewUI. We cannot not leave millions of Americans behind.","TweetDeck",,,,FALSE,FALSE,6,15,"RenewUI",,,,,,,,,,,,,,,"en",,,,,,,,,,,,,
"x430825585640615936",2014-02-04 22:09:58,"x1055730738","RepLowenthal","Doing something about #climatechange is no longer an option. It is a matter of survival. #ActOnClimate @SEEC","TweetDeck",,,,FALSE,FALSE,2,2,"climatechange ActOnClimate",,,,,,,,,,,,,"x29205600","SEEC","en",,,,,,,,,,,,,
