"status_id","created_at","user_id","screen_name","text","source","reply_to_status_id","reply_to_user_id","reply_to_screen_name","is_quote","is_retweet","favorite_count","retweet_count","hashtags","symbols","urls_url","urls_t.co","urls_expanded_url","media_url","media_t.co","media_expanded_url","media_type","ext_media_url","ext_media_t.co","ext_media_expanded_url","ext_media_type","mentions_user_id","mentions_screen_name","lang","quoted_status_id","quoted_text","retweet_status_id","retweet_text","place_url","place_name","place_full_name","place_type","country","country_code","geo_coords","coords_coords","bbox_coords"
"x963869925281583105",2018-02-14 20:17:52,"x818713465653051392","RepDarrenSoto","Just informed of shooting in Marjory Stoneman Douglas High School in Parkland, Fla. I’m monitoring @browardsheriff for updates on this horrible situation. Hoping for the safety of everyone.","Twitter for iPhone",,,,FALSE,FALSE,20,5,,,,,,,,,,,,,,"x58488799","browardsheriff","en",,,,,,,,,,,,,
"x931214768484114435",2017-11-16 17:37:56,"x818713465653051392","RepDarrenSoto","We need a tax plan that benefits all Americans! Not a #GOPTaxScam that burdens middle class families by stripping away their health care and offering tax giveaways to the top 1 percent. Join me in the fight to defeat it! @USProgressives","Twitter Web Client",,,,FALSE,FALSE,75,43,"GOPTaxScam",,,,,,,,,,,,,"x246088673","USProgressives","en",,,,,,,,,,,,,
"x921485041548578822",2017-10-20 21:15:28,"x818713465653051392","RepDarrenSoto","Ending cost-sharing reduction payments will leave hard-working Americans w/ few protections &amp; little coverage. Shameful! #ProtectOurCare","Twitter Web Client",,,,FALSE,FALSE,9,7,"ProtectOurCare",,,,,,,,,,,,,,,"en",,,,,,,,,,,,,
"x920045147290832896",2017-10-16 21:53:51,"x818713465653051392","RepDarrenSoto","To close out #HispanicHeritageMonth join me in recognizing Hispanic leaders in Central Florida and their contributions to our community ...","Twitter Web Client",,,,FALSE,FALSE,21,3,"HispanicHeritageMonth",,,,,,,,,,,,,,,"en",,,,,,,,,,,,,
"x918503527898669057",2017-10-12 15:48:00,"x818713465653051392","RepDarrenSoto","Americans want #TaxReform that puts the middle class first, not more deficit-exploding tax cuts for billionaires. #NotOnePenny","Twitter Web Client",,,,FALSE,FALSE,63,34,"TaxReform NotOnePenny",,,,,,,,,,,,,,,"en",,,,,,,,,,,,,
"x916347719043645440",2017-10-06 17:01:35,"x818713465653051392","RepDarrenSoto","Our nation comes together during crises. #PuertoRico &amp; #USVI should be no different. We must stand with #OurFellowAmericans as they recover.","Twitter Web Client",,,,FALSE,FALSE,25,14,"PuertoRico USVI OurFellowAmericans",,,,,,,,,,,,,,,"en",,,,,,,,,,,,,
"x914625022223937536",2017-10-01 22:56:12,"x818713465653051392","RepDarrenSoto","Met w Gov @ricardorossello &amp; Sen Prez @trschatz51 about devastation, need for @fema pkg &amp; #PuertoRicoRelief @MSNBC @CNN @FoxNews #flapol","Twitter for iPhone",,,,FALSE,FALSE,15,8,"PuertoRicoRelief flapol",,,,,,,,,,,,,"x80013913 390197006 16669075 2836421 759251 1367531","ricardorossello trschatz51 fema MSNBC CNN FoxNews","en",,,,,,,,,,,,,
"x913093716344229889",2017-09-27 17:31:21,"x818713465653051392","RepDarrenSoto","The collapse of #Trumpcare is a testament to the power of American families telling their Congress to #ProtectOurCare","Twitter for iPhone",,,,FALSE,FALSE,15,3,"Trumpcare ProtectOurCare",,,,,,,,,,,,,,,"en",,,,,"https://api.twitter.com/1.1/geo/id/01fbe706f872cb32.json","Washington","Washington, DC","city","United States","US",,,"-77.119401 -76.909396 -76.909396 -77.119401 38.801826 38.801826 38.9953797 38.9953797"
"x908796743034261505",2017-09-15 20:56:42,"x818713465653051392","RepDarrenSoto","911-Immediate safety threat
311-Debris, flooding, non-emergency safety threat
211-Food/housing issues/unemployment #IrmaRecovery #Irma","Twitter for iPhone",,,,FALSE,FALSE,7,6,"IrmaRecovery Irma",,,,,,,,,,,,,,,"en",,,,,,,,,,,,,
"x899807442976088064",2017-08-22 01:36:26,"x818713465653051392","RepDarrenSoto","Trump's vision of endless war in Afganistan with more troops will not make America great again #sayfie #flapol @orlpolitics @HispanicCaucus","Twitter for iPhone",,,,FALSE,FALSE,19,5,"sayfie flapol",,,,,,,,,,,,,"x326777538 33530012","orlpolitics HispanicCaucus","en",,,,,,,,,,,,,
"x892871474729627652",2017-08-02 22:15:22,"x818713465653051392","RepDarrenSoto","RAISE Act goes against American values. Slashing legal #immigration would unjustly tear families apart and simply hurt the American economy.","Twitter Web Client",,,,FALSE,FALSE,102,57,"immigration",,,,,,,,,,,,,,,"en",,,,,,,,,,,,,
"x890256043003060224",2017-07-26 17:02:35,"x818713465653051392","RepDarrenSoto","Rather than sensationalizing division, we should focus on our troops &amp; taking care of our veterans when they return home #ProtectTransTroops","Twitter Web Client",,,,FALSE,FALSE,280,100,"ProtectTransTroops",,,,,,,,,,,,,,,"en",,,,,,,,,,,,,
"x887799416907866112",2017-07-19 22:20:50,"x818713465653051392","RepDarrenSoto","New #CBO score estimates that 32 MILLION Americans will be uninsured by 2026 if we repeal the ACA. Repealing will only hurt Americans!","Twitter for iPhone",,,,FALSE,FALSE,10,6,"CBO",,,,,,,,,,,,,,,"en",,,,,"https://api.twitter.com/1.1/geo/id/d6819fe60643ebc1.json","Alexandria","Alexandria, VA","city","United States","US",,,"-77.144435 -77.037304 -77.037304 -77.144435 38.789907 38.789907 38.8448531 38.8448531"
"x887770483449638914",2017-07-19 20:25:51,"x818713465653051392","RepDarrenSoto","We must #defendDACA because students shouldn't need to worry about being torn away from their families and communities. #HereToStay","Twitter Web Client",,,,FALSE,FALSE,34,15,"defendDACA HereToStay",,,,,,,,,,,,,,,"en",,,,,,,,,,,,,
"x885620743584833536",2017-07-13 22:03:33,"x818713465653051392","RepDarrenSoto","Our students deserve #TitleIX! The voices of sexual assault victims should not be silenced and our students should be protected.","Twitter Web Client",,,,FALSE,FALSE,11,6,"TitleIX",,,,,,,,,,,,,,,"en",,,,,,,,,,,,,
"x880497863528255488",2017-06-29 18:47:04,"x818713465653051392","RepDarrenSoto","An overwhelming 89% of Latinos support protecting our nat'l monuments #MonumentsForAll #LatinosForHeritage #CastillodeSanMarcos","Twitter Web Client",,,,FALSE,FALSE,32,11,"MonumentsForAll LatinosForHeritage CastillodeSanMarcos",,,,,,,,,,,,,,,"en",,,,,,,,,,,,,
"x880488445583478789",2017-06-29 18:09:38,"x818713465653051392","RepDarrenSoto","National monuments have been protected by 16 presidents since 1906. Protecting our natural history is NOT debatable! #MonumentsForAll","Twitter Web Client",,,,FALSE,FALSE,84,46,"MonumentsForAll",,,,,,,,,,,,,,,"en",,,,,,,,,,,,,
"x879817223296167936",2017-06-27 21:42:26,"x818713465653051392","RepDarrenSoto","#PTSDAwarenessDay SPOTLIGHT: This month we helped secure $3M in funding for @UCF RESTORES Clinic. Here are 3 reasons why it’s SO important:","Twitter Web Client",,,,FALSE,FALSE,22,11,"PTSDAwarenessDay",,,,,,,,,,,,,"x18999501","UCF","en",,,,,,,,,,,,,
"x877992162704723968",2017-06-22 20:50:18,"x818713465653051392","RepDarrenSoto","I've proudly co-sponsored the Voting Rights Advancement Act because your voice should not be silenced. We must speak up &amp; #RestoreTheVote!","Twitter Web Client",,,,FALSE,FALSE,40,30,"RestoreTheVote",,,,,,,,,,,,,,,"en",,,,,,,,,,,,,
"x876935927473614848",2017-06-19 22:53:12,"x818713465653051392","RepDarrenSoto","On #Juneteenth, we celebrate emancipation &amp; recommit to equal opportunity for all! #Sayfie #fdp #flapol @NAACP @OfficialCBC @HispanicCaucus","Twitter for iPhone",,,,FALSE,FALSE,26,12,"Juneteenth Sayfie fdp flapol",,,,,,,,,,,,,"x44988185 233783568 33530012","NAACP OfficialCBC HispanicCaucus","en",,,,,,,,,,,,,
"x874967665651191808",2017-06-14 12:32:02,"x818713465653051392","RepDarrenSoto","There is no place for violence in our politics. We all join in condemning the attack on @HouseGOP. #sayfie #fdp @HispanicCaucus #FlaPol","Twitter for iPhone",,,,FALSE,FALSE,65,35,"sayfie fdp FlaPol",,,,,,,,,,,,,"x15207668 33530012","HouseGOP HispanicCaucus","en",,,,,,,,,,,,,
"x871747756662108160",2017-06-05 15:17:16,"x818713465653051392","RepDarrenSoto","Our thoughts &amp; prayers are with the victims of #ForsythShooting. I encourage public to support law enforcement investigation #Sayfie #FlaPol","Twitter for iPhone",,,,FALSE,FALSE,22,8,"ForsythShooting Sayfie FlaPol",,,,,,,,,,,,,,,"en",,,,,,,,,,,,,
"x866819318952198149",2017-05-23 00:53:25,"x818713465653051392","RepDarrenSoto","Solidario con #Manchester esta noche. Mis condolencias y plegarias para todos aquellos que perdieron a un ser querido en esta tragedia. 🙏🏽","Twitter for iPhone",,,,FALSE,FALSE,10,6,"Manchester",,,,,,,,,,,,,,,"es",,,,,,,,,,,,,
"x866818067610947584",2017-05-23 00:48:26,"x818713465653051392","RepDarrenSoto","Standing with the people of #Manchester our prayers and condolences go to those who lost a loved one during this tragedy 🙏🏽","Twitter for iPhone",,,,FALSE,FALSE,31,17,"Manchester",,,,,,,,,,,,,,,"en",,,,,,,,,,,,,
"x866765735619592193",2017-05-22 21:20:29,"x818713465653051392","RepDarrenSoto","Welcome to Twitter, House Small Business Cmte Dems! Follow @HouseSBCDems to see how #Democrats' policies promote entrepreneurship. #SmallBiz","Twitter Web Client",,,,FALSE,FALSE,6,0,"Democrats SmallBiz",,,,,,,,,,,,,"x861611548250394624","HouseSBCDems","en",,,,,,,,,,,,,
"x865600545158987780",2017-05-19 16:10:26,"x818713465653051392","RepDarrenSoto","Haitians are valued members of CFL community &amp; I wrote @DHSgov Sec Kelly this wk asking him to #SaveTPS while #Haiti rebuilds. #FDP #sayfie","Twitter Web Client",,,,FALSE,FALSE,20,7,"SaveTPS Haiti FDP sayfie",,,,,,,,,,,,,"x15647676","DHSgov","en",,,,,,,,,,,,,
"x865311599564918784",2017-05-18 21:02:16,"x818713465653051392","RepDarrenSoto","#SpecialProsecutor catches criminals. Solutions-driven #IndependentCommission helps stop future election hacks. We need both! #sayfie #FDP","Twitter Web Client",,,,FALSE,FALSE,240,144,"SpecialProsecutor IndependentCommission sayfie FDP",,,,,,,,,,,,,,,"en",,,,,,,,,,,,,
"x864180095048658944",2017-05-15 18:06:05,"x818713465653051392","RepDarrenSoto","In FL we care about the #environment make your voices heard tonight at #ClimateChange #ProtectTheEnvironment Town Hall #Sayfie @FlaPol","Twitter for iPhone",,,,FALSE,FALSE,13,3,"environment ClimateChange ProtectTheEnvironment Sayfie",,,,,,,,,,,,,"x41517357","flapol","en",,,,,,,,,,,,,
"x862398967086067712",2017-05-10 20:08:31,"x818713465653051392","RepDarrenSoto",".@SpeakerRyan, time to bring @RepSwalwell, @RepCummings' Protecting Our Democracy Act to a vote. #FollowTheFacts #IndependentCommissionNOW","Twitter Web Client",,,,FALSE,FALSE,11,1,"FollowTheFacts IndependentCommissionNOW",,,,,,,,,,,,,"x18916432 942156122 787373558","SpeakerRyan RepSwalwell RepCummings","en",,,,,,,,,,,,,
"x862310481243111425",2017-05-10 14:16:54,"x818713465653051392","RepDarrenSoto","#Trump &amp; #BananaRepublicans are destroying our democracy. Need #IndependentProsecutor to investigate #RussianHacking #ComeyGate. #Sayfie","Twitter Web Client",,,,FALSE,FALSE,59,28,"Trump BananaRepublicans IndependentProsecutor RussianHacking ComeyGate Sayfie",,,,,,,,,,,,,,,"en",,,,,,,,,,,,,
"x860552012362117120",2017-05-05 17:49:22,"x818713465653051392","RepDarrenSoto","Separation of church and state strengthens both. #Trump's so-called #religiousliberty Executive Order weakens both.","Twitter Web Client",,,,FALSE,FALSE,13,4,"Trump religiousliberty",,,,,,,,,,,,,,,"en",,,,,,,,,,,,,
"x859829932633071621",2017-05-03 18:00:05,"x818713465653051392","RepDarrenSoto","Today's Trumpcare changes fix nothing. It still means higher costs and less care for 24+ million working families. #ProtectOurCare","Twitter Web Client",,,,FALSE,FALSE,10,6,"ProtectOurCare",,,,,,,,,,,,,,,"en",,,,,,,,,,,,,
"x856867069006159873",2017-04-25 13:46:43,"x818713465653051392","RepDarrenSoto","Young people deserve the chance to start businesses w/ peace of mind. #TrumpCare’s millennial tax is nothing short of cruel #ProtectOurCare","Twitter Web Client",,,,FALSE,FALSE,9,2,"TrumpCare ProtectOurCare",,,,,,,,,,,,,,,"en",,,,,,,,,,,,,
"x851869886909493248",2017-04-11 18:49:42,"x818713465653051392","RepDarrenSoto","#ThisDayInHistory @NASAKennedy launched #Apollo13 from sunny Florida. Proud!","Twitter Web Client",,,,FALSE,FALSE,6,3,"ThisDayInHistory Apollo13",,,,,,,,,,,,,"x16580226","NASAKennedy","en",,,,,,,,,,,,,
"x846066740786335748",2017-03-26 18:30:04,"x818713465653051392","RepDarrenSoto","Happy Birthday to our fearless leader @NancyPelosi Wishing you a wonderful day!! @HouseNewDems @HouseDemocrats #Sayfie","Twitter for iPhone",,,,FALSE,FALSE,11,4,"Sayfie",,,,,,,,,,,,,"x15764644 761783018 43963249","NancyPelosi HouseNewDems HouseDemocrats","en",,,,,,,,,,,,,
"x845358400808587264",2017-03-24 19:35:23,"x818713465653051392","RepDarrenSoto","#Trumpcare postponed again today YES WE CAN!!! #sayfie @HispanicCaucus @HouseDemocrats @HouseNewDems #fdp #flapol #resist @BarackObama","Twitter for iPhone",,,,FALSE,FALSE,17,7,"Trumpcare sayfie fdp flapol resist",,,,,,,,,,,,,"x33530012 43963249 761783018 813286","HispanicCaucus HouseDemocrats HouseNewDems BarackObama","en",,,,,,,,,,,,,
"x844966152803667969",2017-03-23 17:36:44,"x818713465653051392","RepDarrenSoto","#TrumpCare le quitará cobertura médica a muchos de los 4 millones de adultos y 600,000+ niños Latinos que obtuvieron cobertura con #ACA","Twitter for iPhone",,,,FALSE,FALSE,3,2,"TrumpCare ACA",,,,,,,,,,,,,,,"es",,,,,,,,,,,,,
"x844966053440565248",2017-03-23 17:36:20,"x818713465653051392","RepDarrenSoto","TrumpCare would take coverage away from many of the 4 million Latino adults &amp; 600,000 + Latino children who gained health care under #ACA","Twitter for iPhone",,,,FALSE,FALSE,4,3,"ACA",,,,,,,,,,,,,,,"en",,,,,,,,,,,,,
"x844638237251588096",2017-03-22 19:53:43,"x818713465653051392","RepDarrenSoto","#TrumpCare is opposed by Dems, many Republicans,hospitals, doctors &amp; patients advocates because it would force Americans to #PayMoreForLess","Twitter Web Client",,,,FALSE,FALSE,14,6,"TrumpCare PayMoreForLess",,,,,,,,,,,,,,,"en",,,,,,,,,,,,,
"x839114100340887552",2017-03-07 14:02:46,"x818713465653051392","RepDarrenSoto","Now we know why @GOP hid bill: less coverage 4 working families, more giveaways to top 0.1% @housedemocrats #sayfie #fdp @HispanicCaucus","Twitter for iPhone",,,,FALSE,FALSE,28,24,"sayfie fdp",,,,,,,,,,,,,"x11134252 43963249 33530012","GOP HouseDemocrats HispanicCaucus","en",,,,,,,,,,,,,
"x835190854742654977",2017-02-24 18:13:11,"x818713465653051392","RepDarrenSoto","TODAY at 3PM: Rapid Response meeting w comm' leaders to address @realDonaldTrump latest attacks on #LGBTQ youth #TransKids #FlaPol #Sayfie","Twitter for iPhone",,,,FALSE,FALSE,7,1,"LGBTQ TransKids FlaPol Sayfie",,,,,,,,,,,,,"x25073877","realDonaldTrump","en",,,,,,,,,,,,,
"x831225650677764096",2017-02-13 19:36:53,"x818713465653051392","RepDarrenSoto","Proud to announce I have been appointed @HouseDemocrats Steering &amp; Policy Committee. The fight is on! #USD09 @HouseNewDems @FlaDems #Sayfie","Twitter for iPhone",,,,FALSE,FALSE,26,5,"USD09 Sayfie",,,,,,,,,,,,,"x43963249 761783018 76027332","HouseDemocrats HouseNewDems FlaDems","en",,,,,,,,,,,,,
"x827659699818475525",2017-02-03 23:27:04,"x818713465653051392","RepDarrenSoto","#ACAworks for our Latino community. Don’t miss @NancyPelosi on @UniNoticias at 11:30 p.m. ET talking about the fight to protect it!","Twitter for iPhone",,,,FALSE,FALSE,7,1,"ACAworks",,,,,,,,,,,,,"x15764644 35785401","NancyPelosi UniNoticias","en",,,,,,,,,,,,,
"x825072875052924930",2017-01-27 20:07:57,"x818713465653051392","RepDarrenSoto","#RestInPower Rep. Robert García. You were a trailblazer for our communidad! Your legacy will live on! @HispanicCaucus #Sayfie #fla_pol","Twitter for iPhone",,,,FALSE,FALSE,4,2,"RestInPower Sayfie fla_pol",,,,,,,,,,,,,"x33530012","HispanicCaucus","en",,,,,,,,,,,,,
"x824332083812323330",2017-01-25 19:04:18,"x818713465653051392","RepDarrenSoto","Law enforcement in sanctuary cities believes in community policing. Trump wants to cut funds that keep those communities safe. #NoBanNoWall","Twitter Web Client",,,,FALSE,FALSE,7,6,"NoBanNoWall",,,,,,,,,,,,,,,"en",,,,,,,,,,,,,
"x824331856380383233",2017-01-25 19:03:24,"x818713465653051392","RepDarrenSoto","Law enforcement officers in sanctuary cities choose to arrest dangerous criminals &amp; protect the public. Trump doesn’t trust their judgment.","Twitter Web Client",,,,FALSE,FALSE,11,4,,,,,,,,,,,,,,,,"en",,,,,,,,,,,,,
"x824331665724100613",2017-01-25 19:02:39,"x818713465653051392","RepDarrenSoto","Trump’s executive orders are an attack on all immigrant communities. We stand united against anti-immigrant policies. #NoBanNoWall","Twitter Web Client",,,,FALSE,FALSE,28,11,"NoBanNoWall",,,,,,,,,,,,,,,"en",,,,,,,,,,,,,
"x824331467752960002",2017-01-25 19:01:51,"x818713465653051392","RepDarrenSoto","America was founded on principles of religious freedom. Targeting Muslim immigrants sets a dangerous precedent. #NoBanNoWall","Twitter Web Client",,,,FALSE,FALSE,13,5,"NoBanNoWall",,,,,,,,,,,,,,,"en",,,,,,,,,,,,,
"x824331278413664257",2017-01-25 19:01:06,"x818713465653051392","RepDarrenSoto","Border communities know a #WallofHate is a bad investment. Passing immigration reform is the best way to fix our system. #NoBanNoWall","Twitter Web Client",,,,FALSE,FALSE,12,8,"WallofHate NoBanNoWall",,,,,,,,,,,,,,,"en",,,,,,,,,,,,,
"x824331107160178688",2017-01-25 19:00:25,"x818713465653051392","RepDarrenSoto","A border wall is a $25 billion symbol of hate and fear. #NoBanNoWall","Twitter Web Client",,,,FALSE,FALSE,15,3,"NoBanNoWall",,,,,,,,,,,,,,,"en",,,,,,,,,,,,,
"x824331004924067840",2017-01-25 19:00:01,"x818713465653051392","RepDarrenSoto","Immigration reform would create $700 billion in economic growth for our economy. A #WallofHate is bad economics. #NoBanNoWall","Twitter Web Client",,,,FALSE,FALSE,14,4,"WallofHate NoBanNoWall",,,,,,,,,,,,,,,"en",,,,,,,,,,,,,
"x823995414043095040",2017-01-24 20:46:30,"x818713465653051392","RepDarrenSoto","Just appointed to Native Amer Lands, Energy, &amp; Oversight subcommittees to fight for enviro &amp; PROMESA justice! @FCVoters @impreMedia #sayfie","Twitter for iPhone",,,,FALSE,FALSE,21,7,"sayfie",,,,,,,,,,,,,"x625221746 54286057","FCVoters impreMedia","en",,,,,,,,,,,,,
"x823605776870756354",2017-01-23 18:58:13,"x818713465653051392","RepDarrenSoto","Our prayers go out to the young boy from Auburndale we lost to apparent gun accident &amp; his family #sayfie @theledger #fdp @HispanicCaucus","Twitter for iPhone",,,,FALSE,FALSE,23,5,"sayfie fdp",,,,,,,,,,,,,"x16233017 33530012","theledger HispanicCaucus","en",,,,,,,,,,,,,
"x822608718189785091",2017-01-21 00:56:16,"x818713465653051392","RepDarrenSoto","Colin Powell called immigrants the lifeblood of America. Trump calls them criminals. We must #StandAgainstHate #CHCtoTrump #TrumpInaugural","Twitter for iPhone",,,,FALSE,FALSE,22,8,"StandAgainstHate CHCtoTrump TrumpInaugural",,,,,,,,,,,,,,,"en",,,,,,,,,,,,,
"x822606570110468097",2017-01-21 00:47:44,"x818713465653051392","RepDarrenSoto","President Bush recognized the hard work and selflessness of immigrants. Compare his words to President Trump #CHCtoTrump #TrumpInaugural","Twitter for iPhone",,,,FALSE,FALSE,5,1,"CHCtoTrump TrumpInaugural",,,,,,,,,,,,,,,"en",,,,,,,,,,,,,
"x822605735251050496",2017-01-21 00:44:25,"x818713465653051392","RepDarrenSoto","#CHCtoTrump: We will stand up to anti-immigrant agenda and rhetoric &amp; do everything we can to defend hardworking immigrants #TrumpInaugural","Twitter for iPhone",,,,FALSE,FALSE,4,1,"CHCtoTrump TrumpInaugural",,,,,,,,,,,,,,,"en",,,,,,,,,,,,,
