"status_id","created_at","user_id","screen_name","text","source","reply_to_status_id","reply_to_user_id","reply_to_screen_name","is_quote","is_retweet","favorite_count","retweet_count","hashtags","symbols","urls_url","urls_t.co","urls_expanded_url","media_url","media_t.co","media_expanded_url","media_type","ext_media_url","ext_media_t.co","ext_media_expanded_url","ext_media_type","mentions_user_id","mentions_screen_name","lang","quoted_status_id","quoted_text","retweet_status_id","retweet_text","place_url","place_name","place_full_name","place_type","country","country_code","geo_coords","coords_coords","bbox_coords"
"x349256151361257472",2013-06-24 20:02:10,"x1382011333","USRepRodney","Key week ahead to prevent student loan interest rates from doubling. House has acted.  Senate/President need to step up! #DontDoubleMyRates","Twitter Web Client",,,,FALSE,FALSE,0,3,"DontDoubleMyRates",,,,,,,,,,,,,,,"en",,,,,,,,,,,,,
"x347825383485362176",2013-06-20 21:16:48,"x1382011333","USRepRodney","Honored to attend the 60th Anniversary Reception of the Mental Health Association of Morris County tonight!","Twitter Web Client",,,,FALSE,FALSE,0,0,,,,,,,,,,,,,,,,"en",,,,,,,,,,,,,
"x347397486991777792",2013-06-19 16:56:29,"x1382011333","USRepRodney","Just signed a letter urging Senate leadership to help prevent student loan rates from doubling July 1.  House has acted. #DontDoubleMyRate","Twitter Web Client",,,,FALSE,FALSE,0,1,"DontDoubleMyRate",,,,,,,,,,,,,,,"en",,,,,,,,,,,,,
"x347096761040515072",2013-06-18 21:01:31,"x1382011333","USRepRodney","I thank the Pancreatic Cancer Action Network for meeting with me to discuss cancer research and increasing funding for the #NIH!","Twitter Web Client",,,,FALSE,FALSE,1,2,"NIH",,,,,,,,,,,,,,,"en",,,,,,,,,,,,,
"x345706857299574784",2013-06-15 00:58:32,"x1382011333","USRepRodney","Great community event tonight at Montclair Art Museum! Had the opportunity to see some of their wonderful collections! Thank you!","Twitter Web Client",,,,FALSE,FALSE,1,1,,,,,,,,,,,,,,,,"en",,,,,,,,,,,,,
"x345548726758146048",2013-06-14 14:30:11,"x1382011333","USRepRodney","Happy Birthday @USArmy – the strength of the nation. Americans have relied on our great Army for 238 years! Thanks to military families too!","Twitter Web Client",,,,FALSE,FALSE,0,0,,,,,,,,,,,,,,"x8775672","USArmy","en",,,,,,,,,,,,,
"x344854894693474306",2013-06-12 16:33:08,"x1382011333","USRepRodney","#NorthJersey veterans and employers- use #VetJobsChat to join @USDOL &amp; VSO veterans employment twitter chat TODAY at 1:30pm","Twitter Web Client",,,,FALSE,FALSE,0,0,"NorthJersey VetJobsChat",,,,,,,,,,,,,"x20179628","USDOL","en",,,,,,,,,,,,,
"x344498894127898624",2013-06-11 16:58:31,"x1382011333","USRepRodney","Please visit my Wayne constituent service outreach office tomorrow from 9am-4pm at the Wayne Twp Municipal Complex! We’re here to help!","Twitter Web Client",,,,FALSE,FALSE,0,0,,,,,,,,,,,,,,,,"en",,,,,,,,,,,,,
"x344203311584518144",2013-06-10 21:23:59,"x1382011333","USRepRodney","Off to Picatinny Arsenal with my Youth Advisory Council to take a look at DOD's key R&amp;D facility and our local #NJ11 military site!","Twitter Web Client",,,,FALSE,FALSE,0,1,"NJ11",,,,,,,,,,,,,,,"en",,,,,,,,,,,,,
"x344161373615448065",2013-06-10 18:37:20,"x1382011333","USRepRodney","Congratulations to Bloomfield HS on their 2013 National School Change Award!","Twitter Web Client",,,,FALSE,FALSE,0,0,,,,,,,,,,,,,,,,"en",,,,,,,,,,,,,
"x343830816046059522",2013-06-09 20:43:49,"x1382011333","USRepRodney","Great bfast this AM with impressive scholar athletes at Livingston UNICO.   Then Wayne Day-hot and breezy with many families having fun!","Twitter Web Client",,,,FALSE,FALSE,0,0,,,,,,,,,,,,,,,,"en",,,,,,,,,,,,,
"x343422789631500288",2013-06-08 17:42:28,"x1382011333","USRepRodney","Had a great fish and chips dinner at Cedar Grove EMS last night!","Twitter Web Client",,,,FALSE,FALSE,0,0,,,,,,,,,,,,,,,,"en",,,,,,,,,,,,,
"x343075181243293697",2013-06-07 18:41:11,"x1382011333","USRepRodney","Exciting conversation this A.M. with Frelinghuysen Middle School 6th graders regarding government and civics!  Have a great summer everyone!","Twitter Web Client",,,,FALSE,FALSE,1,1,,,,,,,,,,,,,,,,"en",,,,,,,,,,,,,
"x342754733896900608",2013-06-06 21:27:51,"x1382011333","USRepRodney","Honored to speak at farewell event for President Francis Rafferty of the College of St. Elizabeth! Your dedication will be missed!","Twitter Web Client",,,,FALSE,FALSE,0,0,,,,,,,,,,,,,,,,"en",,,,,,,,,,,,,
"x342734826698321920",2013-06-06 20:08:45,"x1382011333","USRepRodney","Never forget the sacrifices of our men and women in uniform and their families as we remember the 69th Anniversary of #DDay","Twitter Web Client",,,,FALSE,FALSE,0,0,"DDay",,,,,,,,,,,,,,,"en",,,,,,,,,,,,,
"x341995824668082176",2013-06-04 19:12:13,"x1382011333","USRepRodney","Thank you for visiting the Capitol, Newark Academy Middle Schoolers! Enjoy your summer!","Twitter Web Client",,,,FALSE,FALSE,0,0,,,,,,,,,,,,,,,,"en",,,,,,,,,,,,,
"x341936924660998145",2013-06-04 15:18:10,"x1382011333","USRepRodney","Just met with the Rockaway Valley School from Boonton Twp before their Capitol Tour! Thanks for visiting and have a great summer!","Twitter Web Client",,,,FALSE,FALSE,0,1,,,,,,,,,,,,,,,,"en",,,,,,,,,,,,,
"x341564612816273409",2013-06-03 14:38:44,"x1382011333","USRepRodney","Thoughts and prayers to the family of Senator Frank Lautenberg.  New Jersey has lost a tremendous leader and public servant.","Twitter Web Client",,,,FALSE,FALSE,1,2,,,,,,,,,,,,,,,,"en",,,,,,,,,,,,,
"x340506303527014401",2013-05-31 16:33:23,"x1382011333","USRepRodney","Stopped by Anthony Wayne and George Washington Middle Schools in Wayne this AM. Great Q&amp;A with the students! Excellent visits! #NJ11Schools","Twitter Web Client",,,,FALSE,FALSE,0,1,"NJ11Schools",,,,,,,,,,,,,,,"en",,,,,,,,,,,,,
"x340132805319213057",2013-05-30 15:49:14,"x1382011333","USRepRodney","Just finished a great visit w/ students at Hanover Park HS. Now to Sussex County and Pope John XXIII Regional HS &amp; Ogdensburg Middle School!","Twitter Web Client",,,,FALSE,FALSE,1,1,,,,,,,,,,,,,,,,"en",,,,,,,,,,,,,
"x339816681373306880",2013-05-29 18:53:04,"x1382011333","USRepRodney","Former #NJ Governor Christie Whitman will attend my Congressional Youth Advisory Council tonight at the Morris County Library!","Twitter Web Client",,,,FALSE,FALSE,0,1,"NJ",,,,,,,,,,,,,,,"en",,,,,,,,,,,,,
"x339803458381164544",2013-05-29 18:00:32,"x1382011333","USRepRodney","Bloomfield High School’s AP Government Class offered a refreshing prospective on issues our nation faces!","Twitter Web Client",,,,FALSE,FALSE,0,0,,,,,,,,,,,,,,,,"en",,,,,,,,,,,,,
"x339486513500925952",2013-05-28 21:01:06,"x1382011333","USRepRodney","Attended a great discussion earlier w/ Morris Hills HS Environmental Action Club regarding nuclear energy potential and our nation's future!","Twitter Web Client",,,,FALSE,FALSE,0,0,,,,,,,,,,,,,,,,"en",,,,,,,,,,,,,
"x339471591136169985",2013-05-28 20:01:49,"x1382011333","USRepRodney","After a great visit with 8th graders from Memorial Middle School in Woodland Park I wish you all a happy graduation and safe summer!","Twitter Web Client",,,,FALSE,FALSE,0,0,,,,,,,,,,,,,,,,"en",,,,,,,,,,,,,
"x338043078713671680",2013-05-24 21:25:25,"x1382011333","USRepRodney","Remarkable Morris County Memorial ceremony today w/tributes to WW2, Korea, Vietnam vets. Posthumous honor to the late SGT Derek McConnell","Twitter Web Client",,,,FALSE,FALSE,0,0,,,,,,,,,,,,,,,,"en",,,,,,,,,,,,,
"x337941937048920064",2013-05-24 14:43:31,"x1382011333","USRepRodney","This weekend we remember and honor the men and women of our Armed Forces who made the supreme sacrifice and were last seen standing duty.","Twitter Web Client",,,,FALSE,FALSE,0,1,,,,,,,,,,,,,,,,"en",,,,,,,,,,,,,
"x337230312281108480",2013-05-22 15:35:46,"x1382011333","USRepRodney","Will vote today to ok #KeystonePipeline. Could move 830k barrels of oil/day from Canada and replace half what we import from Middle East!","Twitter Web Client",,,,FALSE,FALSE,0,0,"KeystonePipeline",,,,,,,,,,,,,,,"en",,,,,,,,,,,,,
"x336501056727048194",2013-05-20 15:17:58,"x1382011333","USRepRodney","Just left Denise Tighe's senior class at Butler High School. Great group of students headed for a bright future following #Graduation!","Twitter Web Client",,,,FALSE,FALSE,0,0,"Graduation",,,,,,,,,,,,,,,"en",,,,,,,,,,,,,
"x335555936141864960",2013-05-18 00:42:24,"x1382011333","USRepRodney","Stopped at Nutley's Relay for Life cancer event at Demuro Park.  Wonderful cause and over sixty families and groups honoring loved ones!","Twitter Web Client",,,,FALSE,FALSE,1,1,,,,,,,,,,,,,,,,"en",,,,,,,,,,,,,
"x335049832957882371",2013-05-16 15:11:19,"x1382011333","USRepRodney","Just voted to approve a new Homeland Security funding bill targeting bombing prevention, student visa overstays and helps First Reponders","Twitter Web Client",,,,FALSE,FALSE,0,0,,,,,,,,,,,,,,,,"en",,,,,,,,,,,,,
"x334043446845247490",2013-05-13 20:32:18,"x1382011333","USRepRodney","Excellent visit today with over 200 sixth graders at Schuyler-Colefax Middle School in Wayne! #GreatStudents  #GreatSchool","Twitter Web Client",,,,FALSE,FALSE,0,0,"GreatStudents GreatSchool",,,,,,,,,,,,,,,"en",,,,,,,,,,,,,
"x332161843604897793",2013-05-08 15:55:29,"x1382011333","USRepRodney","Pleased to welcome Park Geun-hye, President of South Korea, to Congress this morning. #GreatFriends #StrongAllies in #ROK for 60+ years!","Twitter Web Client",,,,FALSE,FALSE,0,0,"GreatFriends StrongAllies ROK",,,,,,,,,,,,,,,"en",,,,,,,,,,,,,
"x329334352074924033",2013-04-30 20:40:02,"x1382011333","USRepRodney","Great day today bringing a bona fide “Hurricane Hunter” to schools in Woodland Park, Wayne, Nutley and Verona. #ScienceInAction","Twitter Web Client",,,,FALSE,FALSE,0,1,"ScienceInAction",,,,,,,,,,,,,,,"en",,,,,,,,,,,,,
"x329238107163590658",2013-04-30 14:17:36,"x1382011333","USRepRodney","Academy Career Night last night a huge success as 150 people (70 students) learned more about applying to our fine military academies!","Twitter Web Client",,,,FALSE,FALSE,0,0,,,,,,,,,,,,,,,,"en",,,,,,,,,,,,,
"x328949796486402048",2013-04-29 19:11:57,"x1382011333","USRepRodney","Visited @MorrisChamberNJ  this morning where we had a great conversation about getting our economy moving!","Twitter Web Client",,,,FALSE,FALSE,0,1,,,,,,,,,,,,,,"x1132055449","MorrisChamberNJ","en",,,,,,,,,,,,,
"x328857279162089473",2013-04-29 13:04:19,"x1382011333","USRepRodney","Had a great time at Taste of Bloomfield at the Oakside Cultural Center Sunday afternoon! Great food! Great people!","Twitter Web Client",,,,FALSE,FALSE,0,0,,,,,,,,,,,,,,,,"en",,,,,,,,,,,,,
"x327828452474494976",2013-04-26 16:56:08,"x1382011333","USRepRodney","Just voted for legislation to end the air traffic control delays nationwide -- good news for the traveling public!","Twitter Web Client",,,,FALSE,FALSE,0,0,,,,,,,,,,,,,,,,"en",,,,,,,,,,,,,
