"status_id","created_at","user_id","screen_name","text","source","reply_to_status_id","reply_to_user_id","reply_to_screen_name","is_quote","is_retweet","favorite_count","retweet_count","hashtags","symbols","urls_url","urls_t.co","urls_expanded_url","media_url","media_t.co","media_expanded_url","media_type","ext_media_url","ext_media_t.co","ext_media_expanded_url","ext_media_type","mentions_user_id","mentions_screen_name","lang","quoted_status_id","quoted_text","retweet_status_id","retweet_text","place_url","place_name","place_full_name","place_type","country","country_code","geo_coords","coords_coords","bbox_coords"
"x960592538406150144",2018-02-05 19:14:42,"x161411080","gracenapolitano","As we recognize #FMLA25, it’s unacceptable that still just 15% of workers have paid family leave through their employers. Real #paidleavemeans access for all working people.","Twitter Web Client",,,,FALSE,FALSE,10,5,"FMLA25 paidleavemeans",,,,,,,,,,,,,,,"en",,,,,,,,,,,,,
"x956200225621848064",2018-01-24 16:21:13,"x161411080","gracenapolitano","We mourn with the families, classmates, and teachers of the two students who were killed and send prayers for healing to all who were injured yesterday in Benton, KY","Twitter Web Client",,,,FALSE,FALSE,5,6,,,,,,,,,,,,,,,,"en",,,,,,,,,,,,,
"x955588365293883392",2018-01-22 23:49:54,"x161411080","gracenapolitano","I voted NO on the 3-week government funding bill today because it provides no concrete solution to protect DREAMers—122 of whom lose their protections daily—and fails to meet the other critical needs of families in my district and across the country.","Twitter Web Client",,,,FALSE,FALSE,64,17,,,,,,,,,,,,,,,,"en",,,,,,,,,,,,,
"x954600727091048449",2018-01-20 06:25:23,"x161411080","gracenapolitano","Republicans spent all their time &amp; votes on tax breaks for corporations &amp; the wealthiest. Now, they have no energy to pass children’s health, #ProtectDREAMers, or pass a budget. #TrumpShutdown","Twitter for iPhone",,,,FALSE,FALSE,34,22,"ProtectDREAMers TrumpShutdown",,,,,,,,,,,,,,,"en",,,,,,,,,,,,,
"x916355033544851456",2017-10-06 17:30:39,"x161411080","gracenapolitano",".@POTUS' rollback of the #ACA's #birthcontrol mandate could make contraception unaffordable for countless women. #HandsOffMyBC","Twitter for iPhone",,,,FALSE,FALSE,23,12,"ACA birthcontrol HandsOffMyBC",,,,,,,,,,,,,"x822215679726100480","POTUS","en",,,,,,,,,,,,,
"x916346821449936896",2017-10-06 16:58:01,"x161411080","gracenapolitano","I stand w/ #OurFellowAmericans in #PuertoRico &amp; #USVI as they recover from storms-we must deploy every resource necessary to provide relief!","Twitter for iPhone",,,,FALSE,FALSE,11,6,"OurFellowAmericans PuertoRico USVI",,,,,,,,,,,,,,,"en",,,,,,,,,,,,,
"x910587612519419905",2017-09-20 19:32:59,"x161411080","gracenapolitano","Beyond celebration, #HispanicHeritageMonth must also be a time for action for DREAMers. We must pass a clean DREAM Act today! #HereToStay","Twitter Web Client",,,,FALSE,FALSE,10,6,"HispanicHeritageMonth HereToStay",,,,,,,,,,,,,,,"en",,,,,,,,,,,,,
"x908434075702169606",2017-09-14 20:55:36,"x161411080","gracenapolitano","We must permanently fund cost-sharing subsidies that help Americans afford critical care like doctor visits &amp; medications #ProtectOurCare","Twitter Web Client",,,,FALSE,FALSE,11,7,"ProtectOurCare",,,,,,,,,,,,,,,"en",,,,,,,,,,,,,
"x908433854008086530",2017-09-14 20:54:43,"x161411080","gracenapolitano","Fight to #ProtectOurCare not over. Trump Admin is still undermining #ACA by cutting outreach &amp; not committing to fund cost-sharing subsidies","Twitter Web Client",,,,FALSE,FALSE,5,1,"ProtectOurCare ACA",,,,,,,,,,,,,,,"en",,,,,,,,,,,,,
"x903334857983631360",2017-08-31 19:13:07,"x161411080","gracenapolitano","DREAMers have jobs, pay taxes, &amp; contribute fully to our nation’s economy. #DefendDACA","Twitter for iPhone",,,,FALSE,FALSE,257,114,"DefendDACA",,,,,,,,,,,,,,,"en",,,,,,,,,,,,,
"x903332552521515008",2017-08-31 19:03:58,"x161411080","gracenapolitano","DREAMers teach our children, care for our families &amp; serve the only nation they know &amp; love in uniform. We must stand w/ them &amp; #DefendDACA","Twitter for iPhone",,,,FALSE,FALSE,149,81,"DefendDACA",,,,,,,,,,,,,,,"en",,,,,,,,,,,,,
"x902590120238469122",2017-08-29 17:53:48,"x161411080","gracenapolitano","I proudly joined 120+ of my colleagues to send a letter to @POTUS, urging him to reconsider this baseless #TransBan","Twitter for iPhone",,,,FALSE,FALSE,39,11,"TransBan",,,,,,,,,,,,,"x822215679726100480","POTUS","en",,,,,,,,,,,,,
"x902589450387116032",2017-08-29 17:51:08,"x161411080","gracenapolitano","#TransTroops are currently ready to make the ultimate sacrifice in order to protect our country. They deserve respect and honor.","Twitter for iPhone",,,,FALSE,FALSE,32,16,"TransTroops",,,,,,,,,,,,,,,"en",,,,,,,,,,,,,
"x897523257536126977",2017-08-15 18:19:54,"x161411080","gracenapolitano","Right now, #DREAMers need us to stand w/ them. They're our neighbors, classmates &amp; service members. We stand w/ you. #DefendDACA #WithDACA","Twitter Web Client",,,,FALSE,FALSE,26,15,"DREAMers DefendDACA WithDACA",,,,,,,,,,,,,,,"en",,,,,,,,,,,,,
"x897521117509943300",2017-08-15 18:11:24,"x161411080","gracenapolitano","Thanks to Pres. Obama’s action, to date DACA has provided protection &amp; opportunities for nearly 800k immigrant youth in the U.S. #DefendDACA","Twitter Web Client",,,,FALSE,FALSE,11,3,"DefendDACA",,,,,,,,,,,,,,,"en",,,,,,,,,,,,,
"x897509890658365440",2017-08-15 17:26:47,"x161411080","gracenapolitano","5 years ago, thousands of DREAMers attended DACA application workshops across the country. They embody everything we stand for. #DefendDACA","Twitter for iPhone",,,,FALSE,FALSE,19,8,"DefendDACA",,,,,,,,,,,,,,,"en",,,,,,,,,,,,,
"x887727642463567872",2017-07-19 17:35:37,"x161411080","gracenapolitano","We won’t stand for families being torn apart by deportations. We must #defendDACA! #HereToStay","Twitter for iPhone",,,,FALSE,FALSE,15,5,"defendDACA HereToStay",,,,,,,,,,,,,,,"en",,,,,,,,,,,,,
"x887381049210286085",2017-07-18 18:38:23,"x161411080","gracenapolitano","We haven’t stopped #Trumpcare yet. Republicans are reverting to an even more dangerous plan. We must #ProtectOurCare!","Twitter Web Client",,,,FALSE,FALSE,27,11,"Trumpcare ProtectOurCare",,,,,,,,,,,,,,,"en",,,,,,,,,,,,,
"x885926136328441858",2017-07-14 18:17:05,"x161411080","gracenapolitano","Jared Kushner must lose his security clearance immediately. This is not a partisan issue; it is our national security. #RevokeKushner","Twitter Web Client",,,,FALSE,FALSE,1612,767,"RevokeKushner",,,,,,,,,,,,,,,"en",,,,,,,,,,,,,
"x884899398597177345",2017-07-11 22:17:11,"x161411080","gracenapolitano","Donald Jr’s emails prove yet again no one in this family can tell the truth. We need an independent commission now!","Twitter Web Client",,,,FALSE,FALSE,50,23,,,,,,,,,,,,,,,,"en",,,,,,,,,,,,,
"x880502630509936640",2017-06-29 19:06:00,"x161411080","gracenapolitano","Natl monuments like San Gabriel Mtns are recreation destinations for families! We must protect them for future generations. #MonumentsForAll","Twitter Web Client",,,,FALSE,FALSE,14,5,"MonumentsForAll",,,,,,,,,,,,,,,"en",,,,,,,,,,,,,
"x880488735644766208",2017-06-29 18:10:47,"x161411080","gracenapolitano","27 national parks and monuments are facing threats of budget cuts and reduced protections. We must protect our legacy. #MonumentsForAll","Twitter Web Client",,,,FALSE,FALSE,17,7,"MonumentsForAll",,,,,,,,,,,,,,,"en",,,,,,,,,,,,,
"x874699132773990400",2017-06-13 18:44:59,"x161411080","gracenapolitano","By revising #TrumpCare in secret Senate Rs attempting to hide devastating impacts, like reducing access to lifesaving #mentalhealth services","Twitter Web Client",,,,FALSE,FALSE,12,6,"TrumpCare mentalhealth",,,,,,,,,,,,,,,"en",,,,,,,,,,,,,
"x872872305327820801",2017-06-08 17:45:49,"x161411080","gracenapolitano","Fmr FBI Director James Comey says Russia hacked our election &amp; will be back. Need for independent commission now more crucial than ever.","Twitter Web Client",,,,FALSE,FALSE,47,12,,,,,,,,,,,,,,,,"en",,,,,,,,,,,,,
"x872830180305362945",2017-06-08 14:58:26,"x161411080","gracenapolitano",".@FAANews conducted process in SoCal to change flight routes to make air travel more efficient w/ sign-off from public &amp; Members of Congress","Twitter Web Client",,,,FALSE,FALSE,6,2,,,,,,,,,,,,,,"x160946337","FAANews","en",,,,,,,,,,,,,
"x872828227009617920",2017-06-08 14:50:40,"x161411080","gracenapolitano","We cannot let corporations operate #ATC system &amp; risk cuts to workers’ pay &amp; benefits. #DontPrivatizeOurSkies","Twitter Web Client",,,,FALSE,FALSE,4,1,"ATC DontPrivatizeOurSkies",,,,,,,,,,,,,,,"en",,,,,,,,,,,,,
"x872827086423064580",2017-06-08 14:46:08,"x161411080","gracenapolitano","Trump’s aviation plan gives airlines authority to prioritize profit in flight operations over safety. #DontPrivatizeOurSkies","Twitter Web Client",,,,FALSE,FALSE,6,1,"DontPrivatizeOurSkies",,,,,,,,,,,,,,,"en",,,,,,,,,,,,,
"x872486158080638976",2017-06-07 16:11:24,"x161411080","gracenapolitano","Wall Street reform has empowered consumers like never before. We will not go back! #ConsumersFirst","Twitter Web Client",,,,FALSE,FALSE,2,0,"ConsumersFirst",,,,,,,,,,,,,,,"en",,,,,,,,,,,,,
"x862703094953627648",2017-05-11 16:17:00,"x161411080","gracenapolitano","I was brought up by a single mother, a teacher who instilled in me values of hard work &amp; discipline. I am who I am today #BecauseOfMom","Twitter Web Client",,,,FALSE,FALSE,30,8,"BecauseOfMom",,,,,,,,,,,,,,,"en",,,,,,,,,,,,,
"x862688994852831232",2017-05-11 15:20:59,"x161411080","gracenapolitano","Access to #healthcare, including #mentalhealth services, is vital for women. #BecauseOfMom, we are fighting to #ProtectOurCare.","Twitter Web Client",,,,FALSE,FALSE,9,7,"healthcare mentalhealth BecauseOfMom ProtectOurCare",,,,,,,,,,,,,,,"en",,,,,,,,,,,,,
"x860149001085227009",2017-05-04 15:07:57,"x161411080","gracenapolitano","Teenagers are more likely to die of suicide than a car accident. #Trumpcare cuts care that would help prevent these tragedies. #StopSuicide","Twitter Web Client",,,,FALSE,FALSE,34,30,"Trumpcare StopSuicide",,,,,,,,,,,,,,,"en",,,,,,,,,,,,,
"x860147757637660672",2017-05-04 15:03:00,"x161411080","gracenapolitano","#Trumpcare hurts access to lifesaving mental health care. We must move forward, not back! #ProtectOurCare","Twitter Web Client",,,,FALSE,FALSE,12,10,"Trumpcare ProtectOurCare",,,,,,,,,,,,,,,"en",,,,,,,,,,,,,
"x860143785354952706",2017-05-04 14:47:13,"x161411080","gracenapolitano","#TrumpCare would be devastating for an estimated 14 million on Medicaid living with a mental illness. We must defeat it &amp; #ProtectOurCare","Twitter Web Client",,,,FALSE,FALSE,23,17,"TrumpCare ProtectOurCare",,,,,,,,,,,,,,,"en",,,,,,,,,,,,,
"x860136666241130496",2017-05-04 14:18:56,"x161411080","gracenapolitano","1 in 3 Californians receive care through Medicaid, which #TrumpCare cuts by $880 billion; 40% are children. #ACAWorks #ProtectOurCare","Twitter for iPhone",,,,FALSE,FALSE,7,11,"TrumpCare ACAWorks ProtectOurCare",,,,,,,,,,,,,,,"en",,,,,,,,,,,,,
"x860135430678876162",2017-05-04 14:14:01,"x161411080","gracenapolitano","Nobody should have to lose his/her life savings because a loved one becomes seriously sick or injured. #ProtectOurCare &amp; Reject #TrumpCare","Twitter for iPhone",,,,FALSE,FALSE,20,7,"ProtectOurCare TrumpCare",,,,,,,,,,,,,,,"en",,,,,,,,,,,,,
"x844940447776681985",2017-03-23 15:54:35,"x161411080","gracenapolitano","GOP #PayMoreForLess bill raises out of pocket expenses for working class, while giving $600 billion in tax breaks to wealthy. #TrumpCare","Twitter for iPhone",,,,FALSE,FALSE,27,32,"PayMoreForLess TrumpCare",,,,,,,,,,,,,,,"en",,,,,,,,,,,,,
"x844939386537951233",2017-03-23 15:50:22,"x161411080","gracenapolitano","Millions of women rely on Planned Parenthood for healthcare, #Trumpcare cuts ALL funding. #IStandwithPP","Twitter for iPhone",,,,FALSE,FALSE,31,18,"Trumpcare IStandwithPP",,,,,,,,,,,,,,,"en",,,,,,,,,,,,,
"x844934767153942533",2017-03-23 15:32:01,"x161411080","gracenapolitano","With rising rates of suicide &amp; opioid abuse, it is inexcusable &amp; irresponsible to cut mental health &amp; substance use services #Trumpcare","Twitter Web Client",,,,FALSE,FALSE,17,6,"Trumpcare",,,,,,,,,,,,,,,"en",,,,,,,,,,,,,
"x844218992281763841",2017-03-21 16:07:47,"x161411080","gracenapolitano","The #ComeyHearing confirmed FBI is investigating possible Russia/Trump campaign coordination. Need independent commission to #FollowtheFacts","Twitter Web Client",,,,FALSE,FALSE,18,9,"ComeyHearing FollowtheFacts",,,,,,,,,,,,,,,"en",,,,,,,,,,,,,
"x832639681816907776",2017-02-17 17:15:44,"x161411080","gracenapolitano","We call on @HouseGOP to take up the Protecting Our Democracy Act. Americans deserve an independent commission on Trump-Russia connection.","Twitter for iPhone",,,,FALSE,FALSE,46,25,,,,,,,,,,,,,,"x15207668","HouseGOP","en",,,,,,,,,,,,,
"x830103567390355460",2017-02-10 17:18:07,"x161411080","gracenapolitano","Liberty &amp; justice also prevailed last night, proving our system of checks &amp; balances cannot be shaken. #MuslimBan","Twitter for iPhone",,,,FALSE,FALSE,16,8,"MuslimBan",,,,,,,,,,,,,,,"en",,,,,,,,,,,,,
"x830102729850773505",2017-02-10 17:14:48,"x161411080","gracenapolitano","9th Circuit's unanimous decision is victory for all people &amp; their families who were affected by Trump's unconstitutional #MuslimBan","Twitter for iPhone",,,,FALSE,FALSE,22,13,"MuslimBan",,,,,,,,,,,,,,,"en",,,,,,,,,,,,,
"x826859477475393536",2017-02-01 18:27:16,"x161411080","gracenapolitano","Hispanic community needs access to news now more than ever!
@CharterNewsroom @UCIPRTeam -- Please resolve this dispute
#ForTheCommunity","Twitter Web Client",,,,FALSE,FALSE,12,6,"ForTheCommunity",,,,,,,,,,,,,"x121165704 2805814488","CharterNewsroom UCIPRTeam","en",,,,,,,,,,,,,
"x825897040181854211",2017-01-30 02:42:53,"x161411080","gracenapolitano","President Trump’s anti-immigrant polices are contrary to who we are as Americans, and we will do everything we can to stop them. #MuslimBan","Twitter for iPhone",,,,FALSE,FALSE,53,18,"MuslimBan",,,,,,,,,,,,,,,"en",,,,,,,,,,,,,
"x825892200059895808",2017-01-30 02:23:39,"x161411080","gracenapolitano","We welcome refugees who have fled unimaginable violence and adversity; we don't turn our backs on them. #MuslimBan","Twitter for iPhone",,,,FALSE,FALSE,70,12,"MuslimBan",,,,,,,,,,,,,,,"en",,,,,,,,,,,,,
"x825890135376064512",2017-01-30 02:15:27,"x161411080","gracenapolitano","Inspired by peaceful demonstrations at @flyLAXairport &amp; across the country, reflecting our true values of tolerance &amp; love. #MuslimBan","Twitter for iPhone",,,,FALSE,FALSE,26,2,"MuslimBan",,,,,,,,,,,,,"x26886095","flyLAXairport","en",,,,,,,,,,,,,
"x825889061084737536",2017-01-30 02:11:11,"x161411080","gracenapolitano","This abhorrent view makes us less safe/adds fuel to propaganda our enemies use as a recruitment tool/should be condemned by all. #MuslimBan","Twitter for iPhone",,,,FALSE,FALSE,21,10,"MuslimBan",,,,,,,,,,,,,,,"en",,,,,,,,,,,,,
"x825888294546333696",2017-01-30 02:08:08,"x161411080","gracenapolitano","Barring entry to the U.S. based on religion or religious heritage is not only criminal, it is unconstitutional and un-American. #MuslimBan","Twitter for iPhone",,,,FALSE,FALSE,78,33,"MuslimBan",,,,,,,,,,,,,,,"en",,,,,,,,,,,,,
"x824716962005655552",2017-01-26 20:33:40,"x161411080","gracenapolitano","#DACA has expanded access to education,employment &amp; security to young people educated in the U.S who have known no other country #HereToStay","Twitter Web Client",,,,FALSE,FALSE,100,64,"DACA HereToStay",,,,,,,,,,,,,,,"en",,,,,,,,,,,,,
"x824715999450722304",2017-01-26 20:29:51,"x161411080","gracenapolitano","We remain committed to building on the progress we have made, embracing the contributions of more than 750k young DREAMers. #HereToStay","Twitter Web Client",,,,FALSE,FALSE,32,12,"HereToStay",,,,,,,,,,,,,,,"en",,,,,,,,,,,,,
"x824339739612499973",2017-01-25 19:34:44,"x161411080","gracenapolitano","America was founded on principles of religious freedom. Targeting Muslim refugees is not only anti-American, it is anti-human. #NoBanNoWall","Twitter for iPhone",,,,FALSE,FALSE,71,35,"NoBanNoWall",,,,,,,,,,,,,,,"en",,,,,,,,,,,,,
"x824337886862594051",2017-01-25 19:27:22,"x161411080","gracenapolitano","We need policies that embrace our values of acceptance &amp; love of country, not ones that divide us by spreading fear &amp; hate. #NoBanNoWall","Twitter for iPhone",,,,FALSE,FALSE,71,36,"NoBanNoWall",,,,,,,,,,,,,,,"en",,,,,,,,,,,,,
"x819207528089321473",2017-01-11 15:41:09,"x161411080","gracenapolitano","Because of the #ACA mental health services are an essential part of basic coverage for Latinos &amp; all Americans. #acaworks #ProtectOurCare","Twitter for iPhone",,,,FALSE,FALSE,14,7,"ACA acaworks ProtectOurCare",,,,,,,,,,,,,,,"en",,,,,,,,,,,,,
"x819206567014924288",2017-01-11 15:37:20,"x161411080","gracenapolitano","Latinos have historically had higher uninsured rates, experienced more barriers to care &amp; received poorer quality care than whites #acaworks","Twitter for iPhone",,,,FALSE,FALSE,8,7,"acaworks",,,,,,,,,,,,,,,"en",,,,,,,,,,,,,
"x817502050279890944",2017-01-06 22:44:11,"x161411080","gracenapolitano","Very sad &amp; troubling news from Fort Lauderdale airport today. Hearts are w/ victims, their families &amp; all those affected. #EndGunViolence","Twitter Web Client",,,,FALSE,FALSE,7,4,"EndGunViolence",,,,,,,,,,,,,,,"en",,,,,,,,,,,,,
"x809072465242624001",2016-12-14 16:28:02,"x161411080","gracenapolitano","Since Sandy Hook, Congress has done nothing &amp; 130k have died from gun violence. We can no longer be silent. It is time to #EndGunViolence","Twitter Web Client",,,,FALSE,FALSE,13,12,"EndGunViolence",,,,,,,,,,,,,,,"en",,,,,,,,,,,,,
"x809071029398151168",2016-12-14 16:22:19,"x161411080","gracenapolitano","Since the horrific tragedy, more than 7 children PER DAY have died from gun violence. We cannot accept that this is normal. #EndGunViolence","Twitter Web Client",,,,FALSE,FALSE,14,16,"EndGunViolence",,,,,,,,,,,,,,,"en",,,,,,,,,,,,,
"x806622993426370562",2016-12-07 22:14:42,"x161411080","gracenapolitano","As we remember those brave souls &amp; honor the survivors, let us thank all who served &amp; continue to serve in our Armed Forces #PearlHarbor75","Twitter Web Client",,,,FALSE,FALSE,3,1,"PearlHarbor75",,,,,,,,,,,,,,,"en",,,,,,,,,,,,,
"x805787891255406592",2016-12-05 14:56:18,"x161411080","gracenapolitano","I strongly oppose any effort to strike #BuyAmerica from our Water Infrastructure bill. #WRDA","Twitter Web Client",,,,FALSE,FALSE,11,12,"BuyAmerica WRDA",,,,,,,,,,,,,,,"en",,,,,,,,,,,,,
"x805787385019662336",2016-12-05 14:54:18,"x161411080","gracenapolitano","Our #BuyAmerica provisions ensure US taxpayers benefit from manufacturing &amp; infrastructure spending, NOT corporations/foreign companies.","Twitter Web Client",,,,FALSE,FALSE,4,6,"BuyAmerica",,,,,,,,,,,,,,,"en",,,,,,,,,,,,,
"x805787004806057984",2016-12-05 14:52:47,"x161411080","gracenapolitano","US infrastructure should be built w/ US products which support US jobs! #BuyAmerica","Twitter Web Client",,,,FALSE,FALSE,5,4,"BuyAmerica",,,,,,,,,,,,,,,"en",,,,,,,,,,,,,
"x803367089478266882",2016-11-28 22:36:54,"x161411080","gracenapolitano","If you or someone you know is experiencing emotional distress, call the @samhsagov Disaster Distress Helpline: 1-800-985-5990","Twitter for iPhone",,,,FALSE,FALSE,0,1,,,,,,,,,,,,,,"x24959108","samhsagov","en",,,,,,,,,,,,,
"x803366822586286081",2016-11-28 22:35:50,"x161411080","gracenapolitano","Our hearts remain with all students, faculty, and the entire Buckeye community affected by this terrifying situation","Twitter for iPhone",,,,FALSE,FALSE,1,2,,,,,,,,,,,,,,,,"en",,,,,,,,,,,,,
"x803365782709223424",2016-11-28 22:31:43,"x161411080","gracenapolitano","Horrified by the attack this morning at @OhioState. Praying for speedy recovery for the victims &amp; thankful for bravery of first responders","Twitter for iPhone",,,,FALSE,FALSE,1,0,,,,,,,,,,,,,,"x18846918","OhioState","en",,,,,,,,,,,,,
"x781595765655347200",2016-09-29 20:45:26,"x161411080","gracenapolitano","Horrified/saddened by Hoboken train crash; grateful to all first responders. Ensuring commuter rail safety must be priority at any cost.","Twitter Web Client",,,,FALSE,FALSE,3,2,,,,,,,,,,,,,,,,"en",,,,,,,,,,,,,
"x776511733733130241",2016-09-15 20:03:18,"x161411080","gracenapolitano","Hoy marca el inicio del Mes de la Herencia Hispana. Les invito a participar en la celebración desde ahora hasta el 15 de octubre! #2016HHM","Twitter Web Client",,,,FALSE,FALSE,1,1,"2016HHM",,,,,,,,,,,,,,,"es",,,,,,,,,,,,,
"x776511136065785856",2016-09-15 20:00:56,"x161411080","gracenapolitano","Today marks the beginning of #HispanicHeritageMonth. I invite you to join us in celebrating from now until October 15! #2016HHM","Twitter Web Client",,,,FALSE,FALSE,4,0,"HispanicHeritageMonth 2016HHM",,,,,,,,,,,,,,,"en",,,,,,,,,,,,,
"x755856111086043136",2016-07-20 20:05:14,"x161411080","gracenapolitano","Congressman Mark Takai's passing is a great loss. He was a good man and public servant. Sending my deepest condolences to his family.","Twitter Web Client",,,,FALSE,FALSE,9,5,,,,,,,,,,,,,,,,"en",,,,,,,,,,,,,
"x751441214365396992",2016-07-08 15:42:01,"x161411080","gracenapolitano","More and more our nation is faced w/ heartbreaking tragedies, caused by anger and unrest. This must stop. #Dallas","Twitter Web Client",,,,FALSE,FALSE,2,15,"Dallas",,,,,,,,,,,,,,,"en",,,,,,,,,,,,,
"x751439822087127040",2016-07-08 15:36:29,"x161411080","gracenapolitano","We offer our deepest condolences to the families of slain officers and wish speedy recovery to those injured. #Dallas","Twitter Web Client",,,,FALSE,FALSE,5,5,"Dallas",,,,,,,,,,,,,,,"en",,,,,,,,,,,,,
"x751439038201073664",2016-07-08 15:33:22,"x161411080","gracenapolitano","We condemn intolerable actions by a few people who exploited peaceful demonstration in #Dallas, shooting officers there to protect marchers.","Twitter Web Client",,,,FALSE,FALSE,3,6,"Dallas",,,,,,,,,,,,,,,"en",,,,,,,,,,,,,
"x751142377025404932",2016-07-07 19:54:32,"x161411080","gracenapolitano","Our GOP colleagues are denying even a vote on real reform, but we will continue to fight for commonsense legislation #AskDems #DisarmHate","Twitter Web Client",,,,FALSE,FALSE,9,24,"AskDems DisarmHate",,,,,,,,,,,,,,,"en",,,,,,,,,,,,,
"x747465798218883072",2016-06-27 16:25:08,"x161411080","gracenapolitano","Very pleased the Supreme Court has affirmed respect &amp; dignity in making health decisions; a win for women &amp; all Americans #WholeWomansHealth","Twitter for iPhone",,,,FALSE,FALSE,14,4,"WholeWomansHealth",,,,,,,,,,,,,,,"en",,,,,,,,,,,,,
"x745998124741701632",2016-06-23 15:13:07,"x161411080","gracenapolitano","Today's erroneous outcome DOES NOT impact DACA 2012, which was not at issue in this case. #DAPA #DACA #FightforFamilies","Twitter Web Client",,,,FALSE,FALSE,9,6,"DAPA DACA FightforFamilies",,,,,,,,,,,,,,,"en",,,,,,,,,,,,,
"x745997076224483328",2016-06-23 15:08:57,"x161411080","gracenapolitano","Extremely disappointed the Supreme Court has been tainted by politics as usual. We will continue to #FightforFamilies. #DAPA #DACA","Twitter Web Client",,,,FALSE,FALSE,5,3,"FightforFamilies DAPA DACA",,,,,,,,,,,,,,,"en",,,,,,,,,,,,,
"x745414118950109185",2016-06-22 00:32:29,"x161411080","gracenapolitano","Our continued thanks to @LACo_FD @LASDHQ &amp; all police departments from surrounding communities, working to keep us safe. #SanGabrielComplex","Twitter Web Client",,,,FALSE,FALSE,8,4,"SanGabrielComplex",,,,,,,,,,,,,"x46470122","LASDHQ","en",,,,,,,,,,,,,
"x730767464703885312",2016-05-12 14:31:55,"x161411080","gracenapolitano","I stand with @WeAreALPA calling for enforcement of our agreements. @SecretaryFoxx must #DenyNAI","Twitter Web Client",,,,FALSE,FALSE,0,1,"DenyNAI",,,,,,,,,,,,,"x48366585 43920155","WeAreALPA SecretaryFoxx","en",,,,,,,,,,,,,
"x730765140493254656",2016-05-12 14:22:41,"x161411080","gracenapolitano","Allowing Norwegian Air to operate in the US gives unfair advantage against American companies, American workers, and our economy. #DenyNAI","Twitter Web Client",,,,FALSE,FALSE,2,4,"DenyNAI",,,,,,,,,,,,,,,"en",,,,,,,,,,,,,
"x730763866230169600",2016-05-12 14:17:37,"x161411080","gracenapolitano","DOT decision on #DenyNAI is deeply flawed and disregards @StateDept terming labor language as ""ground breaking""","Twitter Web Client",,,,FALSE,FALSE,1,3,"DenyNAI",,,,,,,,,,,,,"x9624742","StateDept","en",,,,,,,,,,,,,
"x727199444752539648",2016-05-02 18:13:52,"x161411080","gracenapolitano","Despite high rates of mental illness, 4 out of 5 (80%) of children ages 6-17 do not receive any help #MHM2016 #EndStigma","Twitter Web Client",,,,FALSE,FALSE,12,12,"MHM2016 EndStigma",,,,,,,,,,,,,,,"en",,,,,,,,,,,,,
"x727198792206966785",2016-05-02 18:11:17,"x161411080","gracenapolitano","Proud to join colleagues/friends/advocates/millions across US to recognize May as National Mental Health Awareness Month #mhm2016 #EndStigma","Twitter Web Client",,,,FALSE,FALSE,11,13,"mhm2016 EndStigma",,,,,,,,,,,,,,,"en",,,,,,,,,,,,,
"x723596251376279555",2016-04-22 19:36:04,"x161411080","gracenapolitano","Climate change is taking devastating toll on our planet &amp; as global community we must #ActOnClimate. #ParisAgreement #EarthDay2016","Twitter Web Client",,,,FALSE,FALSE,3,2,"ActOnClimate ParisAgreement EarthDay2016",,,,,,,,,,,,,,,"en",,,,,,,,,,,,,
"x723595377757310976",2016-04-22 19:32:36,"x161411080","gracenapolitano","Today, on this historic Earth Day, more than 170 countries signed the Paris Agreement on Climate Change. #ActOnClimate #EarthDay2016","Twitter Web Client",,,,FALSE,FALSE,3,3,"ActOnClimate EarthDay2016",,,,,,,,,,,,,,,"en",,,,,,,,,,,,,
