"status_id","created_at","user_id","screen_name","text","source","reply_to_status_id","reply_to_user_id","reply_to_screen_name","is_quote","is_retweet","favorite_count","retweet_count","hashtags","symbols","urls_url","urls_t.co","urls_expanded_url","media_url","media_t.co","media_expanded_url","media_type","ext_media_url","ext_media_t.co","ext_media_expanded_url","ext_media_type","mentions_user_id","mentions_screen_name","lang","quoted_status_id","quoted_text","retweet_status_id","retweet_text","place_url","place_name","place_full_name","place_type","country","country_code","geo_coords","coords_coords","bbox_coords"
"x966658362355212289",2018-02-22 12:58:07,"x816284664658874368","RepArrington","“My home is in Heaven. I'm just traveling through this world.” - Billy Graham","Twitter for iPhone",,,,FALSE,FALSE,4,3,,,,,,,,,,,,,,,,"en",,,,,,,,,,,,,
"x961954801981575169",2018-02-09 13:27:51,"x816284664658874368","RepArrington","It's been a great first year with historic tax relief, economic growth, and better services for our veterans. Today's vote was huge!
Our troops now have what they need to keep us safe and free, and our cotton farmers have what they need to keep us fed and clothed.","Twitter for iPhone",,,,FALSE,FALSE,47,18,,,,,,,,,,,,,,,,"en",,,,,,,,,,,,,
"x958550751059554305",2018-01-31 04:01:22,"x816284664658874368","RepArrington","""We can lift our citizens from welfare to work, from dependence to independence, and from poverty to prosperity."" #SOTU","Twitter for iPhone",,,,FALSE,FALSE,24,12,"SOTU",,,,,,,,,,,,,,,"en",,,,,,,,,,,,,
"x958549955530166272",2018-01-31 03:58:13,"x816284664658874368","RepArrington","This is our new American moment. There has never been a better time to start living the American Dream.","Twitter for iPhone",,,,FALSE,FALSE,26,6,,,,,,,,,,,,,,,,"en",,,,,,,,,,,,,
"x958549565749293056",2018-01-31 03:56:40,"x816284664658874368","RepArrington","In America, we know that faith and family, not government and bureaucracy, are the center of the American life.","Twitter for iPhone",,,,FALSE,FALSE,22,9,,,,,,,,,,,,,,,,"en",,,,,,,,,,,,,
"x958525208662601730",2018-01-31 02:19:52,"x816284664658874368","RepArrington","“The state of our Union is strong because our people are strong.” #SOTU","Twitter for iPhone",,,,FALSE,FALSE,17,4,"SOTU",,,,,,,,,,,,,,,"en",,,,,,,,,,,,,
"x955577979257737216",2018-01-22 23:08:38,"x816284664658874368","RepArrington","I am glad to know Senate Democrats have retreated from their ill-conceived and outrageous demand we shut down our government, disrupt our military, and halt funding for other important obligations over amnesty for people who entered our country illegally.","Twitter Web Client",,,,FALSE,FALSE,5,4,,,,,,,,,,,,,,,,"en",,,,,,,,,,,,,
"x942051284756189184",2017-12-16 15:18:23,"x816284664658874368","RepArrington","After eight long years of big government “Obamanomics” resulting in low wages, low job participation, and no economic growth, the American people will soon be getting a much deserved break.","Twitter Web Client",,,,FALSE,FALSE,9,1,,,,,,,,,,,,,,,,"en",,,,,,,,,,,,,
"x938510523821379584",2017-12-06 20:48:40,"x816284664658874368","RepArrington","The lack of management, oversight &amp; accountability at the VA is astonishing, but in order to turn the VA around, we must be empowered with correct and timely data on the VA’s practices and performance.","Twitter Web Client",,,,FALSE,FALSE,2,3,,,,,,,,,,,,,,,,"en",,,,,,,,,,,,,
"x937029299768561664",2017-12-02 18:42:48,"x816284664658874368","RepArrington","I am thrilled the Senate was able to seize this historic opportunity to deliver tax relief for hard working families, simplify the tax code, make America competitive again, and grow our economy by keeping our jobs and companies from going overseas.","Twitter Web Client",,,,FALSE,FALSE,7,1,,,,,,,,,,,,,,,,"en",,,,,,,,,,,,,
"x933776887670812672",2017-11-23 19:18:53,"x816284664658874368","RepArrington","Happy Thanksgiving from our family to yours! My list of things to be thankful for is endless, but I want y’all to know that I thank God every day for the opportunity to serve our great country and represent the people of West Texas.","Hootsuite",,,,FALSE,FALSE,11,1,,,,,,,,,,,,,,,,"en",,,,,,,,,,,,,
"x926081763016957953",2017-11-02 13:41:12,"x816284664658874368","RepArrington","At Conference this morning going through details of #taxreform. Excited about the prospect of a fairer, simpler, &amp; flatter tax code!","Twitter for iPhone",,,,FALSE,FALSE,11,4,"taxreform",,,,,,,,,,,,,,,"en",,,,,,,,,,,,,
"x925707488292417538",2017-11-01 12:53:58,"x816284664658874368","RepArrington",".@RepHensarling has been a strong conservative &amp; a principled leader for the great state of Texas &amp; our country. Grateful for his service.","Twitter Web Client",,,,FALSE,FALSE,4,1,,,,,,,,,,,,,,"x18566912","RepHensarling","en",,,,,,,,,,,,,
"x925514521409736706",2017-11-01 00:07:11,"x816284664658874368","RepArrington","Heartbroken by the senseless act of terror in NYC. Anne &amp; I are keeping the victims &amp; their families in our prayers.","Twitter for iPhone",,,,FALSE,FALSE,7,2,,,,,,,,,,,,,,,,"en",,,,,,,,,,,,,
"x915279355126919169",2017-10-03 18:16:17,"x816284664658874368","RepArrington","Have a question about our framework for a fair &amp; simple tax code? Respond below using #taxreform, and I’ll start answering them on Thursday!","Twitter Web Client",,,,FALSE,FALSE,8,6,"taxreform",,,,,,,,,,,,,,,"en",,,,,,,,,,,,,
"x874996568130293761",2017-06-14 14:26:53,"x816284664658874368","RepArrington","My team and I are safe. 

Please join me in praying for my friend @SteveScalise, all involved, and their loved ones.","Twitter Web Client",,,,FALSE,FALSE,53,14,,,,,,,,,,,,,,"x1209417007","SteveScalise","en",,,,,,,,,,,,,
"x870786701463048192",2017-06-02 23:38:22,"x816284664658874368","RepArrington","‼️ Red Raiders Win! ‼️

No. 5 @TTU_Baseball opens with a 5-2 victory over Delaware! #WreckEm","Twitter for iPhone",,,,FALSE,FALSE,10,0,"WreckEm",,,,,,,,,,,,,"x1002874908","TTU_Baseball","en",,,,,,,,,,,,,
"x851552525820014592",2017-04-10 21:48:37,"x816284664658874368","RepArrington","Coach Spike Dykes exemplified the best of @TexasTech and embodied the character and color of West Texas like no one else.","Twitter for iPhone",,,,FALSE,FALSE,20,5,,,,,,,,,,,,,,"x14125882","TexasTech","en",,,,,,,,,,,,,
"x845683907022536704",2017-03-25 17:08:50,"x816284664658874368","RepArrington","Please join me today as we honor our heroes.

The freedom we enjoy is only possible because 'some gave all' to defend it. #MedalOfHonorDay","Twitter for iPhone",,,,FALSE,FALSE,4,1,"MedalOfHonorDay",,,,,,,,,,,,,,,"en",,,,,,,,,,,,,
"x836773673818275840",2017-03-01 03:02:44,"x816284664658874368","RepArrington","""Ryan laid down his life for his friends, for his country, and for our freedom, and we will never forget Ryan."" @POTUS #Jointsession","Twitter for iPhone",,,,FALSE,FALSE,131,31,"Jointsession",,,,,,,,,,,,,"x822215679726100480","POTUS","en",,,,,,,,,,,,,
"x836762818523299845",2017-03-01 02:19:36,"x816284664658874368","RepArrington","The most important thing about @POTUS is not how he delivers a speech. It's how he's delivered on many of his promises already #JointAddress","Twitter for iPhone",,,,FALSE,FALSE,12,5,"JointAddress",,,,,,,,,,,,,"x822215679726100480","POTUS","en",,,,,,,,,,,,,
"x828976912521371648",2017-02-07 14:41:12,"x816284664658874368","RepArrington","Honored to be named Chairman of the @HouseVetAffairs Subcmte on Economic Opportunity.","Twitter Web Client",,,,FALSE,FALSE,11,0,,,,,,,,,,,,,,"x282093902","HouseVetAffairs","en",,,,,,,,,,,,,
"x826789489209126913",2017-02-01 13:49:09,"x816284664658874368","RepArrington","In recent history, too many federal judges have sought to revise the Constitution rather than interpret it.","Twitter Web Client",,,,FALSE,FALSE,0,1,,,,,,,,,,,,,,,,"en",,,,,,,,,,,,,
"x825014881984270337",2017-01-27 16:17:30,"x816284664658874368","RepArrington","Encouraged to see thousands #MarchForLife &amp; excited about the tremendous opportunity we have to implement #prolife policies this Congress.","Twitter Web Client",,,,FALSE,FALSE,6,1,"MarchForLife prolife",,,,,,,,,,,,,,,"en",,,,,,,,,,,,,
"x820007323229913090",2017-01-13 20:39:15,"x816284664658874368","RepArrington","Just officially cast my vote to begin repealing Obamacare. One step closer to restoring the greatness of America!","Twitter for iPhone",,,,FALSE,FALSE,1,1,,,,,,,,,,,,,,,,"en",,,,,,,,,,,,,
"x817162357789118465",2017-01-06 00:14:22,"x816284664658874368","RepArrington","Israel is our steadfast ally and the only true democracy in the Middle East.","Twitter Web Client",,,,FALSE,FALSE,4,2,,,,,,,,,,,,,,,,"en",,,,,,,,,,,,,
"x816333100405968896",2017-01-03 17:19:12,"x816284664658874368","RepArrington","Welcome to my official Twitter page! It is an honor to serve the people of West Texas in the House of Representatives.","Twitter Web Client",,,,FALSE,FALSE,3,0,,,,,,,,,,,,,,,,"en",,,,,,,,,,,,,
