"status_id","created_at","user_id","screen_name","text","source","reply_to_status_id","reply_to_user_id","reply_to_screen_name","is_quote","is_retweet","favorite_count","retweet_count","hashtags","symbols","urls_url","urls_t.co","urls_expanded_url","media_url","media_t.co","media_expanded_url","media_type","ext_media_url","ext_media_t.co","ext_media_expanded_url","ext_media_type","mentions_user_id","mentions_screen_name","lang","quoted_status_id","quoted_text","retweet_status_id","retweet_text","place_url","place_name","place_full_name","place_type","country","country_code","geo_coords","coords_coords","bbox_coords"
"x966760804044496896",2018-02-22 19:45:11,"x1055730738","RepLowenthal","Having failed to repeal it, Trump admin is ramping up its assault on #Obamacare. This time, expanding the use of short term insurance plans which don’t cover preexisting conditions, can discriminate by gender &amp; don’t provide essential benefits. A serious mistake. 1/2","TweetDeck",,,,FALSE,FALSE,15,12,"Obamacare",,,,,,,,,,,,,,,"en",,,,,,,,,,,,,
"x966738928748417025",2018-02-22 18:18:16,"x1055730738","RepLowenthal","What do the @APA, @AmerMedicalAssn, @aaas, and countless other medical and scientific organizations have in common? They have called gun violence a public health crisis. @CDCgov must be able to once again research gun violence. #enoughisenough","TweetDeck",,,,FALSE,FALSE,11,9,"enoughisenough",,,,,,,,,,,,,"x493175789 27922157 17292623 146569971","APA AmerMedicalAssn aaas CDCgov","en",,,,,,,,,,,,,
"x966418753582981120",2018-02-21 21:06:00,"x1055730738","RepLowenthal","Proud of my F rating from the NRA!","TweetDeck",,,,FALSE,FALSE,240,29,,,,,,,,,,,,,,,,"en",,,,,,,,,,,,,
"x966050815290085376",2018-02-20 20:43:57,"x1055730738","RepLowenthal","I couldn’t be more proud of the #ParklandStrong students who have so bravely spoken out to fight for a better world. It’s time to take on the NRA and end gun violence once and for all. #MSDStrong","TweetDeck",,,,FALSE,FALSE,44,13,"ParklandStrong MSDStrong",,,,,,,,,,,,,,,"en",,,,,,,,,,,,,
"x965675102783393792",2018-02-19 19:51:00,"x1055730738","RepLowenthal","The Office of the President is a remarkable thing. On this President’s day, I will be celebrating the constitution, and the role we all play in our democracy.","TweetDeck",,,,FALSE,FALSE,27,5,,,,,,,,,,,,,,,,"en",,,,,,,,,,,,,
"x965322025332977665",2018-02-18 20:28:00,"x1055730738","RepLowenthal","Changes in mental health screenings &amp; more reporting could help to prevent crimes, but they aren’t sufficient to address the magnitude of this crisis. We are the only advanced country where mass shootings occur with this frequency. That must change.","TweetDeck",,,,FALSE,FALSE,57,13,,,,,,,,,,,,,,,,"en",,,,,,,,,,,,,
"x964935227402416129",2018-02-17 18:51:00,"x1055730738","RepLowenthal","Under current law, gun manufacturers are immune from any and all liability when their weapons are used for mass shootings. The victims of these senseless crimes have no recourse to justice. This has to change.","TweetDeck",,,,FALSE,FALSE,53,17,,,,,,,,,,,,,,,,"en",,,,,,,,,,,,,
"x964212880085323778",2018-02-15 19:00:39,"x1055730738","RepLowenthal","Thoughts and prayers are not enough. Gun violence needs to stop. The American people overwhelmingly support common sense gun safety measures. @SpeakerRyan, let a bill come to the floor. Let us work to end the needless violence and death.","TweetDeck",,,,FALSE,FALSE,63,26,,,,,,,,,,,,,,"x18916432","SpeakerRyan","en",,,,,,,,,,,,,
"x963930299867582465",2018-02-15 00:17:47,"x1055730738","RepLowenthal","Today’s shooting is a devastating tragedy, and a far too common one. As we grieve for the victims, I am forced to wonder how long we can tolerate this kind of violence before we take action.","TweetDeck",,,,FALSE,FALSE,54,14,,,,,,,,,,,,,,,,"en",,,,,,,,,,,,,
"x963461265556410368",2018-02-13 17:14:00,"x1055730738","RepLowenthal","Congratulations to Long Beach native @chloekimsnow on her gold medal in halfpipe yesterday!","TweetDeck",,,,FALSE,FALSE,43,11,,,,,,,,,,,,,,"x1228176728","chloekimsnow","en",,,,,,,,,,,,,
"x961980236253614081",2018-02-09 15:08:55,"x1055730738","RepLowenthal","The budget deal reached by the Senate will provide much needed resources to essential federal agencies, and strengthens our military. I am pleased to see the end of disastrous budget caps which have weakened our country so seriously for years. 1/2","TweetDeck",,,,FALSE,FALSE,9,5,,,,,,,,,,,,,,,,"en",,,,,,,,,,,,,
"x961333906384531457",2018-02-07 20:20:38,"x1055730738","RepLowenthal","The #DREAM act would pass the House overwhelmingly. We demand that Speaker Ryan bring it to the floor. I applaud Leader Pelosi for her courageous stand today.","TweetDeck",,,,FALSE,FALSE,106,41,"DREAM",,,,,,,,,,,,,,,"en",,,,,,,,,,,,,
"x961301785448144896",2018-02-07 18:13:00,"x1055730738","RepLowenthal","On Friday, the President opened 2 million acres of Bears Ears and Grand Staircase-Escalante to dangerous mining and oil &amp; gas extraction. Congress can’t tolerate this, and I am proud to cosponsor H.R. 4518 to immediately overturn it. Public lands must be protected for all.","TweetDeck",,,,FALSE,FALSE,639,271,,,,,,,,,,,,,,,,"en",,,,,,,,,,,,,
"x961026335396294656",2018-02-06 23:58:28,"x1055730738","RepLowenthal","Today’s GOP budget bill remains inadequate. We continue to lurch from one short-term bill to another, hamstringing our federal agencies and local governments. It’s time to get serious about providing real governance. I voted no.","TweetDeck",,,,FALSE,FALSE,25,3,,,,,,,,,,,,,,,,"en",,,,,,,,,,,,,
"x960911967220355073",2018-02-06 16:24:00,"x1055730738","RepLowenthal","The Nunes memo did nothing to clear the President from charges of collusion of obstruction. However, it did attempt to discredit public servants who can hold this administration accountable. We should release the Democratic memo to stop this attempt to sow confusion.","TweetDeck",,,,FALSE,FALSE,55,16,,,,,,,,,,,,,,,,"en",,,,,,,,,,,,,
"x959819650925252609",2018-02-03 16:03:32,"x1055730738","RepLowenthal","I do not believe Rep. Devin Nunes should be anywhere near the probes into the President’s conduct during the 2016 campaign. He has shown himself to be utterly disinterested in the truth, or the protection of the United States. 1/2","Twitter for iPhone",,,,FALSE,FALSE,89,40,,,,,,,,,,,,,,,,"en",,,,,,,,,,,,,
"x959561066429779969",2018-02-02 22:56:00,"x1055730738","RepLowenthal","On #WorldWetlandsDay, I'd like to recognize the Colorado Lagoon project and the Los Cerritos Wetland project, major environmental restoration projects happening in our backyard! Bringing ecosystems services back, restoring the flow of water &amp; promoting native flora and fauna.","TweetDeck",,,,FALSE,FALSE,32,10,"WorldWetlandsDay",,,,,,,,,,,,,,,"en",,,,,,,,,,,,,
"x959536352512692224",2018-02-02 21:17:48,"x1055730738","RepLowenthal","While I am confident that the American People will see through the shameless and reckless Nunes memo, it is important that the memo prepared by my friend and colleague @RepAdamSchiff be released as well, to provide the relevant context to this debate.","TweetDeck",,,,FALSE,FALSE,52,14,,,,,,,,,,,,,,"x29501253","RepAdamSchiff","en",,,,,,,,,,,,,
"x959203710479060993",2018-02-01 23:16:00,"x1055730738","RepLowenthal","50 years ago today Memphis Sanitation Workers were killed by faulty equipment. They then went on strike to call for safe working conditions. I am proud to cosponsor a resolution in their memory. #IAMCOLEANDWALKER #IAM2018","TweetDeck",,,,FALSE,FALSE,16,9,"IAMCOLEANDWALKER IAM2018",,,,,,,,,,,,,,,"en",,,,,,,,,,,,,
"x959183499940032512",2018-02-01 21:55:41,"x1055730738","RepLowenthal","I have read both the Democratic and Republican intelligence memos. The Nunes memo is misleading propaganda, trying to shield the President from scrutiny from his own justice department and mislead the American people. It’s simply an attack on the rule of law.","TweetDeck",,,,FALSE,FALSE,166,107,,,,,,,,,,,,,,,,"en",,,,,,,,,,,,,
"x959107287100030977",2018-02-01 16:52:51,"x1055730738","RepLowenthal","The fact that the Trump administration has chosen to ignore overwhelming bipartisan majorities, and refuses to implement sanctions designed to punish a hostile nation for an attack on American democracy is nothing short of an outrage. 1/2","TweetDeck",,,,FALSE,FALSE,35,10,,,,,,,,,,,,,,,,"en",,,,,,,,,,,,,
"x958811988217430017",2018-01-31 21:19:26,"x1055730738","RepLowenthal","Ultimately, last night, the President failed to unite us. Against a background of his outrageous assaults on the rule of law and his crusade against all immigrants, no speech can redefine this administration. 1/6","TweetDeck",,,,FALSE,FALSE,37,9,,,,,,,,,,,,,,,,"en",,,,,,,,,,,,,
"x958358139929161728",2018-01-30 15:16:00,"x1055730738","RepLowenthal","We cannot turn our backs on the #DREAMers. Subjecting these hundreds of thousands of young people, who know no other country but the United States, would be an injustice. They are not a bargaining chip, but our friends and neighbors.","TweetDeck",,,,FALSE,FALSE,23,8,"DREAMers",,,,,,,,,,,,,,,"en",,,,,,,,,,,,,
"x957295482233147392",2018-01-27 16:53:23,"x1055730738","RepLowenthal","Today is International Holocaust Remembrance Day. Let us commit ourselves once again to the fight against prejudice, hate, violence and intolerance. #WeRemember","Twitter for iPhone",,,,FALSE,FALSE,228,83,"WeRemember",,,,,,,,,,,,,,,"en",,,,,,,,,,,,,
"x957052077091340288",2018-01-27 00:46:11,"x1055730738","RepLowenthal","The latest news that President Trump attempted to fire Special Counsel Mueller is deeply disturbing. I fear that it fits a pattern of disrespect for our institutions and the rule of law.","Twitter for iPhone",,,,FALSE,FALSE,63,20,,,,,,,,,,,,,,,,"en",,,,,,,,,,,,,
"x956572315860520961",2018-01-25 16:59:47,"x1055730738","RepLowenthal","Yesterday I was honored to join @AquariumPacific to study the environmental and economic role of our local coastline, along with the impact of climate change. Responsible stewardship is the key to our community’s future!","TweetDeck",,,,FALSE,FALSE,39,4,,,,,,,,,,,,,,"x24245649","AquariumPacific","en",,,,,,,,,,,,,
"x956282863426723847",2018-01-24 21:49:36,"x1055730738","RepLowenthal","Today I had the pleasure of visiting the @portoflongbeach for its annual state of the port event. Always a pleasure to work with this vital economic engine. Congratulations on your busiest year yet.","TweetDeck",,,,FALSE,FALSE,21,3,,,,,,,,,,,,,,"x16188231","portoflongbeach","en",,,,,,,,,,,,,
"x956236911928016897",2018-01-24 18:47:00,"x1055730738","RepLowenthal","With the news that AG Sessions has been questioned in the Mueller probe, it is essential that the Special Counsel’s investigation be allowed to continue without political interference. The American people see through @GOP attempts to discredit this vital process.","TweetDeck",,,,FALSE,FALSE,92,45,,,,,,,,,,,,,,"x11134252","GOP","en",,,,,,,,,,,,,
"x956197570996572161",2018-01-24 16:10:40,"x1055730738","RepLowenthal","Make no mistake: the fight for #DREAMAct protections is not over. #DREAMers exemplify some of the best of America--we cannot let them down.","TweetDeck",,,,FALSE,FALSE,29,15,"DREAMAct DREAMers",,,,,,,,,,,,,,,"en",,,,,,,,,,,,,
"x955580505545732096",2018-01-22 23:18:41,"x1055730738","RepLowenthal","The #TrumpShutdown shutdown is ending and while I’m thankful that essential government services are being restored, I was not convinced to vote for the final continuing resolution. Unfortunately, the CR is not a reflection of our priorities. 1/3","TweetDeck",,,,FALSE,FALSE,20,6,"TrumpShutdown",,,,,,,,,,,,,,,"en",,,,,,,,,,,,,
"x955530379473162247",2018-01-22 19:59:30,"x1055730738","RepLowenthal","A crucial victory for #FairMaps in Pennsylvania today, where the State Supreme Court has ordered that a new congressional map be drawn for 2018. A lesson for the whole nation: partisan gerrymandering is undemocratic, wrong, and clearly unconstitutional.","TweetDeck",,,,FALSE,FALSE,62,21,"FairMaps",,,,,,,,,,,,,,,"en",,,,,,,,,,,,,
"x955474866823749632",2018-01-22 16:18:54,"x1055730738","RepLowenthal","New Senate shutdown vote at 1pm today. Hopefully, the House may see something today. In the meantime, I will continue to work to end the #TrumpShutdown.","TweetDeck",,,,FALSE,FALSE,22,8,"TrumpShutdown",,,,,,,,,,,,,,,"en",,,,,,,,,,,,,
"x954784957662220288",2018-01-20 18:37:27,"x1055730738","RepLowenthal","The #TrumpShutdown.   How we got here:  President Trump has reneged on multiple spending deals, and has caused chaos at every turn.  The House of Representatives passed a 4 week continuing resolution (CR) with #CHIPfunding reauth and sent it to the Senate.  1/x","Twitter Web Client",,,,FALSE,FALSE,23,16,"TrumpShutdown CHIPfunding",,,,,,,,,,,,,,,"en",,,,,,,,,,,,,
"x954496191978442752",2018-01-19 23:30:00,"x1055730738","RepLowenthal","I am profoundly disappointed that @GOP decided to launch yet another attack on women’s right to choose. I strongly oppose #HR4712","TweetDeck",,,,FALSE,FALSE,22,5,"HR4712",,,,,,,,,,,,,"x11134252","GOP","en",,,,,,,,,,,,,
"x954460168326123521",2018-01-19 21:06:51,"x1055730738","RepLowenthal","As we face a shutdown, let’s remember how we got here. The lives of thousands of DREAMers hang in the balance. Speaker Ryan and President Trump have both said repeatedly they want a permanent legislative solution which protects these young people. 1/3","TweetDeck",,,,FALSE,FALSE,37,9,,,,,,,,,,,,,,,,"en",,,,,,,,,,,,,
"x954426587469946880",2018-01-19 18:53:25,"x1055730738","RepLowenthal","The hypocrisy &amp; bad faith of @HouseGOP is breathtaking. They have ignored our calls to pass long-term bipartisan CHIP reauthorization for months, and now insist on using it as a political weapon to pass their unacceptable continuing resolution. They're playing games, not leading.","TweetDeck",,,,FALSE,FALSE,56,19,,,,,,,,,,,,,,"x15207668","HouseGOP","en",,,,,,,,,,,,,
"x954103199346065408",2018-01-18 21:28:23,"x1055730738","RepLowenthal","The president threw hundreds of thousands of #DREAMers into jeopardy, derailing lives and threatening young people who know no other home but the United States. Subjecting them to deportation would be immoral and outrageous. This is a line we cannot cross.","TweetDeck",,,,FALSE,FALSE,29,4,"DREAMers",,,,,,,,,,,,,,,"en",,,,,,,,,,,,,
"x954045817429659649",2018-01-18 17:40:22,"x1055730738","RepLowenthal","I have been a long-time and vocal champion of net neutrality. I am a cosponsor of the Congressional Review Act legislation to reverse the Federal Communications Commission’s decision to roll back net neutrality rules.The internet must remain open and fair for everyone—full stop.","TweetDeck",,,,FALSE,FALSE,58,11,,,,,,,,,,,,,,,,"en",,,,,,,,,,,,,
"x952975169928286214",2018-01-15 18:46:00,"x1055730738","RepLowenthal","This #MLK day, let us live up to his legacy with action. Recommit to fighting tirelessly for truth, justice, and equality for all. Work to provide a voice to the voiceless. Organize. Never back down.","TweetDeck",,,,FALSE,FALSE,22,7,"MLK",,,,,,,,,,,,,,,"en",,,,,,,,,,,,,
"x952258698440617984",2018-01-13 19:19:00,"x1055730738","RepLowenthal","Happy Korean American Day! Proud to recognize the contributions of the Korean Community to our national fabric. They, like so many others, have made our nation stronger and better by their presence.","TweetDeck",,,,FALSE,FALSE,25,7,,,,,,,,,,,,,,,,"en",,,,,,,,,,,,,
"x951927516368838656",2018-01-12 21:23:00,"x1055730738","RepLowenthal","My deepest condolences to all those affected by the California mudslides. Thank you to the first responders who have been working so tirelessly.","TweetDeck",,,,FALSE,FALSE,27,5,,,,,,,,,,,,,,,,"en",,,,,,,,,,,,,
"x951896157613121537",2018-01-12 19:18:24,"x1055730738","RepLowenthal","I am appalled by the President’s disgusting and racist remarks. He shames himself, his office, and all those who refuse to hold him accountable. He damages our moral leadership. Worse: he denigrates the true sources of American strength: diversity, tolerance and acceptance.","TweetDeck",,,,FALSE,FALSE,113,37,,,,,,,,,,,,,,,,"en",,,,,,,,,,,,,
"x951532309198622725",2018-01-11 19:12:35,"x1055730738","RepLowenthal","We must always seek to balance our constitutional right to privacy with the need to ensure our security. Unfortunately, today’s FISA legislation did not provide sufficient safeguards for civil liberties. I know that congress can do better.","TweetDeck",,,,FALSE,FALSE,11,2,,,,,,,,,,,,,,,,"en",,,,,,,,,,,,,
"x951231008568901632",2018-01-10 23:15:20,"x1055730738","RepLowenthal",".@NatResources today moved to gut protections for marine mammals endangered by seismic airgun blasting. Yet again, placing oil special interests before our environment and the needs of coastal communities who rely on tourism. HR 3133 must never become law.","TweetDeck",,,,FALSE,FALSE,77,42,,,,,,,,,,,,,,"x41445718","NatResources","en",,,,,,,,,,,,,
"x950776431826624512",2018-01-09 17:09:00,"x1055730738","RepLowenthal","I was proud to take the lead in the fight for Bears Ears at today’s Federal Lands subcommittee hearing. We cannot allow @GOP to rush legislation to cover the President’s illegal elimination of this precious national monument. #StandWithBearsEars","TweetDeck",,,,FALSE,FALSE,91,15,"StandWithBearsEars",,,,,,,,,,,,,"x11134252","GOP","en",,,,,,,,,,,,,
"x950751464598720512",2018-01-09 15:29:47,"x1055730738","RepLowenthal","Alex Azar, Trump Nominee to lead @HHSGov, is the wrong choice to oversee our nation’s healthcare system. His long record working for big pharma means we cannot trust him to place the American people first. #SayNoToAzar","TweetDeck",,,,FALSE,FALSE,53,35,"SayNoToAzar",,,,,,,,,,,,,"x44783853","HHSGov","en",,,,,,,,,,,,,
"x950506201611153408",2018-01-08 23:15:12,"x1055730738","RepLowenthal","Thank you to @RepEdRoyce for your service. I have proudly worked alongside you to help promote human rights and democracy around the world, particularly in Vietnam and Cambodia. I am grateful for your leadership.","TweetDeck",,,,FALSE,FALSE,15,6,,,,,,,,,,,,,,"x246769138","RepEdRoyce","en",,,,,,,,,,,,,
"x949019908150628352",2018-01-04 20:49:12,"x1055730738","RepLowenthal","Trump admin just announced that their draft 5-year oil &amp; gas leasing plan allows drilling in parts of the Pacific. Californians do not want their coastal economies put at risk. As ranking member of Energy and Mineral Resources, I’m leading the fight against this misguided move.","TweetDeck",,,,FALSE,FALSE,404,187,,,,,,,,,,,,,,,,"en",,,,,,,,,,,,,
"x948651932582789120",2018-01-03 20:27:00,"x1055730738","RepLowenthal","All people have the right to peacefully protest. Iran must hear its citizen’s calls for reform. #IranProtest","TweetDeck",,,,FALSE,FALSE,10,7,"IranProtest",,,,,,,,,,,,,,,"en",,,,,,,,,,,,,
"x947554450603782145",2017-12-31 19:46:00,"x1055730738","RepLowenthal","2017 has been a dramatic year. As it comes to a close, though, I look to the future with hope. There is no problem we can’t come together to solve. The arc of history bends toward justice. Our work continues.","TweetDeck",,,,FALSE,FALSE,29,11,,,,,,,,,,,,,,,,"en",,,,,,,,,,,,,
"x945037868044492800",2017-12-24 21:06:00,"x1055730738","RepLowenthal","I’d like to wish everyone a wonderful holiday season!","TweetDeck",,,,FALSE,FALSE,43,3,,,,,,,,,,,,,,,,"en",,,,,,,,,,,,,
"x943972999543361536",2017-12-21 22:34:35,"x1055730738","RepLowenthal","THREAD: @HouseGOP is celebrating adding over a trillion dollars to the deficit with tax cuts for the wealthiest, with a bill that will raise taxes on millions of middle class families. Now they’re leaving town without action on any of the following crucial priorities:","Twitter Web Client",,,,FALSE,FALSE,15,12,,,,,,,,,,,,,,"x15207668","HouseGOP","en",,,,,,,,,,,,,
"x943613734412476416",2017-12-20 22:47:00,"x1055730738","RepLowenthal","If @Potus and @GOP believe their #GOPTaxScam is a “win,” they are mistaken. The American people know better. We will hold them accountable.","TweetDeck",,,,FALSE,FALSE,52,11,"GOPTaxScam",,,,,,,,,,,,,"x822215679726100480 11134252","POTUS GOP","en",,,,,,,,,,,,,
"x943601212909289472",2017-12-20 21:57:15,"x1055730738","RepLowenthal","Today we voted on the #GOPTaxScam for a second time, due to procedural ineptitude by the @GOP. If you want the perfect encapsulation of this chaotic process, look no further. (If you were wondering, I voted no again)","TweetDeck",,,,FALSE,FALSE,61,9,"GOPTaxScam",,,,,,,,,,,,,"x11134252","GOP","en",,,,,,,,,,,,,
"x943209235541905408",2017-12-19 19:59:40,"x1055730738","RepLowenthal","It’s not too late: the senate must reject this #GOPTaxScam","Twitter for iPhone",,,,FALSE,FALSE,5,2,"GOPTaxScam",,,,,,,,,,,,,,,"en",,,,,,,,,,,,,
"x943195591546490880",2017-12-19 19:05:27,"x1055730738","RepLowenthal","The #GOPTaxScam was drafted behind closed doors and rests on debunked economic theories. It delivers for the super-rich but penalizes our state for investing in infrastructure and public services. I will vote no emphatically.","TweetDeck",,,,FALSE,FALSE,38,11,"GOPTaxScam",,,,,,,,,,,,,,,"en",,,,,,,,,,,,,
"x942895787956109314",2017-12-18 23:14:08,"x1055730738","RepLowenthal","Heartbroken by the tragic Amtrak derailment in Washington. I am thankful for the actions of the first responders, and will hold the victims and their families in my heart.","TweetDeck",,,,FALSE,FALSE,26,7,,,,,,,,,,,,,,,,"en",,,,,,,,,,,,,
"x942138262000414720",2017-12-16 21:04:00,"x1055730738","RepLowenthal","Like the overwhelming majority of Americans, I was profoundly disappointed by the FCC’s vote on #NetNeutrality. Yet again, the administration places special interests first and tramples on common sense.","TweetDeck",,,,FALSE,FALSE,112,44,"NetNeutrality",,,,,,,,,,,,,,,"en",,,,,,,,,,,,,
"x941720510072844291",2017-12-15 17:24:00,"x1055730738","RepLowenthal","Allegations of sexual misconduct against the President are credible and must be investigated. I was proud to join 145 colleagues led by @RepLoisFrankel @RepLawrence and @RepSpeier to call for full congressional investigations. There must be zero tolerance.","TweetDeck",,,,FALSE,FALSE,151,66,,,,,,,,,,,,,,"x1077121945 2863006655 24913074","RepLoisFrankel RepLawrence RepSpeier","en",,,,,,,,,,,,,
"x941449725835956224",2017-12-14 23:28:00,"x1055730738","RepLowenthal","Five years ago today, 26 lives were tragically cut short at #SandyHook. As we remember them, we must carry on the struggle to end the scourge of gun violence once and for all. #HonorWithAction, #EndGunViolence","TweetDeck",,,,FALSE,FALSE,29,17,"SandyHook HonorWithAction EndGunViolence",,,,,,,,,,,,,,,"en",,,,,,,,,,,,,
"x941355605188493312",2017-12-14 17:14:00,"x1055730738","RepLowenthal","Yesterday, Deputy AG Rosenstein reaffirmed what we already knew: there is no cause for Trump to shut down Mueller inquiry. I am proud to support the Special Counsel Integrity Act, to block any move to end the investigation prematurely. Truth must come out.","TweetDeck",,,,FALSE,FALSE,55,18,,,,,,,,,,,,,,,,"en",,,,,,,,,,,,,
"x941077019584028672",2017-12-13 22:47:00,"x1055730738","RepLowenthal","As decision approaches on #NetNeutrality, the will of the American people is overwhelmingly clear: keep internet fair, free and accessible. When the FCC votes tomorrow, they should hear that voice.","TweetDeck",,,,FALSE,FALSE,51,17,"NetNeutrality",,,,,,,,,,,,,,,"en",,,,,,,,,,,,,
"x941032624155394048",2017-12-13 19:50:35,"x1055730738","RepLowenthal","Time is running out. The #GOPTaxScam includes reckless drilling in the #ArcticRefuge, which could destroy a natural treasure that we have defended for decades. We must #ProtectTheArctic for future generations .","TweetDeck",,,,FALSE,FALSE,108,64,"GOPTaxScam ArcticRefuge ProtectTheArctic",,,,,,,,,,,,,,,"en",,,,,,,,,,,,,
"x941003534824120320",2017-12-13 17:55:00,"x1055730738","RepLowenthal","Every day, more #DACA recipients lose their protections. Thousands have already lost. A tragedy and a shame. Congress MUST restore protections to #DREAMers.","TweetDeck",,,,FALSE,FALSE,31,10,"DACA DREAMers",,,,,,,,,,,,,,,"en",,,,,,,,,,,,,
"x940629304827883521",2017-12-12 17:07:56,"x1055730738","RepLowenthal","2 years ago today, the US joined with 194 other nations and the EU in agreeing to adopt the  #ParisAgreement. The stakes are too high for us to walk away from the fight against climate change: @CaucusOnClimate is #StillIn.","TweetDeck",,,,FALSE,FALSE,105,43,"ParisAgreement StillIn",,,,,,,,,,,,,"x2792540601","CaucusOnClimate","en",,,,,,,,,,,,,
"x940349034941812736",2017-12-11 22:34:15,"x1055730738","RepLowenthal","I stand with #NYC. Thankful for the first responders and that this tragedy wasn’t more severe. New York's resilience and courage are truly inspiring.","TweetDeck",,,,FALSE,FALSE,17,4,"NYC",,,,,,,,,,,,,,,"en",,,,,,,,,,,,,
"x939592236895006721",2017-12-09 20:27:00,"x1055730738","RepLowenthal","50 yrs ago today, the Queen Mary arrived in Long Beach Harbor to the cheers of thousands, and has remained an icon ever since. Here’s to another 50 for the Queen.","TweetDeck",,,,FALSE,FALSE,74,20,,,,,,,,,,,,,,,,"en",,,,,,,,,,,,,
"x938925593852223488",2017-12-08 00:18:00,"x1055730738","RepLowenthal","My heart goes out to our neighbors affected by the ongoing wildfires. Stay safe and follow emergency announcements from local officials. We will support you however we can.","TweetDeck",,,,FALSE,FALSE,21,6,,,,,,,,,,,,,,,,"en",,,,,,,,,,,,,
"x938900931302760448",2017-12-07 22:40:00,"x1055730738","RepLowenthal","I support a short term continuing resolution that does not leave millions of children at risk of losing healthcare or leave the #DREAMers in jeopardy. Our budget should reflect our values.","TweetDeck",,,,FALSE,FALSE,16,8,"DREAMers",,,,,,,,,,,,,,,"en",,,,,,,,,,,,,
