"status_id","created_at","user_id","screen_name","text","source","reply_to_status_id","reply_to_user_id","reply_to_screen_name","is_quote","is_retweet","favorite_count","retweet_count","hashtags","symbols","urls_url","urls_t.co","urls_expanded_url","media_url","media_t.co","media_expanded_url","media_type","ext_media_url","ext_media_t.co","ext_media_expanded_url","ext_media_type","mentions_user_id","mentions_screen_name","lang","quoted_status_id","quoted_text","retweet_status_id","retweet_text","place_url","place_name","place_full_name","place_type","country","country_code","geo_coords","coords_coords","bbox_coords"
"x963956415986585600",2018-02-15 02:01:33,"x815241612154417152","RepJackBergman","As a father and grandfather, the tragic news out of Florida is incomprehensible. 

Our hearts are with Marjory Stoneman Douglas High School, and all students, victims, families, and first responders in South Florida.","Twitter for iPhone",,,,FALSE,FALSE,33,3,,,,,,,,,,,,,,,,"en",,,,,,,,,,,,,
"x963491116283842571",2018-02-13 19:12:37,"x815241612154417152","RepJackBergman","The @NatResources Committee will hold a hearing on my bipartisan legislation H.R. 4429 - The Cormorant Control Act Thursday, February 15th, at 2:30 PM.","Twitter for iPhone",,,,FALSE,FALSE,10,5,,,,,,,,,,,,,,"x41445718","NatResources","en",,,,,,,,,,,,,
"x963197852561362944",2018-02-12 23:47:18,"x815241612154417152","RepJackBergman","I look forward to reviewing the Administration's budget suggestions and working with my colleagues on the Budget Committee to pass a balanced budget for 2019.","Twitter for iPhone",,,,FALSE,FALSE,8,0,,,,,,,,,,,,,,,,"en",,,,,,,,,,,,,
"x958751809211953152",2018-01-31 17:20:18,"x815241612154417152","RepJackBergman","Cindy and I were not on the train this morning. 

Our thoughts are with all involved. We are thankful for the first responders who are helping those in this incident.","Twitter for iPhone",,,,FALSE,FALSE,28,10,,,,,,,,,,,,,,,,"en",,,,,,,,,,,,,
"x958441239380221954",2018-01-30 20:46:13,"x815241612154417152","RepJackBergman","As we near tonight’s State of the Union address, I’m optimistic @realDonaldTrump will discuss the need and importance of a 21st century infrastructure plan.","Twitter for iPhone",,,,FALSE,FALSE,9,3,,,,,,,,,,,,,,"x25073877","realDonaldTrump","en",,,,,,,,,,,,,
"x957767122293284865",2018-01-29 00:07:31,"x815241612154417152","RepJackBergman","Heard today: My co-worker thanked my boss this weekend for the pay-raise. He informed her that her pay rate didn’t change, but her taxes were lowered thanks to the #TaxCutsandJobsAct","Twitter for iPhone",,,,FALSE,FALSE,11,2,"TaxCutsandJobsAct",,,,,,,,,,,,,,,"en",,,,,,,,,,,,,
"x955610837179420672",2018-01-23 01:19:12,"x815241612154417152","RepJackBergman","As I said before - there was nothing in this bill that Senate Democrats philosophically disagree with and today’s vote to fund the federal government demonstrated just that.","Twitter for iPhone",,,,FALSE,FALSE,8,1,,,,,,,,,,,,,,,,"en",,,,,,,,,,,,,
"x955480132055130112",2018-01-22 16:39:50,"x815241612154417152","RepJackBergman","There is absolutely nothing in this short-term spending bill that democrats philosophically disagree with. 

Senate Democrats are just playing games. #SchumerShutdown","Twitter for iPhone",,,,FALSE,FALSE,13,2,"SchumerShutdown",,,,,,,,,,,,,,,"en",,,,,,,,,,,,,
"x955198248200867840",2018-01-21 21:59:43,"x815241612154417152","RepJackBergman","While negotiations continue as we seek a solution to the Democrats government shutdown, I will be donating all of my pay to a Veteran's organization in Michigan's First District.","Twitter for iPhone",,,,FALSE,FALSE,24,8,,,,,,,,,,,,,,,,"en",,,,,,,,,,,,,
"x954504860321435648",2018-01-20 00:04:27,"x815241612154417152","RepJackBergman","Make no mistake - Senate Democrats are the only thing standing in the way of extending CHIP for six years and keeping the government open. 

There are no excuses. It’s time to do what’s right for the American people.","Twitter for iPhone",,,,FALSE,FALSE,10,3,,,,,,,,,,,,,,,,"en",,,,,,,,,,,,,
"x954459648198930432",2018-01-19 21:04:47,"x815241612154417152","RepJackBergman","“Today, after reviewing a classified memo from the House Intelligence Committee, I join several of my colleagues in calling for its immediate release to the public. /1","Twitter for iPhone",,,,FALSE,FALSE,40,30,,,,,,,,,,,,,,,,"en",,,,,,,,,,,,,
"x954163024302104576",2018-01-19 01:26:07,"x815241612154417152","RepJackBergman","Tonight I voted to pass the longest extension of the Children’s Health Insurance Program (CHIP) in history. This bill ensures over 100,000 Michigan children, many in the 1st District, receive adequate heath insurance for the next 6 years.","Twitter for iPhone",,,,FALSE,FALSE,23,5,,,,,,,,,,,,,,,,"en",,,,,,,,,,,,,
"x948718263256657920",2018-01-04 00:50:34,"x815241612154417152","RepJackBergman","Joining the @mibigshow  with @MPShiels at 7:30 tomorrow morning to talk 2018 and our legislative priorities. Be sure to tune in!","Twitter for iPhone",,,,FALSE,FALSE,3,2,,,,,,,,,,,,,,"x847517948 125733159","mibigshow MPShiels","en",,,,,,,,,,,,,
"x942926039688404992",2017-12-19 01:14:21,"x815241612154417152","RepJackBergman","Excited to join the @stevegrubershow tomorrow morning at 6:45 to talk #TaxReform. 

We’re ready to put this bill on @POTUS desk and provide pro-growth tax reform for all Americans. 

Be sure to tune in!","Twitter for iPhone",,,,FALSE,FALSE,4,2,"TaxReform",,,,,,,,,,,,,"x1605851814 822215679726100480","stevegrubershow POTUS","en",,,,,,,,,,,,,
"x942749433728589824",2017-12-18 13:32:35,"x815241612154417152","RepJackBergman","Joining Tim Ellis now on Eagle 92.1 in The Soo to discuss the work we are doing for our Veterans on @HouseVetAffairs","Twitter for iPhone",,,,FALSE,FALSE,3,0,,,,,,,,,,,,,,"x282093902","HouseVetAffairs","en",,,,,,,,,,,,,
"x933904992439865344",2017-11-24 03:47:55,"x815241612154417152","RepJackBergman","Today we reflect on the many blessings we have as Americans.

From my family to yours, I hope you had a very Happy Thanksgiving.","Twitter for iPhone",,,,FALSE,FALSE,10,0,,,,,,,,,,,,,,,,"en",,,,,,,,,,,,,
"x931236566634201088",2017-11-16 19:04:33,"x815241612154417152","RepJackBergman","Breaking: The House just voted to pass major tax reform for the first time in over 30 years. 

In a major victory for the hard-working people of #Mi01, the Tax Cuts and Jobs Act passed the U.S. House!","Twitter for iPhone",,,,FALSE,FALSE,55,20,"Mi01",,,,,,,,,,,,,,,"en",,,,,,,,,,,,,
"x928704248396898305",2017-11-09 19:22:01,"x815241612154417152","RepJackBergman","On the air now with Jerry Coyne in Grayling on Q100. Talking VA, and Veterans Day!","Twitter for iPhone",,,,FALSE,FALSE,0,0,,,,,,,,,,,,,,,,"en",,,,,,,,,,,,,
"x925446778706677760",2017-10-31 19:38:00,"x815241612154417152","RepJackBergman","Reminder: Tomorrow at noon is the deadline to submit your app for the @CongressionalAC.","Twitter for iPhone",,,,FALSE,FALSE,2,0,,,,,,,,,,,,,,"x1225814342","CongressionalAC","en",,,,,"https://api.twitter.com/1.1/geo/id/0e48e78d08d90c6c.json","Gaylord","Gaylord, MI","city","United States","US",,,"-84.72699 -84.646793 -84.646793 -84.72699 44.981869 44.981869 45.045994 45.045994"
"x923513831317495808",2017-10-26 11:37:10,"x815241612154417152","RepJackBergman","On with @ProudExDemocrat now - talking tax reform, budget, and our upcoming community engagement event in Traverse City.","Twitter for iPhone",,,,FALSE,FALSE,7,0,,,,,,,,,,,,,,"x489934897","ProudExDemocrat","en",,,,,"https://api.twitter.com/1.1/geo/id/dd9c503d6c35364b.json","Pennsylvania","Pennsylvania, USA","admin","United States","US",,,"-80.519851 -74.689517 -74.689517 -80.519851 39.719801 39.719801 42.516072 42.516072"
"x921566794019737600",2017-10-21 02:40:20,"x815241612154417152","RepJackBergman","If there is any one issue that should bring our nation together, it’s our gold star families.","Twitter for iPhone",,,,FALSE,FALSE,13,2,,,,,,,,,,,,,,,,"en",,,,,"https://api.twitter.com/1.1/geo/id/67d92742f1ebf307.json","Michigan","Michigan, USA","admin","United States","US",,,"-90.4181075 -82.122971 -82.122971 -90.4181075 41.696088 41.696088 48.306272 48.306272"
"x917897540028297217",2017-10-10 23:40:01,"x815241612154417152","RepJackBergman","I announced my next round of fall community engagement events today. Times, dates, and locations are listed here ---&gt;","Twitter for iPhone",,,,FALSE,FALSE,5,1,,,,,,,,,,,,,,,,"en",,,,,,,,,,,,,
"x914154310916820993",2017-09-30 15:45:46,"x815241612154417152","RepJackBergman","I'm a Federalist. We must return power to the states. That is where government works best.","Twitter for iPhone",,,,FALSE,FALSE,14,4,,,,,,,,,,,,,,,,"en",,,,,,,,,,,,,
"x914150881263865856",2017-09-30 15:32:08,"x815241612154417152","RepJackBergman","The Soo Locks is not only a economic issue, it is a national security issue. We must build the Lock.","Twitter for iPhone",,,,FALSE,FALSE,14,8,,,,,,,,,,,,,,,,"en",,,,,,,,,,,,,
"x914150084094431232",2017-09-30 15:28:58,"x815241612154417152","RepJackBergman","This Congress has already rolled back $3.7 billion of unnecessary regulations. I'm proud of that.","Twitter for iPhone",,,,FALSE,FALSE,4,2,,,,,,,,,,,,,,,,"en",,,,,,,,,,,,,
"x914145083074732032",2017-09-30 15:09:06,"x815241612154417152","RepJackBergman","One of the biggest tasks the federal government has ahead of it is to quit wasting taxpayer money. This has to stop!","Twitter for iPhone",,,,FALSE,FALSE,6,1,,,,,,,,,,,,,,,,"en",,,,,,,,,,,,,
"x914136592071217152",2017-09-30 14:35:22,"x815241612154417152","RepJackBergman","We need tax reform. It needs to be simple, fair and small business friendly.","Twitter for iPhone",,,,FALSE,FALSE,14,5,,,,,,,,,,,,,,,,"en",,,,,,,,,,,,,
"x914136308850847744",2017-09-30 14:34:14,"x815241612154417152","RepJackBergman","One of the next best steps to address our healthcare issues and costs, we must focus on primary and preventative care.","Twitter for iPhone",,,,FALSE,FALSE,4,0,,,,,,,,,,,,,,,,"en",,,,,,,,,,,,,
"x913127349293547520",2017-09-27 19:44:59,"x815241612154417152","RepJackBergman","Working families in #Mi01 deserve to keep more of their paycheck. It's time to pass a tax plan that allows you to do just that. #TaxReform","Twitter for iPhone",,,,FALSE,FALSE,9,1,"Mi01 TaxReform",,,,,,,,,,,,,,,"en",,,,,,,,,,,,,
"x907246815732486144",2017-09-11 14:17:51,"x815241612154417152","RepJackBergman","This somber day serves as a reminder - service before self. On this #PatriotsDay, may we never forget the sacrifices made, for all of us.","Twitter for iPhone",,,,FALSE,FALSE,14,4,"PatriotsDay",,,,,,,,,,,,,,,"en",,,,,,,,,,,,,
"x907245626353766400",2017-09-11 14:13:07,"x815241612154417152","RepJackBergman","Among the 3000 lives lost on 9/11 343 firefighters and 60 police officers paid the ultimate sacrifice, while helping their fellow man","Twitter for iPhone",,,,FALSE,FALSE,5,3,,,,,,,,,,,,,,,,"en",,,,,,,,,,,,,
"x905475126921191424",2017-09-06 16:57:47,"x815241612154417152","RepJackBergman","The Constitution is clear; Congress has the authority to create legislation, not the executive branch.(1)","Twitter for iPhone",,,,FALSE,FALSE,14,1,,,,,,,,,,,,,,,,"en",,,,,,,,,,,,,
"x904790003062099970",2017-09-04 19:35:21,"x815241612154417152","RepJackBergman","Today we honor the hard working men and women of northern Michigan and the Upper Peninsula. (1)","Twitter for iPhone",,,,FALSE,FALSE,14,0,,,,,,,,,,,,,,,,"en",,,,,,,,,,,,,
"x901946107751780352",2017-08-27 23:14:44,"x815241612154417152","RepJackBergman","Join me in keeping the people of Texas and all of the First Responders and Emergency workers in your thoughts and prayers.","Twitter for iPhone",,,,FALSE,FALSE,20,6,,,,,,,,,,,,,,,,"en",,,,,,,,,,,,,
"x898384360352747520",2017-08-18 03:21:37,"x815241612154417152","RepJackBergman","If more elected officials would focus on legislating, rather than commentating, we could produce better results for the people of the U.S.","Twitter for iPhone",,,,FALSE,FALSE,36,9,,,,,,,,,,,,,,,,"en",,,,,,,,,,,,,
"x898156159202447360",2017-08-17 12:14:49,"x815241612154417152","RepJackBergman","Coming up with Craig Wurpel on WDBC in Escanaba. Tune-in!","Twitter for iPhone",,,,FALSE,FALSE,4,0,,,,,,,,,,,,,,,,"en",,,,,,,,,,,,,
"x898138142213115904",2017-08-17 11:03:14,"x815241612154417152","RepJackBergman","Talking current events on @MPShiels in 5 minutes. Tune in","Twitter for iPhone",,,,FALSE,FALSE,1,1,,,,,,,,,,,,,,"x125733159","MPShiels","en",,,,,,,,,,,,,
"x896038471055413248",2017-08-11 15:59:53,"x815241612154417152","RepJackBergman","Sec. Mattis has shown, in no uncertain terms, that the U.S. will no longer lead from behind in areas of National security and defense.","Twitter for iPhone",,,,FALSE,FALSE,16,4,,,,,,,,,,,,,,,,"en",,,,,,,,,,,,,
"x896037881994727424",2017-08-11 15:57:33,"x815241612154417152","RepJackBergman","It is unacceptable to allow a nuclear ICBM capable of reaching our western shores into the hands of Dictator Kim Jong Un.","Twitter for iPhone",,,,FALSE,FALSE,4,1,,,,,,,,,,,,,,,,"en",,,,,,,,,,,,,
"x896037346881277952",2017-08-11 15:55:25,"x815241612154417152","RepJackBergman","It is imperative that the United States along with the international community, remain steadfast in the pursuit of a nuclear-free DPRK","Twitter for iPhone",,,,FALSE,FALSE,3,0,,,,,,,,,,,,,,,,"en",,,,,,,,,,,,,
"x890284903035744256",2017-07-26 18:57:16,"x815241612154417152","RepJackBergman","(3/3) Secretary Mattis will do his job. Congress can now focus on theirs.","TweetDeck",,,,FALSE,FALSE,11,3,,,,,,,,,,,,,,,,"en",,,,,,,,,,,,,
"x890284561074196481",2017-07-26 18:55:54,"x815241612154417152","RepJackBergman","(2/3) reinforces my confidence in this @realDonaldTrump administration’s focus on, and commitment to, military readiness.","TweetDeck",,,,FALSE,FALSE,16,6,,,,,,,,,,,,,,"x25073877","realDonaldTrump","en",,,,,,,,,,,,,
"x890284413594079232",2017-07-26 18:55:19,"x815241612154417152","RepJackBergman","(1/3) @realDonaldTrump decision to not fund elective transgender surgery...","TweetDeck",,,,FALSE,FALSE,8,3,,,,,,,,,,,,,,"x25073877","realDonaldTrump","en",,,,,,,,,,,,,
"x887861502220406784",2017-07-20 02:27:32,"x815241612154417152","RepJackBergman","Thoughts and prayers for a complete recovery for a true American hero @SenJohnMcCain","Twitter for iPhone",,,,FALSE,FALSE,22,5,,,,,,,,,,,,,,"x19394188","SenJohnMcCain","en",,,,,,,,,,,,,
"x887761759913877505",2017-07-19 19:51:12,"x815241612154417152","RepJackBergman","(3/3) It also will give the Fish and Wildlife Service an extra $10.4 million to fight invasive Asian carp #GLRI #MI01","TweetDeck",,,,FALSE,FALSE,5,0,"GLRI MI01",,,,,,,,,,,,,,,"en",,,,,,,,,,,,,
"x887761587339227140",2017-07-19 19:50:30,"x815241612154417152","RepJackBergman","(2/3) A bill passed out of committee that we fought for--it will fully fund the Great Lakes Restoration Initiative #GLRI #MI01","TweetDeck",,,,FALSE,FALSE,12,2,"GLRI MI01",,,,,,,,,,,,,,,"en",,,,,,,,,,,,,
"x887761242873618434",2017-07-19 19:49:08,"x815241612154417152","RepJackBergman","(1/3) Amazing news was announced last night for our state's natural resources and the Great Lakes! #GLRI #MI01","TweetDeck",,,,FALSE,FALSE,4,0,"GLRI MI01",,,,,,,,,,,,,,,"en",,,,,,,,,,,,,
"x885894396406845441",2017-07-14 16:10:57,"x815241612154417152","RepJackBergman","(3/3) After 40 yrs in #USMC I know firsthand the importance of investing in national security &amp; supporting men &amp; women in uniform #FY18NDAA","Twitter for iPhone",,,,FALSE,FALSE,7,0,"USMC FY18NDAA",,,,,,,,,,,,,,,"en",,,,,,,,,,,,,
"x885894233906917378",2017-07-14 16:10:19,"x815241612154417152","RepJackBergman","(2/3) #FY18NDAA allows us to supply and train our troops, and to properly care for our troops and their families.","Twitter for iPhone",,,,FALSE,FALSE,6,0,"FY18NDAA",,,,,,,,,,,,,,,"en",,,,,,,,,,,,,
"x884784901849055234",2017-07-11 14:42:13,"x815241612154417152","RepJackBergman","(3/3) I will continue my support and protection of the Lakes from all angles--everything from invasive species to research/conservation.","Twitter for iPhone",,,,FALSE,FALSE,5,0,,,,,,,,,,,,,,,,"en",,,,,,,,,,,,,
"x884783548972097536",2017-07-11 14:36:51,"x815241612154417152","RepJackBergman","(2/3) Whether viewing the shipwrecks in the bay, or on land learning about the ROV's &amp; educational programs, this facility is top notch.","Twitter for iPhone",,,,FALSE,FALSE,5,0,,,,,,,,,,,,,,,,"en",,,,,,,,,,,,,
"x882270898904059904",2017-07-04 16:12:28,"x815241612154417152","RepJackBergman","(2/2) True ""reflection"" is a part of this country's 
greatness. Please be a participant. #ProudAmerican #Happy4thofJuly","Twitter for iPhone",,,,FALSE,FALSE,5,0,"ProudAmerican Happy4thofJuly",,,,,,,,,,,,,,,"en",,,,,,,,,,,,,
"x877954934364192769",2017-06-22 18:22:22,"x815241612154417152","RepJackBergman","2/2 Looking forward to his leadership as we address our invasive species issues in #MI1 and protect our Great Lakes!","Twitter Web Client",,,,FALSE,FALSE,0,0,"MI1",,,,,,,,,,,,,,,"en",,,,,,,,,,,,,
"x874984789752807424",2017-06-14 13:40:04,"x815241612154417152","RepJackBergman","We're learning more about motive, but this is a good time to reflect on division and unity. We're all human. We're more the same than not.","Twitter Web Client",,,,FALSE,FALSE,258,105,,,,,,,,,,,,,,,,"en",,,,,,,,,,,,,
"x874984323862192130",2017-06-14 13:38:13,"x815241612154417152","RepJackBergman","I was on scene, but I'm blessed to be safe, and I want to thank the security forces who were so quick to respond. They're the heroes here.","Twitter Web Client",,,,FALSE,FALSE,192,62,,,,,,,,,,,,,,,,"en",,,,,,,,,,,,,
"x874983830599421952",2017-06-14 13:36:16,"x815241612154417152","RepJackBergman","Dismayed by the instance of violence at practice this a.m. for the Congressional baseball game. Prayers are with @SteveScalise and injured.","Twitter Web Client",,,,FALSE,FALSE,51,19,,,,,,,,,,,,,,"x1209417007","SteveScalise","en",,,,,,,,,,,,,
"x860204671264313344",2017-05-04 18:49:10,"x815241612154417152","RepJackBergman","Today, I made good on my campaign promise to #RepealAndReplace","Twitter Web Client",,,,FALSE,FALSE,6,3,"RepealAndReplace",,,,,,,,,,,,,,,"en",,,,,,,,,,,,,
"x859827715083575303",2017-05-03 17:51:16,"x815241612154417152","RepJackBergman","May is National Foster Care Month--time to recognize foster youth, parents, and the pros dedicated to finding forever homes for every child.","Twitter Web Client",,,,FALSE,FALSE,1,1,,,,,,,,,,,,,,,,"en",,,,,,,,,,,,,
"x854662496262737922",2017-04-19 11:46:32,"x815241612154417152","RepJackBergman","Looking forward to a great day in the U.P. and a great event tonight in Escanaba! Hope you can make it--","Twitter for iPhone",,,,FALSE,FALSE,5,0,,,,,,,,,,,,,,,,"en",,,,,,,,,,,,,
"x854462270235136002",2017-04-18 22:30:55,"x815241612154417152","RepJackBergman","It's #taxday, and it's time to think about #taxreform. Folks could do a lot with the time/money they spend navigating the complex tax code!","Twitter for iPhone",,,,FALSE,FALSE,5,0,"taxday taxreform",,,,,,,,,,,,,,,"en",,,,,,,,,,,,,
"x850420987078299648",2017-04-07 18:52:18,"x815241612154417152","RepJackBergman","Bottom line: U.S. acted decisively and appropriately in the face of the Assad regime's cowardice. Bottom line: this nation leads.","Twitter for iPhone",,,,FALSE,FALSE,5,1,,,,,,,,,,,,,,,,"en",,,,,,,,,,,,,
"x850420022463913984",2017-04-07 18:48:28,"x815241612154417152","RepJackBergman","Forces took extraordinary measures to avoid casualties to civilians and casualties to airfield personnel.","Twitter for iPhone",,,,FALSE,FALSE,3,2,,,,,,,,,,,,,,,,"en",,,,,,,,,,,,,
"x850417016104157185",2017-04-07 18:36:31,"x815241612154417152","RepJackBergman","Russia was notified before the strikes, and precautions were taken to protect U.S. forces against any retaliatory attacks.","Twitter for iPhone",,,,FALSE,FALSE,2,2,,,,,,,,,,,,,,,,"en",,,,,,,,,,,,,
"x850415897839902721",2017-04-07 18:32:04,"x815241612154417152","RepJackBergman","The strike was intended to keep the Assad regime from EVER using chemical weapons again.","Twitter for iPhone",,,,FALSE,FALSE,2,2,,,,,,,,,,,,,,,,"en",,,,,,,,,,,,,
"x850415337678000129",2017-04-07 18:29:51,"x815241612154417152","RepJackBergman","Strike last night was proportional, given Assad's heinous acts against innocent civilians early this week.","Twitter for iPhone",,,,FALSE,FALSE,4,1,,,,,,,,,,,,,,,,"en",,,,,,,,,,,,,
"x850415001491910657",2017-04-07 18:28:30,"x815241612154417152","RepJackBergman","Just received a classified briefing on the situation in Syria from Chairman of the Joint Chiefs of Staff Gen. Joe Dunford.","Twitter for iPhone",,,,FALSE,FALSE,2,2,,,,,,,,,,,,,,,,"en",,,,,,,,,,,,,
"x847410037240717312",2017-03-30 11:27:51,"x815241612154417152","RepJackBergman","The Great Lakes are the lifeblood of MI. We HAVE to protect them, and I'm working hard to make sure GRLI dollars are in the budget--","Twitter for iPhone",,,,FALSE,FALSE,15,1,,,,,,,,,,,,,,,,"en",,,,,,,,,,,,,
"x847408371355406336",2017-03-30 11:21:14,"x815241612154417152","RepJackBergman","Fitting in is more about digging in and getting some things done for the First District--","Twitter for iPhone",,,,FALSE,FALSE,1,0,,,,,,,,,,,,,,,,"en",,,,,,,,,,,,,
"x847407712577011712",2017-03-30 11:18:37,"x815241612154417152","RepJackBergman","LIVE now on @stevegrubershow talking budget, tax reform, and health care!","Twitter for iPhone",,,,FALSE,FALSE,2,2,,,,,,,,,,,,,,"x1605851814","stevegrubershow","en",,,,,,,,,,,,,
"x847111748549271553",2017-03-29 15:42:34,"x815241612154417152","RepJackBergman","4/4 That's what was happening here. The FCC was moving in on FTC jurisdiction for no reason and at no benefit to the internet user: you.","Twitter Web Client",,,,FALSE,FALSE,1,2,,,,,,,,,,,,,,,,"en",,,,,,,,,,,,,
"x847110679278571523",2017-03-29 15:38:19,"x815241612154417152","RepJackBergman","3/4 Think about it this way: it would be redundant and costly to ask your police dept. to fight fires. That's the fire dept.'s job.","Twitter Web Client",,,,FALSE,FALSE,1,1,,,,,,,,,,,,,,,,"en",,,,,,,,,,,,,
"x847109331799674880",2017-03-29 15:32:57,"x815241612154417152","RepJackBergman","2/4 Overturning the rule was about keeping the FCC from regulating in an area that already regulated by the Federal Trade Commission (FTC).","Twitter Web Client",,,,FALSE,FALSE,1,1,,,,,,,,,,,,,,,,"en",,,,,,,,,,,,,
"x847108729157947396",2017-03-29 15:30:34,"x815241612154417152","RepJackBergman","1/4 Lots of skewed information about Congress's vote yesterday in re: internet privacy regs.","Twitter Web Client",,,,FALSE,FALSE,1,0,,,,,,,,,,,,,,,,"en",,,,,,,,,,,,,
"x846775887366422529",2017-03-28 17:27:58,"x815241612154417152","RepJackBergman","Gearing up for the Congressional Art Competition--open to high school students residing in the First District--details coming soon!","Twitter Web Client",,,,FALSE,FALSE,2,0,,,,,,,,,,,,,,,,"en",,,,,,,,,,,,,
"x844196696271847424",2017-03-21 14:39:11,"x815241612154417152","RepJackBergman","2/2 Essential Air Services supports industry, boosts our economy, and promotes strong #MI1 communities. I'm all in for that--","Twitter Web Client",,,,FALSE,FALSE,6,1,"MI1",,,,,,,,,,,,,,,"en",,,,,,,,,,,,,
"x840358022954270720",2017-03-11 00:25:40,"x815241612154417152","RepJackBergman","Hopeful that we can work with the Administration to properly fund the Great Lakes Restoration Initiative. We have a duty to protect the GL!","Twitter for iPhone",,,,FALSE,FALSE,41,7,,,,,,,,,,,,,,,,"en",,,,,,,,,,,,,
"x839985451339530240",2017-03-09 23:45:12,"x815241612154417152","RepJackBergman","3/3 Make sure that you take advantage of the services my staff provides. They're there because they're passionate about public service!","Twitter Web Client",,,,FALSE,FALSE,0,0,,,,,,,,,,,,,,,,"en",,,,,,,,,,,,,
"x839985145318895618",2017-03-09 23:43:59,"x815241612154417152","RepJackBergman","2/3 Having an issue with a federal agency? Need help navigating the process? My district staff can help!","Twitter Web Client",,,,FALSE,FALSE,0,1,,,,,,,,,,,,,,,,"en",,,,,,,,,,,,,
"x838807183705899008",2017-03-06 17:43:11,"x815241612154417152","RepJackBergman","Can't wait to hear from you! ☎️","Twitter for iPhone",,,,FALSE,FALSE,1,0,,,,,,,,,,,,,,,,"en",,,,,,,,,,,,,
"x838805185740709888",2017-03-06 17:35:15,"x815241612154417152","RepJackBergman","If you've already spoken with my staff and asked to be added to the call out list, all you have to do to join is wait for a phone call!","Twitter for iPhone",,,,FALSE,FALSE,0,1,,,,,,,,,,,,,,,,"en",,,,,,,,,,,,,
"x837341555946061824",2017-03-02 16:39:18,"x815241612154417152","RepJackBergman","2/2 I stand with the Jewish community and condemn words and acts of hatred based on religion, race, gender, or national origin.","Twitter Web Client",,,,FALSE,FALSE,9,1,,,,,,,,,,,,,,,,"en",,,,,,,,,,,,,
"x837068946922696705",2017-03-01 22:36:03,"x815241612154417152","RepJackBergman","Keeping the #bipartisan spirit alive tonight at the @BPC_Bipartisan 10th anniversary reception. We have to move forward ... together. #BPC10","Twitter Web Client",,,,FALSE,FALSE,2,0,"bipartisan BPC10",,,,,,,,,,,,,"x83932732","BPC_Bipartisan","en",,,,,,,,,,,,,
"x836771398882316288",2017-03-01 02:53:42,"x815241612154417152","RepJackBergman","We can improve national security and address our readiness issues WHILE protecting taxpayer dollars--","Twitter for iPhone",,,,FALSE,FALSE,2,0,,,,,,,,,,,,,,,,"en",,,,,,,,,,,,,
"x836764838445592577",2017-03-01 02:27:38,"x815241612154417152","RepJackBergman","Need to get rid of regs that aren't working and are hurting jobs and our economy--","Twitter for iPhone",,,,FALSE,FALSE,3,1,,,,,,,,,,,,,,,,"en",,,,,,,,,,,,,
"x836764707423993856",2017-03-01 02:27:07,"x815241612154417152","RepJackBergman","Need to make sure regulations working effectively and efficiently when they're working.","Twitter for iPhone",,,,FALSE,FALSE,2,1,,,,,,,,,,,,,,,,"en",,,,,,,,,,,,,
