"status_id","created_at","user_id","screen_name","text","source","reply_to_status_id","reply_to_user_id","reply_to_screen_name","is_quote","is_retweet","favorite_count","retweet_count","hashtags","symbols","urls_url","urls_t.co","urls_expanded_url","media_url","media_t.co","media_expanded_url","media_type","ext_media_url","ext_media_t.co","ext_media_expanded_url","ext_media_type","mentions_user_id","mentions_screen_name","lang","quoted_status_id","quoted_text","retweet_status_id","retweet_text","place_url","place_name","place_full_name","place_type","country","country_code","geo_coords","coords_coords","bbox_coords"
"x743553570339954688",2016-06-16 21:19:20,"x1055730738","RepLowenthal","Over past 4 yrs. 730,000 #DACA students are now that much closer to their version of the American Dream. #DREAMers","TweetDeck",,,,FALSE,FALSE,0,0,"DACA DREAMers",,,,,,,,,,,,,,,"en",,,,,,,,,,,,,
"x742058284966907905",2016-06-12 18:17:36,"x1055730738","RepLowenthal","Devastated by Orlando attack. This cannot continue. No one outside military should have access to mil-style weapons. We have to take action.","Twitter Web Client",,,,FALSE,FALSE,66,36,,,,,,,,,,,,,,,,"en",,,,,,,,,,,,,
"x742000480046436352",2016-06-12 14:27:54,"x1055730738","RepLowenthal","My heart goes out to victims &amp; loved ones of nightclub shooting in Orlando. An act of violence against one of us is an attack on all of us.","Twitter Web Client",,,,FALSE,FALSE,10,3,,,,,,,,,,,,,,,,"en",,,,,,,,,,,,,
"x741372632227057664",2016-06-10 20:53:04,"x1055730738","RepLowenthal","We’re a nation of immigrants. Our differences unite us &amp; make us stronger. #ImmigrantHeritageMonth I#ImmigrationStoryin5Words","Twitter Web Client",,,,FALSE,FALSE,6,3,"ImmigrantHeritageMonth",,,,,,,,,,,,,,,"en",,,,,,,,,,,,,
"x741349484496556032",2016-06-10 19:21:05,"x1055730738","RepLowenthal","As a community psychologist I know #MentalIllness is something we need to address as a community. Proud to be part of #MHALA’s #Ducky Awards","Twitter Web Client",,,,FALSE,FALSE,3,1,"MentalIllness MHALA Ducky",,,,,,,,,,,,,,,"en",,,,,,,,,,,,,
"x739935467500621828",2016-06-06 21:42:17,"x1055730738","RepLowenthal","Wishing everyone in communities across our nation celebrating #Ramadan a peaceful &amp; blessed holy month.  Ramadan Mubarak.","TweetDeck",,,,FALSE,FALSE,0,0,"Ramadan",,,,,,,,,,,,,,,"en",,,,,,,,,,,,,
"x738848347134545920",2016-06-03 21:42:27,"x1055730738","RepLowenthal",".@LongBeachCity completes 1st phase of LED Streetlight Retrofit Program proving greener future is closer than we think.","TweetDeck",,,,FALSE,FALSE,3,2,,,,,,,,,,,,,,"x38808088","LongBeachCity","en",,,,,,,,,,,,,
"x735924106848313344",2016-05-26 20:02:34,"x1055730738","RepLowenthal",".#LB Cabrillo HS revamps Acad of Business &amp; introduces Global Logistics Academy for students interested in careers in #international #trade.","TweetDeck",,,,FALSE,FALSE,4,2,"LB international trade",,,,,,,,,,,,,,,"en",,,,,,,,,,,,,
"x735875460345761792",2016-05-26 16:49:16,"x1055730738","RepLowenthal","May 20 was #Vesak Day, holiday recognized by UN that celebrates birth, enlightenment &amp; passing of Buddha. Happy Vesak to all celebrating.","TweetDeck",,,,FALSE,FALSE,2,2,"Vesak",,,,,,,,,,,,,,,"en",,,,,,,,,,,,,
"x735477528538796032",2016-05-25 14:28:01,"x1055730738","RepLowenthal","Great to speak at @EnoTrans Freight Working Group meeting &amp; unveiling of a report on funding a federal #freight program.","TweetDeck",,,,FALSE,FALSE,2,1,"freight",,,,,,,,,,,,,"x239824566","EnoTrans","en",,,,,,,,,,,,,
"x733645490831667200",2016-05-20 13:08:10,"x1055730738","RepLowenthal","May is #OlderAmericansMonth—please join me in celebrating our #seniors who contribute so much to our nation.","TweetDeck",,,,FALSE,FALSE,1,1,"OlderAmericansMonth seniors",,,,,,,,,,,,,,,"en",,,,,,,,,,,,,
"x732933588858068993",2016-05-18 13:59:19,"x1055730738","RepLowenthal","BREAKING: One of Nigerian school girls horrifically kidnapped by Boko Haram in 2014 is said to be reunited w/ her family. #BringBackOurGirls","TweetDeck",,,,FALSE,FALSE,3,0,"BringBackOurGirls",,,,,,,,,,,,,,,"en",,,,,,,,,,,,,
"x732618152203440131",2016-05-17 17:05:53,"x1055730738","RepLowenthal","To the entire #LGBT community: you are not alone. You are strong, and @LGBTEqCaucus has your back. #WeAreWithYou","Twitter Web Client",,,,FALSE,FALSE,11,5,"LGBT WeAreWithYou",,,,,,,,,,,,,"x1392282998","LGBTEqCaucus","en",,,,,,,,,,,,,
"x732618008460427264",2016-05-17 17:05:19,"x1055730738","RepLowenthal","Proud to stand with @HRC on Intl. Day Against Homophobia &amp; Transphobia in fight for worldwide #LGBT equality. #IDAHOT","Twitter Web Client",,,,FALSE,FALSE,58,15,"LGBT IDAHOT",,,,,,,,,,,,,"x19608297","HRC","en",,,,,,,,,,,,,
"x730860081118629888",2016-05-12 20:39:56,"x1055730738","RepLowenthal","For nearly seven decades #Israel has been one of our longest &amp; closest allies in the Middle East. #YomHa’atzmaut #IsraeliIndependenceDay","TweetDeck",,,,FALSE,FALSE,24,9,"Israel YomHa IsraeliIndependenceDay",,,,,,,,,,,,,,,"en",,,,,,,,,,,,,
"x730811684793819137",2016-05-12 17:27:38,"x1055730738","RepLowenthal","Introduced Res to show US support for an environment that respects political opposition, #humanrights &amp; rule of law in #Cambodian Elections.","TweetDeck",,,,FALSE,FALSE,0,0,"humanrights Cambodian",,,,,,,,,,,,,,,"en",,,,,,,,,,,,,
"x730743793033596928",2016-05-12 12:57:51,"x1055730738","RepLowenthal","Approx. 30% of teen girls who drop out of #highschool say pregnancy is key reason. Reducing teen pregnancy improves #education. #StayTeen","TweetDeck",,,,FALSE,FALSE,0,1,"highschool education StayTeen",,,,,,,,,,,,,,,"en",,,,,,,,,,,,,
"x730480339907444737",2016-05-11 19:30:59,"x1055730738","RepLowenthal","We must make human rights in #Vietnam a priority &amp; increase pressure to release prisoners of conscience. #VietnamHumanRightsDay","TweetDeck",,,,FALSE,FALSE,1,1,"Vietnam VietnamHumanRightsDay",,,,,,,,,,,,,,,"en",,,,,,,,,,,,,
"x730079659623329792",2016-05-10 16:58:49,"x1055730738","RepLowenthal","Honored to receive a 100% perfect score from Defenders of Wildlife for my efforts to protect our native species in their natural #habitats.","TweetDeck",,,,FALSE,FALSE,12,3,"habitats",,,,,,,,,,,,,,,"en",,,,,,,,,,,,,
"x729303225958993920",2016-05-08 13:33:33,"x1055730738","RepLowenthal","This #MothersDay let’s give our mom’s what they deserve—a living wage. RT if you agree women deserve #equalpay for #equalwork. #WhatMomsNeed","Twitter Web Client",,,,FALSE,FALSE,7,7,"MothersDay equalpay equalwork WhatMomsNeed",,,,,,,,,,,,,,,"en",,,,,,,,,,,,,
"x728584291094024192",2016-05-06 13:56:46,"x1055730738","RepLowenthal",".@TheJusticeDept confirms what we have long known: #LGBT rights are #CivilRights. Time to pass #EqualityAct. #EqualityForward","TweetDeck",,,,FALSE,FALSE,0,0,"LGBT CivilRights EqualityAct EqualityForward",,,,,,,,,,,,,"x73181712","TheJusticeDept","en",,,,,,,,,,,,,
"x728330151239536640",2016-05-05 21:06:54,"x1055730738","RepLowenthal","On Yom HaShoah, Holocaust Remembrance Day, we remember lives tragically lost in one of darkest periods in human history.  #NeverAgain","Twitter Web Client",,,,FALSE,FALSE,4,1,"NeverAgain",,,,,,,,,,,,,,,"en",,,,,,,,,,,,,
"x728213030786478080",2016-05-05 13:21:30,"x1055730738","RepLowenthal",".@CSULB signs #Climate Leadership Commitment to show their drive to build an even more #sustainable campus.","TweetDeck",,,,FALSE,FALSE,1,1,"Climate sustainable",,,,,,,,,,,,,"x17053587","CSULB","en",,,,,,,,,,,,,
"x727892120913256448",2016-05-04 16:06:19,"x1055730738","RepLowenthal","Happy #TeacherAppreciationWeek! Let’s celebrate all of our teachers who continue to influence our next generation of leaders. #ThankATeacher","TweetDeck",,,,FALSE,FALSE,2,2,"TeacherAppreciationWeek ThankATeacher",,,,,,,,,,,,,,,"en",,,,,,,,,,,,,
"x727205558034509824",2016-05-02 18:38:10,"x1055730738","RepLowenthal","May is #APAHM, join me in celebrating the immeasurable strengths of our Asian Pacific American communities. #APAHM2016 @CAPAC","TweetDeck",,,,FALSE,FALSE,4,1,"APAHM APAHM2016",,,,,,,,,,,,,"x192955168","CAPAC","en",,,,,,,,,,,,,
"x726133054817882113",2016-04-29 19:36:25,"x1055730738","RepLowenthal","Spoke on the floor about 41st ann. of the Fall of Saigon. It’s critically important to continue to shine a light on #HumanRights in Vietnam.","TweetDeck",,,,FALSE,FALSE,2,2,"HumanRights",,,,,,,,,,,,,,,"en",,,,,,,,,,,,,
"x725390681712279554",2016-04-27 18:26:30,"x1055730738","RepLowenthal","When workers succeed, businesses and the economy succeed. It’s time for Congress to #RaiseTheWage","Twitter Web Client",,,,FALSE,FALSE,5,2,"RaiseTheWage",,,,,,,,,,,,,,,"en",,,,,,,,,,,,,
"x725390614557282304",2016-04-27 18:26:14,"x1055730738","RepLowenthal","Lifting families and working people out of poverty shouldn’t be a partisan issue: the entire nation deserves a fair wage. #RaiseTheWage","Twitter Web Client",,,,FALSE,FALSE,5,3,"RaiseTheWage",,,,,,,,,,,,,,,"en",,,,,,,,,,,,,
"x724245861312659456",2016-04-24 14:37:23,"x1055730738","RepLowenthal","Congrats to City of #Avalon, who received @USDOT grant to begin replacement &amp; expansion of old Ferry Terminal @ Cabrillo Mole on Catalina.","Twitter Web Client",,,,FALSE,FALSE,5,4,"Avalon",,,,,,,,,,,,,"x393562221","USDOT","en",,,,,,,,,,,,,
"x723654626625638400",2016-04-22 23:28:02,"x1055730738","RepLowenthal","Tonight marks the start of #Passover. Chag Sameach to all celebrating!","Twitter Lite",,,,FALSE,FALSE,4,5,"Passover",,,,,,,,,,,,,,,"en",,,,,,,,,,,,,
"x722182428824100864",2016-04-18 21:58:03,"x1055730738","RepLowenthal","Californians, along with the rest of the nation, stand together in support of the Ecuadorian people in this incredible time of need.","TweetDeck",,,,FALSE,FALSE,4,1,,,,,,,,,,,,,,,,"en",,,,,,,,,,,,,
"x721689542332264448",2016-04-17 13:19:29,"x1055730738","RepLowenthal","Today is #CambodianGenocideRemembranceDay. We must never forget the unspeakable horrors of the #CambodianGenocide.","Twitter Web Client",,,,FALSE,FALSE,2,7,"CambodianGenocideRemembranceDay CambodianGenocide",,,,,,,,,,,,,,,"en",,,,,,,,,,,,,
"x721409684536733696",2016-04-16 18:47:26,"x1055730738","RepLowenthal",".@CSULB ranks in top 10 on @PeaceCorps 2016 list of top volunteer-producing Hispanic-Serving Institutions (HSIs) nationwide! #GoBeach","Twitter Web Client",,,,FALSE,FALSE,2,5,"GoBeach",,,,,,,,,,,,,"x17053587 9109712","CSULB PeaceCorps","en",,,,,,,,,,,,,
"x721083087657005057",2016-04-15 21:09:39,"x1055730738","RepLowenthal","I hope we will all join together across our nation to remember #CambodianGenocide &amp; commemorate millions whose lives were tragically lost.","TweetDeck",,,,FALSE,FALSE,5,4,"CambodianGenocide",,,,,,,,,,,,,,,"en",,,,,,,,,,,,,
"x720603829650264065",2016-04-14 13:25:15,"x1055730738","RepLowenthal","Welcome to DC @portoflongbeach. Proud to rep leader in #environmental stewardship which is always paving way for sustainable #goodsmovement.","TweetDeck",,,,FALSE,FALSE,0,1,"environmental goodsmovement",,,,,,,,,,,,,"x16188231","portoflongbeach","en",,,,,,,,,,,,,
"x720602460549681153",2016-04-14 13:19:49,"x1055730738","RepLowenthal",".@LouisianaGov took an important step protecting #LGBT state employees, but its past time for full, national protections for LGBT Americans.","TweetDeck",,,,FALSE,FALSE,12,7,"LGBT",,,,,,,,,,,,,"x166374616","LouisianaGov","en",,,,,,,,,,,,,
"x720344396051251200",2016-04-13 20:14:22,"x1055730738","RepLowenthal","End of an era: #Kobe Bryant will finish his 20th season with the #LosAngeles @Lakers and play his final game this evening! #KobeBryant","Twitter Web Client",,,,FALSE,FALSE,4,2,"Kobe LosAngeles KobeBryant",,,,,,,,,,,,,"x20346956","Lakers","en",,,,,,,,,,,,,
"x719952535403032576",2016-04-12 18:17:15,"x1055730738","RepLowenthal","¡Cuando la mujer sobresale, el país sobresale! Durante #EqualPayDay, nos comprometimos a terminar la disparidad en el pago.","TweetDeck",,,,FALSE,FALSE,1,0,"EqualPayDay",,,,,,,,,,,,,,,"es",,,,,,,,,,,,,
"x716647005410299904",2016-04-03 15:22:15,"x1055730738","RepLowenthal","Our #students shouldn’t be shackled w/ debt when they leave #college. RT if you agree we must make #CollegeAffordable.","Twitter Web Client",,,,FALSE,FALSE,7,7,"students college CollegeAffordable",,,,,,,,,,,,,,,"en",,,,,,,,,,,,,
"x715648458137460740",2016-03-31 21:14:23,"x1055730738","RepLowenthal","I’m celebrating #TransDayOfVisibility to honor and recognize the courage it takes to live authentically. #MoreThanVisibility","TweetDeck",,,,FALSE,FALSE,1,0,"TransDayOfVisibility MoreThanVisibility",,,,,,,,,,,,,,,"en",,,,,,,,,,,,,
"x715648315631804416",2016-03-31 21:13:49,"x1055730738","RepLowenthal","Today, on #TransDayOfVisibility we celebrate courage of transgender &amp; gender nonconforming #Americans living openly despite adversity. #TDOV","TweetDeck",,,,FALSE,FALSE,0,0,"TransDayOfVisibility Americans TDOV",,,,,,,,,,,,,,,"en",,,,,,,,,,,,,
"x715598667772657665",2016-03-31 17:56:32,"x1055730738","RepLowenthal","Cesar Chavez serves as an inspiration to all Americans of what can be achieved when we organize &amp; fight for a just cause. #CesarChavezDay","TweetDeck",,,,FALSE,FALSE,2,2,"CesarChavezDay",,,,,,,,,,,,,,,"en",,,,,,,,,,,,,
"x715263659115749376",2016-03-30 19:45:19,"x1055730738","RepLowenthal","Calling ALL #HighSchool students in the 47th District. Deadline to submit artwork for Cong District Art Comp is April 15!","TweetDeck",,,,FALSE,FALSE,0,0,"HighSchool",,,,,,,,,,,,,,,"en",,,,,,,,,,,,,
"x714520795419123712",2016-03-28 18:33:27,"x1055730738","RepLowenthal","I stand with @WallyBrewster &amp; the entire #LGBT community in the #DominicanRepublic. We won’t give in to bullying. #ImWithWally","TweetDeck",,,,FALSE,FALSE,5,5,"LGBT DominicanRepublic ImWithWally",,,,,,,,,,,,,"x307552685","WallyBrewster","en",,,,,,,,,,,,,
"x714520711575040000",2016-03-28 18:33:07,"x1055730738","RepLowenthal","I stand with Ambassador @WallyBrewster and against anti-#LGBT hate and bigotry. RT to show your support. #ImWithWally","TweetDeck",,,,FALSE,FALSE,3,2,"LGBT ImWithWally",,,,,,,,,,,,,"x307552685","WallyBrewster","en",,,,,,,,,,,,,
"x712986880355213314",2016-03-24 12:58:13,"x1055730738","RepLowenthal",".@LBAirport named Best Airport for Dining, by @USAtoday/10Best.com Readers’ Choice Poll! #FlyLGB #LGB","TweetDeck",,,,FALSE,FALSE,1,2,"FlyLGB LGB",,,,,,,,,,,,,"x106872943 15754281","LBAirport USATODAY","en",,,,,,,,,,,,,
"x711948564503662592",2016-03-21 16:12:19,"x1055730738","RepLowenthal","Honored to be w/ #POTUS on historic #CubaVisit which gives US opportunity to reconnect w/ Cuban people on #economic &amp; #humanrights issues.","TweetDeck",,,,FALSE,FALSE,1,2,"POTUS CubaVisit economic humanrights",,,,,,,,,,,,,,,"en",,,,,,,,,,,,,
"x710193053689061376",2016-03-16 19:56:33,"x1055730738","RepLowenthal","OC Parenting magazine names #Cypress 4th best affordable city for families in #OrangeCounty. #CA47IsThePlaceToBe","TweetDeck",,,,FALSE,FALSE,4,1,"Cypress OrangeCounty CA47IsThePlaceToBe",,,,,,,,,,,,,,,"en",,,,,,,,,,,,,
"x707392661192351744",2016-03-09 02:28:47,"x1055730738","RepLowenthal","RT if you agree working #women deserve #EqualPayForEqualWork. #InternationalWomensDay","Twitter Web Client",,,,FALSE,FALSE,1,4,"women EqualPayForEqualWork InternationalWomensDay",,,,,,,,,,,,,,,"en",,,,,,,,,,,,,
"x705881574848536576",2016-03-04 22:24:16,"x1055730738","RepLowenthal","I will fight to strengthen #seniors programs &amp; protect them from cuts. Seniors deserve a secure #retirement.","TweetDeck",,,,FALSE,FALSE,9,2,"seniors retirement",,,,,,,,,,,,,,,"en",,,,,,,,,,,,,
"x705881487078531078",2016-03-04 22:23:55,"x1055730738","RepLowenthal","Thanks to #ACA 20 million #Americans gained #health coverage. Now for 1st time ever over 90% of Americans have health coverage. #ACAWorks","TweetDeck",,,,FALSE,FALSE,10,4,"ACA Americans health ACAWorks",,,,,,,,,,,,,,,"en",,,,,,,,,,,,,
"x705436791860555777",2016-03-03 16:56:52,"x1055730738","RepLowenthal","Some of our fav species are threatened by #ClimateChange. On #WorldWildlifeDay2016 we must #ActOnClimate to make a difference. #InOurHands","TweetDeck",,,,FALSE,FALSE,5,6,"ClimateChange WorldWildlifeDay2016 ActOnClimate InOurHands",,,,,,,,,,,,,,,"en",,,,,,,,,,,,,
"x704656530382184450",2016-03-01 13:16:23,"x1055730738","RepLowenthal","Women should be able to make #healthcare decisions that keep them and their #families safe. #MyBodyMyClinic #StopTheSham @SCOTUS","TweetDeck",,,,FALSE,FALSE,4,6,"healthcare families MyBodyMyClinic StopTheSham",,,,,,,,,,,,,"x15109516","Scotus","en",,,,,,,,,,,,,
"x702576055564017665",2016-02-24 19:29:19,"x1055730738","RepLowenthal","Today @HouseForeign Affairs Comm. passed @RepTedDeutch resolution urging Iran to come clean about U.S. hostage Bob Levinson #WhatAboutBob","TweetDeck",,,,FALSE,FALSE,3,2,"WhatAboutBob",,,,,,,,,,,,,"x75367781 137794015","HouseForeign RepTedDeutch","en",,,,,,,,,,,,,
"x697917974347452418",2016-02-11 22:59:46,"x1055730738","RepLowenthal","Everyone deserves Human Rights. Proud to send letter to Pres. Obama urging him to make #HumanRights key part of agenda at US-ASEAN summit.","TweetDeck",,,,FALSE,FALSE,1,1,"HumanRights",,,,,,,,,,,,,,,"en",,,,,,,,,,,,,
"x697870230870237186",2016-02-11 19:50:03,"x1055730738","RepLowenthal","Coastal Restoration: Good for the #environment, good for the #economy. #iheartestuaries","TweetDeck",,,,FALSE,FALSE,4,5,"environment economy iheartestuaries",,,,,,,,,,,,,,,"en",,,,,,,,,,,,,
"x697869693504323585",2016-02-11 19:47:55,"x1055730738","RepLowenthal",".#Estuaries support 2/3 of all commercial #seafood #iheartestuaries @CommerceGov @NOAAHabitat","TweetDeck",,,,FALSE,FALSE,3,2,"Estuaries seafood iheartestuaries",,,,,,,,,,,,,"x110541296 373526339","CommerceGov NOAAHabitat","en",,,,,,,,,,,,,
"x697155001676857354",2016-02-09 20:27:59,"x1055730738","RepLowenthal","Led letter w/ @RepRaulGrijalva @Nikiinthehouse &amp; 56 colleagues to @SecretaryJewell to applaud efforts to #ProtectPublicLands.","Twitter Web Client",,,,FALSE,FALSE,2,2,"ProtectPublicLands",,,,,,,,,,,,,"x28602948 242892689 1342861723","RepRaulGrijalva nikiinthehouse SecretaryJewell","en",,,,,,,,,,,,,
"x696441369401778176",2016-02-07 21:12:16,"x1055730738","RepLowenthal","Make sure that #FoodSafety is in your #SuperBowl party playbook to keep guests safe.  #FoodSafe50","Twitter Web Client",,,,FALSE,FALSE,0,0,"FoodSafety SuperBowl FoodSafe50",,,,,,,,,,,,,,,"en",,,,,,,,,,,,,
"x695982197157687296",2016-02-06 14:47:41,"x1055730738","RepLowenthal","Wishing all celebrating #Tet &amp; #LunarNewYear good fortune &amp; great happiness in year ahead.","TweetDeck",,,,FALSE,FALSE,4,3,"Tet LunarNewYear",,,,,,,,,,,,,,,"en",,,,,,,,,,,,,
"x695672431843868672",2016-02-05 18:16:47,"x1055730738","RepLowenthal","Honored to receive an “A” on #NEA Report Card. Proud to advocate for policies that secure continued success for our #students &amp; #teachers.","TweetDeck",,,,FALSE,FALSE,3,3,"NEA students teachers",,,,,,,,,,,,,,,"en",,,,,,,,,,,,,
"x695364179834724355",2016-02-04 21:51:54,"x1055730738","RepLowenthal","Today would be #RosaParks 103rd bday. She said, “Each person must live their life as a model for others.” She did. #BlackHistoryMonth","TweetDeck",,,,FALSE,FALSE,3,3,"RosaParks BlackHistoryMonth",,,,,,,,,,,,,,,"en",,,,,,,,,,,,,
"x694554389336461312",2016-02-02 16:14:05,"x1055730738","RepLowenthal","Nothing says Happy #GroundhogDay quite like #Congress voting yet again to repeal the #ACA. RT if you agree #ACAWorks.","TweetDeck",,,,FALSE,FALSE,2,1,"GroundhogDay Congress ACA ACAWorks",,,,,,,,,,,,,,,"en",,,,,,,,,,,,,
"x693162241982664704",2016-01-29 20:02:11,"x1055730738","RepLowenthal","On 7th anniversary of @Lilly_Ledbetter #FairPay Act we must continue our work to close #GenderPayGap and guarantee #EqualPay for #EqualWork.","TweetDeck",,,,FALSE,FALSE,5,3,"FairPay GenderPayGap EqualPay EqualWork",,,,,,,,,,,,,"x1093338182","Lilly_Ledbetter","en",,,,,,,,,,,,,
"x690656484745703426",2016-01-22 22:05:12,"x1055730738","RepLowenthal","Today marks 43 years since #RoeVWade. Proud to stand w/ millions of Americans to #ReclaimRoe.","Twitter Web Client",,,,FALSE,FALSE,5,1,"RoeVWade ReclaimRoe",,,,,,,,,,,,,,,"en",,,,,,,,,,,,,
"x688050092755017729",2016-01-15 17:28:20,"x1055730738","RepLowenthal","#Coal from public lands makes up &gt; 10% of all US greenhouse gas emissions. Thanks @Interior for holding coal companies accountable!","TweetDeck",,,,FALSE,FALSE,6,4,"Coal",,,,,,,,,,,,,"x76348185","Interior","en",,,,,,,,,,,,,
"x685226578830344192",2016-01-07 22:28:41,"x1055730738","RepLowenthal","The #ACAWorks. We must continue to keep working families healthy &amp; secure.","TweetDeck",,,,FALSE,FALSE,1,0,"ACAWorks",,,,,,,,,,,,,,,"en",,,,,,,,,,,,,
"x684517050967048192",2016-01-05 23:29:17,"x1055730738","RepLowenthal","Proud to join w/ 163 colleagues in #House &amp; #Senate to urge #SCOTUS to protect basic access to reproductive healthcare for all women.","Twitter Web Client",,,,FALSE,FALSE,5,1,"House Senate SCOTUS",,,,,,,,,,,,,,,"en",,,,,,,,,,,,,
"x684446916017569792",2016-01-05 18:50:35,"x1055730738","RepLowenthal","Congress must build on @POTUS action &amp; pass bipartisan King-Thompson bill for strong bckgrd checks &amp; no dangerous loopholes #StopGunViolence","Twitter Web Client",,,,FALSE,FALSE,6,2,"StopGunViolence",,,,,,,,,,,,,"x822215679726100480","POTUS","en",,,,,,,,,,,,,
"x678998323148165120",2015-12-21 17:59:50,"x1055730738","RepLowenthal","Proud to join w/ my colleagues on Tom Lantos #HumanRights Commission to #StandForHumanRights in Cambodia &amp; Laos.","TweetDeck",,,,FALSE,FALSE,3,3,"HumanRights StandForHumanRights",,,,,,,,,,,,,,,"en",,,,,,,,,,,,,
"x676492842529906688",2015-12-14 20:03:56,"x1055730738","RepLowenthal","It’s been 3 years since the tragedy in Newtown. We owe it to the families to take action to keep our communities safe.","TweetDeck",,,,FALSE,FALSE,3,3,,,,,,,,,,,,,,,,"en",,,,,,,,,,,,,
"x674693885000622080",2015-12-09 20:55:32,"x1055730738","RepLowenthal","Proud to stand w/ over 160 of my colleagues to say NO MORE to violence against women’s health providers. #OurHealthOurSafety","Twitter Web Client",,,,FALSE,FALSE,3,1,"OurHealthOurSafety",,,,,,,,,,,,,,,"en",,,,,,,,,,,,,
"x672493879460044800",2015-12-03 19:13:29,"x1055730738","RepLowenthal","Women can NOW serve in frontline #combat positions. News reaffirms what we’ve long known women can do everything men can. @DeptofDefense","TweetDeck",,,,FALSE,FALSE,6,4,"combat",,,,,,,,,,,,,"x66369181","DeptofDefense","en",,,,,,,,,,,,,
"x671804330786312192",2015-12-01 21:33:28,"x1055730738","RepLowenthal","Today is #GivingTuesday what a great way to celebrate our commitment to helping others in need!","Twitter Web Client",,,,FALSE,FALSE,1,1,"GivingTuesday",,,,,,,,,,,,,,,"en",,,,,,,,,,,,,
"x671478645018501120",2015-11-30 23:59:19,"x1055730738","RepLowenthal","We have an obligation to take thoughtful action to protect our #environment for future generations. #ActOnClimate #COP21","Twitter Web Client",,,,FALSE,FALSE,3,4,"environment ActOnClimate COP21",,,,,,,,,,,,,,,"en",,,,,,,,,,,,,
"x671359295938797569",2015-11-30 16:05:04,"x1055730738","RepLowenthal","Para tener cobertura de salud de #CoveredCA el 1 de ene., la fecha límite es el 15 de dic. ¡Llama al (800) 300-0213!","Twitter Web Client",,,,FALSE,FALSE,0,1,"CoveredCA",,,,,,,,,,,,,,,"es",,,,,,,,,,,,,
"x671359257623834624",2015-11-30 16:04:54,"x1055730738","RepLowenthal","Deadline reminder! For health coverage through @CoveredCA starting Jan. 1, you must enroll by Dec. 15. Call #CoveredCA at 800-300-1506","Twitter Web Client",,,,FALSE,FALSE,0,2,"CoveredCA",,,,,,,,,,,,,"x915514734","CoveredCA","en",,,,,,,,,,,,,
"x671344675752714240",2015-11-30 15:06:58,"x1055730738","RepLowenthal","November is National Alzheimer’s Disease Awareness Month &amp; National Family Caregivers Month. #ENDALZ #HonorACaregiver","Twitter Web Client",,,,FALSE,FALSE,4,6,"ENDALZ HonorACaregiver",,,,,,,,,,,,,,,"en",,,,,,,,,,,,,
"x670312744218853376",2015-11-27 18:46:26,"x1055730738","RepLowenthal","Proud to lead bipartisan letter to House Approps Committee w/ @RepComstock to secure #STARBASE funding for fiscal year. #JFTB @DeptofDefense","TweetDeck",,,,FALSE,FALSE,2,0,"STARBASE JFTB",,,,,,,,,,,,,"x2933760046 66369181","RepComstock DeptofDefense","en",,,,,,,,,,,,,
"x669585273563516928",2015-11-25 18:35:44,"x1055730738","RepLowenthal","Honor to join #LB Councilman Dee Andrews at 8th annual Serving w/ a Thankful Heart #Thanksgiving banquet this week.","TweetDeck",,,,FALSE,FALSE,1,0,"LB Thanksgiving",,,,,,,,,,,,,,,"en",,,,,,,,,,,,,
"x669574540138258434",2015-11-25 17:53:05,"x1055730738","RepLowenthal","Turkey questions? The USDA Meat &amp; Poultry Hotline is open 8:00am-2:00pm ET #Thanksgiving. Call 1-888-674-6854! #TurkeyDayTips","TweetDeck",,,,FALSE,FALSE,1,1,"Thanksgiving TurkeyDayTips",,,,,,,,,,,,,,,"en",,,,,,,,,,,,,
"x669288015802589184",2015-11-24 22:54:32,"x1055730738","RepLowenthal",".#SmallBizSat is just around the corner. Great way to #ShopSmall &amp; support our community this holiday season!","TweetDeck",,,,FALSE,FALSE,2,2,"SmallBizSat ShopSmall",,,,,,,,,,,,,,,"en",,,,,,,,,,,,,
"x668908182119563264",2015-11-23 21:45:12,"x1055730738","RepLowenthal","Words matter. Proud to join @JoaquinCastrotx and call for an end to the term alien in federal law. #ActOnImmigrationReform #CHANGEAct","TweetDeck",,,,FALSE,FALSE,22,23,"ActOnImmigrationReform CHANGEAct",,,,,,,,,,,,,"x231510077","JoaquinCastrotx","en",,,,,,,,,,,,,
"x667820707829538816",2015-11-20 21:43:58,"x1055730738","RepLowenthal","It's Universal #ChildrensDay! Supporting #ChildRights gives our kids &amp; their families the opportunity to thrive. @UN","TweetDeck",,,,FALSE,FALSE,1,0,"ChildrensDay ChildRights",,,,,,,,,,,,,"x14159148","UN","en",,,,,,,,,,,,,
"x667782517928407040",2015-11-20 19:12:13,"x1055730738","RepLowenthal","No podemos perpetuar un sistema migratorio que destroza familias. Únanse a nosotros para aprobar la #ReformaMigratoria.","TweetDeck",,,,FALSE,FALSE,0,1,"ReformaMigratoria",,,,,,,,,,,,,,,"es",,,,,,,,,,,,,
