"status_id","created_at","user_id","screen_name","text","source","reply_to_status_id","reply_to_user_id","reply_to_screen_name","is_quote","is_retweet","favorite_count","retweet_count","hashtags","symbols","urls_url","urls_t.co","urls_expanded_url","media_url","media_t.co","media_expanded_url","media_type","ext_media_url","ext_media_t.co","ext_media_expanded_url","ext_media_type","mentions_user_id","mentions_screen_name","lang","quoted_status_id","quoted_text","retweet_status_id","retweet_text","place_url","place_name","place_full_name","place_type","country","country_code","geo_coords","coords_coords","bbox_coords"
"x963896476580614145",2018-02-14 22:03:23,"x2856787757","SenJoniErnst","Please join me in praying for the students, faculty, and staff at Marjory Stoneman Douglas High School, as well as their loved ones. Let us also show our gratitude to the courageous first responders.","Twitter Web Client",,,,FALSE,FALSE,608,150,,,,,,,,,,,,,,,,"en",,,,,,,,,,,,,
"x956235438280372224",2018-01-24 18:41:09,"x2856787757","SenJoniErnst","Larry Nassar‘s actions are horrifying &amp; disgusting, &amp; today, survivors of his sexual abuse in U.S. gymnastics saw some justice in his sentencing. I’m so inspired by the courage &amp; strength of the survivors. We must do more to prevent such horrific acts from occurring again. (1/2)","Twitter Web Client",,,,FALSE,FALSE,64,17,,,,,,,,,,,,,,,,"en",,,,,,,,,,,,,
"x952888105308127234",2018-01-15 13:00:02,"x2856787757","SenJoniErnst","Today, let us not only honor the dynamic leader, Martin Luther King Jr., but his eternal message of equality, peace and love for your fellow man. #MLKDay2018","TweetDeck",,,,FALSE,FALSE,273,76,"MLKDay2018",,,,,,,,,,,,,,,"en",,,,,,,,,,,,,
"x949085783700508673",2018-01-05 01:10:58,"x2856787757","SenJoniErnst","The recent protests in Iran further expose the brutality of the Iranian regime. That is why I joined a bipartisan group of colleagues in condemning the government of Iran for their support of terrorist organizations and the continued oppression of the Iranian people. (1/2)","Twitter for iPhone",,,,FALSE,FALSE,48,13,,,,,,,,,,,,,,,,"en",,,,,,,,,,,,,
"x948287565660082177",2018-01-02 20:19:08,"x2856787757","SenJoniErnst","Fortunate to have worked with my friend @senorrinhatch over the last three years. Thank you for your years of dedicated service and wishing you, Elaine, and your family the very best.","Twitter Web Client",,,,FALSE,FALSE,36,6,,,,,,,,,,,,,,"x262756641","senorrinhatch","en",,,,,,,,,,,,,
"x940683383289602050",2017-12-12 20:42:50,"x2856787757","SenJoniErnst","To all who are celebrating, wishing you a #HappyHanukkah","Twitter Web Client",,,,FALSE,FALSE,23,4,"HappyHanukkah",,,,,,,,,,,,,,,"en",,,,,,,,,,,,,
"x940265829488357377",2017-12-11 17:03:37,"x2856787757","SenJoniErnst","Please join me in praying for those in NYC impacted by the Times Square terror attack and expressing gratitude for the first responders and law enforcement who rushed into action.","Twitter Web Client",,,,FALSE,FALSE,42,8,,,,,,,,,,,,,,,,"en",,,,,,,,,,,,,
"x938874194116468736",2017-12-07 20:53:45,"x2856787757","SenJoniErnst","Thank you @realDonaldTrump for reiterating your commitment to Iowans and all of rural America by continuing to support the Renewable Fuel Standard in today’s meeting.","Twitter Web Client",,,,FALSE,FALSE,135,38,,,,,,,,,,,,,,"x25073877","realDonaldTrump","en",,,,,,,,,,,,,
"x930856097707065344",2017-11-15 17:52:42,"x2856787757","SenJoniErnst","Today the Senate confirmed Dr. Mark Esper to be Secretary of the Army. As a member of the Senate Armed Services Committee, I look forward to working with Dr. Esper to ensure our soldiers have the resources they need to protect our homeland &amp; defend our freedoms.","Twitter Web Client",,,,FALSE,FALSE,84,27,,,,,,,,,,,,,,,,"en",,,,,,,,,,,,,
"x929037417922859008",2017-11-10 17:25:55,"x2856787757","SenJoniErnst","Thank you to the @USMC for 242 of service to our great nation. Happy Birthday, Marines!","Twitter Web Client",,,,FALSE,FALSE,36,8,,,,,,,,,,,,,,"x10126672","USMC","en",,,,,,,,,,,,,
"x925481635092549633",2017-10-31 21:56:31,"x2856787757","SenJoniErnst","Praying for the victims of this horrific terror attack in NYC. Grateful for the selfless actions of first responders and law enforcement.","Twitter Web Client",,,,FALSE,FALSE,49,15,,,,,,,,,,,,,,,,"en",,,,,,,,,,,,,
"x923197537837895681",2017-10-25 14:40:19,"x2856787757","SenJoniErnst","Good discussion with @realDonaldTrump at lunch yesterday on the Hill over tax reform. (1/2)","Twitter Web Client",,,,FALSE,FALSE,53,8,,,,,,,,,,,,,,"x25073877","realDonaldTrump","en",,,,,,,,,,,,,
"x914859313503588352",2017-10-02 14:27:12,"x2856787757","SenJoniErnst","My prayers are with all of the victims in #LasVegas and their loved ones affected by this senseless act of violence.","Twitter Web Client",,,,FALSE,FALSE,179,42,"LasVegas",,,,,,,,,,,,,,,"en",,,,,,,,,,,,,
"x913439534049894402",2017-09-28 16:25:30,"x2856787757","SenJoniErnst","We tragically lose 20 veterans a day to suicide, according to VA. One vet lost to suicide is too many. We must do better for our vets. (1/2)","Twitter Web Client",,,,FALSE,FALSE,50,12,,,,,,,,,,,,,,,,"en",,,,,,,,,,,,,
"x909916178641977349",2017-09-18 23:04:57,"x2856787757","SenJoniErnst","Today the Senate passed the FY18 #NDAA, ensuring our servicemembers have the resources they need to protect themselves &amp; our country (1/2)","Twitter Web Client",,,,FALSE,FALSE,21,6,"NDAA",,,,,,,,,,,,,,,"en",,,,,,,,,,,,,
"x908025370871582721",2017-09-13 17:51:33,"x2856787757","SenJoniErnst","BREAKING: Our bill to roll back former presidents’ perks just passed out of @GOPoversight w/ unanimous support. cc @CongressmanHice (1/2)","Twitter Web Client",,,,FALSE,FALSE,51,16,,,,,,,,,,,,,,"x22508473 2975091705","GOPoversight CongressmanHice","en",,,,,,,,,,,,,
"x902613143041581056",2017-08-29 19:25:17,"x2856787757","SenJoniErnst","Grateful for first responders &amp; volunteers (inclu many Iowa volunteers) working tirelessly to help those impacted by #HurricaneHarvey. (1/2)","Twitter Web Client",,,,FALSE,FALSE,12,4,"HurricaneHarvey",,,,,,,,,,,,,,,"en",,,,,,,,,,,,,
"x902181124478312449",2017-08-28 14:48:36,"x2856787757","SenJoniErnst","Join me in praying for all those affected by #HurricaneHarvey.","TweetDeck",,,,FALSE,FALSE,82,10,"HurricaneHarvey",,,,,,,,,,,,,,,"en",,,,,,,,,,,,,
"x899981412929073153",2017-08-22 13:07:44,"x2856787757","SenJoniErnst","This week is National Employer Support of the Guard and Reserve Week. (1/2)","Twitter for iPhone",,,,FALSE,FALSE,11,3,,,,,,,,,,,,,,,,"en",,,,,,,,,,,,,
"x899683468728250368",2017-08-21 17:23:48,"x2856787757","SenJoniErnst","Our servicemembers serve tirelessly each day to uphold our freedoms. Please join me in praying for our missing USS John S McCain sailors.","TweetDeck",,,,FALSE,FALSE,26,9,,,,,,,,,,,,,,,,"en",,,,,,,,,,,,,
"x898253128641982468",2017-08-17 18:40:09,"x2856787757","SenJoniErnst","Our prayers are with the victims and all those impacted by the horrible terror attack in #Barcelona.","Twitter Web Client",,,,FALSE,FALSE,39,6,"Barcelona",,,,,,,,,,,,,,,"en",,,,,,,,,,,,,
"x896500115107717120",2017-08-12 22:34:18,"x2856787757","SenJoniErnst","The violence in #Charlottesville that is fueled by racist hatred has no place in our society. (1/2)","Twitter for iPhone",,,,FALSE,FALSE,197,61,"Charlottesville",,,,,,,,,,,,,,,"en",,,,,,,,,,,,,
"x893184516461912065",2017-08-03 18:59:17,"x2856787757","SenJoniErnst","Pleased the VA has decided to expand telehealth services for veterans &amp; provide telemedicine across state lines... (1/2)","Twitter Web Client",,,,FALSE,FALSE,23,10,,,,,,,,,,,,,,,,"en",,,,,,,,,,,,,
"x890968055714635776",2017-07-28 16:11:52,"x2856787757","SenJoniErnst","Thrilled the House passed the Global War on Terrorism War Memorial Act. I intro'd this bipartisan bill in the Senate w/ Sen Manchin... (1/3)","Twitter Web Client",,,,FALSE,FALSE,12,4,,,,,,,,,,,,,,,,"en",,,,,,,,,,,,,
"x890580788533760012",2017-07-27 14:33:00,"x2856787757","SenJoniErnst","On #NationalKoreanWarArmisticeDay, we recognize the service of our men &amp; women who fought to defend freedom &amp; democracy in the Korean War.","TweetDeck",,,,FALSE,FALSE,28,7,"NationalKoreanWarArmisticeDay",,,,,,,,,,,,,,,"en",,,,,,,,,,,,,
"x878259806242340864",2017-06-23 14:33:49,"x2856787757","SenJoniErnst",".@SenGillibrand &amp; I intro'd bipartisan legislation to create a career track for the Judge Advocate General (JAG) Corps (1/2)","Twitter Web Client",,,,FALSE,FALSE,9,4,,,,,,,,,,,,,,"x72198806","SenGillibrand","en",,,,,,,,,,,,,
"x876877401426472961",2017-06-19 19:00:38,"x2856787757","SenJoniErnst","My prayers are with the 7 sailors killed aboard the USS Fitzgerald, as well as their families, friends &amp; shipmates.","Twitter Web Client",,,,FALSE,FALSE,47,7,,,,,,,,,,,,,,,,"en",,,,,,,,,,,,,
"x875110605237002240",2017-06-14 22:00:01,"x2856787757","SenJoniErnst","Happy birthday to the 45th President of the United States, @POTUS!","TweetDeck",,,,FALSE,FALSE,80,16,,,,,,,,,,,,,,"x822215679726100480","POTUS","en",,,,,,,,,,,,,
"x874973969048367104",2017-06-14 12:57:05,"x2856787757","SenJoniErnst","Please join me in praying for @stevescalise, Capitol Police and all those impacted at the congressional baseball practice this am.","TweetDeck",,,,FALSE,FALSE,119,29,,,,,,,,,,,,,,"x1209417007","SteveScalise","en",,,,,,,,,,,,,
"x874738958218952704",2017-06-13 21:23:14,"x2856787757","SenJoniErnst","Earlier today I joined many of my Senate colleagues at a White House meeting on health care reform. (1/2)","Twitter Web Client",,,,FALSE,FALSE,20,5,,,,,,,,,,,,,,,,"en",,,,,,,,,,,,,
"x872451791438450689",2017-06-07 13:54:51,"x2856787757","SenJoniErnst","Wishing a very happy birthday to my fellow Midwesterner and friend, @vp!","TweetDeck",,,,FALSE,FALSE,8,2,,,,,,,,,,,,,,"x818910970567344128","VP","en",,,,,,,,,,,,,
"x866822163302666241",2017-05-23 01:04:43,"x2856787757","SenJoniErnst","Our thoughts and prayers are with the victims and their families in Manchester following this horrific act of terrorism.","TweetDeck",,,,FALSE,FALSE,62,15,,,,,,,,,,,,,,,,"en",,,,,,,,,,,,,
"x864831895833645059",2017-05-17 13:16:06,"x2856787757","SenJoniErnst","Prayers for my friend @SenThomTillis. Wishing him well.","TweetDeck",,,,FALSE,FALSE,43,13,,,,,,,,,,,,,,"x2964174789","SenThomTillis","en",,,,,,,,,,,,,
"x864593156540682240",2017-05-16 21:27:26,"x2856787757","SenJoniErnst","Prayers and well-wishes for a speedy recovery to my friend @maziehirono as she undergoes treatment.","Twitter Web Client",,,,FALSE,FALSE,8,1,,,,,,,,,,,,,,"x92186819","maziehirono","en",,,,,,,,,,,,,
"x860116815401410562",2017-05-04 13:00:03,"x2856787757","SenJoniErnst","Happy #SoilandWaterConservationWeek! Growing up on a family farm taught me the value of conserving our land &amp; water for future generations.","TweetDeck",,,,FALSE,FALSE,19,3,"SoilandWaterConservationWeek",,,,,,,,,,,,,,,"en",,,,,,,,,,,,,
"x856940543741480962",2017-04-25 18:38:41,"x2856787757","SenJoniErnst","Proud to introduce legislation w/ @Sen_JoeManchin to authorize the construction of the Global War on Terrorism Memorial (1/2)","Twitter Web Client",,,,FALSE,FALSE,10,2,,,,,,,,,,,,,,"x234374703","Sen_JoeManchin","en",,,,,,,,,,,,,
"x856590227321868288",2017-04-24 19:26:39,"x2856787757","SenJoniErnst","We must #NeverForget the horrific events of the Holocaust and the senseless murder of millions of Jewish people. #HolocaustRemembranceDay","Twitter Web Client",,,,FALSE,FALSE,18,6,"NeverForget HolocaustRemembranceDay",,,,,,,,,,,,,,,"en",,,,,,,,,,,,,
"x856515898936623104",2017-04-24 14:31:18,"x2856787757","SenJoniErnst","Iowan @AstroPeggy, the first woman to command the ISS twice, today broke the record for most cumulative days in space by any American. (1/2)","Twitter Web Client",,,,FALSE,FALSE,29,11,,,,,,,,,,,,,,"x3073871212","AstroPeggy","en",,,,,,,,,,,,,
"x851109145822597120",2017-04-09 16:26:47,"x2856787757","SenJoniErnst","Our prayers are with the victims &amp; families impacted by the horrific #PalmSunday terror attack in #Egypt.","Twitter for iPhone",,,,FALSE,FALSE,48,11,"PalmSunday Egypt",,,,,,,,,,,,,,,"en",,,,,,,,,,,,,
"x849657626191425537",2017-04-05 16:18:58,"x2856787757","SenJoniErnst","Please join me in congratulating @AstroPeggy on these remarkable accomplishments! (4/4)","TweetDeck",,,,FALSE,FALSE,13,4,,,,,,,,,,,,,,"x3073871212","AstroPeggy","en",,,,,,,,,,,,,
"x849657573708005377",2017-04-05 16:18:46,"x2856787757","SenJoniErnst","Dr. Whitson will also be promoted to commander of ISS – becoming the only woman to hold that title twice. (3/4)","TweetDeck",,,,FALSE,FALSE,6,3,,,,,,,,,,,,,,,,"en",,,,,,,,,,,,,
"x849657393902432257",2017-04-05 16:18:03,"x2856787757","SenJoniErnst","Great to talk with @AstroPeggy all the way from the @Space_Station to congratulate her on setting the record for… (1/4)","TweetDeck",,,,FALSE,FALSE,6,3,,,,,,,,,,,,,,"x3073871212 1451773004","AstroPeggy Space_Station","en",,,,,,,,,,,,,
"x847553020053389314",2017-03-30 20:56:01,"x2856787757","SenJoniErnst","Today the Senate overturned an 11th-hour rule issued by the Obama administration… (1/2)","TweetDeck",,,,FALSE,FALSE,18,4,,,,,,,,,,,,,,,,"en",,,,,,,,,,,,,
"x844668533938278400",2017-03-22 21:54:06,"x2856787757","SenJoniErnst","Saddened by today's terror attack in London. Let us remember the lives lost (1/2)","Twitter Web Client",,,,FALSE,FALSE,23,6,,,,,,,,,,,,,,,,"en",,,,,,,,,,,,,
"x837051477029974018",2017-03-01 21:26:38,"x2856787757","SenJoniErnst","Pleased the House passed the SCRUB Act. We need to let our businesses focus on what they do best, innovate &amp; create jobs- not regulations.","TweetDeck",,,,FALSE,FALSE,21,7,,,,,,,,,,,,,,,,"en",,,,,,,,,,,,,
"x832584510353072128",2017-02-17 13:36:30,"x2856787757","SenJoniErnst","Happy Independence Day #Kosovo!","TweetDeck",,,,FALSE,FALSE,30,7,"Kosovo",,,,,,,,,,,,,,,"en",,,,,,,,,,,,,
"x826848137868431363",2017-02-01 17:42:12,"x2856787757","SenJoniErnst","Mr Pruitt answered 1200+ questions from this cmte - over 1k more answers than the incoming noms from the last 4 administrations #Delayocrats","TweetDeck",,,,FALSE,FALSE,50,31,"Delayocrats",,,,,,,,,,,,,,,"en",,,,,,,,,,,,,
"x826848086387519488",2017-02-01 17:42:00,"x2856787757","SenJoniErnst","...but there comes a point when vetting has been turned into obstruction and that is what we are witnessing here today. (2/2) #Delayocrats","TweetDeck",,,,FALSE,FALSE,52,25,"Delayocrats",,,,,,,,,,,,,,,"en",,,,,,,,,,,,,
"x826847920708272128",2017-02-01 17:41:21,"x2856787757","SenJoniErnst","Vetting nominees is an important role and one that I take seriously as do my colleagues... (1/2) #Delayocrats","TweetDeck",,,,FALSE,FALSE,37,14,"Delayocrats",,,,,,,,,,,,,,,"en",,,,,,,,,,,,,
"x822237630599405570",2017-01-20 00:21:42,"x2856787757","SenJoniErnst","I was also glad last week to hear General Mattis say he would work with me to address our military's outdated weapon systems... (3/4)","TweetDeck",,,,FALSE,FALSE,38,6,,,,,,,,,,,,,,,,"en",,,,,,,,,,,,,
"x822237275866230786",2017-01-20 00:20:17,"x2856787757","SenJoniErnst","After over 30 years with the M9 &amp; countless issues with the Modular Handgun System acquisition program to replace it... (1/4)","TweetDeck",,,,FALSE,FALSE,8,2,,,,,,,,,,,,,,,,"en",,,,,,,,,,,,,
"x821819580389748736",2017-01-18 20:40:31,"x2856787757","SenJoniErnst","I am pleased to join @SASCMajority in giving my support to General Mattis to be Secretary of Defense.","TweetDeck",,,,FALSE,FALSE,29,6,,,,,,,,,,,,,,"x275572403","SASCMajority","en",,,,,,,,,,,,,
"x817485617286221824",2017-01-06 21:38:53,"x2856787757","SenJoniErnst","I am heartbroken over the news of the shooting at the Fort Lauderdale airport. My prayers are with the victims and their families. #FLL","Twitter Web Client",,,,FALSE,FALSE,39,13,"FLL",,,,,,,,,,,,,,,"en",,,,,,,,,,,,,
"x817169680737697793",2017-01-06 00:43:28,"x2856787757","SenJoniErnst","Pleased the House passed a resolution condemning anti-Israel UN action. Proud to have introduced bill in Senate to show we #StandwithIsrael","Twitter for iPhone",,,,FALSE,FALSE,94,29,"StandwithIsrael",,,,,,,,,,,,,,,"en",,,,,,,,,,,,,
"x809865928116699136",2016-12-16 21:00:58,"x2856787757","SenJoniErnst","This legislation will help uphold our commitment to provide quality &amp; timely care for our veterans (3/3)","Twitter Web Client",,,,FALSE,FALSE,9,2,,,,,,,,,,,,,,,,"en",,,,,,,,,,,,,
"x809865876723929088",2016-12-16 21:00:46,"x2856787757","SenJoniErnst","Veterans shouldn't have long waits for VA appointments, &amp; this bill modernizes processes by allowing vets to schedule &amp; confirm online (2/3)","Twitter Web Client",,,,FALSE,FALSE,39,9,,,,,,,,,,,,,,,,"en",,,,,,,,,,,,,
"x809781319995682816",2016-12-16 15:24:46,"x2856787757","SenJoniErnst","This marks my 4th bill to be signed into law, and I look forward to continuing to find new ways to eliminate govt waste. (3/3)","Twitter Web Client",,,,FALSE,FALSE,55,12,,,,,,,,,,,,,,,,"en",,,,,,,,,,,,,
"x809781180413464576",2016-12-16 15:24:13,"x2856787757","SenJoniErnst","Thrilled that my bipartisan Program Management Improvement and Accountability Act I intro'd with @SenatorHeitkamp was signed into law (1/3)","Twitter Web Client",,,,FALSE,FALSE,16,5,,,,,,,,,,,,,,"x1061029050","SenatorHeitkamp","en",,,,,,,,,,,,,
"x806544460846919680",2016-12-07 17:02:38,"x2856787757","SenJoniErnst","I am thankful to have served alongside @KellyAyotte in the United States Senate &amp; incredibly thankful to call her my friend. (2/2)","Twitter Web Client",,,,FALSE,FALSE,45,9,,,,,,,,,,,,,,"x229592356","KellyAyotte","en",,,,,,,,,,,,,
"x806544397349306368",2016-12-07 17:02:23,"x2856787757","SenJoniErnst",".@KellyAyotte has tirelessly served the people of NH with passion &amp; dedication, and has supported those serving in our armed forces. (1/2)","Twitter Web Client",,,,FALSE,FALSE,37,7,,,,,,,,,,,,,,"x229592356","KellyAyotte","en",,,,,,,,,,,,,
"x806271950507180032",2016-12-06 22:59:47,"x2856787757","SenJoniErnst","Our veterans should be able to easily schedule their own appointments w/ the VA. We will keep working to make that a possibility. 2/2","Twitter Web Client",,,,FALSE,FALSE,29,10,,,,,,,,,,,,,,,,"en",,,,,,,,,,,,,
"x806271896891363330",2016-12-06 22:59:34,"x2856787757","SenJoniErnst","The House version of our Faster Care for Veterans Act passed the House today!  CC @amyklobuchar 1/2","Twitter Web Client",,,,FALSE,FALSE,22,10,,,,,,,,,,,,,,"x33537967","amyklobuchar","en",,,,,,,,,,,,,
"x803978908597153793",2016-11-30 15:08:03,"x2856787757","SenJoniErnst","We must make sure our first responders have the best training and equipment possible to better protect them as well as our communities.(4/4)","Twitter Web Client",,,,FALSE,FALSE,30,6,,,,,,,,,,,,,,,,"en",,,,,,,,,,,,,
"x803978753219186688",2016-11-30 15:07:26,"x2856787757","SenJoniErnst","The findings and recommendations would then be reported to Congress so we can act. (3/4)","Twitter Web Client",,,,FALSE,FALSE,2,1,,,,,,,,,,,,,,,,"en",,,,,,,,,,,,,
"x803978701557952512",2016-11-30 15:07:14,"x2856787757","SenJoniErnst","response plans and overall strategies used by our first responders when they are faced with railroad hazardous materials incidents. (2/4)","Twitter Web Client",,,,FALSE,FALSE,4,2,,,,,,,,,,,,,,,,"en",,,,,,,,,,,,,
"x803978668989181952",2016-11-30 15:07:06,"x2856787757","SenJoniErnst","Glad our bipartisan bill, RESPONSE Act, passed the House which would establish a council to evaluate the current training methods, (1/4)","Twitter Web Client",,,,FALSE,FALSE,5,2,,,,,,,,,,,,,,,,"en",,,,,,,,,,,,,
"x803258365350707200",2016-11-28 15:24:52,"x2856787757","SenJoniErnst","News of a bomb near the US Embassy in Philippines is alarming. I continue my call for @POTUS to focus on spread of ISIS in SE Asia (1/2)","Twitter for iPhone",,,,FALSE,FALSE,17,8,,,,,,,,,,,,,,"x822215679726100480","POTUS","en",,,,,,,,,,,,,
"x799620848609017856",2016-11-18 14:30:41,"x2856787757","SenJoniErnst","... let us remember to lend a helping hand to all those struggling in our communities. (2/2)","TweetDeck",,,,FALSE,FALSE,45,25,,,,,,,,,,,,,,,,"en",,,,,,,,,,,,,
"x799620790526164992",2016-11-18 14:30:27,"x2856787757","SenJoniErnst","It’s National Hunger and Homelessness Awareness Week. As colder weather and the holiday season approaches... (1/2)","TweetDeck",,,,FALSE,FALSE,46,27,,,,,,,,,,,,,,,,"en",,,,,,,,,,,,,
"x799251408293724162",2016-11-17 14:02:39,"x2856787757","SenJoniErnst","to the health care services they need by promoting the use of telemedicine and fighting to protect our community hospitals. (2/2)","TweetDeck",,,,FALSE,FALSE,10,10,,,,,,,,,,,,,,,,"en",,,,,,,,,,,,,
"x799251365285466112",2016-11-17 14:02:29,"x2856787757","SenJoniErnst","Today is National Rural Health Day. I’m working to ensure that Iowans living in rural and underserved areas have access...(1/2)","TweetDeck",,,,FALSE,FALSE,16,11,,,,,,,,,,,,,,,,"en",,,,,,,,,,,,,
"x798707479710416897",2016-11-16 02:01:17,"x2856787757","SenJoniErnst","No presumption, but I hit a deer last night @ChuckGrassley. What do you think its odds are?","Twitter for iPhone",,,,FALSE,FALSE,89,46,,,,,,,,,,,,,,"x10615232","ChuckGrassley","en",,,,,,,,,,,,,
"x797939049356881920",2016-11-13 23:07:49,"x2856787757","SenJoniErnst","by an enemy torpedo on this day in 1942. They, and all Iowans who gave their lives for our freedom, are true heroes. (3/3)","TweetDeck",,,,FALSE,FALSE,23,8,,,,,,,,,,,,,,,,"en",,,,,,,,,,,,,
"x797938674671435776",2016-11-13 23:06:19,"x2856787757","SenJoniErnst","the attack on Pearl Harbor, and they tragically all lost their lives at the battle for Guadalcanal after the USS Juneau was struck... (2/3)","TweetDeck",,,,FALSE,FALSE,28,10,,,,,,,,,,,,,,,,"en",,,,,,,,,,,,,
"x797938401680953344",2016-11-13 23:05:14,"x2856787757","SenJoniErnst","Today we remember the five Sullivan brothers from Waterloo. These Iowans courageously decided to enlist together following... (1/3)","TweetDeck",,,,FALSE,FALSE,52,16,,,,,,,,,,,,,,,,"en",,,,,,,,,,,,,
"x791691366401269760",2016-10-27 17:21:45,"x2856787757","SenJoniErnst","Congrats to the historic 10 female soldiers who graduated from @FortBenning's Army Infantry Officer Basic Leadership Course yesterday.","TweetDeck",,,,FALSE,FALSE,23,6,,,,,,,,,,,,,,"x41587954","FortBenning","en",,,,,,,,,,,,,
"x789474652682907648",2016-10-21 14:33:19,"x2856787757","SenJoniErnst","Tomorrow is National Prescription Drug Take Back Day &amp; I encourage you to join Iowans across our state in raising awareness…(1/2)","TweetDeck",,,,FALSE,FALSE,9,2,,,,,,,,,,,,,,,,"en",,,,,,,,,,,,,
"x788364018738003970",2016-10-18 13:00:03,"x2856787757","SenJoniErnst","Happy to see Army Sustainment Command NCO of the year, and Davenport resident, SGT Henrique Magalhaes honored at the @Cubs game Sunday!","TweetDeck",,,,FALSE,FALSE,15,3,,,,,,,,,,,,,,"x41144996","Cubs","en",,,,,,,,,,,,,
"x786954320080203776",2016-10-14 15:38:25,"x2856787757","SenJoniErnst","Cyber hacks occur at an alarming rate &amp; preparation is key to preventing the next attack. (1/2) #NationalCyberSecurityAwarenessMonth","TweetDeck",,,,FALSE,FALSE,4,4,"NationalCyberSecurityAwarenessMonth",,,,,,,,,,,,,,,"en",,,,,,,,,,,,,
"x781891755000094722",2016-09-30 16:21:35,"x2856787757","SenJoniErnst","I'm pleased the President fulfilled the State of Iowa's request for federal disaster relief for the 8 counties... (1/2)","TweetDeck",,,,FALSE,FALSE,6,1,,,,,,,,,,,,,,,,"en",,,,,,,,,,,,,
"x780742557034840064",2016-09-27 12:15:05,"x2856787757","SenJoniErnst","The VA OIG report confirms that the process through which the VA chose to award Health Net billions of dollars lacks accountability…(1/2)","TweetDeck",,,,FALSE,FALSE,4,2,,,,,,,,,,,,,,,,"en",,,,,,,,,,,,,
"x776504481282461696",2016-09-15 19:34:29,"x2856787757","SenJoniErnst","Today I introduced a bill with @ChuckGrassley, @SenatorDurbin, @SenatorKirk &amp; @SenGillibrand... (1/2)","TweetDeck",,,,FALSE,FALSE,2,1,,,,,,,,,,,,,,"x10615232 247334603 211588974 72198806","ChuckGrassley SenatorDurbin SenatorKirk SenGillibrand","en",,,,,,,,,,,,,
"x774955928336556033",2016-09-11 13:01:05,"x2856787757","SenJoniErnst","America will never forget those who were lost &amp; our prayers are with their loved ones who continue to feel the deepest pain of their absence","TweetDeck",,,,FALSE,FALSE,37,15,,,,,,,,,,,,,,,,"en",,,,,,,,,,,,,
"x774955738040971264",2016-09-11 13:00:20,"x2856787757","SenJoniErnst","Today is the 15th anniversary of the terror attacks on our nation on September 11th, 2001 &amp; is a somber reminder of the lives lost.","TweetDeck",,,,FALSE,FALSE,26,11,,,,,,,,,,,,,,,,"en",,,,,,,,,,,,,
"x772180708563546112",2016-09-03 21:13:22,"x2856787757","SenJoniErnst","in the region this weekend. Ahead of his meeting with the president of the Philippines, I highlighted critical questions (6/7)","Twitter Web Client",,,,FALSE,FALSE,8,0,,,,,,,,,,,,,,,,"en",,,,,,,,,,,,,
"x772180644420026372",2016-09-03 21:13:06,"x2856787757","SenJoniErnst","our homeland - President Obama must make this one of his top priorities for discussion as he meets with world leaders (5/7)","Twitter Web Client",,,,FALSE,FALSE,6,2,,,,,,,,,,,,,,,,"en",,,,,,,,,,,,,
"x772180575436365826",2016-09-03 21:12:50,"x2856787757","SenJoniErnst","and show U.S. strength. As Islamic extremists groups in Asia unite beneath the flag of ISIS – an enemy who threatens (4/7)","Twitter Web Client",,,,FALSE,FALSE,7,1,,,,,,,,,,,,,,,,"en",,,,,,,,,,,,,
"x772180511955554304",2016-09-03 21:12:35,"x2856787757","SenJoniErnst","and fully commit to eradicating the spread of our rapidly evolving enemy. We must do more to support our allies (3/7)","Twitter Web Client",,,,FALSE,FALSE,6,0,,,,,,,,,,,,,,,,"en",,,,,,,,,,,,,
"x772180445568110593",2016-09-03 21:12:19,"x2856787757","SenJoniErnst","of the need for a global strategy against ISIS. The U.S. must address global strategy shortfalls, show leadership, (2/7)","Twitter Web Client",,,,FALSE,FALSE,7,4,,,,,,,,,,,,,,,,"en",,,,,,,,,,,,,
