"status_id","created_at","user_id","screen_name","text","source","reply_to_status_id","reply_to_user_id","reply_to_screen_name","is_quote","is_retweet","favorite_count","retweet_count","hashtags","symbols","urls_url","urls_t.co","urls_expanded_url","media_url","media_t.co","media_expanded_url","media_type","ext_media_url","ext_media_t.co","ext_media_expanded_url","ext_media_type","mentions_user_id","mentions_screen_name","lang","quoted_status_id","quoted_text","retweet_status_id","retweet_text","place_url","place_name","place_full_name","place_type","country","country_code","geo_coords","coords_coords","bbox_coords"
"x451061016701726720",2014-04-01 18:18:21,"x188019606","Clyburn","Such great news! #ACA has #7MillionAndCounting! http://t.co/kurOzhsOTy","Twitter for iPhone",,,,FALSE,FALSE,11,15,"ACA 7MillionAndCounting",,,,,"http://pbs.twimg.com/media/BkJ9ms1IUAAYba4.jpg","http://t.co/kurOzhsOTy","https://twitter.com/Clyburn/status/451061016701726720/photo/1","photo","http://pbs.twimg.com/media/BkJ9ms1IUAAYba4.jpg","http://t.co/kurOzhsOTy","https://twitter.com/Clyburn/status/451061016701726720/photo/1",,,,"en",,,,,,,,,,,,,
"x450682568535736320",2014-03-31 17:14:32,"x188019606","Clyburn","I had a wonderful time on @Morning_Joe this morning.  Here is the video if you weren't able to tune in.  http://t.co/ZyfPqzEOLx","TweetDeck",,,,FALSE,FALSE,4,3,,,"youtu.be/yLREz_BUUAg","http://t.co/ZyfPqzEOLx","http://youtu.be/yLREz_BUUAg",,,,,,,,,"x254117355","Morning_Joe","en",,,,,,,,,,,,,
"x450640611058544640",2014-03-31 14:27:48,"x188019606","Clyburn","Today is the deadline for 2014 open enrollment for #ACA. Have you signed up yet? #GetCoveredNow http://t.co/zzilAXjkYp","TweetDeck",,,,FALSE,FALSE,1,9,"ACA GetCoveredNow",,,,,"http://pbs.twimg.com/media/BkD_P33CYAAhxBB.jpg","http://t.co/zzilAXjkYp","https://twitter.com/Clyburn/status/450640611058544640/photo/1","photo","http://pbs.twimg.com/media/BkD_P33CYAAhxBB.jpg","http://t.co/zzilAXjkYp","https://twitter.com/Clyburn/status/450640611058544640/photo/1",,,,"en",,,,,,,,,,,,,
"x450573906819440640",2014-03-31 10:02:45,"x188019606","Clyburn","I'll be on @Morning_Joe this morning around 7:15! Make sure to tune in.","Twitter for iPhone",,,,FALSE,FALSE,5,11,,,,,,,,,,,,,,"x254117355","Morning_Joe","en",,,,,,,,,,,,,
"x450362629333463040",2014-03-30 20:03:12,"x188019606","Clyburn","Tomorrow is the deadline for affordable healthcare! #GetCoveredNow http://t.co/hSt3JS6Qpd","Twitter for iPhone",,,,FALSE,FALSE,18,40,"GetCoveredNow",,,,,"http://pbs.twimg.com/media/BkACbNQIQAAHyCy.jpg","http://t.co/hSt3JS6Qpd","https://twitter.com/Clyburn/status/450362629333463040/photo/1","photo","http://pbs.twimg.com/media/BkACbNQIQAAHyCy.jpg","http://t.co/hSt3JS6Qpd","https://twitter.com/Clyburn/status/450362629333463040/photo/1",,,,"en",,,,,,,,,,,,,
"x450001335124242433",2014-03-29 20:07:33,"x188019606","Clyburn","Retweet this if you or someone you know has signed up for #ACA. Only 2 more days until the deadline. #GetCoveredNow","Twitter for iPhone",,,,FALSE,FALSE,5,34,"ACA GetCoveredNow",,,,,,,,,,,,,,,"en",,,,,,,,,,,,,
"x449582887802003456",2014-03-28 16:24:47,"x188019606","Clyburn","I had a wonderful time visiting my hometown of Sumter to speak to the local area social workers. http://t.co/moT4FuKyLa","Twitter for iPhone",,,,FALSE,FALSE,9,7,,,,,,"http://pbs.twimg.com/media/Bj09QRpIUAA6FRt.jpg","http://t.co/moT4FuKyLa","https://twitter.com/Clyburn/status/449582887802003456/photo/1","photo","http://pbs.twimg.com/media/Bj09QRpIUAA6FRt.jpg","http://t.co/moT4FuKyLa","https://twitter.com/Clyburn/status/449582887802003456/photo/1",,,,"en",,,,,,,,,,,,,
"x449552272939552770",2014-03-28 14:23:08,"x188019606","Clyburn","I'm ready to cheer on the USC Women's Basketball team on Sunday. @GamecocksOnline #BeTheChange16 http://t.co/Qccaex4Cqi","Twitter for iPhone",,,,FALSE,FALSE,23,18,"BeTheChange16",,,,,"http://pbs.twimg.com/media/Bj0haQWIAAApkTV.jpg","http://t.co/Qccaex4Cqi","https://twitter.com/Clyburn/status/449552272939552770/photo/1","photo","http://pbs.twimg.com/media/Bj0haQWIAAApkTV.jpg","http://t.co/Qccaex4Cqi","https://twitter.com/Clyburn/status/449552272939552770/photo/1",,"x19455982","GamecocksOnline","en",,,,,,,,,,,,,
"x449261132755509249",2014-03-27 19:06:15,"x188019606","Clyburn","Wow!  Great news!  6 million people have enrolled in ACA as the deadline approaches.  Don't forget to sign up by March 31.  #GetCoveredNow","TweetDeck",,,,FALSE,FALSE,8,11,"GetCoveredNow",,,,,,,,,,,,,,,"en",,,,,,,,,,,,,
"x448920826201776129",2014-03-26 20:34:00,"x188019606","Clyburn","March 31 is the deadline to sign up for #ACA.  Find out how to apply for coverage here.  #6daysleft #getcoverednow - https://t.co/oacojCxWZl","TweetDeck",,,,FALSE,FALSE,1,5,"ACA 6daysleft getcoverednow",,"healthcare.gov/how-to-have-th…","https://t.co/oacojCxWZl","https://www.healthcare.gov/how-to-have-the-best-experience-with-healthcare-gov/#part=2",,,,,,,,,,,"en",,,,,,,,,,,,,
"x448825625869287424",2014-03-26 14:15:42,"x188019606","Clyburn","I will be on @newsnation with @tamronhall on @msnbc in about an hour to discuss the #ACA deadline.  I hope you're able to tune in.","TweetDeck",,,,FALSE,FALSE,3,14,"ACA",,,,,,,,,,,,,"x3871344137 21228708 2836421","NewsNation tamronhall MSNBC","en",,,,,,,,,,,,,
"x448538181844340736",2014-03-25 19:13:30,"x188019606","Clyburn","We all have the power to take our health in our hands. #BlackMenEnroll to #GetCovered","TweetDeck",,,,FALSE,FALSE,3,14,"BlackMenEnroll GetCovered",,,,,,,,,,,,,,,"en",,,,,,,,,,,,,
"x448474357795676160",2014-03-25 14:59:53,"x188019606","Clyburn","We’re in single digits. There are only 7 days left to apply for #ACA.  Here are some tips for signing up. #7daysleft https://t.co/tHXmDBXxNb","TweetDeck",,,,FALSE,FALSE,2,12,"ACA 7daysleft",,"healthcare.gov/how-to-have-th…","https://t.co/tHXmDBXxNb","https://www.healthcare.gov/how-to-have-the-best-experience-with-healthcare-gov/",,,,,,,,,,,"en",,,,,,,,,,,,,
"x448096854056914944",2014-03-24 13:59:49,"x188019606","Clyburn","Have you signed up yet? Only 8 days to apply for affordable healthcare in 2014.  http://t.co/jzQY5inDxA #8daysleft #GetCoveredNow","TweetDeck",,,,FALSE,FALSE,6,23,"8daysleft GetCoveredNow",,"healthcare.gov","http://t.co/jzQY5inDxA","http://www.healthcare.gov",,,,,,,,,,,"en",,,,,,,,,,,,,
"x447023475119489024",2014-03-21 14:54:36,"x188019606","Clyburn","The #ACA is turning 4. Check out 4 ways that this historic law is transforming lives and delivering #healthcare4all http://t.co/p14jBKTMH8","TweetDeck",,,,FALSE,FALSE,5,20,"ACA healthcare4all",,,,,"http://pbs.twimg.com/media/BjQle1ZCQAAgMyD.jpg","http://t.co/p14jBKTMH8","https://twitter.com/Clyburn/status/447023475119489024/photo/1","photo","http://pbs.twimg.com/media/BjQle1ZCQAAgMyD.jpg","http://t.co/p14jBKTMH8","https://twitter.com/Clyburn/status/447023475119489024/photo/1",,,,"en",,,,,,,,,,,,,
"x447008794317717505",2014-03-21 13:56:16,"x188019606","Clyburn","Click on this link to answer questions on Medicaid and CHIP programs through #ACA.  #11daysleft #getcoverednow https://t.co/mBP7gaFf7G","TweetDeck",,,,FALSE,FALSE,2,9,"ACA 11daysleft getcoverednow",,"healthcare.gov/how-to-have-th…","https://t.co/mBP7gaFf7G","https://www.healthcare.gov/how-to-have-the-best-experience-with-healthcare-gov/#part=4",,,,,,,,,,,"en",,,,,,,,,,,,,
"x446724481441357825",2014-03-20 19:06:30,"x188019606","Clyburn","Just 12 days left to sign up for #ACA in 2014.  Go to http://t.co/jzQY5inDxA for more information.  #12daysleft #getcoverednow","TweetDeck",,,,FALSE,FALSE,2,6,"ACA 12daysleft getcoverednow",,"healthcare.gov","http://t.co/jzQY5inDxA","http://www.healthcare.gov",,,,,,,,,,,"en",,,,,,,,,,,,,
"x446717763231711233",2014-03-20 18:39:49,"x188019606","Clyburn","I spoke to a great group at the Spring Valley Rotary Club. Thank you for inviting me. http://t.co/hsFApAeGGQ","Twitter for iPhone",,,,FALSE,FALSE,3,2,,,,,,"http://pbs.twimg.com/media/BjMPcE8IcAAvkE5.jpg","http://t.co/hsFApAeGGQ","https://twitter.com/Clyburn/status/446717763231711233/photo/1","photo","http://pbs.twimg.com/media/BjMPcE8IcAAvkE5.jpg","http://t.co/hsFApAeGGQ","https://twitter.com/Clyburn/status/446717763231711233/photo/1",,,,"en",,,,,,,,,,,,,
"x446433168678465536",2014-03-19 23:48:56,"x188019606","Clyburn","I had a wonderful time speaking to a great group at @UofSC. Thank you to everyone who attended. http://t.co/UK6Mhzj7xd","Twitter for iPhone",,,,FALSE,FALSE,6,4,,,,,,"http://pbs.twimg.com/media/BjIMmfpIcAAtKHy.jpg","http://t.co/UK6Mhzj7xd","https://twitter.com/Clyburn/status/446433168678465536/photo/1","photo","http://pbs.twimg.com/media/BjIMmfpIcAAtKHy.jpg","http://t.co/UK6Mhzj7xd","https://twitter.com/Clyburn/status/446433168678465536/photo/1",,"x28161251","UofSC","en",,,,,,,,,,,,,
"x446366809059381248",2014-03-19 19:25:15,"x188019606","Clyburn","RT @RenaissanceFndn: U.S. Rep. James @Clyburn speaking at USC tonight, 6 p.m., Booker T. Washington Auditorium at 1400 Wheat St. http://t.c…","Twitter Web Client",,,,FALSE,TRUE,0,3,,,,,,,,,,,,,,"x1838701580 188019606","RenaissanceFndn Clyburn","en",,,"x446295602649772032","U.S. Rep. James @Clyburn speaking at USC tonight, 6 p.m., Booker T. Washington Auditorium at 1400 Wheat St. http://t.co/LlmqcA777g",,,,,,,,,
"x446366384344162304",2014-03-19 19:23:33,"x188019606","Clyburn","RT @ColumbiaSC63: Don't miss @UofSC_ISS's Philip Grose lecture with Congressman @Clyburn, 6PM tonight in the Booker T. Washington auditoriu…","Twitter Web Client",,,,FALSE,TRUE,0,6,,,,,,,,,,,,,,"x961005343 1301351426 188019606","ColumbiaSC63 UofSC_ISS Clyburn","en",,,"x446298831123390464","Don't miss @UofSC_ISS's Philip Grose lecture with Congressman @Clyburn, 6PM tonight in the Booker T. Washington auditorium (1400 Wheat St.)",,,,,,,,,
"x446309466032857088",2014-03-19 15:37:23,"x188019606","Clyburn","Do you want to compare healthcare plans with #ACA?  Go to this link and you can do just that.  #13daysleft https://t.co/zGA9ohyLkb","TweetDeck",,,,FALSE,FALSE,4,14,"ACA 13daysleft",,"healthcare.gov/how-to-have-th…","https://t.co/zGA9ohyLkb","https://www.healthcare.gov/how-to-have-the-best-experience-with-healthcare-gov/#part=3",,,,,,,,,,,"en",,,,,,,,,,,,,
"x446250025577111552",2014-03-19 11:41:11,"x188019606","Clyburn","RT @jamiemself: .@Clyburn to speak at USC lecture series Wednesday. http://t.co/KpmMuSsHYG","Twitter for iPhone",,,,FALSE,TRUE,0,6,,,"thestate.com/2014/03/18/333…","http://t.co/KpmMuSsHYG","http://www.thestate.com/2014/03/18/3333972/buzz-jim-clyburn-to-speak-in-usc.html",,,,,,,,,"x242098934 188019606","jamiemself Clyburn","en",,,"x446062675723051008",".@Clyburn to speak at USC lecture series Wednesday. http://t.co/KpmMuSsHYG",,,,,,,,,
"x446013946139791360",2014-03-18 20:03:05,"x188019606","Clyburn","Join me tmw at 6pm at @UofSC and the Philip G. Grose lecture series in partnership w/ the Southern Studies Dept.  
http://t.co/urhdi5LIUr","TweetDeck",,,,FALSE,FALSE,3,7,,,"clyburn.house.gov/press-release/…","http://t.co/urhdi5LIUr","http://clyburn.house.gov/press-release/congressman-clyburn-participate-2014-philip-g-grose-lecture-series-univeristy-south",,,,,,,,,"x28161251","UofSC","en",,,,,,,,,,,,,
"x445983927258607616",2014-03-18 18:03:48,"x188019606","Clyburn","I had a great time speaking to the Spartanburg Rotary Club today. http://t.co/vFMSYXj3a8","Twitter for iPhone",,,,FALSE,FALSE,4,2,,,,,,"http://pbs.twimg.com/media/BjB0BMpIAAE4UAz.jpg","http://t.co/vFMSYXj3a8","https://twitter.com/Clyburn/status/445983927258607616/photo/1","photo","http://pbs.twimg.com/media/BjB0BMpIAAE4UAz.jpg","http://t.co/vFMSYXj3a8","https://twitter.com/Clyburn/status/445983927258607616/photo/1",,,,"en",,,,,,,,,,,,,
"x445924362466906112",2014-03-18 14:07:07,"x188019606","Clyburn","14 days left to apply for affordable healthcare through the marketplace in 2014.  Tips to sign up: https://t.co/tHXmDBXxNb #14DaysLeft","TweetDeck",,,,FALSE,FALSE,4,11,"14DaysLeft",,"healthcare.gov/how-to-have-th…","https://t.co/tHXmDBXxNb","https://www.healthcare.gov/how-to-have-the-best-experience-with-healthcare-gov/",,,,,,,,,,,"en",,,,,,,,,,,,,
"x445600269699932160",2014-03-17 16:39:17,"x188019606","Clyburn","The deadline to sign up for #ACA is March 31. Make sure to go to http://t.co/jzQY5inDxA before it's too late. #15daysleft","Twitter for iPhone",,,,FALSE,FALSE,1,5,"ACA 15daysleft",,"healthcare.gov","http://t.co/jzQY5inDxA","http://www.healthcare.gov",,,,,,,,,,,"en",,,,,,,,,,,,,
"x443811683597684736",2014-03-12 18:12:05,"x188019606","Clyburn","RT if you want Congress to #renewUI. http://t.co/f8qdaspBhk","Twitter Web Client",,,,FALSE,FALSE,23,69,"renewUI",,,,,"http://pbs.twimg.com/media/Bii8X_RCEAAcR2f.jpg","http://t.co/f8qdaspBhk","https://twitter.com/Clyburn/status/443811683597684736/photo/1","photo","http://pbs.twimg.com/media/Bii8X_RCEAAcR2f.jpg","http://t.co/f8qdaspBhk","https://twitter.com/Clyburn/status/443811683597684736/photo/1",,,,"en",,,,,,,,,,,,,
"x443809990764400640",2014-03-12 18:05:22,"x188019606","Clyburn","The GOP priorities are 51 votes to repeal the #ACA but have offered 0 votes to #renewui for #2million Americans.","Twitter Web Client",,,,FALSE,FALSE,11,27,"ACA renewui 2million",,,,,,,,,,,,,,,"en",,,,,,,,,,,,,
"x443807401121427456",2014-03-12 17:55:04,"x188019606","Clyburn","#2million people have lost a vital lifeline, including 200,000 veterans. Congress needs to #RenewUI immediately!","Twitter Web Client",,,,FALSE,FALSE,13,31,"2million RenewUI",,,,,,,,,,,,,,,"en",,,,,,,,,,,,,
"x443805636141539328",2014-03-12 17:48:03,"x188019606","Clyburn","Extending UI is critical for families, essential for workers, and good for our economy. Time to #RenewUI for the #2million in need.","Twitter Web Client",,,,FALSE,FALSE,14,25,"RenewUI 2million",,,,,,,,,,,,,,,"en",,,,,,,,,,,,,
"x443805528826085376",2014-03-12 17:47:38,"x188019606","Clyburn","RT @HouseDemocrats: Assistant Leader James @Clyburn on why he signed the discharge petition to #RenewUI https://t.co/DvwqEPNCeE","Twitter Web Client",,,,FALSE,TRUE,0,31,"RenewUI",,"vine.co/v/Mbbm29zxKJ5","https://t.co/DvwqEPNCeE","https://vine.co/v/Mbbm29zxKJ5",,,,,,,,,"x43963249 188019606","HouseDemocrats Clyburn","en",,,"x443798521410772992","Assistant Leader James @Clyburn on why he signed the discharge petition to #RenewUI https://t.co/DvwqEPNCeE",,,,,,,,,
"x443113768940490752",2014-03-10 19:58:49,"x188019606","Clyburn","If you're in the Columbia area tune into @1001WVOC at 4:08pm.","Twitter for iPhone",,,,FALSE,FALSE,1,2,,,,,,,,,,,,,,"x145335314","1001WVOC","en",,,,,,,,,,,,,
"x442045670263128065",2014-03-07 21:14:35,"x188019606","Clyburn","49 years ago today, my good friend @repjohnlewis and other heroes of the movement marched for justice and into history.","Twitter Web Client",,,,FALSE,FALSE,22,45,,,,,,,,,,,,,,"x29450962","repjohnlewis","en",,,,,,,,,,,,,
"x441932734664278016",2014-03-07 13:45:49,"x188019606","Clyburn","Thanks to #ACA, being a woman is no longer a pre-existing condition for getting health care coverage. #StandWithWomen #WomensHistoryMonth","Twitter Web Client",,,,FALSE,FALSE,10,22,"ACA StandWithWomen WomensHistoryMonth",,,,,,,,,,,,,,,"en",,,,,,,,,,,,,
"x441679428729733121",2014-03-06 20:59:16,"x188019606","Clyburn","As a father and grandfather, I'm joining @USRepKeating &amp; other men committed to ending violence against women and girls. #WRD @jandoe","Twitter Web Client",,,,FALSE,FALSE,11,5,"WRD",,,,,,,,,,,,,"x232992031 18641721","USRepKeating jandoe","en",,,,,,,,,,,,,
"x441571451058266112",2014-03-06 13:50:12,"x188019606","Clyburn","Did you catch the @edshow on @msnbc last night?  http://t.co/nCD1mmxOzh","Twitter Web Client",,,,FALSE,FALSE,0,2,,,"tinyurl.com/qgr5hcl","http://t.co/nCD1mmxOzh","http://tinyurl.com/qgr5hcl",,,,,,,,,"x75052666 2836421","edshow MSNBC","en",,,,,,,,,,,,,
"x441330612725497857",2014-03-05 21:53:12,"x188019606","Clyburn","http://t.co/tDYfDRDaeQ","Twitter Web Client",,,,FALSE,FALSE,18,72,,,,,,"http://pbs.twimg.com/media/Bh_r2qHCQAImH1v.jpg","http://t.co/tDYfDRDaeQ","https://twitter.com/Clyburn/status/441330612725497857/photo/1","photo","http://pbs.twimg.com/media/Bh_r2qHCQAImH1v.jpg","http://t.co/tDYfDRDaeQ","https://twitter.com/Clyburn/status/441330612725497857/photo/1",,,,"und",,,,,,,,,,,,,
"x439178469776576513",2014-02-27 23:21:21,"x188019606","Clyburn","In concert w #MyBrothersKeeper efforts, Congress must take action to #RaiseTheWage and create jobs to bolster opportunity for all.","Twitter Web Client",,,,FALSE,FALSE,3,14,"MyBrothersKeeper RaiseTheWage",,,,,,,,,,,,,,,"en",,,,,,,,,,,,,
"x439170992565665792",2014-02-27 22:51:38,"x188019606","Clyburn","I'm pleased to support #MyBrothersKeeper. White House initiative will help build ladders of opportunity for young men of color to succeed.","Twitter Web Client",,,,FALSE,FALSE,8,21,"MyBrothersKeeper",,,,,,,,,,,,,,,"en",,,,,,,,,,,,,
"x439167807872569344",2014-02-27 22:38:59,"x188019606","Clyburn","Click here to watch my interview with @msnbc @hardball_chris about #RaiseTheWage. http://t.co/U2uWD4XJ8s","Twitter Web Client",,,,FALSE,FALSE,2,7,"RaiseTheWage",,"bit.ly/1eBsOCH","http://t.co/U2uWD4XJ8s","http://bit.ly/1eBsOCH",,,,,,,,,"x2836421 742419929178210304","MSNBC hardball_chris","en",,,,,,,,,,,,,
"x439131010358587392",2014-02-27 20:12:46,"x188019606","Clyburn","RT @WhipHoyer: I join in celebrating 4 yrs of @FLOTUS’ #LetsMove effort w/ #ThrowbackThursday, dancing the Electric Slide w @Clyburn http:/…","Twitter Web Client",,,,FALSE,TRUE,0,11,"LetsMove ThrowbackThursday",,,,,,,,,,,,,"x22012091 818876014390603776 188019606","WhipHoyer FLOTUS Clyburn","en",,,"x439097903400095744","I join in celebrating 4 yrs of @FLOTUS’ #LetsMove effort w/ #ThrowbackThursday, dancing the Electric Slide w @Clyburn http://t.co/h0k6KGtrxb",,,,,,,,,
"x438781395365019648",2014-02-26 21:03:31,"x188019606","Clyburn","@TimBishopNY I just signed House Ds’ discharge petition to #raisethewage. It’s #timefor1010.","Twitter Web Client",,"x153919023","TimBishopNY",FALSE,FALSE,2,1,"raisethewage timefor1010",,,,,,,,,,,,,"x153919023","TimBishopNY","en",,,,,,,,,,,,,
"x436982512313982976",2014-02-21 21:55:24,"x188019606","Clyburn","Happy birthday to my dear friend and colleague @repjohnlewis. I wish him many more blessed years.","Twitter Web Client",,,,FALSE,FALSE,13,15,,,,,,,,,,,,,,"x29450962","repjohnlewis","en",,,,,,,,,,,,,
"x431904310033514496",2014-02-07 21:36:26,"x188019606","Clyburn","Honored last night to receive President's Award from Assn of Farmworker Opportunity Programs. I strongly support workforce development","Twitter Web Client",,,,FALSE,FALSE,2,13,,,,,,,,,,,,,,,,"en",,,,,,,,,,,,,
"x431115753534656512",2014-02-05 17:23:00,"x188019606","Clyburn","#Obamacare is giving people choices.  Click here to watch my interview this morning on @MSNBC: http://t.co/Cqq7jYV4R1","Twitter Web Client",,,,FALSE,FALSE,4,14,"Obamacare",,"bit.ly/1g2eZQn","http://t.co/Cqq7jYV4R1","http://bit.ly/1g2eZQn",,,,,,,,,"x2836421","MSNBC","en",,,,,,,,,,,,,
"x430842634886586368",2014-02-04 23:17:43,"x188019606","Clyburn","This year’s theme for #BlackHistoryMonth is ""Civil Rights in America."" Click here to read more of my statement http://t.co/izxL9ZrN8p","Twitter Web Client",,,,FALSE,FALSE,2,15,"BlackHistoryMonth",,"1.usa.gov/1dpcJ2o","http://t.co/izxL9ZrN8p","http://1.usa.gov/1dpcJ2o",,,,,,,,,,,"en",,,,,,,,,,,,,
"x428997373290098688",2014-01-30 21:05:18,"x188019606","Clyburn","RT @CharlesMBlow: ""In the End, we will remember not the words of our enemies, but the silence of our friends."" - Martin Luther King, Jr.","Twitter Web Client",,,,FALSE,TRUE,0,80,,,,,,,,,,,,,,"x20772763","CharlesMBlow","en",,,"x428949991991050240","""In the End, we will remember not the words of our enemies, but the silence of our friends."" - Martin Luther King, Jr.",,,,,,,,,
"x428262352283131905",2014-01-28 20:24:36,"x188019606","Clyburn","RT: @bridgettfrey .@ChrisVanHollen, @NancyPelosi, &amp; @Clyburn talk about the House Democratic Agenda #SOTUisComing http://t.co/nbwcItJEzG","Twitter Web Client",,,,FALSE,FALSE,2,7,"SOTUisComing",,,,,"http://pbs.twimg.com/media/BfFW-gZCcAAkm00.jpg","http://t.co/nbwcItJEzG","https://twitter.com/bridgettfrey/status/428219071595679744/photo/1","photo","http://pbs.twimg.com/media/BfFW-gZCcAAkm00.jpg","http://t.co/nbwcItJEzG","https://twitter.com/bridgettfrey/status/428219071595679744/photo/1",,"x266150023 18137749 15764644 188019606","bridgettfrey ChrisVanHollen NancyPelosi Clyburn","en",,,,,,,,,,,,,
"x426778125741993984",2014-01-24 18:06:48,"x188019606","Clyburn","#1million600k—the number of Americans who have lost unemployment insurance b/c House Republicans refuse to act. Congress must #renewUI asap","Twitter Web Client",,,,FALSE,FALSE,18,60,"1million600k renewUI",,,,,,,,,,,,,,,"en",,,,,,,,,,,,,
"x423577688586997761",2014-01-15 22:09:25,"x188019606","Clyburn","As we celebrate #MLK's 85th birthday, click here to watch my floor speech about #WarOnPoverty and the work ahead. http://t.co/ToLCA9z9Nh.","Twitter Web Client",,,,FALSE,FALSE,3,14,"MLK WarOnPoverty",,"bit.ly/1dRtTGq","http://t.co/ToLCA9z9Nh","http://bit.ly/1dRtTGq",,,,,,,,,,,"en",,,,,,,,,,,,,
"x421057790438674433",2014-01-08 23:16:14,"x188019606","Clyburn","Much progress in the 50 years since LBJ declared War on Poverty. The CBC's 10-20-30 plan will target funds to persistent poverty areas","Twitter Web Client",,,,FALSE,FALSE,4,15,,,,,,,,,,,,,,,,"en",,,,,,,,,,,,,
"x414585993191100416",2013-12-22 02:39:38,"x188019606","Clyburn","@cpmondello But for Obama, would you have ever heard of Elizabeth Warren?","Twitter for BlackBerry®","x414436769967640576","x19675724","cpmondello",FALSE,FALSE,1,0,,,,,,,,,,,,,,"x19675724","cpmondello","en",,,,,,,,,,,,,
"x408373698479931392",2013-12-04 23:14:11,"x188019606","Clyburn","Even though I'm a proud Que, let me say happy birthday to all the Brothers of #AlphaPhiAlpa today","Twitter Web Client",,,,FALSE,FALSE,6,19,"AlphaPhiAlpa",,,,,,,,,,,,,,,"en",,,,,,,,,,,,,
"x408313769774051328",2013-12-04 19:16:03,"x188019606","Clyburn","@BrandonUpson","Twitter for BlackBerry®","x408289303723118592","x15858612","BrandonUpson",FALSE,FALSE,1,0,,,,,,,,,,,,,,"x15858612","BrandonUpson","und",,,,,,,,,,,,,
"x403263416359329792",2013-11-20 20:47:45,"x188019606","Clyburn","Welcome news. Report shows #Obamacare yielding lowest health cost inflation in 50 years:  http://t.co/QNPjStcQfo","Twitter Web Client",,,,FALSE,FALSE,15,37,"Obamacare",,"usatoday.com/story/news/nat…","http://t.co/QNPjStcQfo","http://www.usatoday.com/story/news/nation-now/2013/11/20/health-care-spending-growth/3650243/",,,,,,,,,,,"en",,,,,,,,,,,,,
"x402924827339522048",2013-11-19 22:22:19,"x188019606","Clyburn","150 years ago today. A new birth of freedom. #GettysburgAddress:   http://t.co/fVedwiEKTm","Twitter Web Client",,,,FALSE,FALSE,8,18,"GettysburgAddress",,"n.pr/1aPMUHc","http://t.co/fVedwiEKTm","http://n.pr/1aPMUHc",,,,,,,,,,,"en",,,,,,,,,,,,,
"x402903511232290816",2013-11-19 20:57:37,"x188019606","Clyburn","Click here to watch my interview on @Morning_Joe, http://t.co/jmpOyxPS8v","Twitter Web Client",,,,FALSE,FALSE,0,0,,,"bit.ly/1jkdgGv","http://t.co/jmpOyxPS8v","http://bit.ly/1jkdgGv",,,,,,,,,"x254117355","Morning_Joe","en",,,,,,,,,,,,,
"x402556500784062464",2013-11-18 21:58:43,"x188019606","Clyburn","Congratulations to @RepSinema for becoming the first Member of Congress to complete an Ironman triathlon. Very impressive!","Twitter Web Client",,,,FALSE,FALSE,5,10,,,,,,,,,,,,,,"x1080844782","RepSinema","en",,,,,,,,,,,,,
"x398580613701070848",2013-11-07 22:39:58,"x188019606","Clyburn","Welcome news on historic Senate vote to pass #ENDA. House must now #PassENDA to ban workplace discrimination against #LGBT Americans.","Twitter Web Client",,,,FALSE,FALSE,4,12,"ENDA PassENDA LGBT",,,,,,,,,,,,,,,"en",,,,,,,,,,,,,
"x395992179421609984",2013-10-31 19:14:27,"x188019606","Clyburn","Click here to watch my interview with @edshow on @msnbc. http://t.co/vR3zNhMSll","Twitter Web Client",,,,FALSE,FALSE,1,6,,,"bit.ly/18Gw50G","http://t.co/vR3zNhMSll","http://bit.ly/18Gw50G",,,,,,,,,"x75052666 2836421","edshow MSNBC","en",,,,,,,,,,,,,
"x395963131404365824",2013-10-31 17:19:01,"x188019606","Clyburn","I'm disappointed by the Senate vote today on the Watt nomination.","Twitter Web Client",,,,FALSE,FALSE,3,17,,,,,,,,,,,,,,,,"en",,,,,,,,,,,,,
"x393443048983506945",2013-10-24 18:25:07,"x188019606","Clyburn","Our immigration system is broken and we need to pass comprehensive reform. #TimeIsNow","Twitter Web Client",,,,FALSE,FALSE,8,26,"TimeIsNow",,,,,,,,,,,,,,,"en",,,,,,,,,,,,,
"x393108218575998976",2013-10-23 20:14:37,"x188019606","Clyburn","Our thoughts and prayers go out to Major's wife, Maria, and their five children during this difficult time.","Twitter Web Client",,,,FALSE,FALSE,1,4,,,,,,,,,,,,,,,,"en",,,,,,,,,,,,,
"x393107536099827712",2013-10-23 20:11:54,"x188019606","Clyburn","It was a pleasure to serve with Major Owens in Congress for 14 years. He was a committed voice on behalf of ""the least"" among us.","Twitter Web Client",,,,FALSE,FALSE,1,3,,,,,,,,,,,,,,,,"en",,,,,,,,,,,,,
"x393107134621028352",2013-10-23 20:10:19,"x188019606","Clyburn","I have known Major Owens since our civil rights activities in the 1960s when we were both involved in Congress of Racial Equality (CORE).","Twitter Web Client",,,,FALSE,FALSE,2,3,,,,,,,,,,,,,,,,"en",,,,,,,,,,,,,
"x393106594101092352",2013-10-23 20:08:10,"x188019606","Clyburn","Emily and I are deeply saddened by the passing of our long-time friend Major Owens.","Twitter Web Client",,,,FALSE,FALSE,0,2,,,,,,,,,,,,,,,,"en",,,,,,,,,,,,,
"x392386186812989440",2013-10-21 20:25:31,"x188019606","Clyburn","RIP Rep Bill Young, a gentleman whom I have served with more than 20 years and whom I have gotten to know, love and respect.","Twitter Web Client",,,,FALSE,FALSE,1,6,,,,,,,,,,,,,,,,"en",,,,,,,,,,,,,
