"status_id","created_at","user_id","screen_name","text","source","reply_to_status_id","reply_to_user_id","reply_to_screen_name","is_quote","is_retweet","favorite_count","retweet_count","hashtags","symbols","urls_url","urls_t.co","urls_expanded_url","media_url","media_t.co","media_expanded_url","media_type","ext_media_url","ext_media_t.co","ext_media_expanded_url","ext_media_type","mentions_user_id","mentions_screen_name","lang","quoted_status_id","quoted_text","retweet_status_id","retweet_text","place_url","place_name","place_full_name","place_type","country","country_code","geo_coords","coords_coords","bbox_coords"
"x570678878483718144",2015-02-25 20:17:01,"x188019606","Clyburn","""It has long been established that these 1st Amendment freedoms are protected by the 14th Amendment from invasion by the States."" (1/3)","Twitter for iPhone",,,,FALSE,FALSE,3,2,,,,,,,,,,,,,,,,"en",,,,,,,,,,,,,
"x570288921353056256",2015-02-24 18:27:28,"x188019606","Clyburn","I was glad to attend today's White House Champions of Change event for Historically Black Colleges and Universities. #HBCUchamps","Twitter for iPhone",,,,FALSE,FALSE,12,14,"HBCUchamps",,,,,,,,,,,,,,,"en",,,,,,,,,,,,,
"x570256945996701696",2015-02-24 16:20:25,"x188019606","Clyburn","I’m pleased to see this long overdue EAC meeting taking place today. Bipartisan action needed to update voting standards. #votingrights","Twitter for iPhone",,,,FALSE,FALSE,2,2,"votingrights",,,,,,,,,,,,,,,"en",,,,,,,,,,,,,
"x569988825268686848",2015-02-23 22:35:00,"x188019606","Clyburn","TY to Ms. Suber &amp; Antione Jackson for having me as your keynote speaker at the Hat, Bowtie &amp; Tea Luncheon this wkend. http://t.co/UpEvSLb02o","TweetDeck",,,,FALSE,FALSE,9,9,,,,,,"http://pbs.twimg.com/media/B-kBN1kUMAESIDn.jpg","http://t.co/UpEvSLb02o","https://twitter.com/Clyburn/status/569988825268686848/photo/1","photo","http://pbs.twimg.com/media/B-kBN1kUMAESIDn.jpg","http://t.co/UpEvSLb02o","https://twitter.com/Clyburn/status/569988825268686848/photo/1",,,,"en",,,,,,,,,,,,,
"x569870650304696320",2015-02-23 14:45:25,"x188019606","Clyburn","Congrats to @johnlegend &amp; @common on their Oscar win. Thank you 4 bringing so many important issues to the forefront. http://t.co/bX8AA2swxi","TweetDeck",,,,FALSE,FALSE,10,7,,,"mediaite.com/tv/john-legend…","http://t.co/bX8AA2swxi","http://www.mediaite.com/tv/john-legend-takes-on-voter-id-laws-and-overcriminalization-in-oscar-victory-speech/",,,,,,,,,"x18228898 17169320","johnlegend common","en",,,,,,,,,,,,,
"x568509446504255488",2015-02-19 20:36:29,"x188019606","Clyburn","I enjoyed sitting down with @JudiGatson from @wis10 today to discuss South Carolina State University. http://t.co/eXyUd9kxLj","Twitter for iPhone",,,,FALSE,FALSE,10,11,,,,,,"http://pbs.twimg.com/media/B-PAUrWCIAATJwf.jpg","http://t.co/eXyUd9kxLj","https://twitter.com/Clyburn/status/568509446504255488/photo/1","photo","http://pbs.twimg.com/media/B-PAUrWCIAATJwf.jpg","http://t.co/eXyUd9kxLj","https://twitter.com/Clyburn/status/568509446504255488/photo/1",,"x15985390 16404646","JudiGatson wis10","en",,,,,,,,,,,,,
"x568440531065430019",2015-02-19 16:02:38,"x188019606","Clyburn","RETWEET ---&gt; Over 200,000 people in SC signed up for health care w/ the Affordable Care Act.    #11MillionAndCounting http://t.co/Q79yES2To4","TweetDeck",,,,FALSE,FALSE,4,12,"11MillionAndCounting",,,,,"http://pbs.twimg.com/media/B-OBkaxCAAAyxmE.jpg","http://t.co/Q79yES2To4","https://twitter.com/Clyburn/status/568440531065430019/photo/1","photo","http://pbs.twimg.com/media/B-OBkaxCAAAyxmE.jpg","http://t.co/Q79yES2To4","https://twitter.com/Clyburn/status/568440531065430019/photo/1",,,,"en",,,,,,,,,,,,,
"x568125113763307521",2015-02-18 19:09:17,"x188019606","Clyburn","Thank you to @VP Joe Biden and @SecretaryFoxx for visiting SC to discuss the very important topic of infrastructure. http://t.co/rw1kA7ZtNr","Twitter for iPhone",,,,FALSE,FALSE,14,15,,,,,,"http://pbs.twimg.com/media/B-JixqwIMAA_qBd.jpg","http://t.co/rw1kA7ZtNr","https://twitter.com/Clyburn/status/568125113763307521/photo/1","photo","http://pbs.twimg.com/media/B-JixqwIMAA_qBd.jpg","http://t.co/rw1kA7ZtNr","https://twitter.com/Clyburn/status/568125113763307521/photo/1",,"x818910970567344128 43920155","VP SecretaryFoxx","en",,,,,,,,,,,,,
"x568090552920616960",2015-02-18 16:51:57,"x188019606","Clyburn","RT @RepLujanGrisham: .@HouseGOP should drop their anti-immigrant efforts &amp; join with Dems to fund @DHSgov. #DontShutDownOurSecurity http://…","TweetDeck",,,,FALSE,TRUE,0,78,"DontShutDownOurSecurity",,,,,,,,,,,,,"x1061385474 15207668 15647676","RepLujanGrisham HouseGOP DHSgov","en",,,"x568062517664210944",".@HouseGOP should drop their anti-immigrant efforts &amp; join with Dems to fund @DHSgov. #DontShutDownOurSecurity http://t.co/J9gYsB3nVq",,,,,,,,,
"x567716593527169024",2015-02-17 16:05:58,"x188019606","Clyburn","Enjoyed speaking with @SCETV about my 10-20-30 plan &amp; many other topics. Watch @PalmettoScene at 7:30pm on Thursday. http://t.co/YyCRvJ3lBR","Twitter for iPhone",,,,FALSE,FALSE,8,16,,,,,,"http://pbs.twimg.com/media/B-DvOtiIYAAQP0w.jpg","http://t.co/YyCRvJ3lBR","https://twitter.com/Clyburn/status/567716593527169024/photo/1","photo","http://pbs.twimg.com/media/B-DvOtiIYAAQP0w.jpg","http://t.co/YyCRvJ3lBR","https://twitter.com/Clyburn/status/567716593527169024/photo/1",,"x20599079 14934119","SCETV PalmettoScene","en",,,,,,,,,,,,,
"x566722771774738433",2015-02-14 22:16:52,"x188019606","Clyburn","Maj. Gen. Becker's leadership at Fort Jackson will be missed when he is reassigned this May. 
http://t.co/SKWTKkxxN3 http://t.co/jphuwPBeG4","Twitter for iPhone",,,,FALSE,FALSE,2,6,,,"thestate.com/2015/02/13/398…","http://t.co/SKWTKkxxN3","http://www.thestate.com/2015/02/13/3987010/becker-leaving-fort-jackson-replacement.html","http://pbs.twimg.com/media/B91nWjICIAA_sTC.jpg","http://t.co/jphuwPBeG4","https://twitter.com/Clyburn/status/566722771774738433/photo/1","photo","http://pbs.twimg.com/media/B91nWjICIAA_sTC.jpg","http://t.co/jphuwPBeG4","https://twitter.com/Clyburn/status/566722771774738433/photo/1",,,,"en",,,,,,,,,,,,,
"x566322510242004992",2015-02-13 19:46:22,"x188019606","Clyburn","2 days left! February 15th is the deadline to #GetCovered. Enroll now → http://t.co/5ipy3hNFl8 http://t.co/o3RelJh73s","TweetDeck",,,,FALSE,FALSE,2,10,"GetCovered",,"HealthCare.gov","http://t.co/5ipy3hNFl8","http://HealthCare.gov","http://pbs.twimg.com/media/B9v7Oz3IQAAtm1_.jpg","http://t.co/o3RelJh73s","https://twitter.com/Clyburn/status/566322510242004992/photo/1","photo","http://pbs.twimg.com/media/B9v7Oz3IQAAtm1_.jpg","http://t.co/o3RelJh73s","https://twitter.com/Clyburn/status/566322510242004992/photo/1",,,,"en",,,,,,,,,,,,,
"x566276117754302464",2015-02-13 16:42:02,"x188019606","Clyburn","It was great to meet with Mayor Muriel Bowser, the Mayor of the District of Columbia.  Thank you for your service. http://t.co/igDatBE3dS","TweetDeck",,,,FALSE,FALSE,3,4,,,,,,"http://pbs.twimg.com/media/B9vREssIYAAgpYO.jpg","http://t.co/igDatBE3dS","https://twitter.com/Clyburn/status/566276117754302464/photo/1","photo","http://pbs.twimg.com/media/B9vREssIYAAgpYO.jpg","http://t.co/igDatBE3dS","https://twitter.com/Clyburn/status/566276117754302464/photo/1",,,,"en",,,,,,,,,,,,,
"x565176943105310720",2015-02-10 15:54:18,"x188019606","Clyburn","My op-ed on persistent poverty and my 10-20-30 plan can be read in @thestate and the @postandcourier. Read it here: http://t.co/euyiUKxycq","TweetDeck",,,,FALSE,FALSE,8,17,,,"postandcourier.com/article/201502…","http://t.co/euyiUKxycq","http://www.postandcourier.com/article/20150210/PC1002/150219987/1021/address-persisting-poverty",,,,,,,,,"x12831882 14693499","thestate postandcourier","en",,,,,,,,,,,,,
"x564795593865064448",2015-02-09 14:38:57,"x188019606","Clyburn","Joining @RepJohnLarson &amp; @RepJoeCourtney @UConn today to discuss college affordability. I'll also be cheering on @GamecockWBB &amp; @dawnstaley.","TweetDeck",,,,FALSE,FALSE,19,9,,,,,,,,,,,,,,"x50452197 85396297 84327770 89492950 18883414","RepJohnLarson RepJoeCourtney UConn GamecockWBB dawnstaley","en",,,,,,,,,,,,,
"x564794549906976769",2015-02-09 14:34:48,"x188019606","Clyburn","MT @RepJohnLarson: Today at 5PM, @Clyburn @RepJoeCourtney &amp; I will hear from @UConn students on college affordability http://t.co/vCjQZ1z33E","TweetDeck",,,,FALSE,FALSE,1,4,,,"larson.house.gov/index.php/news…","http://t.co/vCjQZ1z33E","http://www.larson.house.gov/index.php/news/press-releases/1955",,,,,,,,,"x50452197 188019606 85396297 84327770","RepJohnLarson Clyburn RepJoeCourtney UConn","en",,,,,,,,,,,,,
"x564210351147720707",2015-02-07 23:53:24,"x188019606","Clyburn","I had such a wonderful time visiting with Ms. Elise Jones Martin on her 100th birthday! http://t.co/TZeIvGskky","Twitter for iPhone",,,,FALSE,FALSE,16,18,,,,,,"http://pbs.twimg.com/media/B9R6UfOCMAElJky.jpg","http://t.co/TZeIvGskky","https://twitter.com/Clyburn/status/564210351147720707/photo/1","photo","http://pbs.twimg.com/media/B9R6UfOCMAElJky.jpg","http://t.co/TZeIvGskky","https://twitter.com/Clyburn/status/564210351147720707/photo/1",,,,"en",,,,,,,,,,,,,
"x564062263753990144",2015-02-07 14:04:58,"x188019606","Clyburn","RT @SenatorCardin: Good celebrating #BlackHistoryMonth this morning with @Clyburn http://t.co/VfrscNsdF1","Twitter for iPhone","x564062032518201345","x109071031","SenatorCardin",FALSE,FALSE,7,13,"BlackHistoryMonth",,,,,"http://pbs.twimg.com/media/B9PzR6iCQAEixY5.jpg","http://t.co/VfrscNsdF1","https://twitter.com/SenatorCardin/status/564062032518201345/photo/1","photo","http://pbs.twimg.com/media/B9PzR6iCQAEixY5.jpg","http://t.co/VfrscNsdF1","https://twitter.com/SenatorCardin/status/564062032518201345/photo/1",,"x109071031 188019606","SenatorCardin Clyburn","en",,,,,,,,,,,,,
"x563818555729543168",2015-02-06 21:56:33,"x188019606","Clyburn","RT @MClyburnFCC: @Clyburn congratulates @CharlayneHG at #wpcfdinner. #BrendaStarr and Mother key to her Lifetime of Achievement. http://t.c…","TweetDeck",,,,FALSE,TRUE,0,7,"wpcfdinner BrendaStarr",,,,,,,,,,,,,"x2260619350 188019606 104213174","MClyburnFCC Clyburn CharlayneHG","en",,,"x563806130720100352","@Clyburn congratulates @CharlayneHG at #wpcfdinner. #BrendaStarr and Mother key to her Lifetime of Achievement. http://t.co/rosBGt37wp",,,,,,,,,
"x563763289411563520",2015-02-06 18:16:57,"x188019606","Clyburn","Welcome news on the jobs report. Congress needs to focus on economic policies that create and sustain opportunities for all Americans.","TweetDeck",,,,FALSE,FALSE,2,7,,,,,,,,,,,,,,,,"en",,,,,,,,,,,,,
"x563410383541895169",2015-02-05 18:54:37,"x188019606","Clyburn","Keeping everyone at @UofSC in my thoughts and prayers.  If you’re near campus stay inside until the situation is under control.","TweetDeck",,,,FALSE,FALSE,28,56,,,,,,,,,,,,,,"x28161251","UofSC","en",,,,,,,,,,,,,
"x563092229028585473",2015-02-04 21:50:23,"x188019606","Clyburn","I was honored to remark on the passing of one of my hero's, golfer, Charlie Sifford, on the floor of the House today. http://t.co/jlgeMlnJF0","TweetDeck",,,,FALSE,FALSE,3,7,,,"youtu.be/JNuVc2LaFRo","http://t.co/jlgeMlnJF0","http://youtu.be/JNuVc2LaFRo",,,,,,,,,,,"en",,,,,,,,,,,,,
"x563037873180774402",2015-02-04 18:14:24,"x188019606","Clyburn","An area we need to pay attention to is persistent poverty. This week, I discussed my 10-20-30 plan on the House Floor http://t.co/MWDLKMGOHI","TweetDeck",,,,FALSE,FALSE,8,8,,,"youtu.be/Kw9y3F5VaSQ","http://t.co/MWDLKMGOHI","http://youtu.be/Kw9y3F5VaSQ",,,,,,,,,,,"en",,,,,,,,,,,,,
"x562998969337651201",2015-02-04 15:39:48,"x188019606","Clyburn","RIP Charlie Sifford, a great man and trailblazing pioneer for a great game; the Jackie Robinson of golf. http://t.co/xkhW8SZ7lh","TweetDeck",,,,FALSE,FALSE,3,9,,,"assistantdemocraticleader.house.gov/index.cfm?p=Pr…","http://t.co/xkhW8SZ7lh","http://assistantdemocraticleader.house.gov/index.cfm?p=PressReleases&ContentRecord_id=D5E35758-77DE-4001-8CE4-64AE6F8EF926",,,,,,,,,,,"en",,,,,,,,,,,,,
"x562735603813724160",2015-02-03 22:13:17,"x188019606","Clyburn","RT @HouseDemocrats: House GOP voted 56 times to undermine the Affordable Care Act &amp; force millions of Americans to lose their healthcare. h…","Twitter for iPhone",,,,FALSE,TRUE,0,146,,,,,,,,,,,,,,"x43963249","HouseDemocrats","en",,,"x562734160637607936","House GOP voted 56 times to undermine the Affordable Care Act &amp; force millions of Americans to lose their healthcare. http://t.co/sL2vCY7t2O",,,,,,,,,
"x562669589113217024",2015-02-03 17:50:58,"x188019606","Clyburn","Today, stories of Americans from across the country show us the Affordable Care Act is working. #PeopleOverPolitics http://t.co/wHXUyBTNoI","TweetDeck",,,,FALSE,FALSE,8,6,"PeopleOverPolitics",,,,,"http://pbs.twimg.com/media/B88A-U0CAAAWGNh.jpg","http://t.co/wHXUyBTNoI","https://twitter.com/Clyburn/status/562669589113217024/photo/1","photo","http://pbs.twimg.com/media/B88A-U0CAAAWGNh.jpg","http://t.co/wHXUyBTNoI","https://twitter.com/Clyburn/status/562669589113217024/photo/1",,,,"en",,,,,,,,,,,,,
"x562627377377710080",2015-02-03 15:03:14,"x188019606","Clyburn","In SC, 161,941 ppl signed up for insurance through the Marketplace but the GOP is pushing another bill to repeal ACA  #peopleoverpolitics","TweetDeck",,,,FALSE,FALSE,6,7,"peopleoverpolitics",,,,,,,,,,,,,,,"en",,,,,,,,,,,,,
"x562620489235828736",2015-02-03 14:35:52,"x188019606","Clyburn","Thrilled that @HHSGov is making an investment in @SCFirstSteps.  Investing in early childhood edu is so important. http://t.co/YJJMeqLCFS","TweetDeck",,,,FALSE,FALSE,6,6,,,"clyburn.house.gov/press-release/…","http://t.co/YJJMeqLCFS","http://clyburn.house.gov/press-release/congressman-clyburn-announces-millions-south-carolina-first-steps-school-readiness",,,,,,,,,"x44783853 21912899","HHSGov SCFirstSteps","en",,,,,,,,,,,,,
"x562618124130717697",2015-02-03 14:26:28,"x188019606","Clyburn","RT @HouseDemocrats: .@HouseGOP will vote for 56th time to repeal/undermine health care for Americans today. Time for #PeopleOverPolitics! h…","TweetDeck",,,,FALSE,TRUE,0,179,"PeopleOverPolitics",,,,,,,,,,,,,"x43963249 15207668","HouseDemocrats HouseGOP","en",,,"x562604403069566976",".@HouseGOP will vote for 56th time to repeal/undermine health care for Americans today. Time for #PeopleOverPolitics! http://t.co/Nt1XtOXtS5",,,,,,,,,
"x562335488544358400",2015-02-02 19:43:22,"x188019606","Clyburn","It’s another week in the new Republican Congress, which means another stale attempt to repeal the Affordable Care Act. #PeopleNotPolitics","TweetDeck",,,,FALSE,FALSE,8,9,"PeopleNotPolitics",,,,,,,,,,,,,,,"en",,,,,,,,,,,,,
"x561223147362717697",2015-01-30 18:03:20,"x188019606","Clyburn","Final presser of the @housedemocrats 2015 Issues Conf. We must grow our middle class for the future of this country. http://t.co/6NNM96OZzT","Twitter for iPhone",,,,FALSE,FALSE,3,10,,,,,,"http://pbs.twimg.com/media/B8ndeUWCUAAoZuV.jpg","http://t.co/6NNM96OZzT","https://twitter.com/Clyburn/status/561223147362717697/photo/1","photo","http://pbs.twimg.com/media/B8ndeUWCUAAoZuV.jpg","http://t.co/6NNM96OZzT","https://twitter.com/Clyburn/status/561223147362717697/photo/1",,"x43963249","HouseDemocrats","en",,,,,,,,,,,,,
"x561219379011280897",2015-01-30 17:48:21,"x188019606","Clyburn","RT @AU4Change: .@Clyburn: Middle class economy is so critical for the future growth &amp; development of this great country, we need to get mor…","Twitter for iPhone",,,,FALSE,TRUE,0,3,,,,,,,,,,,,,,"x15135675 188019606","AU4Change Clyburn","en",,,"x561219297503371264",".@Clyburn: Middle class economy is so critical for the future growth &amp; development of this great country, we need to get more people engaged",,,,,,,,,
"x560978389264506880",2015-01-30 01:50:45,"x188019606","Clyburn","Emily and I enjoyed seeing President @BarackObama at the @HouseDemocrats 2015 Issues Conference. #HouseDemsInPhilly http://t.co/7XsoFdQwok","Twitter for iPhone",,,,FALSE,FALSE,18,19,"HouseDemsInPhilly",,,,,"http://pbs.twimg.com/media/B8j-3aoCYAAdahO.jpg","http://t.co/7XsoFdQwok","https://twitter.com/Clyburn/status/560978389264506880/photo/1","photo","http://pbs.twimg.com/media/B8j-3aoCYAAdahO.jpg","http://t.co/7XsoFdQwok","https://twitter.com/Clyburn/status/560978389264506880/photo/1",,"x813286 43963249","BarackObama HouseDemocrats","en",,,,,,,,,,,,,
"x560908881535041536",2015-01-29 21:14:33,"x188019606","Clyburn","Im excited to announce that I’ll be attending the 50th Anni of the Selma march in AL. It’s time to #embracethefuture while honoring our past","TweetDeck",,,,FALSE,FALSE,7,3,"embracethefuture",,,,,,,,,,,,,,,"en",,,,,,,,,,,,,
"x560884493070778368",2015-01-29 19:37:38,"x188019606","Clyburn","I am happy to announce the outstanding investment HUD is making in SC to help find a solution to end homelessness.
http://t.co/K18Vw2acWx","TweetDeck",,,,FALSE,FALSE,2,9,,,"clyburn.house.gov/press-release/…","http://t.co/K18Vw2acWx","http://clyburn.house.gov/press-release/congressman-clyburn-announces-millions-continuum-care-awards-south-carolina",,,,,,,,,,,"en",,,,,,,,,,,,,
"x560792173914750976",2015-01-29 13:30:47,"x188019606","Clyburn",".@HouseDemocrats are using this 2015 Issues Conference to discuss ways to grow America's economy &amp; American paychecks! #HouseDemsInPhilly","Twitter for iPhone",,,,FALSE,FALSE,30,59,"HouseDemsInPhilly",,,,,,,,,,,,,"x43963249","HouseDemocrats","en",,,,,,,,,,,,,
"x560601635152355330",2015-01-29 00:53:39,"x188019606","Clyburn","Discussing the Democratic economic agenda in Philly during the @HouseDemocrats Issues Conference. #HouseDemsInPhilly http://t.co/F0NEg3aJcZ","Twitter for iPhone",,,,FALSE,FALSE,5,10,"HouseDemsInPhilly",,,,,"http://pbs.twimg.com/media/B8eoNYSCcAE11JL.jpg","http://t.co/F0NEg3aJcZ","https://twitter.com/Clyburn/status/560601635152355330/photo/1","photo","http://pbs.twimg.com/media/B8eoNYSCcAE11JL.jpg","http://t.co/F0NEg3aJcZ","https://twitter.com/Clyburn/status/560601635152355330/photo/1",,"x43963249","HouseDemocrats","en",,,,,,,,,,,,,
"x560563503438630913",2015-01-28 22:22:08,"x188019606","Clyburn","Great to see my friend DeDe Lea at last night's screening of Selma. We must honor our history and #embracethefuture http://t.co/ZU4gQB6hqk","Twitter for iPhone",,,,FALSE,FALSE,3,4,"embracethefuture",,,,,"http://pbs.twimg.com/media/B8eFh5MCUAAOw76.jpg","http://t.co/ZU4gQB6hqk","https://twitter.com/Clyburn/status/560563503438630913/photo/1","photo","http://pbs.twimg.com/media/B8eFh5MCUAAOw76.jpg","http://t.co/ZU4gQB6hqk","https://twitter.com/Clyburn/status/560563503438630913/photo/1",,,,"en",,,,,,,,,,,,,
"x560165095041671168",2015-01-27 19:59:00,"x188019606","Clyburn","Enjoyed serving on the UNION Congressional Orientation on Faith &amp; Governing ""Faith &amp; Values Matter in Congress"" panel http://t.co/FfYU9aankE","TweetDeck",,,,FALSE,FALSE,4,4,,,,,,"http://pbs.twimg.com/media/B8YbFGpCMAA6pmd.jpg","http://t.co/FfYU9aankE","https://twitter.com/Clyburn/status/560165095041671168/photo/1","photo","http://pbs.twimg.com/media/B8YbFGpCMAA6pmd.jpg","http://t.co/FfYU9aankE","https://twitter.com/Clyburn/status/560165095041671168/photo/1",,,,"en",,,,,,,,,,,,,
"x560131158852505600",2015-01-27 17:44:09,"x188019606","Clyburn","Today we remember the victims and survivors of the Holocaust.  The liberation of Auschwitz was 70 years ago today.  #neverforget","Twitter for iPhone",,,,FALSE,FALSE,11,27,"neverforget",,,,,,,,,,,,,,,"en",,,,,,,,,,,,,
"x558694361488429058",2015-01-23 18:34:50,"x188019606","Clyburn","#FF @RepCartwright @RepJeffries @replujangrisham @RepGraceMeng @RepBrendanBoyle #DemOutreachEngagementTaskForce (2/2)","TweetDeck",,,,FALSE,FALSE,2,6,"FF DemOutreachEngagementTaskForce",,,,,,,,,,,,,"x776664410 467823431 1061385474 1051127714 231108733","RepCartwright RepJeffries RepLujanGrisham RepGraceMeng RepBrendanBoyle","und",,,,,,,,,,,,,
"x558694317955747840",2015-01-23 18:34:40,"x188019606","Clyburn","#FF @NancyPelosi @RepRoybalAllard @NydiaVelazquez @RepBarbaraLee @RepAndreCarson @RepRichmond #DemOutreachEngagementTaskForce (1/2)","TweetDeck",,,,FALSE,FALSE,4,1,"FF DemOutreachEngagementTaskForce",,,,,,,,,,,,,"x15764644 479872233 164369297 248735463 199325935 267854863","NancyPelosi RepRoybalAllard NydiaVelazquez RepBarbaraLee RepAndreCarson RepRichmond","und",,,,,,,,,,,,,
"x558335714690355200",2015-01-22 18:49:42,"x188019606","Clyburn","As a husband, father to 3 girls &amp; grandfather, I strongly support women’s rights and reproductive freedom. #tbt http://t.co/GYCs5WmvZ5","TweetDeck",,,,FALSE,FALSE,53,82,"tbt",,,,,"http://pbs.twimg.com/media/B7-bNmtCAAA_L39.jpg","http://t.co/GYCs5WmvZ5","https://twitter.com/Clyburn/status/558335714690355200/photo/1","photo","http://pbs.twimg.com/media/B7-bNmtCAAA_L39.jpg","http://t.co/GYCs5WmvZ5","https://twitter.com/Clyburn/status/558335714690355200/photo/1",,,,"en",,,,,,,,,,,,,
"x558306188786692097",2015-01-22 16:52:22,"x188019606","Clyburn","MT @rollcall: @Clyburn,on the powerful moment in 'Selma' when his granddaughter put down the phone to watch the film. http://t.co/FVmk181b0w","TweetDeck",,,,FALSE,FALSE,1,3,,,"wp.me/p3fVW6-4yU","http://t.co/FVmk181b0w","http://wp.me/p3fVW6-4yU",,,,,,,,,"x15922214 188019606","rollcall Clyburn","en",,,,,,,,,,,,,
"x558302376055275520",2015-01-22 16:37:13,"x188019606","Clyburn","RT @rollcall: Rep. @Clyburn , on the powerful moment in 'Selma' when his young granddaughter put down the phone to watch the film. http://t…","TweetDeck",,,,FALSE,TRUE,0,8,,,,,,,,,,,,,,"x15922214 188019606","rollcall Clyburn","en",,,"x558302290520858624","Rep. @Clyburn , on the powerful moment in 'Selma' when his young granddaughter put down the phone to watch the film. http://t.co/LdmqmpZXvG",,,,,,,,,
"x558301976661065728",2015-01-22 16:35:38,"x188019606","Clyburn","RT @rollcall: Clyburn Offers Personal Perspective on the Relevance, Power of ‘Selma’ http://t.co/fVEfsKr1Ox via @DavidEldridge","TweetDeck",,,,FALSE,TRUE,0,3,,,"roll.cl/1CFUIeB","http://t.co/fVEfsKr1Ox","http://roll.cl/1CFUIeB",,,,,,,,,"x15922214 14305039","rollcall DavidEldridge","en",,,"x558299416315297792","Clyburn Offers Personal Perspective on the Relevance, Power of ‘Selma’ http://t.co/fVEfsKr1Ox via @DavidEldridge",,,,,,,,,
"x558013137496981505",2015-01-21 21:27:54,"x188019606","Clyburn","You can read our release here: http://t.co/fA40shpFz0","TweetDeck",,,,FALSE,FALSE,1,7,,,"clyburn.house.gov/press-release/…","http://t.co/fA40shpFz0","http://clyburn.house.gov/press-release/pelosi-clyburn-announce-members-house-democrats-democratic-outreach-engagement-task",,,,,,,,,,,"en",,,,,,,,,,,,,
"x558013073517064193",2015-01-21 21:27:38,"x188019606","Clyburn","I was thrilled to announce the members of the @HouseDemocrats Outreach &amp; Engagement Task Force today w/ @NancyPelosi http://t.co/UrsljAlJaz","TweetDeck",,,,FALSE,FALSE,5,6,,,,,,"http://pbs.twimg.com/media/B751xcZCIAEQnH9.jpg","http://t.co/UrsljAlJaz","https://twitter.com/Clyburn/status/558013073517064193/photo/1","photo","http://pbs.twimg.com/media/B751xcZCIAEQnH9.jpg","http://t.co/UrsljAlJaz","https://twitter.com/Clyburn/status/558013073517064193/photo/1",,"x43963249 15764644","HouseDemocrats NancyPelosi","en",,,,,,,,,,,,,
"x557962188271681537",2015-01-21 18:05:26,"x188019606","Clyburn","RT @HouseRadioTV: STARTING NOW News Conference: @NancyPelosi, @Clyburn et al on new Outreach &amp; Engagement #TaskForce. Location: HVC Studio …","Twitter for iPhone",,,,FALSE,TRUE,0,4,"TaskForce",,,,,,,,,,,,,"x392810019 15764644 188019606","HouseRadioTV NancyPelosi Clyburn","en",,,"x557961914849198080","STARTING NOW News Conference: @NancyPelosi, @Clyburn et al on new Outreach &amp; Engagement #TaskForce. Location: HVC Studio A.",,,,,,,,,
"x557933150492700673",2015-01-21 16:10:03,"x188019606","Clyburn","TY @newsnation for having me on today. I believe last nights #SOTU solidified our base &amp; it's time to find common ground so we can legislate","TweetDeck",,,,FALSE,FALSE,3,8,"SOTU",,,,,,,,,,,,,"x3871344137","NewsNation","en",,,,,,,,,,,,,
"x557916624142221313",2015-01-21 15:04:23,"x188019606","Clyburn","The strength of our society &amp; the success of our economy depend on a strong middle class. Inspired by last night's #SOTU!","TweetDeck",,,,FALSE,FALSE,6,6,"SOTU",,,,,,,,,,,,,,,"en",,,,,,,,,,,,,
"x557737533480910848",2015-01-21 03:12:44,"x188019606","Clyburn","I look forward to helping working families in the 6th Congressional District during the 114th Congress. #SOTU","TweetDeck",,,,FALSE,FALSE,14,8,"SOTU",,,,,,,,,,,,,,,"en",,,,,,,,,,,,,
"x557729807690383360",2015-01-21 02:42:02,"x188019606","Clyburn","It’s time to close loopholes that help the wealthiest few and big corporations.  We need to embrace working men and women. #SOTU","TweetDeck",,,,FALSE,FALSE,658,539,"SOTU",,,,,,,,,,,,,,,"en",,,,,,,,,,,,,
"x557727561439264768",2015-01-21 02:33:07,"x188019606","Clyburn","Instead of fighting to cut education funding we should be finding ways to make it more affordable.  Congress should work for all people.","TweetDeck",,,,FALSE,FALSE,10,21,,,,,,,,,,,,,,,,"en",,,,,,,,,,,,,
"x557727328219176962",2015-01-21 02:32:11,"x188019606","Clyburn","I applaud the #FreeCommunityCollege plan for students willing to work hard for good jobs at good wages. #SOTU","TweetDeck",,,,FALSE,FALSE,22,29,"FreeCommunityCollege SOTU",,,,,,,,,,,,,,,"en",,,,,,,,,,,,,
"x557726704337448961",2015-01-21 02:29:43,"x188019606","Clyburn","The people of the 6th Congressional District would benefit tremendously w/ a rise in the minimum wage. It’s time to pay our workers fairly.","TweetDeck",,,,FALSE,FALSE,7,8,,,,,,,,,,,,,,,,"en",,,,,,,,,,,,,
"x557726566307102720",2015-01-21 02:29:10,"x188019606","Clyburn","Equal pay for equal work is a no brainer.  I appreciate the President’s push for this and hope Congress will act soon. #SOTU","TweetDeck",,,,FALSE,FALSE,14,17,"SOTU",,,,,,,,,,,,,,,"en",,,,,,,,,,,,,
