"status_id","created_at","user_id","screen_name","text","source","reply_to_status_id","reply_to_user_id","reply_to_screen_name","is_quote","is_retweet","favorite_count","retweet_count","hashtags","symbols","urls_url","urls_t.co","urls_expanded_url","media_url","media_t.co","media_expanded_url","media_type","ext_media_url","ext_media_t.co","ext_media_expanded_url","ext_media_type","mentions_user_id","mentions_screen_name","lang","quoted_status_id","quoted_text","retweet_status_id","retweet_text","place_url","place_name","place_full_name","place_type","country","country_code","geo_coords","coords_coords","bbox_coords"
"x748206152341655552",2016-06-29 17:27:02,"x188019606","Clyburn","RT @RepThompson: We can’t allow gun violence followed by moments of silence and no action to become America’s new normal. #DisarmHate https…","Twitter for iPad",,,,FALSE,TRUE,0,92,"DisarmHate",,,,,,,,,,,,,"x303861808","RepThompson","en",,,"x748199175154728961","We can’t allow gun violence followed by moments of silence and no action to become America’s new normal. #DisarmHate https://t.co/dDOBqPfJut",,,,,,,,,
"x748205842982440960",2016-06-29 17:25:48,"x188019606","Clyburn","RT @RepLoisFrankel: America needs action to #DisarmHate. // @freep: ""When is it enough? That's the question @HouseDemocrats are asking."" ht…","Twitter for iPad",,,,FALSE,TRUE,0,7,"DisarmHate",,,,,,,,,,,,,"x1077121945 8795772 43963249","RepLoisFrankel freep HouseDemocrats","en",,,"x748199571788955648","America needs action to #DisarmHate. // @freep: ""When is it enough? That's the question @HouseDemocrats are asking."" https://t.co/WSLW6oEZU4",,,,,,,,,
"x748205741513773056",2016-06-29 17:25:24,"x188019606","Clyburn","RT @RepTedDeutch: I joined sit in last week bc I've heard too many heartbreaking stories of tragic loss from gun violence. We owe it to the…","Twitter for iPad",,,,FALSE,TRUE,0,13,,,,,,,,,,,,,,"x137794015","RepTedDeutch","en",,,"x748199680387977216","I joined sit in last week bc I've heard too many heartbreaking stories of tragic loss from gun violence. We owe it to them to #disarmhate",,,,,,,,,
"x748205721070768128",2016-06-29 17:25:19,"x188019606","Clyburn","RT @RepRubenGallego: We won’t be silent. We won’t back down. Americans are demanding a vote to end gun violence. #DisarmHate
https://t.co/A…","Twitter for iPad",,,,FALSE,TRUE,0,15,"DisarmHate",,,,,,,,,,,,,"x2966570782","RepRubenGallego","en",,,"x748199674536878081","We won’t be silent. We won’t back down. Americans are demanding a vote to end gun violence. #DisarmHate
https://t.co/AKwgY2xP47",,,,,,,,,
"x748205530246692864",2016-06-29 17:24:34,"x188019606","Clyburn","RT @RepBeatty: .@HouseDemocrats are joining Americans in calling on @HouseGOP to #DisarmHate.","Twitter for iPad",,,,FALSE,TRUE,0,5,"DisarmHate",,,,,,,,,,,,,"x1531521632 43963249 15207668","RepBeatty HouseDemocrats HouseGOP","en",,,"x748200013038227461",".@HouseDemocrats are joining Americans in calling on @HouseGOP to #DisarmHate.",,,,,,,,,
"x748205326558760961",2016-06-29 17:23:45,"x188019606","Clyburn","RT @RepTimRyan: .@SpeakerRyan, it is time to confront the epidemic of gun violence in this country. #DisarmHate #DayOfAction https://t.co/h…","Twitter for iPad",,,,FALSE,TRUE,0,54,"DisarmHate DayOfAction",,,,,,,,,,,,,"x13491312 18916432","RepTimRyan SpeakerRyan","en",,,"x748200550915772416",".@SpeakerRyan, it is time to confront the epidemic of gun violence in this country. #DisarmHate #DayOfAction https://t.co/hoQdTSdZMY",,,,,,,,,
"x748203768664186880",2016-06-29 17:17:34,"x188019606","Clyburn","RT @RepMaloney: It's past time we #DisarmHate. Proud to join with #gunsafety advocates for a NY sit-in on this Nat'l Day of Action https://…","Twitter for iPad",,,,FALSE,TRUE,0,44,"DisarmHate gunsafety",,,,,,,,,,,,,"x258900199","RepMaloney","en",,,"x748201139275866112","It's past time we #DisarmHate. Proud to join with #gunsafety advocates for a NY sit-in on this Nat'l Day of Action https://t.co/VAOpj6akoA",,,,,,,,,
"x748203492918104064",2016-06-29 17:16:28,"x188019606","Clyburn","RT @RepLoisFrankel: We can’t wait for more Americans to fall victim to gun violence. The time for action is now. #DisarmHate https://t.co/A…","Twitter for iPad",,,,FALSE,TRUE,0,44,"DisarmHate",,,,,,,,,,,,,"x1077121945","RepLoisFrankel","en",,,"x748201884490489858","We can’t wait for more Americans to fall victim to gun violence. The time for action is now. #DisarmHate https://t.co/ADvRCa79SV",,,,,,,,,
"x748203444385812480",2016-06-29 17:16:16,"x188019606","Clyburn","RT @repdonnaedwards: Over 3yrs &amp; 6mnths since Newtown, over 113,100 people killed by someone using a #gun &amp; NO votes N House. #DisarmHate h…","Twitter for iPad",,,,FALSE,TRUE,0,32,"gun DisarmHate",,,,,,,,,,,,,"x82649553","repdonnaedwards","en",,,"x748201933412966400","Over 3yrs &amp; 6mnths since Newtown, over 113,100 people killed by someone using a #gun &amp; NO votes N House. #DisarmHate https://t.co/cnVAudl44H",,,,,,,,,
"x747506750409019396",2016-06-27 19:07:51,"x188019606","Clyburn","Click here to read my post on Medium, “Good Trouble” by @Clyburn https://t.co/553xcXiiP2","Twitter for iPad",,,,FALSE,FALSE,40,22,,,"medium.com/@Clyburn/good-…","https://t.co/553xcXiiP2","https://medium.com/@Clyburn/good-trouble-ce12fdc45d3b?source=twitterShare-7df647577595-1467054104",,,,,,,,,"x188019606","Clyburn","en",,,,,,,,,,,,,
"x746421977729011712",2016-06-24 19:17:21,"x188019606","Clyburn","Actions speak louder than words. Time for @SpeakerRyan @SenateMajLdr to #GiveUsAVote to #RestoreTheVRA. https://t.co/Swu7Ca2W2Q","Twitter Web Client",,,,FALSE,FALSE,44,26,"GiveUsAVote RestoreTheVRA",,,,,"http://pbs.twimg.com/media/ClvR3CLWgAA2y6r.jpg","https://t.co/Swu7Ca2W2Q","https://twitter.com/Clyburn/status/746421977729011712/photo/1","photo","http://pbs.twimg.com/media/ClvR3CLWgAA2y6r.jpg","https://t.co/Swu7Ca2W2Q","https://twitter.com/Clyburn/status/746421977729011712/photo/1",,"x18916432 1249982359","SpeakerRyan SenateMajLdr","en",,,,,,,,,,,,,
"x746417152618565632",2016-06-24 18:58:11,"x188019606","Clyburn","Tomorrow marks 3 yrs of @HouseGOP inaction on voting rights since @Scotus gutted the VRA &amp; states all over the U.S. made it harder to vote.","Twitter Web Client",,,,FALSE,FALSE,27,31,,,,,,,,,,,,,,"x15207668 15109516","HouseGOP Scotus","en",,,,,,,,,,,,,
"x746078101222887424",2016-06-23 20:30:55,"x188019606","Clyburn","I first met @repjohnlewis on October 14, 1960 at Morehouse College with Dr. Martin Luther King, Jr. #goodtrouble","Twitter Web Client",,,,FALSE,FALSE,93,28,"goodtrouble",,,,,,,,,,,,,"x29450962","repjohnlewis","en",,,,,,,,,,,,,
"x746077192283631617",2016-06-23 20:27:18,"x188019606","Clyburn","For anyone to call this a “publicity stunt” doesn’t know @repjohnlewis. #goodtrouble","Twitter Web Client",,,,FALSE,FALSE,143,54,"goodtrouble",,,,,,,,,,,,,"x29450962","repjohnlewis","en",,,,,,,,,,,,,
"x746042431146201088",2016-06-23 18:09:11,"x188019606","Clyburn","RT @repblumenauer: Jim Clyburn wraps up the House Democrats gun safety presentation on House Floor https://t.co/8QxVfncv7H","TweetDeck",,,,FALSE,TRUE,0,25,,,,,,"http://pbs.twimg.com/media/ClppVU-WYAA317V.jpg","https://t.co/8QxVfncv7H","https://twitter.com/repblumenauer/status/746024514232922112/photo/1","photo","http://pbs.twimg.com/media/ClppVU-WYAA317V.jpg","https://t.co/8QxVfncv7H","https://twitter.com/repblumenauer/status/746024514232922112/photo/1",,"x15954997","repblumenauer","en",,,"x746024514232922112","Jim Clyburn wraps up the House Democrats gun safety presentation on House Floor https://t.co/8QxVfncv7H",,,,,,,,,
"x746028897293197312",2016-06-23 17:15:24,"x188019606","Clyburn","@SpeakerRyan will not let us vote on #NoFlyNoBuy #universalbackgroundcheck, the Charleston Loophole and #DisarmHate. We will not be silent.","Twitter Web Client",,"x18916432","SpeakerRyan",FALSE,FALSE,31,16,"NoFlyNoBuy universalbackgroundcheck DisarmHate",,,,,,,,,,,,,"x18916432","SpeakerRyan","en",,,,,,,,,,,,,
"x746027224982261760",2016-06-23 17:08:45,"x188019606","Clyburn","The time has come for common sense gun laws in America. #NoMoreSilence #NoBillNoBreak #DisarmHate","Twitter Web Client",,,,FALSE,FALSE,66,43,"NoMoreSilence NoBillNoBreak DisarmHate",,,,,,,,,,,,,,,"en",,,,,,,,,,,,,
"x746026744864448514",2016-06-23 17:06:51,"x188019606","Clyburn","""Nothing is more powerful in all the world than an idea whose time has come."" Victor Hugo #NoMoreSilence #NoBillNoBreak #goodtrouble","Twitter Web Client",,,,FALSE,FALSE,76,44,"NoMoreSilence NoBillNoBreak goodtrouble",,,,,,,,,,,,,,,"en",,,,,,,,,,,,,
"x746011258885906433",2016-06-23 16:05:18,"x188019606","Clyburn","On the floor preparing my remarks 24 hours in #sitin
#holdthefloor #nobillnobreak  Tune in! #goodtrouble https://t.co/MGVgSjDQ58","Twitter Web Client",,,,FALSE,FALSE,165,66,"sitin holdthefloor nobillnobreak goodtrouble",,,,,"http://pbs.twimg.com/media/ClpdQ6YWEAAawdO.jpg","https://t.co/MGVgSjDQ58","https://twitter.com/Clyburn/status/746011258885906433/photo/1","photo","http://pbs.twimg.com/media/ClpdQ6YWEAAawdO.jpg","https://t.co/MGVgSjDQ58","https://twitter.com/Clyburn/status/746011258885906433/photo/1",,,,"en",,,,,,,,,,,,,
"x745782490216931328",2016-06-23 00:56:16,"x188019606","Clyburn","Still #StandingUpBySittingDown with @housedems for #nobillnobreak #DisarmHate #NoBillNoBreak https://t.co/Ei0cxilAPL","Twitter Web Client",,,,FALSE,FALSE,427,242,"StandingUpBySittingDown nobillnobreak DisarmHate NoBillNoBreak",,,,,"http://pbs.twimg.com/media/ClmMIxpWYAAo2NJ.jpg","https://t.co/Ei0cxilAPL","https://twitter.com/Clyburn/status/745782490216931328/photo/1","photo","http://pbs.twimg.com/media/ClmMIxpWYAAo2NJ.jpg","https://t.co/Ei0cxilAPL","https://twitter.com/Clyburn/status/745782490216931328/photo/1",,"x17552486","HouseDems","en",,,,,,,,,,,,,
"x745763263405760512",2016-06-22 23:39:52,"x188019606","Clyburn","Pleased to escort @CornellWBrooks and @HilaryOShelton in the Capitol to show support for #NoBillNoBreak. #DisarmHate https://t.co/bY21hfsYw3","Twitter Web Client",,,,FALSE,FALSE,181,79,"NoBillNoBreak DisarmHate",,,,,"http://pbs.twimg.com/media/Cll7XR5WEAAPPfQ.jpg","https://t.co/bY21hfsYw3","https://twitter.com/Clyburn/status/745763263405760512/photo/1","photo","http://pbs.twimg.com/media/Cll7XR5WEAAPPfQ.jpg","https://t.co/bY21hfsYw3","https://twitter.com/Clyburn/status/745763263405760512/photo/1",,"x512225400 265993392","CornellWBrooks HilaryOShelton","en",,,,,,,,,,,,,
"x745725086758502400",2016-06-22 21:08:10,"x188019606","Clyburn","RT @AriBerman: .@repjohnlewis first sit-in, at segregated lunch counter in Nashville 1960 #NoBillNoBreak https://t.co/m1gfwIpffW","Twitter for iPad",,,,FALSE,TRUE,0,946,"NoBillNoBreak",,,,,"http://pbs.twimg.com/media/CllH-J3WQAAvVjG.jpg","https://t.co/m1gfwIpffW","https://twitter.com/AriBerman/status/745706991914455040/photo/1","photo","http://pbs.twimg.com/media/CllH-J3WQAAvVjG.jpg","https://t.co/m1gfwIpffW","https://twitter.com/AriBerman/status/745706991914455040/photo/1",,"x15952856 29450962","AriBerman repjohnlewis","en",,,"x745706991914455040",".@repjohnlewis first sit-in, at segregated lunch counter in Nashville 1960 #NoBillNoBreak https://t.co/m1gfwIpffW",,,,,,,,,
"x745709548112064512",2016-06-22 20:06:25,"x188019606","Clyburn","RT @RepWilson: It is a historic day on Capitol Hill as Democrats stand up &amp; sit in to demand a vote on gun violence. #NoBillNoBreak https:/…","Twitter for iPad",,,,FALSE,TRUE,0,80,"NoBillNoBreak",,,,,,,,,,,,,"x234014087","RepWilson","en",,,"x745698688283086848","It is a historic day on Capitol Hill as Democrats stand up &amp; sit in to demand a vote on gun violence. #NoBillNoBreak https://t.co/nTAViicwoh",,,,,,,,,
"x745687117838319616",2016-06-22 18:37:17,"x188019606","Clyburn","MLK decried “the appalling silence of good people.” 1 yr after #Emanuelamechurch I won't be silent. Now is the time for action #DisarmHate","Twitter Web Client",,,,FALSE,FALSE,345,273,"Emanuelamechurch DisarmHate",,,,,,,,,,,,,,,"en",,,,,,,,,,,,,
"x745674803881861122",2016-06-22 17:48:21,"x188019606","Clyburn","Tried to ask @SpeakerRyan for a vote but was silenced. Today we will #HoldTheFloor until we get a vote. #NoBillNoBreak #DisarmHate","Twitter Web Client",,,,FALSE,FALSE,381,279,"HoldTheFloor NoBillNoBreak DisarmHate",,,,,,,,,,,,,"x18916432","SpeakerRyan","en",,,,,,,,,,,,,
"x745670831699800064",2016-06-22 17:32:34,"x188019606","Clyburn","We will #holdthefloor until we get votes on #NoFlyNoBuy, Universal Background Checks, and Gun Violence Research. #NoBillNoBreak","Twitter Web Client",,,,FALSE,FALSE,360,269,"holdthefloor NoFlyNoBuy NoBillNoBreak",,,,,,,,,,,,,,,"en",,,,,,,,,,,,,
"x745668785370206208",2016-06-22 17:24:26,"x188019606","Clyburn","@repjohnlewis and I have been getting in the way for a long time now. Not going to stop now. #HoldTheFloor #NoBillNoBreak #GoodTrouble","Twitter Web Client",,"x29450962","repjohnlewis",FALSE,FALSE,178,113,"HoldTheFloor NoBillNoBreak GoodTrouble",,,,,,,,,,,,,"x29450962","repjohnlewis","en",,,,,,,,,,,,,
"x745668330510508032",2016-06-22 17:22:38,"x188019606","Clyburn","89 deaths every day from #gunviolence in America. I will continue to #holdthefloor with @repjohnlewis until we get a vote. #NoBillNoBreak","Twitter Web Client",,,,FALSE,FALSE,281,236,"gunviolence holdthefloor NoBillNoBreak",,,,,,,,,,,,,"x29450962","repjohnlewis","en",,,,,,,,,,,,,
"x745656817628418052",2016-06-22 16:36:53,"x188019606","Clyburn","RT @KayeKoonce: #NoVoteNoBreak #StandingUpBySittingDown Thx @Clyburn @repjohnlewis  https://t.co/qYNHU66GMb","Twitter for iPad",,,,FALSE,TRUE,0,30,"NoVoteNoBreak StandingUpBySittingDown",,"twitter.com/deepa_shivaram…","https://t.co/qYNHU66GMb","https://twitter.com/deepa_shivaram/status/745650374757978112",,,,,,,,,"x21968593 188019606 29450962","KayeKoonce Clyburn repjohnlewis","und",,,"x745652276321222656","#NoVoteNoBreak #StandingUpBySittingDown Thx @Clyburn @repjohnlewis  https://t.co/qYNHU66GMb",,,,,,,,,
"x745656444867969024",2016-06-22 16:35:24,"x188019606","Clyburn","RT @repjohnlewis: Sometimes you have to get in the way. You have to make some noise by speaking up and speaking out against injustice &amp; ina…","Twitter for iPad",,,,FALSE,TRUE,0,19265,,,,,,,,,,,,,,"x29450962","repjohnlewis","en",,,"x745631702186336256","Sometimes you have to get in the way. You have to make some noise by speaking up and speaking out against injustice &amp; inaction #goodtrouble",,,,,,,,,
"x745638061229379585",2016-06-22 15:22:21,"x188019606","Clyburn","RT @RepThompson: .@SpeakerRyan we can't leave until we vote on commonsense gun legislation Americans are calling for! #NoBillNoBreak https:…","Twitter for iPad",,,,FALSE,TRUE,0,934,"NoBillNoBreak",,,,,,,,,,,,,"x303861808 18916432","RepThompson SpeakerRyan","en",,,"x745597758216736768",".@SpeakerRyan we can't leave until we vote on commonsense gun legislation Americans are calling for! #NoBillNoBreak https://t.co/1BSslHmmo7",,,,,,,,,
"x745345106933342210",2016-06-21 19:58:15,"x188019606","Clyburn","RT @RepEsty: .@SpeakerRyan, #NoBillNoBreak! American people expect us to take action to protect them from suspected terrorists &amp; criminals.…","Twitter for iPad",,,,FALSE,TRUE,0,296,"NoBillNoBreak",,,,,,,,,,,,,"x1060984272 18916432","RepEsty SpeakerRyan","en",,,"x745221646148050944",".@SpeakerRyan, #NoBillNoBreak! American people expect us to take action to protect them from suspected terrorists &amp; criminals. #DisarmHate",,,,,,,,,
"x734848177560522753",2016-05-23 20:47:13,"x188019606","Clyburn","RT @PPSATSC: Thank you Rep. @Clyburn for stopping by our Columbia, SC health center for a tour! https://t.co/kqyByidbVb","Twitter Web Client",,,,FALSE,TRUE,0,9,,,,,,"http://pbs.twimg.com/media/CjJML4ZUkAETe2G.jpg","https://t.co/kqyByidbVb","https://twitter.com/PPSATSC/status/734751242879041536/photo/1","photo","http://pbs.twimg.com/media/CjJML4ZUkAETe2G.jpg","https://t.co/kqyByidbVb","https://twitter.com/PPSATSC/status/734751242879041536/photo/1",,"x102789020 188019606","PPSATSC Clyburn","en",,,"x734751242879041536","Thank you Rep. @Clyburn for stopping by our Columbia, SC health center for a tour! https://t.co/kqyByidbVb",,,,,,,,,
"x733747418790014977",2016-05-20 19:53:11,"x188019606","Clyburn","RT @RepGraceMeng: Holding town hall w/ @NydiaVelazquez, @RepJeffries on need 2 strengthen-restore #VotingRights Act. #RestoreTheVRA https:/…","Twitter Web Client",,,,FALSE,TRUE,0,15,"VotingRights RestoreTheVRA",,,,,,,,,,,,,"x1051127714 164369297 467823431","RepGraceMeng NydiaVelazquez RepJeffries","en",,,"x733685309515403264","Holding town hall w/ @NydiaVelazquez, @RepJeffries on need 2 strengthen-restore #VotingRights Act. #RestoreTheVRA https://t.co/guqZndkorp",,,,,,,,,
"x733746858997252100",2016-05-20 19:50:58,"x188019606","Clyburn","RT @RepRoybalAllard: I'm co-hosting a voting rights forum @EastLACollege Fri 5/20, 10AM! Be sure to register at https://t.co/jkVgLFQ0Gi. ht…","Twitter Web Client",,,,FALSE,TRUE,0,11,,,"votingrightsforum2016.eventbrite.com","https://t.co/jkVgLFQ0Gi","http://votingrightsforum2016.eventbrite.com",,,,,,,,,"x479872233 2981062548","RepRoybalAllard EastLACollege","en",,,"x733480182418309122","I'm co-hosting a voting rights forum @EastLACollege Fri 5/20, 10AM! Be sure to register at https://t.co/jkVgLFQ0Gi. https://t.co/7HuWKLcnlS",,,,,,,,,
"x733294756848140288",2016-05-19 13:54:28,"x188019606","Clyburn",".@HouseGOP has doubled down on efforts to turn discrimination into law, using #NDAA as a vehicle for their agenda of hate. #NDAAForAll","Twitter for iPad",,,,FALSE,FALSE,19,15,"NDAA NDAAForAll",,,,,,,,,,,,,"x15207668","HouseGOP","en",,,,,,,,,,,,,
"x733028857616474113",2016-05-18 20:17:53,"x188019606","Clyburn","Click here to read my op-ed on Republicans’ Feckless Policies and Reckless Politics: https://t.co/CBFGQXBaOG","Twitter Web Client",,,,FALSE,FALSE,16,14,,,"1.usa.gov/1NyRDI2","https://t.co/CBFGQXBaOG","http://1.usa.gov/1NyRDI2",,,,,,,,,,,"en",,,,,,,,,,,,,
"x732610986218278912",2016-05-17 16:37:25,"x188019606","Clyburn","Good news for N.Charleston! Reinvestment Fund, RWJF grant to address access to health care for low-income families. #InvestHealth","Twitter Web Client",,,,FALSE,FALSE,13,11,"InvestHealth",,,,,,,,,,,,,,,"en",,,,,,,,,,,,,
"x730785628401618947",2016-05-12 15:44:05,"x188019606","Clyburn","RT @kdrkrepp: As descendent of Confederate leadership, I support @Clyburn @RepAdamSmith amendment. Flag needs to come down. https://t.co/LB…","Twitter Web Client",,,,FALSE,TRUE,0,3,,,,,,,,,,,,,,"x1129736798 188019606 58928690","kdrkrepp Clyburn RepAdamSmith","en",,,"x730771044848553985","As descendent of Confederate leadership, I support @Clyburn @RepAdamSmith amendment. Flag needs to come down. https://t.co/LBrXBILKQ6",,,,,,,,,
"x730085301910183937",2016-05-10 17:21:14,"x188019606","Clyburn","RT @civilrightsorg: Less than 6 months until the first presidential election in 50 years without the VRA's full protections. Congress must…","Twitter Web Client",,,,FALSE,TRUE,0,30,,,,,,,,,,,,,,"x58503762","civilrightsorg","en",,,"x730056492087390208","Less than 6 months until the first presidential election in 50 years without the VRA's full protections. Congress must act! #RestoreTheVRA",,,,,,,,,
"x727582115508916224",2016-05-03 19:34:28,"x188019606","Clyburn","Today is #TeacherAppreciationDay. Be sure to #thankateacher for the countless lives changed for the better through quality education","Twitter Web Client",,,,FALSE,FALSE,31,23,"TeacherAppreciationDay thankateacher",,,,,,,,,,,,,,,"en",,,,,,,,,,,,,
"x726133240705241089",2016-04-29 19:37:10,"x188019606","Clyburn","It is not and never was flag of the Confederacy. Republicans should stop glorifying a myth. The Citadel should stop flying divisive symbol","Twitter Web Client",,,,FALSE,FALSE,55,34,,,,,,,,,,,,,,,,"en",,,,,,,,,,,,,
"x725750432820252673",2016-04-28 18:16:01,"x188019606","Clyburn","RT if you agree: House Republicans are wrong to vote to continue to fly Confederate battle flag at any institution supported by US tax $$$","Twitter for iPad",,,,FALSE,FALSE,80,132,,,,,,,,,,,,,,,,"en",,,,,,,,,,,,,
"x725426577819983872",2016-04-27 20:49:08,"x188019606","Clyburn","RT @postandcourier: .@Clyburn takes aim at #Citadel's #ConfederateFlag with amendment. https://t.co/dVJ5otUbd5 #chsnews @Emma_Dumain https:…","Twitter Web Client",,,,FALSE,TRUE,0,15,"Citadel ConfederateFlag chsnews",,"bit.ly/1rAgYaG","https://t.co/dVJ5otUbd5","http://bit.ly/1rAgYaG",,,,,,,,,"x14693499 188019606 243337600","postandcourier Clyburn Emma_Dumain","en",,,"x725421025073201152",".@Clyburn takes aim at #Citadel's #ConfederateFlag with amendment. https://t.co/dVJ5otUbd5 #chsnews @Emma_Dumain https://t.co/aymiV3pgpg",,,,,,,,,
"x725426357551927297",2016-04-27 20:48:16,"x188019606","Clyburn","RT @Emma_Dumain: .@Clyburn releases statement on #FY17NDAA amendment, saying it would not affect current ROTC students and staff.","Twitter Web Client",,,,FALSE,TRUE,0,1,"FY17NDAA",,,,,,,,,,,,,"x243337600 188019606","Emma_Dumain Clyburn","en",,,"x725419397494521856",".@Clyburn releases statement on #FY17NDAA amendment, saying it would not affect current ROTC students and staff.",,,,,,,,,
"x725426086952185856",2016-04-27 20:47:11,"x188019606","Clyburn","RT @Emma_Dumain: BREAKING: @Clyburn is reviving the Confederate flag debate on Capitol Hill. First stop, the Citadel #FY17NDAA https://t.co…","Twitter Web Client",,,,FALSE,TRUE,0,19,"FY17NDAA",,,,,,,,,,,,,"x243337600 188019606","Emma_Dumain Clyburn","en",,,"x725416431123357696","BREAKING: @Clyburn is reviving the Confederate flag debate on Capitol Hill. First stop, the Citadel #FY17NDAA https://t.co/3XHhKDUunU",,,,,,,,,
"x723600353275580416",2016-04-22 19:52:22,"x188019606","Clyburn","I had a great time talking with historian Eric Foner at  #Reconstruction150 today. @HistoricCola @UofSC History Center","Twitter Web Client",,,,FALSE,FALSE,6,6,"Reconstruction150",,,,,,,,,,,,,"x28161251","UofSC","en",,,,,,,,,,,,,
"x723231578042699776",2016-04-21 19:26:59,"x188019606","Clyburn","RT @OfficialCBC: We are sad to hear of the passing of the iconic Prince. He was an unapologetic performer that amazed all with his creativi…","Twitter Web Client",,,,FALSE,TRUE,0,14,,,,,,,,,,,,,,"x233783568","OfficialCBC","en",,,"x723227596561903617","We are sad to hear of the passing of the iconic Prince. He was an unapologetic performer that amazed all with his creativity and ingenuity.",,,,,,,,,
"x722504704148836356",2016-04-19 19:18:39,"x188019606","Clyburn","Congrats to Columbia Museum of Art on National Medal, nation's highest museum honor. I'm proud of CMA's countless community contributions","Twitter Web Client",,,,FALSE,FALSE,22,8,,,,,,,,,,,,,,,,"en",,,,,,,,,,,,,
"x720617851237883905",2016-04-14 14:20:58,"x188019606","Clyburn","RT @4H: ""Rev. Clementa Pinckney made a tremendous impact on the ppl of S.C."" Rep @Clyburn presents Pinckney's wife w/ Distinguished Alumni…","Twitter Web Client",,,,FALSE,TRUE,0,8,,,,,,,,,,,,,,"x14107459 188019606","4H Clyburn","en",,,"x720241793116143617","""Rev. Clementa Pinckney made a tremendous impact on the ppl of S.C."" Rep @Clyburn presents Pinckney's wife w/ Distinguished Alumni Medallion",,,,,,,,,
"x719967022222864384",2016-04-12 19:14:49,"x188019606","Clyburn","RIP to Bob McGlotten, who died last month. A true champion for working ppl, he served on the CBCI board and was always helping others","Twitter Web Client",,,,FALSE,FALSE,6,3,,,,,,,,,,,,,,,,"en",,,,,,,,,,,,,
"x719947177280323586",2016-04-12 17:55:57,"x188019606","Clyburn","Thanks to Robert Smith from N Charleston and folks at Goodwill Industries for 2016 Policymaker Award. We must support ppl w disabilities","Twitter Web Client",,,,FALSE,FALSE,15,6,,,,,,,,,,,,,,,,"en",,,,,,,,,,,,,
"x719900232604106752",2016-04-12 14:49:25,"x188019606","Clyburn","RIP Alma Brown, widow of late Commerce Sec Ron Brown. She was an amazing woman and leaves a legacy of service to others, especially children","Twitter Web Client",,,,FALSE,FALSE,26,16,,,,,,,,,,,,,,,,"en",,,,,,,,,,,,,
"x717732556876156928",2016-04-06 15:15:51,"x188019606","Clyburn","RT @RepBarbaraLee: CA passed largest expansion of voting rights in the nation. Join me, @Clyburn &amp; CA SoS Alex Padilla to learn more: https…","Twitter Web Client",,,,FALSE,TRUE,0,25,,,,,,,,,,,,,,"x248735463 188019606","RepBarbaraLee Clyburn","en",,,"x716359560064176129","CA passed largest expansion of voting rights in the nation. Join me, @Clyburn &amp; CA SoS Alex Padilla to learn more: https://t.co/3MhQ78DOqX",,,,,,,,,
"x715218961688866816",2016-03-30 16:47:43,"x188019606","Clyburn","OTD 6 yrs ago, Democrats enacted biggest college aid package in history; now must defeat Republican budget that rolls back aid for higher ed","Twitter Web Client",,,,FALSE,FALSE,37,41,,,,,,,,,,,,,,,,"en",,,,,,,,,,,,,
"x712723191714746369",2016-03-23 19:30:25,"x188019606","Clyburn","Sharp ↓ in AZ polling places since ’08 is no coincidence. More proof of coordinated effort to keep people fr voting. We must #RestoretheVRA","Twitter Web Client",,,,FALSE,FALSE,38,26,"RestoretheVRA",,,,,,,,,,,,,,,"en",,,,,,,,,,,,,
"x712396222607269888",2016-03-22 21:51:09,"x188019606","Clyburn","My thoughts and prayers go out to the victims of today's attacks in #Brussels. We stand in solidarity against terror and hatred.","Twitter Web Client",,,,FALSE,FALSE,28,11,"Brussels",,,,,,,,,,,,,,,"en",,,,,,,,,,,,,
"x712259053360013312",2016-03-22 12:46:06,"x188019606","Clyburn",".@HouseGOP plans to leave town for 2 weeks w/out voting on #budget or addressing health crises. #DoYourJobHouseGOP https://t.co/Z4G6TTFpMJ","Twitter for iPad",,,,FALSE,FALSE,133,226,"budget DoYourJobHouseGOP",,,,,"http://pbs.twimg.com/media/CeJz1c9UUAEhno4.jpg","https://t.co/Z4G6TTFpMJ","https://twitter.com/Clyburn/status/712259053360013312/photo/1","photo","http://pbs.twimg.com/media/CeJz1c9UUAEhno4.jpg","https://t.co/Z4G6TTFpMJ","https://twitter.com/Clyburn/status/712259053360013312/photo/1",,"x15207668","HouseGOP","en",,,,,,,,,,,,,
