"status_id","created_at","user_id","screen_name","text","source","reply_to_status_id","reply_to_user_id","reply_to_screen_name","is_quote","is_retweet","favorite_count","retweet_count","hashtags","symbols","urls_url","urls_t.co","urls_expanded_url","media_url","media_t.co","media_expanded_url","media_type","ext_media_url","ext_media_t.co","ext_media_expanded_url","ext_media_type","mentions_user_id","mentions_screen_name","lang","quoted_status_id","quoted_text","retweet_status_id","retweet_text","place_url","place_name","place_full_name","place_type","country","country_code","geo_coords","coords_coords","bbox_coords"
"x633631022249283584","2015-08-18 13:26:22","x2382685057","RepRobWoodall","Congrats to @GeorgiaGwinnett on a great 10 years! Looking forward to what's to come: http://t.co/GeoauKFgOT #GGC","Twitter Web Client",NA,"","",FALSE,FALSE,3,2,"GGC",NA,"bit.ly/1TOBksE","http://t.co/GeoauKFgOT","http://bit.ly/1TOBksE","","","","","","","",NA,"x36671384","GeorgiaGwinnett","en","","","","",NA,NA,NA,NA,NA,NA,NA,NA,NA
"x632297283418099712","2015-08-14 21:06:34","x2382685057","RepRobWoodall","Another great Business Expo in #Forsyth County! Thanks to all for everything you do! @forsythnews @ForsythChamber http://t.co/f8RocNR3r2","Twitter for iPhone",NA,"","",FALSE,FALSE,2,2,"Forsyth",NA,"","","","http://pbs.twimg.com/media/CMZfBVHUsAAih32.jpg","http://t.co/f8RocNR3r2","https://twitter.com/RepRobWoodall/status/632297283418099712/photo/1","photo","http://pbs.twimg.com/media/CMZfBVHUsAAih32.jpg","http://t.co/f8RocNR3r2","https://twitter.com/RepRobWoodall/status/632297283418099712/photo/1",NA,"x138450130 313392782","forsythnews ForsythChamber","en","","","","",NA,NA,NA,NA,NA,NA,NA,NA,NA
"x630750457242255360","2015-08-10 14:40:02","x2382685057","RepRobWoodall","I hope all our @GwinnettSchools students had a great summer! Welcome back &amp; I look forward to visiting with many of you this year! #Gwinnett","Twitter Web Client",NA,"","",FALSE,FALSE,1,1,"Gwinnett",NA,"","","","","","","","","","",NA,"x119766595","GwinnettSchools","en","","","","",NA,NA,NA,NA,NA,NA,NA,NA,NA
"x629744380606328832","2015-08-07 20:02:15","x2382685057","RepRobWoodall","Couldn’t help but notice the #FairTax in last night’s debate! For all of us on board from day 1 &amp; along the way–keep it up! @FairTaxOfficial","Twitter Web Client",NA,"","",FALSE,FALSE,3,2,"FairTax",NA,"","","","","","","","","","",NA,"x24009801","FairTaxOfficial","en","","","","",NA,NA,NA,NA,NA,NA,NA,NA,NA
"x629388807213690880","2015-08-06 20:29:19","x2382685057","RepRobWoodall","I hope all our @FCSchoolsGA students had a great first day back! Make this year a great one! #Forsyth","Twitter Web Client",NA,"","",FALSE,FALSE,2,2,"Forsyth",NA,"","","","","","","","","","",NA,"x22982114","FCSchoolsGA","en","","","","",NA,NA,NA,NA,NA,NA,NA,NA,NA
"x628700838026969089","2015-08-04 22:55:35","x2382685057","RepRobWoodall","About to kick off our telephone town hall meeting at 7PM. Hope you'll join! Call-in number: 877 229 8493, passcode 17849.","Twitter Web Client",NA,"","",FALSE,FALSE,0,0,"",NA,"","","","","","","","","","",NA,"","","en","","","","",NA,NA,NA,NA,NA,NA,NA,NA,NA
"x628294237638008832","2015-08-03 19:59:54","x2382685057","RepRobWoodall","POLL: Americans oppose the President’s #IranNuclearDeal by a 2:1 margin. It’s crucial we do better: http://t.co/hopB1NTFDN","Twitter Web Client",NA,"","",FALSE,FALSE,0,0,"IranNuclearDeal",NA,"bit.ly/1SB7pUg","http://t.co/hopB1NTFDN","http://bit.ly/1SB7pUg","","","","","","","",NA,"","","en","","","","",NA,NA,NA,NA,NA,NA,NA,NA,NA
"x627239745479962624","2015-07-31 22:09:43","x2382685057","RepRobWoodall","Partnering with our job-creators across the many industries throughout #GA07 is a pleasure.  Thanks… https://t.co/Gaaf0ypgJ1","Instagram",NA,"","",FALSE,FALSE,0,0,"GA07",NA,"instagram.com/p/50ReexuBw8/","https://t.co/Gaaf0ypgJ1","https://instagram.com/p/50ReexuBw8/","","","","","","","",NA,"","","en","","","","",NA,NA,NA,NA,NA,NA,NA,NA,NA
"x626517964750237699","2015-07-29 22:21:37","x2382685057","RepRobWoodall","Veterans have kept their promises to us, &amp; we must keep the promises we’ve made to them. Proud to be a part of passing #VAaccountability Act","Twitter Web Client",NA,"","",FALSE,FALSE,3,0,"VAaccountability",NA,"","","","","","","","","","",NA,"","","en","","","","",NA,NA,NA,NA,NA,NA,NA,NA,NA
"x626168456979828736","2015-07-28 23:12:48","x2382685057","RepRobWoodall","Proud to support the #REINSAct today. The American worker and small business pays the price for over-regulation: http://t.co/PF5hH5PBT3","Twitter Web Client",NA,"","",FALSE,FALSE,1,2,"REINSAct",NA,"1.usa.gov/1GZVp2r","http://t.co/PF5hH5PBT3","http://1.usa.gov/1GZVp2r","","","","","","","",NA,"","","en","","","","",NA,NA,NA,NA,NA,NA,NA,NA,NA
"x626037865420595200","2015-07-28 14:33:52","x2382685057","RepRobWoodall","House Budget Committee hearing today: http://t.co/n3lPZMM2IC. Fiscal responsibility requires sound budgeting principles. #budget","Twitter Web Client",NA,"","",FALSE,FALSE,2,1,"budget",NA,"1.usa.gov/1euH6fD","http://t.co/n3lPZMM2IC","http://1.usa.gov/1euH6fD","","","","","","","",NA,"","","en","","","","",NA,NA,NA,NA,NA,NA,NA,NA,NA
"x625784833369894912","2015-07-27 21:48:25","x2382685057","RepRobWoodall","Gwinnett County Food Pantries are low on needed items! Let's help them stock up! READ MORE: http://t.co/LqbFJMnEs2 #Gwinnett","Twitter Web Client",NA,"","",FALSE,FALSE,1,2,"Gwinnett",NA,"bit.ly/1IpXB8V","http://t.co/LqbFJMnEs2","http://bit.ly/1IpXB8V","","","","","","","",NA,"","","en","","","","",NA,NA,NA,NA,NA,NA,NA,NA,NA
"x624253928948035586","2015-07-23 16:25:09","x2382685057","RepRobWoodall","With last night's passage of #HR1734 the House took another step towards empowering our states rather than Washington. #accountability","Twitter Web Client",NA,"","",FALSE,FALSE,2,2,"HR1734 accountability",NA,"","","","","","","","","","",NA,"","","en","","","","",NA,NA,NA,NA,NA,NA,NA,NA,NA
"x623566844490838016","2015-07-21 18:54:55","x2382685057","RepRobWoodall","Thank you, #Marine LCpl &amp; Forsyth resident Austin Handle, for this touching memorial to those we lost in #Chattanooga http://t.co/grWAXXtQfi","Twitter Web Client",NA,"","",FALSE,FALSE,3,2,"Marine Chattanooga",NA,"bit.ly/1OvadfO","http://t.co/grWAXXtQfi","http://bit.ly/1OvadfO","","","","","","","",NA,"","","en","","","","",NA,NA,NA,NA,NA,NA,NA,NA,NA
"x623210611799891969","2015-07-20 19:19:23","x2382685057","RepRobWoodall","Join me on @instagram and share your best pics from the district using #GA07! @reprobwoodall is where you'll find me.","Twitter Web Client",NA,"","",FALSE,FALSE,3,2,"GA07",NA,"","","","","","","","","","",NA,"x180505807 2382685057","instagram RepRobWoodall","en","","","","",NA,NA,NA,NA,NA,NA,NA,NA,NA
"x623158807284318208","2015-07-20 15:53:32","x2382685057","RepRobWoodall","I want to thank the local verizon team in the new Peachtree Corners location for showing me around… https://t.co/RC6W1LgRRu","Instagram",NA,"","",FALSE,FALSE,3,1,"",NA,"instagram.com/p/5XRrhyuB1-/","https://t.co/RC6W1LgRRu","https://instagram.com/p/5XRrhyuB1-/","","","","","","","",NA,"","","en","","","","",NA,NA,NA,NA,NA,NA,NA,NA,NA
"x622162468295544833","2015-07-17 21:54:26","x2382685057","RepRobWoodall","A bad #IranNuclearDeal is more dangerous than no deal at all – READ MORE on HRes367 opposing it: http://t.co/YOKReow0mw","Twitter Web Client",NA,"","",FALSE,FALSE,6,5,"IranNuclearDeal",NA,"1.usa.gov/1LfFogw","http://t.co/YOKReow0mw","http://1.usa.gov/1LfFogw","","","","","","","",NA,"","","en","","","","",NA,NA,NA,NA,NA,NA,NA,NA,NA
"x621795994469027840","2015-07-16 21:38:12","x2382685057","RepRobWoodall","May we all remember the families and those affected by the horrific shooting in #Chattanooga today. #PrayforChattanooga","Twitter Web Client",NA,"","",FALSE,FALSE,4,3,"Chattanooga PrayforChattanooga",NA,"","","","","","","","","","",NA,"","","en","","","","",NA,NA,NA,NA,NA,NA,NA,NA,NA
"x621711696076361728","2015-07-16 16:03:13","x2382685057","RepRobWoodall","Just awesome to see so many passionate folks descend on DC for such a worthwhile initiative! To… https://t.co/EFpBECYwZh","Instagram",NA,"","",FALSE,FALSE,1,1,"",NA,"instagram.com/p/5M_nD7OB-n/","https://t.co/EFpBECYwZh","https://instagram.com/p/5M_nD7OB-n/","","","","","","","",NA,"","","en","","","","",NA,NA,NA,NA,NA,NA,NA,NA,NA
"x621441406905774082","2015-07-15 22:09:11","x2382685057","RepRobWoodall","Today, the House moved the ball forward towards long-term #transportation solutions. READ MORE: http://t.co/NtHgqrP5in","Twitter Web Client",NA,"","",FALSE,FALSE,1,1,"transportation",NA,"1.usa.gov/1K8p94G","http://t.co/NtHgqrP5in","http://1.usa.gov/1K8p94G","","","","","","","",NA,"","","en","","","","",NA,NA,NA,NA,NA,NA,NA,NA,NA
"x621420518848229376","2015-07-15 20:46:11","x2382685057","RepRobWoodall","No matter the intent, excessive Dodd-Frank regs came with high costs - $24B in fact - for the economy. READ MORE: http://t.co/5QZB7poUTk","Twitter Web Client",NA,"","",FALSE,FALSE,1,1,"",NA,"bit.ly/1f47e1x","http://t.co/5QZB7poUTk","http://bit.ly/1f47e1x","","","","","","","",NA,"","","en","","","","",NA,NA,NA,NA,NA,NA,NA,NA,NA
"x621343960032772096","2015-07-15 15:41:58","x2382685057","RepRobWoodall","Excited to be with you on Instagram as well. Hope to see you there! You can follow here: https://t.co/ANRAJoNLbh","Twitter Web Client",NA,"","",FALSE,FALSE,1,2,"",NA,"instagram.com/reprobwoodall/","https://t.co/ANRAJoNLbh","https://instagram.com/reprobwoodall/","","","","","","","",NA,"","","en","","","","",NA,NA,NA,NA,NA,NA,NA,NA,NA
"x621341574237147136","2015-07-15 15:32:29","x2382685057","RepRobWoodall","Good morning, folks! Excited to be with you. https://t.co/9PNBBBNtnB","Instagram",NA,"","",FALSE,FALSE,1,2,"",NA,"instagram.com/p/5KIN5oOB6G/","https://t.co/9PNBBBNtnB","https://instagram.com/p/5KIN5oOB6G/","","","","","","","",NA,"","","en","","","","",NA,NA,NA,NA,NA,NA,NA,NA,NA
"x617873346567532548","2015-07-06 01:51:00","x2382685057","RepRobWoodall","Congratulations to @ussoccer_wnt for bringing home another #WorldCup title! #USWNT #ProudAmerican","Twitter for iPhone",NA,"","",FALSE,FALSE,2,0,"WorldCup USWNT ProudAmerican",NA,"","","","","","","","","","",NA,"x133448051","ussoccer_wnt","en","","","","",NA,NA,NA,NA,NA,NA,NA,NA,NA
"x617327663032717312","2015-07-04 13:42:38","x2382685057","RepRobWoodall","There is no more American of traits than freedom – and today in particular, we celebrate it. Happy #4thofJuly! http://t.co/vz6ESoUkMo","Twitter for iPhone",NA,"","",FALSE,FALSE,4,3,"4thofJuly",NA,"","","","http://pbs.twimg.com/media/CJEwPDOUwAIXl-h.jpg","http://t.co/vz6ESoUkMo","https://twitter.com/RepRobWoodall/status/617327663032717312/photo/1","photo","http://pbs.twimg.com/media/CJEwPDOUwAIXl-h.jpg","http://t.co/vz6ESoUkMo","https://twitter.com/RepRobWoodall/status/617327663032717312/photo/1",NA,"","","en","","","","",NA,NA,NA,NA,NA,NA,NA,NA,NA
"x616365950422634496","2015-07-01 22:01:08","x2382685057","RepRobWoodall","Happy 3rd Birthday to Gwinnett’s newest city, @PtreeCorners!","Twitter Web Client",NA,"","",FALSE,FALSE,2,2,"",NA,"","","","","","","","","","",NA,"x2382500186","PtreeCorners","en","","","","",NA,NA,NA,NA,NA,NA,NA,NA,NA
"x615973567130411009","2015-06-30 20:01:57","x2382685057","RepRobWoodall","With GA leading the charge, more states join lawsuit against #EPA #WOTUS overreach: http://t.co/Tf5nCtDyAZ","Twitter Web Client",NA,"","",FALSE,FALSE,1,0,"EPA WOTUS",NA,"bit.ly/1NvhevX","http://t.co/Tf5nCtDyAZ","http://bit.ly/1NvhevX","","","","","","","",NA,"","","en","","","","",NA,NA,NA,NA,NA,NA,NA,NA,NA
"x614470957537824769","2015-06-26 16:31:07","x2382685057","RepRobWoodall","In his dissent of the #SCOTUS #ObergefellvHodges decision, Justice Roberts said it well: http://t.co/VKfNBiBthl","Twitter Web Client",NA,"","",FALSE,FALSE,1,1,"SCOTUS ObergefellvHodges",NA,"1.usa.gov/1LAhhZR","http://t.co/VKfNBiBthl","http://1.usa.gov/1LAhhZR","","","","","","","",NA,"","","en","","","","",NA,NA,NA,NA,NA,NA,NA,NA,NA
"x614118598525734913","2015-06-25 17:10:58","x2382685057","RepRobWoodall","Today's #SCOTUS ruling doesn't change the fact that #Obamacare is broken. http://t.co/sbntvn4SoR","Twitter Web Client",NA,"","",FALSE,FALSE,1,1,"SCOTUS Obamacare",NA,"1.usa.gov/1BPbZXA","http://t.co/sbntvn4SoR","http://1.usa.gov/1BPbZXA","","","","","","","",NA,"","","en","","","","",NA,NA,NA,NA,NA,NA,NA,NA,NA
"x613830984992190464","2015-06-24 22:08:05","x2382685057","RepRobWoodall","Today the House acted to protect the American people from higher energy costs &amp; more #EPA overreach.  READ MORE: http://t.co/aPhvyB1l6O","Twitter Web Client",NA,"","",FALSE,FALSE,4,1,"EPA",NA,"1.usa.gov/1HeSXM8","http://t.co/aPhvyB1l6O","http://1.usa.gov/1HeSXM8","","","","","","","",NA,"","","en","","","","",NA,NA,NA,NA,NA,NA,NA,NA,NA
"x613487602583343104","2015-06-23 23:23:37","x2382685057","RepRobWoodall","Proud to support the House-passed #Obamacare #IPAB repeal to protect seniors' access to the Medicare benefits they've earned.","Twitter Web Client",NA,"","",FALSE,FALSE,1,4,"Obamacare IPAB",NA,"","","","","","","","","","",NA,"","","en","","","","",NA,NA,NA,NA,NA,NA,NA,NA,NA
"x612738817968111617","2015-06-21 21:48:12","x2382685057","RepRobWoodall","Happy #FathersDay to the dads out there. Thank you for all you do.","Twitter for iPhone",NA,"","",FALSE,FALSE,2,1,"FathersDay",NA,"","","","","","","","","","",NA,"","","en","","","","",NA,NA,NA,NA,NA,NA,NA,NA,NA
"x611190897707995136","2015-06-17 15:17:20","x2382685057","RepRobWoodall","Thanks to all those who put their names on the ballot, and those who are making their voices heard. READ MORE: http://t.co/lb48GTcFJh","Twitter Web Client",NA,"","",FALSE,FALSE,0,1,"",NA,"bit.ly/1LhKeq8","http://t.co/lb48GTcFJh","http://bit.ly/1LhKeq8","","","","","","","",NA,"","","en","","","","",NA,NA,NA,NA,NA,NA,NA,NA,NA
"x611173549676589056","2015-06-17 14:08:23","x2382685057","RepRobWoodall","Thanks again to all those who participated in last night's telephone town hall. Great conversation, and I look forward to the next!","Twitter Web Client",NA,"","",FALSE,FALSE,0,1,"",NA,"","","","","","","","","","",NA,"","","en","","","","",NA,NA,NA,NA,NA,NA,NA,NA,NA
"x610184161874321408","2015-06-14 20:36:55","x2382685057","RepRobWoodall","On #FlagDay, we celebrate the principles of freedom and opportunity for which America stands, and remember all those who have defended it.","Twitter for iPhone",NA,"","",FALSE,FALSE,1,1,"FlagDay",NA,"","","","","","","","","","",NA,"","","en","","","","",NA,NA,NA,NA,NA,NA,NA,NA,NA
"x609466448495427584","2015-06-12 21:04:59","x2382685057","RepRobWoodall","Responsible &amp; accountable trade opens new markets and grows America's economy. #TPA READ MORE -&gt; http://t.co/MgNJOEyOPL","Twitter Web Client",NA,"","",FALSE,FALSE,0,0,"TPA",NA,"1.usa.gov/1FdCW1s","http://t.co/MgNJOEyOPL","http://1.usa.gov/1FdCW1s","","","","","","","",NA,"","","en","","","","",NA,NA,NA,NA,NA,NA,NA,NA,NA
"x609123106335125504","2015-06-11 22:20:40","x2382685057","RepRobWoodall","Enjoyed visiting with the @GeorgiaStateU delegation today. Thank you for all you do for our community! http://t.co/tGceBAumMW","Twitter Web Client",NA,"","",FALSE,FALSE,2,1,"",NA,"","","","http://pbs.twimg.com/media/CHQKPMUUsAEIAsV.jpg","http://t.co/tGceBAumMW","https://twitter.com/RepRobWoodall/status/609123106335125504/photo/1","photo","http://pbs.twimg.com/media/CHQKPMUUsAEIAsV.jpg","http://t.co/tGceBAumMW","https://twitter.com/RepRobWoodall/status/609123106335125504/photo/1",NA,"x26524127","GeorgiaStateU","en","","","","",NA,NA,NA,NA,NA,NA,NA,NA,NA
"x609105350835482625","2015-06-11 21:10:06","x2382685057","RepRobWoodall","Proud to support #THUD  &amp; #DOD approps bills passed in the House this week. 6 this year. Please join me in urging the Senate to do the same.","Twitter Web Client",NA,"","",FALSE,FALSE,0,0,"THUD DOD",NA,"","","","","","","","","","",NA,"","","en","","","","",NA,NA,NA,NA,NA,NA,NA,NA,NA
"x608316971860553728","2015-06-09 16:57:22","x2382685057","RepRobWoodall","Great discussion this morning w/ @Transport Chairman Shuster. Thx @GeorgiaTech for hosting, and all involved. @RepTomGraves @RepRickAllen","Twitter Web Client",NA,"","",FALSE,FALSE,1,5,"",NA,"","","","","","","","","","",NA,"x35829796 19080617 190328374 2964287128","Transport GeorgiaTech RepTomGraves RepRickAllen","en","","","","",NA,NA,NA,NA,NA,NA,NA,NA,NA
"x607168543247855616","2015-06-06 12:53:56","x2382685057","RepRobWoodall","""The eyes of the world are upon you. The hopes &amp; prayers of liberty-loving people everywhere march with you."" - Dwight D. Eisenhower #DDay71","Twitter for iPhone",NA,"","",FALSE,FALSE,1,0,"DDay71",NA,"","","","","","","","","","",NA,"","","en","","","","",NA,NA,NA,NA,NA,NA,NA,NA,NA
"x606450616915918848","2015-06-04 13:21:09","x2382685057","RepRobWoodall","Responsible approps bills are a part of effective &amp; accountable gov't. Last night the House continued that work. #CJS http://t.co/8KcUBXDQdv","Twitter Web Client",NA,"","",FALSE,FALSE,0,0,"CJS",NA,"","","","http://pbs.twimg.com/media/CGqLn2KWcAALMoc.png","http://t.co/8KcUBXDQdv","https://twitter.com/RepRobWoodall/status/606450616915918848/photo/1","photo","http://pbs.twimg.com/media/CGqLn2KWcAALMoc.png","http://t.co/8KcUBXDQdv","https://twitter.com/RepRobWoodall/status/606450616915918848/photo/1",NA,"","","en","","","","",NA,NA,NA,NA,NA,NA,NA,NA,NA
"x603991921262985216","2015-05-28 18:31:10","x2382685057","RepRobWoodall","Earlier this month I supported HR 1732, which passed the House &amp; would stop @EPA #WOTUS overreach. Please urge your Senators to do the same.","Twitter Web Client",NA,"","",FALSE,FALSE,1,3,"WOTUS",NA,"","","","","","","","","","",NA,"x14615871","EPA","en","","","","",NA,NA,NA,NA,NA,NA,NA,NA,NA
"x603964797596606465","2015-05-28 16:43:23","x2382685057","RepRobWoodall","The @EPA’s decision to broadly expand their own authority is yet another example of overreach in this Administration. #WOTUS","Twitter Web Client",NA,"","",FALSE,FALSE,1,3,"WOTUS",NA,"","","","","","","","","","",NA,"x14615871","EPA","en","","","","",NA,NA,NA,NA,NA,NA,NA,NA,NA
"x603663543431462913","2015-05-27 20:46:18","x2382685057","RepRobWoodall","By those creating them, federal regulations are always presented as needed &amp; positive. Here at home we know better--&gt; http://t.co/PJQ1ZVeYyS","Twitter Web Client",NA,"","",FALSE,FALSE,1,0,"",NA,"bit.ly/1FaDnKq","http://t.co/PJQ1ZVeYyS","http://bit.ly/1FaDnKq","","","","","","","",NA,"","","en","","","","",NA,NA,NA,NA,NA,NA,NA,NA,NA
"x603644262371217408","2015-05-27 19:29:41","x2382685057","RepRobWoodall","The list of reasons for the #FairTax is long, but none more important than giving the taxpayer back their anonymity--&gt;http://t.co/kEpqL1NdaW","Twitter Web Client",NA,"","",FALSE,FALSE,2,6,"FairTax",NA,"slate.me/1HM0mj0","http://t.co/kEpqL1NdaW","http://slate.me/1HM0mj0","","","","","","","",NA,"","","en","","","","",NA,NA,NA,NA,NA,NA,NA,NA,NA
"x602866740180209665","2015-05-25 16:00:06","x2382685057","RepRobWoodall","Our #freedom has come at the highest of costs for so many - and they are not forgotten. #MemorialDay http://t.co/ASBcwMZOTh","Twitter Web Client",NA,"","",FALSE,FALSE,2,0,"freedom MemorialDay",NA,"","","","http://pbs.twimg.com/media/CF3QGwIVEAMhYMu.jpg","http://t.co/ASBcwMZOTh","https://twitter.com/RepRobWoodall/status/602866740180209665/photo/1","photo","http://pbs.twimg.com/media/CF3QGwIVEAMhYMu.jpg","http://t.co/ASBcwMZOTh","https://twitter.com/RepRobWoodall/status/602866740180209665/photo/1",NA,"","","en","","","","",NA,NA,NA,NA,NA,NA,NA,NA,NA
"x601784374519029760","2015-05-22 16:19:10","x2382685057","RepRobWoodall","Congratulations and best of luck to all our 7th District graduates! #grad2015","Twitter Web Client",NA,"","",FALSE,FALSE,0,0,"grad2015",NA,"","","","","","","","","","",NA,"","","en","","","","",NA,NA,NA,NA,NA,NA,NA,NA,NA
"x601521415129563137","2015-05-21 22:54:15","x2382685057","RepRobWoodall","About to get the telephone town hall started. Join me by dialing 877-229-8493, and using the passcode 17849.","Twitter Web Client",NA,"","",FALSE,FALSE,0,1,"",NA,"","","","","","","","","","",NA,"","","en","","","","",NA,NA,NA,NA,NA,NA,NA,NA,NA
"x601427315810312192","2015-05-21 16:40:20","x2382685057","RepRobWoodall","Please join me tonight for a telephone town hall meeting at 7PM. Call in at 877-229-8493 &amp; use the passcode 17849. Looking forward to it.","Twitter Web Client",NA,"","",FALSE,FALSE,1,1,"",NA,"","","","","","","","","","",NA,"","","en","","","","",NA,NA,NA,NA,NA,NA,NA,NA,NA
"x600785700968071169","2015-05-19 22:10:47","x2382685057","RepRobWoodall","The House-passed #HTF extension provides a path to a long-term solution for America's infrastructure needs.","Twitter Web Client",NA,"","",FALSE,FALSE,2,2,"HTF",NA,"","","","","","","","","","",NA,"","","en","","","","",NA,NA,NA,NA,NA,NA,NA,NA,NA
"x599578457673211906","2015-05-16 14:13:38","x2382685057","RepRobWoodall","Thank you to all who serve, and Happy Armed Forces Day! America's military is the finest in the world b/c of you. http://t.co/9eACjJyXcX","Twitter Web Client",NA,"","",FALSE,FALSE,3,2,"",NA,"","","","http://pbs.twimg.com/media/CFIhbgzUEAA8lJh.png","http://t.co/9eACjJyXcX","https://twitter.com/RepRobWoodall/status/599578457673211906/photo/1","photo","http://pbs.twimg.com/media/CFIhbgzUEAA8lJh.png","http://t.co/9eACjJyXcX","https://twitter.com/RepRobWoodall/status/599578457673211906/photo/1",NA,"","","en","","","","",NA,NA,NA,NA,NA,NA,NA,NA,NA
"x599281974893772800","2015-05-15 18:35:31","x2382685057","RepRobWoodall","Congress’ most important responsibility is providing for America’s national defense. Proud to support HR 1735. http://t.co/gDH7epwGZU","Twitter Web Client",NA,"","",FALSE,FALSE,1,2,"",NA,"","","","http://pbs.twimg.com/media/CFETx9DWEAAi3a8.png","http://t.co/gDH7epwGZU","https://twitter.com/RepRobWoodall/status/599281974893772800/photo/1","photo","http://pbs.twimg.com/media/CFETx9DWEAAi3a8.png","http://t.co/gDH7epwGZU","https://twitter.com/RepRobWoodall/status/599281974893772800/photo/1",NA,"","","en","","","","",NA,NA,NA,NA,NA,NA,NA,NA,NA
"x598953080672124928","2015-05-14 20:48:37","x2382685057","RepRobWoodall","Proud to support House-passage of HR1191 ensuring Congressional review &amp; oversight of any #Iran nuclear deal.","Twitter Web Client",NA,"","",FALSE,FALSE,0,0,"Iran",NA,"","","","","","","","","","",NA,"","","en","","","","",NA,NA,NA,NA,NA,NA,NA,NA,NA
"x598588453794754562","2015-05-13 20:39:43","x2382685057","RepRobWoodall","Thank you to all our law enforcement professionals for your service to our community! #PoliceWeek http://t.co/MX63soSMwB","Twitter Web Client",NA,"","",FALSE,FALSE,3,6,"PoliceWeek",NA,"","","","http://pbs.twimg.com/media/CE6dBs2UIAAB4O-.png","http://t.co/MX63soSMwB","https://twitter.com/RepRobWoodall/status/598588453794754562/photo/1","photo","http://pbs.twimg.com/media/CE6dBs2UIAAB4O-.png","http://t.co/MX63soSMwB","https://twitter.com/RepRobWoodall/status/598588453794754562/photo/1",NA,"","","en","","","","",NA,NA,NA,NA,NA,NA,NA,NA,NA
"x598292615528865793","2015-05-13 01:04:09","x2382685057","RepRobWoodall","Proud to support HR1732, the Regulatory Integrity Protection Act, to preserve local decision-making authority -&gt; http://t.co/yKVSFKcxRs","Twitter Web Client",NA,"","",FALSE,FALSE,0,3,"",NA,"1.usa.gov/1AVatgg","http://t.co/yKVSFKcxRs","http://1.usa.gov/1AVatgg","","","","","","","",NA,"","","en","","","","",NA,NA,NA,NA,NA,NA,NA,NA,NA
"x598164639751524352","2015-05-12 16:35:38","x2382685057","RepRobWoodall","Remembering those in #Nepal as a 2nd earthquake has hit the area -&gt; http://t.co/488XeFcMO5","Twitter Web Client",NA,"","",FALSE,FALSE,2,3,"Nepal",NA,"bbc.in/1Iy8NQk","http://t.co/488XeFcMO5","http://bbc.in/1Iy8NQk","","","","","","","",NA,"","","en","","","","",NA,NA,NA,NA,NA,NA,NA,NA,NA
"x598157158203678720","2015-05-12 16:05:54","x2382685057","RepRobWoodall","3 individual 1st place winners, and a 2nd place team win nationally! Congratulations @GeorgiaGwinnett! Read more: http://t.co/SOZ1ADkiqj","Twitter Web Client",NA,"","",FALSE,FALSE,1,3,"",NA,"bit.ly/1JF2g54","http://t.co/SOZ1ADkiqj","http://bit.ly/1JF2g54","","","","","","","",NA,"x36671384","GeorgiaGwinnett","en","","","","",NA,NA,NA,NA,NA,NA,NA,NA,NA
"x596690213071618048","2015-05-08 14:56:47","x2382685057","RepRobWoodall","70 years ago today, Allied Forces declared victory in Europe during WWII. The world is forever grateful. #VEDay70 http://t.co/oduDwCcQnp","Twitter Web Client",NA,"","",FALSE,FALSE,0,3,"VEDay70",NA,"","","","http://pbs.twimg.com/media/CEfelj9WYAAVuz1.jpg","http://t.co/oduDwCcQnp","https://twitter.com/RepRobWoodall/status/596690213071618048/photo/1","photo","http://pbs.twimg.com/media/CEfelj9WYAAVuz1.jpg","http://t.co/oduDwCcQnp","https://twitter.com/RepRobWoodall/status/596690213071618048/photo/1",NA,"","","en","","","","",NA,NA,NA,NA,NA,NA,NA,NA,NA
"x596387520583176192","2015-05-07 18:53:59","x2382685057","RepRobWoodall","As a nation founded on faith and religious freedom, prayer is a cornerstone of who we are. #NationalDayofPrayer","Twitter Web Client",NA,"","",FALSE,FALSE,4,6,"NationalDayofPrayer",NA,"","","","","","","","","","",NA,"","","en","","","","",NA,NA,NA,NA,NA,NA,NA,NA,NA
"x595967549025705984","2015-05-06 15:05:10","x2382685057","RepRobWoodall","Great visits to @collinshill and White Oak Elementary this morning. Thanks to all the fantastic students and staff! #TeacherAppreciationWeek","Twitter Web Client",NA,"","",FALSE,FALSE,0,2,"TeacherAppreciationWeek",NA,"","","","","","","","","","",NA,"x66979661","collinshill","en","","","","",NA,NA,NA,NA,NA,NA,NA,NA,NA
