"status_id","created_at","user_id","screen_name","text","source","reply_to_status_id","reply_to_user_id","reply_to_screen_name","is_quote","is_retweet","favorite_count","retweet_count","hashtags","symbols","urls_url","urls_t.co","urls_expanded_url","media_url","media_t.co","media_expanded_url","media_type","ext_media_url","ext_media_t.co","ext_media_expanded_url","ext_media_type","mentions_user_id","mentions_screen_name","lang","quoted_status_id","quoted_text","retweet_status_id","retweet_text","place_url","place_name","place_full_name","place_type","country","country_code","geo_coords","coords_coords","bbox_coords"
"x967132098774618112","2018-02-23 20:20:35","x2382685057","RepRobWoodall","America's budgeting process is flawed, and hasn't been reformed in more than 4 decades, but we now have the opportunity to build the bipartisan, bicameral consensus to change that. #budget https://t.co/xU3fYSWvUt","Twitter Web Client",NA,"","",FALSE,FALSE,2,3,"budget",NA,"bit.ly/2GHffaZ","https://t.co/xU3fYSWvUt","http://bit.ly/2GHffaZ","","","","","","","",NA,"","","en","","","","",NA,NA,NA,NA,NA,NA,NA,NA,NA
"x964202784944984065","2018-02-15 18:20:32","x2382685057","RepRobWoodall","Headed to the House Floor to share a bit about the ongoing #budgets and #spending discussion happening in Washington and across the country.  I hope you’ll tune in!","Twitter Web Client",NA,"","",FALSE,FALSE,3,4,"budgets spending",NA,"","","","","","","","","","",NA,"","","en","","","","",NA,NA,NA,NA,NA,NA,NA,NA,NA
"x963854887309234176","2018-02-14 19:18:07","x2382685057","RepRobWoodall","About to join @nigutb and @politicsgpb as we talk #instrastructure plans. Tune in if you're able!","Twitter Web Client",NA,"","",FALSE,FALSE,1,2,"instrastructure",NA,"","","","","","","","","","",NA,"x3166672924 2875025835","nigutb politicsgpb","en","","","","",NA,NA,NA,NA,NA,NA,NA,NA,NA
"x963757878413877249","2018-02-14 12:52:38","x2382685057","RepRobWoodall","This morning I’m joining CSPAN’s Pedro Echevarria to talk #budget and #infrastructure plans.  Tune in at 8AM to join us! About to get started! @cspanwj https://t.co/05z4QDd1VG","Twitter Web Client",NA,"","",FALSE,FALSE,1,2,"budget infrastructure",NA,"bit.ly/2sqxrDk","https://t.co/05z4QDd1VG","http://bit.ly/2sqxrDk","","","","","","","",NA,"x15923226","cspanwj","en","","","","",NA,NA,NA,NA,NA,NA,NA,NA,NA
"x963184895446147072","2018-02-12 22:55:48","x2382685057","RepRobWoodall","Congratulations to this year’s #gwinnettcounty Elementary School Counselor of the Year, Sherry Ferguson! We are fortunate to have such dedicated folks in our community, and I’m grateful for all you do! #GA07 https://t.co/p7YlWjb2H4","Twitter Web Client",NA,"","",FALSE,FALSE,5,4,"gwinnettcounty GA07",NA,"bit.ly/2G41pPF","https://t.co/p7YlWjb2H4","http://bit.ly/2G41pPF","","","","","","","",NA,"","","en","","","","",NA,NA,NA,NA,NA,NA,NA,NA,NA
"x958545568141336576","2018-01-31 03:40:47","x2382685057","RepRobWoodall","#StateOfTheUnion #SOTU https://t.co/cPm9tikosN","Twitter Web Client",NA,"","",FALSE,FALSE,3,3,"StateOfTheUnion SOTU",NA,"bit.ly/2FsIWfh","https://t.co/cPm9tikosN","http://bit.ly/2FsIWfh","","","","","","","",NA,"","","und","","","","",NA,NA,NA,NA,NA,NA,NA,NA,NA
"x958473754274824193","2018-01-30 22:55:25","x2382685057","RepRobWoodall","Today, we in the House again passed the DoD Approps Act, which fully funds the department and prioritizes America’s military service members with the largest pay raise in eight years.  I hope you’ll join me in urging the Senate to take up this common sense bill.","Twitter Web Client",NA,"","",FALSE,FALSE,5,4,"",NA,"","","","","","","","","","",NA,"","","en","","","","",NA,NA,NA,NA,NA,NA,NA,NA,NA
"x955579741817507840","2018-01-22 23:15:38","x2382685057","RepRobWoodall","Just voted to end the #SchumerShutdown. I was troubled and perplexed that Senate Dems would shut the govt down by opposing a funding bill that they actually support, all to convince the President to take up an issue he had already committed to taking up. https://t.co/qISC2zpYmy","Twitter Web Client",NA,"","",FALSE,FALSE,24,5,"SchumerShutdown",NA,"bit.ly/2BiXMSV","https://t.co/qISC2zpYmy","http://bit.ly/2BiXMSV","","","","","","","",NA,"","","en","","","","",NA,NA,NA,NA,NA,NA,NA,NA,NA
"x954407313363881984","2018-01-19 17:36:50","x2382685057","RepRobWoodall","Proud to support House passage of #HR4712 today, moving us closer to our ultimate goal in the defense of life. #MarchforLife #MarchForLife2018","Twitter Web Client",NA,"","",FALSE,FALSE,12,5,"HR4712 MarchforLife MarchForLife2018",NA,"","","","","","","","","","",NA,"","","en","","","","",NA,NA,NA,NA,NA,NA,NA,NA,NA
"x953771887967993856","2018-01-17 23:31:52","x2382685057","RepRobWoodall","More good news for American workers and families in response to the #TaxCutsandJobsAct - and we're just getting started. #TaxReform @HouseGOP https://t.co/wkycXdEA20","Twitter Web Client",NA,"","",FALSE,FALSE,15,7,"TaxCutsandJobsAct TaxReform",NA,"cnb.cx/2yBuCl7","https://t.co/wkycXdEA20","http://cnb.cx/2yBuCl7","","","","","","","",NA,"x15207668","HouseGOP","en","","","","",NA,NA,NA,NA,NA,NA,NA,NA,NA
"x952938877613993984","2018-01-15 16:21:47","x2382685057","RepRobWoodall","“A genuine leader is not a searcher for consensus, but a molder of consensus.” – Dr. Martin Luther King, Jr. #MartinLutherKingJr  #MLKDay","Twitter Web Client",NA,"","",FALSE,FALSE,8,4,"MartinLutherKingJr MLKDay",NA,"","","","","","","","","","",NA,"","","en","","","","",NA,NA,NA,NA,NA,NA,NA,NA,NA
"x952301820818444289","2018-01-13 22:10:21","x2382685057","RepRobWoodall","Happy #KoreanAmericanDay to everyone taking part in the celebration! #GA07 is blessed with a vibrant community!","Twitter for iPhone",NA,"","",FALSE,FALSE,5,6,"KoreanAmericanDay GA07",NA,"","","","","","","","","","",NA,"","","en","","","","",NA,NA,NA,NA,NA,NA,NA,NA,NA
"x950857806663573506","2018-01-09 22:32:21","x2382685057","RepRobWoodall","So grateful for our #LawEnforcement officers and all they do for us on a daily basis. Thank you! #LawEnforcementAppreciationDay","Twitter Web Client",NA,"","",FALSE,FALSE,5,4,"LawEnforcement LawEnforcementAppreciationDay",NA,"","","","","","","","","","",NA,"","","en","","","","",NA,NA,NA,NA,NA,NA,NA,NA,NA
"x949018080721670144","2018-01-04 20:41:57","x2382685057","RepRobWoodall","From drastic reductions in excessive federal regulations, to historic #taxreform, a pro-growth agenda helped the economy gain tremendous strength in 2017. Now with the #Dow surpassing 25K for the first time ever, 2018 is off to a great start! #Dow25K https://t.co/QKN8KAj9z8","Twitter Web Client",NA,"","",FALSE,FALSE,8,4,"taxreform Dow Dow25K",NA,"cnb.cx/2lTvyJN","https://t.co/QKN8KAj9z8","http://cnb.cx/2lTvyJN","","","","","","","",NA,"","","en","","","","",NA,NA,NA,NA,NA,NA,NA,NA,NA
"x948220499280134144","2018-01-02 15:52:38","x2382685057","RepRobWoodall","Congratulations to the @universityofga on an impressive #RoseBowl win last night! We're sure proud of you! #GoDawgs @FootballUGA","Twitter Web Client",NA,"","",FALSE,FALSE,12,2,"RoseBowl GoDawgs",NA,"","","","","","","","","","",NA,"x16435792 321586997","universityofga FootballUGA","en","","","","",NA,NA,NA,NA,NA,NA,NA,NA,NA
"x947879473524953088","2018-01-01 17:17:31","x2382685057","RepRobWoodall","Happy New Year to you all! Looking forward to what 2018 holds! #HappyNewYear2018","Twitter for iPhone",NA,"","",FALSE,FALSE,9,2,"HappyNewYear2018",NA,"","","","","","","","","","",NA,"","","en","","","","",NA,NA,NA,NA,NA,NA,NA,NA,NA
"x945335537669431296","2017-12-25 16:48:50","x2382685057","RepRobWoodall","Wishing a very #MerryChristmas to everyone celebrating today! And a special thanks to our service members and first-responders who are away from loved ones. Thank you for all you do! https://t.co/0axqcR1zk9","Twitter for iPhone",NA,"","",FALSE,FALSE,6,4,"MerryChristmas",NA,"","","","http://pbs.twimg.com/media/DR6Bp6bUQAAlTv2.jpg","https://t.co/0axqcR1zk9","https://twitter.com/RepRobWoodall/status/945335537669431296/photo/1","photo","http://pbs.twimg.com/media/DR6Bp6bUQAAlTv2.jpg","https://t.co/0axqcR1zk9","https://twitter.com/RepRobWoodall/status/945335537669431296/photo/1",NA,"","","en","","","","",NA,NA,NA,NA,NA,NA,NA,NA,NA
"x943937625391616002","2017-12-21 20:14:02","x2382685057","RepRobWoodall","Very proud to see an overwhelming vote (418-0) in support of the ""Jobs for Our Heroes Act"" in the House today. Grateful for the opportunity to have led on this issue, and I look forward to it being signed into law soon! #veterans https://t.co/CTtbKZgWHx","Twitter Web Client",NA,"","",FALSE,FALSE,17,13,"veterans",NA,"bit.ly/2p5zLxV","https://t.co/CTtbKZgWHx","http://bit.ly/2p5zLxV","","","","","","","",NA,"","","en","","","","",NA,NA,NA,NA,NA,NA,NA,NA,NA
"x943548512201052160","2017-12-20 18:27:50","x2382685057","RepRobWoodall","Today, #TaxReform heads to the @POTUS' desk, fulfilling a commitment made to the American people! Proud to support it. #HR1 #TaxCutsandJobsAct @HouseGOP @WhiteHouse https://t.co/1JbiVIas8b","Twitter Web Client",NA,"","",FALSE,FALSE,9,3,"TaxReform HR1 TaxCutsandJobsAct",NA,"bit.ly/2BN8t4H","https://t.co/1JbiVIas8b","http://bit.ly/2BN8t4H","","","","","","","",NA,"x822215679726100480 15207668 822215673812119553","POTUS HouseGOP WhiteHouse","en","","","","",NA,NA,NA,NA,NA,NA,NA,NA,NA
"x943205720845058048","2017-12-19 19:45:42","x2382685057","RepRobWoodall","About to speak on the @HouseFloor re: legislation I was proud to author that will help our #veterans return to the civilian workforce as quickly as possible. Grateful for the bipartisan support, and excited to see it be signed into law!","Twitter Web Client",NA,"","",FALSE,FALSE,8,2,"veterans",NA,"","","","","","","","","","",NA,"x7402662","HouseFloor","en","","","","",NA,NA,NA,NA,NA,NA,NA,NA,NA
"x940710427335512064","2017-12-12 22:30:18","x2382685057","RepRobWoodall","As #Hanukkah begins this evening, I’d like to wish all who are celebrating a blessed time with family and friends! May it be a wonderful season marked by joy and peace!  #ChagSameach!","Twitter Web Client",NA,"","",FALSE,FALSE,5,4,"Hanukkah ChagSameach",NA,"","","","","","","","","","",NA,"","","en","","","","",NA,NA,NA,NA,NA,NA,NA,NA,NA
"x938828428375097349","2017-12-07 17:51:54","x2382685057","RepRobWoodall","Great discussion today in our @Transport roundtable on emerging technologies in the trucking industry. Thanks to all for your expertise! #transportation #technology https://t.co/boG6BCp5rr","Twitter for iPhone",NA,"","",FALSE,FALSE,3,5,"transportation technology",NA,"","","","http://pbs.twimg.com/media/DQdjblYVwAAw0N_.jpg","https://t.co/boG6BCp5rr","https://twitter.com/RepRobWoodall/status/938828428375097349/photo/1","photo","http://pbs.twimg.com/media/DQdjblYVwAAw0N_.jpg","https://t.co/boG6BCp5rr","https://twitter.com/RepRobWoodall/status/938828428375097349/photo/1",NA,"x35829796","Transport","en","","","","",NA,NA,NA,NA,NA,NA,NA,NA,NA
"x938788133096820736","2017-12-07 15:11:47","x2382685057","RepRobWoodall","""A date which will live in infamy...” - FDR. It changed the world and prompted the U.S. to enter #WWII. Forever grateful for those who sacrificed so much for freedom here and across the world. #PearlHarborDay #USSArizona https://t.co/p22ievlyjr","Twitter for iPhone",NA,"","",FALSE,FALSE,16,14,"WWII PearlHarborDay USSArizona",NA,"","","","http://pbs.twimg.com/media/DQc-0w0VwAA2LXV.jpg","https://t.co/p22ievlyjr","https://twitter.com/RepRobWoodall/status/938788133096820736/photo/1","photo","http://pbs.twimg.com/media/DQc-0w0VwAA2LXV.jpg","https://t.co/p22ievlyjr","https://twitter.com/RepRobWoodall/status/938788133096820736/photo/1",NA,"","","en","","","","",NA,NA,NA,NA,NA,NA,NA,NA,NA
"x938528340046163968","2017-12-06 21:59:27","x2382685057","RepRobWoodall","Just voted in favor of #HR38 as it passed the House. Our Founders knew the importance of both the 2nd and 10th amendments, and I’m grateful for the partnership that crafted a balanced solution. #2A @Georgia_AG https://t.co/MMJ8qsSMH7","Twitter Web Client",NA,"","",FALSE,FALSE,87,55,"HR38 2A",NA,"bit.ly/2ix8ApP","https://t.co/MMJ8qsSMH7","http://bit.ly/2ix8ApP","","","","","","","",NA,"x234400240","Georgia_AG","en","","","","",NA,NA,NA,NA,NA,NA,NA,NA,NA
"x935636187045335040","2017-11-28 22:27:04","x2382685057","RepRobWoodall","Today's vote in the Senate Budget Committee to advance #taxreform legislation was another crucial step towards a final bill. I'm eager to see a full Senate vote very soon. https://t.co/GCeaEusj6H","Twitter Web Client",NA,"","",FALSE,FALSE,6,5,"taxreform",NA,"bit.ly/2ndrKpU","https://t.co/GCeaEusj6H","http://bit.ly/2ndrKpU","","","","","","","",NA,"","","en","","","","",NA,NA,NA,NA,NA,NA,NA,NA,NA
"x933720023968952322","2017-11-23 15:32:56","x2382685057","RepRobWoodall","Wishing you all a #HappyThanksgivingDay! I’d also like to offer a special message of gratitude to our service members and first-responders who are away from home and their loved ones today. Thank you so much for all you do for us! https://t.co/yEER6SCuL4","Twitter for iPhone",NA,"","",FALSE,FALSE,7,3,"HappyThanksgivingDay",NA,"","","","http://pbs.twimg.com/media/DPU9aL8WsAEhTQM.jpg","https://t.co/yEER6SCuL4","https://twitter.com/RepRobWoodall/status/933720023968952322/photo/1","photo","http://pbs.twimg.com/media/DPU9aL8WsAEhTQM.jpg","https://t.co/yEER6SCuL4","https://twitter.com/RepRobWoodall/status/933720023968952322/photo/1",NA,"","","en","","","","",NA,NA,NA,NA,NA,NA,NA,NA,NA
"x933409794534334464","2017-11-22 19:00:11","x2382685057","RepRobWoodall","I'm very grateful for this amazing team of folks at Norcross Meals on Wheels! Thank you for all you do in our community! #ga07 #thanksgiving https://t.co/O9BDrAQ5CI","Twitter for iPhone",NA,"","",FALSE,FALSE,4,5,"ga07 thanksgiving",NA,"","","","http://pbs.twimg.com/media/DPQjQfMVwAA58G2.jpg","https://t.co/O9BDrAQ5CI","https://twitter.com/RepRobWoodall/status/933409794534334464/photo/1","photo","http://pbs.twimg.com/media/DPQjQfMVwAA58G2.jpg","https://t.co/O9BDrAQ5CI","https://twitter.com/RepRobWoodall/status/933409794534334464/photo/1",NA,"","","en","","","","",NA,NA,NA,NA,NA,NA,NA,NA,NA
"x931262436975529984","2017-11-16 20:47:21","x2382685057","RepRobWoodall","Proud to support #taxreform with many of the principles we #FairTax supporters have worked to advance as #HR1 was approved by the House today. https://t.co/4duEgVqUic","Twitter Web Client",NA,"","",FALSE,FALSE,8,5,"taxreform FairTax HR1",NA,"bit.ly/2myDYsD","https://t.co/4duEgVqUic","http://bit.ly/2myDYsD","","","","","","","",NA,"","","en","","","","",NA,NA,NA,NA,NA,NA,NA,NA,NA
"x930557269238075392","2017-11-14 22:05:16","x2382685057","RepRobWoodall","We're on the verge of delivering once-in-a-generation #TaxReform for the American people. Tune in to @FoxNews tonight with coverage beginning at 6:00 for @SpeakerRyan's televised town hall with @marthamaccallum &amp; @BretBaier! #TaxTownHall  https://t.co/vCk6NVENri","Twitter Web Client",NA,"","",FALSE,FALSE,102,37,"TaxReform TaxTownHall",NA,"bit.ly/2zDoAkk","https://t.co/vCk6NVENri","http://bit.ly/2zDoAkk","","","","","","","",NA,"x1367531 18916432 46681100 18646108","FoxNews SpeakerRyan marthamaccallum BretBaier","en","","","","",NA,NA,NA,NA,NA,NA,NA,NA,NA
"x929424680259391489","2017-11-11 19:04:46","x2382685057","RepRobWoodall","The celebration of our #veterans continues! #HappyVeteransDay! #GA07 https://t.co/kdSAJxIkcC","Twitter for iPhone",NA,"","",FALSE,FALSE,3,2,"veterans HappyVeteransDay GA07",NA,"","","","http://pbs.twimg.com/media/DOX6zcLUEAApHdc.jpg","https://t.co/kdSAJxIkcC","https://twitter.com/RepRobWoodall/status/929424680259391489/photo/1","photo","http://pbs.twimg.com/media/DOX6zcLUEAApHdc.jpg","https://t.co/kdSAJxIkcC","https://twitter.com/RepRobWoodall/status/929424680259391489/photo/1",NA,"","","en","","","","",NA,NA,NA,NA,NA,NA,NA,NA,NA
"x929088707247902720","2017-11-10 20:49:44","x2382685057","RepRobWoodall","Happy 242 birthday to the @USMC!Thank you for all you do for our great country! #MarineCorpsBirthday #Marines","Twitter for iPhone",NA,"","",FALSE,FALSE,6,5,"MarineCorpsBirthday Marines",NA,"","","","","","","","","","",NA,"x10126672","USMC","en","","","","",NA,NA,NA,NA,NA,NA,NA,NA,NA
"x929081268683362305","2017-11-10 20:20:10","x2382685057","RepRobWoodall","Another gorgeous day in #GA07! Grateful to be spending it celebrating our amazing #Veterans. #HappyVeteransDay #VeteransDayWeekend https://t.co/X9AY7zn7kc","Twitter for iPhone",NA,"","",FALSE,FALSE,4,4,"GA07 Veterans HappyVeteransDay VeteransDayWeekend",NA,"","","","http://pbs.twimg.com/media/DOTCfDyVAAA1fPt.jpg","https://t.co/X9AY7zn7kc","https://twitter.com/RepRobWoodall/status/929081268683362305/photo/1","photo","http://pbs.twimg.com/media/DOTCfDyVAAA1fPt.jpg","https://t.co/X9AY7zn7kc","https://twitter.com/RepRobWoodall/status/929081268683362305/photo/1",NA,"","","en","","","","",NA,NA,NA,NA,NA,NA,NA,NA,NA
"x928665313515851776","2017-11-09 16:47:19","x2382685057","RepRobWoodall","Always so thankful for our #veterans, and looking forward to being back home to celebrate them this weekend! #VeteransDay https://t.co/moWAt8vM5r","Twitter Web Client",NA,"","",FALSE,FALSE,1,3,"veterans VeteransDay",NA,"bit.ly/2hWxHT6","https://t.co/moWAt8vM5r","http://bit.ly/2hWxHT6","","","","","","","",NA,"","","en","","","","",NA,NA,NA,NA,NA,NA,NA,NA,NA
"x926873538430107648","2017-11-04 18:07:26","x2382685057","RepRobWoodall","Grateful for our amazing #veterans, and all those who made today's luncheon in their honor possible. Thank you for all you do. #GA07 https://t.co/clMqET2hxn","Twitter for iPhone",NA,"","",FALSE,FALSE,2,3,"veterans GA07",NA,"","","","http://pbs.twimg.com/media/DNzqkLEUEAEaAZc.jpg","https://t.co/clMqET2hxn","https://twitter.com/RepRobWoodall/status/926873538430107648/photo/1","photo","http://pbs.twimg.com/media/DNzqkLEUEAEaAZc.jpg","https://t.co/clMqET2hxn","https://twitter.com/RepRobWoodall/status/926873538430107648/photo/1",NA,"","","en","","","","",NA,NA,NA,NA,NA,NA,NA,NA,NA
"x925374111257432065","2017-10-31 14:49:15","x2382685057","RepRobWoodall","For the 5th straight year, @SiteSelection has named #GA as the #1 state in which to do business! #local #partnership https://t.co/FCmFSUKmQt","Twitter Web Client",NA,"","",FALSE,FALSE,2,3,"GA local partnership",NA,"on-ajc.com/2ihMlDx","https://t.co/FCmFSUKmQt","http://on-ajc.com/2ihMlDx","","","","","","","",NA,"x28629384","SiteSelection","en","","","","",NA,NA,NA,NA,NA,NA,NA,NA,NA
"x925083771711512577","2017-10-30 19:35:33","x2382685057","RepRobWoodall","#TaxReform, #RegulatoryReform, added #NationalSecurity measures…just some of last week’s progress. READ MORE: https://t.co/iQWezzZzMd","Twitter Web Client",NA,"","",FALSE,FALSE,0,2,"TaxReform RegulatoryReform NationalSecurity",NA,"bit.ly/2z3AnaF","https://t.co/iQWezzZzMd","http://bit.ly/2z3AnaF","","","","","","","",NA,"","","en","","","","",NA,NA,NA,NA,NA,NA,NA,NA,NA
"x923654399699968000","2017-10-26 20:55:44","x2382685057","RepRobWoodall","#ICYMI Today was a big day for #TaxReform. MORE:  https://t.co/NjgBrhaHyB","Twitter Web Client",NA,"","",FALSE,FALSE,8,4,"ICYMI TaxReform",NA,"bit.ly/2gMgkHk","https://t.co/NjgBrhaHyB","http://bit.ly/2gMgkHk","","","","","","","",NA,"","","en","","","","",NA,NA,NA,NA,NA,NA,NA,NA,NA
"x923237425140453376","2017-10-25 17:18:49","x2382685057","RepRobWoodall","HAPPENING NOW: On the House floor managing debate for the #Budget that opens the door to #TaxReform leaving no American behind.","Twitter Web Client",NA,"","",FALSE,FALSE,8,1,"Budget TaxReform",NA,"","","","","","","","","","",NA,"","","en","","","","",NA,NA,NA,NA,NA,NA,NA,NA,NA
"x922908556545986561","2017-10-24 19:32:01","x2382685057","RepRobWoodall","As Co-Chair of the Congressional Robotics Caucus, I’m fortunate to work first-hand with some very bright minds! #Robotics #TechTuesday https://t.co/J4skx0eDJ1","Twitter for iPhone",NA,"","",FALSE,FALSE,7,4,"Robotics TechTuesday",NA,"","","","http://pbs.twimg.com/media/DM7UbucVoAACtw_.jpg","https://t.co/J4skx0eDJ1","https://twitter.com/RepRobWoodall/status/922908556545986561/photo/1","photo","http://pbs.twimg.com/media/DM7UbucVoAACtw_.jpg","https://t.co/J4skx0eDJ1","https://twitter.com/RepRobWoodall/status/922908556545986561/photo/1",NA,"","","en","","","","",NA,NA,NA,NA,NA,NA,NA,NA,NA
"x922541902746083334","2017-10-23 19:15:04","x2382685057","RepRobWoodall","We have a tremendous opportunity to deliver on #TaxReform for the American people. READ MORE: https://t.co/GGWC2L82co","Twitter Web Client",NA,"","",FALSE,FALSE,8,4,"TaxReform",NA,"bit.ly/2hZ4fuQ","https://t.co/GGWC2L82co","http://bit.ly/2hZ4fuQ","","","","","","","",NA,"","","en","","","","",NA,NA,NA,NA,NA,NA,NA,NA,NA
"x922510892847239170","2017-10-23 17:11:50","x2382685057","RepRobWoodall","Congrats to Duluth native and former @Braves catcher Brian McCann for reaching 1st #WorldSeries! #Astros #MLB #GA07 https://t.co/qd4VXfGeN0","Twitter Web Client",NA,"","",FALSE,FALSE,2,3,"WorldSeries Astros MLB GA07",NA,"bit.ly/2yKS9Q2","https://t.co/qd4VXfGeN0","http://bit.ly/2yKS9Q2","","","","","","","",NA,"x21436663","Braves","en","","","","",NA,NA,NA,NA,NA,NA,NA,NA,NA
"x920383472874807296","2017-10-17 20:18:14","x2382685057","RepRobWoodall","We have a once-in-a-generation opportunity to deliver #taxreform to the American people, and a unified plan to do it. #TaxReformTuesday https://t.co/msA3bHlsmJ","Twitter Web Client",NA,"","",FALSE,FALSE,10,7,"taxreform TaxReformTuesday",NA,"","","","http://pbs.twimg.com/ext_tw_video_thumb/920380771659108352/pu/img/DT_bOs3ZgD1xfpkI.jpg","https://t.co/msA3bHlsmJ","https://twitter.com/RepRobWoodall/status/920383472874807296/video/1","photo","http://pbs.twimg.com/ext_tw_video_thumb/920380771659108352/pu/img/DT_bOs3ZgD1xfpkI.jpg","https://t.co/msA3bHlsmJ","https://twitter.com/RepRobWoodall/status/920383472874807296/video/1",NA,"","","en","","","","",NA,NA,NA,NA,NA,NA,NA,NA,NA
"x918945806689931264","2017-10-13 21:05:28","x2382685057","RepRobWoodall","Happy 242nd birthday to the @USNavy! Thank you for all you do in service to our great country! #NavyBirthday #Navy","Twitter for iPhone",NA,"","",FALSE,FALSE,2,4,"NavyBirthday Navy",NA,"","","","","","","","","","",NA,"x54885400","USNavy","en","","","","",NA,NA,NA,NA,NA,NA,NA,NA,NA
"x918510027111124992","2017-10-12 16:13:50","x2382685057","RepRobWoodall","The opportunity for #fairandsimple #taxreform is here. Now. And this is the plan.  @HouseGOP @WaysandMeansGOP https://t.co/0pUqO9Kqdg","Twitter Web Client",NA,"","",FALSE,FALSE,3,5,"fairandsimple taxreform",NA,"bit.ly/2xhcPzB","https://t.co/0pUqO9Kqdg","http://bit.ly/2xhcPzB","","","","","","","",NA,"x15207668 12788332","HouseGOP WaysandMeansGOP","en","","","","",NA,NA,NA,NA,NA,NA,NA,NA,NA
"x918093193031421952","2017-10-11 12:37:29","x2382685057","RepRobWoodall","Talking #TaxReform and #budget on @cspanwj this morning. Tune in now!","Twitter for iPhone",NA,"","",FALSE,FALSE,6,7,"TaxReform budget",NA,"","","","","","","","","","",NA,"x15923226","cspanwj","en","","","","",NA,NA,NA,NA,NA,NA,NA,NA,NA
"x916404290805100544","2017-10-06 20:46:23","x2382685057","RepRobWoodall","A great piece from @GeorgiaTrend on #GA07's own @Okabashi for their great work! Happy #manufacturingday! https://t.co/318V7OaYi5","Twitter Web Client",NA,"","",FALSE,FALSE,3,2,"GA07 manufacturingday",NA,"bit.ly/2fQg1af","https://t.co/318V7OaYi5","http://bit.ly/2fQg1af","","","","","","","",NA,"x95259311 18138426","GeorgiaTrend Okabashi","en","","","","",NA,NA,NA,NA,NA,NA,NA,NA,NA
"x916024429548789760","2017-10-05 19:36:57","x2382685057","RepRobWoodall","Today, the House approved a #FY2018 #budget moving us towards fair and simple #TaxReform. https://t.co/CjEifLsbjU","Twitter Web Client",NA,"","",FALSE,FALSE,4,4,"FY2018 budget TaxReform",NA,"bit.ly/2y45suk","https://t.co/CjEifLsbjU","http://bit.ly/2y45suk","","","","","","","",NA,"","","en","","","","",NA,NA,NA,NA,NA,NA,NA,NA,NA
"x915697348562563072","2017-10-04 21:57:15","x2382685057","RepRobWoodall","Why does America need #taxreform built upon #FairTax principles of simplicity &amp; fairness? Glad you asked: https://t.co/0pUqO9Kqdg","Twitter Web Client",NA,"","",FALSE,FALSE,4,3,"taxreform FairTax",NA,"bit.ly/2xhcPzB","https://t.co/0pUqO9Kqdg","http://bit.ly/2xhcPzB","","","","","","","",NA,"","","en","","","","",NA,NA,NA,NA,NA,NA,NA,NA,NA
"x915578009385660421","2017-10-04 14:03:02","x2382685057","RepRobWoodall","Headed to the @HouseFloor to talk #FAA &amp; #aviation reform. Tune in to @cspan to hear how we're moving America forward. #21AirrAct @Transport","Twitter Web Client",NA,"","",FALSE,FALSE,4,5,"FAA aviation 21AirrAct",NA,"","","","","","","","","","",NA,"x7402662 15675138 35829796","HouseFloor cspan Transport","en","","","","",NA,NA,NA,NA,NA,NA,NA,NA,NA
"x913867624290951168","2017-09-29 20:46:35","x2382685057","RepRobWoodall","To everyone celebrating #YomKippur, may it be a meaningful and blessed time! #GmarChatimaTova","Twitter Web Client",NA,"","",FALSE,FALSE,2,2,"YomKippur GmarChatimaTova",NA,"","","","","","","","","","",NA,"","","en","","","","",NA,NA,NA,NA,NA,NA,NA,NA,NA
"x913510068250914817","2017-09-28 21:05:47","x2382685057","RepRobWoodall","Join @GADeptofTrans Commissioner McMurry &amp; me tonight at 7PM for my next tele-town hall to talk #infrastructure -&gt; https://t.co/XkgrU6T586","Twitter Web Client",NA,"","",FALSE,FALSE,1,3,"infrastructure",NA,"bit.ly/2wU671o","https://t.co/XkgrU6T586","http://bit.ly/2wU671o","","","","","","","",NA,"x229155805","GADeptofTrans","en","","","","",NA,NA,NA,NA,NA,NA,NA,NA,NA
"x913161509949394944","2017-09-27 22:00:44","x2382685057","RepRobWoodall","America has a once in a generation opportunity for #taxreform, &amp; this is a huge step: https://t.co/dm8X38ElIE @WhiteHouse @SpeakerRyan","Twitter Web Client",NA,"","",FALSE,FALSE,6,3,"taxreform",NA,"bit.ly/2hy3RqG","https://t.co/dm8X38ElIE","http://bit.ly/2hy3RqG","","","","","","","",NA,"x822215673812119553 18916432","WhiteHouse SpeakerRyan","en","","","","",NA,NA,NA,NA,NA,NA,NA,NA,NA
