"status_id","created_at","user_id","screen_name","text","source","reply_to_status_id","reply_to_user_id","reply_to_screen_name","is_quote","is_retweet","favorite_count","retweet_count","hashtags","symbols","urls_url","urls_t.co","urls_expanded_url","media_url","media_t.co","media_expanded_url","media_type","ext_media_url","ext_media_t.co","ext_media_expanded_url","ext_media_type","mentions_user_id","mentions_screen_name","lang","quoted_status_id","quoted_text","retweet_status_id","retweet_text","place_url","place_name","place_full_name","place_type","country","country_code","geo_coords","coords_coords","bbox_coords"
"x938964602913804288","2017-12-08 02:53:01","x816652616625168388","RepAndyBiggsAZ","This week, my district staff again visited the SE VA clinic for our bi-monthly office hours. They enjoy these chances to interact w/ vets at this location. Thank you, veterans, for your service to this country. We appreciate you &amp; are honored to serve you in any way we can. #AZ05 https://t.co/SCKSM5cKQ5","Twitter for iPhone","","","",FALSE,FALSE,15,6,"AZ05","","","","","http://pbs.twimg.com/media/DQffUykUEAIOicA.jpg","https://t.co/SCKSM5cKQ5","https://twitter.com/RepAndyBiggsAZ/status/938964602913804288/photo/1","photo","http://pbs.twimg.com/media/DQffUykUEAIOicA.jpg","https://t.co/SCKSM5cKQ5","https://twitter.com/RepAndyBiggsAZ/status/938964602913804288/photo/1",NA,"","","en","","","","",NA,NA,NA,NA,NA,NA,NA,NA,NA
"x938911509266292736","2017-12-07 23:22:02","x816652616625168388","RepAndyBiggsAZ","NOW: I'm joining @cvpayne on @FoxBusiness to talk about my continued push to hold DOJ officials - including Robert Mueller - accountable for their biases and conflicts of interest. Hope you'll tune in. #AZ05 https://t.co/97y4Hzi8Gp","Twitter for Android","","","",FALSE,FALSE,34,15,"AZ05","","","","","http://pbs.twimg.com/media/DQevBJaVwAA7NVT.jpg","https://t.co/97y4Hzi8Gp","https://twitter.com/RepAndyBiggsAZ/status/938911509266292736/photo/1","photo","http://pbs.twimg.com/media/DQevBJaVwAA7NVT.jpg","https://t.co/97y4Hzi8Gp","https://twitter.com/RepAndyBiggsAZ/status/938911509266292736/photo/1",NA,"x19400611 56413858","cvpayne FoxBusiness","en","","","","",NA,NA,NA,NA,NA,NA,NA,NA,NA
"x938894677851475970","2017-12-07 22:15:09","x816652616625168388","RepAndyBiggsAZ","I stepped out of @HouseJudiciary today to talk to @HARRISFAULKNER on @FoxNews @OutnumberedOT about our questioning of FBI Director Christopher Wray. Watch HERE: https://t.co/zC70JvkxRY #AZ05","TweetDeck","","","",FALSE,FALSE,59,18,"AZ05","","youtu.be/AuzPwM3urGo","https://t.co/zC70JvkxRY","https://youtu.be/AuzPwM3urGo","","","","","","","",NA,"x1131917492 18313747 1367531 912759481766957057","HouseJudiciary HARRISFAULKNER FoxNews OutnumberedOT","en","","","","",NA,NA,NA,NA,NA,NA,NA,NA,NA
"x938837598742679553","2017-12-07 18:28:20","x816652616625168388","RepAndyBiggsAZ","HAPPENING NOW: I'm questioning @FBI Director Christopher Wray in the @HouseJudiciary Committee. Watch here: https://t.co/5chYIT0JGJ #AZ05 https://t.co/FXRgo6tpvo","Twitter for Android","","","",FALSE,FALSE,35,11,"AZ05","","judiciary.house.gov/hearing/oversi…","https://t.co/5chYIT0JGJ","https://judiciary.house.gov/hearing/oversight-federal-bureau-investigation-2017/","http://pbs.twimg.com/media/DQdrzt6VQAASxZd.jpg","https://t.co/FXRgo6tpvo","https://twitter.com/RepAndyBiggsAZ/status/938837598742679553/photo/1","photo","http://pbs.twimg.com/media/DQdrzt6VQAASxZd.jpg","https://t.co/FXRgo6tpvo","https://twitter.com/RepAndyBiggsAZ/status/938837598742679553/photo/1",NA,"x17629860 1131917492","FBI HouseJudiciary","en","","","","",NA,NA,NA,NA,NA,NA,NA,NA,NA
"x938830824782344192","2017-12-07 18:01:25","x816652616625168388","RepAndyBiggsAZ","HAPPENING NOW: I'm joining @HARRISFAULKNER on @FoxNews @OutnumberedOT to talk about the FBI Director's testimony in @HouseJudiciary. Hope you'll watch. #AZ05 https://t.co/Wxnf9GDyHg","Twitter for iPhone","","","",FALSE,FALSE,55,14,"AZ05","","","","","http://pbs.twimg.com/media/DQdloBOUEAA1tJt.jpg","https://t.co/Wxnf9GDyHg","https://twitter.com/RepAndyBiggsAZ/status/938830824782344192/photo/1","photo","http://pbs.twimg.com/media/DQdloBOUEAA1tJt.jpg","https://t.co/Wxnf9GDyHg","https://twitter.com/RepAndyBiggsAZ/status/938830824782344192/photo/1",NA,"x18313747 1367531 912759481766957057 1131917492","HARRISFAULKNER FoxNews OutnumberedOT HouseJudiciary","en","","","","",NA,NA,NA,NA,NA,NA,NA,NA,NA
"x938824565115015173","2017-12-07 17:36:33","x816652616625168388","RepAndyBiggsAZ","Ahead of tomorrow's crucial deadline to fund the gov, I wrote an op-ed for @thehill w @RepMattGaetz, @RepDaveBrat, @RepRodBlum, @RepTomGarrett, @RepGosar, and @RepTrentFranks to address our urgent need to control our spending &amp; eliminate our national debt: https://t.co/w2GcDBOLXy","TweetDeck","","","",FALSE,FALSE,37,28,"","","bit.ly/2AD3RLh","https://t.co/w2GcDBOLXy","http://bit.ly/2AD3RLh","","","","","","","",NA,"x1917731 818948638890217473 2560169238 2965083477 818460870573441028 240760644","thehill RepMattGaetz RepDaveBrat RepRodBlum RepTomGarrett RepGosar","en","","","","",NA,NA,NA,NA,NA,NA,NA,NA,NA
"x938781234741874688","2017-12-07 14:44:22","x816652616625168388","RepAndyBiggsAZ","Few events have changed the course of history like the attack on Pearl Harbor. Today, we remember this day in our nation's history. We mourn our soldiers lost that day. And we give thanks for the freedoms this country maintains. https://t.co/FYC02NcyLA","TweetDeck","","","",FALSE,FALSE,18,5,"","","","","","http://pbs.twimg.com/media/DQc4Te0VwAATUCy.jpg","https://t.co/FYC02NcyLA","https://twitter.com/RepAndyBiggsAZ/status/938781234741874688/photo/1","photo","http://pbs.twimg.com/media/DQc4Te0VwAATUCy.jpg","https://t.co/FYC02NcyLA","https://twitter.com/RepAndyBiggsAZ/status/938781234741874688/photo/1",NA,"","","en","","","","",NA,NA,NA,NA,NA,NA,NA,NA,NA
"x938609253379706880","2017-12-07 03:20:59","x816652616625168388","RepAndyBiggsAZ","We won a significant 2nd Amendment victory today by passing Concealed Carry Reciprocity. But we complicated our efforts by adding the Fix NICS bill to #HR38. I voted for the bill although I was again disappointed with the process. MORE: https://t.co/uFsDpyYKOH #AZ05","Twitter for iPhone","","","",FALSE,FALSE,34,8,"HR38 AZ05","","facebook.com/RepAndyBiggs/p…","https://t.co/uFsDpyYKOH","https://www.facebook.com/RepAndyBiggs/posts/959489904231481","","","","","","","",NA,"","","en","","","","",NA,NA,NA,NA,NA,NA,NA,NA,NA
"x938551686221783040","2017-12-06 23:32:14","x816652616625168388","RepAndyBiggsAZ","Merry Christmas, #AZ05! The Capitol Christmas tree is lit. https://t.co/OwkswxpFTH","Twitter for Android","","","",FALSE,FALSE,41,8,"AZ05","","","","","http://pbs.twimg.com/media/DQZnxNMV4AAhvqW.jpg","https://t.co/OwkswxpFTH","https://twitter.com/RepAndyBiggsAZ/status/938551686221783040/photo/1","photo","http://pbs.twimg.com/media/DQZnxNMV4AAhvqW.jpg","https://t.co/OwkswxpFTH","https://twitter.com/RepAndyBiggsAZ/status/938551686221783040/photo/1",NA,"","","en","","","","",NA,NA,NA,NA,NA,NA,NA,NA,NA
"x938529227787395072","2017-12-06 22:02:59","x816652616625168388","RepAndyBiggsAZ","Looking forward to joining @seanhannity with @RepMattGaetz &amp; @replouiegohmert in a couple of minutes to talk about our efforts to demand truthful and transparent answers from the FBI. Listen on @KFYI or https://t.co/HV7OKqW6Vj. @AZ05","TweetDeck","","","",FALSE,FALSE,22,8,"","","bit.ly/2ujYPi4","https://t.co/HV7OKqW6Vj","http://bit.ly/2ujYPi4","","","","","","","",NA,"x41634520 818948638890217473 22055226 20211914","seanhannity RepMattGaetz replouiegohmert KFYI","en","","","","",NA,NA,NA,NA,NA,NA,NA,NA,NA
"x938477948272893954","2017-12-06 18:39:13","x816652616625168388","RepAndyBiggsAZ","I applaud @POTUS @realDonaldTrump's action to implement the 1995 decision to recognize Jerusalem as Israel’s capital and to move our embassy to its rightful place in the city. Jerusalem is the historic capital of the Jewish people. I pray for a peaceful transition. https://t.co/gECYTNE1KL","TweetDeck","","","",FALSE,FALSE,73,34,"","","","","","http://pbs.twimg.com/media/DQYkpIkXkAUNaN7.jpg","https://t.co/gECYTNE1KL","https://twitter.com/RepAndyBiggsAZ/status/938477948272893954/photo/1","photo","http://pbs.twimg.com/media/DQYkpIkXkAUNaN7.jpg","https://t.co/gECYTNE1KL","https://twitter.com/RepAndyBiggsAZ/status/938477948272893954/photo/1",NA,"x822215679726100480 25073877","POTUS realDonaldTrump","en","","","","",NA,NA,NA,NA,NA,NA,NA,NA,NA
"x938421918276968448","2017-12-06 14:56:35","x816652616625168388","RepAndyBiggsAZ","I joined several of my House colleagues to highlight the double standard our justice system has employed when investigating Hillary Clinton's alleged crimes. Americans are tired of the special treatment for the Clintons &amp; their friends. We deserve the answers we have requested. https://t.co/DVmTLlh7ML","Twitter for Android","","","",FALSE,FALSE,235,148,"","","","","","http://pbs.twimg.com/ext_tw_video_thumb/938421408249589761/pu/img/UUcFxdd-Z_e9rYHp.jpg","https://t.co/DVmTLlh7ML","https://twitter.com/RepAndyBiggsAZ/status/938421918276968448/video/1","photo","http://pbs.twimg.com/ext_tw_video_thumb/938421408249589761/pu/img/UUcFxdd-Z_e9rYHp.jpg","https://t.co/DVmTLlh7ML","https://twitter.com/RepAndyBiggsAZ/status/938421918276968448/video/1",NA,"","","en","","","","",NA,NA,NA,NA,NA,NA,NA,NA,NA
"x938238193941524480","2017-12-06 02:46:31","x816652616625168388","RepAndyBiggsAZ","Another day with no action from the Senate on our appropriations bills. Our constituents did not send us to DC to shirk our constitutional requirements. Let's pass a real budget. #AZ05 https://t.co/91xtRzuV6k","Twitter for iPhone","","","",FALSE,FALSE,18,7,"AZ05","","","","","http://pbs.twimg.com/media/DQVKqUSXcAUR2BN.jpg","https://t.co/91xtRzuV6k","https://twitter.com/RepAndyBiggsAZ/status/938238193941524480/photo/1","photo","http://pbs.twimg.com/media/DQVKqUSXcAUR2BN.jpg","https://t.co/91xtRzuV6k","https://twitter.com/RepAndyBiggsAZ/status/938238193941524480/photo/1",NA,"","","en","","","","",NA,NA,NA,NA,NA,NA,NA,NA,NA
"x938181610918350848","2017-12-05 23:01:41","x816652616625168388","RepAndyBiggsAZ","Earlier this afternoon, I joined @TeamCavuto on @FoxNews to discuss the mad dash to the end of the year. Lots of ongoing discussions and negotiations about tax reform and government spending. Hope you'll watch our conversation.  https://t.co/fwuU9oKBbt #AZ05","TweetDeck","","","",FALSE,FALSE,13,3,"AZ05","","youtu.be/LQm2TsismsE","https://t.co/fwuU9oKBbt","https://youtu.be/LQm2TsismsE","","","","","","","",NA,"x223970563 1367531","TeamCavuto FoxNews","en","","","","",NA,NA,NA,NA,NA,NA,NA,NA,NA
"x938152307946123264","2017-12-05 21:05:14","x816652616625168388","RepAndyBiggsAZ","Look who joined me in Stat Hall?! @repgosar was making his own appearance at the same time I was on @foxnews. Good to see my Arizona friend and colleague. https://t.co/u7WQd2OYsg","Twitter for Android","","","",FALSE,FALSE,18,2,"","","","","","http://pbs.twimg.com/media/DQT8ineW0AYzxc3.jpg","https://t.co/u7WQd2OYsg","https://twitter.com/RepAndyBiggsAZ/status/938152307946123264/photo/1","photo","http://pbs.twimg.com/media/DQT8ineW0AYzxc3.jpg","https://t.co/u7WQd2OYsg","https://twitter.com/RepAndyBiggsAZ/status/938152307946123264/photo/1",NA,"x240760644 1367531","RepGosar FoxNews","en","","","","",NA,NA,NA,NA,NA,NA,NA,NA,NA
"x938151338382430208","2017-12-05 21:01:23","x816652616625168388","RepAndyBiggsAZ","Getting ready to join @TeamCavuto on @FoxNews to discuss the mad dash to pass tax reform and a government spending bill. Hope you'll watch. #AZ05 https://t.co/cjLzo6ABNN","Twitter for Android","","","",FALSE,FALSE,16,5,"AZ05","","","","","http://pbs.twimg.com/media/DQT7qMtW0AEivBX.jpg","https://t.co/cjLzo6ABNN","https://twitter.com/RepAndyBiggsAZ/status/938151338382430208/photo/1","photo","http://pbs.twimg.com/media/DQT7qMtW0AEivBX.jpg","https://t.co/cjLzo6ABNN","https://twitter.com/RepAndyBiggsAZ/status/938151338382430208/photo/1",NA,"x223970563 1367531","TeamCavuto FoxNews","en","","","","",NA,NA,NA,NA,NA,NA,NA,NA,NA
"x938103072542330880","2017-12-05 17:49:36","x816652616625168388","RepAndyBiggsAZ","Great to see the Sessions from Mesa in DC for a Capitol tour. Thanks for bringing some of the Arizona warmth with you - it's getting cold in the Swamp. #AZ05 https://t.co/PBk2dIKieb","Twitter for iPhone","","","",FALSE,FALSE,15,3,"AZ05","","","","","http://pbs.twimg.com/media/DQTPxHgWsAAymaj.jpg","https://t.co/PBk2dIKieb","https://twitter.com/RepAndyBiggsAZ/status/938103072542330880/photo/1","photo","http://pbs.twimg.com/media/DQTPxHgWsAAymaj.jpg","https://t.co/PBk2dIKieb","https://twitter.com/RepAndyBiggsAZ/status/938103072542330880/photo/1",NA,"","","en","","","","",NA,NA,NA,NA,NA,NA,NA,NA,NA
"x938046249688879105","2017-12-05 14:03:48","x816652616625168388","RepAndyBiggsAZ","#SCOTUS will hear an important case for freedom. I trust that the justices will give #JusticeForJack.

Along with several of my House &amp; Senate colleagues, I was pleased to sign onto a brief amici curiae in support of Jack Phillips. You can read that here: https://t.co/qs3HcZsopf https://t.co/DnZLcGDQW0","TweetDeck","","","",FALSE,FALSE,10,8,"SCOTUS JusticeForJack","","bit.ly/2imu2h9","https://t.co/qs3HcZsopf","http://bit.ly/2imu2h9","http://pbs.twimg.com/media/DQSbvesWAAAb4G5.jpg","https://t.co/DnZLcGDQW0","https://twitter.com/RepAndyBiggsAZ/status/938046249688879105/photo/1","photo","http://pbs.twimg.com/media/DQSbvesWAAAb4G5.jpg","https://t.co/DnZLcGDQW0","https://twitter.com/RepAndyBiggsAZ/status/938046249688879105/photo/1",NA,"","","en","","","","",NA,NA,NA,NA,NA,NA,NA,NA,NA
"x937875679298899970","2017-12-05 02:46:01","x816652616625168388","RepAndyBiggsAZ","Victory at the Supreme Court today. @POTUS @realDonaldTrump's executive order to restrict travel from six countries stands. https://t.co/eR4sgjhAJ8","Twitter for iPhone","","","",FALSE,FALSE,44,17,"","","","","","http://pbs.twimg.com/media/DQQA9AAUEAAhIGe.jpg","https://t.co/eR4sgjhAJ8","https://twitter.com/RepAndyBiggsAZ/status/937875679298899970/photo/1","photo","http://pbs.twimg.com/media/DQQA9AAUEAAhIGe.jpg","https://t.co/eR4sgjhAJ8","https://twitter.com/RepAndyBiggsAZ/status/937875679298899970/photo/1",NA,"x822215679726100480 25073877","POTUS realDonaldTrump","en","","","","",NA,NA,NA,NA,NA,NA,NA,NA,NA
"x937843392771510273","2017-12-05 00:37:43","x816652616625168388","RepAndyBiggsAZ","We are on the verge of historic tax reform for countless Americans, and I hope that our conference committee will strengthen our bill. I applaud my colleagues for their commitment to these transformational policies, and I look forward to seeing the final product. #AZ05 https://t.co/xjPrhbWAQi","Twitter for iPhone","","","",FALSE,FALSE,19,6,"AZ05","","","","","http://pbs.twimg.com/media/DQPjlc8XUAE5fDp.jpg","https://t.co/xjPrhbWAQi","https://twitter.com/RepAndyBiggsAZ/status/937843392771510273/photo/1","photo","http://pbs.twimg.com/media/DQPjlc8XUAE5fDp.jpg","https://t.co/xjPrhbWAQi","https://twitter.com/RepAndyBiggsAZ/status/937843392771510273/photo/1",NA,"","","en","","","","",NA,NA,NA,NA,NA,NA,NA,NA,NA
"x937791397746311171","2017-12-04 21:11:07","x816652616625168388","RepAndyBiggsAZ","What could the United States do with an extra $89 billion?

What could Arizona do with an extra $2.3 billion?

If we didn't have the exorbitant costs of illegal immigration, we could find out the answers to those questions. https://t.co/dOXBs90DPk","TweetDeck","","","",FALSE,FALSE,39,22,"","","","","","http://pbs.twimg.com/media/DQO0QgsWsAANXHh.jpg","https://t.co/dOXBs90DPk","https://twitter.com/RepAndyBiggsAZ/status/937791397746311171/photo/1","photo","http://pbs.twimg.com/media/DQO0QgsWsAANXHh.jpg","https://t.co/dOXBs90DPk","https://twitter.com/RepAndyBiggsAZ/status/937791397746311171/photo/1",NA,"","","en","","","","",NA,NA,NA,NA,NA,NA,NA,NA,NA
"x937710582341529600","2017-12-04 15:49:59","x816652616625168388","RepAndyBiggsAZ","81 days have passed since the House sent appropriations bills to the Senate. It is irresponsible to make the country wait for this important legislation. The Senate must take up these bills immediately. #AZ05 https://t.co/6X0G08NqbB","Twitter for iPhone","","","",FALSE,FALSE,25,10,"AZ05","","","","","http://pbs.twimg.com/media/DQNqzJZUEAEy6pB.jpg","https://t.co/6X0G08NqbB","https://twitter.com/RepAndyBiggsAZ/status/937710582341529600/photo/1","photo","http://pbs.twimg.com/media/DQNqzJZUEAEy6pB.jpg","https://t.co/6X0G08NqbB","https://twitter.com/RepAndyBiggsAZ/status/937710582341529600/photo/1",NA,"","","en","","","","",NA,NA,NA,NA,NA,NA,NA,NA,NA
"x937500141824696320","2017-12-04 01:53:46","x816652616625168388","RepAndyBiggsAZ","I am constantly amazed at Steve Ronnebeck's inner strength as he walks through life after his son's tragic death. Steve could rightfully sit &amp; mourn his son, but instead, he fights for ""Grant's Law"" to help ensure that no other father or mother experiences his grief. #AZ05 https://t.co/gmEpW17rDT","Twitter for iPhone","","","",FALSE,FALSE,22,8,"AZ05","","","","","http://pbs.twimg.com/media/DQKraBbW0AIrzGw.jpg","https://t.co/gmEpW17rDT","https://twitter.com/RepAndyBiggsAZ/status/937500141824696320/photo/1","photo","http://pbs.twimg.com/media/DQKraBbW0AIrzGw.jpg http://pbs.twimg.com/media/DQKraBZXkAA5FBt.jpg http://pbs.twimg.com/media/DQKraBaXcAAdzBS.jpg","https://t.co/gmEpW17rDT https://t.co/gmEpW17rDT https://t.co/gmEpW17rDT","https://twitter.com/RepAndyBiggsAZ/status/937500141824696320/photo/1 https://twitter.com/RepAndyBiggsAZ/status/937500141824696320/photo/1 https://twitter.com/RepAndyBiggsAZ/status/937500141824696320/photo/1",NA,"","","en","","","","",NA,NA,NA,NA,NA,NA,NA,NA,NA
"x937401692496244736","2017-12-03 19:22:34","x816652616625168388","RepAndyBiggsAZ","Another day without any consideration from the Senate on the appropriations bills the House sent to them. How many more days do we have to wait? The Senate must act - immediately. #AZ05 https://t.co/jNng3j6Hmv","Twitter for iPhone","","","",FALSE,FALSE,16,11,"AZ05","","","","","http://pbs.twimg.com/media/DQJR3hrVAAAAAJD.jpg","https://t.co/jNng3j6Hmv","https://twitter.com/RepAndyBiggsAZ/status/937401692496244736/photo/1","photo","http://pbs.twimg.com/media/DQJR3hrVAAAAAJD.jpg","https://t.co/jNng3j6Hmv","https://twitter.com/RepAndyBiggsAZ/status/937401692496244736/photo/1",NA,"","","en","","","","",NA,NA,NA,NA,NA,NA,NA,NA,NA
"x937096584357130240","2017-12-02 23:10:10","x816652616625168388","RepAndyBiggsAZ","My friend Steve Ronnebeck joined @IngrahamAngle on @FoxNews to talk about the crushing toll of illegal immigration on innocent American families. Parents like Steve know the real consequences of our government's dereliction of duty.

https://t.co/03yOCJgIOe","Twitter for iPhone","","","",FALSE,FALSE,12,4,"","","video.foxnews.com/v/566507986600…","https://t.co/03yOCJgIOe","http://video.foxnews.com/v/5665079866001/?playlist_id=5622526903001#sp=show-clips","","","","","","","",NA,"x50769180 1367531","IngrahamAngle FoxNews","en","","","","",NA,NA,NA,NA,NA,NA,NA,NA,NA
"x937030290966564870","2017-12-02 18:46:45","x816652616625168388","RepAndyBiggsAZ","We've waited over eleven weeks for the Senate to even consider our appropriations bills, let alone vote on the legislation. This inaction shouldn't be tolerated. The Senate must act on these bills. #AZ05 https://t.co/X8gpyfy7jK","Twitter for iPhone","","","",FALSE,FALSE,20,8,"AZ05","","","","","http://pbs.twimg.com/media/DQEAFEhWkAItu1O.jpg","https://t.co/X8gpyfy7jK","https://twitter.com/RepAndyBiggsAZ/status/937030290966564870/photo/1","photo","http://pbs.twimg.com/media/DQEAFEhWkAItu1O.jpg","https://t.co/X8gpyfy7jK","https://twitter.com/RepAndyBiggsAZ/status/937030290966564870/photo/1",NA,"","","en","","","","",NA,NA,NA,NA,NA,NA,NA,NA,NA
"x936957916942389251","2017-12-02 13:59:09","x816652616625168388","RepAndyBiggsAZ","Kudos to the Senate for addressing #taxreform &amp; allowing the process to proceed. I remain hopeful that a conference committee will improve the final product. All Americans deserve a tax cut &amp; I will work w my colleagues to ensure that our final bill maximizes economic prosperity. https://t.co/xa1nvRRZNE","TweetDeck","","","",FALSE,FALSE,35,14,"taxreform","","","","","http://pbs.twimg.com/media/DQC-QOyW0AAVgi-.jpg","https://t.co/xa1nvRRZNE","https://twitter.com/RepAndyBiggsAZ/status/936957916942389251/photo/1","photo","http://pbs.twimg.com/media/DQC-QOyW0AAVgi-.jpg","https://t.co/xa1nvRRZNE","https://twitter.com/RepAndyBiggsAZ/status/936957916942389251/photo/1",NA,"","","en","","","","",NA,NA,NA,NA,NA,NA,NA,NA,NA
"x936725599342813184","2017-12-01 22:36:01","x816652616625168388","RepAndyBiggsAZ","What a finish it's going to be to 2017. I'm headed home yet again to Arizona, but I wanted to fill you in on the week that was in D.C. Lots of committee action to report on, including efforts to protect your 2nd Amendment rights. Please watch. https://t.co/uwO5pgsUI7 #AZ05","Twitter for iPhone","","","",FALSE,FALSE,16,7,"AZ05","","facebook.com/RepAndyBiggs/p…","https://t.co/uwO5pgsUI7","https://www.facebook.com/RepAndyBiggs/posts/956737237840081","","","","","","","",NA,"","","en","","","","",NA,NA,NA,NA,NA,NA,NA,NA,NA
"x936677195669495809","2017-12-01 19:23:40","x816652616625168388","RepAndyBiggsAZ","FRIDAYS STAND FOR FREEDOM!

Today, I kick off December - and the Christmas season - by highlighting the first of my four regulations of Christmas. 

Did you know that there's a regulation on Christmas lights?

Read MORE: https://t.co/EttVvZYtzf https://t.co/PJ4KOncecr","Twitter for Android","","","",FALSE,FALSE,4,4,"","","biggs.house.gov/freedom-fridays","https://t.co/EttVvZYtzf","https://biggs.house.gov/freedom-fridays","http://pbs.twimg.com/ext_tw_video_thumb/936676827350921218/pu/img/2i1lTJfhNoXtFlLj.jpg","https://t.co/PJ4KOncecr","https://twitter.com/RepAndyBiggsAZ/status/936677195669495809/video/1","photo","http://pbs.twimg.com/ext_tw_video_thumb/936676827350921218/pu/img/2i1lTJfhNoXtFlLj.jpg","https://t.co/PJ4KOncecr","https://twitter.com/RepAndyBiggsAZ/status/936677195669495809/video/1",NA,"","","en","","","","",NA,NA,NA,NA,NA,NA,NA,NA,NA
"x936618920429129728","2017-12-01 15:32:06","x816652616625168388","RepAndyBiggsAZ","Why has the Senate waited 78 days to act on on the appropriations bills the House has sent them? The American people deserve responsible governance and action on this legislation. Senate - do your job. #AZ05 https://t.co/ueSaV7yBSV","TweetDeck","","","",FALSE,FALSE,31,13,"AZ05","","","","","http://pbs.twimg.com/media/DP-J6LGXkAEyOrB.jpg","https://t.co/ueSaV7yBSV","https://twitter.com/RepAndyBiggsAZ/status/936618920429129728/photo/1","photo","http://pbs.twimg.com/media/DP-J6LGXkAEyOrB.jpg","https://t.co/ueSaV7yBSV","https://twitter.com/RepAndyBiggsAZ/status/936618920429129728/photo/1",NA,"","","en","","","","",NA,NA,NA,NA,NA,NA,NA,NA,NA
"x936445455063449600","2017-12-01 04:02:49","x816652616625168388","RepAndyBiggsAZ","I can't even begin to imagine the heartbreak the Steinle family must feel tonight. This verdict was an tragedy.

Kate's death was truly preventable &amp; due, in part, to the lax policies of the Obama admin &amp; San Francisco's sanctuary city status. 
MORE: https://t.co/rX4HOxYPgr #AZ05 https://t.co/HC9K1ghvWy","TweetDeck","","","",FALSE,FALSE,36,15,"AZ05","","bit.ly/2ixmCey","https://t.co/rX4HOxYPgr","http://bit.ly/2ixmCey","http://pbs.twimg.com/media/DP7sGk4W4AEIxid.jpg","https://t.co/HC9K1ghvWy","https://twitter.com/RepAndyBiggsAZ/status/936445455063449600/photo/1","photo","http://pbs.twimg.com/media/DP7sGk4W4AEIxid.jpg","https://t.co/HC9K1ghvWy","https://twitter.com/RepAndyBiggsAZ/status/936445455063449600/photo/1",NA,"","","en","","","","",NA,NA,NA,NA,NA,NA,NA,NA,NA
"x936367871994875904","2017-11-30 22:54:32","x816652616625168388","RepAndyBiggsAZ","As November draws to a close, we recognize all of the hard-working entrepreneurs in #AZ05. Thank you for all of your endeavors and sacrifices. We appreciate your vital contributions to our economy and communities. https://t.co/iyUpVcxyud","TweetDeck","","","",FALSE,FALSE,9,2,"AZ05","","","","","http://pbs.twimg.com/media/DP6lgzpX4AAT7dR.jpg","https://t.co/iyUpVcxyud","https://twitter.com/RepAndyBiggsAZ/status/936367871994875904/photo/1","photo","http://pbs.twimg.com/media/DP6lgzpX4AAT7dR.jpg","https://t.co/iyUpVcxyud","https://twitter.com/RepAndyBiggsAZ/status/936367871994875904/photo/1",NA,"","","en","","","","",NA,NA,NA,NA,NA,NA,NA,NA,NA
"x936301146309824513","2017-11-30 18:29:23","x816652616625168388","RepAndyBiggsAZ","It's been 77 days since the House sent our 12 appropriations bills to the Senate. The House has done its hard work; now the Senate must act. No more delays. #AZ05 https://t.co/NS7sIkGQGi","TweetDeck","","","",FALSE,FALSE,46,36,"AZ05","","","","","http://pbs.twimg.com/media/DP5o1o-WkAAFP0e.jpg","https://t.co/NS7sIkGQGi","https://twitter.com/RepAndyBiggsAZ/status/936301146309824513/photo/1","photo","http://pbs.twimg.com/media/DP5o1o-WkAAFP0e.jpg","https://t.co/NS7sIkGQGi","https://twitter.com/RepAndyBiggsAZ/status/936301146309824513/photo/1",NA,"","","en","","","","",NA,NA,NA,NA,NA,NA,NA,NA,NA
