"status_id","created_at","user_id","screen_name","text","source","reply_to_status_id","reply_to_user_id","reply_to_screen_name","is_quote","is_retweet","favorite_count","retweet_count","hashtags","symbols","urls_url","urls_t.co","urls_expanded_url","media_url","media_t.co","media_expanded_url","media_type","ext_media_url","ext_media_t.co","ext_media_expanded_url","ext_media_type","mentions_user_id","mentions_screen_name","lang","quoted_status_id","quoted_text","retweet_status_id","retweet_text","place_url","place_name","place_full_name","place_type","country","country_code","geo_coords","coords_coords","bbox_coords"
"x970331069504540675","2018-03-04 16:12:09","x941080085121175552","SenDougJones","Take the message of this pilgrimage with you, otherwise it's a wasted trip. We all stand on the shoulders of Dr. King. #MLKPilgrimage https://t.co/uMu088xZQa","Twitter for iPhone","","","",FALSE,FALSE,275,88,"MLKPilgrimage",NA,"","","","http://pbs.twimg.com/media/DXdO9ZSVAAAlf-U.jpg","https://t.co/uMu088xZQa","https://twitter.com/SenDougJones/status/970331069504540675/photo/1","photo","http://pbs.twimg.com/media/DXdO9ZSVAAAlf-U.jpg http://pbs.twimg.com/media/DXdO9ZQU8AAvdZq.jpg http://pbs.twimg.com/media/DXdO9ZTU0AAETzL.jpg","https://t.co/uMu088xZQa https://t.co/uMu088xZQa https://t.co/uMu088xZQa","https://twitter.com/SenDougJones/status/970331069504540675/photo/1 https://twitter.com/SenDougJones/status/970331069504540675/photo/1 https://twitter.com/SenDougJones/status/970331069504540675/photo/1",NA,"","","en","","","","","","","","","","",NA,NA,""
"x970322868000186368","2018-03-04 15:39:34","x941080085121175552","SenDougJones","Honored to join civil rights hero Dr. Bernard Lafayette at the Coffee Shoppe on our way to the Edmund Pettus Bridge. https://t.co/xY4N6MHkQe","Twitter for iPhone","","","",FALSE,FALSE,60,20,"",NA,"","","","http://pbs.twimg.com/media/DXdHfwAW0AEUucX.jpg","https://t.co/xY4N6MHkQe","https://twitter.com/SenDougJones/status/970322868000186368/photo/1","photo","http://pbs.twimg.com/media/DXdHfwAW0AEUucX.jpg http://pbs.twimg.com/media/DXdHfwTW0AULuQI.jpg","https://t.co/xY4N6MHkQe https://t.co/xY4N6MHkQe","https://twitter.com/SenDougJones/status/970322868000186368/photo/1 https://twitter.com/SenDougJones/status/970322868000186368/photo/1",NA,"","","en","","","","","","","","","","",NA,NA,""
"x970304727094358016","2018-03-04 14:27:28","x941080085121175552","SenDougJones","Excited to start today’s Bridge Crossing Jubilee by speaking at the Martin and Coretta King Beloved Unity Breakfast https://t.co/JJwmzwieWy","Twitter for iPhone","","","",FALSE,FALSE,91,26,"",NA,"","","","http://pbs.twimg.com/media/DXc2_1qWsAAb9W2.jpg","https://t.co/JJwmzwieWy","https://twitter.com/SenDougJones/status/970304727094358016/photo/1","photo","http://pbs.twimg.com/media/DXc2_1qWsAAb9W2.jpg","https://t.co/JJwmzwieWy","https://twitter.com/SenDougJones/status/970304727094358016/photo/1",NA,"","","en","","","","","","","","","","",NA,NA,""
"x969706311691751425","2018-03-02 22:49:35","x941080085121175552","SenDougJones","Proud to participate in this year’s @FaithNPolitics Congressional Civil Rights Pilgrimage. Starting today with the wreath-laying at 16th St. Baptist Church to honor the four little girls killed in the bombing. https://t.co/eMrGhiLZa3","Twitter for iPhone","","","",FALSE,FALSE,185,66,"",NA,"","","","http://pbs.twimg.com/media/DXUWvhPWsAAHzU2.jpg","https://t.co/eMrGhiLZa3","https://twitter.com/SenDougJones/status/969706311691751425/photo/1","photo","http://pbs.twimg.com/media/DXUWvhPWsAAHzU2.jpg http://pbs.twimg.com/media/DXUWvhMWAAAZ9sp.jpg","https://t.co/eMrGhiLZa3 https://t.co/eMrGhiLZa3","https://twitter.com/SenDougJones/status/969706311691751425/photo/1 https://twitter.com/SenDougJones/status/969706311691751425/photo/1",NA,"x107514329","FaithNPolitics","en","","","","","","","","","","",NA,NA,""
"x969692102513823746","2018-03-02 21:53:07","x941080085121175552","SenDougJones","Just finished spending time with students @stairbirmingham! After seeing the incredible work they are doing firsthand, I encourage folks Birmingham to volunteer with this outstanding program: https://t.co/18b2VFVJ09 https://t.co/M1PjM6kLBh","Twitter for iPhone","","","",FALSE,FALSE,103,30,"",NA,"stairbirmingham.org/how-to-help/vo…","https://t.co/18b2VFVJ09","https://stairbirmingham.org/how-to-help/volunteer.html","http://pbs.twimg.com/media/DXUJ0j0W0AItnb5.jpg","https://t.co/M1PjM6kLBh","https://twitter.com/SenDougJones/status/969692102513823746/photo/1","photo","http://pbs.twimg.com/media/DXUJ0j0W0AItnb5.jpg http://pbs.twimg.com/media/DXUJ0jxXUAAMK3u.jpg","https://t.co/M1PjM6kLBh https://t.co/M1PjM6kLBh","https://twitter.com/SenDougJones/status/969692102513823746/photo/1 https://twitter.com/SenDougJones/status/969692102513823746/photo/1",NA,"x714485665107304448","stairbirmingham","en","","","","","","","","","","",NA,NA,""
"x969232279116697600","2018-03-01 15:25:57","x941080085121175552","SenDougJones","This weekend, I'll serve as co-host for the @FaithNPolitics Pilgrimage, which has become such an important part of the celebration of the Selma to Montgomery march. To see a number of congressional leaders coming from both parties is very, very symbolic. https://t.co/5iMNP2OP72","Twitter Web Client","","","",FALSE,FALSE,63,22,"",NA,"usatoday.com/story/news/pol…","https://t.co/5iMNP2OP72","https://www.usatoday.com/story/news/politics/2018/02/28/50-years-after-kings-assassination-congressional-civil-rights-pilgrimage-honors-him/375154002/","","","","","","","",NA,"x107514329","FaithNPolitics","en","","","","","","","","","","",NA,NA,""
"x967584614763069440","2018-02-25 02:18:43","x941080085121175552","SenDougJones","Alabama's HBCUs including five UNCF member institutions are a core foundation of our world-class university system. #uncfbham","Twitter for Android","","","",FALSE,FALSE,102,23,"uncfbham",NA,"","","","","","","","","","",NA,"","","en","","","","","","","","","","",NA,NA,""
"x967581327137673218","2018-02-25 02:05:39","x941080085121175552","SenDougJones","I want you to know that @UNCF and all of Alabama's Historically Black Colleges have an ally in the Senate.  #uncfbham https://t.co/1yWy0vapbq","Twitter for Android","","","",FALSE,FALSE,167,41,"uncfbham",NA,"","","","http://pbs.twimg.com/media/DW2KExRU8AAZKRx.jpg","https://t.co/1yWy0vapbq","https://twitter.com/SenDougJones/status/967581327137673218/photo/1","photo","http://pbs.twimg.com/media/DW2KExRU8AAZKRx.jpg","https://t.co/1yWy0vapbq","https://twitter.com/SenDougJones/status/967581327137673218/photo/1",NA,"x989397451","UNCF","en","","","","","","","","","","",NA,NA,""
"x967103743983538177","2018-02-23 18:27:55","x941080085121175552","SenDougJones","I have always worked to have dialogues, not monologues. My advice to you, is to do the same. You can't find common ground and you can't find solutions, if you're unwillingly to engage with folks who might not agree with you.","Twitter for Android","","","",FALSE,FALSE,246,54,"",NA,"","","","","","","","","","",NA,"","","en","","","","","","","","","","",NA,NA,""
"x967102116148994048","2018-02-23 18:21:27","x941080085121175552","SenDougJones","It's so exciting to see the engagement happening across Alabama &amp; our country. We need your perspective &amp; your enthusiasm. - AL YMCA Youth Legislature. https://t.co/yl77zQb0dE","Twitter for Android","","","",FALSE,FALSE,66,12,"",NA,"","","","http://pbs.twimg.com/media/DWvWPC7VAAAF01G.jpg","https://t.co/yl77zQb0dE","https://twitter.com/SenDougJones/status/967102116148994048/photo/1","photo","http://pbs.twimg.com/media/DWvWPC7VAAAF01G.jpg","https://t.co/yl77zQb0dE","https://twitter.com/SenDougJones/status/967102116148994048/photo/1",NA,"","","en","","","","","","","","","","",NA,NA,""
"x967099655220793344","2018-02-23 18:11:40","x941080085121175552","SenDougJones","Nothing better than spending an afternoon meeting with a whole room full of Alabama's future leaders at the YMCA Youth Legislature. https://t.co/a3MRG3iYfz","Twitter for Android","","","",FALSE,FALSE,85,21,"",NA,"","","","http://pbs.twimg.com/media/DWvT6p8VoAEUMv_.jpg","https://t.co/a3MRG3iYfz","https://twitter.com/SenDougJones/status/967099655220793344/photo/1","photo","http://pbs.twimg.com/media/DWvT6p8VoAEUMv_.jpg http://pbs.twimg.com/media/DWvT7y_UMAAhSE9.jpg http://pbs.twimg.com/media/DWvT9BYVAAADd6G.jpg http://pbs.twimg.com/media/DWvT-zUVwAAfI8U.jpg","https://t.co/a3MRG3iYfz https://t.co/a3MRG3iYfz https://t.co/a3MRG3iYfz https://t.co/a3MRG3iYfz","https://twitter.com/SenDougJones/status/967099655220793344/photo/1 https://twitter.com/SenDougJones/status/967099655220793344/photo/1 https://twitter.com/SenDougJones/status/967099655220793344/photo/1 https://twitter.com/SenDougJones/status/967099655220793344/photo/1",NA,"","","en","","","","","","","","","","",NA,NA,""
"x966817349297991681","2018-02-22 23:29:53","x941080085121175552","SenDougJones","Redstone Arsenal in Huntsville is home to thousands of men and women working in national defense, federal law enforcement and, yes, even space exploration. It was fascinating to tour the base today and get a firsthand look at the innovative work they’re doing to keep us safe. https://t.co/YCuzWFkjaL","Twitter for iPhone","","","",FALSE,FALSE,78,13,"",NA,"","","","http://pbs.twimg.com/media/DWrTPngUQAAZXLz.jpg","https://t.co/YCuzWFkjaL","https://twitter.com/SenDougJones/status/966817349297991681/photo/1","photo","http://pbs.twimg.com/media/DWrTPngUQAAZXLz.jpg http://pbs.twimg.com/media/DWrTPnnVMAYwlU2.jpg","https://t.co/YCuzWFkjaL https://t.co/YCuzWFkjaL","https://twitter.com/SenDougJones/status/966817349297991681/photo/1 https://twitter.com/SenDougJones/status/966817349297991681/photo/1",NA,"","","en","","","","","https://api.twitter.com/1.1/geo/id/7b236efa78378490.json","Redstone Arsenal","Redstone Arsenal, AL","city","United States","US",NA,NA,"-86.671758 -86.6273414 -86.6273414 -86.671758 34.6555752 34.6555752 34.70936 34.70936"
"x966701351815274496","2018-02-22 15:48:57","x941080085121175552","SenDougJones","You have to meet with your constituents where they are — and sometimes that means you just need to take a knee. These kids are participating in a federally funded childcare program at @NWSCC that supports their parents as they’re working to earn a degree. https://t.co/TwXboxhFgp","Twitter for iPhone","","","",FALSE,FALSE,277,69,"",NA,"","","","http://pbs.twimg.com/media/DWppv_dU0AAr_XF.jpg","https://t.co/TwXboxhFgp","https://twitter.com/SenDougJones/status/966701351815274496/photo/1","photo","http://pbs.twimg.com/media/DWppv_dU0AAr_XF.jpg","https://t.co/TwXboxhFgp","https://twitter.com/SenDougJones/status/966701351815274496/photo/1",NA,"x227008128","NWSCC","en","","","","","https://api.twitter.com/1.1/geo/id/74d460734c3eca69.json","Muscle Shoals","Muscle Shoals, AL","city","United States","US",NA,NA,"-87.6806388 -87.6173621 -87.6173621 -87.6806388 34.7052524 34.7052524 34.762527 34.762527"
"x966377685734830081","2018-02-21 18:22:49","x941080085121175552","SenDougJones","Started my day in Birmingham with the Alabama Air Guard’s 117th Air Refueling Wing. These Airmen are working hard every day to keep our country safe. https://t.co/fq9dUwaK5g","Twitter for iPhone","","","",FALSE,FALSE,126,18,"",NA,"","","","http://pbs.twimg.com/media/DWlDYRmUQAAcJq6.jpg","https://t.co/fq9dUwaK5g","https://twitter.com/SenDougJones/status/966377685734830081/photo/1","photo","http://pbs.twimg.com/media/DWlDYRmUQAAcJq6.jpg","https://t.co/fq9dUwaK5g","https://twitter.com/SenDougJones/status/966377685734830081/photo/1",NA,"","","en","","","","","","","","","","",NA,NA,""
"x966041931326337024","2018-02-20 20:08:39","x941080085121175552","SenDougJones","When you go to Selma, make sure you get an expert like Mayor @DarrioM to show you around. Walking through town, you feel its history — and it reminds me of the work left to be done to make sure every American is treated equally and with dignity. https://t.co/kWiD6Ujw0F","Twitter for iPhone","","","",FALSE,FALSE,265,67,"",NA,"","","","http://pbs.twimg.com/media/DWgRb24VAAA-BgL.jpg","https://t.co/kWiD6Ujw0F","https://twitter.com/SenDougJones/status/966041931326337024/photo/1","photo","http://pbs.twimg.com/media/DWgRb24VAAA-BgL.jpg","https://t.co/kWiD6Ujw0F","https://twitter.com/SenDougJones/status/966041931326337024/photo/1",NA,"x100390830","DarrioM","en","","","","","https://api.twitter.com/1.1/geo/id/ba2e7f7eb278521d.json","Selma","Selma, AL","city","United States","US",NA,NA,"-87.095997 -86.978868 -86.978868 -87.095997 32.372411 32.372411 32.4571783 32.4571783"
"x965950088341327872","2018-02-20 14:03:42","x941080085121175552","SenDougJones","Thanks @BishopState for welcoming me yesterday. I was so impressed by your computer app coding program, your talented students, and all the great plans you have for the future. It was great to hear how I can best support BSCC and all of our HBCUs. https://t.co/Aq1DidFAsS","Twitter for iPhone","","","",FALSE,FALSE,64,17,"",NA,"","","","http://pbs.twimg.com/media/DWe-drHUQAEZQi9.jpg","https://t.co/Aq1DidFAsS","https://twitter.com/SenDougJones/status/965950088341327872/photo/1","photo","http://pbs.twimg.com/media/DWe-drHUQAEZQi9.jpg http://pbs.twimg.com/media/DWe-drIUQAAEcoq.jpg http://pbs.twimg.com/media/DWe-drOUMAAtMZr.jpg http://pbs.twimg.com/media/DWe-drJVMAEAIvC.jpg","https://t.co/Aq1DidFAsS https://t.co/Aq1DidFAsS https://t.co/Aq1DidFAsS https://t.co/Aq1DidFAsS","https://twitter.com/SenDougJones/status/965950088341327872/photo/1 https://twitter.com/SenDougJones/status/965950088341327872/photo/1 https://twitter.com/SenDougJones/status/965950088341327872/photo/1 https://twitter.com/SenDougJones/status/965950088341327872/photo/1",NA,"x128605497","BishopState","en","","","","","https://api.twitter.com/1.1/geo/id/ba2e7f7eb278521d.json","Selma","Selma, AL","city","United States","US",NA,NA,"-87.095997 -86.978868 -86.978868 -87.095997 32.372411 32.372411 32.4571783 32.4571783"
"x965737586479247361","2018-02-19 23:59:17","x941080085121175552","SenDougJones","Where economic development meets national security — it was great to get an up-close look at Austal’s ship production facility in Mobile this afternoon. https://t.co/4yGHGNXJrC","Twitter for iPhone","","","",FALSE,FALSE,77,16,"",NA,"","","","http://pbs.twimg.com/media/DWb9NzhWsAA_H3z.jpg","https://t.co/4yGHGNXJrC","https://twitter.com/SenDougJones/status/965737586479247361/photo/1","photo","http://pbs.twimg.com/media/DWb9NzhWsAA_H3z.jpg","https://t.co/4yGHGNXJrC","https://twitter.com/SenDougJones/status/965737586479247361/photo/1",NA,"","","en","","","","","https://api.twitter.com/1.1/geo/id/d049033410e9e81b.json","Mobile","Mobile, AL","city","United States","US",NA,NA,"-88.301598 -88.021513 -88.021513 -88.301598 30.523874 30.523874 30.843424 30.843424"
"x965672734318649344","2018-02-19 19:41:35","x941080085121175552","SenDougJones","Getting briefed at @Austal_USA in Mobile before we head out to tour the shipyard. https://t.co/yEFBxF7j9e","Twitter for iPhone","","","",FALSE,FALSE,55,20,"",NA,"","","","http://pbs.twimg.com/media/DWbCN-oVQAAKwgu.jpg","https://t.co/yEFBxF7j9e","https://twitter.com/SenDougJones/status/965672734318649344/photo/1","photo","http://pbs.twimg.com/media/DWbCN-oVQAAKwgu.jpg","https://t.co/yEFBxF7j9e","https://twitter.com/SenDougJones/status/965672734318649344/photo/1",NA,"x135632526","Austal_USA","en","","","","","","","","","","",NA,NA,""
"x965645353180680198","2018-02-19 17:52:47","x941080085121175552","SenDougJones","This morning, I hit the road for a week-long tour across Alabama. Talked to a few of our great morning radio hosts on the way to Mobile! https://t.co/XS2tLvSo1p","Twitter for iPhone","","","",FALSE,FALSE,238,40,"",NA,"","","","http://pbs.twimg.com/media/DWapVDqX0AI0acP.jpg","https://t.co/XS2tLvSo1p","https://twitter.com/SenDougJones/status/965645353180680198/photo/1","photo","http://pbs.twimg.com/media/DWapVDqX0AI0acP.jpg","https://t.co/XS2tLvSo1p","https://twitter.com/SenDougJones/status/965645353180680198/photo/1",NA,"","","en","","","","","","","","","","",NA,NA,""
"x964661715987202049","2018-02-17 00:44:10","x941080085121175552","SenDougJones","If you care about election integrity, this should absolutely get your attention. https://t.co/VFu7gxRChR","Twitter for iPhone","","","",FALSE,FALSE,182,68,"",NA,"washingtonpost.com/world/national…","https://t.co/VFu7gxRChR","https://www.washingtonpost.com/world/national-security/russian-troll-farm-13-suspects-indicted-for-interference-in-us-election/2018/02/16/2504de5e-1342-11e8-9570-29c9830535e5_story.html?hpid=hp_rhp-top-table-high_russiaindict-119pm%3Ahomepage%2Fstory&utm_term=.788f3ed29f3a","","","","","","","",NA,"","","en","","","","","https://api.twitter.com/1.1/geo/id/01fbe706f872cb32.json","Washington","Washington, DC","city","United States","US",NA,NA,"-77.119401 -76.909396 -76.909396 -77.119401 38.801826 38.801826 38.9953797 38.9953797"
"x964627471529402368","2018-02-16 22:28:05","x941080085121175552","SenDougJones","Just announced my first official week-long state tour in Alabama. I'm looking forward to getting out to Mobile, Selma, Centreville, Birmingham, Muscle Shoals, Huntsville, and Montgomery next week. Follow along on Twitter!","Twitter Web Client","","","",FALSE,FALSE,333,66,"",NA,"","","","","","","","","","",NA,"","","en","","","","","","","","","","",NA,NA,""
"x964562228891541506","2018-02-16 18:08:50","x941080085121175552","SenDougJones","Thanks to Alabamian @RyanKinder for stopping by this week to talk about the importance of a bipartisan bill I’ve co-sponsored to protect songwriters and ensure we get more great music like this for years to come. #StandWithSongwriters https://t.co/hrADGcxcNR","Twitter for iPhone","","","",FALSE,FALSE,78,15,"StandWithSongwriters",NA,"","","","http://pbs.twimg.com/ext_tw_video_thumb/964562051862597632/pu/img/idN317mN2LPjHtFB.jpg","https://t.co/hrADGcxcNR","https://twitter.com/SenDougJones/status/964562228891541506/video/1","photo","http://pbs.twimg.com/ext_tw_video_thumb/964562051862597632/pu/img/idN317mN2LPjHtFB.jpg","https://t.co/hrADGcxcNR","https://twitter.com/SenDougJones/status/964562228891541506/video/1",NA,"x31639103","RyanKinder","en","","","","","","","","","","",NA,NA,""
"x964283202499153921","2018-02-15 23:40:05","x941080085121175552","SenDougJones","Bipartisanship is a word that folks like to say, but it’s tough work. We're committed to making positive change &amp; bringing more of our colleagues to the table for the tough conversations ahead. Read my full statement here: https://t.co/b7T5x2sfaD","Twitter Web Client","","","",FALSE,FALSE,101,27,"",NA,"jones.senate.gov/content/statem…","https://t.co/b7T5x2sfaD","https://www.jones.senate.gov/content/statement-senator-doug-jones-immigration-votes-senate-today","","","","","","","",NA,"","","en","","","","","","","","","","",NA,NA,""
"x964271447966404608","2018-02-15 22:53:23","x941080085121175552","SenDougJones","Right now on the Senate floor, I'm joining @SenAlexander to introduce a resolution commemorating the 50th anniversary of the Memphis sanitation workers' strike -- an historic event in the Civil Rights Movement.","Twitter Web Client","","","",FALSE,FALSE,65,10,"",NA,"","","","","","","","","","",NA,"x76649729","SenAlexander","en","","","","","","","","","","",NA,NA,""
"x964198562836963329","2018-02-15 18:03:45","x941080085121175552","SenDougJones","This is bipartisanship at work. Together, our Common Sense Coalition has proposed a bill that will both protect DREAMers and strengthen our borders. This group gives me hope that we can continue to work together on the many more challenges we face. https://t.co/esyGkDR7Pj","Twitter for iPhone","","","",FALSE,FALSE,120,35,"",NA,"","","","http://pbs.twimg.com/media/DWGFeo6V4AABOxL.jpg","https://t.co/esyGkDR7Pj","https://twitter.com/SenDougJones/status/964198562836963329/photo/1","photo","http://pbs.twimg.com/media/DWGFeo6V4AABOxL.jpg","https://t.co/esyGkDR7Pj","https://twitter.com/SenDougJones/status/964198562836963329/photo/1",NA,"","","en","","","","","","","","","","",NA,NA,""
"x963751334833922048","2018-02-14 12:26:38","x941080085121175552","SenDougJones","Great conversation with @rachelnpr about how we can find consensus in the Senate to protect #Dreamers and strengthen our borders https://t.co/12pfRyvZjP","Twitter for Android","","","",FALSE,FALSE,144,34,"Dreamers",NA,"","","","http://pbs.twimg.com/media/DV_uuLnWAAEPSTb.jpg","https://t.co/12pfRyvZjP","https://twitter.com/SenDougJones/status/963751334833922048/photo/1","photo","http://pbs.twimg.com/media/DV_uuLnWAAEPSTb.jpg","https://t.co/12pfRyvZjP","https://twitter.com/SenDougJones/status/963751334833922048/photo/1",NA,"x48071844","rachelnpr","en","","","","","","","","","","",NA,NA,""
"x963479598058147840","2018-02-13 18:26:51","x941080085121175552","SenDougJones","This announcement is another positive step towards restoring our natural habitats after the tremendous damage caused by the Deepwater Horizon Spill https://t.co/o6m0kCQa2F","Twitter Web Client","","","",FALSE,FALSE,104,34,"",NA,"al.com/news/index.ssf…","https://t.co/o6m0kCQa2F","http://www.al.com/news/index.ssf/2018/02/bon_secour_national_wildlife_r.html","","","","","","","",NA,"","","en","","","","","","","","","","",NA,NA,""
"x963432598516183040","2018-02-13 15:20:05","x941080085121175552","SenDougJones","History lesson of the day: More than a decade before New Orleans was founded, Mobile was celebrating the first #MardiGras. Happy #FatTuesday, everyone! #Alabama","Twitter for iPhone","","","",FALSE,FALSE,328,81,"MardiGras FatTuesday Alabama",NA,"","","","","","","","","","",NA,"","","en","","","","","https://api.twitter.com/1.1/geo/id/01fbe706f872cb32.json","Washington","Washington, DC","city","United States","US",NA,NA,"-77.119401 -76.909396 -76.909396 -77.119401 38.801826 38.801826 38.9953797 38.9953797"
"x963093069355716613","2018-02-12 16:50:55","x941080085121175552","SenDougJones","Abusers have to be held accountable and this is a moment where the White House can send that message loud and clear. I hope they step up, but as a Congress &amp; as a nation, we cannot look the other way. Today, victims have found their voices and I stand w/them to call for justice.","Twitter Web Client","","","",FALSE,FALSE,1068,330,"",NA,"","","","","","","","","","",NA,"","","en","","","","","","","","","","",NA,NA,""
"x962824107829186560","2018-02-11 23:02:10","x941080085121175552","SenDougJones","Great speaking with my friend @JeffWVTM13 today about my 1st month in office &amp; working across the aisle to pass legislation that will help Alabama. https://t.co/vneBqAQzeM","Twitter for Android","","","",FALSE,FALSE,86,17,"",NA,"","","","http://pbs.twimg.com/media/DVyja15W0AUwp_e.jpg","https://t.co/vneBqAQzeM","https://twitter.com/SenDougJones/status/962824107829186560/photo/1","photo","http://pbs.twimg.com/media/DVyja15W0AUwp_e.jpg","https://t.co/vneBqAQzeM","https://twitter.com/SenDougJones/status/962824107829186560/photo/1",NA,"x3299878853","JeffWVTM13","en","","","","","","","","","","",NA,NA,""
"x962006184025776128","2018-02-09 16:52:02","x941080085121175552","SenDougJones","Thanks for stopping by, @SpaceCampCEO! I'm not sure I'd choose freeze-dried ice cream over the real thing, but I guess that's why I'm a senator and not an astronaut. https://t.co/NqJwy3fuqe","Twitter Web Client","","","",FALSE,FALSE,146,23,"",NA,"","","","http://pbs.twimg.com/media/DVm35aVW0AE9ejJ.jpg","https://t.co/NqJwy3fuqe","https://twitter.com/SenDougJones/status/962006184025776128/photo/1","photo","http://pbs.twimg.com/media/DVm35aVW0AE9ejJ.jpg","https://t.co/NqJwy3fuqe","https://twitter.com/SenDougJones/status/962006184025776128/photo/1",NA,"x288450026","SpaceCampCEO","en","","","","","","","","","","",NA,NA,""
"x961701463083945986","2018-02-08 20:41:11","x941080085121175552","SenDougJones","Proud to introduce bipartisan legislation that will help Alabama businesses, cut bureaucratic red tape and create jobs. https://t.co/PAjuhEenOS","Twitter Web Client","","","",FALSE,FALSE,62,17,"",NA,"jones.senate.gov/content/senato…","https://t.co/PAjuhEenOS","https://www.jones.senate.gov/content/senators-jones-and-cotton-introduce-bipartisan-legislation-clarify-commercial-lending-rules","","","","","","","",NA,"","","en","","","","","","","","","","",NA,NA,""
"x961662246786125826","2018-02-08 18:05:21","x941080085121175552","SenDougJones","The House Defense funding bill would cost major employers in Alabama 100s of millions of dollars &amp; could lead to layoffs. By rejecting that bill today, and as a result of yesterday's Senate compromise, we can take action on the Senate's bipartisan bill, which is better for AL.","Twitter Web Client","","","",FALSE,FALSE,148,43,"",NA,"","","","","","","","","","",NA,"","","en","","","","","","","","","","",NA,NA,""
"x961650002786508802","2018-02-08 17:16:41","x941080085121175552","SenDougJones","Great meeting today with Chris Reynolds &amp; Stephen Ciccone from Toyota to discuss the new Huntsville plant &amp; how we can work together to continue growing Alabama’s booming automotive sector. https://t.co/63FTnEGmgk","Twitter Web Client","","","",FALSE,FALSE,89,26,"",NA,"","","","http://pbs.twimg.com/media/DVh3i4aX4AAG1NA.jpg","https://t.co/63FTnEGmgk","https://twitter.com/SenDougJones/status/961650002786508802/photo/1","photo","http://pbs.twimg.com/media/DVh3i4aX4AAG1NA.jpg","https://t.co/63FTnEGmgk","https://twitter.com/SenDougJones/status/961650002786508802/photo/1",NA,"","","en","","","","","","","","","","",NA,NA,""
